title,tags
"Switching batteries from series to parallel - technical solution","<mechanical-engineering><electrical-engineering>"
"Can the structural integrity of bridges be measured in real-time for safety?","<civil-engineering><structural-engineering><bridges><sensors>"
"Purpose of spheres and fins on submarine propeller","<mechanical-engineering><fluid-mechanics><propulsion><marine-engineering><naval-engineering>"
"Why are turbo compound engines not more widely used?","<mechanical-engineering>"
"Could house fires be prevented by increasing dryer vent speed?","<mechanical-engineering><airflow>"
"Why build a cell lattice tower with square cross-section instead of triangular cross-section?","<civil-engineering><steel><structures>"
"Control RF wave direction or path","<electrical-engineering><telecommunication>"
"About glass transition temperature in a DMA scan of an unknown material","<materials>"
"Why is kVA not the same as kW?","<electrical-engineering>"
"How does a diesel internal combustion engine start even though there are no spark plugs?","<mechanical-engineering><automotive-engineering><combustion>"
"What are the differences between linear and low-dropout (LDO) regulators?","<electrical-engineering><power-electronics>"
"Why use two tower cranes on one construction site?","<civil-engineering><construction-management>"
"Measuring motor vibrations","<electrical-engineering><motors><vibration>"
"mechanical Strength of 3D printed part","<materials><mechanical-failure><failure-analysis>"
"How much does the elasticity (Young's Modulus) of concrete and asphalt change with ambient temperature?","<structural-engineering><materials><concrete><stiffness><elastic-modulus>"
"Composite vs metal gearing","<materials><gears>"
"What happens to the voltage?","<electrical-engineering>"
"Calculating Required Motor Power for Robot","<robotics><torque>"
"Rules of thumb for sizing an air pump piston?","<mechanical-engineering><pneumatic>"
"Measurement of grinding wheel waviness","<electronic-filters><grinding>"
"Assessment of a concrete beam being strengthened by an additional steel member","<civil-engineering><steel><concrete><composite><eurocodes>"
"How to calculate saturated steam flow rates?","<thermodynamics><steam>"
"Water valve for over 120C temperature","<mechanical-engineering><electrical-engineering><valves>"
"Max horizontal momentary load of vertical steel tube","<structural-engineering>"
"What factors are needed to be taken into account when building a vending machine?","<mechanical-engineering>"
"Is it better to throw used domestic cooking oil in toilet or within the garbage?","<environmental-engineering><waste-water-treatment><waste-disposal><recycling>"
"why do we consider the external pressure when calculating the boundary work","<mechanical-engineering><thermodynamics>"
"Is the efficiency of a reciprocating air compressor constant for all allowable values of Pressure?","<compressors>"
"How would I calculate a force on a spring? Or more specifically the weight of an object that spring is supporting","<springs>"
"How to compute the mass and max speed of a ball moving on a circular track under the influence of gravity and a spring","<mechanical-engineering><dynamics>"
"Need help solving for PSIG","<mechanical-engineering>"
"Uneven split of amperage from battery","<electrical-engineering><battery>"
"How to Make an Object Able to be Screwed In/Out With a Sideways Knob","<mechanical-engineering>"
"Torsional Constant of Thin-Walled Multi-Cell Structures","<structures><aerospace-engineering>"
"How to determine heat exchanger equation?","<heat-transfer><chemical-engineering><heat-exchanger>"
"How do folding barriers work?","<mechanical-engineering><gears><linkage>"
"Does solidworks store license and user information inside files?","<solidworks>"
"Convergence problem in polymer - silicon structural analysis","<sensors><ansys-apdl>"
"Does a spillway failure have different consequences versus dam failure?","<civil-engineering><hydroelectric-dams>"
"Percent Increase vs. Factor By Which Something Increases","<heat-transfer>"
"How to simulate Ground Penetrating Radar system?","<electrical-engineering><finite-element-method><rf-electronics><electromagnetism>"
"Can Schotkky diodes rectify signals of GHz frequency?","<electrical-engineering><rf-electronics>"
"What rare earth metal is used in exhaust pipes?","<mechanical-engineering>"
"Propane rocket nozzle material","<cad><propulsion><autodesk-inventor><rocketry>"
"Does the decrease in speed of the train at the curvature changes the properties of Speed Time Curve Of Urban Service","<rail><transportation>"
"Spring-like device with anisotropic k value","<springs>"
"CNC engraving single line fonts","<cnc>"
"How much ductile can be the MAX phases?","<mechanical-engineering><materials>"
"How to calculate flow rate of viscous fluids through a funnel-shaped needle?","<fluid-mechanics><microfluidics><fluid>"
"Controlling torque required to turn a shaft","<motors><torque><mechanisms>"
"Solidworks Extrude Base/Boss - Base Extrude Doesn't Seem to Exist Anymore?","<cad><solidworks>"
"How would you find the amount of 'usable power' in a typical coal mining process","<mining-engineering>"
"meaning of ""hysterisis""in simple words?","<mechanical-engineering><electrical-engineering><experimental-physics>"
"Is stud bolts covered under ASME B18.2.1","<mechanical-engineering><piping>"
"Machinability index for ferrous and nonferrous material","<mechanical-engineering><machining><material-science>"
"differential drive vehicle in screen coords","<modeling><simulation><kinematics>"
"How to establish metric specifications for ergonomic suitability of a product?","<mechanical-engineering><product-engineering>"
"Thermal Capacitance - Convention for Modeling of Electrical Equivalent","<modeling><circuits>"
"What does ""Percent Trucks in Design Lane"" input represent?","<civil-engineering><pavement>"
"Help sizing of lug attachment flange/plate?","<mechanical-engineering><structural-engineering><civil-engineering><structural-analysis><structures>"
"Do you know any mechanism that can pass a thread through several holes?","<mechanisms><mechanical>"
"Shear force and bending moment","<mechanical-engineering><structural-engineering>"
"Struggling to find solution: question 1 (Finding the maximum length possible of a rod with specific stresses in action)","<mechanical-engineering><design><stresses>"
"Understanding Stagnation Pressure Head in non-compressible fluids","<fluid-mechanics>"
"Changing the quality of the transient process in a nonlinear system (in Mathematica)","<control-engineering><control-theory><dynamics><nonlinear-control><adaptive-control>"
"Is there a way by which one could determine the required temperature difference for stirling engine?","<mechanical-engineering><thermodynamics><heat-transfer>"
"Modern equivalent concrete strength to 'Class Ws 3/4"" '","<civil-engineering><concrete><engineering-history>"
"Where can I find technical drawings for computer parts?","<mechanical-engineering><electrical-engineering><3d-printing><drafting><computer>"
"Thermodynamics question","<thermodynamics>"
"How to Derive the Differential Form of the Contintuity Equation","<fluid-mechanics><mathematics>"
"What are the disadvantages of cylindrical residential buildings?","<structural-engineering><architecture>"
"Empirical correlation for low reynolds convective heat transfer coefficient","<thermodynamics><heat-transfer><convection>"
"Will laser cutting render my galvanized sheet metal susceptible to corrosion?","<metal-folding>"
"How to heat up a swimming pool with the sun","<thermal-conduction>"
"In P&ID, what is the difference in terms of information between pipe and signal line In the diagram?","<instrumentation><pi-diagram>"
"Drawing documentation: Is possible to keep the original drawing valid when revised version is released?","<standards><documentation>"
"Why 'battery storage power stations' use mainly liion batteries?","<power><battery><electrical-grid>"
"How much should I adjust torque specs for lubricated threads?","<automotive-engineering><torque>"
"What part is this and how do I create it in Fusion 360?","<software><computer-aided-design>"
"Identification of bolt material","<materials><product-testing>"
"Show thread feature as thread symbol in Solidworks drawing","<solidworks>"
"What does TIR stand for in Window Pane Fenestration?","<glass><solar>"
"Can the strength of a strut be determined by deflections?","<mechanical-engineering><structural-engineering><stresses>"
"What engineering topic builds upon the concepts of basic statics?","<civil-engineering><statics>"
"Fulcrum Movement","<mechanical-engineering>"
"What options are available to create a vacuum with hydraulics?","<hydraulics><vacuum>"
"How do robots maintain stability?","<mechanical-engineering><control-engineering><sensors><robotics>"
"Seals that form around a moving (linear) rectangular object","<mechanical-engineering>"
"How to create rotating, artificial dipoles?","<electrical-engineering>"
"How was the trajectory of the V2 ballistic missile (during boost phase) calculated?","<electrical-engineering>"
"Did I wire these solar panels correctly?","<electrical-engineering><photovoltaics><solar-energy>"
"Why use a 'dogbone' shape for tensile testing specimens?","<mechanical-engineering><metallurgy>"
"Why is the Poisson's ratio for isotropic 1/4 and the maximum value 1/2 (when there is no net volume change)?","<mechanical-engineering><materials><metallurgy>"
"beam cross section modeling by extrusion on proe","<mechanical-engineering><structural-engineering><modeling>"
"Why use bushings of different material than what they contact?","<materials><friction>"
"Is it possible for a bicycle chainwheel to have a fractional number of teeth?","<mechanical-engineering><gears><measurements>"
"Help with hydraulic design","<hydraulics><siphon>"
"Dynamic mass balance in plug flow reactor","<fluid-mechanics><chemical-engineering><modeling>"
"Impact of mold material in carbon fiber part finish","<materials><composite>"
"Error correcting codes in processors","<electrical-engineering>"
"Air colliding with surface, local effects?","<fluid-mechanics>"
"How would I go about designing a logic circuit that multiplies two 2-bit numbers?","<electrical-engineering>"
"How do I calculate the additional energy required to pump fluid through a restriction?","<energy>"
"irregular shape basement as part foundation for two story timber frame house","<structural-engineering>"
"Need electrostatic material to attract pet hair","<adhesive>"
"Rigid circular disc equation of motion","<mechanical-engineering><vibration>"
"How to scale a 3D object on 2 dimensions only?","<autocad>"
"How to prevent movement in this 3 DOF setup?","<mechanical-engineering><design><mechanisms><fasteners><servo>"
"Can we have plinth beam below ground level for small homes?","<civil-engineering>"
"Why do petrol engines have lower compression ratio than diesel engine?","<automotive-engineering>"
"what thickness steel sheet for a motorcycle turntable","<mechanical-engineering>"
"RC drone rotor air access","<aerodynamics><propulsion><thrust><drag>"
"Why don't propeller designers use multiple profiles?","<aerospace-engineering><aerodynamics><propulsion><airfoils>"
"Difference between direction of ramming in hydraulic press?","<structural-engineering><civil-engineering><hydraulics>"
"simulation of an attitude optimal Backstepping controller based quaternion for a UAV in MATLAB","<control-engineering><aerospace-engineering><simulation><matlab><optimal-control>"
"What steel to use? What thickness and width? What angles to use?","<steel><carbon-fiber><molding>"
"Deflection of a stack of disks under applied force/pressure","<mechanical-engineering><structural-engineering><valves><deflection><deformation>"
"High impact force sensor?","<measurements><sensors>"
"Can Fortran 90 be used with Aspen Plus, or only Fortran 77?","<chemical-engineering><simulation><process-engineering>"
"Build and visualize Pitch, Roll and Yaw from 9dof data offline","<mechanical-engineering><electrical-engineering><sensors>"
"Bending Moment Doubt","<kinematics>"
"Carbon Nanotubes as muscles?","<carbon-fiber>"
"How to resolve file space issue on CDAQ Controller with Labview Test System?","<electrical-engineering><product-testing><labview>"
"Practical rugged method for elevating water 7 feet high?","<mechanical-engineering><hydraulics>"
"Calculating force exerted on plate by link","<mechanical-engineering><statics><linkage>"
"Flap disc vs sand paper vs grinding disc","<cutting>"
"How to calculate change in pressure from LN2 state change (constant volume)","<pressure><liquid><vaporization>"
"Boron Carbide Shattering a Bullet","<materials><design><strength>"
"Thermoelectric Module Not Working Properly!","<mechanical-engineering>"
"Looking for the name of a part","<mechanical-engineering>"
"Solar Heat Gain/Outside Temperature Effects on a House","<mechanical-engineering><thermodynamics><hvac>"
"Do variables dimensions matter in PID simulation + I want the PID output to be volts?","<control-engineering><control-theory><pid-control>"
"Determining the headloss according to Darcy-Weisbach with pipes in parallel and series","<fluid-mechanics><hydraulics><pipelines>"
"Steel Worm/Steel Wheel vs Steel Worm/Bronze Wheel","<mechanical-engineering><gears><metallurgy><metals>"
"My output is much lower than I expect it to be for my transistor-zener diode voltage regulator","<simulation><power-electronics><circuits>"
"RHS column profile able to replace 3m UC 152x23 column?","<steel><columns><eurocodes>"
"Heat Transfer in A Cylinder of an Internal Combustion Engine","<mechanical-engineering><heat-transfer>"
"Working of spider gear in differential axle wheel mechanism","<automotive-engineering><power-transmission>"
"Pivoting trailer gate on multiple axes","<automotive-engineering><mechanical><safety><car>"
"Parts needed for controlling vacuum line pressure with pressurized nitrogen","<pressure><gas><vacuum><compressed-gases>"
"Can I combine two shear-stresses acting on one plane?","<mechanical-engineering><stresses>"
"I am trying to create an op amp based negative voltage regulator","<simulation><circuits><circuit-design>"
"Is stress a vector or scalar?","<mechanical-engineering><stresses>"
"When To Ignore Changes In Pressure When Computing Flow Energy For Gases?","<fluid-mechanics>"
"Pacejka ""Magic Formula"" tire models origin of the name","<automotive-engineering><simulation><friction><wheels>"
"Finding Supply/Nominal voltage for Torque Motor BLDC","<electrical-engineering><motors><electrical><electric-vehicles>"
"Trying to simulate the bending of a right angled pipe in solidworks","<pipelines><solidworks>"
"Designing a PID Controller for Satellite Control","<control-engineering><aerospace-engineering><pid-control><matlab>"
"shock absorbing rigid joint","<springs><shock>"
"When finding flow generated by a pump, where do points A and B go?","<fluid-mechanics><pumps>"
"What's the difference between pulsed lasers and frequency combs?","<electrical-engineering><optics><lasers><fiber-optics>"
"How to design and make thermal inkjet print head / nozzles","<mechanical-engineering><electrical-engineering><fluid-mechanics>"
"How does Pavement ME Design handle climatic data?","<pavement>"
"When teaching separation processes, which one should be introduced first? Distillation or absorption?","<chemical-engineering><process-engineering><mass-transfer>"
"Help with finding support reactions of a truss","<statics>"
"Buckling in Columns","<solid-mechanics>"
"Use 4 to 5-second timer to disengage/engage mechanical system","<design>"
"Why use steam instead of just hot air?","<steam>"
"How to determine ideal flow path length for specified pressure drop","<mechanical-engineering><fluid-mechanics><pressure><airflow>"
"Reaction Forces on a Beam","<statics><beam>"
"Composite beam- increase in bending moment due to reinforced steel","<beam><composite>"
"Why is there still no truly omnidirectional treadmill? (technical reasons)","<mechanical-engineering><mechanisms><mechanical>"
"Sign convention-moment","<moments>"
"How to Wire a Brushless Motor with 8 stators?","<motors>"
"How does an industrial engineer develop a process?","<process-engineering><industrial-engineering><project-management>"
"Pressure measurement problem","<fluid-mechanics>"
"Device to balance water pressure","<hydraulics>"
"How to use VBA on Aspen Hysys?","<control-engineering><chemical-engineering><dynamics><process-engineering><signal-processing>"
"How to derive deformation gradient or displacement gradient?","<mechanical-engineering><finite-element-method><numerical-methods><abaqus><mechanical>"
"How does Electric arc welding compared to gas welding?","<mechanical-engineering><welding><welds>"
"Chemical engineering calculations - basis","<chemical-engineering><chemistry>"
"What is this ""johnson controls"" device on the wall in airport?","<compressed-air>"
"Modelling Convection in Fluent","<ansys><fluent>"
"How can I calculate how much weight can lift my stepper motor?","<mechanical-engineering><electrical-engineering><structural-engineering>"
"How to integrate 7 segment display with ULN2003?","<electrical-engineering><control-engineering><communication>"
"Conveyor Truss Analysis Problem with loading","<structural-engineering><civil-engineering><structures>"
"Winding a wire heating element after a few uses","<materials><thermodynamics><heat-transfer><heating-systems><thermal-conduction>"
"Automatic translation of either-sided rotation to fixed directions?","<mechanical-engineering><gears><transmission>"
"Thermal efficiency affected by hertz (Gas turbine)","<electrical-engineering><turbines><energy-efficiency>"
"Designing of a tissue stretching device using a linear actuator","<design><biomedical-engineering>"
"Most efficient fillet design given an envelope (for stress)","<mechanical-engineering><design><stresses><finite-element-method><strength>"
"Hydrostatic force on inclined immersed surface","<fluid-mechanics>"
"Adjusting the pressure of the condenser and the evaporator","<mechanical-engineering><thermodynamics><pressure><compressors><refrigeration>"
"Nylon brittleness as function of moisture content","<mechanical-engineering><materials><chemical-engineering><chemistry>"
"Methane Gas Density in Adiabatic Compressible Flow","<fluid-mechanics><fluid><compressible-flow>"
"Cutting flattened out ""threads"" to prevent small-scale slipping","<mechanical-engineering><threads>"
"How to prevent ice build up in a refrigerator?","<refrigeration>"
"Can a hobby gearbox be used to mechanically amplify small forces for better force sensor resolution?","<mechanical-engineering><gears>"
"How to build a transparent double hollow helix at home","<plastic><molding>"
"Included angle in a semicircle","<statics>"
"Calculating the force produced by acoustic levitation","<mechanical-engineering>"
"Best types of valves for dirty services","<valves>"
"Low bandwidth electronic filter","<electrical-engineering><rf-electronics>"
"Smallest capacitor in size","<electrical-engineering>"
"Type of hinge I should use","<mechanical-engineering><applied-mechanics><mechanisms>"
"Using linear actuator in the limited space","<actuator>"
"Simple and easy Open Source CAD tools for basic 2D and 3D designs","<cad><autocad><3d-printing><computer-aided-design>"
"Heat released by gas mixtures that undergo constant pressure cooling","<mechanical-engineering><thermodynamics>"
"is it possible to achieve 1000C temperature in a cabin?","<chemical-engineering><heating-systems><chemistry>"
"Sheet Metal Bending: stuck on calculating the minimum radius required","<mechanical-engineering><manufacturing-engineering><metals><moments><yield-point>"
"Are brass and copper utensils safe for humans to eat from?","<mechanical-engineering><chemical-engineering><corrosion><chemistry>"
"Types of articulation","<mechanical-engineering><mechanisms><joining>"
"What is the hardware called that can step a lever N degrees upon manual force?","<mechanical-engineering><bearings><bolting>"
"Can adding stationary bades after an axial ducted fan increase efficiency?","<fluid-mechanics><airfoils>"
"What's the difference between critical load and yield stress, and failure in general?","<civil-engineering><materials><stresses><wood>"
"Gap between the two frequencies in FSK","<electrical-engineering><rf-electronics>"
"""Springiness"" of rolled copper sheet","<materials><solid-mechanics><material-science>"
"Determine Bolt dia from Shear stress and force","<stresses>"
"Questions on Na2Cr2O7 turning to a vapor phase in 2500F furnace. And possible ways, if any, to filter it","<mechanical-engineering>"
"How to use the Ritz method with the weak form to approximate solution of differential equation","<finite-element-method><numerical-methods>"
"Calculating the flow rate of a siphon system","<fluid-mechanics><pipelines><fluid>"
"Double Shear Stress butt joint","<structural-engineering><stresses><shear>"
"Solar Radiation Environmental Test Duration","<mechanical-engineering><environmental-engineering><product-testing>"
"How is digital image-data converted to a laser projection in laser printers?","<electrical-engineering><lasers><consumer-electronics>"
"Planes, lines and distances: looking for engineering problems","<mathematics><education>"
"Would not a telephone call (from the late 1950s) auto-disconnect if one of the parties ""closes the handle""?","<telecommunication><engineering-history>"
"HVAC Bag Filter Backwash","<airflow><hvac><air-quality>"
"Failure of wire flattening pinch rollers","<mechanical-engineering>"
"Trying to find this exact type of T Ruler?","<mechanical-engineering><tools>"
"3D Printing Models exported to DWG from STL using 3DS Max have missing surfaces","<3d-printing><autodesk-inventor>"
"Physical Significance of Max Shear Stress in a Rod in Compression","<mechanical-engineering><stresses><shear>"
"How do I create nano-scale mesh electronics in Solidworks?","<cad><solidworks>"
"Kalman Filter by Orthogonal Projection","<control-engineering><control-theory>"
"What should length of copper coil be to heat fluid from Temp A to Temp B?","<heating-systems>"
"Are there different moments of inertia for shapes and bodies?","<mechanical-engineering><moments><solid-mechanics>"
"why is there a lead (Pb) warning on extra heavy duty batteries?","<electrical-engineering>"
"Is it feasible to mount a 40kg shelf on a rotating and sliding pole?","<structural-engineering><stresses><wood>"
"Control System; Finding resonant frequency of 3rd order","<control-engineering><control-theory>"
"What are the key technical challenges to development of traveling wave reactors?","<energy><nuclear-engineering><nuclear-technology><nuclear-reprocessing>"
"Software for Soft Body Dynamics","<simulation>"
"Calculating reliability of a parallel redundant system","<systems-engineering>"
"How is it possible that an *undertaker* invented the automatic telephone exchange? And as early as in 1888?","<telecommunication><engineering-history>"
"Has a replicator ever been built?","<mechanical-engineering>"
"Screw type associated with COM port/DB-9","<computer-engineering>"
"carbon steel corrosion in chloride solution","<corrosion>"
"How to determine the deflection of a wire mesh under wind load?","<mechanical-engineering><deflection><meshing>"
"What concerns would I need to consider for building a swimming pool of gold coins?","<structures><structural-engineering><building-design>"
"Is the concept IC Engine a viable concept?","<mechanical-engineering><combustion><turbines>"
"Boundary condition for a parallelogram-shaped excavation on an embankment","<civil-engineering><structural-engineering><modeling><geotechnical-engineering>"
"What makes the material travel through Archimedes' Screw?","<fluid-mechanics>"
"Is there a theoretical bound to how tall a structure can be built?","<civil-engineering><structures>"
"How to select a low flow rate diesel flow meter","<mechanical-engineering><petroleum-engineering><equipment-selection>"
"Will a sacrificial anode protect any length of metal that it is connected to?","<materials><corrosion>"
"Dead weight pressure tester for very low positive pressures","<measurements><pressure><metrology><standards>"
"What is a good sensing element to monitor corrosion in a bridge structural health monitoring system?","<electrical-engineering><civil-engineering><bridges><sensors>"
"Why dig out and then fill in before building a large structure?","<structural-engineering><geotechnical-engineering><building-design><foundations>"
"Calculate force to lift piston from a given closing pressure","<mechanical-engineering><hydraulics>"
"How do units of mm^2/mm represent the reinforcing steel area in a slab?","<civil-engineering><structural-engineering><reinforced-concrete>"
"Sizing plate washers for through-bolting to concrete","<structural-engineering><standards><fasteners><reinforced-concrete>"
"How to select a micro controller for a low power application?","<electrical-engineering><embedded-systems>"
"How do engineers deal with sinkholes?","<geotechnical-engineering>"
"Effective length for lateral torsional buckling in a laced strut","<steel><structural-engineering><beam>"
"Mechanism of gear rotation","<mechanical-engineering><gears>"
"Rate of Cooling of a Black ""Polymer"" Handgun","<heat-transfer>"
"How to Build waterless non composting toilets?","<mechanical-engineering>"
"Is there any plastic film material stronger than Mylar?","<materials>"
"Effects of center of gravity very close to rear wheels of a car","<automotive-engineering><engines>"
"Adhesion energy vs force","<mechanical-engineering>"
"Finding downward force of lever bar","<mechanical-engineering><civil-engineering><applied-mechanics><statics><dynamics>"
"Force required to rotate an object on a plane - moment of inertia?","<mechanical-engineering><applied-mechanics><moments>"
