title,tags
"Can I use grout as mortar?","<civil-engineering>"
"Can you help me with a flow rate question?","<fluid-mechanics>"
"What type of bearing used in swivel arm?","<mechanical-engineering>"
"Is thermodynamic data of fresh water a good approximation for saline water?","<thermodynamics><water-resources>"
"Installing satellite dish to point to local zenith","<mechanical-engineering><applied-mechanics>"
"Stepper motor torque calculation based on pulleys ratio","<stepper-motor>"
"ANSYS Fluent - Using Patch to set initial conditions, should I set the pressure and velocity or only one property to generate shock waves in a pipe?","<mechanical-engineering><fluid-mechanics><ansys><cfd><fluent>"
"Measure distance between a circle and an ellipse center in autocad/inventor","<robotics><autocad><autodesk-inventor>"
"Solidworks export the 3d points of a spline","<solidworks>"
"Designing cylindrical cam","<design><kinematics>"
"Boundary conditions in a heat transfer problem","<mechanical-engineering><heat-transfer><chemical-engineering><finite-element-method>"
"What size aluminum beam and cable do I need?","<structural-engineering>"
"Structural Analysis Conundrum","<structural-engineering><statics>"
"Controlled demolition of a sky scraper?","<civil-engineering><building-physics>"
"Bode Plot Stability Criteria","<control-theory>"
"What is the Thickness of JIS Standard Pipe","<mechanical-engineering><materials><standards>"
"Achieving a ""Soft"" open mechanism","<mechanical-engineering>"
"redundant links in a mechanism","<mechanical-engineering><design><mechanisms>"
"Trouble shooting a DIY USB Feedthrough","<mechanical-engineering><electrical-engineering>"
"Heat switch material","<thermodynamics><thermal-conduction>"
"Do I need to worry about increase in temperature/pressure in ultrasound cleaner?","<mechanical-engineering><materials><thermodynamics>"
"How to convert to date axis in excel?","<civil-engineering>"
"Filtering Long-duration Signal","<electrical-engineering><signal-processing><signal><biomechanics><electronic-filters>"
"What is the importance of pitch ratio? And why is the value different for different aircrafts?","<mechanical-engineering><aircraft-design>"
"How much would a regular sized oil rig type platform cost to build?","<drilling>"
"Force limits for gear rack and pinion gear","<mechanical-engineering><gears><torque><mechanical>"
"Would a large dome structure prevent widespread effects of nuclear plant explosions?","<civil-engineering><nuclear-engineering>"
"How to increase the sensitivity range of MQ3 Alcohol sensor?","<electrical-engineering><sensors>"
"Is there a specific term for the car loops at an airport?","<civil-engineering>"
"Custom cavity for speaker system?","<acoustics>"
"How to generate a NACA 6-Series Airfoil analytically?","<aerodynamics><matlab>"
"Why adding alloy elements in a steel for increasing tempering temperature while keeping the same hardnes and ductility?","<materials><heat-treatment>"
"What controls the gain in a BJT amplifier, and why does this circuit have a gain of unity?","<electrical-engineering><circuit-design>"
"How can I *more accurately* measure the weight of a hanging bottle?","<mechanical-engineering><design><cad><mechanisms><autodesk-inventor>"
"Why to avoid low and high fluid velocities in hydraulic systems","<mechanical-engineering><hydraulics><valves>"
"How can I produce two 180-degree intermittent rotations with a Geneva drive?","<mechanical-engineering><gears>"
"Holonomic constraint forces using Lagrange multipliers","<mechanical-engineering><modeling><dynamics><robotics>"
"Fluid dynamics right angle air duct","<fluid-mechanics><aerodynamics>"
"Determining change of object over time ( diameter )","<sensors>"
"In what context is 50 threads per inch common?","<measurements><threads>"
"Why does a vehicle under crosswind need corrective steering?","<mechanical-engineering><automotive-engineering><applied-mechanics><dynamics>"
"Dry steering in cars","<automotive-engineering>"
"Where to start when studying Architectural Engineering by myself?","<structural-engineering><building-physics><architecture><construction-management>"
"What action does a 3 axis gyro stabiliser do to stabilise the drone?","<mechanical-engineering><aircraft-design>"
"Most effective heat transfer in a vertical pipe with small top/bottom temperature difference?","<heat-transfer><heat-exchanger><thermal-conduction><convection>"
"How to measure above 100K RPM?","<measurements><sensors>"
"Physical Significance","<heat-transfer>"
"Marginal Planetary Gear Set","<gears>"
"Optical methods for reaction engineering","<mechanical-engineering><design><chemical-engineering><optics>"
"Solidworks Flow Simulation the Rotation option missing","<finite-element-method><simulation><solidworks>"
"How does a single pivot side-pull caliper bicycle brake work?","<mechanical-engineering>"
"Is there a way to construct a self-centering axle?","<mechanical-engineering><applied-mechanics>"
"Could a magnetic audio tape recorder/player be made using a vibrating permanent magnet?","<magnets><audio-engineering>"
"How do I invert a system in state space form?","<control-engineering>"
"Computer ""Ports"", port scans and daemons","<computer-engineering><computer-hardware>"
"How to work out the damping or deflection curve from deflection angles?","<mathematics><vibration>"
"Multiple Varying cross section beam deflection","<structural-engineering><beam><aircraft-design>"
"What constitutes AGILITY where Behavior-Driven and Unit Testing are concerned","<industrial-engineering><tools><research>"
"What are the differences between compressor stations, pump stations, and booster stations?","<gas><pipelines><energy>"
"Bridge terminology - railing-like parapet","<bridges>"
"Difference between 'vanes' and 'blades'","<mechanical-engineering><fluid-mechanics>"
"How to calculate the swl of aluminium?","<materials>"
"Recommended compressed air source and location for separate air compression system","<mechanical-engineering><compressed-air><compressors><industrial-engineering>"
"Second Moment of Inertia (or Second Moment of Area) of Beam Section","<structural-engineering><civil-engineering><mathematics><inertia-matrix>"
"What is your best recommendation to optimize the torque/speed relationship of a motor?","<mechanical-engineering><motors>"
"Relation between airespeed and pushing force","<fluid-mechanics><fluid><air>"
"Is there any defined mathematical parameter that can give me the average distance of a volume to a point?","<design><mathematics><computer-aided-design>"
"How can I mesure the axial induction factor of a small propeller using a DC motor?","<mechanical-engineering><electrical-engineering><fluid-mechanics>"
"Can the same diaphragm pump be used to pressurize a container?","<pumps>"
"Calculate numerical directional derivative on triangular element","<mechanical-engineering>"
"I’m a civil engineering consultant, and I am analyzing different properties across US to develop long-term property maintenance plans","<civil-engineering><software>"
"Can I keep hardened steel cool with ice while welding?","<cooling><welding><heat-treatment><hss>"
"What FDA compliant plastics can have contact with alochol (wine)?","<plastic>"
"multiple wall, pressurized gas pressure vessel","<pressure>"
"Converting Creo files to STP on linux","<cad>"
"How to adjust magnification when mounting camera on microscope","<optics>"
"How would I find the Second Moment of Area of a Parallelogram?","<mechanical-engineering><structural-engineering><statics><inertia-matrix>"
"Does a Faraday cage effectively act as a notch filter?","<electrical-engineering><signal-processing>"
"Settling of unevenly loaded storage tank","<civil-engineering><soil><geotechnical-engineering>"
"How is the wattage of an incandescent light fixture determined?","<electrical-engineering>"
"Is it possible to modify a home gutter to absorb sufficient solar energy to melt ice?","<solar-energy>"
"Why do rechargeable Lithium Ion & Lithium Polymer batteries explode or catch fire?","<electrical-engineering><chemical-engineering><battery>"
"Making a mechanical device to measure the radius of the Earth","<engineering-history><education>"
"How do I calculate the forces on a desk and its legs?","<mechanical-engineering><beam><statics>"
"What made bronze the first widely used (non-ornamental) metal in human civilization?","<materials><metallurgy><engineering-history>"
"Harvesting thermoelectric energy from computer graphics cards","<mechanical-engineering><electrical-engineering><thermodynamics>"
"Did Otto Lilienthal ever experiment with non-human-powered aircraft?","<engineering-history><aerospace-engineering><aircraft-design>"
"Is active noise cancellation useful in vehicles?","<electrical-engineering><feedback-loop><audio-engineering><automotive-engineering>"
"Thermoelectric Technology to Harvest Energy from Internal Combustions Engines","<mechanical-engineering><electrical-engineering><thermodynamics>"
"How can the vendor be approved/disapproved based on validation test data?","<electrical-engineering><statistics><quality-engineering><manufacturing-engineering><product-engineering>"
"How does a traffic light sense the proximity of vehicles?","<electrical-engineering><civil-engineering><traffic-light>"
"How is the long term reactivity of implant materials evaluated?","<biomechanics><biomedical-engineering>"
"How can I measure the thickness of a sedimentation layer in a closed tank?","<civil-engineering><process-engineering><sensors>"
"What are the major differences between Engineering degrees and Engineering Technology degrees in terms of employability?","<education><licensure>"
"What are the longitudal tolerances of thread on metric nuts and bolts?","<mechanical-engineering><tolerance>"
"Tension in a rope","<mechanical-engineering>"
"Truss problem with multiple unknowns","<structural-engineering><statics>"
"Nastran RBE2 coordinate change","<mechanical-engineering><modeling><simulation>"
"What type of acturator with motor to choice for measurement with step = 0,25 μm?","<measurements><equipment-selection><actuator>"
"Quaternion in control applications","<control-theory>"
"How to cast and mold melt plastic to a shape and design you want?","<casting>"
"Can photopolymers from 3D printer be fused together like for thermo plastics?","<3d-printing>"
"Piezoelectric Pressure Gauge","<pressure>"
"Body submerged in two liquids","<fluid-mechanics>"
"What is the best way to model a beam and slab bridge?","<structural-engineering><civil-engineering><modeling><bridges>"
"Relative strength of wire mesh vs rebar for reinforcing a concrete slab","<structural-engineering><concrete><reinforced-concrete>"
"Why is the moment of forces on a rigid body in static equilibrium must be zero about any point, even if the position of that point is not on the body","<statics>"
"Pattern of zero stress in regular truss structure","<structural-engineering><finite-element-method>"
"How to add traction to a wheel?","<wheels>"
"How can I make a GPS traceable microchip?","<electrical-engineering><telecommunication><wireless-communication><communication>"
"Max. Allowable pressure in process pipe","<mechanical-engineering>"
"Latitude Angle in gravity equation","<aerospace-engineering>"
"Effort applied on the cement silo","<structural-engineering><civil-engineering><structural-analysis><prestressed-concrete>"
"How can you sync an electric motor with an IC engine?","<mechanical-engineering><electrical-engineering>"
"How does the central lock mechanism in articulated arm (magic arm) works?","<mechanical-engineering><design>"
"Finding all members using method of joints","<structural-engineering><civil-engineering><structural-analysis>"
"force transmission in kinematic chain","<torque><kinematics>"
"""Set redefined"" Error When Running a Restart Job in Abaqus 6.12-1","<finite-element-method><software>"
"Computer engineering: Physical time clock timing","<computer-engineering><computer-hardware>"
"Which equations of a state space model influence the poles and zeroes?","<control-engineering><transfer-function>"
"Why GPS receivers are more sensitive than GSM or WiFi receivers?","<electrical-engineering><wireless-communication>"
"What benefits does loopshaping have over other control design methods?","<control-engineering><control-theory>"
"Analytically determine and draw the system response to a piecewise step input for an electrical system","<electrical-engineering><control-engineering><control-theory>"
"What do these sigma subscripts represent?","<mechanical-engineering><civil-engineering><modeling>"
"Concrete formwork - best approach to counter uplift forces, for a freestanding pour?","<structural-engineering><civil-engineering><concrete><retaining-wall>"
"What is the preferred composition for modern concrete bridges?","<civil-engineering><bridges><concrete>"
"What will be the effect of torque and wheel diameter on the stability of a robot?","<design><stability>"
"Difference between AT and AMT transmissions as far driving experience is concerned","<automotive-engineering>"
"Alloys with same density as gold","<materials><alloys>"
"Estimating the time required to heat a rod by a certain $\Delta T$","<heat-transfer>"
"Is a Transatlantic tunnel technically possible today? How feasible would it be?","<civil-engineering><tunnels>"
"What are the risks and possible mitigations of installing ground anchors under spread footings?","<civil-engineering><geotechnical-engineering>"
"Thermal conductivity relationship with particle size in nanofluids","<fluid-mechanics><heat-transfer>"
"Where is the ""angle"" in the first, second, etc. angle projections?","<drafting>"
"How many blades for a steam turbine?","<turbines><steam>"
"Relationship between wind velocity, turbine rotor diameter, and power output","<energy><renewable-energy><power><wind-power>"
"Intuition vs software results","<design><computer-aided-design><aluminum>"
"Lightweight Air Compressor","<mechanical-engineering><compressors>"
"Illuminate the Earth with an artificial satellite?","<aerospace-engineering>"
"Motor for inverted rotary pendulum","<mechanical-engineering><motors>"
"Short range distance estimation systems","<electrical-engineering><sensors><distance-measurement>"
"What is micro-electromechanical systems (MEMS)?","<mechanical-engineering><applied-mechanics><power-electronics><systems-engineering>"
"Hardware behind interrupts","<electrical-engineering><embedded-systems>"
"What is the maximum degrees per step of a stepper motor for a 3D printer?","<stepper-motor><3d-printing>"
"Is this Square Track Cam valid?","<mechanical-engineering>"
"Why design a cable stayed bridge with pylons inclined towards the obstacle being spanned?","<civil-engineering><structural-engineering><bridges><reinforced-concrete>"
"Dead Load / Self Weight for ceilings & HVAC","<structural-engineering><hvac>"
"What are the disadvantages of concentrated solar thermal power?","<renewable-energy><solar-energy><electrical-grid>"
"Should I reject a concrete mix design for having too high of a compressive strength?","<civil-engineering><structural-engineering><reinforced-concrete>"
"How do the springs really work in my design?","<mechanical-engineering><design><springs>"
"Does opening a tap in a sink affect the radial speed of the water around the jet?","<fluid-mechanics>"
"What is the numerical diffusion?","<mechanical-engineering><cfd>"
"Why Ceramic Capacitors Are Not Rated Directly Like Electrolytic Ones?","<electrical-engineering>"
"Diesel Cycle Vs. Otto cycle","<mechanical-engineering><fluid-mechanics><thermodynamics>"
"Efficiency model for centrifugal pumps, using relations from Europump's Ecopump project","<mechanical-engineering><pumps><modeling><process-engineering><education>"
"Are smaller heat-pumps more efficient?","<mechanical-engineering><thermodynamics><heat-transfer>"
"How to find the wear rate of materials in the net?","<mechanical-engineering><materials><data>"
"Relation of Digital Logic Design to Electrical Power Engineering?","<electrical-engineering>"
"Airfoil meshing using ANSYS","<fluid-mechanics><aerospace-engineering><ansys><cfd><meshing>"
"Designing an RLC circuit with specific transfer function","<transfer-function>"
"What calculation to find how much force before tipping over?","<mechanical-engineering><structural-engineering><structures>"
"How the design of ship help to survive in the water","<mechanical-engineering><fluid-mechanics><marine-engineering>"
"Truss analysis of internal forces in members","<structural-engineering><structural-analysis><statics>"
"Rocket vs aeroplane? Difference in take off?","<aerospace-engineering><aerodynamics><rocketry>"
"Does a house heating system affect perceived and true indoor air humidity?","<heat-transfer><heating-systems><dehumidification>"
"solidworks mating gear with shaft problem","<mechanical-engineering><gears><solidworks>"
"SOLIDWORKS - 3D Sketch of Trombone","<mechanical-engineering><design><cad><solidworks>"
"How does indoor temperature factor in when determining ideal relative humidity in a home?","<hvac><temperature><air>"
"Design automation using fluid dynamics simulations","<fluid-mechanics><design><cad><computer-aided-design>"
"prevent shaft from moving in solidworks","<mechanical-engineering><solidworks>"
"C++ simulate physical audio output","<software><audio-engineering>"
"Would Amorphous Diamond-like Carbon coatings have a fatigue cycle limit?","<materials><fatigue><material-science>"
"Predict egg drop outcome in random container","<materials><design><structural-analysis><control-theory>"
"If a driver gear has larger radius than a driven gear, will a larger gear ratio result in more torque supplied to the driven gear?","<gears><applied-mechanics>"
"Why do custom engines typically specify a type like ""Ford"" or ""Chevy""?","<automotive-engineering><engines>"
"How to select the correct Bolt/screw Torque for sealing?","<mechanical-engineering><torque><plastic><seals>"
"Dictionary of standardized engineering terms?","<electrical-engineering>"
"Internal involute spline 1.375 - 21T","<mechanical>"
"Fluid dynamics' equivalent to current smoothing","<fluid-mechanics>"
"Trying to get a plane at a certain distance and angle","<mechanical-engineering><cad><solidworks>"
"Simple Free Body Diagram","<statics>"
"What is and how do you calculate the wind velocity design for wind turbines?","<turbines><renewable-energy><wind-power>"
"Equation driven conical spring not rebuilding properly in Solidworks 2019","<solidworks>"
"Head loss from rectangular slot orifice flowing up?","<hydraulics>"
"Attaching Gear onto Motor","<mechanical-engineering><motors><gears><power><power-transmission>"
"Door functional or not?","<applied-mechanics>"
"Designing A Freely Spinning Object","<design><motors><prototyping>"
"Can a 3018 or 1610 CNC router cut aluminum (foil)?","<cnc>"
"Maximum amps from a switching voltage regulator","<power><power-electronics><power-engineering><regulations><current>"
"Ignoring Mechanical Material Properties and Design Implications, in a Compressor, does the Thermal Density of the Blades Affect Efficiency?","<thermodynamics><compressors><engines>"
"Overextending and cutting a coil spring","<steel><modeling><springs><elastic-modulus><coil-spring>"
"How to add friction to a rope without using abrasion","<friction>"
"Sutherland's law for other gasses","<fluid-mechanics><aircraft-design>"
"Low temperature flexible polymers","<materials>"
"How to calculate the open-loop transfer function with disturbance at the input of the plant","<control-theory><transfer-function>"
"Does having a basement level increase overall earthquake resistance of a high rise building?","<structural-engineering><structural-analysis>"
"250W 24V Motors","<mechanical-engineering><motors><battery><electric-vehicles>"
"Stewart platform 6DOF parrallel manipulator static force diagram","<statics><kinematics>"
"How can I measure correctly with a ruler?","<measurements>"
"Are there tools to select the best material based on their functions?","<materials>"
"Friction versus ratcheting pawl","<mechanical-engineering><materials><gears><friction>"
"What does it mean for a machine design to be ""kinematic""?","<kinematics><machine-design>"
"Temperature controller using pt-1000 sensor","<electrical-engineering><control-engineering><control-theory>"
"Does venturi effect helps in reducing temperature of a room?","<heat-transfer><hvac>"
"Is my understanding of the roles of transistors in this circuit correct?","<electrical-engineering><circuits><circuit-design>"
"Using Density Correction Factors for Fans and Blowers","<design><pressure><pneumatic>"
"RF Engineering - Cascading a 3 Port S-Parameter Network into a 4-Port S-Parameter network","<electrical-engineering><mathematics>"
"Meaning of flow rate in water pump","<mechanical-engineering>"
"What is the difference between requirements and design specifications?","<design><specifications>"
"What is the amount of force that will cause failure?","<structural-analysis>"
"Why aircraft refrigeration uses a centrifugal compressor in place of reciprocating compressor?","<mechanical-engineering><fluid-mechanics><thermodynamics><refrigeration>"
"Drum-brake self-adjusters","<mechanical-engineering><automotive-engineering>"
"Best PID autotuning algorithm/library for simple heater problem","<pid-control>"
"On servo loops bandwidth and tracking","<control-engineering>"
"Why is the thin-walled cylinder more likely to experience failure along its axis than along its hoop/circumference?","<stresses><pressure-vessel><mechanical-failure><solid-mechanics>"
"Increase in internal energy and temperature","<mechanical-engineering><thermodynamics><heat-transfer><thermal-insulation>"
"How do I reduce the mains spike in a switched mode PSU?","<electrical-engineering><power-electronics><circuits><consumer-electronics><electronics>"
"Unable to multiply the part along the same axis as rotate in SolidWorks","<solidworks>"
"Why do I have uncertainty in my dimension in Solidworks?","<solidworks>"
"Drucker-Prager Model Parameters, a Proper Choice","<civil-engineering><structural-analysis><modeling><geotechnical-engineering><elastic-modulus>"
"Why vertical wind turbine don't be half covered","<fluid-mechanics><renewable-energy><wind-power><generator>"
"Can magnetic stripes be read wirelessly with lasers or other technologies?","<electrical-engineering><electromagnetism><magnets>"
"Stainless steel wire mesh spot welded to a frame","<mechanical-engineering><welding>"
"Does pressurization speed affect the tensile stress in the vessel wall","<structural-engineering>"
"Modeling of a Wireless Channel with known BER","<modeling><telecommunication><wireless-communication>"
"How do I calculate the reactions in this truss?","<civil-engineering>"
"How to choose type of output from a water level switch?","<electrical-engineering><circuits>"
"How are dangerous to build things studied?","<design><safety>"
"Can one move the zeros of a transfer function?","<control-engineering><control-theory><transfer-function>"
"Designing a submersible cooling system for rapid flow hot nitrogen gas","<thermodynamics><design><experimental-physics>"
"How to purify/treat air smell produced by a kitchen?","<air-quality><drain-waste-vent>"
"What are displacement field and Deformation field?","<mechanical-engineering><kinematics>"
"What are the governing equations solved in FEA for structural mechanics?","<finite-element-method>"
"Practical Application of Adiabatic processes","<thermodynamics>"
"Why is a mining cage called a Mary-Ann?","<geotechnical-engineering><environmental-engineering><mining-engineering>"
"12v relay to open and an close switch without sending power to switch","<electrical-engineering><automotive-engineering><electrical>"
"Motion of gears","<mechanical-engineering><dynamics>"
"Calculating heath exchange for custom boiler","<heat-transfer>"
"Evaluating drag and convection for a flower heat budget model","<mechanical-engineering><fluid-mechanics><heat-transfer>"
"Thin or thick wall for expanding rubber pressure cylinder","<stresses><strength><pressure-vessel><elastic-modulus>"
"How can I see the scale of a DWG file?","<cad><autocad>"
"Stick welding inner corner","<welding>"
"Why are rotary ramjets not replacing turbojets yet?","<mechanical-engineering><aviation>"
"What is the mechanism of transition in applications of finite state automata?","<electrical-engineering><computer-engineering><consumer-electronics>"
"head coefficient and volume coefficient for centrifugal pump","<chemical-engineering><pumps>"
"How to find phase proportion at equilibrium - from iron-carbon diagram - Leblond","<mechanical-engineering><materials><metallurgy><welding>"
"Flow rate and Pressure relation","<fluid-mechanics>"
"Why hydroelectricity needs to flood so much land surface if only the height difference matters (hydrostatic pressure is not affected)?","<electrical-engineering>"
"Determining thrust equations for a custom UAV","<mechanical-engineering><electrical-engineering><aerospace-engineering><aerodynamics><thrust>"
"Vibration table for tests (7-200Hz) from extruded aluminium profiles bolted together - good idea (?)","<structures><vibration><fasteners>"
"Can I oversize my air conditioner if I use a two speed compressor?","<hvac><cooling><home-improvement>"
"CNC round-over bits with thin shank","<cnc>"
"How to model a driven wheel with no slip","<mechanical-engineering><design><dynamics><mechanical>"
"How can you calculate the torque and speed of a single output gear being driven by two different input gears?","<mechanical-engineering><motors><gears><torque>"
"What is the theory behind imaging a precision pinhole?","<optics>"
"What is ""water surface elevation"" and ""headwater""?","<hydraulics>"
"How much torque is needed?","<torque>"
"What is the difference between the wave equation and the advection equation?","<convection><waves>"
