title,tags
"What will remain constant during the circulation of working substance in a refrigerating machine?","<thermodynamics><heat-transfer><compressors><refrigeration>"
"Given Pitch and Roll in one Heading, convert to co-planar pitch and roll for North","<control-theory><aerospace-engineering><positions-measurement>"
"Relationship between Material cost and Labor cost","<civil-engineering><construction-management>"
"What causes shear force?","<structural-engineering><civil-engineering><strength>"
"Maximum Tensile strength confusion","<measurements><instrumentation>"
"Linear Guidance law into X-Y axis","<modeling><matlab><acceleration><linear-motion>"
"What methods are used to extract energy from low energy heat sources?","<electrical-engineering><thermodynamics>"
"Why would 12L14 material be a ""feature"" of a work-holding flange nut?","<mechanical-engineering><materials>"
"What is the current limiter for SEPIC LED driver?","<electrical-engineering>"
"Does ground conduct heat?","<heat-transfer>"
"How did scientists develop the stencils that made even more precise processors than they had previously?","<manufacturing-engineering><computer-engineering>"
"Hazardous waste packaging","<environmental-engineering><waste-disposal>"
"Damped harmonic motion with dry friction","<dynamics>"
"Can a chain of nested thermal heat pumps be used to to gain thermal energy out of the environment?","<thermodynamics><heat-transfer><pumps><geotechnical-engineering><temperature>"
"Extended Kalman Filter formulation","<control-engineering><control-theory><optimal-control><kalman-filters>"
"Usticking two glass elements fused by vacuum","<vacuum><glass>"
"AI in protection relays","<electrical-engineering>"
"Arc welder? Cheap welding device for chainmail/chainmail jewelry","<materials><manufacturing-engineering><metallurgy><welding><strength>"
"Does the module of 2 meshing spur gears have to be the exact same value ?","<gears>"
"Is a 1:1 Worm Drive possible?","<mechanical-engineering><gears><servo>"
"Oxygen sensors in trace gas environments","<electrical-engineering><sensors><gas>"
"What does mesh topology mean?","<cfd><meshing>"
"Equations for power transmitted by a flat belt drive","<mechanical-engineering><power-transmission>"
"Difference Between minimum steel required in Slabs and Shear Walls","<structural-engineering><concrete><reinforced-concrete>"
"What is the minimum diameter necessary for 2 linear motion shafts to deflect less than 0.05mm when a 2kg weight is in the centre?","<deflection>"
"Save loose soil from erosion on a slope","<civil-engineering>"
"Debugging Ansys ACT C# Extensions","<structural-engineering><finite-element-method><ansys><ansys-workbench>"
"Can I make check valve in simple workshop?","<mechanical-engineering><fluid-mechanics><hydraulics><valves>"
"H6 tolerance shaft manufacturing","<tolerance><metrology><lathe>"
"Power torque and rotational speed of a not running yet DC motor","<electrical-engineering><motors><power-engineering>"
"Need advice: Estimating the compressive yield strength of abdominal tissues from the data of its rigidity or stiffness constant","<mechanical-engineering><strength><biomechanics>"
"Solar panel actuator control","<actuator><stability><systems-design><photovoltaics>"
"Is the PCV valve open during high engine load","<mechanical-engineering><automotive-engineering>"
"How does the superposition principle relate to Bernoulli-Euler and Timoshenko beam theory?","<mechanical-engineering><beam><modeling>"
"Is it practical to make a solar furnace for small scale metal production?","<heat-transfer><metallurgy><solar-energy><forging>"
"In what cases are the roughness values Rt and Ra used?","<mechanical-engineering><materials><measurements><surface-preparation>"
"Will this work for single output twin engine","<gears>"
"What were the technical reasons for type bar designs being more common than type wheels for manual typewriters?","<engineering-history>"
"calculating the efficiency of a microwave oven","<thermodynamics><heat-transfer><energy-efficiency><radiation><thermal-radiation>"
"Air conditioner using liquid nitrogen and a cryogenic heat exchanger","<mechanical-engineering><thermodynamics><hvac>"
"What is a definitive discrete PID controller equation?","<control-engineering><control-theory><pid-control>"
"Distance travelled at articulation point of turning vehicle","<mechanical-engineering><applied-mechanics><modeling><mathematics><distance-measurement>"
"What are the regular holes in poured concrete walls called?","<concrete>"
"How can I calculate the discharge flow rate of compressor of 1 HP?","<mechanical-engineering>"
"How much space should I leave between round bushing and the rotating parts to minimize the play?","<cnc>"
"Which design to maximize friction for a device standing on concrete?","<mechanical-engineering><friction><concrete><industrial-engineering><product-engineering>"
"Measuring wire damage using strain gauges","<mechanical-engineering><electrical-engineering><measurements>"
"How to design a transfer function for a Model Rocket?","<control-engineering><pid-control><rocketry>"
"Aluminum tube frame to support 2300 lbs water tank","<structural-engineering>"
"Need help with FEA bar analysis problem","<structural-engineering><structural-analysis><applied-mechanics><structures><finite-element-method>"
"Solving Hertz Impact ODE with Simulink","<applied-mechanics><mathematics><matlab><simulink><solid-mechanics>"
"Singularity function","<mechanical-engineering><mechanical>"
"Can a plate under bending be designed using its plastic section modulus?","<structural-engineering><steel>"
"Is such manned flight feasible?","<fluid-mechanics>"
"Eulerian description of fluid flow","<mechanical-engineering><fluid-mechanics><civil-engineering><chemical-engineering><aerospace-engineering>"
"Fluid Mechanic Buoyancy problem. How to determine the height?","<mechanical-engineering><fluid-mechanics><thermodynamics><pressure><statics>"
"Simple beam with cantilever ends","<beam>"
"Calculating the Surface Temperature of a Cable with known heat flow","<mechanical-engineering><thermodynamics><heat-transfer>"
"Vibrations analysis 7x rpm","<vibration>"
"Pulse Oximetry, does the decimal matter?","<biomedical-engineering><medical-devices>"
"why the constants of the shear and bending are zero","<statics>"
"Is it a Lever Or Not?","<mechanical-engineering>"
"What are fluids or ""goos"" called, that increase friction?","<mechanical><friction><fluid>"
"Curious of drawing a hole for M3 countersunk screw, 5.5mm or 6.5mm?","<cnc>"
"performances of a continuous flow reactor","<chemical-engineering>"
"How can I damp oscillating behaviour caused by quantization in a digital control system?","<control-engineering>"
"Name that bearing!","<bearings>"
"Shock/Isolation mounting under tension","<structural-engineering><structures><vibration><shock>"
"Minimum distance between long curtains and radiator for good air flow?","<thermodynamics><convection>"
"Angular acceleration and the moment of inertia","<mechanical-engineering><dynamics><acceleration>"
"Where is the positive terminal on the laser pointer","<battery>"
"Water & plumbing pipes vs gravity or air pressure","<fluid>"
"Why not build container ships from plastic?","<structural-engineering><structural-analysis><metals><plastic><ships>"
"One way/locking mechanism without springs or flexible members","<mechanisms><mechanical>"
"Fusion 360 animation , contact sets","<mechanical>"
"Why/how normal shear stress is zero in thin-walled beams?","<structural-analysis>"
"Find amount of sliding between 2 surfaces","<finite-element-method><abaqus>"
"equivalent deduction of Non-mechanical thermodynamic work","<thermodynamics><chemical-engineering>"
"Finite Element Code: Convergence issues","<mechanical-engineering><applied-mechanics><finite-element-method>"
"Definitions of strength?","<strength><yield-point><unit>"
"How this radio knob converting a rotation into a straight-linear motion?","<mechanisms><geometry>"
"Technical drawing for a part with complex (non-line, non-arc) geometry","<solidworks><drawings>"
"Transfer pump suitable for air, water and their mixture","<pumps><vacuum-pumps>"
"Make something that turns yet locked in place","<mechanical-engineering><solidworks>"
"Difference Latches and Flip-Flops","<electrical-engineering><computer-engineering>"
"number of total reactions in a structure","<structural-engineering>"
"On construction of a triangular interferometer like LISA","<lasers><experimental-physics><building-design>"
"Countertop Span/sag Calculations","<aluminum><deflection>"
"Generating electromagnetic signal using CPU clock","<rf-electronics><computer-hardware>"
"Definition of stiffness for structural dynamics: How would you find the stiffness of an unusual beam directly?","<civil-engineering><structural-analysis><dynamics><stiffness><frequency-response>"
"Why does a simple pin-ended triangular (arched/curved) beam deflect more due to secondary effects (non-linear analysis)?","<structural-engineering><civil-engineering><statics><deflection><stiffness>"
"Battery mAh ratings","<electrical-engineering><battery>"
"Choosing significant figures when dealing with a wide range of values","<statistics><data>"
"Water distribution - sizing weir buildings","<civil-engineering><hydraulics>"
"slope deflections method analysis of beam","<structural-engineering>"
"Are thermal (LWIR) lenses as capable as visible-wavelength optics?","<optics>"
"How to make a pulley system with a mechanical advantage of 0.5","<mechanical-engineering><experimental-physics><pulleys><building-physics>"
"How to I design a planetary gear with a gear ratio of 2:1 ( doubling the torque)","<mechanical-engineering><gears><servo>"
"Peltier Module to warm hands?","<electrical-engineering>"
"Angle of rotation in fixed end of beam","<structural-engineering>"
"How can I measure if water is flowing through a copper pipe?","<electrical-engineering>"
"How split-flap display rotates by exact angle","<mechanical-engineering><electrical-engineering><gears>"
"Units to use in this formula?","<pressure><measurements><unit>"
"Is it Possible to Automatically Transform an Image of an Object into a Line Drawing in AutoCAD?","<measurements><autocad><cad>"
"carry over factor in beam ( moment distribution )","<structural-engineering><structural-analysis>"
"Equation for Axial flow compressor blade/stator vein geometry?","<mechanical-engineering>"
"Latches - Question regarding states","<electrical-engineering><computer-engineering>"
"How does a cable-laying ship retrieve a partly-laid cable?","<marine-engineering><ships><infrastructure><fiber-optics><offshore>"
"What actuators do the me-shifter gear shifting system uses?","<automotive-engineering><gears>"
"What is the value of Nusselt number in laminar flow?","<fluid-mechanics><thermodynamics>"
"shear force in influence line of beam","<structural-engineering><structural-analysis>"
"What is the difference between a piston and a plunger compressor/pump?","<mechanical-engineering><pumps><compressors>"
"How much time is needed to cut steel?","<mechanical-engineering><machining>"
"Material Properties: Does bending reduce iron rebar's strength?","<materials><structural-engineering><reinforced-concrete><reinforcement>"
"Create a movie from STL file?","<computer-aided-design><solidworks>"
"Interpretation of shear flow/shear center of L-profile","<mechanical-engineering><stresses><structural-analysis>"
"Z-axis of Downham (Elliot) Mini Borer is jammed. How to recover?","<mechanical-engineering>"
"A counterweight with one weight inside the other","<design>"
"Actuator recommendation for oscillating motion of a 6 kg object","<motors>"
"Do Car Safety (Colision) Regulations Depend on Max Speed?","<regulations>"
"First principle derivation for torsional constant","<materials><structural-engineering><steel>"
"Why do 2 points on a mechanism not have the same angular velocities?","<kinematics>"
"How do I use FEM to derive the torsional constant of an arbitrary shape?","<modeling><finite-element-method>"
"Response of a system to a step function (Heaviside function)","<electrical-engineering><mathematics><signal><transfer-function><signal-processing>"
"How to calculate the velocity of a piston-like linkage?","<mechanical-engineering><kinematics>"
"What is the longevity of Delrin rollers on aluminum linear rail?","<mechanical-engineering><failure-analysis>"
"How to calculate the maximum spacing between Hemholtz coils?","<mechanical-engineering><electrical-engineering><magnets>"
"Waterproof Case Time Limits","<waterproofing><diffusion>"
"How to find the angle of deformation in Ansys APDL?","<mechanical-engineering><modeling><finite-element-method><ansys><structural-analysis>"
"C15 Equivalent material in IS standard","<mechanical-engineering><steel><standards>"
"What are the key differences between the X-Band and the S-Band radars?","<mechanical-engineering>"
"How to 'smooth/flatten' the surface of a disturbed liquid without contacting it?","<fluid-mechanics><magnets>"
"Can a DC voltage booster be connected directly to a DC to AC inverter?","<electrical-engineering><power-electronics>"
"What mechanism in the radar that enables the switch between transmission and reception?","<electrical-engineering><marine-engineering>"
"How do you apply fits and tolerances when designing hole and shaft?","<mechanical-engineering><machining>"
"Why do manufacturers still make aluminum kitchen utensils?","<steel><aluminum>"
"How to make a micro water dripping pump with little or no electrical input?","<pumps>"
"What is the name for a digital height measuring device?","<civil-engineering><metrology>"
"How to determine whether plastic is ABS or Polypropylene?","<plastic>"
"Will AC Motor Maintain Speed of Descending Object","<motors><current><ac>"
"How can I estimate blocking window distance in an sCMOS sensor setup?","<electrical-engineering><sensors><optics><cmos>"
"Can a Peltier's device (i.e.Thermoelectric cooler) achieve cryogenic temperature efficiently?","<mechanical-engineering><thermodynamics><heat-transfer><refrigeration><cryogenics>"
"Why HMMWV's lights aren't located at the edges?","<design><car><lighting>"
"The Cavitation Problem","<hydraulics>"
"Is there a standard formula available to calculate lateral concrete pressure from the measurements of lateral concrete strain?","<concrete>"
"How do I determine what hardness to change the bearing or the track?","<mechanical-engineering><stresses>"
"Can I submerge a pneumatic cylinder in oil?","<mechanical-engineering><pneumatic>"
"How to modify Airfoil thickness","<airfoils>"
"How to furnace-melt bismuth oxide into optical glass?","<chemical-engineering>"
"How do nuclear power plants prevent fuel rods from depleting nonuniformaly?","<nuclear-engineering>"
"I need a mechanism/method to control a shaft that can rotate at different speeds. (faster clockwise and slower anti-clockwise)","<mechanical-engineering><gears><mechanical>"
"analysis of PD controller vs static-gain","<control-engineering><control-theory><pid-control>"
"Forces on pruning shears","<statics>"
"Trim parts against parts in assembly level solidworks","<solidworks>"
"grey cast iron from freezing point to room temperature (cooling process)","<mechanical-engineering><manufacturing-engineering>"
"Is it possible to grayscale a MPO file (3D camera) for a CNC carving","<3d-printing><cnc>"
"How do I to connect aluminium profiles with 60 and 120 degree angles?","<aluminum><connections>"
"Help with linear rod drill press like design/materials","<springs><linear-motion><coil-spring>"
"How to constrain stepper motor inside case?","<mechanical><stepper-motor><actuator><linear-motion>"
"Drained and undrained shear strength of clay correlated?","<geotechnical-engineering>"
"Bendable flaps on sheet metal","<design><cad><metals><cutting><metal-folding>"
"Where can I find a list of building codes to put on a set of blueprints for a addition","<structural-engineering><civil-engineering><architecture>"
"First millennium BC Egyptian rudder systems","<fluid-mechanics>"
"Is it possible to have the load cell signal as feedback to the servo drive of the servo motor?","<motors><linear-motion><servo><linear-motors>"
"Question about flow temperature and storage temperature in a cogeneration plant","<electrical-engineering><energy><heating-systems><energy-efficiency><power-engineering>"
"how can I solve this error in c++: Exception Unhandled?","<biomedical-engineering>"
"Are ceramic materials suitable for making locking lugs for guns?","<material-science>"
"Autocad start drawing away from the Z=0 (non-coplanar)","<autocad><technical-drawing><drawings>"
"Moisture sensor for Mixers","<control-engineering><sensors><concrete>"
"(Mechanics/Electronics) Anybody know DTC code for asking Air flow measurement on OBD2?","<electronics>"
"How can I find the length of 12 gauge wire needed for a cone of if I know it's surface area","<electrical-engineering><electrical>"
"Aerodynamics - How can you solve for mass when velocity & chord are not given?","<mechanical-engineering><aerodynamics>"
"For arc-length method in nastran, how to analyse post-buckling behaviour with load decrease","<structural-engineering><structural-analysis><aerospace-engineering><buckling><nastran>"
"Deflection and stress in a freely rotating beam","<beam>"
"Raised plywood false floor for heavy equipment usages","<concrete><wood>"
"what to learn to design mechatronics device that move","<mechanical><robotics><electrical>"
"Differentiating between Two Orthographic Projections","<technical-drawing><machine-design>"
"Oil pressure inside copper tube?","<thermodynamics><heat-transfer><pressure>"
"Simple negative ion detector circuit?","<electrical-engineering>"
"Nickel Chromium Wire for high temperatures","<heating-systems>"
"Calculation of the stored energy for a heat storage tank","<thermodynamics><energy><heating-systems><power-engineering><energy-storage>"
"The best foundation type?","<structural-engineering><geotechnical-engineering>"
"Distribution of Forces into 3D Bolt Group","<structural-analysis><bolting><fasteners>"
"How to slice a 3d object with a plane?","<autocad>"
"Determine the range of τxz values for which the maximum tangential stress is less than or equal to 60 MPa","<mechanical-engineering><solid-mechanics>"
"Connect Redis which is installed on same network's different machine's VMWare's ubuntu","<networking>"
"chamfering of die ends","<manufacturing-engineering>"
"Discrete measurement - continuous observer design","<control-engineering><control-theory><pid-control>"
"The behavior of the stress-strain curve of metal, containing a void","<mechanical-engineering><stresses><metals>"
"Work calculation in a thermodynamics cycle process","<mechanical-engineering><thermodynamics><automotive-engineering><fluid>"
"Specifications of Tensile Test Specimen?","<mechanical-engineering><mechanical><experimental-physics><mechanical-failure><research>"
"why do centrifugal compressors have curved blades?","<mechanical-engineering><aerodynamics><compressors>"
"Why one big cargo ship is more efficient than 10 or 100 smaller ships?","<design><machine-design><ships>"
"transformation matrix from the original reference to the main reference","<mechanical-engineering><solid-mechanics>"
"Internal Tent Temperature","<thermodynamics><thermal-conduction><solar-energy><partial-differential-equations>"
"Statics - other methods for determining reactions of supported beam","<statics>"
"Moment of a force in 3D","<statics><torque>"
"How to use MERRA data in Pavement ME Version 2.6 for rigid design?","<pavement>"
"Mdf cutting seems to require absurdly low spindle speed for the right chip load","<cnc>"
"How to calculate miter angles for an angled stretcher","<geometry>"
"On the steam locomotives, why was the driver's cabin not located in the front of the boiler for better visibility?","<rail><transportation><steam>"
"Bending of an L-shaped beam","<mechanical-engineering><structural-engineering><structural-analysis><statics>"
"Aerospace bolts and washer combination","<aerospace-engineering><manufacturing-engineering><fasteners>"
"How to model leaning columns in opensees?","<civil-engineering><software><columns><earthquake-engineering>"
"Thermography - objects appear hotter than they are","<thermal-radiation>"
"Can you use an accelerometer to measure beam deflection under static loading?","<mechanical-engineering><applied-mechanics><beam>"
"Laser saturation and laser saturation intensity","<lasers>"
"Buckling of Parallel rods","<mechanical-engineering><structural-engineering><structural-analysis><stresses><buckling>"
"Remote point vs point mass in Ansys","<finite-element-method><ansys><ansys-workbench>"
"Determine Heating costs in $/kWh for a specific location","<heating-systems><energy>"
"Can the signal reflections from seismographic surveys be intercepted and interpreted to produce valid results","<seismic>"
"What is the pressure of water-dew resulted from cooling of atmospheric air down to dew point temperature?","<mechanical-engineering><thermodynamics><hvac>"
"How high will a flywheel catapult launch a payload?","<mechanical-engineering><applied-mechanics><mechanisms><mathematics><energy>"
"Modeling the structure vs FEM","<structural-engineering><structural-analysis><geotechnical-engineering>"
"How to interpret the phase plot from an accelerometer on vibrating machinery","<mechanical-engineering><vibration><turbomachinery>"
"Is it possible to build an efficient Electric Vehicle engine with minimal to no computing control systems?","<automotive-engineering>"
"How are the thermodynamics of CPUs and other chips handled?","<electrical-engineering><heat-transfer>"
"Tolerance Fit with Spring Dowels","<mechanical-engineering><fasteners>"
"What determines the optimal number of balls between races in a bearing?","<mechanical-engineering><bearings>"
"How to quantify martial arts strikes?","<sensors><measurements><biomechanics>"
"What is the logic behind combustion air requirements?","<mechanical-engineering><combustion>"
"Why do water mains break in the winter?","<pipelines><infrastructure>"
"How to remove heat from an IP66 enclosure?","<mechanical-engineering><electrical-engineering><heat-transfer><cooling>"
"Building a steel footbridge over a railway line and its catenary","<electrical-engineering><civil-engineering><bridges><rail>"
"Precise rotational movement and locking","<mechanical-engineering>"
"At what point does an I-beam becomes a H-beam?","<civil-engineering><steel><beam>"
"Could magnets at the RHIC be damaged like the ones at the LHC were in 2008?","<magnets><experimental-physics>"
"How many decimal places of GPS should be stored to be accurate within a few feet?","<surveying>"
"Increasing Yield Strength with Plastic Deformation","<mechanical-engineering><materials><applied-mechanics>"
"Why doesn't a lightning strike destroy the lightning rod?","<electrical-engineering>"
"What was that?! Quantifying the impact of a martial arts strike","<measurements><biomedical-engineering><terminology>"
"Which material is most efficient for the skin of a solar balloon?","<materials><aerospace-engineering><thermodynamics>"
"Could a knife blade & shaft be made of 100% diamond?","<materials>"
"How is the design life of a reinforced concrete structure calculated?","<civil-engineering><structural-engineering><concrete>"
"Modal Testing and Frequency Response Interpretation","<mechanical-engineering><dynamics><vibration><modal-analysis><frequency-response>"
"Natural gas boiler Vs. Electric Heater efficiency","<gas><energy-efficiency><heating-systems><electrical><cost-engineering>"
"AC power fluctuation microwave oven","<electrical-engineering><electrical>"
"What is the explanation why Pulse and Glide is more energy-efficient for trains","<energy-efficiency>"
"Keeping rpm stable with input of floating rpm","<mechanical-engineering><gears>"
"Confusing symbol in led labeling: How to Obtaining precision with hobby electronics?","<power-electronics>"
"Why is longitudinal slip necessary for car to be able to move?","<mechanical-engineering><automotive-engineering>"
"How to calculate and common capacity factors for gas power plants","<electrical-engineering><power-engineering>"
"Force required to open a door of volume lxbxh and weight w","<mechanical-engineering>"
"Simulink analysis of data parallel to generation","<matlab><simulink>"
"Force in a member of the loaded overhead sign truss","<mechanical-engineering>"
"Difference between maximum shear stress and absolute shear stress","<applied-mechanics>"
"drive/driven gears","<gears>"
"Isn't a pin support supposed to prevent translation both horizontally and vertically?","<statics><connections>"
"Calculate shear stress unit conversions","<measurements>"
"Filename standards and spacing","<standards>"
"building a clock with a rotating face","<mechanical-engineering>"
"How to calculate the diameter of a transmission shaft from RPM & Torque","<mechanical-engineering><materials><elastic-modulus>"
"Racking design question","<mechanical-engineering><structural-engineering><design>"
"How to estimate cooling time of pipe due to inner flow (instationary heat transfer)","<airflow><cooling>"
"Simulate Dust Layer on PV Cell?","<simulation><experimental-physics><photovoltaics>"
"What is the twisting rate to reduce capacitance load on DC power transmission line?","<electrical-engineering><power><power-engineering>"
"Plugging a 25A device (Welder) on 10A house plug","<electrical-engineering><welding><welds>"
"Antenna reception problem","<electrical-engineering>"
"Are there high torque stepper motors with rear and front mount availabe on the market","<stepper-motor>"
"Force P required to slide the door if one of the wheel becomes frozen","<civil-engineering><statics>"
"Car which can climb the ramp of higher inclination","<statics>"
"Can homogeneous temperature assumption derive no heat transfer? If yes, why?","<thermodynamics>"
