title,tags
"Advice for designing internal structure of glider wing","<mechanical-engineering><design><structural-analysis><aerospace-engineering><geometry>"
"Can a water pressure switch be used as a low-water cutoff means for a steam boiler?","<mechanical-engineering><safety><combustion><pressure-vessel><boilers>"
"Measuring flow of polyol with ultrasonic flow meter","<fluid-mechanics><ultrasound>"
"solution of system of coupled partial differential equations","<mechanical-engineering><structural-engineering><automotive-engineering>"
"Read holes schematic drawing notation. How to? Particular case","<measurements><drilling><drawings>"
"Will deodorant flamethrower ever explode?","<fire>"
"Rotary Screw Air Compressor","<pneumatic>"
"Can the hysteresis phenomenon be considered as a (type of) friction","<mechanical-engineering><friction>"
"How to measure velocity of hot gas ( temperature range: 100 - 450 ºC)?","<hvac>"
"Shaft Spline Information","<mechanical-engineering><manufacturing-engineering><computer-aided-design><documentation>"
"Can a thing resonate whilst exposed to white noise?","<dynamics><vibration>"
"Is it possible to cook with low power PV systems (under 300 W)","<photovoltaics><consumer-electronics><home-improvement>"
"Measuring Helix Angle","<gears><measurements><power><manufacturing-engineering>"
"Do gears make an electric motor bike more efficient?","<mechanical-engineering><electrical-engineering><electric-vehicles>"
"How is the energy production of solar and wind compared with the prospect of nuclear fusion?","<energy-efficiency><renewable-energy><nuclear-technology><infrastructure>"
"Looking for elegant ways to divert airflow","<mechanical-engineering><fluid-mechanics><airflow><flow-control>"
"What is the difference between a strain wave gearing and a Harmonic drive?","<gears>"
"Dynamics of Mass in Epitrochoidal Motion via Ringless Planetary Gear System","<mechanical-engineering><gears><dynamics>"
"Combining critical speeds for a shaft of variable cross-section","<mechanical-engineering><dynamics><vibration>"
"Affect of Cast in Pipes in a 1m thick Raft Slab on shear","<structural-engineering><structural-analysis><foundations>"
"Designing bulk material handling system for injection molding","<mechanical-engineering><manufacturing-engineering><plastic>"
"New electrical engineer seeking advice on electrical design for hotel!","<design><electrical>"
"What's the maximum water jet psi we can create?","<fluid-mechanics><pumps>"
"Hydraulic Arm - Handbrake","<hydraulics><pneumatic>"
"Beam stiffness matrix with sliding end release in arbitrary angle","<beam><stiffness>"
"Help finding a thixotropic suspension with specific properties","<fluid-mechanics><fluid>"
"Identifying a connected plate on a gear liquid-metering pump","<mechanical-engineering><gears><pumps>"
"How to quickly equalize pressure in a low pressure container?","<pressure><vacuum><siphon>"
"How can traffic signal controllers handle multiple conflicting preemption requests of equal priority without dropping one?","<rail><highway-engineering><traffic-intersections><traffic-light>"
"Estimating wind velocity behind a wind turbine","<airflow><turbines>"
"Thermodynamic, ideal gas problem","<thermodynamics><gas><pistons>"
"Oil refinery pipeline direct to gas stations","<pipelines><petroleum-engineering><infrastructure>"
"What's inside a peak expiratory flow meter, and what's the difference with an anemometer?","<airflow>"
"simplified acceleration and max speed calculations for a game?","<modeling><simulation>"
"Does a washer really increase static friction force?","<statics><friction>"
"Is a Home's Temperature Affected by Solar Gain Through Windows on Cloudy Days?","<thermodynamics><temperature>"
"Thermal Modeling","<mechanical-engineering><modeling>"
"How can I compute the thickness of a pole of a given material that is needed to carry a given load?","<mechanical-engineering><structural-engineering><materials>"
"Internal stress tensor associated with centrifugal/centripetal load","<stresses>"
"Measurement of pressure using inclined manometer","<fluid-mechanics>"
"Heat of Combustion, Vaporization tables","<materials><thermodynamics><combustion>"
"How do I calculate the velocity of the piston?","<mechanical-engineering><fluid-mechanics><motors><systems-engineering><power-transmission>"
"Inlet of an ICE","<engines>"
"Is it possible to create a hard slick non-stick non-degradable substance?","<mechanical-engineering><materials><ceramics>"
"Where is the resistance in my DC hub motor coming from?","<motors>"
"How to calculate the register draught/draft loss (RDL) of a burner?","<pressure><power-engineering>"
"Safely evaporate electrolyte from fragile porous substrate","<heating-systems><chemistry><heat-treatment><evaporation>"
"Unknown Water Source","<structural-engineering><civil-engineering>"
"Rayleigh damping in structural mechanics","<structural-analysis><applied-mechanics><vibration>"
"How to retrofit seed starting trays to prevent root circling","<manufacturing-engineering><environmental-engineering><prototyping>"
"Determination of solid bed fluidisation","<fluid-mechanics><chemical-engineering><compressible-flow><multiphase-flow>"
"What properties can be plotted on an Ashby diagram?","<materials>"
"How to analyse a frame of a machine?","<mechanical-engineering><structural-engineering><structural-analysis>"
"How do I solve for the mole and mass flow rates in a system?","<materials><energy>"
"Cantilever beam with disc at end (structural mechanics)","<structural-analysis><applied-mechanics><finite-element-method>"
"Maximum error in Encoder when discrete sample interval is 2 ms","<control-engineering>"
"What is this kind of sewer maintenance work?","<civil-engineering>"
"Why aren't these kind of drivers used in loudspeakers?","<mechanical-engineering><acoustics><consumer-electronics>"
"Determination of delivery pressure from pump in my Parts Washer","<fluid-mechanics><pressure><hydraulics><fluid><liquid>"
"Heat loss from the greenhouse to the soil","<thermodynamics><heat-transfer>"
"How can the Microsoft and the Facebook Fibers reach 160 Tbps between Virginia and Bilbao?","<telecommunication><data><fiber-optics>"
"2-D Plane Stress Transformations","<stresses>"
"How can I determine horizontal force reactions in a fixed on both ends beam","<mechanical-engineering><structural-engineering><civil-engineering><structural-analysis><statics>"
"How do I compute/plot the open loop transfer function of a system given its state-space description?","<control-engineering>"
"Unknown value in solution of continuity problem?","<fluid-mechanics>"
"How would I most easily create a mechanical intervalometer for a digital camera?","<mechanical>"
"Document Feathering Tolerance on Drawing","<manufacturing-engineering><machining><technical-drawing><drawings>"
"Finding the displacement in a truss using energy method Question","<civil-engineering><structural-analysis>"
"How to prevent an object doing a full rotation on a shaft","<mechanical-engineering><design><mechanical><systems-design><prototyping>"
"smallest highspeed stepper motors?","<electrical-engineering><motors><stepper-motor>"
"What's the difference between simple and deep groove ball bearing","<mechanical-engineering><bearings>"
"How to estimate the time cost of interrupting a task and picking it up again later","<modeling><manufacturing-engineering><project-management><timing><cost-estimation>"
"Beam Span for Outdoor Shelter","<beam>"
"Radio triangulation with Raspberry Pi","<positions-measurement><radio>"
"Advantage of anti-windup","<control-engineering><control-theory><pid-control><optimal-control>"
"How can I derive the KVL equation for the voltage-divider bias circuit of PNP BJT?","<electrical-engineering>"
"How would you seal a hole in an HDPE container that's in -20C environment","<materials><temperature><seals><adhesive>"
"Fluid head loss coefficient for drilled hole cross profiles","<mechanical-engineering><fluid-mechanics>"
"How to know what capacity of a compressor will suit the demand of machines in a plant?","<mechanical-engineering><fluid-mechanics>"
"How reliable is a QR code reader?","<electrical-engineering><sensors><software>"
"Why would ""quality of the gearbox"" affect torque of a machine tool?","<gears><torque>"
"Postion of overturning moment for retaining wall","<structural-engineering><geotechnical-engineering>"
"Can a blimp enter Mar's atmosphere as a glider?","<structural-engineering><materials><aerospace-engineering><experimental-physics><aircraft-design>"
"Figuring out how much torque dc motor will need to run at a certain speed. (E-skateboard project)","<mechanical-engineering><automotive-engineering><motors><torque>"
"Does a sinusoidal input voltage make a BLDC motor into a PMSM?","<electrical-engineering><control-engineering><motors>"
"Infrared thermometer unreliable","<sensors>"
"Doubt on power generation by hydraliuc turbine","<power-engineering>"
"Component-based simulation versus block-based simulation","<simulation>"
"How can I build a electronically controlled valve for a 1/4 inch tube","<valves><servo>"
"Controller design with pole placement method with given damping and settling time","<control-engineering><control-theory><stability>"
"How to characterize a system given several curves","<electrical-engineering><control-engineering>"
"Using python to send automated commands through a serial-usb-cable adapter","<electrical-engineering><control-engineering><control-theory><computer-hardware>"
"How can I find the price of a product if the manufacturer doesn't show it on their website?","<mechanical-engineering><equipment-selection>"
"Transfer function for hovercraft","<transfer-function>"
"Efficiency of off road vehicles","<applied-mechanics><dynamics><energy-efficiency><optimal-control>"
"What do Rear-End Collision Avoidance System do on Ice?","<automotive-engineering>"
"Why is ""regular"" gasoline standard instead of something more knock-resistant?","<automotive-engineering><chemical-engineering><combustion><petroleum-engineering>"
"Creating a constant internal temperature that is negligible to the external environment","<electrical-engineering><power-electronics><temperature>"
"Is a chair with N+1 wheels ever less stable than a chair with N wheels?","<wheels><stability>"
"FOC algorithm for BLDC motor and rotor position estimation via IMU","<electrical-engineering><control-engineering><motors><control-theory><pid-control>"
"stability/controllability of a finite time linear quadratic regulator","<stability>"
"Preload a worm gear?","<gears>"
"How to chose production process of copper electrical connector, Extrusion vs Die casting","<casting>"
"Physical principle behind suction of a piston","<mechanical-engineering><fluid-mechanics>"
"Which floor is likely to collapse during the earthquake?","<structural-engineering>"
"Windmills in empty fields. Why no trees?","<mechanical-engineering><fluid-mechanics><thermodynamics><heat-transfer>"
"Inertia Relief and Buckling SOL105 in Nastran","<finite-element-method><buckling><nastran>"
"How to measure resistivity of a given sheet of material?","<electrical-engineering><materials>"
"PLC / Scada education requirements.","<education>"
"How to model ball joint in Patran/Nastran?","<mechanical-engineering><modeling><simulation>"
"Can steel be replaced with aluminum alloy in reinforced concrete?","<civil-engineering><aluminum><reinforced-concrete>"
"Diesel or Gasoline? Which one is more dangerous to our health?","<automotive-engineering><chemical-engineering><gas><petroleum-engineering><diesel>"
"What is the name of my feedback procedure in control system that I am using?","<control-engineering><control-theory><pid-control><systems-engineering><feedback-loop>"
"How large of an area of the earth's surface would we need to cover in mirrors to negate global warming?","<materials><temperature><environmental-engineering>"
"Difference between PI and PD controller?","<sensors><control-theory>"
"How to obtain relative movement and rotation of bridge bearings?","<civil-engineering><structural-analysis><modeling><bridges>"
"What type of control system is this? open loop?","<control-engineering><control-theory><temperature><pid-control><feedback-loop>"
"How can I build a proximity sensor?","<electrical-engineering><sensors>"
"shear formula confusion","<structural-engineering>"
"Biological process in wastewater treatment","<waste-water-treatment><waste-disposal>"
"Difference between Linkage, Kinematic chain, Mechanism, Mechanical element, Mechanical machine and their precise definitions","<mechanical-engineering><terminology><mechanisms><linkage>"
"shear flow in hollow beam","<structural-engineering>"
"Calculation for cantilever retaining wall, with small/no heel","<structural-engineering><retaining-wall>"
"What is the theoretical grain size in a ideal phase diagram of a metal?","<steel><metallurgy>"
"How to simulate car acceleration","<mechanical-engineering><automotive-engineering><gears><modeling>"
"direction of shear stress","<structural-engineering>"
"Plastic Injection Moulding a Piece with Undercuts","<manufacturing-engineering><plastic>"
"Are these right angle projections correct?","<mechanical-engineering>"
"How to model a sheet metal nut in SolidWorks?","<modeling><solidworks>"
"What is the difference between pressure and stress?","<pressure><stresses>"
"Below what Froude number can I neglect wave-making resistance on a vessel?","<drag><marine-engineering>"
"When is DC power generation superior over AC power generation?","<electrical-engineering><power-electronics>"
"Easy nonlinear model for large deformation of a beam","<mechanical-engineering><beam><applied-mechanics>"
"How to determine reinforcement design strip widths and locations","<concrete><reinforcement>"
"In the context of a known disturbance $d(t)$ in a control loop, what is the $\Delta t$ at which the control loop has to be executed?","<process-engineering><control-engineering>"
"Why do hydraulic systems use special fluid - what's wrong with water?","<mechanical-engineering><hydraulics>"
"Can you use the Hagen-Poiseuille equation for a pipe which radius is in the sub-millimeter region?","<fluid-mechanics><microfluidics>"
"How to equalise the water distribution in a leaky pipe irrigation system?","<civil-engineering><pressure>"
"What are the benefits of a diaphragm pump vs a simplex pump?","<mechanical-engineering><civil-engineering><pumps>"
"How to know whether the flow is supersonic in a nozzle?","<fluid-mechanics><gas><pipelines><measurements>"
"Determining pressures of a compressible gas","<fluid-mechanics><gas>"
"Would it make sense to have a 12V lighting circuit in a house?","<electrical-engineering><energy-efficiency>"
"Does gravity have any effect on metal casting?","<mechanical-engineering><aerospace-engineering><casting><production-technology>"
"Weight percentage and grams per liter","<measurements>"
"Rule of thumb for choosing a best sampling rate","<control-engineering>"
"Do pressurised cans still pose a risk to bursting in normal conditions, but after being exposed to heat?","<pressure><chemical-engineering><gas><safety><compressed-gases>"
"Cross-Sectional Dimension of a Spring","<mechanical-engineering>"
"Low voltage power transmission","<electrical>"
"Effect of bypass valve on flow rate and pressure","<fluid-mechanics><thermodynamics>"
"Boring through joist","<structural-engineering><structures>"
"I have the yaw rate, rear wheel speeds, and the radius of tires, how to find x and y speeds?","<mechanical-engineering><control-engineering><kinematics>"
"Calculating the Thickness of a Glass Tube which contains a Vacuum","<pressure><stresses><vacuum>"
"How to choose a best sampling rate, according to time constant or bandwidth?","<control-engineering>"
"Placement of supporting boiler in heating circuit","<heat-transfer><heating-systems><energy-storage><boilers>"
"Time constant of second order system","<control-theory>"
"Seeking transparent, somewhat flexible material","<materials>"
"What is the exact concept of bearings?","<mechanical-engineering><bearings><friction>"
"How to determine minimal wall thickness for a rectangular pressure vessel?","<pressure-vessel>"
"What are these ""water fountains"" in the middle of a river in North Korea? (Probably also found elsewhere.)","<structural-engineering><civil-engineering><water-resources>"
"how to implement an encoder in matlab","<telecommunication><matlab><communication><digital-communication>"
"Thermodynamics equality question","<thermodynamics>"
"what does 0.1% FS +/- 0.02 mean?","<measurements>"
"Is a Geodesic Dome (fuller dome) that floats possible? What material or engineering effort would it take?","<mechanical-engineering><structural-engineering><civil-engineering><applied-mechanics>"
"PWM -electronic solenoid valve","<electrical-engineering>"
"Precipitation Hardening","<mechanical-engineering><materials><metallurgy><material-science>"
"Stability with eigenvalues' real part equal to zero","<control-theory><stability><eigenvalue-analysis>"
"Etymology of the term ""journal bearing""","<mechanical-engineering><motors><bearings>"
"Control effort in mixed sensitivity design","<electrical-engineering><control-engineering><control-theory>"
"How do I build a water Ram Pump that will pump 400 feet and 30 feet vertically","<mechanical-engineering><fluid-mechanics><pumps><water-resources>"
"Sizing the air duct that comes after a fan","<fluid-mechanics><airflow>"
"What lining design holds better for a tunnel? Spiral lining or cylindrical lining?","<structural-engineering><structural-analysis><structures><tunnels>"
"How to do a pressure drop or saltation velocity calculation on pneumatically conveyed solids in slug flow?","<chemical-engineering><piping>"
"How to design a rotating base?","<bearings>"
"How to integrate ∫vᵢ(uᵢ² + vᵢ²)dA in calculating monosymmetry index of an angle?","<civil-engineering><structural-analysis><mathematics><cross-section>"
"convert foot pounds of torque on a nut to sideways tons of press","<mechanical-engineering>"
"Proper way to power/use a vacuum cylinder?","<vacuum><pneumatic><vacuum-pumps>"
"How do markers, blocks, and parts work in MSC Adams?","<simulation><cad><software>"
"Most efficient airflow pattern to cool a recessed shelf","<airflow><cooling>"
"Why only the spectrum range of radio waves can be reflected from atmospheric layers while higher ranges (Infrared-Visible Light-Ultraviolet) can't?","<telecommunication><wireless-communication>"
"Elastic bands vs Spring Steel?","<materials><steel><elastic-modulus>"
"How to compute the performance of a refrigerant?","<refrigeration>"
"Reinforcing beam and slab with correct steel bar structure","<structural-engineering><beam><reinforced-concrete>"
"Is torque produced at the crank of an engine lower than at the wheels?","<torque><power><engines>"
"Equivalent Force: Hydraulic rams in H frame machine press","<mechanical-engineering><pressure><statics>"
"Is it likely that a 3d printer will ever be able to print a copy of itself?","<3d-printing>"
"Why is it generally assumed that the evaporator works isothermally?","<evaporation>"
"How to use failure criteria in isotropic material (NASTRAN)","<modeling><finite-element-method><failure-analysis><nastran>"
"RTC interface with PIC16F877A","<embedded-systems><microelectronics>"
"Feedback control of two-link planar manipulator","<control-engineering><control-theory><dynamics><kinematics>"
"How to determine the damping coefficient?","<mechanical-engineering><vibration>"
"When backup cooling fails in reactors without passive safety, what is the risk of radioactive contamination?","<safety><nuclear-technology><nuclear-engineering>"
"How do tire-balancing beads work?","<mechanical-engineering><fluid-mechanics>"
"Finding Neutral Axis of a simple shape undergoing axial load","<mechanical-engineering><structural-engineering><structures><applied-mechanics>"
"UV resistance of UV cured photopolymers","<materials>"
"Why do we even use engineering stress?","<materials><structural-engineering><stresses>"
"thermal resistance and thermal time constant with ambient temperature","<thermodynamics><heat-transfer><temperature><thermal-insulation>"
"What is the power and max flow rate required to rotate a 300 W wind turbine?","<fluid-mechanics><airflow><renewable-energy><wind-power><wind-tunnels>"
"Can a magnetic lock be negated or overcome by a stronger electromagnet?","<mechanical-engineering><electrical-engineering><magnets>"
"Piping construction, flanged connection - Difference between Collar and Flat collar","<mechanical-engineering><piping>"
"How does the DERIVATIVE term slow down the signal?","<control-engineering><control-theory>"
"How to determing convergence in a CFD model","<mechanical-engineering><fluid-mechanics><cfd>"
"What optics and display are used in Microsoft HoloLens?","<design><optics><computer-engineering>"
"Monitoring water flow from a pump","<pumps><water-resources>"
"Calculating stresses of section with varying depth","<mechanical-engineering><structural-engineering><structures><stresses>"
"Impact force with unknown deformations or time duration?","<stresses><applied-mechanics><dynamics><deformation>"
"What is the difference between an automatic transmission and an automated manual transmission?","<mechanical-engineering><automotive-engineering><power-engineering>"
"How is the shift map of an automatic transmission constructed?","<mechanical-engineering><automotive-engineering><power-engineering>"
"Calculating a transfer function from a block diagram","<control-engineering><control-theory>"
"Determining Gain from a root locus plot","<control-engineering>"
"How to calculate torque needed to stop a rotating beam over x seconds","<torque>"
"Conversion of Piezoelectric coefficients","<electrical-engineering>"
"What is the mechanism of the blades movement","<mechanical-engineering><mechanisms>"
"How to put the green diamond back in it's original position in AutoCAD 2018","<cad><autocad>"
"Using a Copper Waterblock or Aluminum Heatsink to Cool Water via Thermo Electric Cooler","<thermodynamics><heat-transfer>"
"Does this exist - 'screwdriver gun' with cartridge to automatically load new screws?","<mechanical-engineering>"
"How to Pull Heat Quicker from a Thermo-Electric Cooler using an Aluminum Heatsink","<heat-transfer>"
"Efficiency and NOx emission of lean burn gas engines","<automotive-engineering><energy-efficiency><biogas>"
"Curved Slider Mechanism With Two Different Radii","<mechanical-engineering><mechanisms><cad>"
"Why does removal of ventilation of a sewage pipe lead to backflow from the toilet?","<fluid-mechanics><piping><drain-waste-vent>"
"Young's modulus for composite auxetic material","<materials><elastic-modulus><composite>"
"What are the conditions for a signal to be an energy signal and a power signal?","<electrical-engineering><power><energy><signal-processing><homework>"
"Why are there multiple ways to save polygonized 3D model data?","<cad>"
"What determines the cost of the wind turbines?","<turbines><wind-power><cost-engineering><cost-estimation>"
"How to calculate the max torque due to angular momentum of a beam given motor specs","<dynamics>"
"Purpose of special railway transport wagons?","<transportation>"
"Origin of barricade tape color combinations (allegedly OSHA)","<safety><standards><regulations>"
"Negative gain in Ziegler-Nicholas Oscillation Method?","<electrical-engineering><control-engineering><pid-control>"
"Orthogonal Channels in a RAKE receiver?","<electrical-engineering><wireless-communication>"
"How to find required clamping force of bolts to prevent flange faces from twising due to torque?","<torque><friction>"
"How to provide lateral support for adjacent masonry during installation of steel UC in an old cavity wall?","<structural-engineering><civil-engineering><structures><strength><reinforcement>"
"Force to compress flexible elastic tubing","<compressors><elastic-modulus>"
"Calculate or approximate force required to expand a thin-walled elastic cylinder held rigidly at both ends?","<pressure><elastic-modulus>"
"Should I run 2-wheeler at constant speed?","<mechanical-engineering><energy-efficiency>"
"A sealed ball is not connected to anything externally, but can have any complex mechanism inside. Can the mass change?","<applied-mechanics>"
"Production technology for hexagonal shaft ?","<product-engineering><forging>"
"How to create intersected conical copper coils?","<metallurgy><metals>"
"twisting at shear center / centroid","<structural-engineering>"
"How to calculate deflection of a cantilever beam subject to point loading","<structural-engineering><beam><deflection>"
"ANSYS Mechanical Contact behavior","<mechanical-engineering><ansys>"
"Anomalous oxygen in aluminium sample SEM EDS","<materials><measurements>"
"If I made a incandescent light bulb filament smaller what would happen?","<power-engineering>"
"slope and deflection of beam engineering","<structural-engineering>"
"Wingspan formula for an Ornithopter","<aerospace-engineering><airflow><aircraft-design><airfoils>"
"slope of deflection of beam at center","<structural-engineering>"
"How does a flexible endoscope turn?","<mechanical-engineering><biomedical-engineering><mechanisms><medical-devices>"
"how does thickness affect the maximum crushing strength and modulus of rupture of wood?","<wood><elastic-modulus><crushing>"
"yield stress vs critical load stress","<structural-engineering>"
"How to implement wifi for a headless IOT device?","<iot>"
"How to get remove water from a submarine that is submerged","<fluid-mechanics><pressure>"
"How should I draw the semi cylinder in the sketch?","<mechanical-engineering>"
"Why can’t one see for 2nd order system that it is at its stability limit neither in the Nyquist plot nor Bode plot?","<control-engineering><control-theory>"
"Difference between a ""Pulley"" and a ""Wheel and axle""","<mechanical-engineering><wheels><pulleys><mechanisms>"
