title,tags
"One word to describe ""On the left"" or ""On the right"" like in Above and Below","<adjective-position>"
"Is there an idiom or saying for an act that on the surface appears extending the olive branch but in reality it means to abscond responsibility","<meaning-in-context><idioms><idiom-meaning>"
"Present Perfect vs. Past.... help","<past-tense><present-perfect>"
"What does ""party-speak"" mean in this sentence?","<meaning-in-context>"
"Word meaning to repeat what another person is saying as a form of mockery?","<single-word-requests>"
"Is it okay to say 'margin of survival'?","<expressions><meaning-in-context><terminology><usage><technical>"
"Difference between 'Candor' and 'Sincerity'","<meaning><word-choice><synonyms>"
"Why not to say ""a saggy mustache"" rather than ""a droopy mustache""?","<differences>"
"What is the best word to use in place of ""unique, but due to your setup"", without attributing blame?","<single-word-requests>"
"A word like sporadic but meaning 'most of the time'","<single-word-requests><synonyms>"
"Standing idle while a couple is cuddling or kissing","<expressions>"
"Word for a message that most people find plain but a smaller group see as supportive","<single-word-requests>"
"What defines a ""nuanced"" thesis or conclusion?","<meaning>"
"What are some idioms that refer to taking advantage of an opportunity to the fullest?","<idioms>"
"""too big a"" vs ""a too big""","<word-order><syntactic-analysis><big-mess-construction>"
"How to friendly propose a customer to pay a small sum?","<sentence><formality><colloquialisms><speech>"
"Is there a word which denotes expertise in framing search-engine queries?","<single-word-requests>"
"Is there a name for ""the string of characters typed randomly on a keyboard home row""?","<single-word-requests><phrase-requests><slang>"
"CET vs Europe/Oslo timezone naming","<terminology>"
"A word meaning ‘enacted as law, but not yet implemented as social practise’","<single-word-requests><research>"
"""Subterranean"", but for planets/surfaces other than Earth","<single-word-requests><adjectives>"
"When should I add ""to"" before an infinitive in a parallelism sentence?","<infinitives><parallelism><particles>"
"Position of a relative clause","<differences><syntactic-analysis><word-order><relative-clauses>"
"Is there any vs. Are there any","<grammar>"
"Generic, catch-all term for ""power user""?","<single-word-requests><synonyms>"
"Interpretation of ""what is the probability of having offspring that are male with blue eyes""?","<meaning>"
"Artist Terminology for Paper, Canvas, etc","<single-word-requests>"
"Meaning of ""To lick a knack""","<phrase-meaning>"
"Definition of ""significata""?","<meaning>"
"A spectacled person pulled on a rounded neck t-shirt and got stuck. Is there a word for that situation?","<single-word-requests>"
"which verb means ""to give someone advantage in a competition""","<verbs>"
"Mixing hyphenated prefixes with cased hyphenated compound modifiers","<hyphenation><compound-adjectives>"
"Is there a word for hangover thirst?","<single-word-requests><slang>"
"Semantically meaningless words","<semantics><linguistics>"
"What is the etymology of the shift dress?","<etymology>"
"the most problematic or loud person gets the most attention and quiet person is ignored","<idiom-requests>"
"Single word for agile, stealth, and light fingered","<single-word-requests>"
"How is the word ""saw"" pronounced in the US, specifically, New York?","<pronunciation><phonetics>"
"Is this a correct usage of ""which""?","<grammaticality><determiners>"
"""Their body"" vs ""Their bodies"" when referring to people of similar type","<grammar>"
"Cast Away in Past Tense?","<grammar><past-tense>"
"Origin of ""No, a thousand times no""","<etymology><indian-english>"
"What's the difference between hard-boiled fiction and crime fiction?","<terminology>"
"When can a celebrity be referred to by their surname only?","<usage>"
"What would you call this angle?","<single-word-requests>"
"When did men start to lose their ""virginity""?","<meaning><etymology><historical-change>"
"What's another word for street-smart?","<single-word-requests><synonyms>"
"""Sorry about that"" - Usage","<usage><phrase-meaning><idiom-meaning>"
"Grammatical structure of the given sentence","<grammar><syntactic-analysis><present-participles>"
"Is the sentence ""What is the biggest car Joe can buy?"" correct?","<grammaticality>"
"He insisted he saw the accident vs he insisted he had seen the accident","<meaning>"
"What's the difference between ""right now"" and ""currently""?","<differences>"
"Is it correct to say ""speaking off-topic""?","<meaning><phrase-meaning>"
"A word for an individual who feels that compliments that he receives are always backhanded","<meaning><single-word-requests>"
"What does “Fabs days hair” means?","<meaning>"
"Single-word term for ""Number of employees""","<single-word-requests><vocabulary>"
"Pronoun in English without specific referent","<pronouns><writing-style><writing>"
"Need help with understanding","<meaning>"
"What is the meaning of ground truth?","<american-english><british-english>"
"Should ""the"" be used in this sentence?","<grammatical-number><definite-articles>"
"'serve the best interest of' or 'serve the best interests of'?","<grammatical-number>"
"Word for the text ready to be copied?","<single-word-requests><nouns>"
"Usage of ""taken"" regarding the time a picture was taken","<word-order><software>"
"""In your session"" or ""during your session""","<sentence><sentence-patterns>"
"Is there a male counterpart to being a virgin?","<single-word-requests><synonyms>"
"Why is the past tense of text, as used by some people, pronounced ""text-ted"" and not just ""tested""?","<grammar><american-english><pronunciation><dialects>"
"Is it OK to say something is ""buried"" in a webpage?","<word-usage><verbs>"
"Origin of fag (meaning a cigarette in British English)","<etymology><british-english>"
"Omitting ""is"" in sentences (when occurring after ""that"", ""this"", and ""it"")","<omissibility>"
"""If I were to go"" vs ""If I had gone""","<subjunctive-mood>"
"Neesh or Nitch?","<pronunciation>"
"""Ethics"" versus ""morals""","<word-choice>"
"Can one be *highly* ambivalent?","<word-choice><grammaticality><modifiers><writing-style>"
"When ending a list with ""etc."", should there be a comma before ""etc.""?","<punctuation><commas>"
"Each apple and each orange [has/have]?","<grammatical-number><conjunctions><verb-agreement><determiners><coordinating-conjunctions>"
"Proper Usage of gerund form of the verb","<verbs><gerunds>"
"How can I learn to get collocations right?","<idioms><adverbs><phrasal-verbs><collocation>"
"What are your favorite English language tools?","<resources>"
"Using 'stuck' as a verb","<verbs><parts-of-speech>"
"What is the first recorded appearance of the mistranslation ""Red Square""?","<etymology><history><mistranslation><proper-nouns><toponyms>"
"""just because… doesn't mean…""","<literature><formality><construction>"
"""Do it"" versus ""do that""","<word-choice><pronouns><deixis>"
"Do plaza and square have a different meaning?","<word-choice>"
"What is the origin of the word ""goodbye""?","<etymology>"
"What is the longest word you can come up with that the letters are all in alphabetical order?","<orthography>"
"Should the words ""city""/""state""/""province"" be capitalized (if not followed by the name of the city)?","<nouns><orthography><capitalization>"
"""Fill out a form"" or ""fill in a form""","<word-choice><prepositions><phrasal-verbs><collocation><transatlantic-differences>"
"What's the correct usage of ""hopefully""?","<grammaticality><adverbs><disjuncts>"
"Bourbon whiskey, Bourbon monarchy: is there a connection?","<etymology>"
"Is Valley Girl speak ""like"", entering the language?","<colloquialisms><language-evolution><filler-words>"
"Why do you say ""friend of mine"" instead of ""friend of me""?","<grammar><double-possessive>"
"What mnemonics help solve common linguistic issues?","<grammar><orthography>"
"Did eBay take the name from a Pig Latin word?","<etymology><proper-nouns>"
"Is ""forte"" pronounced ""fort"" or ""for-tay""?","<pronunciation>"
"Which is more correct: ""Plug-in"" or ""plugin""?","<word-choice><hyphenation>"
"Changing subject and verb positions in statements and questions","<grammar><word-order><questions><subject-verb-inversion>"
"How should I punctuate around quotes where the punctuation required by the quote interferes with the punctuation of the sentence?","<punctuation><commas><quotes><question-mark><quotation-marks>"
"What does ""about now"" mean?","<meaning-in-context>"
"What is the origin of ""holy smoke""?","<etymology><phrases><expressions><minced-oaths>"
"Is it ""Chinese simplified"", or ""simplified Chinese""?","<word-choice><word-order>"
"Why are not ""infamous"" and ""inflammable"" the opposite of ""famous"" and ""flammable""?","<etymology><adjectives><synonyms><antonyms><prefixes>"
"Using ""the"" before ordinal numbers","<numbers><articles><definite-articles>"
"Redundancy in American Usage","<american-english>"
"""Who turned off the lights?""","<word-order>"
"Why is it ""masterpiece"" and not ""a piece of art""?","<word-choice>"
"What is the origin of ""xox""?","<etymology>"
"Is there an accepted rule for naming all of our various distant relatives (kinship terms)?","<kinship-terms>"
"What is the difference between ""proven"" and ""proved""?","<verbs><differences><adjectives><past-participles>"
"When is it appropriate to use the original pronunciation of a foreign word versus the English pronunciation?","<pronunciation><dialects><pronunciation-vs-spelling>"
"Is the proper spelling “judgment” or “judgement”?","<american-english><british-english><orthography><transatlantic-differences><silent-letters>"
"Is there a difference between ""cheers"" and ""thanks"" in colloquial British English?","<british-english><colloquialisms>"
"""e.g."" versus ""i.e.""","<word-choice><abbreviations>"
"Is the phrase ""please kindly"" redundant?","<email><redundancy>"
"Does ""will you stop here, please"" express a command or exhortation?","<meaning>"
"""Visualized"" equivalent adjective for audio","<single-word-requests><analogy><sense-verbs>"
"What does ""educated"" mean in ""educated guess""?","<meaning>"
"""Such requests"" versus ""those requests""","<word-choice>"
"What does ""catch the sun"" mean?","<meaning><phrases>"
"What does the expression ""body shop"" mean?","<meaning><idioms><vocabulary>"
"What does ""keen"" in ""keen intellect"" mean?","<meaning>"
"Why is New York City also called ""the Big Apple""?","<etymology><nouns><adjectives><proper-nouns><nicknames>"
"Alternatives to ""and/or""?","<word-choice><synonyms><conjunctions><formality><and-or>"
"How to add emphasis to a modal verb?","<writing-style><modal-verbs><emphasis>"
"""To call"" vs. ""to ring""","<meaning><differences><verbs><telephone>"
"Interjection for a longing sigh","<single-word-requests><interjections>"
"Does the sentence ""What the fox say?"" mean anything?","<meaning>"
"A name for hat collectors?","<single-word-requests><nouns><analogy><winterfest>"
"Word designating something as being representative of a whole","<single-word-requests>"
"Is English particularly well suited for so-called ""natural language programming""?","<expressions><programming><logic>"
"Why are so many English expressions derived from baseball terminology?","<idioms><american-english>"
"Word for being disgusted by but unable to stop looking at something","<single-word-requests>"
"How widespread are snow goblins?","<dialects><christmas>"
"Correct capitalization for domain specific phrase?","<capitalization>"
"""Let's get it over (with)"" — do I need the ""with""?","<phrases><idioms><prepositions><syntactic-analysis>"
"Quoting: original vs different source?","<quotes><quotations>"
"Was the verb ""bring"" once used as a noun?","<etymology><verbs><nouns><word-usage><capitalization>"
"Capitalization: ""Our Planet""","<capitalization>"
"Is Missouri called /mi.'zuɹ.ə/ outside of Missouri?","<pronunciation><dialects><pronunciation-vs-spelling>"
"Why does ""forgetive"" mean ""creative"", not ""easy to forget things""?","<meaning><adjectives>"
"Are these how's meaning 'how well'?","<conjunctions><exclamations>"
"Looking for the inverse of ""frictional""","<single-word-requests><word-usage><adjectives>"
"Where does the word “snogging” come from?","<etymology><british-english><indian-english><commonweath-english><origin-unknown>"
"Where does the word “wankers” come from?","<etymology><slang><offensive-language><commonweath-english>"
"Where did the word “quim” come from?","<etymology><british-english><slang><offensive-language>"
"Where does the word “minge” come from?","<etymology><british-english><slang><offensive-language>"
"Where does the word “spliff” come from?","<etymology><slang><commonweath-english><caribbean-english>"
"Correspond to vs. Correspond with","<grammar><usage><synonyms>"
"Where does the word “jism” come from?","<etymology><slang><offensive-language>"
"Where do ""shenanigans"" come from?","<etymology><american-english><slang><origin-unknown>"
"Prepositions for use with engagement","<grammar>"
"What is the difference between ""responsibility"" and ""obligation""?","<meaning><nouns><word-usage>"
"What word or phrase describes the quality of an assertion to be inbetween a fact and an opinion?","<meaning><word-choice><single-word-requests><nouns><diction>"
"Suffixes in ""grandiose"" and ""grandeur""","<suffixes>"
"the late so and so","<phrases>"
"What are the differences between ""go to school happily"", ""go happily to school"" and ""happily go to school""?","<adverbs><word-order>"
"What's the word in English for something that increases/decreases?","<word-choice><single-word-requests><expression-choice>"
"[pronoun]'ve for possessives","<possessives><perfect-aspect>"
"""Went to school happily"" vs. ""happily went to school"" vs. ""went happily to school""","<adverbs><word-order><semantics>"
"I was wondering whether it is acceptable to put the adverb “rudely” in the following three places in this sentence","<adverbs>"
"""For/during/on/in the first two nights""","<word-choice><prepositions><in-on>"
"""Is missing"" vs. ""is missed""","<word-choice><adjectives><past-participles><present-participles>"
"What is a term for someone who is bad at communicating with other people?","<single-word-requests><pejorative-language>"
"Can ""I write of love"" be used as a substitute for ""I write about love""?","<expressions><meaning-in-context>"
"How can this sentence be correct?","<nouns><syntactic-analysis><sentence-patterns><repetition>"
"""Season's greetings"" or ""Seasoned greetings""","<idioms><greetings><christmas><eggcorn><catachresis>"
"What goes first: Sometimes, I bring X (1)'with me' (2)'to Y'?","<word-order>"
"Is this a predicative adjunct?","<complements><adjuncts>"
"What do you call a person who refuses the love of another?","<single-word-requests><neologisms>"
"What is the difference between 'To study English is not easy' and 'Studying English is not easy'?","<sentence><nuance>"
"""Will"" vs ""is going to"" for predictions, what is considered an evidence?","<future><will-be-going><will-future>"
"How to pronounce the ""dr"" sound in the middle of words","<american-english><pronunciation>"
"indirect speech","<indirect-speech>"
"""IS"" or 'ARE' ? in this sentence","<grammar>"
"Is there any such thing as noun pronoun proximity?","<pronouns><personal-pronouns><agreement><pronominal-agreement>"
"Try to + inf or Try + v + ing?","<differences>"
"What is a name for statistical indicators such as GDP annual rate, unemployment rate?","<hypernyms><lexicon>"
"Capitalising Names of Industries","<word-choice>"
"Do negatives work algebraically?","<grammaticality>"
"Distinction between First Nations, Metis, and Inuit peoples, and the reason for it","<differences>"
"Usual combinations of nouns/verbs and prepositions","<prepositions><nouns><resources><online-resources>"
"Idiom for the phrase ""getting a good result from a bad situation or with a bad condition""?","<idioms>"
"Clause structure","<clauses>"
"What does it mean when someone says: ""King me""?","<phrase-meaning>"
"In a poetic structure using an AABBA scheme, should the final line's meter match the first two's?","<poetry><meter><poetic-devices>"
"How do you say conditional in future sentence?","<grammar>"
"""Brush oneself up"" is a common phrase?","<idioms><american-english>"
"Word for “direction“ where which way you're pointing to doesn't matter?","<single-word-requests><expressions><phrase-requests><translation>"
"Is there a word for the room adjacent to an office where the secretary sits?","<single-word-requests>"
"Her and her husband proper grammar","<personal-pronouns>"
"What is the opposite of ""eschatology""?","<antonyms><greek>"
"Rule for deciding the plural form of ""space jellyfish""?","<grammatical-number>"
"You know? or Do you know?","<grammar><questions>"
"Voting ""wrongly.""","<usage>"
"Are there any English expressions that mean 'to lie a lot', and that include a 'that--clause' in their structure?","<idiom-requests>"
"what is the meaning of ""Entrepreneurial entry""?","<meaning><ambiguity><translation>"
"How to say that I drink a coffee that is not the same as the coffee that other people drink?","<grammar><phrase-requests>"
"Correct usage of ""was passed""","<grammaticality><verbs><usage><tenses>"
"What is a good one word theme instead of ""Treasured memories""?","<single-word-requests>"
"Is there a name for all numbers different than zero?","<terminology><numbers>"
"Transcription and pronunciation of the 'un-' prefix in General American English","<pronunciation><prefixes><ipa><negative-prefixes>"
"What do you call someone who asks many questions?","<single-word-requests>"
"word request: support in getting tasks completed","<single-word-requests>"
"Alternative to ""launch customer"" or ""beta customer""?","<synonyms><terminology>"
"(Edited) What is the noun for ''the way of thinking about what could have happened in the past all the time''","<single-word-requests><nouns>"
"Past tense and future tense can be used together?","<american-english><british-english>"
"Why is a presen participle (using) used here?","<grammar><present-participles>"
"Is that expression right?","<expressions>"
"How do natives pronounce ""what the f**k?""","<american-english><pronunciation><offensive-language>"
"to ban sth from/in/at?","<prepositions>"
"Tense of the verb","<tenses>"
"""Five and a half million tons of laundry is / are sent to...""","<grammatical-number><questions>"
"should we use banned instead of banning? what's incorrect in this sentence?","<grammar><word-choice><word-usage>"
"Syntactic Functions of Clauses","<grammar>"
"""bless you!"" alternative","<expressions>"
"what's incorrect in this sentence?","<grammar><word-choice><word-usage>"
"Word for number of people in a room","<single-word-requests>"
"Is the ""female"" in ""female cousin"" redundant here?","<adjectives><translation><grammatical-gender><kinship-terms>"
"Does 'lending' an object require its relocation?","<etymology><semantics>"
"""instance of time"" vs. ""instant of time""","<word-choice>"
"Single word for ""factor or consideration that supports a specific conclusion or position""","<single-word-requests>"
"Difference between 'voting' and 'casting a vote'","<word-usage><american-english>"
"What’s the difference between “for” and “to” in “for/to many people”?","<meaning><grammaticality><differences><prepositions><to-for>"
"Meaning of 'quite at home being home'","<expressions><meaning-in-context>"
"how to say it if you used a wrong window on you instant messanger?","<phrases>"
"Usage of 'stand'","<word-usage>"
"idiomatic phrases for *the threat to go to the police*","<phrase-requests>"
"The meaning of the word 'Han'?","<etymology><orthography><history>"
"Is it right 'up' your alley or right 'down' your alley?","<idioms>"
"Can somebody recommend a good word to describe somebody with great responsibility","<single-word-requests><word-usage>"
"Word to describe ideological based giving? (outside of tithing, more specific than charitable)","<single-word-requests><phrase-requests>"
"What is the origin of the term ""ask for her hand in marriage""?","<idioms>"
"Adjective for ""something in which you always find something new""","<single-word-requests><adjectives>"
"This book reads easily vs this book is reading easily","<verbs><syntactic-analysis><sentence-patterns>"
"Use of ""did"" in an affirmative sentence before subject","<verbs><word-order><subject-verb-inversion><adverb-position><do-support>"
"Death's dateless night","<meaning><shakespeare>"
"Conditional: More than 1","<grammatical-number><usage><verb-agreement>"
"What word characterizes this one statement with its diametrically opposed conclusions?","<synonyms>"
"Is ""sub-project"" more like ""support project"" or ""child project""?","<meaning><ambiguity><translation>"
"What is the meaning of ""The backbone of something""?","<meaning><idioms>"
"Is the following a noun clause?","<grammar><clauses>"
"Inversions acceptable in conversations?","<subject-verb-inversion>"
"Is ""an s-t-r-e-e-t"" correct?","<grammar><articles>"
"""Can't you see the person is embroidering?"" - idiomaticity and alternatives?","<idioms><expression-choice>"
"Can I say ""awaken me from my naive view""?","<meaning-in-context><writing><analogy>"
"British English - “In two hours time”","<meaning><british-english>"
"A word with a wide range of meanings","<word-choice>"
"Omission of ""to"" with deontic ""have to""","<syntactic-analysis><modal-verbs>"
"Is it correct to say ""aging X years or more""?","<word-usage><usage>"
"The history and use of the term ""moth hour""","<meaning><history>"
"Is there a term for the device of titling named chapters in a work of fiction?","<literary-techniques><terminology><literary-device>"
"Difference between ""isolated"" and ""insulated""","<word-choice>"
"Is there a word for the mental state of laughter?","<meaning><word-choice><single-word-requests>"
"Why don’t other pronouns get to albe-themselves, à la albeit’s “it”?","<conjunctions><word-formation>"
"""To know X is all I need"" vs. ""knowing X is all I need""","<word-choice><grammaticality><infinitives><gerunds>"
"Is ""do something by date X"" inclusive?","<meaning><meaning-in-context><prepositions><time><dates>"
"""I run in the subway""","<grammar><prepositions>"
"What's the word for ""adjusting"" to keep up with a change","<single-word-requests>"
"Plural of ""syntax""","<grammatical-number>"
"""Available jobs to/for them""","<word-choice><grammaticality><prepositions><british-english><to-for>"
"What is the meaning of the word ""this,"" all by itself?","<etymology><meaning-in-context><slang>"
"Word meaning the act of the state taking away one's right to live","<single-word-requests>"
"""I thought they have taken it off"" vs ""I thought they took it off""","<word-choice><verbs><tenses>"
"Why two different tenses in the report from Yahoo News?","<tenses>"
"Expression for desire to feel superior to others","<expressions>"
"""I was going to be called Kate if I was a girl""","<verbs><conditionals><subjunctive-mood><will-be-going><future-in-past>"
"Which definition of commitment is correct in this sentence?","<meaning-in-context>"
"Phrase or idiom to mean ""one at a time""","<phrases><expressions><phrase-requests>"
"What is the difference between ""something else"" and ""something extra""?","<differences>"
"What is the term for a string that is made up of fixed-length components?","<single-word-requests><terminology><programming>"
"Is ""forwent"" used much?","<verbs><word-usage><past-tense><simple-past>"
"""Texted"" as past tense of ""text""","<past-tense>"
"What is the difference between 'the English King' and 'the England's King'?","<meaning>"
"Use of ""if""/""whether""","<word-choice><grammaticality><conjunctions><if-whether>"
"Expression ""to arrive at a place with your hands hanging""","<idioms><expressions>"
"""You should be well-organised"" or ""You should be well organised""?","<hyphenation>"
"A word for showing a bit of anger that you are not satisfied with what is offered?","<word-choice><single-word-requests>"
"""All our X"" vs. ""all of our X""","<grammaticality><prepositions><pronouns><all-of>"
"Alternative to the phrase ""took place""?","<synonyms><phrase-requests>"
"Which syllable is stressed in the word ""nineteen""?","<pronunciation><numbers><stress>"
"A loud silence has ensued","<oxymoron>"
"Difference between ""while"" and ""whilst""","<expressions>"
"Simple present vs. present continuous","<differences><verbs><speech><progressive-aspect>"
"Does the phrase ""fully n percent"" have real meaning?","<meaning><word-choice><phrases>"
"Ways to express ""Thank you"" in English","<expressions><american-english>"
"What does ""here's to someone/thing"" mean?","<meaning><expressions><meaning-in-context>"
"Does the concept of a generic masculine exist in the English Language?","<pronouns><gender-neutral>"
"“Not to mention” Vs. “Let alone”","<phrase-meaning><phrase-usage>"
"What is the correct structure for the phrase 'only happens once'?","<grammar><grammaticality><word-order><syntactic-analysis>"
"what does it mean to ""get set"" What does get set mean?","<meaning>"
"Can ""would"" be used twice in an English conditional sentence and still be grammatical?","<grammar><tenses><conditionals><modal-verbs>"
"Having an intransitive verb appearing before the subject","<intransitive-verbs>"
"""Only by playing fair, and also without fear, will you ever win.""","<meaning>"
"Are there specific texts, such as French/English poetry, in which the word romance was originally used, and popularized in?","<meaning><etymology><ambiguity><french>"
"Freaks out vs. scares","<meaning><word-choice><grammar><phrases><meaning-in-context>"
