title,tags
"When do I use ""can"" or ""could""?","<word-choice><tenses><politeness><subjunctive-mood><can-could>"
"Where does the ""quint"" in ""quintessential"" come from?","<meaning><etymology>"
"When should I use ""shall"" versus ""will""?","<differences><future><will-future><shall-future>"
"When did ""while"" and ""whilst"" become interchangeable?","<word-choice><etymology><differences><conjunctions><historical-change>"
"""May"" & ""Might"": What's the right context?","<word-choice><grammar><modal-verbs><auxiliary-verbs>"
"Is it appropriate to use short form of ""have"" ('ve) when it means possession?","<verbs><contractions><auxiliary-verbs>"
"Which words in a title should be capitalized?","<capitalization><titles><headline-case>"
"When is it appropriate to end a sentence in a preposition?","<grammaticality><prepositions><word-order><sentence-ends><pied-piping>"
"Where did the term ""OK/Okay"" come from?","<etymology>"
"What is the proper plural of the word ""freshman""?","<grammatical-number><american-english><north-american-english>"
"Where did the singular ""innings"" come from?","<grammatical-number><sports>"
"Are ""betwixt"", ""trebble"", etc., acceptable in American English?","<american-english><british-english><formality>"
"Is it ever acceptable for a period to come after a quote at the end of a sentence?","<punctuation><quotation-marks><period>"
"""What's wrong in/with this question?""","<word-choice><grammaticality><prepositions>"
"Is there a correct gender-neutral singular pronoun (""his"" vs. ""her"" vs. ""their"")?","<word-choice><possessives><personal-pronouns><singular-they><gender-neutral>"
"Can a word be contracted twice (e.g. ""I'ven't"")?","<punctuation><apostrophe><pronunciation-vs-spelling><contractions>"
"What’s the rule for using “who” and “whom” correctly?","<pronouns><grammatical-case><relative-pronouns><questions><whom>"
"How do I ask a question politely?","<modal-verbs><politeness>"
"What's the difference between a gerund and a participle?","<differences><gerunds><participles><verb-forms>"
"When to use “that” and when to use “which”, especially in relative clauses","<pronouns><conjunctions><relative-clauses><which-that><relative-pronouns>"
"Is it acceptable to start a sentence with “however”?","<grammaticality><word-order><conjunctions><sentence-starts><discourse-markers>"
"How does one correctly use a semicolon?","<punctuation><semicolon>"
"What is the correct spelling of ""buyer* remorse""?","<idioms><punctuation><orthography><possessives><apostrophe>"
"What is the difference between ""lay"" and ""lie""?","<verbs><differences><confusables><lie-lay-lain-laid>"
"Should I use a semicolon or a dash to connect two closely related sentences?","<punctuation><semicolon><dashes>"
"When referring to a noun, when does the gender matter?","<nouns><grammatical-gender>"
"Difference between ""ability"" and ""capability""","<differences><synonyms><nouns>"
"When should ""into"" be used rather than ""in to,"" and vice versa?","<word-choice><prepositions>"
"How does the phrase ""used to"" work, grammatically?","<verbs><idioms><terminology><syntactic-analysis><parts-of-speech>"
"""Employee"" in the phrase ""employee ID"" is a determiner, not an adjective—right?","<grammar><parts-of-speech><determiners><attributive-nouns>"
"Is it wrong to start sentences with ""in which case""?","<grammaticality><sentence-starts>"
"When should I use ""a"" vs ""an""?","<word-choice><pronunciation><articles><indefinite-articles><sandhi>"
"Are actors taught to roll their ""r""'s?","<pronunciation>"
"What proposals have been made to give the apostrophe some relief?","<punctuation><apostrophe>"
"What does ""great good"" mean in the tutorial title ""Learn You a Haskell for Great Good!""?","<meaning>"
"How much punctuation is appropriate when ending a sentence with a full-sentence quotation?","<punctuation><quotes>"
"Was the usage ""Spaghetti were"" ever acceptable or common?","<grammatical-number><uncountable-nouns>"
"Is it alright to use lowercase ""i"" or should you always use ""I"" (uppercase)?","<writing>"
"Should you always use the accent in foreign words like ""résumé""?","<writing><diacritics>"
"Is there software that can determine whether I speak with a neutral accent?","<learning><accent>"
"Why would you write ""ain't""? Isn't it a contraction only used in spoken English?","<slang><contractions><aint>"
"What are some of the better English reference grammars?","<resources>"
"Should I write ""that being said"" (vs. ""that's been said"" or ""Having said that"")?","<writing><expressions>"
"I thought ""spare me with ..."" means ""don't bother me with the details of ..."". Does it?","<meaning><idioms>"
"Is it correct to use ""their"" instead of ""his or her""?","<grammaticality><pronouns><personal-pronouns><grammatical-gender><singular-they>"
"What manual of style should I use for technical writing for US Federal Government documents?","<style-manuals>"
"Is the usage of ""speaks to"" new? Is it American?","<american-english>"
"Favourite untranslatables","<translation><list-request>"
"""Well"" and ""good"" as applied to the quality of photographs","<grammaticality><adjectives><adverbs>"
"Is it correct to say ""on accident"" instead of ""by accident""?","<word-choice><prepositions>"
"In what ways is Appalachian speech closer to Elizabethan English than contemporary British?","<dialects>"
"Is ""everyone"" singular or plural?","<grammatical-number><pronouns><verb-agreement>"
"What is the adjective that describes a person who takes everything in stride?","<single-word-requests>"
"Out on a tear last night - meaning?","<meaning><idioms><humor>"
"A word for someone who pretends to be interested in a home for sale","<vocabulary>"
"Is there a word or phrase for nostalgia for an era in which one didn't live?","<single-word-requests><phrase-requests><idiom-requests>"
"Is the word ""attached"" in the sentence ""Please find attached the file..."" passive or adjective? Why can the word ""attached"" split verb from object","<business-language>"
"Help with dialogue tags!","<dialogue>"
"which of these two sentences would be correct?","<grammaticality>"
"Word that means ""to remove dependence""","<single-word-requests>"
"What is the English pronunciation of ""pain au chocolat""?","<pronunciation><french><foreign-phrases>"
"Difference between adverb and adverbial adjunct","<adverbs><adjuncts>"
"Is ‘a dog which is barking’ synonymous with ‘a barking dog’?","<meaning><phrases><idioms><differences>"
"""You’re going to have jump for it"" meaning","<phrase-meaning>"
"Word for (feeling) a really strong visceral impulse that draws you to something","<single-word-requests>"
"Understanding the ""Welsh""","<meaning>"
"What are the inhabitants of the island Ireland called?","<terminology>"
"What is the etymology behind the euphemism ""The Troubles""?","<etymology><idioms><euphemisms>"
"How to use term describe `out of scope` job, but it is a company tasks","<single-word-requests>"
"""above all else"" means the most important?","<phrases>"
"Is ""new changes"" redundant?","<redundancy>"
"In the context, the translation of the phrase FLASHY BOI ""5 hours of debugging VS / flashy boi""","<meaning><phrases><slang><translation><jokes>"
"What is the word that means of or pertaining to bushes?","<single-word-requests><adjectives><terminology>"
"Word for disenfranchising women of their rights to make money","<single-word-requests>"
"What is the difference between Clients and Clientele?","<differences><synonyms>"
"What does canonical mean when used in sentence?","<american-english><slang><translation>"
"What is the word describing renaming an event or process with a symbolic phrase or word?","<single-word-requests>"
"What is the meaning of ""pathetic"" in this phrase?","<meaning>"
"What is the word to describe ""annoying but commonly accepted""?","<single-word-requests><nouns><slang>"
"Addressing several doctors in a salutation","<salutations>"
"Is this toilet sign correct usage of the English language?","<adverbs>"
"Car Interior synonym?","<single-word-requests><synonyms>"
"What do you call a word that can be spelled forward or backward forming two different words","<terminology>"
"Articles and Prepositions: “At/The mountain of…” and ""…descended in/on her head""","<prepositions><articles><definite-articles><indefinite-articles>"
"""To be reviewed and approved""","<passive-voice><infinitives>"
"Is there a nicer/politer/more positive alternative for ""negates""?","<single-word-requests><meaning><synonyms><euphemisms>"
"Is ""outcome"" plural?","<grammar><grammatical-number>"
"Is there a word for swear word substitutes?","<word-usage><vocabulary>"
"""technical work"" singular or plural?","<grammar><grammatical-number>"
"Is there a word for following a man or his ideas too closely?","<single-word-requests><verbs>"
"Is it correct to use ""their"" when referring to a single person when the gender is known?","<pronouns><personal-pronouns>"
"Police Have.....vs Police Has","<verbs><grammatical-number><verb-agreement>"
"What is correct use of definite article ""the""?","<grammar>"
"It is typical vs. It is frequent","<grammaticality>"
"The present perfect usage","<present-perfect><simple-past>"
"What to call a mass of meat in English?","<single-word-requests><british-english>"
"Is it ever correct to use ""on"" after ""continue""?","<grammaticality><prepositions><phrasal-verbs>"
"Phrasal verbs meaning stop being consistent in doing something?","<phrases><phrase-requests>"
"meaning of the word ""dressing"" in this paragraph?","<meaning>"
"Which one is better to use, Need or Needs?","<grammar><word-choice>"
"It has been long time since","<grammar><verb-agreement><sequence-of-tenses>"
"Meaning of ""we're a slenderer pair than you would make the half of"" in Byron's ""Don Juan""","<meaning-in-context><poetry>"
"Nothing's getting done today - is it present or future?","<tenses><ing><continuous-aspect>"
"To have some assets as [something]","<american-english><british-english>"
"Meaning of ""bull"" in Byron's ""this is no bull, although it sounds so""","<meaning><etymology><poetry>"
"Smelt vs smelled","<verbs>"
"How should I use ""any"" in ""if clauses""","<grammar><syntactic-analysis>"
"Possible error in long, complicated sentence?","<meaning><syntactic-analysis><subordinate-clauses>"
"Is this sentence properly written","<punctuation><sentence>"
"How is ""burial"" incorrectly formed?","<etymology><suffixes><word-formation><middle-english>"
"Is the comma necessary in this sentence?","<commas><sentence>"
"What is going on grammatically in the opening line of One Hundred Years of Solitude?","<grammar><verbs><past-tense><infinitives>"
"meaning of two had(s) here","<meaning><grammar>"
"In this sentence, is the correct pronoun me, I, or myself?","<pronouns>"
"Is there a word that denotes something that's an anomaly, but you'd think that's the standard?","<single-word-requests><expressions>"
"Origin of the saying “happy wife, happy life”","<etymology><phrase-origin>"
"Should a semicolon be used in this sentence?","<punctuation><semicolon>"
"single word for a challenging journey","<single-word-requests><nouns>"
"""Can't help but think"": origin and current meaning","<phrase-origin><double-negation>"
"What is it about this sentence that makes it sound awkward?","<grammar><ambiguity>"
"Etymology of ""fixing someone's wagon""","<etymology><expressions>"
"What does pending approval mean?","<phrase-requests>"
"Definition of ""telescope""","<meaning>"
"What are the subject and predicate in the following sentences?","<subjects><predicate>"
"Use of a comma after the identification of a year","<commas>"
"how much of this stuff we can channel","<meaning><meaning-in-context>"
"Can I write a comma straight after a dot? in business card","<american-english>"
"Which one is grammatically correct, with ""have"" or without ""have""?","<grammaticality><syntactic-analysis><conjunction-reduction><is-it-a-rule><compound-predicates>"
"What’s the geographic distribution of different pronunciations of the word ""experiment""?","<pronunciation><dialects><phonology>"
"One word to describe all flora","<nouns><adjectives>"
"Where did ""that really takes the biscuit/cake"" come from?","<etymology><phrases>"
"Get to doing something","<grammar><synonyms><explanation>"
"If someone calls something by a wrong name, what are they actually referring to?","<meaning-in-context><phrase-usage><objects>"
"What is a word for non alpha numeric characters that are the same when opened and closed?","<grammar><terminology><american-english><writing><programming>"
"When concerned or where concerned","<expressions>"
"In which or at which?","<grammar><grammaticality><phrase-requests>"
"can ""coexist"" cover animate and inanimate things?","<meaning>"
"Season's Greetings usage","<word-usage><christmas>"
"Someone who appears more of an expert than they are","<single-word-requests><phrase-requests>"
"How to convey the meaning of ""ordering a mess of papers and books""","<single-word-requests><phrase-requests>"
"What is the difference between a part of speech and a syntactic function / grammatical relation?","<grammar><parts-of-speech><syntactic-analysis><functions>"
"Sequence of tenses in elaborate sentences?","<tenses><perfect-aspect>"
"Is it possible to use the relative pronoun ""which"" to refer to people?","<grammar><relative-pronouns>"
"Is it common to use the phrase “come with” without specifying with whom","<phrases><word-usage><expression-choice>"
"a word for wanting to be somewhere else","<single-word-requests>"
"Is there any rule of silent initial letters in English?","<pronunciation-vs-spelling><silent-letters>"
"What does ""Payment with return""?","<meaning><translation><legalese>"
"Are products of wordsmithing proper English?","<history><suffixes><prefixes><lexicon>"
"What are the difference between ""details"" and ""information""?","<differences>"
"Use of commas with seemingly dependent clauses","<commas><clauses><dependent-clause><independent-clauses><example>"
"Mixing tenses in past tense fiction","<tenses><past-tense><future><present-tense>"
"Suffering succotash","<idioms>"
"What is the saying or idiom or word that means when ""friends"" don’t need you anymore it seems like they don’t know you anymore","<word-choice><idioms><popular-refrains>"
"Pluralizing Noun Phrase?","<nouns><grammatical-number>"
"In + pres. participle constructions (""In performing,"" ""in using"")","<prepositions><present-participles>"
"What is difference between ""using"" and ""by using""?","<prepositions><gerunds>"
"Space before apostrophe","<orthography><history><apostrophe><contractions><typography>"
"Word for a person that is both caring and cold-hearted logical","<single-word-requests>"
"Forcing someone's choice through malicious or careless timing","<expressions><phrase-requests>"
"""The other side"" to refer to the afterlife","<meaning><phrases><meaning-in-context><history><jokes>"
"why rocks in ""dumb as rocks""?","<simile>"
"What does ""share the passion"" mean?","<prepositions>"
"what's the English phrase for the Chinese one ""Destination at south, heading to north""?","<phrases><translation>"
"Man in blue shirt","<grammar><word-usage>"
"Irish folk song: Hunt the Hare, and played some funny rigs","<meaning><expressions><hiberno-english>"
"The use of the definite article ""The""","<definite-articles>"
"Usage of ""persons""","<expressions><word-usage><usage><phrase-usage>"
"Buffalo explanation","<syntactic-analysis>"
"How many moods are there in English and what are they?","<mood>"
"why ""thus was""? is it correct gramatically?","<grammar>"
"Noun that means ""something that contrasts favorably with the rest""?","<word-choice>"
"Are ""smell like"" and ""smell of"" the same?","<differences>"
"Grammatical role of “the hell”?","<adverbs><parts-of-speech><syntactic-analysis>"
"What's the opposite of hypochondriacal?","<single-word-requests><adjectives><antonyms>"
"Word to describe the completion of a planned rail journey","<word-choice><single-word-requests><british-english>"
"How, when and where did the phrase 'state of the art' originate?","<etymology><phrases><usage>"
"""the only other colleague"" - implies how many total number of colleagues?","<expressions>"
"Ambiguous parsing in the absence of prepositions","<ambiguity><syntactic-analysis>"
"idiom for warning someone who has entered a place without permission or invitation?","<idioms>"
"Mixed conditional and sequence of events","<grammaticality><conditionals><conditional-perfect>"
"Self-irony, self irony","<expressions>"
"What is the meaning of a party/event with the slogan ""jingle&mingle""?","<meaning-in-context><slogan><motto>"
"What does ""most of all"" mean in this context?","<meaning><meaning-in-context>"
"Is ""spellbind"" a defective verb?","<word-usage><verbs>"
"Noticed your mail late or noticed your mail belatedly","<expression-choice>"
"How do you reply to someone correctly in this context?","<grammar>"
"""It also has motivated me..."" Is this correct?","<word-choice><grammaticality>"
"From thence vs. thence in the Apostles' Creed","<adverbs>"
"The Difference Between ""Cream"" and ""Creme""","<meaning><grammar><terminology>"
"What is the possessive form of “neither”?","<possessives><apostrophe><neither-nor><indefinite-pronouns>"
"Trying to find a good word for 'a small discussion' or perhaps 'a focused discussion'","<single-word-requests><phrase-requests><synonyms>"
"Origins of ""Oorah""?","<meaning><etymology>"
"Term for infinitely expanding problems","<phrase-requests><programming>"
"Did ""sublime"" and ""cherubim"" rhyme in the past?","<pronunciation><lyrics><rhymes><christmas><songs>"
"Is there a slightly ironic idiom for ""one's purpose in life""?","<idioms><idiom-requests>"
"'Who' versus 'what' when talking about relationships between two people","<grammar><who><what>"
"Proper grammar for listing plural items","<grammar>"
"Is it true that English has ""evolved"" to say that ""Jim and me"" instead of ""Jim and I"" is correct?","<grammaticality><pronouns><grammatical-case>"
"What does ""they prescribe upon our riper ears"" mean?","<meaning-in-context><quotes>"
"Can the word ""cooking"" also be used to describe something that is ""still in the process of being developed""?","<meaning>"
"Are sentences limited to one coordinating conjunction?","<commas><coordinating-conjunctions>"
"What the meaning of ""faster than you can say Indiana Jones""?","<idioms>"
"Difference between Quick and Fast","<differences>"
"Schoolmaster vs Principal or Teacher","<word-choice><differences><transatlantic-differences>"
"""Goal of math"" or ""Goal of mathematicians""?","<grammaticality>"
"Does extraterrestrial refer to origin or location?","<meaning>"
"Word for a single tunnel within a ""tunnel complex"" or the complex itself","<single-word-requests><terminology><translation><technical>"
"It takes/requires/needs for someone to do something","<grammar>"
"Short forms for pounds and ounces?","<measuring-units>"
"Is the -ing a participle in the sentence?","<relative-clauses><syntactic-analysis><ing><participial-phrases><gerund-phrases>"
"What's the verb for ""to drink small amounts of drink""?","<single-word-requests><verbs>"
"What is a better word than ""track"" for a piece of music?","<single-word-requests><generic-term>"
"Using future perfect vs future perfect continuous","<differences><future><perfect-aspect>"
"Something that has a ""name and description""","<single-word-requests>"
"An adjective for ""in the wrong register""","<single-word-requests><adjectives>"
"Using modal verb ""would"" as a main verb","<grammar><verbs><modal-verbs>"
"""Conduct a project"" or ""complete a project"", or else?","<sentence>"
"Adjective for advice","<adjectives>"
"Is there a name for these sorts of paradoxical inversions?","<subject-verb-inversion><rhetoric>"
"I'm a guy and I change my appearance to look like my female counterpart","<meaning><single-word-requests><phrase-requests>"
"What is the proper way of addressing a professor?","<word-usage><politeness><email>"
"“on condition of his getting out of this then, come, and cutting it”","<meaning-in-context><phrase-meaning><dickens>"
"Give up versus give in","<meaning><differences>"
"What's the word for a gathering mainly for the purpose of eating food?","<single-word-requests>"
"Word for the bias of a profession towards itself?","<phrase-requests>"
"To have older brothers","<meaning-in-context>"
"Expenditure or expenditures?","<grammatical-number>"
"What's it called when you over-use ""would""?","<word-choice><grammar>"
"""Police say there appear to be signs of a break-in."" Why ""appear"" instead of ""appears""?","<grammar><verb-agreement><modal-verbs>"
"I remember taking a lot of pictures for my wedding","<meaning><grammar><grammaticality><american-english><passive-voice>"
"Question on conjugations to unknown crowds","<verbs><conjugation>"
"Subject + having (grammar)","<grammar><syntactic-analysis>"
"About how many words of four letters are there in English?","<orthography><dictionaries>"
"Is it improper to use a colon and then another colon in the same sentence?","<punctuation><writing-style><colon>"
"Word for a passed down language?","<single-word-requests>"
"bigotry, with or without prejudice","<word-usage><nouns><american-english>"
"Is there a special meaning for ""this has to go""?","<meaning><phrases>"
"Can ""harsh"" be used as a noun?","<meaning><ambiguity>"
"Term for law that is not practiced in reality","<single-word-requests><legalese>"
"Is ""keep off"" considered a phrasal verb, as in ""keep off the grass""?","<prepositions><phrasal-verbs><parts-of-speech>"
"What's a word for someone who pushes boundaries?","<meaning><word-choice>"
"What is the difference between ""body count"" and ""death toll""?","<meaning><differences>"
"Why should etymology stop where it does?","<etymology>"
"Punctuation for delineating two adjectives","<punctuation>"
"What's this type of coffee maker called?","<single-word-requests>"
"He is in the same school as John or John's?","<grammar><possessives><apostrophe>"
"Can I use ""# of subjects"" as ""the number of subjects"" in column headings in academic papers?","<abbreviations>"
"Take a call - meaning in the following context","<meaning-in-context>"
"Words/phrases for work progress","<single-word-requests><phrase-requests>"
"Why is ""forward slash"" not spelled ""forwardslash""?","<punctuation><compounds><spacing><slash>"
"Order of adjectives: why is ""This is a hot, tasty, Indian curry."" wrong?","<adjective-position>"
"Is Sherlock a real name?","<meaning>"
"What does ""intuitive"" mean?","<meaning>"
"Can we use ""fury"" to refer to a large crowd?","<word-usage>"
"Stop chewing! What is it called when someone doesn't like the sound of other people eating?","<single-word-requests><expressions><phrase-requests><food><phobias>"
"Singular or Plural after a List of Streets using ""or""?","<grammatical-number><lists>"
"Is ""the difference"" a collective nouns?","<collective-nouns>"
"Phrase For Inside the Bell Curve","<phrases>"
"Sentence writing - use of pronouns","<sentence>"
"What do you call an artwork that was not made specifically for a client?","<single-word-requests>"
"How can I describe the intersection between a circle and a curve?","<grammar><american-english><mathematics>"
"Is there a technical (and less gruesome) term for ""execution squad"" mentality?","<terminology><psychology>"
"Should you use first word capitals for an advertising slogan used in a descriptive, adjectival way?","<grammaticality><phrases><capitalization><slogan>"
"Is there a word in English for someone who likes to experience something which has somewhat been experienced by himself already?","<single-word-requests>"
"Correct usage of ""awhile""","<word-usage>"
"Difference between ""accountability"" and ""responsibility""","<meaning><differences><nouns>"
"Which is correct..Nothing last forever? or Nothing lasts forever?","<usage>"
"Should we use ""in terms of""?","<meaning><writing-style>"
"Past participle after noun: ""proposed cost"" vs. ""cost proposed""","<grammaticality><nouns><word-order><writing-style><past-participles>"
"is it correct to use 'one' in a paragraph beginning then move to 'I'?","<pronouns>"
"What exactly is ""verbal irony""","<meaning><semantics><irony>"
"A Good Phrase to Replace ""Get To Know""","<word-choice><expressions><phrase-requests>"
"Inclusive ""or"" in speech","<word-choice>"
"What is the correct spelling of ""X, schmX"" to indicate dismissiveness (e.g., ""evidence, schmevidence"")?","<etymology><american-english><orthography><prefixes>"
"What is the "", gerund"" sentence called, and how can I improve it?","<terminology><sentence><gerunds><syntactic-analysis>"
"""feint"" and ""feign"": Are they synomyms?","<meaning><differences><synonyms>"
"I'll take you home / I'll bring you home","<meaning><grammar><semantics><bring-take>"
"Applications in vs. applications to","<word-choice><grammaticality><prepositions>"
"Is there any term for a person who has changed his name?","<single-word-requests>"
"usage of 'never again'","<grammar>"
"Does 'mailbox money' mean anything?","<meaning><phrases>"
"Is something ""half price"" or ""half priced""?","<adjectives><terminology><suffixes><compound-adjectives>"
"Meaning of 'jumps across' in sentence","<meaning><verbs><prepositions><sentence>"
"What is the plural of ""ostrich""?","<grammatical-number>"
"Convolve vs. convolute","<etymology><differences><american-english><british-english>"
"Satisfactory solution to the spelling of regular past participles of new verbs ending in a hard C","<verbs><orthography>"
"What is the proper word for 'newly formed flower'?","<single-word-requests>"
"Which preposition to use in ""to live in fear [...] one's life""","<word-choice><grammaticality><prepositions>"
"Difference between ""humble"" and ""modest""","<synonyms>"
