title,tags
"Should I describe a book I've read in the past or present tense?","<past-tense><present-perfect><present-tense><simple-past>"
"We know where each other stand or stands?","<grammatical-number>"
"Where does ""shakedown"" come from?","<etymology>"
"What should I use ""tell"" or ""say""?","<word-choice>"
"Out or out of which is it?","<prepositions><american-english><british-english>"
"What is a specific word for someone who can't feel any emotions and can't understand emotions or more specifically love?","<single-word-requests>"
"Can an adjective be converted into a noun by '-s'?","<nouns><adjectives><suffixes>"
"Term for not taking a stance or non-stance on an issue","<single-word-requests>"
"Is ""fatty"" a proper word to use?","<politeness><connotation><colloquialisms>"
"Is it a complement clause?","<grammar><grammaticality>"
"A word/phrase for something massively complex","<single-word-requests><phrase-requests><idiom-requests>"
"What does ""matrices"" mean in this context?","<meaning>"
"Word for feeling amused by someone/people being ... stupid?","<single-word-requests>"
"technical editor to Copy editor","<grammar>"
"Opposite of the term ""keming"" (KEMING)","<single-word-requests><typography>"
"Simplicity or Complexity, which is more important in speech and writing?","<writing-style><speech>"
"A word to describe a prolific scientist, inventor or explorer who was inspirational and innovative","<single-word-requests><nouns>"
"Is this sentence correct: ""I am making my personality better""?","<grammar><grammaticality><idioms>"
"What do you call a person who prevents his/her own progress?","<single-word-requests><phrase-requests>"
"Short form of word ""available""","<abbreviations><shorthand>"
"Is 'had have + past participle' a correct grammatical form?","<grammar><tenses>"
"Listing multiple compound words","<hyphenation><compounds>"
"What's the name of the action for opening a lock with an RF card?","<verbs><terminology><technical>"
"How would you interpret ""Public file description entry line definition""","<meaning>"
"What's the origin of music ""charts""?","<etymology>"
"known vs recognizable","<adjectives>"
"Syntax structure","<descriptive-grammar>"
"Is ""A Spanish Learning Grammar"" grammatical?","<grammar><articles><syntactic-analysis>"
"What word is used to describe the movements of objects caused by Earthquake?","<meaning><single-word-requests><word-choice><word-usage><synonyms>"
"Word for ""speeding up a process"" in line with the idiom ""to kick-start""","<idioms><synonyms><metaphors>"
"""Twice in"" ? can preposition be used after twice?","<grammar><prepositions>"
"Is there a word/phrase to describe an action which leads to it being pointless?","<single-word-requests><phrases><expressions>"
"Heavy rain season or heavy raining season?","<grammar>"
"What's an introductory part of the title of an article/book called?","<terminology>"
"What is a word that means ""does not collapse?""","<single-word-requests>"
"""Quality comes naturally with integrity.""","<grammaticality><phrase-meaning>"
"Other words for or similar to synecdoche","<figures-of-speech><literary-device><synecdoche>"
"What the right expression for ""pursue a requirement""?","<verbs><expressions><vocabulary>"
"Is there another word for a ""large family"" or ""small family""?","<single-word-requests><compounds>"
"A word or short phrase for 'better in every way'?","<phrase-requests>"
"Does 'knockoff', meaning 'copy', come from the German word 'nach'?","<etymology>"
"Proper way to use the comma when having a similar items in a list with one exception","<commas>"
"We're finished vs We're done","<grammar>"
"How do native speakers answer questions like ""what's cooking""?","<american-english><conversation>"
"What does the expression ""Word."" mean?","<meaning><expressions><american-english>"
"The habitual past ""would"" versus ""simple past"" tense","<grammar><grammaticality><past-tense><simple-past><past-habitual>"
"a few days every month usage","<grammar><grammaticality>"
"What is the semantical difference between reliable and trustworthy?","<differences><semantics>"
"What does ""even"" mean in this statement?","<grammar>"
"People with similar traits","<meaning-in-context><phrase-requests><vocabulary><usage>"
"Difference between lexicon, vocabulary and dictionary","<meaning><differences><terminology>"
"Is the use of ""acquainted with"" correct here?","<meaning><phrases><meaning-in-context>"
"“To the next time” vs. “Till the next time”","<prepositions><expression-choice>"
"Why is this not a run-on sentence?","<run-on-sentence>"
"What does ""come to terms with"" mean?","<meaning><meaning-in-context><vocabulary><idiom-meaning>"
"Marking stress for a syllable","<stress>"
"Trendline for historical usage of ""prick""","<single-word-requests><etymology>"
"Why are you saying something ""for"" yourself when your parent asks you what you have to say for yourself?","<etymology><expressions><idioms>"
"a principle that [...], and that [...]","<syntactic-analysis><subjunctive-mood>"
"Et cetera and Et alii","<word-usage>"
"Is there an etymon for scam?","<etymology>"
"How do you write the expression of disgust that sounds like ""er""?","<expressions><british-english><orthography><ambiguity><interjections>"
"On a certain usage of the word ""only""","<meaning><history><only>"
"present progressive for general statements","<present-progressive>"
"What does the phrase: ''Let's throw a little wrench in his plans'' mean?","<phrases><idioms>"
"The difference between a sentence starting with 'to' + verb and starting with a gerund","<grammar>"
"What is the difference between ""bias"" and ""opinion""?","<meaning><usage>"
"In certain case, double negation doesn't cancel the negation?","<negation>"
"""Idiom"" and ""idiot""","<etymology>"
"Question tags — ""did you"" vs. ""didn't you""","<meaning><questions><negation><subject-verb-inversion><question-tags>"
"Opposite of ""bells and whistles""","<antonyms>"
"Is ""put together"" an adjectival phrase?","<phrases><meaning-in-context><adjectives>"
"Why is fingernail paint called ""nail polish""?","<idioms>"
"Why are nicknames called ""nicknames""?","<etymology><metanalysis>"
"'Usually' Or 'Normally'","<word-choice>"
"Why are the words hundred, thousand, million, and trillion singular after plural numbers?","<grammatical-number>"
"Verbs for ""and"" and ""or""?","<verbs><synonyms>"
"Is 0.1 million singular or plural?","<grammatical-number>"
"A word to describe two (far apart) locations","<single-word-requests><adjectives>"
"""...who didn't have a..."" vs ""...without a...""","<word-choice><titles>"
"What does ""even in costume"" mean here?","<meaning><nouns>"
"Word for ""personal reason for not being able to do something""","<single-word-requests>"
"Meaning of ""I would venture""","<phrases><meaning-in-context>"
"Why do we ""talk turkey""?","<etymology><slang>"
"Silly questions, like X is/are a complete waste of time?","<word-choice><grammaticality><verbs><grammatical-number>"
"Opposite of 'Midas touch'?","<idioms><expressions><phrase-requests><antonyms>"
"how to reply to Howdy","<american-english>"
"What word describes our habit to use extremes in language, and what are its implications?","<single-word-requests><conversation><language-evolution>"
"Adverb-adjective compound premodifier with or without hyphen?","<adverbs><hyphenation>"
"how much more—question or statement?","<punctuation><questions>"
"What is the opposite of commercial?","<antonyms>"
"Association for profit","<single-word-requests>"
"Is there an equivalent of p.p. for non-signed printed letters?","<letter-writing>"
"What is this menagerie doing in my bread-basket?","<jargon>"
"Trouble with second conditionals (with “could”)","<conditionals><semantics><subjunctive-mood><reversed-conditional>"
"Tenses and Verbs","<verbs><tenses>"
"What's the word for ""preferring this option/choice""","<single-word-requests>"
"What’s the difference between “come recommended” and “be recommended”?","<differences><auxiliary-verbs><passive-voice>"
"What's the term of ""omission"" in phonetics?","<phonology><phonetics>"
"Hypernym for “import” and “export”?","<single-word-requests><vocabulary>"
"Mileage as unit-agnostic term","<measuring-units><cultural-phrases><localisation>"
"Why don’t “snow” and “plow” — well, or “plough” — rhyme?","<etymology><pronunciation><orthography><old-english><historical-change>"
"When are ""from"" and ""by"" interchangeable?","<word-choice><prepositions>"
"Is this redundant pronoun use ""grammatical""?","<grammaticality><syntactic-analysis>"
"What is a better word for ""exponentially""?","<word-choice>"
"""Is too"" instead of ""it is""","<conversation>"
"""You are right; I'm sorry"" — semicolon or comma?","<punctuation><commas><semicolon>"
"Addressing email to more than one person","<email><salutations>"
"""He started paying Carol to look after me""","<meaning><phrases><expressions>"
"What is the word for ""money I want to spend in the future""?","<finance>"
"Word for this type of question?","<single-word-requests>"
"What case follows 'of' in this phrase - nominative or accusative? (i.e. 'of he' or 'of him'?)","<grammar>"
"Word for ""collecting money for a special event from a group of people""","<meaning><word-choice><single-word-requests><verbs><nouns>"
"A word meaning ""To bring out of retirement"" / ""To bring back into use""","<adverbs><phrasal-verbs>"
"Word for having four sides or parts","<vocabulary>"
"Can I say that a scientific field has been ""polymorphic"" if it has changed dramatically over time?","<meaning><word-usage>"
"Wanderwort origins and the Indus Valley Civilization?","<etymology><history>"
"Repeat ""on"" in a list?","<grammaticality><prepositions><lists><parallelism><repetition>"
"""Named"" vs ""called""","<expressions><usage><programming>"
"What is the meaning of ""April smile?""","<phrases><expressions><phrase-meaning>"
"The Usage Domains of ""why"" and ""how""","<word-choice><word-usage><questions><science>"
"To not want to believe something has happened","<meaning><meaning-in-context>"
"Why and how did ""a sensible boy"" become ""intelligent and prudent""?","<etymology><latin><italian><semantic-shift><false-friends>"
"Why does the Sudan have a ""the"" in the name?","<definite-articles><toponyms>"
"Up- vs Down-here","<prepositions><prepositional-phrases><direction>"
"When did “green field’ and ‘brown field’ come into use as an economic, or investment term, and who rearranged so?","<etymology>"
"""Had they have""?","<grammaticality><conditionals>"
"Looking for the land cargo equivalent of a ""stevedore""","<single-word-requests><nouns><analogy>"
"Use of comma and dash","<punctuation><colon>"
"How to describe having the same amount of advantages and disadvantages?","<phrase-requests>"
"Meaning of ""approach"" in context","<meaning-in-context>"
"The plural of 'stomach""","<irregular-plurals>"
"A person who gets angry when they... vs A person who gets angry when he","<grammar>"
"A word for worn pool table felt","<single-word-requests>"
"How to understand WHICH here?","<grammar>"
"""Which planet is nearest Earth?"" vs ""Which planet is the nearest to Earth?""","<grammaticality><prepositions><articles>"
"how to find the subject and verb in the subordinate sentence","<grammar>"
"How to understand strew here","<meaning>"
"Can I use ""keypoint"" as a single word?","<word-choice><word-usage>"
"Do we need to use 'the' here?","<determiners>"
"Is the usage of ""with which"" here correct?","<prepositions>"
"can a/an modify unccountable noun?","<meaning><grammar>"
"""This does not have to go""","<questions>"
"How to choose tense while using ""in case"" in a sentence?","<tenses>"
"Adverbs in comparative degree and anyone or everybody rules","<comparatives>"
"When introducing an initialism for the first time in a paper, but the noun is possessive, do I make the initialism possessive as well?","<writing-style><possessives><acronyms><initialisms><formatting>"
"""Failed of late"" meaning?","<meaning><meaning-in-context><idiom-meaning>"
"The use of Vice from the phrase vice versa","<word-usage>"
"Is this a valid sentence: ""[This] is [that] made [аdjective]""?","<meaning><phrases>"
"Meaning of ""to gird up one's loins"" (King James English)","<idiom-meaning>"
"Explain the difference between the following 2 sentences","<descriptive-grammar>"
"Slang or scientific term for ""mental food""?","<single-word-requests><phrase-requests>"
"Opposite of a diet","<single-word-requests>"
"Preposition stranding: is it possible to remove preposition altogether?","<grammar><prepositions>"
"Metaphor or idiom?","<idioms><metaphors>"
"Earliest usages of the literal and figurative sense of “window dressing”","<etymology><phrase-origin>"
"What are the rules for what ""they"" refers to when there are two plural nouns in a sentence?","<nouns><pronouns>"
"Mouse Spin alternative","<etymology>"
"Word for two very particular phrases","<phrases><expression-requests>"
"Correct way to use gerunds?","<tenses>"
"antonym for ""look forward to""","<single-word-requests>"
"Conjunctions, coordinators","<grammar><descriptive-grammar>"
"“enables users to” vs “allows users to” – both correct?","<word-choice><grammaticality>"
"Is the sentence ""I’m only going to ask you again once."" grammatically correct?","<grammaticality>"
"In the medical field what terminology do they use in describe cures and treatments","<single-word-requests><phrases><expressions><terminology>"
"have or has following ""something and something""","<have>"
"Capitalization With Hyphen in Length-Limited Title","<capitalization><headline-case>"
"what is the meaning of this sentences please tell me","<sentence-meaning>"
"Idiom or proverbs for the word ""not pleasant""","<idioms><proverbs>"
"From <date> to <date> OR On <date> to <date>?","<prepositions><dates>"
"What is the meaning of 'in my honor'?","<meaning>"
"""With my/their/our V-ing..."" as supplement to main clause","<gerunds><grammatical-case><gerund-phrases><possessive-vs-oblique>"
"How to use alphabet character to pronunciation American English?","<pronunciation>"
"Struggling with simple past/present perfect in ""Author X (2016) showed/has shown""","<tenses><present-perfect><simple-past>"
"What's the difference between ""cut out of"" and ""cut out from""?","<meaning><differences><usage><phrase-usage>"
"Is the use of the word ""thus"" still common practice?","<meaning><british-english>"
"Can you say motivate your answer?","<grammaticality>"
"What is the word for using someone's hospitality unashamedly?","<single-word-requests>"
"What meaning does ""within"" have in this case?","<meaning><word-usage>"
"Is there a term for the reduplication of letters?","<single-word-requests><terminology><historical-change>"
"Proper usage of trans-theory terms","<gender-politics><sex-vs-gender><social-gender><natural-gender>"
"Is choice of verb form or construction determined by context or by a sentence's internal structure?","<tenses>"
"Is there a name for this literary device from James Baldwin and question about punctuation?","<punctuation><literature><literary-techniques><literary-device>"
"Attention vs attentiveness","<meaning><nuance>"
"A puzzle about direct/indirect question","<indirect-speech>"
"Is it ""so ..."" or ""so that ...""?","<that>"
"What is the difference between ""All"" and ""Only"" here?","<meaning><predicate>"
"Why does ""-ing"" go to ""-in"" in some dialects?","<pronunciation><dialects>"
"""your grandfather’s and my health"" or ""your grandfather’s and mine health""?","<grammaticality><possessives><coordinating-conjunctions>"
"Would we call someone who is biased towards people of their own country ""racist""?","<meaning>"
"Why does forbearance mean tolerance?","<meaning><etymology>"
"Contradiction of ""only so much""","<figures-of-speech><intensifying-adverbs>"
"Difference between ""get hands on"" and ""get""","<meaning><idioms>"
"""In doing so"" vs ""In so doing""","<phrases><differences>"
"Can I shorten this noun phrase using compounds?","<grammaticality><compounds>"
"Idiom for vehement agreement: ""This with [blank] on""","<phrase-requests><idiom-requests>"
"When did the phrase ""above your paygrade"" come into use?","<phrases><history>"
"Single word for ""better but harder"" or ""greater but harder to achieve""?","<single-word-requests><word-choice>"
"Should I repeat the ""for"" after each verb?","<grammaticality>"
"How should I understand this quote from Mark Twain about life and love?","<meaning><phrase-meaning>"
"""How could I"" and ""how could I have"" in rhetorical questions","<modal-verbs><perfect-aspect><backshifting><conditional-perfect><can-could>"
"How is it correct to use? Present Perfect and Past Simple","<past-tense><present-perfect>"
"Pronunciation difference between waist and waste","<pronunciation>"
"Is 'was' or is 'were' correct in this sentence?","<grammatical-number><verb-agreement><syntactic-analysis>"
"A word to describe a person that everything come to them late in life!","<expressions><terminology><epithet-requests><diction>"
"make drug to be in patient’s body","<single-word-requests>"
"Semicolon or comma in example sentence","<grammar><punctuation><commas><semicolon>"
"Why not in present simple? ""You're always cadging cigarettes from me!""","<grammar><tenses>"
"""Rhetoric"" vs ""Eloquence""","<meaning><word-usage>"
"Word for ""doing something and forgetting it soon after""","<single-word-requests>"
"Are ""mmm"" and ""hmm"" the only words in the English language without vowel letters?","<single-word-requests><vocabulary><orthography><consonants>"
"""true for"" vs ""true of""","<usage>"
"'Rita is not hardworking like Samson.' In this sentence, is Samson hardworking?","<meaning><word-choice>"
"Non-derogatory word for shill?","<single-word-requests>"
"Is ""epidemiology"" an appropriate word for the study of invasive species in an ecosystem?","<single-word-requests><technical><science>"
"To sally or not to sally?","<word-usage><verbs>"
"Could the attributive noun be plural?","<grammar><attributive-nouns><premodifiers>"
"Punctuation In Two Prepositional Phrases Using the Same Object","<punctuation><prepositional-phrases>"
"A word for ""the quality of being temperamental"" i.e. *temperamentalness*","<single-word-requests><nouns>"
"""recent future"" is correct to use it?","<adverbs><phrase-usage>"
"What is a word for extreme type of criticism?","<single-word-requests>"
"In the famous speech from the film ""Network"", he says ""Let me have my toaster and my TV and my steel belted radials"", what are steel belted radials?","<meaning>"
"Are 'glimpse' and 'glance' interchangeable as verbs?","<meaning><verbs><differences>"
"People answering me ""what's new"" when I ask them ""How are you doing""","<meaning-in-context>"
"an expression for ""falling into mud is Ok, but staying in it isn't""","<expressions>"
"Are there cases where a possessive pronoun is omitted?","<grammar><pronouns><possessives>"
"Is ""yay or nay"" an acceptable alternative to ""yea or nay""?","<expressions><eggcorn>"
"Why are clothes “hung” but men “hanged”?","<etymology><differences><verbs><past-participles>"
"Can a sentence start with ""Because""?","<grammaticality><sentence><conjunctions><sentence-starts>"
"Possessive form for words ending in ""y""","<grammatical-number><possessives>"
"Equivalences between Australian English and American English","<american-english><australian-english><resources>"
"What is the correct pronunciation of ""Caribbean""?","<pronunciation>"
"What does Maugham mean by ""his spaghetti were""?","<grammatical-number><literature><uncountable-nouns>"
"""Speak to"" vs. ""Speak with""","<word-choice><american-english><british-english><phrasal-verbs>"
"Is domain-specific meaning acceptable/advisable when used in a document directed outside the domain?","<idioms><jargon>"
"""Toy for your kid"" or ""Toy for your kids"" as you don't know how many kids they have?","<grammatical-number>"
"Tendency of using pronouns 'she/her' when talking about a random person","<expressions><politeness><correspondence>"
"What is the plural form of ""status""?","<nouns><grammatical-number><latin><irregular>"
"Can ""anyways"" be used at the beginning of a sentence?","<word-choice><sentence-starts>"
"When should com­pound words be writ­ten as one word, with hy­phens, or with spaces?","<hyphenation><compounds><open-vs-closed-vs-hyphenated>"
"When to use 'an' and when to use 'a' with words begining with 'h'?","<word-choice><grammar><pronunciation-vs-spelling>"
"Definite article with plural nouns","<grammar><grammatical-number><articles>"
"Expansion and pronunciation of ""Mrs""","<pronunciation><abbreviations>"
"How should I ask for a bill in a restaurant politely?","<word-choice><nouns><politeness>"
"Does ""ever"" apply to the future, or only the past?","<adverbs><tenses>"
"New Oxford American Dictionary describes ""the"" as an adjective","<meaning><articles><parts-of-speech><determiners><syntactic-analysis>"
"The use of ""random"" to mean ""arbitrary"", ""unidentified"", ""unknown"", etc","<meaning><synonyms>"
"What is the origin of British/Irish cinema names?","<etymology><insular-english>"
"What do ""brave"" (adj) and ""courage"" (n) really mean?","<meaning>"
"""Without reason"" or ""Without reasons""?","<learning><idioms><grammatical-number>"
"""Change"" or ""changes""?","<word-choice><grammatical-number>"
"What does ""going forward"" mean?","<meaning>"
"""Pissed"" vs ""Pissed off""","<american-english><australian-english>"
"Does ""nineteen-hundreds"" refer to 1900–1909 or 1900–1999?","<numbers><dates>"
"Informal US terms for money amounts","<american-english><vocabulary><formality><money>"
"Why does ""under the sea"" mean ""in the sea""?","<word-choice><prepositions>"
"What part of speech is ""on"" in ""on fire""?","<grammar><parts-of-speech>"
"Possessive form of ""you guys""","<grammar>"
"difference between the prefix ""un"" and ""not""","<negation><semantics><prefixes>"
"How does one pluralize a name that ends with a silent x?","<grammatical-number><proper-nouns>"
"What is the right word to use in this sentence: ""start looking at things beyond the ( ) of judgement/criticism""?","<vocabulary>"
"Is there a word for imitating language sound?","<single-word-requests>"
"This makes possible to","<grammar>"
"Why is there is no comma after ""yet""? What does it mean compared to ""however"" and ""but""?","<grammar><grammaticality><syntactic-analysis>"
"Do I need a comma before as in this sentence: does as start a nonrestrictive element?","<commas><north-american-english><that><non-restrictive>"
"Word to express nervous anticipation","<single-word-requests><word-choice>"
"Alternative for huckster","<synonyms>"
"What's the difference between ""the mechanics"" and ""the mechanism""","<differences>"
"Is it The Johnsons or The Johnson's","<apostrophe>"
"Name of a place at the end of a long journey","<single-word-requests><phrases>"
"How to best use 'based around your skill set' in a sentence most effectively?","<meaning><grammar><grammaticality><phrase-requests><sentence>"
"The construct: [subject] ""approximates"" [something] to [something else]","<meaning><grammar><grammaticality><transitive-verbs><intransitive-verbs>"
"Whenever...then","<grammaticality>"
"Present perfect or present perfect continuous with a participle?","<verbs><present-perfect><participles>"
"What modern word carries the meaning of pre-Victorian usage of ""gay""?","<single-word-requests><history>"
"Expression to describe the curse of being at higher positions in a workplace","<expressions><idioms><business-language>"
"""look-up tables"", ""look up tables"" or ""lookup tables""","<word-usage><orthography>"
"introducing, picking up, or influencing the lifespan of [,] discourse referents (last comma necessary?)","<punctuation>"
"Earlier in the day meaning?","<american-english><british-english><sentence><early-modern-english>"
"What is the word for people who deliberately listen to other people's talk?","<single-word-requests>"
"A word for speaking for an animal?","<word-choice>"
"What's the difference between segregate and separate as verb?","<differences>"
"Tautology and Redundancy difference","<meaning>"
"Words develop their opposite","<etymology><antonyms><auto-antonyms>"
"Word for an entity, specifically a city, which is of the same nationality as you?","<single-word-requests><adjectives>"
"Question instead of simple sentence","<questions><cinema>"
"Inexplicable 'it'","<pronouns><syntactic-analysis><dummy-it><antecedents>"
"Comma and dash introducing a list","<punctuation><commas><dashes>"
"What does the word “trip” exactly mean in English?","<meaning><nouns>"
"""What I have, I give [it to] others""","<word-choice><grammaticality><pronouns><repetition>"
"""Confined in the case"", ""confined on the bus""","<word-choice><grammaticality><prepositions><collocation>"
"Inversion or no inversion after ""only""?","<adverbs><subject-verb-inversion>"
"What's the word which means something that can be used in many different situations?","<single-word-requests>"
"""I've been looking to do [this or that]."" Is ""looking to do"" idiomatic?","<phrases><idioms>"
"Which is a better and commonly used word, Bulk or Batch?","<word-choice><expressions>"
"Grapes and vintners","<meaning><grammaticality><sentence>"
"Should a taunt, which is grammatically correct as a question, be treated like a question or a taunt","<questions>"
"Why do we say ""he asked after you"" not ""he asked about you""?","<grammar><etymology>"
"The number of an uninflected pronoun","<grammatical-number><pronouns>"
"Punctuation with Abbreviations","<punctuation><abbreviations>"
"More issues with the predicate nominative","<grammatical-case>"
"""I have been reading your letter with pleasure""?","<tenses><perfect-aspect><continuous-aspect>"
"Is the term ""breadwinner"" still widely accepted?","<word-choice>"
