title,tags
"curl ethereum -d question","<external-api>"
"Vyper and ethereum: how do I read a public constant function on another contract?","<vyper>"
"Truffle Exec Return Events","<truffle><javascript><events>"
"ICO and Token both together","<ether><tokens>"
"How overflows work in solidity?","<solidity><overflow>"
"Run testnet in a cluster","<go-ethereum><blockchain><mining>"
"Nested structs that are part of a mapping broken in Solidity 0.5.0?","<solidity><struct><bug><compiler>"
"Can I send/transfer data from Smart Contract to an EOA?","<solidity><eoa>"
"How can I create a copy of an existent contract in Javascript ?","<web3js-v1.x>"
"Modifier to only allow access via staticcall","<solidity><contract-development><contract-design><modifiers><optimization>"
"what does memory hard mean in ETH POW?","<proof-of-work>"
"Why is geth account list and eth.accounts different?","<go-ethereum><metamask>"
"Is it possible to interact with a contract deployed within another contract via web3js?","<solidity><web3js><contract-design>"
"function gas calculator and function gas padding","<gas><gas-price><gas-estimate>"
"Issue in understanding MintedCrowdsale in the ICO contract from openzeppelin","<solidity><ico><openzeppelin-contracts>"
"How to handle dynamic size string array in solidity?","<solidity><contract-design><storage><arrays><string>"
"Using web3.py, I get a key error when connecting to a remote server with 3 nodes running (autoconnect works fine)","<web3.py><python><web3-providers>"
"Smart contract function throwing error in remix","<contract-development><remix><presale>"
"Meta-transaction explanation","<meta-transactions>"
"The use of ERC20 tokens in a private ethereum network","<contract-development><contract-design><ether><erc-20>"
"What is the range of the random number generated by this code?","<solidity>"
"How does lower network bandwidth and lower latency create a bottleneck for POS Blockchain network?","<proof-of-stake>"
"Is payable fallback function not always invoked?","<fallback-function>"
"solidity two dimentional mapping or array","<solidity>"
"Is it possible to split single Solidity contract across multiple files?","<solidity><contract-development>"
"loop to find the highest value in an array","<solidity><arrays>"
"How to catch solidity contract revert message using web3j","<solidity><go-ethereum><web3js><web3j><revert-opcode>"
"Web3JS incorrect return value","<solidity><web3js><remix><javascript>"
"Transaction cannot found when using debug.traceTransaction","<go-ethereum><geth-debugging><transaction-trace>"
"What is the purpose of Private Blockchain?","<ether><mining>"
"Solidity - Is it possible to sort an Array of Structs? - UnimplementedFeatureError","<solidity>"
"getting the latest holders address:balance for a smart contract","<contract-development><events>"
"web3 - call a variable, wait, get variable, wait, loop, get vars in loop, wait and do action","<web3js>"
"How to fix a web3.py HTTPConnectionPool read timeout error","<web3.py><python><web3-providers>"
"How to display formatted transaction information in Remix IDE from web3.eth.getTransactionReceipt()?","<remix><events><logs>"
"Is there any connection between Serenity Market and Ethereum 2.0 (codename Serenity)?","<exchanges>"
"Ethereum source code build in Windows","<go-ethereum>"
"Why the need for different tokens?","<ethereumj>"
"Geth command line - load JavaScript file on startup with console","<go-ethereum>"
"Truffle - deploy and interact with a contract locally from a script","<solidity><truffle><contract-deployment><nodejs>"
"Canceled a transaction and no longer saw my ether in metamask wallet","<transactions>"
"Solidity-how to transfer ether from an account to a smart contract as deposit","<contract-development><accounts>"
"Does every solidity contract need to be migrated individually in truffle?","<solidity><truffle>"
"Geth console - list active RPC connections","<go-ethereum>"
"im getting an error when trying to deploy my contract in rinkeby network..?","<go-ethereum><truffle><rinkeby><truffle-hdwallet-provider>"
"How to assign a value to a bytes variable?","<solidity><bytes>"
"sendTransaction returns Invalid JSON RPC response","<web3js><transactions><json-rpc>"
"Gas estimation failed error:Can someone help me to resolve this error,Many thanks","<blockchain><remix><metamask><pending-transactions>"
"mist ""Error: Cannot find module index.js"" on ubuntu","<mist><ubuntu>"
"starting geth node with db facility","<go-ethereum><rpc>"
"How to call fallback function because non existing function using truffle console?","<solidity><truffle><fallback-function>"
"Is there any advantage of using localhost as testnet in Metamask?","<metamask><dapps><testnets><ganache-cli>"
"Best Practices for Getter Function","<solidity><web3js>"
"truffle init function is showing an error on my Ubuntu 18.04 system","<truffle><blockchain><ubuntu>"
"buyTokens throws error when is is getting called","<solidity><ethereum-wallet-dapp><openzeppelin><openzeppelin-contracts>"
"How to find whether a call in debug trace has out of gas error?","<gas><contract-debugging><out-of-gas><trace>"
"error deploying token to ropsten using remix","<solidity><go-ethereum><remix><tokens><ropsten>"
"I have my public key and seed phrase, but private key is lost (MetaMask)","<metamask><private-key><public-key>"
"Uncaught: Error: Returned error: VM Exception while processing transaction: invalid opcode","<solidity><truffle>"
"Off chain random matchmaking","<solidity><off-chain>"
"How do I know if I am connecting to uniswap factory mainnet or testnet if the contract addresses are common for both?","<web3js><truffle><contract-invocation><uniswap>"
"How to get data location for string > 31 length","<solidity><storage><assembly><keccak>"
"Error: Unhandled Rejection (Error): This contract object doesn't have address set yet, please set an address first?","<truffle><metamask><react>"
"Should mining multi-gpu rigs dedicate a gpu to each incoming job or...?","<mining><mining-pools><gpu><ethash>"
"UnhandledPromiseRejectionWarning: Error: nonce generation function failed or private key is invalid in Ganache","<go-ethereum><golang><modifiers><revert-opcode><ganache-cli>"
"eth mainnet syncing took 2 weeks or more and still syncing","<fast-sync>"
"Why ethereum transaction fee has increased so high?","<fees>"
"How does this contract scam work?","<solidity>"
"What does data represent in the uniswap swap function?","<uniswap>"
"Chainlink wrong address","<ether><erc-20><etherscan><chainlink>"
"Does Ethereum 2.0 have privacy on state variables?","<solidity><ethereum-wallet-dapp>"
"how come i can generate keys using bip39 with only one words as seedphrase/mnemonic without any error?","<ethereum-wallet-dapp><private-key><mnemonic>"
"Etherscan like contract explorer for network deployed on localhost","<contract-development><myetherwallet>"
"Solidity inline assembly not compiling","<solidity><contract-development>"
"Difference between a byte in a bytes32 and a byte in a bytes structure","<solidity><data-types><type-casting>"
"Conditional in assembly","<assembly>"
"Does an underscore before an existing function name have a special meaning in solidity?","<solidity><uniswap>"
"How do purchase contracts in DAPPs get to know when someone made a payment in fiat?","<solidity><contract-development>"
"(JS) Wait until web3 has been established before running function","<web3js>"
"How to get require() error message?","<solidity><etherscan><solidity-0.5.x><revert-opcode><receipts>"
"""Cannot retrieve ENS addresses unless fully synced on main chain"" message","<solidity><go-ethereum><mist><ropsten>"
"What is ETH useful for appart from being a cryptocurrency? Does it have something specific due to smart contracts?","<ether><tokens><dapps>"
"Does externally owned account have two parameters (""codehash"" and ""storage root"")?","<storage>"
"Why is eth.accounts[0] undefined","<go-ethereum><accounts><password>"
"Python ethereum create account using web3.py","<web3.py>"
"Iterating through events","<web3js><events>"
"Simple clock sync to avoid time drift.","<mining><solo-mining>"
"Accessing Web3 in trufflebox's react-auth-box","<web3js><truffle><javascript><react><truffle-box>"
"Pricing when creating a contract from another contract","<contract-deployment><gas>"
"Do transactions/call to functions of smart contracts ever happen in parallel/concurrent manner?","<solidity>"
"Import unencrypted private key into ethereum wallet","<myetherwallet><private-key><import>"
"Quorum: Generating Public Key for a Given Address","<public-key><quorum>"
"Deploy Contract (compiled by Truffle) without using Truffle","<solidity><contract-development><web3js><truffle><contract-deployment>"
"Geth response: invalid content type, only application/json is supported","<go-ethereum><json-rpc>"
"What happens when contract is making delegatecall to deleted contract?","<solidity><parity><delegatecall>"
"Cant see mining reuslt on ethermine","<mining><mining-pools><claymore><solo-mining>"
"Are there any rinkeby testnet faucets that don't require social network accounts?","<faucets>"
"Balances are different","<go-ethereum><transactions>"
"Warning: Uninitialized storage pointer","<storage>"
"transfer ether from smart contract wallet to normal wallet","<ether><contract-design><contract-invocation><contract-deployment><internal-transactions>"
"Struct variable of type enum not getting updated","<solidity><struct>"
"Private key needed or not for sending transaction in ethereum","<web3js><web3.py>"
"How send bytes32 in web3.py?","<web3js><python>"
"What are the average transaction propagation times in Ethereum for reaching 50% and 95% of nodes?","<statistics><transaction-propagation>"
"Function call of other contract","<solidity><contract-development><contract-invocation>"
"TypeError in Array Traversal","<solidity><arrays>"
"Send back to back signed raw transaction","<web3js><transactions><nonce>"
"web3.eth.accounts is Empty","<web3js><testrpc><accounts>"
"Distributing tokens to 1000 addresses","<mist>"
"Truffle Compile Error (Invalid input source specified, Compilation Failed)","<contract-deployment><truffle-compile>"
"TypeError: Greeter.deployed(...).setGreeting is not a function","<truffle><contract-deployment>"
"Smart contract event showing ""Uncaught TypeError: contract_instance.NumberIsIncreased is not a function""","<solidity><go-ethereum><contract-development><web3js><events>"
"Importing files from an ""outside"" folder","<solidity><solc><import>"
"Accepting bitcoin during crowdsale and making refund if soft cap not reached","<solidity><erc-20><ico><crowdsale><bitcoin>"
"Web3j - sending erc20 token","<go-ethereum><mist><tokens><erc-20><web3j>"
"How to generate ethereum address derived from xpub in PHP?","<go-ethereum><ether><private-key>"
"Where are keystore of testrpc?","<testrpc>"
"Is there a readable (less formal) version of Ethereum Yellow Paper?","<yellow-paper>"
"How to access ethereum smart contract(already deployed) in a Java application via its address using web3j?","<ethereum-wallet-dapp><ethereumj><web3j><java>"
"Exchange messages between two clients of Dapp without spending gas?","<transactions><gas><whisper><message>"
"How does whisper work in Ethereum?","<whisper><message>"
"Reduce gas usage in contract that creates other contracts","<solidity><truffle>"
"Why do some tokens have a Max Supply value on CMC while others do not?","<tokens>"
"Compile errror in remix doesn't make the thing clear","<ethereum-wallet-dapp><tokens>"
"Truffle develop (Ganache) increase block gas limit","<solidity><truffle>"
"how to get how much eth adress put into crowdsale contract?","<solidity><tokens><erc-20><crowdsale>"
"Create a child contract from parent contract via remix","<solidity><contract-development><remix>"
"Invalid opcode on estimateGas","<contract-development><contract-deployment><gas-estimate><invalid-opcode>"
"How store ETH in a smart contract","<solidity><addresses><cpp-ethereum>"
"Must I run node and compile/migrate contracts on AWS Instance for WebDapp?","<go-ethereum><truffle><nodes><rinkeby><aws>"
"What caused this error: Attempting to run transaction which calls a contract function, but recipient address is not a contract address","<truffle-migration><clients>"
"How can I set the gas price while deploying a contract with web3.js?","<go-ethereum><web3js><remix><gas-price><rinkeby>"
"Truffle testcases with msg.value","<solidity><truffle>"
"Does ETC have wallet which can use multi-signature wallet contract like Ethereum Wallet For ETH","<wallets><ethereum-classic>"
"If I set private blockchain, will the dapp be private only?","<private-blockchain><dapps>"
"How do companies register ICO ticker","<ico>"
"creation ERC721 error: Transaction failed, invalid address,","<tokens><erc-721>"
"What are the hex outputs in a truffle migrate?","<truffle>"
"What bad things could happens if Geth RPC is public?","<go-ethereum><security><json-rpc>"
"What are the inputs to the truffle Txn?","<go-ethereum><truffle>"
"Is there a way to generate a mnemonic recovery phrase for an account on a private Ethereum chain?","<go-ethereum>"
"see Ethereum USD value at time of transaction?","<transactions><blockchain><bitcoin><price><blockchain.info>"
"How to give struct members default values","<solidity><contract-development><contract-deployment>"
"Does the web3.eth.contract.new error object has a transactionHash?","<web3js><contract-deployment>"
"How can I delete element then return him in function?","<solidity><contract-development><arrays>"
"Parity dev chain automine","<private-blockchain><parity>"
"Etherscan verification purpose","<contract-deployment><etherscan>"
"send data & ether to other contract in the same method","<solidity><remix>"
"A possible method for safe random number in lotteries","<solidity><randomness>"
"Storage trie - are trie nodes reused for two contract instances with the same storage content?","<evm><merkle-patricia-tries><state-trie><storage-trie>"
"Struct (array) or mappings?","<solidity><ether><struct>"
"How do I download an entire array using web3?","<web3js><synchronization><arrays>"
"How does bitrex transfer ethereum coins to ETC and viceversa","<wallets><wallet-transfer>"
"Mappings inside functions to filter query","<contract-design><storage><mapping><query>"
"Mappings can not be assigned to error","<erc-20><contract-debugging>"
"Error transferring balance. Runs out of gas","<solidity><remix><gas>"
"How to get the miner address of a block with infura Rinkeby endpoint?","<mining><json-rpc><infura><rinkeby><clique>"
"which is a better method to use for signing messages between two parties in web3?","<web3js><metamask><ethereumjs><state-channels>"
"If I create an ERC-20 token and accept dollars from people in exchange of my ERC-20 token, would this be an asset-backed token?","<ether><erc-20><ico>"
"How can I apply an effect to an address for a set time?","<solidity><erc-20>"
"Head of blockchain fall back to 0 after unsafe shutdown, how to reset it to the latest?","<go-ethereum><blockchain>"
"Expected identifier but got reserved keyword 'reference' Product public reference; ^-------^","<solidity><contract-development><remix><error>"
"How use SSL between geth nodes communication?","<go-ethereum><poa>"
"Determine current stage in smart contract","<solidity>"
"Adding the delta to a token transfer","<solidity><contract-development><contract-design><remix><cpp-ethereum>"
"How do I load the `web3` module using the html `script` element?","<web3js><nodejs>"
"Error while installing web3@1.0.0-beta.26 on Windows 10","<web3js><nodejs>"
"Is gas limit constant for regular transfers?","<gas><gas-limit>"
"Pass hexadecimal literal to contract using web3js","<solidity><web3js><remix><hex>"
"how can i translate the ethers.js ""getSigner"" utility to web3?","<web3js><contract-design><web3-providers><ethers.js>"
"Problem with loading my front end local host due to metamask","<metamask><ganache>"
"Error: Invalid JSON RPC response | ropsten.infura","<contract-deployment><ropsten><truffle-migration><infura>"
"Why is the holder balance more than total supply? Why has nothing been sent to the contract?","<solidity><erc-20><etherscan>"
"Why is my code calculating incorrectly?","<solidity><erc-20><etherscan>"
"Is there a reason why minting is excluded in erc721 interface?","<solidity><erc-721>"
"Mapping not updating?","<solidity><erc-20><etherscan>"
"What does mutability guarantees mean in erc721","<erc-721><payable><interfaces>"
"Getting Tx is not a constructor when executing this program","<web3js><javascript>"
"TypeError: Wrong argument count for function call: 2 arguments given but expected 1. Use abi.encodePacked","<solidity><abi><randomness>"
"Debit a user's wallet on a blockchain without its validation?","<wallet-transfer>"
"It is very slow to sync by parity in archive mode","<parity>"
"How can I send an Anonymous event (In ABI, anonymous==true) in Solidity?","<solidity><events><abi>"
"Why is my calculation broken?","<solidity><remix><safemath>"
"can etherscan.io show local ganache transaction details?","<tokens><metamask><dapps><openzeppelin-contracts>"
"Event to alert when receive a token","<solidity>"
"What are the parameters for the ideal gas limit?","<solidity><gas-limit><gas-price>"
"How does EIP-55 prove a string is ACTUALLY a valid Ethereum address?","<addresses><eip><checksum>"
"Who is msg.sender in a nested call chain?","<solidity><contract-development><transactions><contract-design><contract-invocation>"
"Solidity: Saving arbitrary data into bytes array and later parsing it","<solidity><assembly>"
"How to add a custom JSON-RPC endpoint to geth?","<go-ethereum><private-blockchain><json-rpc>"
"Deploy contract dynamically based on user request","<web3js><truffle>"
"pending transaction blocked on a local private node","<web3js><private-blockchain><pending-transactions>"
"Marketplace Smart Contracts","<blockchain><ether><dapp-development>"
"Invalid transaction v,r,s values with geth when reading from of signed MEW RLP transaction","<go-ethereum><transactions><raw-transaction><rlp>"
"Smart Contracts and symmetric encryption","<transactions><encryption>"
"Oraclize on Ropsten","<oracles>"
"Is it possible to tell whether an address is mist, mew or parity?","<mist><wallets><parity><cpp-ethereum><myetherwallet>"
"How to use my created token, a coin, on my created smart contract?","<solidity>"
"Rinkeby transaction taking too much time","<transactions><rinkeby>"
"How to check do I remember password from ethereum wallet at Mist?","<mist><password>"
"How to deploy truffle contracts to Rinkebey?","<truffle><contract-deployment><metamask><truffle-config><rinkeby>"
"How do you call a function of a deployed contract from another contract?","<solidity><contract-invocation>"
"Unlock contract deploy address in Truffle testing using TestRPC?","<solidity><truffle><testrpc>"
"Can I do contract transactions with metamask?","<transactions><metamask>"
"Can I use delegatecall in a transaction?","<solidity><transactions><assembly><delegatecall>"
"Will existing contracts behave differently when REVERT is implemented by Metropolis?","<solidity><metropolis><revert-opcode>"
"Will I be able to mine having my whole blockchain imported using the ""light"" syncmode?","<go-ethereum><mining><synchronization>"
"Ethereum Consortium Blockchain Designed to be Proof of Concept or Production Ready","<microsoft-azure>"
"Issues with Parity's send transactions and deploying contracts","<transactions><parity><mac-osx><ropsten><pending-transactions>"
"Is there a way to read a data structure(eg:mapping) of a smart contract?","<blockchain><ens>"
"ReferenceError: artifacts is not defined running Truffle Test","<truffle>"
"Error: Documented parameter ""{uint"" not found in the parameter list of the function on Solidity 0.4.11","<solidity><contract-development><multisignature>"
"Typed setx gpu_max_alloc_percent in cmd","<go-ethereum>"
"Can I make a transaction that sends funds directly to the address an ENS domain resolves to?","<transactions><accounts><ens>"
"Calculating Gas Remaining at Specific Point in Execution of Contract","<solidity><gas><gas-estimate>"
"how to send my precrowdsale funds to crowdsale contract?","<contract-debugging>"
"Jaxx ether wallet - loss of ether","<myetherwallet>"
"how can I detect if an address contained a contract that called selfdestruct?","<web3js><selfdestruct>"
"How was this contract created with empty code?","<contract-deployment>"
"What's the difference between Ethereum blockchain and Ethereum Classic blockchain?","<blockchain><ethereum-classic>"
"Full node - network upload status","<go-ethereum>"
"How to choose an account to deploy a contract in truffle","<truffle><contract-deployment><truffle-config>"
"Is an ERC20 token more of an 'IOU' token or is it capable of being a stand-alone crypto?","<contract-development><wallets><erc-20>"
"Getting ""data"" for JSON RPC eth_call","<contract-invocation><json-rpc>"
"Limit geth/parity node synchronization network usage","<go-ethereum><synchronization><parity>"
"Difference between security deposit and stake in Casper?","<casper>"
"Is it more efficient to create multiple contracts or one contract with lots of storage?","<contract-design>"
"Batching transactions to reduce fees","<go-ethereum><ether>"
"Implementing a reinforced invoice?","<solidity><contract-development><transactions><contract-design><contract-invocation>"
"What does it mean by smart contract state.Where they get stored?","<contract-development><state-transition>"
"Cannot deploy contract in remix with my Metamask","<parity><remix><metamask>"
"How to setup a Dapp developer fee?","<dapp-development><fees>"
"What would be the probability for miners having very low gas price to deploy a transaction?","<transactions><gas><gas-price><miner>"
"What attacks could be performed without a solution to ""nothing at stake"" (security deposits)","<proof-of-stake><casper>"
"How can a smart contract run when receiving ether directly, not through a function?","<ether><payable>"
"In Casper, theoretically how many validators could participate in consensus-by-bet (at any given block)?","<casper>"
"How to modify the gasLimit of the private block chain on the console","<go-ethereum><ether><cpp-ethereum><ethereum-classic><golang>"
"Can a miner ""cheat"" my lottery smart contract?","<transactions><ether><miner><payable><randomness>"
"how to sign a smart contract and transaction.If somebody does not sign the contract,does it means that he is or not part of the network?","<contract-development><transactions><signature>"
"myetherwallet +Advanced: Add Data","<wallets>"
"Better pattern to detect web3 default account when using metamask","<web3js><javascript><metamask><web3-providers>"
"Solidity: Can modifiers be marked payable?","<solidity><modifiers>"
"Out of gas error deploying library","<go-ethereum><solidity><out-of-gas><library><morden>"
"Throw not generated when accessing mapping with invalid key","<solidity><mapping><struct><exceptions>"
"Missing File from Mix IDE Install Package for Windows","<windows><installation><mix>"
"Interface order of functions","<solidity><mist><remix>"
"Is it possible to sign transactions offline in Mist?","<transactions><mist><signature><offline>"
"How to install solidity in Visual Studio?","<solidity><contract-deployment><installation><visual-studio>"
"What does it mean that Ethereum is ""turing complete""","<blockchain><turing-completeness>"
"How do I send an arbitary message to an Ethereum address?","<transactions><dapps><whisper>"
"Is there an Ethereum trading website which allows overlaying of trade entry and exit points over their chart?","<exchanges><poloniex>"
"What is the best way to represent infinity in Solidity?","<solidity>"
"Visual Studio Code Ethereum tutorial","<solidity><contract-development><visual-studio-code>"
"What is the difference between a static node and a trusted node?","<go-ethereum><nodes>"
"What is the composition of the blockchain database?","<blockchain><storage><memory><database><leveldb>"
"Which password is required to unlock my accounts?","<go-ethereum><accounts><keystore><recovery><password>"
"How do I set the nonce for raw transactions?","<go-ethereum><json-rpc><raw-transaction><nonce>"
"Check if Contract variable is undefined","<solidity><contract-development>"
"network port udp:30303 could not be mapped: no UPnP or NAT-PMP router discovered","<go-ethereum><network>"
"Checking zero value of structure","<solidity>"
"Mac [El Capitan], Mist is stuck on block 1,150,006","<mist><synchronization><homestead><mac-osx>"
"Catch on throw from contract","<solidity>"
"Getting a contract by address only (without ABI definition)","<web3js>"
"Can anyone help guide on running two geth clients on the same box and same network?","<go-ethereum><synchronization><datadir>"
"How to get the running instance of a Contract","<solidity><truffle>"
"Deploying new contract in transaction MIX IDE","<solidity><contract-development><contract-deployment><mix>"
"How to convert a bytes32 to string","<solidity><string><bytes32>"
"Convert with JS a Solidity bytes32 to a Solidity string","<solidity><web3js><dapp-development><string><bytes32>"
"What are the options that the web3.js solidity compiler passes to solc?","<solidity><web3js><clients>"
"Ethereum Difficulty History? Percentages not a chart","<mining><difficulty>"
"Is there a way to find an account's current transaction nonce?","<go-ethereum><contract-development><web3js><json-rpc>"
"constant versus public in solidity functions","<solidity><contract-development><mix>"
"Common useful JavaScript snippets for geth","<go-ethereum><javascript>"
"How can I import accounts created by quorumwallet into Ethereum Wallet Mist?","<mist><wallets><accounts><ethereum-wallet-dapp>"
"How do I decrease the difficulty on a private testnet?","<mining><testnets><difficulty>"
"Is it convenient to use mappings as temporary KeyValue instances?","<solidity><evm><storage><arrays><mapping>"
