title,tags
"Uncaught (in promise) Error: Returned error: oversized data when calling the set method for a very large cipher string","<web3js><truffle><quorum>"
"How can I easily get the Ethereum 2.0 network's fork digest and fork version?","<eth-2.0><p2p><libp2p>"
"How to check if a particular address is already present in an array","<contract-development><addresses>"
"how to create hierarchical blockchin using Geth, ethereum?","<go-ethereum><contract-development><private-blockchain>"
"Error syncing new node on private network:no peers available or all tried for download","<go-ethereum><synchronization>"
"Updating ERC-721 Token's Metadata after it was Minted","<solidity><go-ethereum><blockchain><erc-721><nft>"
"Revert error on delegated transfer function","<solidity><go-ethereum><truffle><tokens><web3j>"
"Why is my view function running out of gas when reading from mapping/HashMap?","<contract-development><evm><vyper>"
"Front running, events, off-chain and on-chain","<solidity><web3js><txpool>"
"infura return null when eth_getTransactionReceipt","<web3js><infura><php><sendtransaction>"
"Need of writing tests again and again","<remix><dapps><testing>"
"Block gas limit lower than required to deploy a contract","<contract-development><ropsten>"
"Issue about connecting with WalletConnect by using the example of Web3Modal","<web3js><walletconnect>"
"Bundling two assets in a contract and issuing shares for them","<contract-design><defi>"
"Returning ERC20 tokens accidentally sent to the DAI contract","<erc-20><contract-invocation><dai>"
"Restoring a mnemonic seed with one missing word","<ethereum-wallet-dapp><recovery>"
"best way to get transaction timestamps?","<web3js><transactions><ethereumjs><timestamp>"
"How to test your smart contract against currently existing ones on mainnet locally using Truffle?","<truffle><contract-deployment><ganache><truffle-migration><compilation>"
"Where to define the MetaMask window.ethereum.on Listener","<go-ethereum><metamask><javascript><nodejs>"
"A proxy for an upgradeable contract returns a wrong value","<solidity><contract-development><bug><upgrading><contract-upgrading>"
"Is it possible to work with stable coin currency in Ethereum smart contracts using solidity?","<contract-development><tokens><stablecoins>"
"Solidity ; not required after enum statement","<solidity><remix>"
"Simple way to find the exact address / transaction by the part of the address / transaction hash?","<transactions><addresses>"
"How to execute the Transfer function from Remix","<remix>"
"Why can smart contracts receive ETH but not other ERC-20 tokens?","<contract-development><contract-design><tokens>"
"how does contract cost less gas in structs?","<contract-development><contract-design><contract-deployment><contract-invocation>"
"How to declare an array of structs as storage variables?","<solidity>"
"why separate assignments are better than single?","<contract-development><contract-design><contract-deployment><contract-invocation><contract-debugging>"
"Private key or password for Account that is deployed on remix","<private-key>"
"Assigning variables to multiple fields in a structure","<solidity><contract-development>"
"Transaction Error. Exception thrown in contract code. REVERT","<contract-development><blockchain><metamask><etherscan>"
"Divide or not to divide in a smart contract?","<contract-development><gas><events><gas-price>"
"What are the Ethereum 2.0 testnets?","<testnets><eth-2.0><beacon-chain><medalla><spadina>"
"Deposit Ether into a Contract","<contract-development><remix>"
"contract inline assembly - return array parts by using assembly","<contract-development><contract-design><contract-deployment><contract-invocation><contract-debugging>"
"geth mainnet fast sync appears stuck at around 100 blocks from highestBlock","<go-ethereum><fast-sync><mainnet>"
"Uniswap transaction fails with TransferHelper: TRANSFER_FROM_FAILED","<uniswap>"
"How do I send multiple transactions as one transaction?","<web3js><transactions><tokens><dapps>"
"Quorum vs Private network Ethereum blockchain","<private-blockchain><quorum>"
"Pass json of address to Contract","<solidity><contract-development><truffle><json-rpc>"
"java.lang.ClassCastException: org.bouncycastle to error while creating wallet using web3j","<web3j>"
"Trying to figure if blockchain has finished downloading.","<go-ethereum><blockchain><mastering-ethereum>"
"Solidity test file reaches gas limit due to imports","<solidity><truffle><testing><ganache>"
"Is there any protection in the Ethereum consensus or network protocol to avoid a block being mined with a timestamp 1000 years ahead of UTC time?","<timestamp><datetime>"
"Not able to decode the input data from transaction using web3j","<web3j><raw-transaction>"
"problem I have 200 gb hard disk this will be a problem when downloading the blockchain geth ethereum","<go-ethereum>"
"Quorum: permissioned-nodes.js and static-nodes.js","<quorum><permissioned-chain>"
"getting error TypeError: Member ""transfer"" not found or not visible after argument-dependent lookup in address","<solidity><contract-development>"
"What is the default license for solidity code released to the blockchain?","<solidity>"
"can an ethereum contract control alternative assets like btc?","<go-ethereum><wallets><ethereum-wallet-dapp>"
"""Cannot import url"", ""File outside of allowed directories"" using --standard-json","<solc><import><solcjs>"
"Storing keccak hash in bytes32","<solidity>"
"How to save and retrieve the investors address in a crowdsale contract","<solidity><erc-20><myetherwallet><ico><airdrop>"
"Web3JS throws InvalidResponse without Ganache core ever receiving a request?","<solidity><web3js><json-rpc><solc><web3-providers>"
"What is BlackList and why it is used in Tether Token Smart Contract? And what is the use of Pause and Unpause in Tether?","<contract-development><transactions><blockchain><tokens>"
"web3.eth.getBalance(...).then is not a function","<web3js><etherscan>"
"Can solidity alone suitable for ICO project?","<solidity><exchanges>"
"Is there a way to calculate gas usage of external function call?","<solidity><gas-estimate>"
"is it possible to get events from transactions that are in the `txpool`?","<transactions><events><pending-transactions><txpool><decentralized-exchange>"
"Can I send transaction to a view|pure function?","<solidity><web3js>"
"The cost of using Ethereum as a reference database","<gas><storage><gas-price>"
"Getting the last synced block is 0","<go-ethereum><synchronization><blocks><fast-sync>"
"Transfer ETH using third party","<go-ethereum><web3js><ether><etherscan><web3j>"
"web3 python installation failes #include ""Python.h"" error: command 'x86_64-linux-gnu-gcc' failed with exit status 1","<web3.py><python>"
"Need to use function modifiers however little confuse when implement and how","<solidity><contract-development><contract-design><contract-debugging>"
"IncreasingPriceCrowdsale breaking TimedCrowdsale","<openzeppelin-contracts>"
"Dataset for Ethereum applications","<blockchain>"
"How can I execute transferFrom function in node js","<solidity><go-ethereum><blockchain>"
"Getting ParserError: Expected ',' but got 'payable' and also one important security issue with contract","<solidity><contract-development><contract-design><security><contract-debugging>"
"Why is multidimensional array declaration order reversed?","<solidity><arrays>"
"TruffleContract At() function with Drizzle","<truffle><dapps><truffle-contract><drizzle>"
"Is there a way for a smart contract to manage a codebase?","<contract-design><contract-deployment>"
"How do I install Mist from the pre-built binaries on 32-bit Linux?","<mist><ethereum-wallet-dapp>"
"Walk-Through Creation of a Personal Two-Factor Authentication Wallet / Contract","<contract-design><wallets><light-clients><multisignature>"
"what does the ""12 confirmations"" mean in the mist when sending transactions?","<mist>"
"How do I Zero Storage","<solidity><storage>"
"Why is this distribution not randomized?","<solidity><contract-design>"
"Store encrypted private keys on-chain","<cryptography>"
"Iterating through an array in JS and simple promises (web3/pudding)","<web3js><javascript><truffle>"
"Data storage : cost of contract size?","<storage>"
"My MyEtherWallet address is different than the first address it gave me","<addresses><private-key><myetherwallet>"
"How and from where i can learn about Ethereum Mining algorithm(including PoW)?","<go-ethereum><mining><proof-of-work>"
"How does the BTC Relay validate Bitcoin blocks?","<bitcoin><btcrelay><sidechain>"
"2 mapped structs with an address array - push not working","<solidity><arrays><mapping><struct>"
"Solidity: Initialize struct containing string array","<solidity><arrays><struct><string>"
"How to call a contract method using the eth_call JSON-RPC API","<go-ethereum><contract-invocation><json-rpc><abi><calldata>"
"Geth very slow mining in dev mode on windows","<go-ethereum>"
"Install Mist Ethereum on external HDD","<mist><blockchain><installation><keystore><hardware>"
"How do miners profit post-PoS, if at all, how will new miners get their start, and who will execute the EVM byte code (and why)?","<mining><proof-of-stake><casper>"
"Password to confirm transaction","<password>"
"How to initialize empty struct array in new struct?","<solidity><arrays><struct>"
"How can I force a redownload of the entire blockchain on the mist wallet?","<blockchain><mist><wallets>"
"how to combine two strings together","<contract-design>"
"How to export transactions into a CSV file","<transactions><accounts><export>"
"Is ethereum based on bitcoin?","<bitcoin><history><forks><altcoin>"
"How do I tell whether the Mist/Wallet is ""fast"" or ""full"" syncing?","<go-ethereum><blockchain><fast-sync>"
"Are there any alternatives for Meteor JS to build DApps?","<dapp-development><dapps><javascript><meteor>"
"How can I store big files on the blockchain?","<blockchain><storage><ipfs><swarm>"
"How are ethereum addresses generated?","<addresses><accounts><cryptography><account-generation>"
"Why the DAO contract have two reward accounts?","<the-dao><slock.it>"
"I created a wallet contract, sent ether to it and now cannot send to another account","<transactions><mist><wallets><contract-invocation><ethereum-wallet-dapp>"
"Why do smart contract languages need to be deterministic?","<contract-design><protocol>"
"error: Storage location can only be given for array or struct types","<solidity><memory>"
"Is it possible to define a smart contract as the address when mining on a pool like ethermine?","<contract-design><mining><mining-pools><coinbase>"
"Library method returns nothing","<solidity>"
"How do I print my account balances and TheDAO tokens from geth","<go-ethereum><javascript><tokens><balances><the-dao>"
"Unable to send raw transaction","<go-ethereum><web3js><cpp-ethereum><raw-transaction>"
"How to watch log for all instances of a specific type of contract?","<solidity><web3js><dapp-development><events>"
"How to run my own full node pool? (error: unexpected identifier)","<go-ethereum><cpp-ethereum><nodes><mining-pools>"
"How do I know how ""confirmed"" the result of calling getBalance API is?","<json-rpc><balances><confirmations>"
"Find address which called the method?","<solidity><contract-development><addresses>"
"Daohub transfer ownership","<the-dao><tokens><dao><dao-hub>"
"what is the use of the payload field in the ethereum transaction reciept?","<go-ethereum><transactions><blockchain>"
"How can I return an array of struct from a function?","<solidity><contract-design><contract-development>"
"Truffle vs Meteor","<truffle><meteor>"
"Geth-ing started","<go-ethereum>"
"How to quickly check Ethereum Hashing Speed?","<mining>"
"How many Ethers has the Ethereum Switzerland GmbH?","<shares>"
"Probe network for events and transactions while hosting on AWS ubuntu","<go-ethereum><aws>"
"Mining own Pool - Error reading from socket","<mining-pools>"
"geth sync status is not clear","<go-ethereum>"
"What encoding is used for Ethereum addresses?","<addresses><encoding>"
"Is there a dead man switch functionality in Ethereum? Say I died and I wanted to send all my coins to my children","<contract-development>"
"Deploying contract template using web interface & Metamask","<contract-design><dapp-development><metamask>"
"Gas cost of different computations","<solidity><gas><gas-price>"
"Ethereumjs testrpc getting 400 Bad Request when navigating to localhost:8545","<testrpc><ethereumjs>"
"Testrpc installation on Ubuntu 14.04 is failing","<testrpc><ethereumjs>"
"Creating a dapps","<blockchain><dapp-development><dapps><ethereumjs><pyethereum>"
"truffle migrate command gives Error: Invalid Json Response: """"","<truffle><testrpc><truffle-migration>"
"Why is my hashrate so low? (R9 280x at 7 mhs / GTX 960 Strix at 2 mhs)","<mining><hashrate>"
"How can I use web3 on the server","<web3js>"
"testrpc throwing 'out of gas' if same number of parameters passed while deploying as constructor","<testrpc><out-of-gas>"
"Couldnt connect to node","<mist>"
"How to get into a PoA (private) chain?","<private-blockchain><parity><proof-of-authority>"
"Hashrate of R9 280X is extremely low. Why?","<hashrate>"
"Mist reloading chain structure from scratch","<mist><synchronization><testnets>"
"Can a transaction have a negative fee?","<gas><evm><fees><opcode>"
"Can I use geth light sync for mining purpose","<go-ethereum><mining><ether>"
"Bug? Config error? geth error: admin.addPeer is unsuccessful","<go-ethereum><private-blockchain><parity><javascript><peers>"
"Compiling contract in web3: ""Method eth_compileSolidity not supported""","<web3js><contract-deployment><compilation>"
"Is next formula to calculate TX cost in euros correct?","<transactions><gas-price><gas-estimate>"
"Parity through SOCKS5 Proxy?","<parity>"
"Maintain and even restore privacy when using cryptocurrencies","<transactions><exchanges><privacy>"
"How to send Ether programatically everyday? (Centralized)","<go-ethereum><ether><wallets>"
"Mist Wallet Synch Stuck - Not coder/geek","<mist><synchronization><ethereum-wallet-dapp>"
"Is there a way to prevent transactions becoming too expensive","<ether><gas-price>"
"Ethereum Wallet takes forever to sync every day I open it. Is this practical?","<ethereum-wallet-dapp>"
"State of knowledge / research directions academic paper","<architecture><economics>"
"Pending Balance Doesn't Payout to Miner","<go-ethereum><mining-pools>"
"How many active nodes does ethereum currently have?","<nodes>"
"Can I automatically transfer Ether to a Bankaccount?","<ether>"
"Halt chain to get balance of new wallet on Ropsten?","<go-ethereum><wallets><ropsten>"
"Very high CPU usage with GPU mining","<mining><gpu>"
"How to take coins from a msg.sender? Or verify coins were sent?","<solidity><contract-design>"
"Does the Poloniex minimum deposit amount apply to mining rewards?","<mining><mining-pools><poloniex>"
"How can a transaction be out of gas but still complete?","<gas><out-of-gas>"
"What is geth doing?","<go-ethereum>"
"Why does my custom token show 0?","<mist><tokens>"
"How excatly Bancor works (for non-economists)","<tokens>"
"Can't get Metamask account in javascript","<web3js><javascript><metamask>"
"Can MetaMask be used as remote node for back end, and not require users to have plug in?","<go-ethereum><metamask><aws>"
"Is there a good way to calculate a ratio in Solidity (since there is no float/double)?","<solidity>"
"What are offchain and onchain Transactions?","<solidity><contract-development><mining><ethereum-wallet-dapp><ethereum-design>"
"Tokens standards on go-ethereum and Quorum - ERC721","<go-ethereum><quorum><erc-721><eip>"
"Detecting whether a transaction was cancelled (because a block is orphaned)","<transactions><blockchain><security><rpc><uncle-blocks>"
"function to transfer eth in solidity","<solidity><remix>"
"abi.encodePacked Is it necessary","<solidity>"
"Authenticating accounts in Ethereum using web3js","<web3js><accounts><authentication>"
"Managing ERC20 tokens with a multisignature address","<erc-20><multisignature>"
"""Gas estimation failed"" on Ropsten using MetaMask!","<remix><contract-deployment><metamask><ropsten><gas-estimate>"
"Private Ethereum Node connection with Metamask","<private-blockchain><metamask><rpc>"
"What is missing to make a successful payment between payer and recipient?","<transactions><balances><payments><state-channels><finality>"
"Can I implement 'function balance()' in a contract?","<solidity>"
"How can I use machine learning with smart contract?","<solidity><blockchain><machine-learning>"
"Is it possible to create batches of transactions without using smart contracts?","<transactions><synchronization><external-api>"
"Can the result of a call trigger the execution of a transaction?","<solidity><contract-development><truffle><contract-invocation><ethereumjs>"
"Correct way of sending Token via contract","<contract-development><erc-20>"
"What does this code return? block.timestamp / 1 days","<solidity><timestamp>"
"How to give a non-zero balance to a contract at time of deployment using Remix?","<remix><wallets><contract-deployment><accounts><balances>"
"How long do my files stay on IPFS when I upload it?","<storage><ipfs><swarm>"
"Error: VM Exception while processing transaction: revert due to require statement","<solidity><blockchain><exchanges>"
"How can I transfer half mining award to an address?","<go-ethereum><mining><consensus><address.transfer>"
"What does a position means in an ethereum Tx?","<transactions><etherscan><nonce>"
"Async/Await + Promisify Problems","<go-ethereum><web3js><javascript>"
"Truffle - Transfer leads to ""Error: VM Exception while processing transaction: revert""","<solidity><truffle><error>"
"What does it mean when a function is called in the head of constructor() function?","<solidity>"
"how can i find the contract name from the address using the etherscan API?","<ether><etherscan>"
"Unable to declare public mapping in Solidity","<solidity><contract-development><mapping>"
"In solidity smart contracts how do you access internal state variables declared in the constructor?","<solidity><state-variable>"
"what do I do with compiled interface output?","<tokens><interfaces>"
"In Quorum running raft consensus, what happens if one node attempts to modify the state via modofying the physical file?","<quorum>"
"How do I construct a call to contract return string using inline assembly?","<solidity><assembly>"
"Quorum Private Transactions and zk-SNARKS","<quorum>"
"Looking for good guide on how to deploy and verify source code of Smart Contract using Truffle/Remix","<truffle><remix><contract-deployment><verify><contract-verification>"
"Mocha test at kill() function","<truffle><truffle-test><selfdestruct><mocha>"
"How to get require message in a test case? Truffle test","<truffle><truffle-test>"
"ERC20 tokens transactions' history from Ethereum node","<web3js><transactions><erc-20><addresses>"
"Updating Smart Contract in Quorum with no change to the smart contract address","<contract-deployment><quorum>"
"Combining two 32 byte values (bytes32) into a 64 byte value","<assembly>"
"Access contract method via web3","<solidity><contract-development><web3js>"
"Nethereum C# automated ether transfer","<nethereum><c#>"
"Retrieving key value while setting mapping","<solidity><mapping>"
"My smart smart contract won't send to multiple addresses","<solidity><contract-development><contract-deployment><contract-invocation><contract-debugging>"
"creating an exchange platform based on ethereum smart contract","<contract-development><contract-design><tokens>"
"What if I don't verify a contract?","<web3js><contract-verification>"
"Error:new bignumber() not a base 16 number","<web3js>"
"How to get erc20 contract deploy time / block number","<erc-20><blocks>"
"give a certain date to a document","<solidity><contract-design>"
"Is this token code only or crowdsale code as well","<contract-development>"
"Write output into a text file","<go-ethereum><command-line>"
"Creating contract B from contract A, but address of contract B shows a contract of type A on Remix","<solidity><contract-development><remix><contract-invocation>"
"How to inherit an interface?","<solidity><truffle>"
"Is it possible to transfer ERC20 tokens without sending a transaction to the contract address?","<erc-20><etherscan>"
"Received "" VM error : revert "" while calling payable function in remix","<solidity><remix><error><payable>"
"Visa debit/prepaid card for ERC20 tokens","<tokens><erc-20>"
"web3.py - Python dtype for contract function with int256[x]","<solidity><abi><web3.py><data-types>"
"Calling Functions from Base contract","<solidity><contract-development><contract-design>"
"Is it really not possible to write a js function that takes address and returns public key?","<web3js><parity><dapps><ethereumjs>"
"What does public mean for a variable?","<solidity>"
"Dos with revert","<security><dos>"
"How to interact with a smart contract to change a variable state","<state-variable>"
"(1) Parity: why does syncing fall behind, (2) Why are events missing events because of (1)","<web3js><parity><events>"
"Start up ganache-cli ethereum client in travis CI for testing","<truffle><json-rpc>"
"Passing 13 arguments in function giving error: Stack too deep, try using less variables","<solidity>"
"Sending Ether from private Geth node to Mist Account","<mist><private-blockchain><ethereum-wallet-dapp><metamask><private-key>"
"What number types are used in web3.py","<web3.py>"
"React + Web3, making call from componentDidMount but web3 not ready?","<web3js><react>"
"Parse arbitrary bytes input","<solidity><contract-design><bytes>"
"How to create an ERC20 Faucet?","<erc-20><json-rpc><testnets><testing><faucets>"
"Destructuring function results in truffle console","<truffle>"
"Testrpc - How to turnoff writing messages to the console?","<testrpc>"
"How to test a simple payment contract","<solidity><truffle><truffle-test>"
"VS Code Syntax error when emitting events in Solidity 0.4.21","<solidity><visual-studio><visual-studio-code>"
"How to allow only the owner to transfer ERC20 tokens during crowdsale?","<solidity><transactions><tokens><ico><crowdsale>"
"Ethereum local node bootnodes not working","<go-ethereum><bootnodes>"
"Function argument quantity","<solidity><fallback-function>"
"Truffle Contract Factory Testing (Javascript)","<truffle><javascript><testing>"
"ERC223 SafeMath Functions","<solidity>"
"Is it OK to use the reset flag with every Truffle compile and migrate when using the TestRPC client?","<solidity><truffle><truffle-migration><truffle-deployment><truffle-compile>"
"Are Ethereum State Channels unidirectional or bidirectional?","<transactions><state-channels>"
"can't connect to web3 socket in mist console","<web3js><mist>"
"cpp-ethereum Current block number is 0","<private-blockchain><cpp-ethereum><console>"
"How do online wallets store users' tokens?","<wallets><exchanges>"
"Mapping not working with address type","<solidity><contract-development><remix><ropsten><mapping>"
"Getting hash of a file","<hash><sha3>"
"The reason for ""Could not find artifacts for"" in truffle?","<solidity><truffle>"
"Struct array uninitialised storage pointer","<solidity><arrays><struct>"
"What does address(0) mean?","<solidity><addresses><mapping>"
"How does the blockchain handle consistency of miner-provided values?","<blockchain><mining>"
"Remix compiler is not loading and gives ""Compiler not yet loaded."" message when attempting to force","<solidity><contract-development><remix><compiler><browsers>"
"modifier consumes all gas","<solidity><gas><modifiers>"
"Is there api way to get Token transfer data of exact token?","<etherscan><python>"
"Unserialize parameter","<solidity><contract-design><contract-development>"
"How does web3.js verify that it is geth that is listening on port 8545?","<web3js><security>"
"How can I create a contract with a default value","<solidity><contract-development>"
"Find contract address inside the contract?","<contract-development><contract-debugging><addresses>"
"How to fix the ""Incorrect usage"" error when using the Embark framework with geth","<go-ethereum><embark>"
"Encode method signature and parameters using Go-Ethereum","<go-ethereum><json-rpc><golang>"
"Saving ether from a corrupt ether wallet","<wallets><bug><myetherwallet>"
"Why can't I send ETH? (Mist 0.7.2 OSX Yosemite)","<go-ethereum><mist><synchronization><mac-osx><bug>"
"Is geth command line and mist Wallet UI console the same thing?","<go-ethereum><mist>"
"Returning a struct and reading via Web3","<solidity><contract-development><web3js><struct>"
"What happens if I call .at() with an invalid address?","<web3js><contract-deployment>"
"Getting 'invalid opcode' error","<solidity><contract-development><contract-debugging><invalid-opcode>"
"Does Ethereum have a payment URI like Bitcoin?","<mist><bitcoin>"
"My C: drive in my WINDOWS PC is almost full. How can I change both geth and Mist path to relocate my blockchain files?","<go-ethereum><mist><wallets><windows><datadir>"
"Mining Performance of AMD Radeon Pro Duo","<mining><gpu><hashrate><benchmark>"
"If I installed Mist, do I also need to install geth separately?","<go-ethereum><mist>"
"Is there a way to lock my coins in an account for X days?","<contract-design>"
"What are the step by step instructions to do a multi-signature spending account with 2 of 5 people?","<multisignature>"
"Contract storage not being updated after sendTransaction","<contract-development><web3js><contract-debugging>"
"geth --exec generates: error: TypeError: Cannot access member 'input' of null","<go-ethereum><mac-osx>"
"Will I lose all mining time if I restart my miner?","<mining><mining-pools><ethminer><solo-mining>"
"How can I execute code locally at given address?","<go-ethereum><contract-invocation><command-line>"
"How to compile .sol file from the command-line?","<go-ethereum><mac-osx><compilation>"
