title,tags
"Refund Ether stored in a Contract","<solidity><contract-development><remix><mist>"
"Unknown Ethereum folder on my C drive","<blockchain>"
"Installing web3","<web3js><installation>"
"How to generate public key from private key in Rust?","<ecdsa><rust><secp256k1>"
"How Does Exchanges Implement Gas Fees for ERC20 Tokens","<ether><wallets><gas>"
"No data is deployed on the contract address!","<testnets>"
"How do I take value from array of objects?","<solidity><contract-design><remix><arrays>"
"Transaction not getting confirmed because of transfer function even after making the address payable","<solidity><blockchain><remix>"
"Reading Ledger from etherscan API vs Emitting Events","<solidity><events><etherscan>"
"Geth Clique: can change config params in genesis and still retain the existing blocks?","<go-ethereum><genesis><hardforks><forks>"
"I have question about private block chain gas structure","<private-blockchain><gas><fees>"
"Image and file storage in block chain","<private-blockchain><nodes><gas-price><ipfs>"
"Parity json.ipc file permissions","<parity><ipc>"
"Remix - Solidity IDE - Gas requirements high","<solidity><remix><ide>"
"how to get the last incoming transaction before date","<transactions><blocks>"
"Decentralized Access Control in permissioned Blockchain","<consensus><peers><access>"
"What are the correct steps to make connection and communication within one Node by creating Private Network in windows?","<go-ethereum><mining><private>"
"Set rate for crowdsale after it has ended","<ico><crowdsale><openzeppelin-contracts>"
"Boot Node issue","<go-ethereum><private-blockchain><bootnodes>"
"Connection of web3 with Ropsten","<solidity><blockchain><remix><testnets><ropsten>"
"time order when calling functions of smart contract","<dapp-development><dapps><timestamp>"
"How many Times I can Bid on Same domain name and Is There any way to increase bidding amount during auction","<blockchain><ens>"
"contract sendTransaction does not return transaction hash","<web3js><truffle><react>"
"What is the work of self destruct in a contract?","<attacks><solidity>"
"Inspecting IPFS files","<blockchain><ipfs>"
"Truffle Migrate Error: Could not find built Migrations contract: Unexpected token in JSON at position 0","<truffle><truffle-migration><mac-osx>"
"Address checksum Solidity implementation","<solidity><addresses><checksum>"
"Programmatically send ERC20 tokens to user wallet. How does transfer work?","<ether><c#>"
"Mineable Tokens? Is it possible? If so, how can I make one?","<go-ethereum><tokens><wallets><mist><ethereum-wallet-dapp>"
"Format of Event logs structure in Remix","<solidity><remix>"
"Does network latency significantly affect mining rewards?","<mining><network>"
"Cannot mine at synced block with Ethereum Wallet","<go-ethereum><myetherwallet><ethminer>"
"After a successful geth fast sync, Mist began to sync all the db again","<go-ethereum><mist>"
"What is ""a public key under ECIES"", and how to get it?","<web3js><parity><encryption>"
"How to unblock transaction set a 0 fee (mistake) on Mist wallet?","<mist>"
"How can a run a 'Dev' instance and have Mist running on Geth at the same time?","<go-ethereum><mist>"
"Too little storage for sync blockchain","<mist><wallets><synchronization>"
"ethminer invalid argument: -S","<go-ethereum>"
"Parity Signer: Pending","<parity><cpp-ethereum>"
"Is there any optimal time to check ipfs-hash exist or not?","<ipfs>"
"How can I run Ethereum node to profit from transaction fees and not from minning?","<transactions><nodes><hardware>"
"Is it possible to make a Public Address only accept ETH/WEI from only Specified Address(es)?","<addresses>"
"I argue that Proof Of Stake will consolidate ether holdings rather than decentralize them. Am I wrong?","<proof-of-stake><economics>"
"How do the miners prove to have actually run the contract code that they claim the gas fees for?","<mining><contract-design><proof-of-work><ethash>"
"If I backup my ethereum wallet, and then add to it, will the backed up copy have the funds in it?","<backup>"
"Parity Ethereum on Windows : Corruption block checksum mismatch - fails to launch","<wallets><parity>"
"Which testnet? Which Linux client?","<pyethereum>"
"Is it possible to receive text messages (SMS) using ethereum?","<dapps>"
"How to show more than 10 Accounts on Parity's UI?","<parity><parity-wallet>"
"Sending ETH from Mist on testnet does not show up in Metamask account","<mist><testnets>"
"Parity Vault password lost","<parity><password>"
"Install Genoil failed","<cpp-ethereum><genoil>"
"Does the Minereum Automatic Token Creation Service Work?","<go-ethereum><contract-development><mining><contract-design><tokens>"
"Very basic newcomer question - Do you gain anything back from running Smart Contracts on the blockchain?","<blockchain><ether><gas>"
"""Push"" is not available in bytes32[], memory out of storage","<solidity><storage><arrays>"
"Calculating Percent Change in Soliidity","<solidity><remix>"
"When coins provide external service (e.g. Filecoin) how is the work done (e.g. storage) verified to earn the Ether?","<contract-design><ether><gas>"
"GPU randomly freezes all the time","<mining><linux><nvidia>"
"Parity keeps restarting warp restore","<parity><bug><warp-sync>"
"Hardware wallets and Plausible Deniability","<hardware-wallets>"
"Unable to store/retreive the value of an inherited attribute","<storage><inheritance>"
"Where are my ethers: Etherli wallet withdrawal by using Parity","<parity><recovery><pending-transactions><internal-transactions><ether.li>"
"Invalid Opcode Pushing to bytes32[] from transaction","<solidity><web3js>"
"Payable function 'charges' sender twice value sent in tx after invoking library function","<solidity><contract-debugging><library><dapp-debugging>"
"How do I update Parity's enode id?","<parity><enode>"
"Ethereum token sale api","<explorer-api>"
"Is it worth to solo with 1Gh?","<ether><hashrate><solo-mining>"
"How do I connect two peers on different machines in a private network?","<go-ethereum><private-blockchain><peers>"
"SWARM .ETH help","<swarm><ens>"
"How increase mining speed in AWS instance?","<go-ethereum><private-blockchain><aws>"
"What's the bottleneck in my geth sync?","<synchronization>"
"Which RX card for ETH mining?","<mining><bitcoin><gpu>"
"How to Debug geth Node that Won't Connect to Parity-based Private Network?","<go-ethereum><private-blockchain>"
"Send ether to a payable function from nethereum","<ether><contract-invocation><nethereum><payable>"
"How to create a dapp to provide access in browser without installing Ethereum client on Mist browser?","<synchronization><dapp-development>"
"transaction pending but now showing on MEW","<transactions>"
"What method can I use instead of delegatecall?","<solidity><delegatecall>"
"Do I need different ethereum adresses for every airdrop?","<metamask><myetherwallet><airdrop>"
"function approveAndCall error","<solidity><contract-development><contract-design><remix><erc-20>"
"How to validate ERC-20 payments into a contract?","<solidity><erc-20><payments>"
"I have a certain amount of ERC20 Tokens. How can I Create a crowdsale contract that allows me to send them to it to be sold?","<contract-development><contract-design><tokens><ico><crowdsale>"
"Truffle react with Proxy Contract of OpenZeppelin","<contract-development><truffle-contract><openzeppelin><react><proxy-contracts>"
"Help on transferFrom and Approve functions","<solidity><tokens><erc-20><address.transfer>"
"Solidity - ether transfer from contract to contract issue","<solidity>"
"Private Blockchain transactions throughput","<go-ethereum><transactions>"
"Can myetherwallet be ""hacked"" from the browser extension?","<myetherwallet><private-key>"
"What is the performance of dapps?","<dapp-development><dapps>"
"Overriding function of a deployed contract","<solidity>"
"WEB3.JS How do I configure a payable function front end with the input (DAPP)","<solidity><web3js><dapps><javascript>"
"How can I carry out the operation of ""withdrawing eth from an ERC20 contract into a wallet"" from the onchain (i.e., from another contract)?","<solidity><transactions><erc-20><address.transfer>"
"How to get all ethereum addresses?","<python>"
"value.forEach is not a function on web3 send","<solidity><web3js><metamask>"
"How can I access a contract deployed by another (deployed) contract?","<contract-development><contract-design><remix><contract-deployment><contract-invocation>"
"Casper Friendly Finality Gadget - Greater degrees of transaction/settlement finality over existing PoW?","<proof-of-stake><casper>"
"Quorum - How to guard against DDOS if there are no gas transaction fee in private enterprise blockchain","<quorum>"
"Syncmode = full, and still getting ""missing trie node""","<go-ethereum><contract-development><blockchain><synchronization><rpc>"
"ENS with Smart Contract","<testnets><ens>"
"url not parseable error in Remix Compiler","<remix>"
"Synchronous call of external contract function in Solidity","<solidity><go-ethereum><blockchain>"
"How to build a blind voting contract in Solidity","<solidity><contract-development><voting>"
"Whether Geth is safe to install?","<go-ethereum><security><user-safety>"
"Delegatecall require statement does not cause an abortion in any way","<solidity><blockchain><delegatecall>"
"What is the alternative to using the deprecated 'var' in this example code?","<solidity>"
"Division/Percentages in Solidity (a workaround)","<solidity><contract-development><contract-design><security><contract-debugging>"
"Is there any Ropsten (or any other testnet) node with whisper enabled?","<testnets><ropsten><whisper>"
"How can I upload a smart contract to the Ethereum blockchain directly from a Raspbian Terminal without Parity, Geth, etc installed?","<solidity><dapps>"
"Raiden network and publicity","<private-blockchain><plasma><sidechain><raiden>"
"addPeer() to Ethereum system with different IP address (connect with Google cloud)","<private-blockchain>"
"Uncaught ReferenceError: Web3 is not defined Solidity","<web3js><javascript><error><web3-providers>"
"Set 2 peers in 1 computer (windows), admin.addPeers return ture, but net.peerCount return 0","<go-ethereum>"
"Quorum Data Migration","<quorum>"
"is there any way to have a permanent refund contract for ERC20 tokens?","<solidity><erc-20><gas-refund>"
"Pending Transaction from locked token","<ether><myetherwallet><etherscan><pending-transactions><etherdelta>"
"Can non-default port (not 30303) be a reason for the small number of peers?","<peers><p2p>"
"Is there a difference between the call stack and the ""normal"" stack?","<solidity><assembly><call-depth-attacks>"
"eth.getBalance(<account>, <block>) returns ""Error: missing trie node""","<balances><state-trie>"
"Quorum Consensus - BAR (Byzantine Altruistic Rational) Fault Tolerance / BAR Fault Tolerance / BAR Model","<security><consensus><quorum>"
"Error in installing truffle in macOS","<truffle>"
"Who pays the expenses of running all contract codes again and again?","<gas><economics>"
"How to get the internal transaction in Javascript?","<solidity><transactions><javascript><internal-transactions>"
"ERC20 Token Total Supply, When to Mint, When to Burn?","<solidity><tokens><erc-20><ico>"
"Get a large amount of blocks with web3 (nodejs)","<web3js><nodejs><infura><websocket>"
"How do I manage unlocking accounts in a test in Truffle","<solidity><go-ethereum><contract-development><truffle>"
"Invoking internal function with enough gas","<solidity><contract-development><gas>"
"What is coinbase?","<accounts><coinbase>"
"How to deploy contract into local running node using solidity browser?","<contract-deployment><remix>"
"Contract creating another contract in a single source file","<solidity><contract-design><contract-deployment><constructor>"
"How to encrypt a message with the public-key of an Ethereum address","<addresses><cryptography><encryption><public-key>"
"Where to find the private key for my contract in blockapps?","<contract-deployment><private-key><javascript>"
"Are there any other mining clients than Ethminer?","<mining><clients>"
"How do we manage accounts for users","<solidity><web3js>"
"Passing ether with call to Solidity function","<transactions><web3js><ether><contract-debugging><contract-invocation>"
"Specifying gas amount for contract call from JavaScript","<web3js><gas><contract-debugging><contract-invocation><out-of-gas>"
"What is the merit of creating new smart contract languages like Solidity instead of using other languages?","<solidity><python><golang><architecture>"
"Calling public array of structs using web3","<solidity><web3js><arrays>"
"How does mining software choose transactions?","<transactions><mining><blocks><txpool>"
"Is it possible to establish a conditional gas limit in a transaction?","<transactions><mining><gas><evm><gas-limit>"
"Smart contracts and IoT: how will they call the physical world?","<dao><oracles><iot>"
"How do I host Ethereum on a server?","<clients><nodes><solc><server-side><hosting>"
"How does etherchain access and query Ethereum blockchain transaction data?","<nodes><explorers><microsoft-azure><query>"
"GPU can't allocate the DAG in a single chunk. Bailing?","<mining><dag><ethminer>"
"How fast should be an internet connection to mine ETH?","<mining><ether><network>"
"Risk of using BlockHash, other miners preventing attack.","<contract-development><mining><blockchain><security><mining-pools>"
"How does the system enforce correct execution of smart contracts?","<mining><security><consensus><cryptography>"
"Geth: how to unlock an account via json rpc","<go-ethereum><json-rpc>"
"How do you get a json file (ABI) from a known contract address?","<solidity><contract-development><events><remix><abi>"
"How to make miner to mine only when there are Pending Transactions?","<go-ethereum><mining><pending-transactions>"
"What is the XETH Wallet / Bitprofile?","<go-ethereum><wallets><clients>"
"What are some examples of how inline assembly benefits smart contract development?","<solidity><contract-design><contract-development><assembly>"
"Personal API documentation for JSON RPC","<go-ethereum><security><json-rpc>"
"How is contract storage arranged?","<blockchain><storage>"
"How can I expose Geth's RPC server to external connections?","<go-ethereum><json-rpc>"
"Blockchain sync on geth stalls at block 1.1 million","<go-ethereum><blockchain><synchronization><homestead><forks>"
"What can I use to interact with the Ethereum network from an Android device?","<light-clients><android>"
"How to get address from private key in java","<accounts><addresses><private-key><ethereumj>"
"Same functionality, new contract for new usage?","<transactions><contract-design><contract-invocation>"
"check msg.data in crowdsale contract, but the msg.data.length is zero","<solidity><crowdsale>"
"Gas estimation: inconcistency between Python Web3 and NodeJS Web3","<web3js><gas-estimate><web3.py>"
"Error on deploying simple contract : It seems this transaction will fail. If you submit it it may consume all the gas you send","<solidity><contract-development><mist><gas-limit>"
"DeclarationError: Identifier not found or not unique","<solidity><contract-development><remix>"
"Multiple ether wallet to single wallet","<transactions>"
"RLP decoding question","<yellow-paper><rlp><white-paper>"
"Connect to ropsten network from Node.js","<metamask><nodejs><ropsten>"
"Truffle migrate stuck at first migration","<go-ethereum><quorum>"
"eth.balance() shows random alphanumeric content","<dapps><ethereumjs><ethjs>"
"Keys and addresses terminology","<contract-development><ethereum-wallet-dapp>"
"Using oraclize function into fallback function","<solidity><oracles>"
"After truffle init I don't see MetaCoin.sol and other files expected to be there?","<solidity><truffle><ethereumj>"
"Unlock Account with Web3js Version 1.0?","<web3js><accounts>"
"Thoughts on copying state over multiple contract generations?","<dapp-development><dapps>"
"What is the Eclipse attack and how was it fixed in Ethereum?","<attacks>"
"Are event logs still accessible after selfdestruct?","<solidity><go-ethereum><events><logs>"
"I get some POST 404 (Not Found) when I deploy the IPFS webui in production","<ipfs>"
"Lost Private key","<private-key><private>"
"Address Not Getting Stored Correctly in State Variable?","<contract-design><addresses><storage><data-types><access>"
"Crowdsale Contract Merged into Token Contract","<solidity><crowdsale>"
"Solidity compile Error: Expected primary expression","<solidity>"
"How long can a string be until it spills into the next word?","<solidity><gas><storage><string><rlp>"
"errored: Error: gas required exceeds allowance or always failing transaction","<remix><gas><gas-limit><error>"
"Time Specified calls in Solidity using Oraclize","<solidity><remix><oracles><recursive>"
"IPFS code needing extra JS Scripts with Solidity","<solidity><truffle><ipfs>"
"Proof of Stake for ERC-20 Token","<ether><tokens><wallets><erc-20><proof-of-stake>"
"SHA3_512 library, convert the input and output to 512-bit bytes","<solidity><evm><sha3><assembly><hash-algorithm>"
"Truffle / Solidity - Can I call mulitple variables, simultaneously?","<solidity><blockchain><truffle>"
"how to call contract method using sendRawTransaction","<web3js><truffle-contract>"
"Trigger Function When Sent To Specific Address","<solidity><contract-invocation>"
"Could Someone Explain this Mutli-Sig Smart Contract?","<ether><tokens><multisignature><offline>"
"How can I estimate the time remaining to complete a sync?","<go-ethereum><synchronization><javascript><nodes>"
"Request multiple API endpoints in Oraclize call","<solidity><oracles>"
"How can I make my contract send out my tokens?","<contract-development><tokens>"
"How to destroy a token or list of token from a another contract?","<solidity><go-ethereum><web3js><tokens>"
"gas required exceeds allowance or always failing transaction when I try to transfer ether...","<gas>"
"contract.method.getData getData is undefined","<contract-development><web3js>"
"Solidity: Deleting a Struct from a Storage Array?","<solidity>"
"Web3.js is not installing correctly with commands ""npm install web3"", npm install web3 -latest"" and npm install ethereal/web3.js -save""","<web3js>"
"Why are lending rates on USD based stable coins so different?","<dai><stablecoins><usdt><defi>"
"Solidity Error: Struct containing a (nested) mapping cannot be constructed","<solidity><mapping><struct><solc>"
"how miners within a mining pool execute transactions and verify blocks?","<go-ethereum><transactions><blockchain><mining><mining-pools>"
"Transaction shows up on etherscan and metamask said it was sent, but my token balance is still the same","<transactions><erc-20><gas><gas-price><usdc>"
"What is the cause of an ""APPROVED"" transaction but doesnt do a ""TRANSFER"" for an ERC-20 Token?","<erc-20><transfer><erc-20-approve>"
"It's 2020 September. How big is the Ethereum blockchain when download a full node?","<blockchain><full-node><blockchain-size>"
"constructor input arguments or hardcoded values? best practice","<solidity><go-ethereum><contract-development><contract-design>"
"Error on view function call {'code': -32015, 'data': 'Reverted 0x', 'message': 'VM execution error.'}","<solidity><web3.py><chainlink>"
"Does ASIC miner works in ETH and ETC","<mining><ethereum-classic><solo-mining><powhash>"
"Is Chainlink's price reference data free to consume?","<oracles><chainlink>"
"ETH daemon not syncing from snapshot","<go-ethereum><fast-sync><aws><snapshot>"
"How to fix: Warning! Error encountered during contract execution [Out of gas]","<gas>"
"If mining is on, on an Ethereum node on EC2 AWS instance, it is unable to connnect to peers on Azure","<go-ethereum><peers><aws><p2p><azure>"
"medalla testnet launchpad requires metamask or similar","<go-ethereum><ether><metamask><wallets><medalla>"
"Why do I pay fee for reading transaction on Ropsten?","<transactions><ropsten><fees><view>"
"Is there a way to verify transactions afterwards they are entered in the ethereum blockchain?","<web3js><contract-development><transactions><security><ethereumjs>"
"Could there be multiple asset pools In a DAMM liquidity pool?","<oracles><exchanges><decentralized-exchange><defi><dex>"
"What does ""participation rate"" mean in the context of ETH2?","<eth-2.0><terminology><beacon-chain>"
"Remix Compiler Errors - Transferred GitHub .SOL Codes to Remix","<solidity><remix><erc-20><testing><compiler>"
"Pull metadata from ERC721 contracts","<erc-721>"
"Ethereum vs bitcoin technology","<bitcoin><proof-of-work>"
"Remix Error - Trying to Follow Ropsten Faucet Instructions","<solidity><remix><metamask><ropsten>"
"""out of gas"" when trying to send back ETH from a contract to tx.origin","<solidity><contract-development><transactions><out-of-gas><solidity-0.7.x>"
"when uncle block info is recorded into blockchain irreversibly?","<uncle-blocks>"
"What is the criteria to resync chain using proof of stake?","<synchronization><proof-of-stake><forks>"
"how to use import ""@openzeppelin"" in remix or import ""https://github..."" in truffle?","<truffle><remix><openzeppelin>"
"Abigen doesn't create free data retrieval call for public state variable","<solidity><go-ethereum><solc><golang>"
"Deploy pre compiled bytecode using truffle migrations deployer api","<truffle><bytecode><uniswap>"
"Uniswap Factory contract event - how to find addresses for new token pair","<solidity><go-ethereum><uniswap>"
"Deployed bytecode size seems to mismatch contract code size","<solidity><contract-deployment>"
"puthon web3.py Get the latest block","<web3.py>"
"Error on calling initialize after deploying upgradable contract","<contract-deployment>"
"In Solidity how to use unnamed function parameters?","<solidity>"
"Serialize a transaction","<web3js>"
"Uniswap transaction","<transactions><uniswap>"
"Get number of logs in block","<web3js><logs><block-header>"
"Require(...) condition location in wrapped functions","<solidity><go-ethereum><contract-development><contract-design>"
"Truffle test does nothing but compile work","<solidity><truffle>"
"Connect GETH to miner's node. Speed up transactions","<go-ethereum><transactions><mining><nodes><mining-pools>"
"How to get transaction hash without waiting for await call?","<transactions><ropsten><hash><async><sendsignedtransaction>"
"Proof-of-Stake: How to prevent someone from being always selected as an author of block?","<security><proof-of-stake><eth-2.0><beacon-chain><block-production>"
"Fork in Proof-of-Stake?","<proof-of-stake><forks>"
"Recursively search for Ethereum nodes","<nodejs><ethereumjs><devp2p>"
"Why does ip address value differ in the enode url from the info output of a geth node instance to running admin.nodeInfo.enode in the js console?","<go-ethereum><private-blockchain><network><enode>"
"If I participate in a ERC20 ICO with my Metamask eth address, can I add the custom token later on?","<erc-20><metamask><etherscan><ico>"
"How to select the next author of block in Proof-of-Stake?","<proof-of-stake><randomness><eth-2.0><beacon-chain><block-production>"
"How can i do 2^0.3 (exponent below 1) using integers?","<solidity><math>"
"Tracing back tripped require() to a source code line","<solidity><contract-debugging><evm><solc>"
"how localethereum works with its browser wallet","<wallets>"
"Contracts work on testrpc but not Rinkeby. Using delegatecall (upgradeable contracts) pattern and trying to add new Contract() to array is failing","<solidity><truffle><rinkeby><delegatecall><inheritance>"
"What do the response values of a Parity `trace_transaction` call actually represent?","<parity><contract-debugging><evm>"
"Reasons to develop DApp when you have to pay for executing logic","<blockchain><dapps><gas-price>"
"How to detect transfer of funds from contract?","<testing><web3.py>"
"MyEtherWallet and Ethereum Wallet","<wallets><myetherwallet>"
"Modeling language for Block-Chain-Oriented Systems","<contract-design><design-patterns>"
"get accounts's transactions details in solidity","<solidity><transactions>"
"After-the-fact Fee calculation for ETH transfers","<transactions><gas-price><web3j>"
"Substring in solidity","<solidity><contract-development>"
"Contract forwarding ether transfer","<solidity>"
"Export Token Holders list of a token to csv","<etherscan><export>"
"How to move coins without blockchain?","<wallets><nodes>"
"web3.js can I call a smart contract function without knowing the ABI?","<web3js><tokens><addresses><metamask>"
"What are definite future benefits of buying and holding small amounts of Ether today?","<ether>"
"How to get 'defaultAccount' by Nethereum?","<nethereum>"
"Hidden problems in ""set array to empty array to clear it"" approach","<solidity><gas><arrays><memory>"
"Are Ethereum softwares tracking me?","<go-ethereum>"
"Provided address is invalid, the capitalization checksum test failed, or its an indrect IBAN address which can't be converted","<web3js><transactions>"
"Mintable Token with Inflation","<solidity><tokens>"
"How is the block gas limit dynamically adjusted?","<blockchain><blocks>"
"Function does not return value","<solidity><remix>"
"Overriding Solidity selfdestruct","<solidity><delegatecall><selfdestruct>"
"Permissioned blockchain for company","<blockchain><permissioned-chain>"
"Is there an online service where I can find a web3 cli?","<web3js><cli>"
"""Deploy contract"" dropdown menu not displaying in Ethereum Wallet","<contract-development><contract-design><contract-deployment><contract-debugging>"
"Property 'personal' does not exist on type 'Web3' by using web3.personal.unlockAccount()","<web3js>"
"Issuing bonds on Ether","<ether>"
"Private node doesn't have ip address","<go-ethereum><nodes>"
"Parity New Account: no seed?","<parity><accounts>"
"How do I watch Events from multiple contracts","<events>"
"How to check the size of a contract in Solidity?","<solidity><contract-development>"
