title,tags
"Solidity 0.5 Truffle Compile Error","<solidity><truffle><truffle-compile>"
"How come npmjs website shows that Truffle latest version is 4.1.14, and that it was published 3 days ago?","<truffle><solc><compilation>"
"How can obtain the value of erc20 token in transaction?","<erc-20><parity>"
"Running Openzepplin from docker","<solidity><docker><openzeppelin-contracts>"
"How do I read an array inside of a struct?","<solidity><truffle><storage><arrays><mapping>"
"What happens when run in command line: geth?","<go-ethereum><contract-development>"
"How to run smart contract using go-ethereum source code?","<go-ethereum><contract-development>"
"Invoking events without ""emit"" prefix is deprecated","<solidity>"
"Refill Ether to account after token transfer","<go-ethereum><web3js><tokens>"
"Error from Remix: ""ParserError: Expected primary expression""","<solidity><remix><ethereum-wallet-dapp>"
"How do you get the UTXOs a transaction is spending using web3.js?","<web3js><transactions><blockchain>"
"Solidity and JavaScript merkle tree verification does not work","<solidity>"
"Solidity/Remix Error: The constructor should be payable if you send value enum change state","<contract-design><design-patterns>"
"How to create Multi-node private ethereum blockchain network (windows platform)","<go-ethereum><private-blockchain>"
"How to access string arguments from calldata in external functions? (0.5.X)","<solidity><solc><calldata>"
"Running 'parity account new' - is the generated account suitable for all networks (mainnet, ropsten, kovan, etc)?","<parity><accounts><private-key><network><public-key>"
"Gas issue on sendRawTransaction on the rinkeby network","<go-ethereum><web3js><gas><rinkeby><sendrawtransaction>"
"Usage of the account part of a derivation path to generate Ethereum addresses","<wallets>"
"Get lastest input transaction of the account","<web3js><transactions><javascript>"
"Create account on Ethereum using Nethereum C#","<ethereum-classic><nethereum><c#>"
"TypeError: Type contract InsuranceClaim is not implicitly convertible to expected type address","<solidity><blockchain>"
"Peering over a direct L2 link without IP addresses","<blockchain><private-blockchain><peers>"
"Error while generating Mnemonic","<go-ethereum><web3js><accounts>"
"Source File requires different compiler version","<solidity><contract-development><truffle>"
"eth.sign() method giving error","<signature><console>"
"The default output of the function. Solidity","<solidity><truffle>"
"Truffle migrate ERC820Registry","<truffle-migration><ganache>"
"How do consensus vulnerabilities occur when parity nodes do not mien?","<go-ethereum><mining><parity><consensus>"
"Contract returns incorrect uint when it should fail","<solidity><uint256>"
"Getting an error while trying to store large payloads (13-20kB)","<solidity><web3js><contract-development><nethereum>"
"How long you can consider a pending transaction as invalid?","<transactions><blockchain>"
"contract methods undefined","<web3js><javascript>"
"Ethers js adding provider","<dapps><javascript><ethers.js>"
"How the hashing of the block data ensures the data integrity?","<go-ethereum><blockchain>"
"Evaluate the performance of a smart contract","<solidity><ethereumjs><testing><truffle-test>"
"How to raise version of oraclize-api installed via Truffle","<truffle><oracles>"
"Testing a function in Solidity","<truffle><truffle-test><exceptions>"
"question regarding linearization of inheritance","<inheritance>"
"REMIX: ParserError: Expected identifier but got 'payable' address payable target","<solidity><tokens><remix><etherscan>"
"Error: cannot find module hdwallet-provider - trying to deploy contract to ropsten using infura key","<go-ethereum><truffle-migration><infura>"
"How to call geth mining through java code manually ?","<mining><web3j>"
"What is bzz protocol?","<go-ethereum><swarm><bzz>"
"Configuring a new ethereum network, using geth and PoA as consensus","<go-ethereum><poa>"
"Deploy smart contract on Ropsten using truffle-hdwallet-provider","<truffle><contract-deployment>"
"Get blocks between dates","<blocks>"
"Avoiding contract impersonation","<solidity><security>"
"I want my contract to pay for gas","<gas><contract-invocation>"
"Solidity 0.6.x - when is it mandatory to use assembly (with examples)?","<solidity><assembly>"
"Transaction is not broadcasting","<ethereum-classic><nethereum><c#>"
"Decentralized Identifier - DID method Registration","<blockchain><decentralization><identity>"
"Preventing Errant Nodes","<web3js><nodes><rpc>"
"Is there any contract to get USD value of Ether","<ether><ethereumjs><usdt>"
"Import accounts on Ethereum Wallet is disabled","<wallets><accounts>"
"My activity is erased from the Ropsten testnet","<transactions><etherscan><ropsten>"
"Transaction Order of Execution - Same Gas","<transactions><gas>"
"contract.method.balanceOf() is not a function","<solidity><web3js><erc-20>"
"Why don't decimals work in solidity?","<math><fixed-point><decimals>"
"Trying to understand the ethereum stack","<evm><assembly>"
"How to refund gas to the smart contract caller? (What is the number?)","<contract-development><gas-estimate><gas-refund>"
"Do smart contract transactions get signed?","<transactions><contract-invocation><signature>"
"Verify that a smart contract inherits from a smart contract well-known definition","<solidity>"
"Geth behind mainnet during fast sync on an SSD","<go-ethereum><nodes><geth-debugging><fast-sync><windows>"
"Chainlink import causing Truffle console to crash","<solidity><truffle><openzeppelin><chainlink><safemath>"
"Where does Metamask mobile for Android store wallet seed or private keys?","<metamask>"
"How do I count the elements of an array in solidity?","<solidity><contract-development><remix><contract-design><pyethereum>"
"Gas requirement is infinite for the function","<gas><addresses><arrays><struct><gas-limit>"
"If gas is refunded, is it required to call?","<gas><contract-invocation><gas-refund>"
"Frontrunning Uniswap horror story transactions","<security><attacks><uniswap><frontrunning>"
"Storing access to encrypted data in non-fungible tokens","<contract-development><ipfs><encryption><nft>"
"Stuck ETH in Smart Contract","<erc-20><contract-deployment><contract-debugging>"
"How to add burn function to an ERC20 and ICO smart contract?","<contract-development>"
"Subscribe to new txpool transactions on geth node","<go-ethereum><txpool>"
"Why is GETH excessively and unnecessarily writing to my drive C?","<go-ethereum>"
"Stuck at ""ipfs process started"" after running embark","<go-ethereum><dapp-development><ipfs><embark>"
"User login in ethereum based voting dapp","<ethereum-wallet-dapp><voting><authentication>"
"Migrate with truffle deployer by using new","<truffle><truffle-migration><truffle-deployment>"
"Can I selfdestruct a smart contract without the selfdestruct function being implemented?","<selfdestruct>"
"If you're a node, why would you accept other node's solution instead of copying and broadcasting that solution?","<security>"
"Getting address of a new contract in truffle with javascript?","<web3js><truffle>"
"ERC20 Code - How to Read and Publish on Github","<remix><etherscan>"
"ComponentDidMount doesn' detect Metamask change account","<web3js><truffle><metamask><javascript><addresses>"
"Ethereum geth mainnet blocked on Looking for peers","<go-ethereum><blockchain><wallets><ethereum-wallet-dapp><geth-debugging>"
"How to call the super contract function where msg.sender should be same in solidity?","<abi><solidity-0.5.x><keccak><delegatecall>"
"When running a geth node, how can I know when reorg occur?","<go-ethereum><forks><chain-reorganization>"
"Can miner himself add a transaction with a zero gas price?","<mining><gas><gas-estimate>"
"How to show token balance from a ETH address in my Android App?","<blockchain><tokens><dapps><ethereum-wallet-dapp><dapp-development>"
"Generating blocks without mining,","<mining><cpp-ethereum><blocks>"
"Can't connect node on private network with bootnode","<go-ethereum><private-blockchain><bootnodes>"
"nonce too low , please help","<go-ethereum><web3js><transactions>"
"Gasless transactions - sending transaction instead of signing message. How does it work?","<solidity><web3js><metamask><gas><openzeppelin>"
"is there a way to make a private precompiled contract charge same gas as if it was a normal contract?","<go-ethereum>"
"Generating cache from block_number and seed using Python","<go-ethereum><python><dag><ethash>"
"Geth peer count being limited","<go-ethereum>"
"Attempting to transfer erc20 token, but keep encountering insufficient funds for gas * price + value","<tokens><ether><erc-20><web3j><java>"
"Verifying contract always returns true","<zero-knowledge><zokrates>"
"UnimplementedFeatureError: Copying of type struct Question memory[] memory to storage not yet supported","<solidity><struct>"
"A way to capture actual gas used per transaction","<transactions><gas><gas-limit><blocks><receipts>"
"Token Restrictions Helping me Understand Blockchain Logic","<solidity><tokens><security>"
"Using a solidity smart contract, what's the best proof that A can provide B showing that A acted in good faith towards paying C?","<solidity><contract-development>"
"web3.utils.sha3 and web3.sha3 are not returning same hash","<hash><sha3>"
"VM transaction failed reverting the transaction","<solidity><web3js><truffle>"
"When truffle migrate required account to be unlocked?","<truffle><private-blockchain><truffle-migration><truffle-deployment>"
"is it possible to get gas refunded if a smart contract call fails to complete?","<gas><wallets><gas-refund><trust>"
"Transaction is not included in block even block number is increasing [private-net]","<go-ethereum><private-blockchain><mining>"
"hardening infinite loops","<solidity><contract-development><contract-design><gas>"
"How to sync wallet files with different servers on private blockchain","<private-blockchain><nodes><private-key><poa>"
"how to read smart contract A's data from other smart contract B in ethereum?","<contract-development><contract-invocation>"
"How to fix Solidity version missmatch from Visual Studio Code","<solidity><visual-studio-code>"
"How to import multiple folders into remix?","<remix>"
"An ERC-1151 with two kinds of tokens, how to number them?","<tokens><addresses><uint256><erc-1155>"
"IERC1155Views - whether and how to use it?","<exchanges><erc-1155><decimals>"
"Can I stop geth when it is halfway done and restart it without loosing all the first half of data?","<go-ethereum><blockchain><synchronization><nodes><datadir>"
"Failing to send() 1 wei from one contract to another","<payable><address.transfer><fallback-function><receive>"
"Why did an Event Fire even though Etherscan suggests it failed?","<web3js><medalla>"
"Mutual dependency of two contracts","<contract-design>"
"Making sure a string (input/output) is less then 64 characters","<solidity><remix><gas><storage><string>"
"Why is the ERC721 metadata limited to images?","<tokens><erc-721>"
"How to write on the blockchain from vb.net?","<.net>"
"Which mode shoud I use for Parity syncing to use trace_ APIs for TXs since current blocks?","<transactions><parity><synchronization>"
"Etherscan.io API call response with ""Please turn JavaScript on and reload the page.""","<etherscan>"
"Geth client: how to disable ipv6?","<go-ethereum>"
"How to receive/swap tokens on a new Solidity contract?","<solidity><remix>"
"ETH sent to incorrect address","<addresses><public-key><address.transfer>"
"syncing forever","<synchronization>"
"How do I split a signature into v, r, and s parts in python?","<signature><python><cryptography>"
"Solidity vs Viper?","<solidity><vyper>"
"Change gas amount in Truffle 4","<solidity><contract-development><truffle><truffle-config>"
"Smart Contract for trustless presale pooling","<contract-development><contract-debugging><vulnerability>"
"web3.eth.sendSignedTransaction -> insufficient funds for gas * price + value","<web3js><nodejs>"
"What were the first 5 technical steps in launching Ethereum?","<ethereum-wallet-dapp>"
"ethereum user friendly app","<dapp-design>"
"Risk of attack if you give more than the half of your tokens?","<contract-development><contract-design><contract-deployment><crowdsale><tokens>"
"Ethereum node has low RPC performance","<parity><json-rpc>"
"Unknown network ""development""","<truffle><mist><networkid>"
"Open Ethereum mining pool","<mining>"
"How do I send an arbitrary message to an ethereum address?","<addresses><message>"
"Using sub-contract to simplify interface","<dapp-development><dapp-design>"
"geth --preload ""customcommands.js""","<go-ethereum>"
"""Error: VM Exception while executing eth_call: invalid opcode"" when accessing array","<solidity><contract-development><web3js><contract-design><openzeppelin>"
"Identify crypto from a given wallet address?","<addresses><identity>"
"TypeError: Cannot read property 'abiDefinition' of undefined","<solidity><web3js>"
"Is it possible, I don't have password for my wallet?","<myetherwallet><password>"
"Did I effectively lock me out of my own smart contract?","<contract-invocation><contract-deployment><ethereum-wallet-dapp><parity-wallet>"
"Doubts about gas reward","<contract-deployment><gas>"
"Wallet for ERC-20 Tokens","<erc-20>"
"Can this contract be killed?","<solidity><mining><contract-design>"
"Faster way of getting contract property in Web3js","<solidity><contract-development><web3js>"
"Obtaining Gas and Gas Price Solidity","<solidity><gas><gas-price><gas-refund>"
"Lost ETH - Don't remember which wallet was used?","<wallets>"
"How KYC ICO check addresses during crowdsale?","<contract-development><crowdsale>"
"Blockchain Recent Scaling Proposals : (Sharding, blocksize , SegWit, GHOST, Lightning, multichains, sidechains, DAGs)","<proof-of-stake><proof-of-work><dag><scalability><sidechain>"
"Multiple web3 instances on a Single Page","<solidity><contract-development><web3js><contract-deployment><gui>"
"Set up hardforks parameters in parity JSON chain spec file for private network","<private-blockchain><parity><testnets><chainspec>"
"Web3 0.20 contract deployment","<solidity><web3js><contract-deployment><infura><sendrawtransaction>"
"Nonce question please","<dapps>"
"Uncaught (in promise) Error while opening and doing transaction on private ethereum blockchain using web3 and go-ethereum","<go-ethereum><web3js><react>"
"Truffle uint test script not updating storage variable, and strange behaviour","<storage><truffle-test><state-variable>"
"Calling Msg.sender Natively","<delegatecall>"
"Using vanilla javascript with web3 and metamask","<web3js><metamask><javascript><nodejs>"
"Get Submitted Data from Blockchain","<go-ethereum><blockchain><database>"
"Data encryption","<go-ethereum><blockchain><encryption>"
"How to authorize multiple contracts issue the same ERC20 token?","<contract-development><contract-design><tokens><erc-20>"
"Why solidity's keccak returns different value from online generators?","<remix><keccak><solidity-0.5.x>"
"How to find the value of erc20 token sent out using transaction hash","<web3js><transactions><erc-20><hash>"
"read error unexpected EOF","<web3js><contract-development><quorum>"
"Increasing the difficulty/cost of manipulating an on-chain PRNG?","<solidity><randomness>"
"How to generate the full list of function selectors for a contract?","<solidity><abi><hash><keccak>"
"Synchronization: why startingBlock is ahead of currentBlock?","<synchronization>"
"Why is NOT a protocol with a Turing-complete smart contract language able to use SNARKs to prove the validity of the chain?","<zksnark><terminology><zero-knowledge><data-validity>"
"Solidity and Web3js codes are not working inside the private Ethereum(geth) network but same codes are working in public ethereum","<solidity><go-ethereum><web3js><remix><private-blockchain>"
"How to create smart contracts and tokens without using any cryptocurency?","<tokens>"
"Cannot fetch account details","<dapps>"
"Is there a unicode currency symbol for DAI?","<dai><makerdao>"
"Sending value to a solidity contract method from web3 results in `Invalid Tuple Value` error","<solidity><web3js><contract-development><contract-debugging><nodejs>"
"How to guarantee IPFS file access based on Non Fungible Token ownership (or security)?","<solidity><erc-721><cryptography><nft>"
"Is there a way to create an ERC20 token with an unlimited suplly?","<erc-20>"
"How do I asynchronously wait for Contract.events.MyEvent data to be returned in Web3 1.0?","<web3js><web3js-v1.x>"
"About Ethereum testnet 61 (Ethereum Classic)","<go-ethereum><ethereum-classic><network>"
"How to lock eth into a smart contract for a certain amount of time?","<smart-lock>"
"How to find out the number of Validators of a transaction if i have its transaction hash","<blockchain><mining><ethereum-wallet-dapp>"
"Any QuickBlocks tutorial?","<cpp-ethereum><external-api><explorer-api><exchange-api>"
"Non-stop ""Served eth_signTransaction"" warnings after upgrading geth to 1.9.x for private network?","<go-ethereum><private-blockchain>"
"Confusion around Truffle, Ganache and Meta Mask","<truffle><metamask><ganache>"
"ERC721 Token - Burn and mint again","<erc-721>"
"Delegatecall return values solidity 5.0","<solidity><delegatecall>"
"How does one retrieve revert/require error messages from RPC","<solidity><error><rpc>"
"Truffle solidity tests are executed before end of deployment","<truffle><testing><truffle-migration>"
"Question regarding refund of ETH / gas if too late for an ICO","<gas><ico>"
"Ethereum Solo Mining - Adding additional miners to the rig","<cpp-ethereum>"
"How to recover my ether.li wallet with any other wallet software?","<transactions><wallets><recovery><multisignature><ether.li>"
"Should I set an extremely high gas price while participating in a popular token crowdsale?","<gas-price>"
"Ethereum Virtual Machine code","<evm><bytecode>"
"No balance after a few days of ETH mining","<nodes><windows><ubuntu><miner>"
"Balance not displaying in wallet","<balances>"
"BTC sent to my ether wallet for swap into ETH, but its not showing BTC or even ETH","<go-ethereum><myetherwallet><transaction-propagation>"
"My transaction has been pending for over 8h now","<pending-transactions>"
"What are ""smart tokens"" and how do they differ from regular tokens?","<tokens>"
"How to pass public variable in Remix online compiler","<solidity><contract-debugging><remix><arrays>"
"How can I let TestRpc reveil the public key of a generated account","<web3js><truffle><testrpc><web3j>"
"How to get ABI for an existing contract","<contract-development><contract-invocation><abi>"
"how to use the contract instance for multiple functions?","<go-ethereum><truffle><testing><mocha>"
"How to copy/assign an array via for loop","<solidity><arrays>"
"Running a shell script in after a contract is deployed in a private blockchain network","<go-ethereum>"
"Electronic Voting","<voting>"
"Solidity Documentation vs Grammar, which one is the most correct?","<solidity><documentation><grammar>"
"Problem with import of ether.li wallet into Mist","<mist><import><multisignature><ether.li>"
"How to Start solidity programming after installing plugin in Intellij idea","<solidity>"
"Mining pool 0.2 minimal payout","<mining-pools>"
"remove contract on ethereum blockchain using web3","<solidity><contract-development><truffle><contract-debugging><ethereumj>"
"Which scope of variables changes the state of the contract?","<transactions><contract-invocation>"
"How to issue tradable tokens?","<solidity><contract-design><tokens><erc-20><ico>"
"How to sign a transaction on an offline computer?","<cold-storage><offline>"
"Could't connect to node? ethereum wallet installing error","<wallets>"
"how to deploy derived smart contracts solidity","<solidity>"
"The thoughts of develop a dapp in the website","<dapp-development><parity><ipfs><dapp-design>"
"Blockchain use case in healthcare","<blockchain><private-blockchain><use-cases>"
"How is this code feasibly valid?","<go-ethereum>"
"buy token with card","<ether><ethereum-wallet-dapp>"
"Ethereum Mining 3 Geforce 1070","<mining><ether><linux>"
"Help will be greatly appreciated: I'm trying to find the JSON or ABI for one of my contract wallets:","<wallets><keystore>"
"Are smart contracts expensive?","<gas-price>"
"Is there a way to see all incomming connections?","<go-ethereum><peers>"
"Why does geth -light start importing block headers from 3297471","<go-ethereum><blockchain><light-clients>"
"What does this screen shot mean?","<mining>"
"Are the functions in this code missing the payable modifier?","<payable>"
"How to deploy smart contract in predefined contract address in private ethereum network?","<private-blockchain><contract-deployment>"
"What's so special about the .call() function?","<interfaces>"
"Running ethereumjs/testrpc from a Docker container","<testnets><nodejs><docker>"
"Ether.li Problems","<ether.li>"
"what happens if there is a power cut while mining ethereum?","<go-ethereum><blockchain><mining>"
"Can I make new cryptocurrency on top of ethereum blockchain tech.?","<solidity><web3js><dapps>"
"Geth on ios not working","<go-ethereum><nodes><ios>"
"Token transfer fail with revert","<solidity><contract-development><truffle><contract-debugging>"
"Accesing state variables in an other contract","<solidity><contract-development><contract-design><contract-deployment>"
"Non transferrable ERC721 token?","<solidity><erc-721>"
"Clique: recommended sealer setup for small networks?","<proof-of-authority><clique>"
"Mintable tokens with some kind of identifier","<tokens><mint>"
"Connecting an Ethereum account with a Twitter user","<authentication>"
"Can't see deployed contract in truffle console","<truffle><truffle-migration><console>"
"JavaScript merkle-patricia-tree/secure - OutOfMemory when traversing large (~70Gb) state tries","<go-ethereum><javascript><merkle-patricia-tries><leveldb>"
"How to simulate p2p network for blockchain systems?","<go-ethereum><dapp-development><devp2p>"
"How to check that MyToken has been sent from one address to the other address?","<solidity><tokens>"
"Is it possible to reduce the cost of this function with a for loop?","<solidity><contract-development><gas>"
"How do I pass arguments to a contract-constructor with web3Js (>=version 1.0)","<contract-development><myetherwallet>"
"what is [Reverted] during contract execution","<transactions><contract-deployment><contract-invocation><revert-opcode>"
"Deploy contract that requires an ERC20 object in constructor","<solidity><web3js><ico><openzeppelin>"
"ERC20 merged mining questions","<contract-development><contract-invocation><erc-20>"
"sha512 in Solidity or assembly, does it exist?","<keccak><sha3><hash-algorithm>"
"How much gas does an ERC20 transfer cost?","<gas><erc-20>"
"problem with sequence deployment","<truffle>"
"How can I write a script to move ETH from many wallets associated with a mnemonic to a single wallet?","<myetherwallet><hd-wallets>"
"Succinct contract state/storage root of a smart contract","<contract-design><state-trie>"
"Smartpools' sha3_512, is there a stand alone implementation?","<hash><sha3><hash-algorithm>"
"What are the web3 httpProvider options?","<web3js><metamask><web3-providers>"
"Resetting Ethereum PoA private network","<go-ethereum>"
"Why am I having trouble connecting to the Infura mainnet?","<json-rpc><infura>"
"Error creating CustomGenesis","<go-ethereum><testnets><genesis>"
"Blockchain basics question","<blockchain><mining><private-blockchain>"
"Why does truffle require 4 authorizations for 1 contract + 1 migration?","<truffle><contract-deployment><truffle-migration>"
"Zeppelin Solidity Destroy and Send","<solidity><truffle><openzeppelin>"
"Generating Ethereum Accounts on web3.py","<web3.py><infura>"
"Feedback the cheat and fraud of etc eth on twitter. How can i recover my loss?","<cpp-ethereum><ethereum-classic>"
"Dapp fundamental q about listening solidity events","<dapps><php><websocket>"
"Error creating local Geth tesnet","<go-ethereum>"
"Calling a function from a function undeclared identifier","<solidity><contract-invocation>"
"ERC20 approve and transferFrom from a contract","<solidity><erc-20>"
"Shouldn't gas be constant for calling same contract method?","<gas><contract-invocation><gas-limit>"
"Setting boolean variable does work in Remix but doesn't work is Mist","<solidity><remix><rinkeby>"
"What are the conditions in a smart contract of an ICO","<go-ethereum><blockchain><tokens><ethereum-wallet-dapp><ico>"
"Latest Zeppelin SampleCrowdsale.sol token moved outside of contract?","<solidity><truffle><truffle-migration><openzeppelin>"
"How can I highlight the syntax of Solidity in Ace browser editor?","<solidity><remix>"
"Solidity function gas requirement is infinite","<solidity><remix><mapping>"
"Where are contracts actually running?","<consensus>"
"How do I access a contract by its address (within Mix)","<contract-development><contract-debugging><mix><ide>"
"Syntax highlighting for Solidity VS Code extension not working on linux","<solidity><linux><visual-studio-code>"
"Is it possible to run the Ethereum Wallet with a remote Blockchain?","<wallets><nodes><light-clients>"
"multi-step game, would the contract stop for a while for another transaction to come","<contract-design>"
"Watching for changes in web3.isConnected()","<web3js>"
"How can I generate a V3 of the Ethereum wallet file format in js, from strings: 'Passphrase' and 'Email or username' required by Quorumwallet?","<go-ethereum><wallets><accounts><brain-wallets>"
"What Ethereum applications can I use without having to mine or buy ether?","<dapps>"
"How does EtherScan know I am sending to a Shapeshift/Poloniex wallet?","<transactions><explorers><shapeshift><poloniex><etherscan>"
"Do you need the fully synced node before sending a transaction to the network?","<go-ethereum><transactions><blockchain><synchronization>"
"the etherdice's detailed algorithm","<contract-design><gambling>"
