title,tags
"Split differential equations into two video courses; theory and calculation?","<course-design><differential-equations>"
"How to reasonably denote lines, line segments and rays?","<secondary-education><geometry><notation>"
"The role of ""area"" in a Common-Core aligned high school classroom","<secondary-education><geometry><common-core>"
"References on the effectiveness of manipulatives (virtual vs. physical)","<reference-request><education-research><manipulatives>"
"Teaching a Pre-Calculus Course using Basic Mathematics by Serge Lang","<textbooks><precalculus>"
"Native language, writing, and mathematical problem solving","<mathematical-pedagogy><reference-request><writing><problem-solving><philosophy-of-maths>"
"Importance of exercises for learning mathematics","<undergraduate-education><reference-request><education-research><exercises>"
"Everyday Example Problems for Solving Linear and Quadratic Equations","<secondary-education><algebra><student-motivation>"
"Example illustrating use of additivity of (probability) measures before introducing independence and conditioning","<undergraduate-education><examples><probability>"
"Gender and groupwork","<reference-request><gender>"
"Course-based undergraduate research experiences in math","<mathematical-pedagogy><course-design><undergraduate-research>"
"Monte Carlo real life examples","<examples>"
"OP (Overlall Position) Calculations for Queensland's post-secondary-entrance rankings","<secondary-education>"
"Is the current education system as bad as most critics and famous pure mathematicians try to convey?","<mathematical-pedagogy><secondary-education><teaching>"
"Is there any advantage of plotting graphs using traditional paper and pencil method?","<undergraduate-education><secondary-education><reference-request><graphing>"
"Catalog of undergraduate's misconceptions / problems while proving","<undergraduate-education><reference-request><proofs><students-mistakes><undergraduate-research>"
"SMSG Materials Available","<reference-books><struggling-students><new-math>"
"Monty Hall challenge","<mathematical-pedagogy><probability>"
"Functional analysis text for junior-senior math majors?","<undergraduate-education><textbooks><functional-analysis>"
"Effectiveness of audio / video feedback","<reference-request><technology-in-education><tutoring><interactive-teaching>"
"How do you learn math as a person who has no sense of touch and sight?","<special-needs-education>"
"Teaching intuition for the universal property of the product (category theory)","<concept-motivation><online-instruction><category-theory>"
"Negative Denominator in Fractions; Importance and Applications","<fractions><negative-numbers>"
"Common Core Question: What is included and excluded in high school mathematics?","<mathematical-pedagogy><secondary-education><common-core>"
"Job boards for university positions in Math Education?","<undergraduate-education><employment>"
"Software for randomizing multiple choice tests","<software><testing><test-design>"
"Encouraging class participation","<classroom-management><interactive-teaching><class-participation><calculus>"
"Is there a good age/level to start learning mathematical proofs?","<proofs>"
"How to assign homework when answers are freely available or attainable online?","<course-design><homework>"
"How should one tutor a student in undergraduate real analysis?","<tutoring><mathematical-analysis><undergraduate-education>"
"How to balance higher order thinking and drill/practice","<undergraduate-education><course-design><tutoring>"
"What are some good simple examples that getting the right result is not enough?","<proofs><examples>"
"A calculus book that uses differentials?","<calculus><textbooks><infinitesimals>"
"Counterexamples in first year calculus","<calculus><mathematical-pedagogy>"
"Implementing oral exams","<calculus><oral-exams><testing>"
"Formula sheets and books during tests and exams","<testing><aids><exams>"
"What are some good examples to motivate the implicit function theorem?","<examples><mathematical-analysis><graduate-education><concept-motivation>"
"Visual Pythagorean demonstration","<geometry><visual-proof>"
"How to bring an undergraduate researcher up to speed on a brand new topic","<undergraduate-research>"
"The ""water triangle"" proportional reasoning task","<proportional-reasoning><reference-request>"
"Engaging students in computer lab","<classroom-management><class-participation>"
"According to Common Core standards, what math skills are beginning Kindergarteners supposed to have?","<primary-education><common-core>"
"What is a free and simple 3D plot software for students?","<technology-in-education><software>"
"What prerequisites would college students need for a course based primarily on Euclid's elements?","<undergraduate-education><course-design><curriculum><geometry><prerequisites>"
"What is a good handwriting font for mathematics?","<board-use>"
"Keeping quicker students engaged and interested throughout a course","<calculus><classroom-management><class-participation><interactive-teaching><undergraduate-education>"
"Should geometric algebra be presented early on in undergraduate education?","<undergraduate-education><curriculum>"
"How do you handle a wide ability range when delivering a 50 min tutorial with lots of material to get through?","<mixed-ability><time-management>"
"What are the comparative advantages of open-book versus closed-book exams?","<reference-request><exams>"
"Multidimensional differentials for students with poor spatial imaging","<calculus><mathematical-analysis>"
"How do online practicing websites decide how much practice / repetition is 'enough'?","<primary-education><technology-in-education>"
"Teaching functions/mappings early","<primary-education><functions>"
"How do I adapt a MWF class into a TuTh class?","<course-design><scheduling>"
"Multiple Solutions Methods vs. Encouraging a Particular Approach","<proofs><problem-design><testing>"
"When is it appropriate to lecture?","<general-pedagogy><classroom-interaction>"
"What activities can enhance student comprehension of concepts involved in logarithmic and exponential integrals?","<calculus>"
"Any tips in explaining the central limit theorem in statistics?","<undergraduate-education><statistics>"
"How to design exercise groups in very advanced course?","<course-design><tutoring><graduate-education>"
"Is it good to have solutions of homework published?","<undergraduate-education><secondary-education><homework><tutoring><publishing>"
"How to deal with very motivated students having ""off-topic"" interests?","<undergraduate-education><mathematical-pedagogy><student-motivation>"
"How to explain linear approximation to an equation to calculus students?","<undergraduate-education><calculus><differential-equations>"
"How to prepare for lecturing in a non-fluent foreign language?","<calculus><language-use><large-lecture>"
"How to balance the difficulty level and speed of lectures for students of very different levels?","<undergraduate-education>"
"Published papers for Intro Stat students to read","<undergraduate-education><reference-request><examples><statistics><big-list>"
"According to Nathan Jacobson, what is Intermediate Algebra and Advanced Algebra?","<algebra><textbooks><self-learning><reference-books><abstract-algebra>"
"Is Linear Algebra Done Right too much for a beginner?","<self-learning><linear-algebra><book>"
"Which examples should we mention when teaching the concept of derivatives?","<calculus>"
"What is a good format of tutorial sessions?","<undergraduate-education><tutoring><lecturing>"
"Is it a problem if a senior student majoring in mathematics could not prove the quadratic formula?","<undergraduate-education><proofs><solving-polynomials>"
"What is the standard for ""simplifying your answer""?","<fractions><roots><powers>"
"Book recommendations on mathematics education focusing on geometry","<undergraduate-education><secondary-education><geometry><education-research><reference-books>"
"Analogy for nested loops/integrals","<vector-calculus>"
"Is there a point at which it makes decidedly more sense to learn about a ""linear approximation"" to a function, rather than a ""tangent""?","<calculus><derivative>"
"Calculus workbook suggestions","<undergraduate-education><calculus><textbooks>"
"How to deal with a ""protest"" assignment?","<undergraduate-education><assessment>"
"Would teaching nonstandard calculus in an introduction calculus course make it easier to learn?","<calculus><course-design><infinitesimals><axioms-foundations><infinity>"
"Activities for calc based physics","<calculus><physical-sciences>"
"A question from a young student to mathematicians","<proofs><problem-solving>"
"Possible Educational Outcomes of ""Riemann Hypothesis""","<education-research>"
"The concept of infinity for a 5 year old","<preschool-education><infinity>"
"Why do standard geometry textbooks not start with trigonometry?","<secondary-education><course-design><geometry><curriculum><trigonometry>"
"Should we stop using traditional compass in schools & start/encourage adopting compasses like ""Slide N Measure"" or ""Safe-T"" compasses instead?","<secondary-education><geometry>"
"Is evaluating a Real Polynomial at a Complex Value a suitable task for Precalculus students?","<algebra><textbooks><precalculus><complex-numbers><polynomials>"
"Topics for undergraduate seminar for mathematics educators","<undergraduate-education><secondary-education><mathematics-in-daily-life><seminar>"
"How to conduct online testing for Calculus?","<undergraduate-education><calculus><online-instruction><testing>"
"Math circles while under quarantine","<online-instruction><math-circle>"
"A Question about Theodore Frankel's ""The Geometry of Physics""","<graduate-education><physical-sciences><differential-geometry>"
"Tools for Mathematical presentation","<interactive-teaching><online-instruction><presentation>"
"help thinking of conceptual or open-ended Intro Algebra and Intermediate Algebra test questions","<test-design>"
"How much does it cost to develop an online course?","<undergraduate-education><technology-in-education><online-instruction>"
"The Future of Worksheets - will they still be used or abandoned?","<teaching><writing>"
"The spatial thinking course for primary school - what to use?","<mathematical-pedagogy><primary-education><mathematics-in-daily-life><critical-thinking>"
"Online testing platform","<testing>"
"What is the best way to intuitively explain the relationship between the derivative and the integral?","<undergraduate-education><calculus>"
"Ideas for explaining 4D and higher dimensions","<undergraduate-education><geometry>"
"How to define ""axes with the same scale"" in Secondary/High School?","<secondary-education><definitions>"
"IMO selection process in Pakistan","<math-contests>"
"Textbook for multivariable calculus with interesting modern applications","<undergraduate-education><textbooks><vector-calculus>"
"How to teach addition, subtraction, multiplication and division of binary numbers? Are there any activities that can be recommended?","<secondary-education><mathematical-pedagogy>"
"How to award points for sense-making at the end of a problem?","<exams><grading>"
"Should we rename the greater than sign?","<undergraduate-education><negative-numbers>"
"Placement tests for middle school math","<mathematical-pedagogy><exams><assessment>"
"Real analysis: why usually first limits of sequences and then limits of functions?","<undergraduate-education><mathematical-pedagogy><course-design><mathematical-analysis>"
"A basic game to make arguments about","<proofs><games>"
"Is there any other procedure to find the square root?","<undergraduate-education><arithmetic-operations>"
"How do you teach a class with one struggling student?","<classroom-management><struggling-students>"
"What should I do if I have a student 'hiding' their working out?","<general-pedagogy><struggling-students><classroom-interaction>"
"What is a good answer to the question ""Which logic is better?""","<course-design><mathematical-pedagogy><logic><student-question>"
"What courses should be a part of a Mathematics Education degree program?","<course-design><graduate-education><teacher-preparation><teacher-training>"
"Learning counting and addition: fingers or in their head?","<preschool-education>"
"Explaining mathematics, giving talks, and using the blackboard as a support","<teacher-preparation><presentation><teacher-development>"
"How do I help my student understand concepts such as ""$x$ divided by $x$""?","<mathematical-pedagogy>"
"Should word problems be reasonable?","<algebra><trigonometry><word-problems>"
"Cartesian product set","<algebra><set-theory>"
"Looking for a creative way to teach ANOVA","<undergraduate-education><statistics>"
"Unable to solve word problems, fluent in arithmetic","<word-problems>"
"Fun Activities/Games Before a Break/Between Units for Secondary Geometry","<secondary-education><geometry><games>"
"Introduction-to-proof book using natural-deduction-style rules?","<textbooks>"
"How should I teach linear algebra and vector geometry together at high school?","<linear-algebra>"
"Benefits of Having the Same Professor Teach the Entire Calculus Sequence","<undergraduate-education><calculus><teacher-development>"
"How can I teach a $7^\text{th}$ grade student the concept of ratio and proportion","<secondary-education><proportional-reasoning>"
"Explaining the symbols in definite and indefinite integrals","<calculus><notation>"
"How to introduce the notion of imaginary number using the geometric mean?","<complex-numbers>"
"What is the evidence about the effectiveness of remediation in math?","<undergraduate-education><community-colleges><remedial-courses>"
"Research on how mathematics skills transfer to other areas","<reference-request><student-motivation><education-research>"
"Literature on skill transfer","<reference-request><education-research><reference-books>"
"Helping students use constructions in geometry","<secondary-education><mathematical-pedagogy><geometry>"
"Numerical / Computational problems suitable for grade 9-12 audience","<secondary-education><examples>"
"Self study question in calculus","<calculus><self-learning>"
"Effective Final Review","<calculus><review>"
"How to teach abstract algebra for the first time?","<undergraduate-education><teaching><interactive-teaching><abstract-algebra>"
"How to explain Chinese remainder theorem?","<algebra><teaching><terminology>"
"Dissemination of mistakes in international texts such as the IGCSE","<textbooks><functions><reference-books><graphing>"
"Writing Fractions ""Correctly""","<notation>"
"Ideas for a 2 weeks project focused in polynomial functions","<secondary-education><calculus><precalculus>"
"Where can I find primary sources from the New Math movement in the 60s?","<reference-request><history><new-math>"
"""Seeing"" GCD and LCM in Word Problems","<number-theory><problem-solving><word-problems><middle-school>"
"Stating identity is not the same as knowing value","<secondary-education><algebra><problem-solving><language-use>"
"Searching activities with ""Find the error"" strategy for learning maths","<exponent>"
"Why isn't the term *inequation* widely used in English?","<terminology>"
"Should basic exercises be solved before formulas are introduced?","<education-research><teaching>"
"Applications of notable points and lines of a triangle","<geometry><applications>"
"Looking for a video about arithmetic disappearing in a few years","<arithmetic>"
"Motivation for Fibonacci: Bees","<concept-motivation><sequences><recursion>"
"L'Hopital's Rule: Why do we need it?","<graduate-education><teaching>"
"Why teach reference angles?","<undergraduate-education><trigonometry>"
"Engaging Women in Economics","<gender>"
"How to teach sum of fractions to students?","<secondary-education><primary-education><fractions>"
"Cognitive traps in very early set theory","<set-theory>"
"Problem based learning (PBL) for pupils with educational difficulties","<secondary-education><student-motivation><problem-solving>"
"Material on tutoring university level math classes","<reference-request><tutoring><reference-books>"
"""Personalized System of Instruction"" (PSI) vs. ""Individually Prescribed Instruction"" (IPI)","<undergraduate-education><textbooks><primary-education><curriculum><self-learning>"
"What are the reasons for “math fear”?","<student-motivation><anxiety>"
"Why don't all teachers use clickers?","<interactive-teaching><large-lecture>"
"Interactive Algebra Lessons and Experiments","<algebra>"
"What is a reasonable use of clickers in the context of teaching?","<interactive-teaching>"
"Reasons to teach Thales' theorem","<concept-motivation><geometry>"
"What can be done to instill good habits in students?","<undergraduate-education><secondary-education><student-motivation><classroom-management><struggling-students>"
"How does a reliance on calculators affect student performance?","<reference-request><students-mistakes><calculators>"
"Problem of a talented student who doesn't like to solve too much problems","<student-motivation><undergraduate-research><gifted-students>"
"How to divide up readings in a flipped classroom?","<course-design><textbooks><interactive-teaching>"
"Is there a critical class size for student participation (students perspective)?","<technology-in-education><class-participation><large-lecture>"
"Studies which compare students with and without math training","<secondary-education><education-research>"
"How to balance short-term learning outcomes with long-term goals and ethical considerations","<reference-request><general-pedagogy>"
"Devising backup plan to become HS teacher as a late undergrad","<teacher-preparation><usa><certification>"
"How is calculus possible in a small number of very long class periods?","<course-design><calculus><homework>"
"How do I Create Geometric Drawings Efficiently?","<technology-in-education><presentation><software><lecture-notes>"
"Unit circle vs. ratios of right triangles vs. wave functions for introducing trig functions","<course-design><trigonometry>"
"What interesting properties of the Fibonacci sequence can I share when introducing sequences?","<calculus><sequences>"
"Research on reciprocal teaching of mathematics?","<reference-request><education-research>"
"Lancasterian/Monitorial system at a secondary level?","<secondary-education><general-pedagogy>"
"Why is distribution prioritized over combining?","<algebra><textbooks><definitions><community-colleges>"
"Impact of philosophy of mathematics upon effectiveness of instructor","<mathematical-pedagogy><philosophy-of-maths>"
"Approaches to Teaching for Questions Around Partitioning Space","<secondary-education><geometry><students-mistakes>"
"clasification of teaching licensures and certifications particularly for teacher-students","<teacher-training><teaching><certification>"
"Looking for a reference for highschool level readers","<undergraduate-education><secondary-education><reference-request><reference-books>"
"Differential forms in mechanics?","<undergraduate-education><vector-calculus><engineering-mathematics>"
"Can homework play a substantial role in the assessment of understanding in university math?","<homework><assessment>"
"Textbooks for mathematical/computing/physics teaching that are based on empirical research","<mathematical-pedagogy>"
"Teaching an abstract algebra class involving modules, best way to introduce operations on modules?","<intuition>"
"When should a kid have memorized the multiplication table?","<primary-education><multiplication-table>"
"What symbol is appropriate to represent a sum modulo N?","<notation>"
"Spiral learning in real analysis","<reference-request><curriculum><general-pedagogy><mathematical-analysis>"
"Colleges that showcase their calculus material online","<calculus>"
"Making co-ordinate geometry interesting for XI grade students","<mathematical-pedagogy><analytic-geometry>"
"looking for good and clear examples about graph theory apllied to scheduling","<community-colleges><graphing><scheduling>"
"How do you explain why perpendicular lines have negative reciprocated slopes?","<undergraduate-education><secondary-education><analytic-geometry>"
"Are there any online question bank of mathematics questions?","<mathematical-pedagogy><online>"
"How to start tackling a 200 page big script?","<self-learning><linear-algebra>"
"Mathematics minor requirements","<undergraduate-education><usa>"
"Resources for improving computational skills at the high school/university transition","<undergraduate-education><secondary-education><calculus><resource-request><calculations>"
"When assigning a late penalty for assignments is that penalty subtracted from the total or does it reduce the score by that percentage","<grading>"
"Multiple extra credit questions in a homework set","<undergraduate-education><student-motivation><homework>"
"Different ways to multiply decimals","<arithmetic-operations><arithmetic>"
"Textbooks for an independent study in point-set topology","<undergraduate-education><textbooks><self-learning><topology>"
"Dolciani and Sorgenfrey textbook collaboration","<secondary-education><textbooks><big-list>"
"Do you have an efficient way to view student responses to remote assignments allowing them to type math symbols and steps? (Middle + High school)","<homework><grading><assessment>"
"Has a List of Fundamental Mathematical Skills been compiled?","<undergraduate-education><mathematical-pedagogy><reference-request>"
"Do you teach different proofs or calculations of same question?","<calculus><proofs><concept-motivation><problem-solving>"
"Are these assumptions in statistics correct or beneficial?","<secondary-education><statistics>"
"Courses equivalent to College Algebra in other countries?","<undergraduate-education><secondary-education><algebra><usa>"
"Fundamental Ideas in Mathematics","<resource-request>"
"Linguistic recursion issues while writing Mathematics textbooks for Basic School","<language-use>"
"Mathematics acts as a filter to higher education","<education-research><mathematics-in-daily-life>"
"How does knowing more about mathematics help one's teaching of lower level course, such as calculus?","<undergraduate-education><calculus>"
"Studies about group tutoring sessions","<undergraduate-education><reference-request><concept-motivation><education-research><tutoring>"
"Good textbooks for a college Basic Geometry course?","<undergraduate-education><textbooks><geometry><community-colleges>"
"Difficulty in teaching the coordinates of a vector with respect to a basis $\{v_1,v_2,\ldots,v_n\}$","<undergraduate-education><linear-algebra><definitions><vectors>"
"Teaching three-year-old subtraction using the number line","<gifted-students><arithmetic-operations><preschool-education>"
"Geometry textbook with an abstract algebra emphasis","<undergraduate-education><textbooks><geometry><graduate-education><abstract-algebra>"
"When Euclid was used as a textbook, what exercises did students do?","<textbooks><geometry><homework>"
"In a typical 3rd-semester multivariate calculus course in the US, what kind of area integrals do students actually learn to do?","<undergraduate-education><vector-calculus><usa>"
"Alternating group without $S_n$","<undergraduate-education><abstract-algebra>"
"How to write slower on a blackboard?","<board-use><lecturing>"
"Why do some students struggle so much with fractions?","<primary-education><fractions>"
"A more rigorous approach to Precalculus","<mathematical-pedagogy><precalculus>"
"Midterm in Mathematics Courses","<reference-request><course-design><assessment>"
"How to explain the motivation of parentheses in addition, subtraction and multiplication?","<mathematical-pedagogy><primary-education><arithmetic>"
"Looking for undergraduate degree in Maths through distance learning","<undergraduate-education>"
"How do I help a 6-year-old understand the meaning of her sums","<tutoring><arithmetic-operations>"
"How to show that a radical can be partially simplified","<undergraduate-education><algebra>"
"Simpler explanation for finding the vertex of a parabola","<secondary-education><geometry><functions>"
"Should we teach trigonometric substitution?","<undergraduate-education><calculus><curriculum><integration>"
"Is there an introductory book on linear algebra that makes use of simple concrete examples to teach the underlying theory?","<reference-request><textbooks>"
"How to teach brackets?","<notation>"
"Good apps on the iPad for inquiry-based exploration in a quantitative reasoning course","<technology-in-education><inquiry-based-learning><ipads><quantitative-reasoning>"
"How can I improve my concept map?","<mathematical-pedagogy><self-learning><intuition><aids><concept-maps>"
"How to think mathematically?","<secondary-education><education-research>"
"Will the low-achieving children always be there?","<advising>"
"When did US mathematics programs start failing to prepare incoming students for books like ""Baby"" Rudin?","<mathematical-analysis><history>"
"Algebra or Analysis","<graduate-education>"
"Textbook for first course in linear algebra","<textbooks><linear-algebra>"
"Teaching the use of pictures in proofs","<undergraduate-education><proofs>"
"What is the best hardware/software available to give online classes","<technology-in-education>"
"Are there any video games/app to teach children at age 3-4-5?","<technology-in-education><software><preschool-education>"
"How to get students in a under-graduate linear algebra course interested in determinants?","<undergraduate-education><concept-motivation><linear-algebra>"
"Are there free, offline mathematics assesment and learning programs for grades 1 to 12?","<software>"
"Has any research been done on the topic of ""fact-based"" versus ""rule-based"" understanding?","<reference-request>"
"How to motivate 'Theory of Computation'?","<undergraduate-education><student-motivation><concept-motivation><computer-science>"
