title,tags
"Proof that the maximum element in a linear search is found log(n) times","<probability><divergent-series>"
"Definition of finite vs definition of countable set (using Surjective function)","<elementary-set-theory>"
"How to do this integral without the inverse hyperbolic tan","<calculus><integration>"
"Construction of Grassmann manifolds","<algebraic-geometry><manifolds><geometric-topology><characteristic-classes><grassmannian>"
"Solve the differential equation $\left(y'\right)^3+\left(3x-6\right)\cdot \:y'=3x$","<ordinary-differential-equations>"
"test for convergence or divergence","<calculus><sequences-and-series><computational-mathematics>"
"Intuitive Explanation why the Fundamental Theorem of Algebra fails for infinite sums","<complex-analysis>"
"Determine of the subset of $\mathbb{R}^3$ is a subspace.","<linear-algebra>"
"determinate moment problem","<real-analysis><functional-analysis><moment-problem>"
"Antiderivative as an integral operator from $L^2(0,2\pi)$ to $L^2(0,2\pi)$","<functional-analysis><operator-theory><hilbert-spaces><compactness>"
"Does an extension operator in Sobolev spaces commute with derivative operators?","<functional-analysis><sobolev-spaces><approximation-theory>"
"Counting problem(product rule)","<combinatorics><discrete-mathematics>"
"Explicit eigendecomposition of a rank-$2$ matrix","<linear-algebra><matrices><eigenvalues-eigenvectors><matrix-decomposition>"
"SDE of a (geometric/standard) Brownian motion","<brownian-motion><stochastic-differential-equations>"
"How to uniquely code 2 reals numbers b and c into a single real number X?","<real-analysis><arithmetic>"
"Optimization Problem $\sum_{i=1}^{a}\sum_{j=1}^{b}\sum_{k=1}^{n_{ij}}(y_{ijk}-\mu-\alpha_i-\eta_j-\gamma_{ij})^2$","<statistics><statistical-inference><maximum-likelihood>"
"$ \ \vec a × \vec b = \vec b × \vec c = \vec c × \vec a $ implies existance of a triangle","<geometry><analytic-geometry><triangles><cross-product>"
"If $e\leq d$, prove that $A_q(n,e)\geq A_q(n,d)$.","<proof-writing><cryptography><coding-theory>"
"Why does $\log_{10}(10^x + 1) - x$ approximate $\log_{10} e$?","<algebra-precalculus><numerical-methods><logarithms>"
"Define number by relation to $0$?","<real-numbers>"
"Elliptic Paraboloid, and Plane $y=1$, and Rate in respect to $x$ at point $P(2,1,7)$","<real-analysis><calculus><partial-derivative><solution-verification><plane-curves>"
"$\lim_{R \to \infty}\int^R_{-R}x^3dx$ implies $\int^{\infty}_{-\infty}x^3dx$ exists?","<real-analysis><limits>"
"Integer optimization method","<optimization><integer-programming>"
"How do we define an ""intuitive"" average on this function?","<probability-theory><measure-theory><probability-distributions><average><measurable-functions>"
"On the Reduction Lemma (the existence of an $(n-1,M,d-1)$-code)","<proof-explanation><cryptography><coding-theory>"
"Locus of intersecting perpendicular tangents of conic, using polar coordinates","<analytic-geometry><conic-sections><coordinate-systems><polar-coordinates><locus>"
"function not integrable if the asymptotics of the volume of upper level sets is $\Omega(r^{-1})$","<real-analysis>"
"Successive approximations of a function (taylor formula derivation)","<taylor-expansion>"
"Basis of a subspace of $\mathbb{R}^5$ spanned by vectors $(1,3,-1,2,3)$, $(2,7,-2,5,2),$ and $(1,4,-1,3,-1)$.","<linear-algebra><matrices><vector-spaces>"
"if $\sum a_n$ is a divergent series of positive terms then so is $\sum \sqrt{a_n}$","<sequences-and-series><solution-verification><alternative-proof>"
"What is the role of ""X"" symbol in the box-and-whisker plot?","<descriptive-statistics>"
"If $A_n B_n$ converge to the identity matrix, is it true that $A_n^{1/2} B_n^{1/2} \to I$ as well?","<linear-algebra><matrices>"
"Evaluate $\int_0^\pi \frac{\sin\frac{21x}{2}}{\sin \frac x2} dx$ (from MIT Integration Bee)","<integration><definite-integrals><contest-math><trigonometric-integrals>"
"Probability of ruin - calculating an integral after exponential change of measure","<probability><integration><sampling>"
"Fourier transform $G(f)$ of a Gaussian signal","<integration><functions><fourier-transform>"
"Solution for a first order non-linear partial differential equation","<partial-differential-equations><characteristics>"
"$X$ is a first-countable space and $A \subset X$, show $x \in \bar A \iff \exists (x_n) \rightarrow x$","<general-topology>"
"Find asymptotic distribution of $l(\hat{\theta_n}) - l(\theta_0)$","<statistics><probability-distributions><asymptotics><estimation><log-likelihood>"
"Why is $k[x,y,z,u]/(x^2-y^2z, uy-x) \cong k[y,u]$?","<algebraic-geometry><ring-theory><commutative-algebra>"
"Let S be the set of non ﬁnitely generated ideals in R. Suppose A is a maximal element in S. Then A is a prime ideal","<abstract-algebra>"
"Find the distance from $(1, 1, 1)$ to the subspace span ${(1, 1, 0), (0, 1, 1)}$ of $\mathbb R^3$.","<linear-algebra><vector-spaces><inner-products>"
"Maximum number of linearly independent vectors subject to a constraint","<linear-algebra><vector-spaces><euclidean-geometry>"
"Riemann/Lebesgue integrability of a function","<real-analysis><calculus>"
"Integral on a curve $\int_C (x^2+y^2)ds$","<integration><curves>"
"Deducing homotopy equivalence from a coexact sequence","<reference-request><algebraic-topology><dynamical-systems>"
"Is there a formula for the silver spiral?","<polar-coordinates><means>"
"Given any $n+2$ integers, show that there exist two of them whose sum, or else whose difference, is divisible by $2n$.","<elementary-number-theory><proof-verification><elementary-set-theory><pigeonhole-principle>"
"Pigeonhole Principle Problem - need help understanding the concept","<pigeonhole-principle>"
"Polar coordinates to find area","<polar-coordinates>"
"$\sum_{n=1}^{\infty} {2^n}{\sin(\frac{1}{3^nx})}$ is uniformly continuous on the Interval $(1,\infty)$?","<convergence-divergence><uniform-convergence>"
"Exact differential equations, what are we trying to find exactly?","<ordinary-differential-equations>"
"Is it possible to find a ratio/rate for this sequence?","<sequences-and-series>"
"Inclusion-Exclusion Problem - derangement","<combinatorics><inclusion-exclusion>"
"Probability machine 1 is the first to fail","<probability><proof-verification>"
"Proving eigenvectors of matrix products","<linear-algebra><matrices>"
"Characterizing critical points of a complex valued function.","<complex-analysis><multivariable-calculus>"
"Integrating with a non-analytical solution (random effects)","<integration><random-variables><normal-distribution><monte-carlo><approximate-integration>"
"Steady state error using final value theorem","<control-theory>"
"Bounding sub-Gaussian tail events by Gaussian tail events?","<probability><probability-theory><random-matrices><concentration-of-measure>"
"Comparison of two self ratings","<statistics><math-software><number-comparison>"
"I want a text book with various examples","<number-theory><reference-request>"
"A simple question about the proof of theorem 3.42 in Walter Rudin's ""Principles of Mathematical Analysis""","<calculus><sequences-and-series><proof-verification>"
"ADMM - proximal vs. augmented lagrangian interpretation: stuck on algebraic step :(","<linear-algebra><convex-optimization>"
"The Integral $\int \frac {dx}{(x^2-2ax+b)^n}$","<calculus><indefinite-integrals><partial-fractions>"
"What is a Spectral Graph Convolution?","<graph-theory><convolution>"
"Determine stationary distribution of Markov Chain","<markov-chains>"
"Prove that any open set of $\mathbb{R}^n$ is a countable union of open $n$-rectangles","<real-analysis><general-topology><analysis>"
"Existence of analytic function having different values on $|z|=1$ and $|z|=2$","<complex-analysis><entire-functions>"
"Compute $\int_C x\sqrt{x^2-y^2} \mathrm ds$","<integration><curves>"
"Is it true that the generators of a commutative ring is finite?","<abstract-algebra><ideals>"
"sequence of inequalities information theory","<probability-theory><information-theory>"
"Is quasi-isomorphism of $A_{\infty}$ algebras invertible","<reference-request><homological-algebra>"
"Trace of a the inverse of a complex matrix","<inverse><trace>"
"Circumpolar Equation Derivation","<geometry><mathematical-astronomy>"
"Counting problem k-tuples","<combinatorics>"
"Finding the orthogonal complement of a subspace of $\mathbb{R}^4$","<linear-algebra><matrices><vector-spaces><orthogonality>"
"How many edges are in a graph $G$ such that $G-v$ is a tree $\forall v \in V(G)$?","<graph-theory>"
"Find a limit using a functions integral sums","<limits>"
"How to prove this gradient theorem in vector calculus","<calculus><integration><vector-analysis>"
"Getting x in terms of y","<algebra-precalculus>"
"Square roots and solutions to equations with squares. Why are there negatives and positives?","<complex-numbers><radicals>"
"Find the jordan basis for $A$","<linear-algebra><eigenvalues-eigenvectors><jordan-normal-form>"
"Is there cardinal number $\kappa$, such that $\kappa$ is not inaccessible and $2^{<\kappa}<\kappa^{<\kappa}$?","<set-theory><cardinals>"
"Interpret the characteristic function of $A\backslash B$ in terms of $f_A$ and $f_B$.","<functions><elementary-set-theory>"
"Tranform region of type 1 into a region of type 2","<calculus><multivariable-calculus>"
"Are metrics that determine the same topology, equivalent?","<general-topology><metric-spaces>"
"induction with binomial coefficients 6","<induction><binomial-coefficients>"
"Derivating matrixs.","<calculus><matrices><derivatives>"
"Is the space ($\Bbb R,d)$ totally bounded? compact?","<real-analysis><compactness>"
"In a UFD if $x$ is irreducible, then $(x)$ is prime","<abstract-algebra><ring-theory><unique-factorization-domains>"
"How to proof this this sentence with natural deduction?","<logic>"
"Prove that $I_X: X \to X$ defined by $I_X(x) = x$ is a bijection","<functions><discrete-mathematics>"
"Can the commutator $[A,\,B]$ be derived if $\left[A,\,B^2\right]$ is known?","<noncommutative-algebra>"
"chain rule , partial derivative","<multivariable-calculus><partial-derivative><chain-rule>"
"Height of Irregular Pyramid Given it's Faces","<geometry><polyhedra>"
"Does the following function has a maximum?","<real-analysis><limits><irrational-numbers><maxima-minima>"
"A mathematical function for counting forwards then backwards","<arithmetic>"
"What is meant by $\infty^1$, $\infty^2$, $\infty^3$?","<group-theory><notation>"
"If $ \lim_{n\to \infty} (a_n - b_n) = 0$, with $\{a_n\}$ converging, then $\{b_n\}$ converges to the same limit.","<real-analysis><sequences-and-series><proof-verification>"
"show that $[a]^4=[3]$ is not possible","<proof-verification><modular-arithmetic><proof-explanation>"
"k colouring vertices","<combinatorics><trees><coloring>"
"Series Convergence, Did I do this correctly","<calculus><sequences-and-series><limits>"
"Continuous almost everywhere function that is no continuous function equals to it","<real-analysis><measure-theory><lebesgue-measure>"
"Two measures in $\mathbb{R}^{2}$","<measure-theory><lebesgue-measure>"
"Dependant random variables with covariance equal to $0$","<statistics>"
"How do I find a missing side of a triangle with Only 2 given side lengths?","<trigonometry><word-problem>"
"For what values of $n$ can {1, 2, . . . , n} be partitioned into three subsets with equal sums?","<elementary-number-theory>"
"Let $m$ be a finite Borel measure on a metric space $(X,d)$. Show $\displaystyle\lim_{\rho \to r}m(B_x(\rho)) = m(B_x(r))$","<real-analysis><analysis><measure-theory>"
"Computing the state transition matrix","<linear-algebra><ordinary-differential-equations><matrix-calculus><control-theory><linear-control>"
"Inversion of Gamma and Zeta Functions through Fourier Transform","<fourier-analysis><improper-integrals><gamma-function><fourier-transform><riemann-zeta>"
"How to relate Cosh and $e$ in some expression?","<algebra-precalculus><functions><hyperbolic-functions>"
"An application of the Inclusion Principle to Chemistry? (Proof Verification)","<combinatorics><proof-verification><inclusion-exclusion><chemistry>"
"Sigmoid function symmetry property","<symmetric-functions>"
"Prove by induction involving calculus","<calculus><induction>"
"Riemannian metrics on vector bundles according to Jeffrey. M. Lee's book","<differential-geometry><riemannian-geometry><vector-bundles>"
"How to solve this problem on the differentiation under integral sign","<calculus><integration><derivatives>"
"Brownian motion and elliptic PDE","<partial-differential-equations><stochastic-processes><monte-carlo>"
"Intuition for GBM's SDE","<intuition><brownian-motion>"
"Can Fredholm integral equation of the first type be represented as a differential equation?","<integration><ordinary-differential-equations>"
"Dihedral group as a direct product","<group-theory><finite-groups><dihedral-groups>"
"Parseval's Theorem","<integration><fourier-analysis>"
"Significant Digits for the Sum of Three or More Numbers","<arithmetic>"
"A (simple?) question about continuous functions","<calculus><real-analysis><optimization><continuity>"
"$s_{n+1} = \sqrt{s_n+1}$ converges to $\frac{1+\sqrt{5}}{2}$","<sequences-and-series><limits>"
"For a region, is there always a $f$ which has no holomorphic extension to any larger region","<complex-analysis>"
"Reference for closed map lemma","<general-topology><reference-request>"
"Solve congruence equation $3373x \equiv 2^{485} \pmod{168}$","<elementary-number-theory><divisibility><congruences>"
"Distributing different fruit","<combinatorics><combinations>"
"How to find the inverse of 70 (mod 27)","<modular-arithmetic><cryptography>"
"$G=C_{p}\times C_{p^2}$, describe $\mathrm{End}(G)$","<group-theory><finite-groups>"
"Number of Diagonal Crossings in Regular Polygon","<combinatorics><geometry>"
"Special functions and diff eq's ......","<ordinary-differential-equations>"
"Is the submodule of a finitely generated free module finitely generated?","<abstract-algebra><modules>"
"Is a closed interval in the real numbers infinite?","<calculus><general-topology>"
"Supremum - Proof.","<real-analysis>"
"Show that $\gcd(a,bc)=1$ if and only if $\gcd(a,b)=1$ and $\gcd(a,c)=1$","<abstract-algebra><elementary-number-theory><divisibility><gcd-and-lcm>"
"Is there a distribution like this?","<probability-distributions>"
"How to integrate greatest integer function $\int^{1.5}_0 \lfloor x^2 \rfloor \, dx$","<calculus><functions><integration>"
"Show that $ \sum_{r=1}^{n-1}\binom{n-2}{r-1}r^{r-1}(n-r)^{n-r-2}= n^{n-2} $","<combinatorics><summation><binomial-coefficients>"
"How was the first log table put together?","<reference-request><logarithms><math-history>"
"Please Help me solve as detailed as possible. I can't remember.","<algebra-precalculus><systems-of-equations>"
"How prove this limit $\displaystyle\lim_{n\to \infty}a_{n}=1$","<sequences-and-series><limits><roots>"
"How can a formal language $L$ concatenated with itself $L^k$ ever equal $L^{k+1}$","<formal-languages>"
"Self adjoint operator.","<linear-algebra>"
"Kalman filtering with angle measurements","<approximation><bayesian-network><kalman-filter>"
"Addition a point on an elliptic curve with an integer value","<elliptic-curves><cryptography>"
"If $x_n \to x$ in Hilbert space, does $|x_n| \leq C|x|$?","<functional-analysis><hilbert-spaces>"
"Heat equation $\frac{\partial \theta}{\partial t}=\kappa \frac{\partial ^2\theta}{\partial x}$ using two transformations to solve","<partial-differential-equations><transformation>"
"Multivariate Hypergeometric Distribution With Wildcard","<statistics><probability-distributions><binomial-coefficients>"
"Calculating an axis aligned bounding box for a transformed sphere","<conic-sections>"
"If $\|\left(f'(x)\right)^{-1}\|\le 1 \Longrightarrow$ $f$ is an diffeomorphism","<real-analysis><algebraic-topology><covering-spaces>"
"Fejer-Riesz Lemma","<complex-analysis><polynomials>"
"Finding marked price","<algebra-precalculus>"
"How many distinct holomorphic function from $\mathbb{C}$ to $\mathbb{C}$ is there?","<complex-analysis><cardinals><self-learning>"
"How to change variables of a probability distribution when variables have different dimensions","<probability-distributions>"
"If a statement is true for a particular n and for n+2, what needs to be done to prove the statement is true for every positive integer?","<induction>"
"Is countable intersection of open sets an open set???","<general-topology>"
"How do I transform this equotation","<algebra-precalculus>"
"Wedderburn's theorem","<abstract-algebra><ring-theory><finite-fields>"
"Norm inequalities on $\mathbb{R}^n$","<linear-algebra><inequality><vector-spaces><norm><normed-spaces>"
"How to get to the first step of solving $z^2=i$?","<complex-numbers>"
"On Bachet's Duplication Formula and the number $-432$","<abstract-algebra><number-theory><reference-request><diophantine-equations><elliptic-curves>"
"Burnside's formula on a hexagon","<abstract-algebra><group-theory><permutations>"
"Riemann integral of $ f(x)=x^2$","<real-analysis><analysis><integration>"
"Quotient ring is a UFD","<abstract-algebra><commutative-algebra><ring-theory><unique-factorization-domains>"
"What's the factor of $x^{40} $ in $(1+x^4+x^5)^{100}$?","<combinatorics><discrete-mathematics>"
"Looking for functions $f$ with $\int_{-\infty}^{\infty}f(x)\,dx = 1$.","<big-list><calculus><analysis>"
"Counting primes","<number-theory><algorithms><prime-numbers>"
"Approximation symbol: Is $\pi \approx 3.14\dots$ equivalent to $\pi \fallingdotseq 3.14\dots$?","<definition><approximation>"
"Meaning of closed points of a scheme","<intuition><algebraic-geometry>"
"Proving the Riemann Hypothesis without revealing anything other than you proved it","<computer-science><riemann-hypothesis>"
"Computation with a memory wiped computer","<computer-science>"
"Probability to find connected pixels","<probability><graph-theory>"
"Visualising functions from complex numbers to complex numbers","<big-list><math-software><complex-analysis>"
"What is the easiest known expression for inverse of Laplace transform?","<analysis><integral-transforms>"
"Exact differential eqns and exact differential forms","<ordinary-differential-equations>"
"Why are Hopf algebras called quantum groups?","<terminology><noncommutative-geometry><quantum-groups>"
"Learning Lambda Calculus","<logic><learning><online-resources><lambda-calculus><type-theory>"
"How to prove and interpret $\operatorname{rank}(AB) \leq \operatorname{min}(\operatorname{rank}(A), \operatorname{rank}(B))$?","<linear-algebra><matrices><inequality><matrix-rank>"
"What's the difference between open and closed sets?","<general-topology><terminology><intuition>"
"What is the difference between matrix theory and linear algebra?","<linear-algebra>"
"Best Algebraic Geometry text book? (other than Hartshorne)","<big-list><reference-request><algebraic-geometry>"
"Fourier transform for dummies","<fourier-analysis><fourier-transform>"
"Resources for getting maths on to the web","<soft-question>"
"Proving the Shoelace Method at the Precalculus Level","<geometry><algebra-precalculus><contest-math><analytic-geometry>"
"Examples of well-displayed mathematics on the internet","<soft-question><online-resources>"
"Usefulness of Conic Sections","<algebra-precalculus><conic-sections><education>"
"Number of colorings of cube's faces","<combinatorics>"
"Why are derivatives specified as d/dx?","<calculus><reference-request><notation><math-history>"
"How do I convert from Cartesian to conical coordinates?","<geometry><coordinate-systems>"
"Different definitions of trigonometric functions","<geometry><calculus><trigonometry>"
"Group With an Endomorphism That is ""Almost"" Abelian is Abelian.","<group-theory>"
"Verifying that $\mathcal{P}(\mathbb{N})\times\mathcal{P}(\mathbb{N})=\text{ the }\sigma\text{- algebra generated by }\mathbb{N}\times\mathbb{N}$","<elementary-set-theory>"
"Converting between SVD and Eigenvector-based expressions","<linear-algebra><matrices><eigenvalues-eigenvectors><svd>"
"Does equality of antiderivatives imply equality almost everywhere?","<real-analysis><measure-theory>"
"Studying for Abstract Algebra: Group","<abstract-algebra>"
"Improper integral of $\dfrac{x^2}{ e^x−1}$","<calculus><integration><improper-integrals>"
"Compute remainder of division","<divisibility>"
"Rank reduction to satisfy Barvinok's upper bound & Rank of a set notation","<geometry><convex-optimization><matrix-rank><semidefinite-programming>"
"Sum of three bijections","<elementary-set-theory>"
"Relative Entropy and variation formula for $C_c$","<functional-analysis><probability-theory><entropy>"
"Commuting matrices and exponential function","<matrices><exponential-function>"
"Key Features of This Rational Function","<rational-functions>"
"$Hom_G(\pi,\sigma)$ = $Hom_{\mathfrak{g}}(d\pi,d\sigma)$?","<representation-theory><lie-groups><lie-algebras>"
"which chain rule","<multivariable-calculus>"
"How to isolate colour Green from the Picture.","<matlab>"
"For$ f$ non-negative function, show that $f$ is meseurable if for some $p>0$ $f^p$ is measurable.","<real-analysis><measure-theory><lebesgue-measure>"
"Set theory, operation with products, union and intersection","<elementary-set-theory><logic>"
"algebraic determination of the correct phase angle","<trigonometry>"
"Finding the derivative of the equation.","<calculus><derivatives>"
"Asymptotic expansion of $\sin\left(\pi + \exp(-1/\epsilon)\right)$","<asymptotics>"
"Rewrite formula","<algebra-precalculus><logarithms>"
"The smallest number $n$ such that $5^{84}$ divides $n!$.","<elementary-number-theory>"
"Volumes of solids by rotating","<volume>"
"How can I minimize the error from fitting two functions to different parts of data?","<statistics><data-analysis>"
"${P(|X|\geq \lambda)\leq f(\lambda)}$","<probability><probability-theory>"
"Prove the linear transformation that takes all linear maps T: V → W to their respective matrix representations is an isomorphism.","<matrices><functions><vector-spaces><transformation>"
"Is the center of a p-group non-trivial?","<group-theory><infinite-groups>"
"Does this limit exists ? $\lim_{x \to 0} \sec\sqrt{x}$","<calculus><limits>"
"Every sequence with $\lim x_n=c$, show that $f$ is continuous at $c$","<real-analysis><sequences-and-series><convergence-divergence>"
"What is the definition of ""Augmentation Ideal Filtration""?","<abstract-algebra><reference-request><algebraic-topology><definition>"
"How to prove that the diameter of a graph is less than 2 given that the minimum degree of any vertex in G is greater than the number of vertices / 2","<graph-theory>"
"How to find a minimal polynomial","<abstract-algebra><polynomials><field-theory><minimal-polynomials>"
"continuity of a metric d","<real-analysis><metric-spaces>"
"Cardinality of the set of non isomorphic structures of fixed cardinality","<logic><model-theory>"
"A question about $f(x)\equiv 0$","<integration><integral-equations>"
"Does a surjection from x to y imply a surjection of their power sets?","<elementary-set-theory>"
"Not unit-speed curve on a sphere","<differential-geometry>"
"Value of a series","<calculus><sequences-and-series>"
"Ellipse $3x^2-x+6xy-3y+5y^2=0$: what are the semi-major and semi-minor axes, displacement of centre, and angle of incline?","<analytic-geometry><conic-sections>"
"Show that map from $\text{Hom$_A$($_AA,M$)} \to M$ is injective","<abstract-algebra><modules>"
"How do I show that an element of a topological space lies in the closure of a subset of a topological space?","<general-topology>"
"Why are these two quotients equal?","<abstract-algebra><polynomials><ideals>"
"How does the following example prove that this set of axioms for a probability field is consistent?","<probability-theory><logic>"
"John von Neumann- Exercise about a Fly and two Trains","<calculus><recreational-mathematics>"
"Any results for small number Goldbach conjecture research?","<analytic-number-theory><goldbachs-conjecture>"
"generalization of geometric series $ \sum_{k=0}^\infty x^{p(k)} $","<sequences-and-series><polynomials><closed-form>"
"Path integral question","<integration><complex-analysis>"
"Loop of a topological group acting on different points being homotopic to constant maps.","<algebraic-topology>"
"Help with the integral $\int_{-b/2}^{\frac{\pi-10b}{20}}\frac{\mathrm{d}x}{x^2+bx+c}$","<calculus><definite-integrals>"
"When does Coh$(X)$ have enough locally frees?","<algebraic-geometry>"
"How find this binomial-coefficients sum $\sum_{k_{1}+k_{2}+\cdots+k_{d}=n}\binom{n}{k_{1},k_{2},\cdots,k_{d}}^2$","<binomial-coefficients>"
"prove a set is closed in $C^0$","<real-analysis><uniform-convergence>"
"I am not quite sure how to complete this question, may someone please guide me in the right direction?","<calculus>"
"Inverse Nasty Integral","<integration><definite-integrals><rational-functions>"
"Non-Hamiltonian Graphs with Disjoint Perfect Matchings?","<graph-theory><hamiltonian-path>"
"Let $F$ be a set of subsets of the set $\{1,2,3,...,n\}$ such that:","<combinatorics><elementary-number-theory><contest-math>"
"How do I convert this double integral to polar?","<multivariable-calculus><polar-coordinates>"
"Closed form solution for time-dependent harmonic oscillator","<ordinary-differential-equations><closed-form><matrix-equations><nonlinear-system>"
"How often do we need to iterate this to get $\log (n)$?","<sequences-and-series><limits>"
"How many ways to select 3 numbers from $1-30$ so that the sum of them is a multiple of 3?","<combinatorics><combinations>"
"Find $f(0)$ if $f(x)= \sum\limits_{n=1}^\infty \frac{(-1)^{n+1}x^{2n-2}}{(2n+1)!} $","<real-analysis><analysis><taylor-expansion>"
"Conditions for controllability canonical form to be non-observable but detectable","<dynamical-systems><control-theory><canonical-transformation>"
"The shift of an integral variable whch is related with infinity","<convergence-divergence><improper-integrals>"
