title,tags
"How can I make ""complex"" graphs that combine multiple functions with a software?","<calculus><software><functions><precalculus><graphing>"
"Recommend a website for creating geometric figures","<geometry><software>"
"Using an iPad to write on pdf slides","<technology-in-education><software><lecture-notes><ipads>"
"If I want to pursue theoretical mathematics, especially Category theory, do I ever need programming skill?","<computer-programs><category-theory>"
"Kid, 8 years old, developed a new calculation algorithm","<gifted-students>"
"Should I go over examples straight from the textbook in Calculus lectures?","<textbooks>"
"What are teachers' expectations on private tutoring in secondary education?","<secondary-education><tutoring>"
"How to create educational linear algebra animations?","<undergraduate-education><linear-algebra>"
"Pythagorean triples","<undergraduate-education><teaching><number-theory>"
"Can undergraduate math courses be taught at a high school level?","<secondary-education>"
"Is Calculus AB/BC a 'bad course?'","<calculus>"
"Would it be constructive to teach a whole course on how to evaluate certain hard integrals?","<integration>"
"Favorite secondary math manipulatives?","<secondary-education><manipulatives>"
"Co-curricular lessons between geometry and chemistry?","<secondary-education><geometry><curriculum><physical-sciences>"
"Beautiful planar geometry theorems not encountered in high school","<undergraduate-education><geometry>"
"Introductory exercise for the addition of large natural numbers","<student-motivation><examples><teaching><arithmetic-operations>"
"Quadratic equations using complex math but with no imaginary roots","<complex-numbers>"
"toys/manipulatives for exploring graph theory","<manipulatives><graph-theory>"
"Good Source for German Tank Problem","<statistics>"
"How to address opportunities for improvement with a teacher","<primary-education><examples><teaching>"
"Algorithmic thinking problems","<course-design><technology-in-education><examples>"
"What on earth was Old Math?","<history><new-math>"
"What is abstraction and generalization ?","<self-learning>"
"Reference request for studies on gender in math examples, homework problems, or math exams","<mathematical-pedagogy><reference-request><word-problems><women><gender>"
"Telescoping sums to introduce integral and derivative relationship","<calculus>"
"Is there research for or against such an approach in teaching calculus?","<mathematical-pedagogy><calculus><infinitesimals>"
"Benefits of students grading each other's (or their own) homework or quizzes?","<homework><grading>"
"Does there exist an international certification of mathematical skill?","<teacher-preparation><certification><teacher-evaluations>"
"The meaning of equal sign in unit conversion","<primary-education><fractions><equal-sign>"
"Is it better to provide students with guided notes or to have them write their own notes, or both?","<teaching><lecture-notes>"
"Proof of why BODMAS (or BIDMAS) works?","<notation><arithmetic-operations><calculations>"
"Resources on 3D transforms, vectors, coordinate systems","<technology-in-education><geometry><linear-algebra><intuition><trigonometry>"
"I'm a self learner, what are some ways that I can compensate for the lack of a study group?","<student-motivation><self-learning>"
"How to deal with a talented 11-year-old pupil?","<secondary-education><gifted-students>"
"A good (open) place to let colleagues/peers review the material of one lecture?","<meta>"
"Calculus Text that Uses Sequences to Define Limits","<calculus><textbooks>"
"Is there a remedial college textbook that includes basic logic?","<undergraduate-education><textbooks><community-colleges><remedial-courses>"
"videos for teaching and publishing in youtube","<interactive-teaching>"
"Justifying non-expert lecturer","<undergraduate-education>"
"Looking for a progression of learning to get back my math skills","<self-learning>"
"The best way to introduce trigonometric functions in a rigorous analysis course","<undergraduate-education><mathematical-analysis><trigonometry>"
"How to design a fair oral exam for >10 students?","<undergraduate-education><graduate-education><oral-exams>"
"The Lord of the Fields","<mathematical-pedagogy><course-design><classroom-management>"
"Models and strategies for teaching fractions in 7th grade mathematics","<secondary-education><fractions>"
"What do you say to students who want to apply Banach-Tarski theorem in practice?","<mathematical-pedagogy><classroom-management><logic><set-theory>"
"When should I say ""nothing is as it seems""?","<undergraduate-education><mathematical-pedagogy><intuition>"
"How does one create ""good"" math problems?","<problem-design>"
"What can be said about Lie groups in a first abstract algebra course?","<undergraduate-education><curriculum><abstract-algebra>"
"Quantifying arthmetical skill","<reference-request><arithmetic>"
"What are the fundamentals of writing practice questions for early teen students?","<problem-design><problem-solving><physical-sciences>"
"Are document cameras widely used at college level?","<technology-in-education>"
"Tutoring Mathematics at University","<undergraduate-education><tutoring>"
"Is there a base-independent term for numbers written out with decimal/binary points?","<terminology><rational-numbers>"
"Shanghai math -- what is it, and how good is it?","<textbooks><primary-education><interactive-teaching>"
"Teaching Completing the Square","<secondary-education><algebra>"
"How to effectively use colors on a whiteboard?","<presentation>"
"How to use these actions words for subtraction?","<language-use><arithmetic-operations>"
"What is ""subtract 4 from 3 times X"" and why?","<algebra>"
"Why don't textbooks explain proofs' discovery?","<proofs>"
"A4 paper of notes in an exam","<undergraduate-education><exams><graduate-education>"
"Is Calculus Necessary?","<calculus><reference-request><curriculum><discrete-math>"
"What's the word for addition and subtraction without borrowing or carrying over?","<primary-education><arithmetic-operations><preschool-education><mental-math>"
"Functions, Domains, and Ranges in Precalculus","<undergraduate-education><functions><precalculus>"
"Seeking references for why it is good that students understand why mathematical rules work","<undergraduate-education><reference-request><undergraduate-research>"
"Definition of Trapezoid","<geometry><terminology><definitions>"
"Sensible amount of repetition 7 year old","<reference-request><primary-education><teaching><arithmetic>"
"What story and one-digit Natural Numbers best fit Bayes' Theorem chart?","<probability>"
"How can I convince authors to publish the Instructor's Solution Manual to students?","<textbooks>"
"Pros/Cons of using a single story in multiple examples to demonstrate different points","<undergraduate-education><examples>"
"Why do we still teach the determinant formula for cross product? And is it as bad as I think it is?","<undergraduate-education><calculus><notation><vector-calculus><vectors>"
"Pattern and Structure Mathematics Awareness Program (pasmap)","<reference-books><resource-request><book>"
"Support modelling cycle through differentiated means","<secondary-education><applied-mathematics><applications>"
"What is the name of this teaching style?","<teaching>"
"What determines whether a textbook publishes all solutions to exercises?","<textbooks>"
"Is $\overline{AB} \cong \overline{BA}$ usually taught as an instance of the symmetric property of congruence?","<secondary-education><geometry><proofs><usa>"
"Are there any university programs that ""supersize"" calculus courses?","<mathematical-pedagogy><calculus><united-states>"
"Term for candidates for inflection points","<calculus><terminology><derivative>"
"Can we define length and perpendicularity not via an inner product?","<geometry><linear-algebra>"
"Examples where roots are necessary for the solution","<calculus><student-motivation><examples><concept-motivation>"
"What kind of math will be mandatory in the future?","<mathematical-pedagogy><creativity><syllabus>"
"Preparation to exams","<textbooks><geometry>"
"Does ""factor"" mean simply the multiplication (of any functions, numbers etc)","<terminology>"
"Correct term to say that a number divides another number ""evenly""?","<mathematical-pedagogy><language-use>"
"What are the historical reasons for the hostility against standardized testing in the US?","<testing>"
"What are non-math majors supposed to get out of an undergraduate calculus class?","<undergraduate-education><calculus>"
"Nontraditional calculus recitations","<undergraduate-education><mathematical-pedagogy><calculus><classroom-management><class-participation>"
"$1000 to spend on a math classroom?","<secondary-education><technology-in-education>"
"Should we tell students to never replace parts of an expression by their limits when taking a limit?","<calculus><limits>"
"How are U.S. students placed in math classes?","<secondary-education><classroom-management>"
"Rewards based educaton","<secondary-education><education-research>"
"How to explain the topic of Fourier transform interactively?","<undergraduate-education><concept-motivation>"
"Is Knuth's suggestion on teaching calculus a good idea?","<mathematical-pedagogy><calculus>"
"Is this example of Leibniz notation sloppy?","<calculus><notation>"
"Average Rate of Change isn't/is Statistics","<calculus><mathematical-pedagogy>"
"Why are we so careful in saying that dy/dx is not a fraction?","<calculus><mathematical-pedagogy>"
"Using terminology for the different concepts of rational number","<primary-education><fractions><terminology>"
"Examples of Applications of Basic Mathematics to Computing","<undergraduate-education><examples><concept-motivation>"
"Group theory via actions","<undergraduate-education><mathematical-pedagogy><abstract-algebra>"
"Exercises to go with Simon's ""Representations of finite and compact groups""","<reference-request><exercises>"
"Grade 8 ""Question of the Day"" Ideas","<secondary-education><problem-design>"
"Resource about notation for students","<reference-request><notation><online-instruction>"
"How to propose subjects for bachelor's theses?","<undergraduate-education><graduate-education><undergraduate-research><advising>"
"Direct applications and motivation of trig substitution for beginning calculus students","<calculus><concept-motivation>"
"Is there a simple explanation for calculus classes of why partial fractions work?","<calculus>"
"Can we motivate undergraduates by saying they will be able to read famous papers?","<undergraduate-education><reference-request><student-motivation>"
"Integer Operations","<secondary-education>"
"What Should be there in a Single Variable Calculus course for Engineers?","<engineering-mathematics><calculus>"
"Good (natural) motivational examples for quadratic equations","<algebra><precalculus>"
"Automatically creating homework worksheets from textbook problems","<undergraduate-education><homework>"
"Motivation for polynomial long division","<secondary-education><algebra><solving-polynomials>"
"Undergraduate Math Seminar topic","<proofs><seminar>"
"A robot to simulate differential equations for undergraduate students.","<undergraduate-education><technology-in-education><differential-equations>"
"Teaching math long distance","<interactive-teaching>"
"Harnessing misuse of equals sign","<algebra><equal-sign>"
"Is This Trick Helpful?","<secondary-education><algebra><division>"
"Geometry sample tests","<geometry>"
"Third Grade Question -- This makes no sense to me","<primary-education><arithmetic-operations>"
"How is it correct for a lecturer to prove and ""explain"" a proof while explicitly knowing students are not familiar with logic itself?","<undergraduate-education><proofs>"
"'Low-algebra' examples of induction","<secondary-education><induction>"
"a theorem to simplify continuity in Stewart's calculus: early transcendentals","<calculus>"
"Can we solve math just by speaking and not using any other extra devices?","<problem-solving>"
"What is it called when terms disappear when reducing fractions?","<language-use>"
"Automated drilling sites with some specific problems","<online-instruction>"
"Examples (for beginners) of real functions which are not given by elementary formulae","<calculus><examples><functions><precalculus>"
"What were the applications of conic sections before Newton?","<history-of-math>"
"What mathematics activities get students physically moving?","<interactive-teaching><community-colleges><classroom-interaction>"
"Need to learn recurrence relation discrete mathematics","<engineering-mathematics><discrete-math><computer-science><recursion>"
"Suggested idea: Course exams written by someone else other than the instructors/coordinators. Good or Bad?","<exams><test-design>"
"3D vectors with 3D glasses?","<vectors>"
"What do I study in calculus beyond the minimum required for undergraduate engineering?","<reference-request><textbooks><reference-books><engineering-mathematics>"
"How much math would a non-STEM major have studied in 1950?","<undergraduate-education><history>"
"An intuitive explanation of l'Hôpital's rule for ∞/∞","<calculus><limits>"
"How should one approach the concept of ""plus or minus"", such as in the numerator of the quadratic formula?","<mathematical-pedagogy><algebra><notation>"
"Cinderella vs. GeoGebra","<geometry><software>"
"How to emulate erf and/or the Normal Inverse function in Moodle?","<software><probability><specific-software>"
"Should high school teachers say “real numbers” before teaching complex numbers?","<mathematical-pedagogy><terminology><real-numbers>"
"Why is modulo not an elementary operation?","<arithmetic-operations><philosophy-of-maths>"
"How to solve the problem of Wolfram Alpha?","<technology-in-education><student-motivation><assessment>"
"Tips to improve blackboard writing","<mathematical-pedagogy><writing>"
"Explaining the order of negative integers","<primary-education><negative-numbers>"
"Why ""plug in numbers"" when solving inequality?","<calculus><precalculus><teaching>"
"Accepted mathematical training methods?","<self-learning>"
"Assessing the level of students in a class","<graduate-education><assessment><class-participation><classroom-interaction>"
"Is there any research on the value of extra credit in the college mathematics classroom?","<undergraduate-education><mathematical-pedagogy><reference-request><grading>"
"Average time to solve basic arithmetic problem","<secondary-education><primary-education><education-research>"
"Teaching Models for Mathematics (like 5 E's in Science)","<teaching>"
"What is the value of sentence type maths problems for primary school students?","<word-problems>"
"Students who fall behind","<struggling-students>"
"Paper on Replicating Test Questions","<reference-request><testing>"
"Should one visualize properties of a matrix or/and state its properties?","<exams><linear-algebra><test-design>"
"""But I copied that from a book-reference you gave! How can that be wrong?"", or how can you grade homework which is solved poorly in some book?","<homework><grading><general-pedagogy>"
"How to convey the meaning of ""mathematical maturity""?","<undergraduate-education><examples><assessment>"
"In math courses with writing requirements, how should large papers be graded fairly?","<undergraduate-education><grading><assessment><writing>"
"Teaching by powerpoint presentation","<technology-in-education><software><presentation>"
"How to handle babies in the classroom","<classroom-management>"
"Appropriate education level for this geometry problem","<secondary-education><algebra><geometry>"
"What goes wrong when students interchange ""there exists"" and ""for all"" randomly? How to fix this?","<undergraduate-education><logic><students-mistakes>"
"What did you use to teach scale drawings?","<secondary-education><technology-in-education>"
"How to keep students engaged during a quiz that is not at the end of class?","<classroom-management>"
"How to motivate equivalence classes","<concept-motivation><set-theory>"
"What topic can I use in an Introduction to Proofs course that would introduce students to a wide variety of proof methods?","<undergraduate-education><course-design><proofs>"
"How to handle the situation when you made a stupid mistake in front of the class?","<classroom-management>"
"Teaching integration (online). Logical progression in subject?","<calculus><tutoring>"
"Definition of root of equation/expression","<terminology>"
"Simple examples that violate group axioms","<algebra><examples><abstract-algebra>"
"Dealing with Resisting Students","<tutoring>"
"Electronic devices to replace pencil and paper","<self-learning><writing><mathematics-in-daily-life>"
"Are Proficiency Strands Hierarchical?","<curriculum>"
"Math Education Research Areas","<education-research>"
"As it is appears here, how many constants do you see in $2x^3 + y^4 = \sqrt 5$?","<algebra>"
"What did math educators think about the transition to widespread classroom use of calculators?","<reference-request><technology-in-education><history>"
"Resources for high school teachers about APOS theory","<secondary-education><reference-request>"
"How to teach a weak student?","<primary-education><tutoring><struggling-students>"
"Why convert to sums of two squares?","<mathematics-in-daily-life><teaching>"
"A complete syllabus for preparing for International mathematical olympiad (IMO)","<teacher-preparation><math-contests>"
"List of math competition problems by topic","<mathematical-pedagogy><reference-request><math-contests>"
"How to choose the school for practising teaching?","<secondary-education><general-pedagogy><teachers><teacher-training>"
"Important topics for first numerical methods course","<undergraduate-education><mathematical-pedagogy><course-design>"
"What is a good book to learn all of prealgebra?","<reference-request><textbooks><reference-books><prerequisites>"
"High-school level algebra textbooks for gifted students","<secondary-education><algebra><textbooks><gifted-students><problem-solving>"
"Quantity as the basic concept for applied mathematics","<reference-request><applied-mathematics><quantity>"
"Math Research Projects on Water","<secondary-education>"
"Is there a correlation between academic qualifications and teaching effectiveness?","<teacher-training>"
"Does it make sense to speak of whether the standard deviation is a ""good measure"" of some particular distribution?","<statistics>"
"Critiquing Proof Style During Class","<reference-request><proofs><writing><critical-thinking>"
"What to teach in Set Theory & Logic Course","<course-design><logic><set-theory>"
"Topics for Discovery-based Projects","<undergraduate-education><problem-design>"
"Symmetric version of product and quotient differentiation rules","<calculus><reference-request>"
"Why is combinatorics not a part of the Tripos?","<curriculum><discrete-math>"
"""Extension Mathematics"" by Tony Gardiner","<textbooks>"
"How should one manage knowns vs unknowns when solving a problem?","<problem-solving>"
"Intergration by differentiating will get you $0$ marks - but how to explain why?","<calculus><exams><grading>"
"Multiplying the square roots of negative numbers before we calculate a result using $i$","<algebra>"
"Should figures be presented to scale?","<secondary-education><geometry>"
"Material and textbooks for CLIL learners","<secondary-education><textbooks><english-language-learners>"
"Self-study: how much should we try to figure out material on our own before studying from a textbook?","<self-learning>"
"Is there any video lecture series on Graph Theory which uses ""Introduction to Graph Theory"" by Douglas West? as the text","<reference-request><self-learning><resource-request><graph-theory>"
"How to reduce ambiguity in the following question?","<language-use>"
"What famous graduate math textbooks use color?","<textbooks><graduate-education>"
"Reference on study habits; cramming vs studying a bit every day","<reference-request>"
"Why do we teach the Rational Root Theorem? (high school algebra 2)","<secondary-education><technology-in-education><solving-polynomials><rational-numbers><roots>"
"Improving exposition of a proof about polynomials over infinite fields","<undergraduate-education><proofs><abstract-algebra><polynomials>"
"Are some people unteachable at mathematical problem solving?","<problem-solving>"
"Developing abductive (problem-solving) skills","<undergraduate-education><problem-solving>"
"How to (or should one) distinguish between lowercase and uppercase letters orally when lecturing?","<calculus><teaching>"
"Learn university maths or train for high school competitions: which is better?","<undergraduate-education><secondary-education><math-contests>"
"How do I convince my teachers that a book on maths must focus on conceptual understanding?","<mathematical-pedagogy><primary-education><concept-motivation>"
"How to teach linear programming and reductions?","<undergraduate-education><textbooks><teaching>"
"Using video games as an introductory tool for game theory? Can video games illustrate game theoretic concepts?","<games>"
"Is this primarily a ""rote computational trick"" for multiplication by 9?","<primary-education><arithmetic><multiplication-table>"
"Resources for Learning Multiplication Facts","<primary-education><teaching><multiplication-table>"
"When should we get into limits in introductory calculus courses?","<mathematical-pedagogy><calculus><infinitesimals><limits>"
"Unique candidate that fails","<undergraduate-education><mathematical-pedagogy>"
"New app teaches math really fast. How does it work?","<secondary-education><technology-in-education><primary-education>"
"Software to organize and track your exercises","<software><organization><exercises>"
"How to teach binary numbers to 5th graders?","<primary-education><mathematical-pedagogy><concept-motivation>"
"Intuitive explantion: What is a Finsler metric?","<concept-motivation><geometry><intuition>"
"Real life examples to motivate the study of linear functions","<secondary-education><reference-request><concept-motivation><functions>"
"Real time interactive whiteboard for tutoring math","<secondary-education><tutoring><software><online-instruction>"
"Substituting $x=1$ into $px^{p-1}$, why do so many students get $p^{p-1}$?","<algebra><students-mistakes>"
"I wanna learn math!","<self-learning>"
"Teaching Mathematics rules or its applications","<undergraduate-education><applied-mathematics>"
"Grading Computations vs. Grading Proofs: Is there a difference?","<proofs><grading>"
"The Fundamental Theorem of Calculus and Vegetables","<calculus><reference-request><visual-proof>"
"Historical tidbits to liven up calculus classes","<calculus><history>"
"The origins of $\operatorname{cis}(\theta)$","<trigonometry><history><complex-numbers>"
"Using joke / song / film / pop culture to exhibit a new mathematical concept","<undergraduate-education><secondary-education><examples><concept-motivation><mathematics-in-daily-life>"
"How to correct visualization of mathematical expressions?","<primary-education><arithmetic-operations>"
"When to use row or column vectors in points and translations","<secondary-education>"
"Intro to Proof: if $x$ divides $y$, then $ x \leq y$","<inquiry-based-learning>"
"Math Everywhere Activities","<primary-education><mathematics-in-daily-life>"
"Are there any studies evaluating the impact of the Mathematics Vision Project?","<curriculum>"
"On concentration inequalities","<textbooks><graduate-education>"
"Teaching math by serving it as games with rules first, not intuition?","<teaching><teachers><games>"
"Is it feasible to expose undergraduates to a ""map""-centric point of view early on?","<undergraduate-education><mathematical-pedagogy><course-design>"
"Succinct description of situations where naively obvious is correct, but for far more complicated reasons?","<undergraduate-education><graduate-education><abstract-algebra><number-theory>"
"Verifying Simple Expression Equivalence in a Spreadsheet","<mathematical-pedagogy><test-design>"
"How to remedy the ""freshman's dream""?","<students-mistakes>"
"Why do we study Cantor Set?","<mathematical-analysis>"
"Intuition for the mean for elementary school kids","<primary-education>"
"Beyond cubic polynomials: Applications?","<undergraduate-education><solving-polynomials>"
"Hardware for real time streaming of writings and drawings","<tutoring>"
"How to organize a ""cheatsheet-making session"" with students","<classroom-management><classroom-interaction>"
"Why do we state the antiderivative of $\sec x$ as $\ln |\sec x +\tan x|+C$?","<trigonometry><integration>"
"Subtraction Methods in School Mathematics","<reference-request><primary-education>"
"symmetry of a square - is it possible pure geometric approach in didactics?","<geometry>"
"Soft questions for 8 - 12 year olds","<reference-request><primary-education>"
"How can I implement the principles of deliberate practise in my mathematical studies?","<undergraduate-education><student-motivation><self-learning>"
"Examples of arithmetic and geometric sequences and series in daily life","<examples><mathematics-in-daily-life><series>"
"In what ways can educators introduce polynomials in grades 7 to 9?","<mathematical-pedagogy><secondary-education>"
"Ideas for teaching a bit of linear optimization to advanced undergraduates?","<course-design><optimization>"
"Should I teach Laplace Transforms? How much?","<mathematical-pedagogy><applications><differential-equations>"
"SMSG Calculus Usage?","<secondary-education><calculus><textbooks><history><new-math>"
"How to get kids thinking about the relationship between basic math (algebra) and English (or language in general)","<language-use>"
"Which math class should I take as an exchange student in the USA (OH)?","<algebra><geometry><statistics><functions>"
