title,tags
"When do the eigenvectors of a $n\times n$ matrix span $\mathbb{R}^n$? (aka when is a matrix diagonalizable?)","<linear-algebra><eigenvalues-eigenvectors>"
"Prove combinatorial Identity using a combinatorial argument.","<combinatorics><binomial-coefficients><combinatorial-proofs>"
"Double sigma formula","<summation><notation>"
"Convergence of $\sum _{n=2}^{\infty }\:\frac{1}{n\ln\left(n\right)}$","<sequences-and-series><convergence-divergence>"
"2 ways for $\int_{|z|=r} x^2dz$","<complex-analysis><contour-integration>"
"Proving the differentiability and continuity of $ f(t)=\frac{1}{it(b-a)}(e^{itb}-e^{ita})$ extended by $f(0)=1$","<calculus><real-analysis><derivatives>"
"Liapunov function (Energy function) for a nonlinear ODE system","<ordinary-differential-equations><dynamical-systems><systems-of-equations>"
"Are the infinity norm and the the induced norm equivalent in $l^2$?","<real-analysis><norm>"
"Operator algebra generalization of linear algebra result on diagonalization of commuting operators with distinct eigenvalues","<functional-analysis><operator-algebras><operator-theory>"
"An ODE and a constraint - is there any hope in solving this?","<ordinary-differential-equations><dynamical-systems>"
"What is the angle between two 4 dimensional vectors? $v_{1}=(-1,2,2,0),v_2=({2,-4,5,1})$","<linear-algebra>"
"Bijection between left exact localizations of $PSh(C)$ and Grothendieck topologies on $C$","<category-theory><sheaf-theory><grothendieck-topologies>"
"How to solve a singularity problem for diferential equation?","<ordinary-differential-equations><numerical-methods><boundary-value-problem><singularity-theory>"
"Help with elementary question involving a partially ordered set.","<discrete-mathematics><order-theory><lattice-orders>"
"What is the Galois group of $x^4 +5$ over the rationals?","<galois-theory>"
"Deriving log-likelihood for summation of binomial and poisson random variables","<probability>"
"Almost Everywhere pointwise limit measurable functions measurable?","<functional-analysis><measure-theory>"
"The equivalence of the definitions of stalks","<algebraic-geometry><category-theory>"
"Map Earth surface so straight line distance is great circle distance?","<spherical-geometry>"
"A contradiction to do with continuity? (involves chain rule)","<calculus><functional-analysis>"
"Is linear space totally different from group?","<linear-algebra><group-theory>"
"Find the value of the variable in the combinatorics.","<linear-algebra><combinatorics><combinations>"
"understanding lattice in detailed","<group-theory><complex-analysis><lattice-orders>"
"Prove that $y^3=x^2+2^{16}3^9$ has no integer solutions","<number-theory><diophantine-equations>"
"How many spheres of radius $R/2$ can be packed into a can having depth $R$, height $H$, with a hemispherical top","<geometry><volume>"
"Quotient ring of $T/I$","<linear-algebra><matrices>"
"Convergence of ratio between two sequenses","<calculus><sequences-and-series><convergence-divergence>"
"The ""standard"" definition of discrete subspace","<general-topology><terminology>"
"characterize all matrices $X$ such that $BA = X$ whenever $AB = X$","<linear-algebra>"
"Holomorphic function constant on a lattice.","<complex-analysis>"
"Prove that the set of all diagonal matrices is a subring of $\operatorname{Mat}_n(R)$ which is isomorphic to $R \times\dots\times R$ ($n$ factors)","<linear-algebra><matrices><ring-theory>"
"Is there an elementary proof of the convolution theorem?","<fourier-analysis><convolution>"
"Expressing T in terms of its adjoint for T normal","<linear-algebra>"
"How find this positive $n$ such $n<6(1-1.001^{-1000})<n+1$","<calculus><limits>"
"positive series convergent properties","<calculus><sequences-and-series>"
"The relation between piano 12-scale and Fibonacci?","<fibonacci-numbers>"
"Understanding a proof about finite $p$-groups","<group-theory><finite-groups><p-groups>"
"Doeas $ \int_0^{0.5} \frac{\mathrm dx}{\sin x\ln x} $ exist?","<calculus><improper-integrals>"
"A doubt in a proof concerning Hilbert spaces.","<general-topology><hilbert-spaces>"
"Expression of an Integer as a Power of 2 and an Odd Number (Chartrand Ex 5.4.2[a])","<elementary-number-theory>"
"normed vector space real analysis","<functional-analysis><normed-spaces>"
"Andre LeClair, Riemann zeta zero approximation?","<number-theory><riemann-hypothesis><lambert-w>"
"Help me organize these concepts -- KKT conditions and dual problem","<convex-optimization><duality-theorems><karush-kuhn-tucker>"
"Induction proof $2n+1<2^n$","<inequality><discrete-mathematics><induction>"
"Power Series: Can anyone recommend a book?","<calculus><real-analysis>"
"show that a perfectly normal space is completely normal","<general-topology><separation-axioms>"
"Pigeonhole principle questions","<pigeonhole-principle>"
"How find this maximum of $f(n)$","<multivariable-calculus><inequality>"
"How to show: $z_1+|a|^2z_2=z_2+|a|^2 z_1 \Rightarrow z_2=z_1$?","<complex-analysis>"
"Games with known outcome but unknown strategy","<game-theory>"
"Question on double integrals.","<multivariable-calculus>"
"How to solve this equality for $S$","<calculus>"
"Locus question?","<functions><locus>"
"Why is a root system irreducible iff its Dynkin diagram is connected?","<lie-algebras><root-systems>"
"$A_n$ contains an isomorphic copy of $S_{n-2}$","<abstract-algebra><group-theory><permutations>"
"$f_x$ is continuous, $f_{xt}$ is differentiable, does that mean $f_t$ is continuous?","<calculus><real-analysis><partial-derivative>"
"Asymptotic Expansion of a Two Variable Function","<real-analysis><complex-analysis><asymptotics>"
"Zeroes of $s+\sum\limits_{n=2}^\infty \frac{(-1)^{n+1}}{n^s\ln n} $?","<complex-analysis><integration><complex-numbers><riemann-zeta>"
"Stratifications by smooth subvarieties","<algebraic-geometry>"
"Solution(s) to 'power equations'","<algebra-precalculus>"
"Fatou's Lemma Counterexample","<measure-theory>"
"How to write down proofs?","<soft-question>"
"Dirichlet's Divisor Problem","<number-theory><analytic-number-theory>"
"Explanation of numeric experiment that approximates e?","<probability><stochastic-processes>"
"Isomorphism between algebraic Numbers","<abstract-algebra>"
"Choosing subsets of a set with a specified amount of maximum overlap between them","<combinatorics>"
"How is moduli of curves relevant in physics?","<algebraic-geometry><mathematical-physics><moduli-space>"
"Degree sequence of a graph has repeated entries","<graph-theory>"
"Determine speed of the object at the current time by the non-uniform time sample","<sequences-and-series><statistics><numerical-methods><approximation>"
"Is It True that We Can Never Be Sure of Validity of a Mathematical Proof?","<meta-math>"
"Discontinuous at rationals and differentiable at irrationals?","<real-analysis><analysis>"
"Mean of highest exponent in prime factorization of all integers ≥ 2","<number-theory><prime-numbers><prime-factorization>"
"Does there exist a bijective $f:\mathbb{N} \to \mathbb{N}$ such that $\sum f(n)/n^2$ converges?","<number-theory><analysis><convergence-divergence>"
"Existence of a normal subgroup with $\lvert\operatorname{Aut}{(H)}\rvert>\vert\operatorname{Aut}{(G)}\rvert$","<group-theory><finite-groups>"
"Primes dividing the values of integer polynomials","<number-theory><prime-numbers><algebraic-number-theory>"
"What's so special with small categories?","<big-list><set-theory><category-theory>"
"Permutations with duplicates","<combinatorics>"
"Are there smooth analogs to polynomial splines","<numerical-methods><interpolation>"
"Simple inequality problem","<algebra-precalculus><inequality>"
"Division of Factorials [binomal coefficients are integers]","<elementary-number-theory><divisibility><factorial><multinomial-coefficients>"
"A curious compactness confusion: space filling curves in the hilbert cube that contradict a bona fide theorem?","<general-topology>"
"Bertrand's Postulate","<number-theory>"
"Are there publications or references describing $N$ dimensional space divided by $N-1$ dimensional (hyper)planes?","<geometry><algebra-precalculus><reference-request>"
"Graph Path Length Problem","<graph-theory>"
"How can I characterize the type of solution vector that comes out of a matrix?","<linear-algebra><matrices>"
"Locally Compact Group with Haar Measure","<fourier-analysis>"
"Prove that $\text{rank}(A) = \text{rank}(A^T)$ using SVD","<linear-algebra><proof-verification><svd><matrix-rank>"
"Is this integral reducible to an elliptic integral?","<integration><special-functions><elliptic-integrals>"
"Solving differential equation related to sales","<calculus><ordinary-differential-equations>"
"How did my book see the rank and what is wrong with my null space","<linear-algebra><matrices><vector-spaces>"
"To prove $\pi(x)>\dfrac x{\ln x} , \forall x \ge 17$ by elementary argument","<number-theory><prime-numbers>"
"How to solve $e^{3z} = 1+i$","<complex-analysis><complex-numbers>"
"The limit of a sum","<calculus><integration><limits><riemann-sum>"
"what is permutation invariant sequence space","<linear-algebra><abstract-algebra><functional-analysis>"
"e as sum of an infinite series","<sequences-and-series><limits>"
"How to calculate decimal factorials, like $0.78!$","<factorial>"
"Show that $\log\log z$ is analytic","<complex-analysis><complex-numbers><logarithms><real-numbers>"
"Does a matrix $A$ need to have $\det A \neq 0$ to even have a rank?","<linear-algebra><matrices><determinant>"
"solving for z in $|e^z| = 2$","<complex-analysis><complex-numbers>"
"Simple quadratic, crazy question part 2","<number-theory><elementary-number-theory>"
"Probability of spherical particles touching one another in a cylindrical column","<probability><volume>"
"A tough dice probability conundrum","<probability><game-theory><dice>"
"The number of $(d-1)$-faces in a $d$-polytope is at least $(d+1)$","<vector-spaces><affine-geometry><discrete-geometry><polytopes>"
"Are the hyperreal numbers densely ordered?","<set-theory>"
"Entire function with vanishing derivatives?","<complex-analysis>"
"Slope from a graph","<algebra-precalculus><functions>"
"Definition of Adic-filtration","<abstract-algebra><definition><group-rings>"
"How to prove the inequality $2\sqrt{n + 1} − 2 \le 1 +\frac 1 {\sqrt 2}+\frac 1 {\sqrt 3}+ \dots +\frac 1 {\sqrt n} \le 2\sqrt n − 1$?","<inequality><summation><radicals><riemann-sum>"
"MathWordProblem : Time and Work","<algebra-precalculus>"
"If $\left\langle a^k \right\rangle =\mathbb Z _n ^{\times } $ $\forall k $: $\gcd (k,n)=1 $, can there be other generators?","<abstract-algebra>"
"Demystifying the asymptotic expression for the partition function","<number-theory><reference-request><integer-partitions>"
"Cartesian product using family of sets","<elementary-set-theory>"
"Differentiate y=Cot²(sinx)","<trigonometry><derivatives>"
"What formula to give small values more weight?","<curves>"
"Computing the Laplacian of $\frac{\mu\ \cdot\ \mathbf{r}}{\|\mathbf{r}\|^3}$","<calculus><multivariable-calculus><partial-derivative><laplacian>"
"Period of a pendulum","<ordinary-differential-equations><proof-verification><physics>"
"Free and proper action","<manifolds><lie-groups><group-actions><smooth-manifolds>"
"Gradient theorem","<real-analysis>"
"Calculus help for viruses","<calculus><exponential-function>"
"Equivalent condition for CH","<set-theory><infinitary-combinatorics>"
"Why are all singletons confluent?","<computer-science><relations>"
"Is true that $ \cap_{n=1}^{\infty} {\omega}_n \neq \emptyset $?","<general-topology>"
"Showing two integrals are equal as n tends to infinity:","<integration>"
"prove $\limsup_{n\to\infty}\frac{\sqrt{2({{x_1}^2+{x_2}^2+...+{x_n}^2})}}{n}\leq\limsup_{n\to\infty}\frac{x_n}{\sqrt{n}}$","<sequences-and-series><inequality><limsup-and-liminf>"
"Is there any direct method for Lagrange multiplier based domain decomposed problem?","<matrices><numerical-methods><computational-mathematics><finite-element-method>"
"Yet another multivariable integral over a simplex","<integration>"
"Show that the matrix $(a_{j,k})_{j,k\in \mathbb{N}}$ induces a bounded operator on $\ell^2$.","<functional-analysis>"
"Example of a continious function in [-1,1] , not differentiable at 5 points.","<calculus>"
"how do I determine if a number is in the middle half cantor set?","<real-analysis>"
"Is the following limit finite?","<real-analysis><limits>"
"right-continuous extension of nondecreasing right-continuous function","<real-analysis>"
"Is quantum field theory impredicative?","<logic>"
"fitting a L shape (corner) to points to remove outliers","<geometry><mathematical-modeling>"
"How to define a Bijection between $(A^B)^C$ and $A^{B \times C}$","<functions><equivalence-relations>"
"Stationary Distribution of a Geometric Brownian Motion with a resetting barrier","<stochastic-processes>"
"Are Jacobi elliptic functions liouvillian?","<functions><special-functions><elliptic-functions>"
"Dijkstra Correctness","<graph-theory>"
"Expressing $4n+3$ as difference of two squares","<elementary-number-theory>"
"Probability, expected value, variance, random variable","<probability>"
"find $g$ such that $g\circ f=h$","<calculus><real-analysis><polynomials>"
"How to iteratively factorize a matrix with missing values?","<matrices><matrix-decomposition>"
"Are two Graph isomorphic?","<group-isomorphism>"
"Base change of n","<elementary-number-theory>"
"Prove: $|\mathcal{P}( \{0, 1\}\mbox{*}) |=|\left[0, 1\right]|$","<elementary-set-theory><cardinals>"
"Is there any good textbook or notes on graph theory for undergraduate student?","<graph-theory>"
"$S$ be a finite subset of $\mathbb R^3$ such that any 3 vectors in $S$ spans a $2$ dimensional subspace then $S$ also spans $2$ dimensional space","<linear-algebra><vector-spaces>"
"Construct a continuous onto map from $(0,1]$ to $[0,1]$","<functions>"
"Maximum and minimum when $\lim_{x\to +\infty} f(x)= 0 = \lim_{x\to -\infty}f(x)$","<real-analysis>"
"Equivalent conditions for a finitely presented module","<commutative-algebra><modules><tensor-products><proof-explanation><localization>"
"Number of solutions to $n=\sum_{i=1}^{r} x_i ;\forall i, 1\le x_i\le k; \exists i ,x_i\ge d$ for $r\in \mathbb N$","<combinatorics><generating-functions>"
"Statistical derivation source","<statistics>"
"If $x_{n+1} = ax_n+b$ for $n \geq 0$, then prove that the sequence $\{x_n\}$ converges to $\frac{b}{1-a}$ for a given value of $x_0$.","<real-analysis><sequences-and-series><cauchy-sequences>"
"Prove inequality $|e^{i\theta}-e^{i\phi}|\leq |\theta-\phi|$ for all $\theta,~\phi$ such that $0\leq \theta- \phi\leq \pi.$","<complex-analysis><complex-numbers>"
"Form committee of $2$ out of $5$ women and $3$ out of $6$ man with additional requirements.","<combinatorics>"
"Independence of non-constant real variables","<probability-theory><independence>"
"Real Analysis - Notation","<real-analysis><notation>"
"$\lim\limits_{n\to \infty}\frac{n^k}{2^n}$ without l'Hopital","<limits>"
"The sequence $a_n=\frac{2n+1}{(n-1)^2}$ decreases monotonically","<real-analysis><sequences-and-series><analysis><inequality>"
"Is the duality principle of Boolean algebra always true?","<logic><boolean-algebra>"
"Show non-definability of (biparted graphs, graphs with eulerian cycle, even number of nodes)","<logic><model-theory><first-order-logic>"
"$F(x)=f'(x)$ in complex analysis conditions","<complex-analysis><complex-integration>"
"Find solutions of the inequality","<algebra-precalculus><inequality><logarithms>"
"A simple question about C*-norm","<functional-analysis><c-star-algebras>"
"How do I know if this function is linear or not.","<linear-algebra><linear-transformations>"
"Find the angle of triangle inside circle","<triangles><angle>"
"Does a glass of water sing because of the SO(2) symmetry?","<real-analysis><functional-analysis><soft-question><representation-theory><lie-groups>"
"Solve inequality $F(z) \leq\min(1, z) $","<inequality><monte-carlo>"
"Integrating mod function","<calculus><absolute-value>"
"Limit of $n$th root of a ratio that goes to infinity","<calculus><limits><factorial>"
"Nonhomogenous 2D heat equation","<heat-equation>"
"Tangents of two distinct points on a parametric curve","<calculus><parametric>"
"Find gcd($a,c$) with gcd($a,b$) and gcd($b,c$) is given?","<algorithms><gcd-and-lcm>"
"Is this set a linear subspace of $\mathbb{R}^{2}$? $U=\left\{\begin{pmatrix} 4t^{3}\\t^{2}\end{pmatrix}\in\mathbb{R}^{2}:t\in\mathbb{R} \right\}$","<linear-algebra><abstract-algebra>"
"Why is $ \sin8t \sin2t = \frac{\cos 6t -\cos 10t}{2}$?","<calculus><trigonometry>"
"What does it mean to say that a point at infinity is mapped to $0$?","<transformation><projective-geometry><projective-space>"
"Asymptotic estimation of a divergent integral","<integration><asymptotics><divergent-integrals>"
"Improper integral $ \int_a^b \frac{\sqrt{x-a}}{\sqrt{b-x}}dx $","<calculus><improper-integrals>"
"How to solve non linear integro-differential equation","<laplace-transform><convolution><integro-differential-equations>"
"Final Topology Generated by Inclusion Map","<general-topology><functional-analysis><algebraic-topology><continuity><limits-colimits>"
"Two similar versions of the logarithmic derivative.","<real-analysis><complex-analysis><limits><functions><derivatives>"
"Show that $f(x,y) = (x^{\alpha} + y^{\alpha})^{1/\alpha}$ is concave for $0 < \alpha < 1$ and for $\alpha < 0$","<real-analysis><calculus><convex-analysis>"
"If $G$ is a finite subgroup of $GL_n(C)$ then there is a polynomial $f\in C[x_1,...,x_n]$ such that $f(gv)=f(v)$","<linear-algebra><abstract-algebra><polynomials>"
"Probability distribution of iid variables","<probability>"
"proving bi-Lipschitz function has an inverse that is lipschitz","<real-analysis><continuity><proof-writing><metric-spaces><inverse-function-theorem>"
"How Many Unique Combinations","<combinations>"
"Is $f(y) = \frac{\sin y}{y}$ a continuous function?","<continuity>"
"Units in $\mathbb{Z}_2[x]/(x^2-4)$","<number-theory><algebraic-number-theory><p-adic-number-theory>"
"Solving differential equation using method of undetermined coefficients?","<calculus><ordinary-differential-equations><discrete-mathematics><derivatives><homogeneous-equation>"
"Trying to determine the existence of a local inverse near a point","<real-analysis><calculus><multivariable-calculus><inverse-function><jacobian>"
"Writing linear equation of Image in linear transformation","<linear-algebra><linear-transformations>"
"Convergence of the complex power series $\sum_{n=1}^\infty \dfrac{1\cdot 3\cdot 5\cdots (2n-1)}{2\cdot 4\cdots (2n)}z^n$","<complex-analysis><power-series>"
"If W is a subspace of V and $x \notin W$, prove that there exists $f \in W^0$ such that $f(x) \neq 0$.","<linear-algebra><dual-spaces>"
"Does $|f(\sqrt{xy})| \le |\frac{f(x)+f(y)}{2}|$ imply $f$ is a logarithm?","<real-analysis><functional-equations><symmetry><a.m.-g.m.-inequality><functional-inequalities>"
"The product topology of weak topologies is the same as the weak topology of the product space?","<general-topology><functional-analysis><weak-topology>"
"Proving that a rational map is an endomorphism of an elliptic curve","<algebraic-geometry><solution-verification>"
"Number of rational points $(a,b)$ on the circumference of a circle with centre as $(\pi,e)$","<analytic-geometry><circles><conic-sections><irrational-numbers><rational-numbers>"
"Prove $f:\mathbb{R}\rightarrow \mathbb{R}$ is monotone iff $f^{-1}[x,y]$ is an interval for each $[x,y]\subset\mathbb{R}$","<real-analysis>"
"Solving a differential equation using substitution - steps verification","<calculus><ordinary-differential-equations>"
"Embedding Sobolev $H^1$ into $L^\infty$ space","<complex-analysis><functional-analysis><sobolev-spaces><integral-inequality>"
"Curvature Simple Question","<calculus>"
"two shooters, probabilities that have a possibility of going to infinity","<probability>"
"Does Lebesgue Change of Variables only hold for Borel functions?","<real-analysis><measure-theory><lebesgue-measure>"
"How to solve this double sum?","<summation>"
"Question on convergence of series, unable to understand it properly","<sequences-and-series><limits><convergence-divergence>"
"expectation of discrete random variables","<probability-theory><conditional-expectation>"
"Proving that $a_n=\sqrt{n^2+n}-n$ converges, finding its limit and showing that its sequence ${(a_n)^{\infty}_{n=1}}$ is monotinic.","<real-analysis><proof-verification><convergence-divergence><epsilon-delta><monotone-functions>"
"convention of writing vector symbols","<vectors>"
"Initial value problem using Laplace","<laplace-transform>"
"Possibilities of the end of digits and quadratic residues","<number-theory>"
"Optimisation Problem involving sorting Vectors","<optimization><convex-optimization><computability>"
"Show that the sum of the terms of a sequence converges","<sequences-and-series><limits>"
"Epimorphisms are surjective in the category of $G$-sets?","<representation-theory>"
"Fourier transformation of $Ae^{-x^2+ax}$","<calculus><mathematical-physics><fourier-transform>"
"Integral and trig substitution","<indefinite-integrals>"
"Prove $[x/4]_2$ is a homomorphism","<abstract-algebra><group-theory><group-homomorphism>"
"Problem with system of differential equations","<real-analysis><integration><ordinary-differential-equations>"
"$(f \circ f \circ f)(x) = (f \circ f)(x) + x$","<functions>"
"How to solve this integral since it has a endpoint singularity?","<integration><singularity>"
"Is this sufficient criterion for existence of non-abelian groups also necessary?","<finite-groups>"
"K is a normal extension of $\mathbb{Q}$ and $[K: \mathbb{Q}] = p$, with $p$ prime then $Gal_{\mathbb{Q}} K$ is isomorphic $\mathbb{Z}_p$","<abstract-algebra><galois-theory>"
"Compute the determinant of the following matrix","<linear-algebra><matrices><determinant><matrix-equations>"
"What are the ""strong"" and ""weak"" in mathematics?","<logic>"
"Get $A$ and $C$ matrix from Observability matrix","<matrices><control-theory><optimal-control><pseudoinverse><linear-control>"
"Fitness probability question","<probability><combinatorics>"
"Help with directional derivative to the direction of the tangent of a curve.","<multivariable-calculus><derivatives><partial-derivative><vector-analysis>"
"$H_{dR}^k(M/G)\to H_{dR}^k(M)$ is injective","<differential-geometry><homology-cohomology><smooth-manifolds><pullback>"
"Find the area of the conical shell that has an equation $ z=\sqrt{x^2+y^2} $ using polar coordinates","<calculus><integration><multivariable-calculus><polar-coordinates>"
"numbers representable as sums of perfect powers","<elementary-number-theory><perfect-powers>"
"prove that $\sum_{n=1}^\infty \frac{(-1)^n}{n}$ convergies using Cauchy criterion","<sequences-and-series>"
"Evaluate by first adding all other rows to the first row.","<linear-algebra><matrices><determinant>"
"Understanding equality $\frac{1}{2}\int_0^{2\pi} \frac{\cos(\theta)}{2 + \cos(\theta)}d\theta = \pi - \int_0^{2\pi} \frac{d\theta}{2 + \cos(\theta)}$","<real-analysis><trigonometry><definite-integrals>"
"$\{(x,y) \in \mathbb R^2 \mid 2x+y \leq 2, x-y >4 \}$ open, closed or neither?","<general-topology><elementary-set-theory><metric-spaces><euclidean-geometry>"
"Control Theory- Designing Cascade Lead Compensator","<control-theory><linear-control>"
"What do you call an equation that is impossible to algebraically solve?","<trigonometry><recreational-mathematics><education>"
"Connection on fiber bundle of generic fiber","<differential-geometry><reference-request><fiber-bundles><connections>"
"Is $EXX^2 = EX^3$?","<probability-distributions>"
"Munkres, Topology, section 37, question 1","<general-topology>"
"Proving $\lim_{x\to \infty} a_n = 0$ if $\lim_{x\to \infty} \sqrt[n]{|a_n|} = a$ for $a < 1$","<limits><radicals>"
"Show that a polynomial function has a minimum","<calculus><polynomials>"
"There are 45 students in an elementary class...","<statistics><normal-distribution><sampling>"
"The meaning of the class $\Omega ''$ of distribution functions","<probability><probability-theory><probability-distributions>"
"Question about extension theorems in ring theory","<abstract-algebra><ring-theory>"
"Strong markov property Brownian motion","<probability><brownian-motion>"
"numbering permutations with repeated items","<combinatorics><permutations><combinations>"
"Normal space- equivalent condition: $\forall U, V$ - open $: U \cup V = X \ \ \ \exists F \subset U \ , G \subset V$ - closed $: F \cup G = X$","<general-topology><separation-axioms>"
"How to calculate straight line into graph having variety of different results","<graphing-functions><functional-equations>"
"Vector Subspace question","<linear-algebra>"
"Finding the number of pairs with given GCD and LCM (proof)","<elementary-number-theory>"
"How is this $f(n) = n^n$ function called?","<functions>"
"Where can I get all mathematician's birth day and death day?","<reference-request><math-history><education>"
"Prove that Bezout's coefficients given by the extended Euclidean algorithm are minimal in absolute value","<elementary-number-theory>"
"confused about an explanation of a recurrence problem","<algorithms>"
"A peculiar kind of sequences","<sequences-and-series>"
"Power of cumulative distribution function","<probability>"
"Any $n$-element arithmetic progression which sum is $n!$","<calculus><sequences-and-series>"
"Possible for this function to be discontinuous?","<calculus><real-analysis><functions>"
"Direct Sum of vector subspaces","<linear-algebra>"
"Bayes Learning - MAP hypothesis","<machine-learning><bayesian><bayes-theorem>"
"Why variance in probability is taken as E[(X−E[X])2]?","<probability-theory><statistics>"
"Signature form of $S^2 \times S^2$","<algebraic-topology><differential-topology>"
"Solving a radical equation $\sqrt{x+1} - \sqrt{x-1} = \sqrt{4x-1}$","<algebra-precalculus><radicals>"
