title,tags
"Pros and cons of randomised question generation","<mathematical-pedagogy><reference-request><technology-in-education><general-pedagogy><assessment>"
"Introducing derivative concept and definition","<calculus><engineering-mathematics><derivative>"
"When did the term and taught technique 'cross multiplication' enter into common use?","<mathematical-pedagogy><terminology><vocabulary>"
"Questions for Oral Examination in Mathematics","<examples><exams><assessment><oral-exams>"
"Is this just a mistake or a more serious misconception?","<algebra><students-mistakes><functions>"
"the role of context in mathematical discussions of units and measurement in web design","<undergraduate-education><secondary-education><geometry>"
"How early to start ""abstract"" math education, or, How to prevent smart kids from never getting exposed to math?","<mathematical-pedagogy><secondary-education><student-motivation><curriculum>"
"How to use false theorems or proofs?","<mathematical-pedagogy><proofs><problem-design>"
"What should I cover when teaching hypothesis testing in high school?","<secondary-education><statistics>"
"Specific examples (like elementary proofs,or simple problems) which appear rich in abstractions when observed through the lens of abstraction","<mathematical-pedagogy><examples>"
"Rationale for not dividing both sides of an equation by $x$ (ex: $6x^2 = 12x$)","<secondary-education><algebra>"
"Teaching students to find and correct their own errors","<undergraduate-education><secondary-education><students-mistakes><critical-thinking>"
"Effectiveness of proofs in secondary education","<secondary-education><proofs><education-research>"
"Is Applied Math easier than Pure Math?","<self-learning>"
"What are some common fallacies students make when they learn $X$ concept?","<secondary-education><mathematical-pedagogy><primary-education><students-mistakes>"
"Mathematics after Rube Goldberg (recommendation) - Question for orientation","<undergraduate-education>"
"How to differentiate between mathematical skills and understanding of mathematical concepts?","<secondary-education><mathematical-pedagogy><concept-motivation><transferrable-skills>"
"Student input in secondary teacher evaluations","<secondary-education><reference-request><teacher-evaluations>"
"How to visually demonstrate basic algebra","<algebra><tutoring><struggling-students>"
"Exam Writing: Combining Topics on Exams in New Ways","<undergraduate-education><mathematical-pedagogy><exams>"
"Simple ""real world"" l'Hôpital's rule problem?","<calculus><examples>"
"How to explain the difference between the fraction a / b and the ratio a : b?","<primary-education><fractions>"
"How to estimate the time needed to solve a basic mathematics problem","<primary-education>"
"Flipping (or not) a large graduate class","<graduate-education><computer-science>"
"Conceptual Mathematics by Lawvere & Schanuel as text for bridging course?","<undergraduate-education><course-design><textbooks><category-theory>"
"Good ideas on structuring a math class?","<mathematical-pedagogy><course-design><secondary-education>"
"Should we avoid indefinite integrals?","<calculus><concept-motivation><integration>"
"How do I Introduce Converse Theorems in Class?","<mathematical-pedagogy><secondary-education>"
"How can we handle grocery store/bus stop conversations better?","<mathematics-in-daily-life>"
"Which first, definite or indefinite integrals?","<calculus>"
"Grad school after doing an online bachelor's degree without support for undergraduate research","<online-instruction><undergraduate-research><advising>"
"Help finding good deep mathematics problems","<problem-solving>"
"What are the best practices for giving online tests?","<undergraduate-education><testing>"
"What are some of the open problems that can be suitably introduced in a calculus course?","<undergraduate-education><calculus><student-motivation><undergraduate-research><vectors>"
"The use of ""$\therefore$"" and ""$\because$""","<undergraduate-education><secondary-education><proofs><notation>"
"English translation of Sung-Dae Hong's The Art of Mathematics","<secondary-education><textbooks><reference-books>"
"When do college students learn rigorous proofs?","<undergraduate-education><proofs><course-sequence>"
"Why is a translated exponential function considered an exponential function?","<functions><definitions><exponential>"
"Ideal Features of Online Homework Platform?","<homework><online-instruction><big-list>"
"How to get better at proofs","<undergraduate-education><proofs><undergraduate-research>"
"Integration by substitution not using letter u","<integration>"
"Ordered checklist for learning Mathematics for Data Science","<self-learning>"
"Polymorphic functions in vector calculus","<undergraduate-education><vector-calculus>"
"Which book has functions and their respective graphs?","<reference-request><functions><book>"
"Adding one to numbers bigger than ten","<reference-request><students-mistakes><arithmetic>"
"Concentrations of Adult Math Phobia","<arithmetic><remedial-courses>"
"Good Combination for Self Study for a Mathematical Novice","<self-learning>"
"Should Measurement of Angles Using Degree (and perhaps Common Logarithm as well) be Avoided in Pre-Calculus?","<terminology><precalculus>"
"How to write variables on the board, which are supposed to be italicised?","<writing><board-use>"
"Why do no students know to change the limits of integration when doing substitutions?","<undergraduate-education><calculus>"
"What exactly does 'abstract' signify in a course like Harvard's Math 55 (Honors 1st yr)?","<critical-thinking>"
"Books and worksheets on symmetry","<geometry><examples><applications>"
"What software tools allow an educator to display slides but also draw on the slides like MS Paint?","<software>"
"Small data sets with integral sample standard deviations","<examples><statistics>"
"How to denote angle?","<geometry><notation><teaching>"
"Good metaphor to explain the difference between pointwise and uniform convergence","<undergraduate-education><calculus><examples>"
"Comprehensive Assessment Test for Undergraduate Math Program","<undergraduate-education><test-design>"
"At what educational stage are angles greater than 180 introduced?","<geometry><notation><teaching>"
"Evaluating integrals geometrically, without using the fundamental theorem of calculus","<undergraduate-education><calculus><examples><integration>"
"Repeating basic material in exercise class at university","<teaching><class-participation>"
"Lipschitz continuity before standard definition of continuity","<undergraduate-education><calculus><mathematical-analysis>"
"Why many people believe that: $\displaystyle c>0\implies \frac{1}{c}<0$?","<mathematical-pedagogy><real-numbers><inverse>"
"Correctness in learning mathematics","<undergraduate-education><secondary-education><primary-education><creativity>"
"Are there any undeveloped areas of mathematics accessible (for both understanding and research) to an undergraduate?","<undergraduate-research>"
"Percentage nature","<rational-numbers>"
"Frequent calculus error: replacing interior part of an expression with its limit","<calculus><students-mistakes><limits>"
"Grading problems that nobody solved","<exams><grading>"
"What do mathematicians call a proof?","<undergraduate-education><proofs><undergraduate-research>"
"Questions with ""round"" answers only?","<mathematical-pedagogy><calculations>"
"Teaching somebody else's class","<course-design><general-pedagogy>"
"Epsilons and deltas in a first calculus course","<calculus><undergraduate-education>"
"Presenting a solution with a stroke of genius","<mathematical-pedagogy><mixed-ability><gifted-students>"
"How to schedule a seminar (weekly based vs. one big meeting) to maximize learning?","<course-design><seminar><scheduling><graduate-education>"
"Placing incoming college freshmen: basic algebra, pre-calc, calc","<undergraduate-education><test-design><assessment>"
"How should LaTeX be taught to university students?","<undergraduate-education><course-design><curriculum><specific-software>"
"Naming arbitrary constants: subscripts, primes, or just more letters?","<undergraduate-education><mathematical-pedagogy><notation>"
"What is an interesting high-school level topic to discuss using Mathematica or Geogebra?","<undergraduate-education><secondary-education><technology-in-education>"
"The art of designing of problem sets","<homework><problem-design>"
"Solutions to exercises","<mathematical-pedagogy><exercises>"
"Are there textbooks that cover most etymological aspects of mathematics?","<terminology>"
"What books are good for drawing an intersecting plane?","<textbooks><reference-books>"
"Real-life exceptions to PEMDAS?","<algebra><primary-education><examples>"
"What are the benefits of an expertly curated learning pathway?","<textbooks><course-design><curriculum><education-research>"
"How to justify that students should come to class?","<undergraduate-education>"
"Is there a simple example that empirical evidence is misleading?","<undergraduate-education>"
"Category mistakes regarding symbols and their impact on math (mis) understanding. ( Object symbol/ sentence symbol confusion)","<mathematical-pedagogy><teaching><students-mistakes><set-theory><mathematical-discourse>"
"What are ""PreK‐12th‐grade students""?","<education-research><terminology>"
"A compelling example of what complex numbers are for, before teaching them","<mathematical-pedagogy><applications><complex-numbers>"
"How to come up with a Leslie matrix with convenient eigenvalues?","<linear-algebra><applied-mathematics><solving-polynomials>"
"Mobile phone apps that would allow for students to anonymously ""buzz"" me in real time?","<technology-in-education>"
"How can I explain why numerical integration is easy, but symbolic integration is hard?","<integration>"
"Resources for teaching calc III","<calculus><resource-request>"
"Near-universal student mistake on $\lim_{x\rightarrow\infty}e^{x+1}/e^x$","<calculus><students-mistakes><limits>"
"Searching for prezi like software that supports LaTeX natively","<software><presentation><specific-software>"
"Can students tell the difference between the ""definition if"" and the ""theorem if""?","<undergraduate-education><reference-request><logic><definitions><language-use>"
"Teaching arithmetic operations ($+ - \times \div$) to a 3 year old","<assessment><gifted-students><arithmetic-operations><preschool-education>"
"Aspiring HS Math Teacher: Textbooks for learning Algebra, Geometry, Trigonometry, and Calculus?","<secondary-education><textbooks>"
"How to convince my student that this is an Identity : $\sec^2x-\tan^2x=1$?","<secondary-education><trigonometry>"
"Subtraction to Addition Conversion; how important is it?","<algebra><negative-numbers>"
"Where can I help students for free in real-time? (not openstudy.com)","<tutoring>"
"Coverage of Fundamentals of Lines and Planes","<geometry><reference-request>"
"Effectiveness of students seeing proofs - reference request","<undergraduate-education><proofs>"
"Substitution in recurrence relations","<sequences>"
"How to better pace activities","<class-participation>"
"Theme of a Differential Equations Course","<differential-equations>"
"Good examples of functions defined as definite integrals of elementary functions?","<calculus><reference-request><problem-design>"
"Moving lines in schematic diagrams","<self-learning><students-mistakes><notation><precalculus>"
"Integrate Coding into the Geometry Curriculum","<secondary-education><curriculum><geometry><computer-programs>"
"Alternative terms for 'mathematical understanding'","<undergraduate-education><terminology>"
"What am I supposed to be learning with long proofs of the main theorems in class?","<proofs><graduate-education>"
"Teaching strong induction instead of induction","<proofs><induction>"
"interactive web page for differential calculus","<calculus><technology-in-education><interactive-teaching>"
"Political complications following from oral examinations in the British university system?","<oral-exams><cultural-differences>"
"Show me the money","<student-motivation><concept-motivation>"
"How to help my students form study groups during office hours?","<struggling-students>"
"Publishing of exams in internet","<undergraduate-education><publishing>"
"What are the best apps for students to discuss math problems?","<secondary-education><mathematical-pedagogy><technology-in-education><interactive-teaching>"
"Student Project about Prime Numbers: How to Continue?","<secondary-education><prime-numbers>"
"A companion on the Journey Through Genius","<textbooks><history-of-math>"
"Honors project idea for linear algebra","<undergraduate-education><reference-request><examples><gifted-students>"
"How to assign grades to proofs: what do(es) the literature/experts suggest?","<reference-request><proofs><grading>"
"What are your favorite instructional counterexamples on sequences?","<calculus><examples><sequences>"
"Good ways of explaining the idea of epsilon-delta limits to bio & chem majors?","<calculus><concept-motivation><biology>"
"What are some good or neat examples of computing a function's Taylor series?","<calculus><examples>"
"How to create a misuse of calculator!","<technology-in-education><calculators>"
"Language to Distinguish Between Variables and Arbitrary Constants","<calculus><mathematical-pedagogy><notation><integration>"
"Teaching students to write the ""invisible"" ones","<secondary-education><mathematical-pedagogy>"
"Is non-standard notation useful when teaching new concepts?","<mathematical-pedagogy><intuition>"
"Entertaining examples of multiply quantified statements","<logic>"
"A parabolic arc is not semicircular. But students think so","<undergraduate-education><calculus><geometry><students-mistakes>"
"How can I teach Mathematics to genius students?","<secondary-education><gifted-students>"
"Explaining Closure to ""Basic"" Algebra 2 Students","<secondary-education><mathematical-pedagogy><algebra>"
"On what total do you grade your exams?","<course-design><exams><grading>"
"Are there technique to help with poor recall?","<self-learning>"
"How to deal with fast students without neglecting weaker ones","<classroom-management><gifted-students><general-pedagogy>"
"Summer Mathematics Workbooks for Elementary and Middle School","<self-learning><summer>"
"Ideal Undergraduate Sequence","<undergraduate-education><curriculum>"
"A free BYOD response system that registers students?","<technology-in-education><software>"
"How much time to spend on a single question?","<undergraduate-education><homework><general-pedagogy>"
"Effective use of Moodle (or similar)","<undergraduate-education><technology-in-education><general-pedagogy><software>"
"Effective use of Maple T.A","<undergraduate-education><technology-in-education><reference-request><software>"
"Mathematical thinking skills for engineering students","<undergraduate-education><textbooks>"
"Emphasizing benefits of mathematical abstraction","<undergraduate-education><secondary-education><examples>"
"How to motivate the geometric definition of trigonometric functions on the unit circle","<concept-motivation><trigonometry>"
"How to make Calculus II seem motivated, interesting, and useful?","<calculus>"
"What are the differences between popular undergraduate abstract algebra books?","<undergraduate-education><textbooks><abstract-algebra>"
"Grading scale: how to handle multiple choice questions with different number of choices","<exams><grading><test-design>"
"Advice for Tablet/Stylus for Mathematics Teaching","<technology-in-education><software>"
"What explains why a student can learn philosophy well, but fail in abstract math?","<critical-thinking>"
"How to teach calculus effectively to non-math (and noisy) students?","<calculus><classroom-management>"
"How much prior math should I review in teaching a graduate-level course?","<graduate-education><differential-equations><review>"
"Inability to work with an arbitrary mathematical object","<undergraduate-education><mathematical-pedagogy><proofs><real-numbers>"
"Mathematics exam -- How to keep brain functioning through a four-hour exam?","<exams><assessment><gifted-students>"
"Exponents with Negative Base; with or without Parentheses","<arithmetic-operations><negative-numbers><middle-school><exponent>"
"Is the annual system still in vogue anywhere in Europe, North America, Australia, or East Asia? And what about the 2-year B.A. / B.Sc. degree?","<undergraduate-education><exams><assessment>"
"Pedagogical advice/articles for graduate student teaching assistants","<undergraduate-education><mathematical-pedagogy><reference-request><general-pedagogy>"
"Which book to use concurrently with each of these mathematics texts?","<reference-request><textbooks><mathematical-analysis><topology><functional-analysis>"
"Should college mathematics always be taught in such a way that real world applications are always included?","<undergraduate-education><linear-algebra><applications><applied-mathematics>"
"Interesting but very easy epsilon-delta problems?","<mathematical-analysis><problem-design><limits>"
"To which degree should exams test intelligence vs mastery of the material","<exams>"
"Complex Variables for Engineers versus Ordinary Differential Equations with Linear Algebra difficulty","<advising><course-sequence>"
"""Real world"" examples of implicit functions","<calculus><examples><functions>"
"How to Write Steps of Solving Equations?","<algebra><writing><middle-school>"
"Resources for precalculus applications","<geometry><word-problems>"
"What is a recommend way to describe a negative number with large absolute value?","<terminology>"
"Why is polynomial factorization over the integers part of secondary school curricula?","<secondary-education><reference-request><curriculum><history><solving-polynomials>"
"How to show $(x - a)$ is a factor of a polynomial $p(x)$ if and only if $p(a) = 0$ (without division)","<roots>"
"Logic and proofs in secondary school","<secondary-education><mathematical-pedagogy><proofs><logic><middle-school>"
"Analogies for grad, div, curl, and Laplacian?","<calculus><vector-calculus>"
"Is There Such Thing as Reaching Half a Standard?","<secondary-education><usa><common-core>"
"How to naturally encounter the properties of identity, commutativity, associativity, and distributivity (to define rings)?","<abstract-algebra><intuition><arithmetic-operations>"
"Reference Request: Suitability of a text and corresponding video lecture series request for ""Matroid Theory""","<reference-request><textbooks>"
"Do you mention the continuity and the differentiability of the empty function","<undergraduate-education><calculus>"
"Would it make sense for math courses to be pass/fail?","<undergraduate-education><secondary-education>"
"What is ""mastery"" in a mathematical topic?","<mathematical-pedagogy><proofs>"
"What are the resources to learn prerequisite knowledge to latter High school and undergrad prep textbooks?","<secondary-education><textbooks><self-learning><middle-school><resource-request>"
"What is a good place for teachers to share self-created content?","<undergraduate-education><secondary-education><online-instruction><problem-solving><online>"
"Good resources on matrix equations","<resource-request>"
"How much more skilled in the topic should you be in order to teach the topic?","<undergraduate-education><secondary-education><graduate-education>"
"How do I learn advanced mathematics without forgetting?","<self-learning><graduate-education><advising>"
"Ramanujan results for middle school?","<middle-school>"
"Research for Video Length for Math Videos","<undergraduate-education><videos>"
"At what age are most children able to convert between rational fractions and decimals?","<primary-education><arithmetic-operations>"
"How can teachers warn students about common mistakes without causing the student to make the mistake?","<mathematical-pedagogy><examples>"
"Generating system of equations with unique solutions","<homework><arithmetic-operations><arithmetic>"
"Intuition or geometry for Partial Fractions","<calculus><intuition><integration>"
"How can I introduce the idea of eigenvectors and matrix decompositions to a general audience in an engaging manner?","<algebra><concept-motivation><linear-algebra><eigenvalues>"
"Appealing thinking games, that are easy to make; easy to learn, and easy to play","<mathematical-pedagogy><games>"
"Introductory book or other resource on $p$-adic numbers/number theory/analysis","<textbooks><self-learning><mathematical-analysis><reference-books><number-theory>"
"Definitions of factors and terms","<secondary-education><definitions>"
"In single variable calculus, do you distinguish between critical and singular points?","<calculus><terminology><derivative>"
"Consolidating three descriptions of a parabola in precalculus","<undergraduate-education><secondary-education><geometry><precalculus>"
"Should we ""program"" calculus students, like the physicists seem to want us to?","<undergraduate-education><reference-request><infinitesimals>"
"Free, open-source, customizable, interactive math books with gaming elements","<general-pedagogy><games>"
"What to do if there is a wrong definition in a problem?","<exams>"
"Bloom's taxonomy","<general-pedagogy><teacher-development><transferrable-skills>"
"Why is this type of reductio ad absurdum not taught more?","<undergraduate-education><proofs>"
"Is there a toy example of an axiomatically defined system/ structure?","<undergraduate-education><concept-motivation>"
"How do i deal with students who make these mistakes?","<secondary-education><students-mistakes><integration><number-theory><complex-numbers>"
"Are there any math certificates/qualifications on high school maths that you can do after high school?","<secondary-education><exams><self-learning><prerequisites>"
"Complex numbers in high school","<secondary-education><mathematical-pedagogy><mathematical-analysis><complex-numbers>"
"Does learning classical approach to differential geometry before modern approach help or hinder?","<undergraduate-education><graduate-education><differential-geometry>"
"How should I deal well-known versus the obvious rubric?","<calculus><course-design><grading>"
"The Undergraduate Responsibility Gradient","<undergraduate-education><mathematical-pedagogy><calculus><assessment>"
"Reason behind the dominance of particular countries in the IMO (International Mathematical Olympiad)","<education-research><math-contests><cultural-differences>"
"Solvability of Systems of Diophantine Equations using Modular Reasoning","<discrete-math><resource-request>"
"Looking for examples from the MCMC family of ideas","<technology-in-education><statistics>"
"Good Textbook for combined Beginning and Intermediate Algebra Course","<undergraduate-education><algebra><textbooks><community-colleges>"
"""Sigma Notation"" vs. ""Summation Notation""","<vocabulary>"
"Transitioning from 'Read textbook to learn' to 'Read original paper/Read paragraphs of textbooks'","<textbooks><graduate-education>"
"What do you do when you realize mid-lecture that your lesson plan is not working?","<general-pedagogy><teacher-preparation>"
"Is extra credit appropriate?","<undergraduate-education><homework><grading>"
"What is a good motivation/showcase for a student for the study of eigenvalues?","<examples><concept-motivation><linear-algebra><eigenvalues>"
"Pi or Tau? How should the circle constant be taught?","<secondary-education><geometry><trigonometry>"
"Students use WolframAlpha. Can we change calculus instruction to exploit it while discouraging 'cheating'?","<undergraduate-education><calculus><technology-in-education>"
"To what extent is math research in the United States subsidized by calculus teaching?","<calculus>"
"How do you fix a broken course plan?","<course-design><classroom-management><teacher-preparation>"
"online homework vs paper homework","<undergraduate-education><homework><technology-in-education>"
"Use of mathematical humor suitable for motivation/explaination?","<student-motivation><general-pedagogy>"
"What course web software is usable by mathematicians?","<technology-in-education><software>"
"Technology and distractions","<undergraduate-education><technology-in-education><classroom-management>"
"How can you explain to students that they should not use the same variable in an integrand and in the limits of integration simultaneously?","<calculus><examples>"
"Should students be asked to use more than one notation for the derivative in an introductory calculus class?","<calculus><notation>"
"Impressive examples where a ""proof by picture"" goes wrong","<undergraduate-education><examples><proofs>"
"Three approaches to regular languages","<mathematical-pedagogy><computer-science>"
"How to standardize grading across several sections of a course?","<undergraduate-education><course-design><grading><assessment><large-lecture>"
"How to encourage women to study mathematics?","<student-motivation><advising><gender><women>"
"How to make calculus lecture time more interactive?","<calculus><interactive-teaching><class-participation>"
"What to do when students are not keeping their eyes on their own test?","<classroom-management><exams>"
"Writing up a proof that assumes what is to be proven?","<proofs>"
"How many hours / school years does it take for the average child to memorize the $10\times 10$ addition and multiplication tables?","<primary-education><multiplication-table>"
"Online open-course-ware that uses Maclane's book ""Algebra""","<graduate-education><abstract-algebra><online-instruction>"
"Scientific results on the usefulness of physical units in secondary education?","<secondary-education><physical-sciences><meta-cognition>"
"Propositional and predicate logic, with quantifiers: Is there any research when it is ideal to explicitly teach in mathematics education?","<mathematical-pedagogy><education-research><students-mistakes><logic>"
