title,tags
"Why does a first course in linear algebra teach QR-decomposition?","<linear-algebra><applied-mathematics><engineering-mathematics>"
"Relational understanding for a specific topic","<mathematical-pedagogy><education-research>"
"Prerequisites to study Laplace Transform completely?","<undergraduate-education><mathematical-pedagogy>"
"What are some nice ways to incorporate Euler's Method or other numerical methods throughout calculus?","<applications>"
"Cautionary tales for Gaussians/the central limit theorem?","<probability>"
"Which Geometry book is more rigorous/harder?","<geometry>"
"Have you ever completely covered every topic in a textbook, and if so, which text?","<undergraduate-education><textbooks>"
"Best Touchscreen Laptop for Tutoring During COVID Pandemic","<technology-in-education><tutoring>"
"Struggling with Math Skills and When to Quit","<student-motivation><struggling-students>"
"Should a student have another chance at a math test question when they have a english problem?","<secondary-education><testing>"
"Mental visualisation ability test for each age?","<primary-education><meta-cognition><mental-math>"
"Why don’t American school textbooks recognize negative numbers as whole numbers?","<textbooks><terminology><negative-numbers>"
"Teaching linear algebra, wacom tablet display of coordinate system, eigenvectors, markov chains","<linear-algebra><online-instruction><software><vectors>"
"Is there any university program that offers an introductory statistical methods class that is bayesian -instead- of a frequentist one?","<statistics>"
"How do I teach my kid","<secondary-education><algebra>"
"Should students get another chance at a math question because of English troubles?","<secondary-education><testing>"
"Appropriate context for teaching derivative (undergraduate/graduate)","<calculus><precalculus>"
"Recommendation for cheap practical graphics tablet?","<technology-in-education>"
"What's the common word for equations and inequalities?","<language-use>"
"Applications of abstract algebra outside of mathematics and suitable textbook","<undergraduate-education><textbooks><abstract-algebra><applications>"
"Student converted $\sqrt{x^2}$ and ended up with just $x$ instead of $|x|$","<algebra>"
"Why is multivariable analysis often omitted?","<undergraduate-education><mathematical-analysis><graduate-education>"
"Different approaches to proofs that ""are the same""?","<proofs><discrete-math>"
"In Text Exercises","<mathematical-pedagogy><textbooks>"
"Rubric for grading an undergraduate real analysis course","<undergraduate-education><mathematical-analysis><grading>"
"How to write a book for someone who learns math alone?","<self-learning>"
"Is Khan academy really good?","<software><online-instruction>"
"Teaching measurement to 4th grade students by projects?","<technology-in-education><primary-education><interactive-teaching><teacher-preparation><teachers>"
"Research on the use of outlined / structured proofs in instruction","<mathematical-pedagogy><reference-request><proofs>"
"Why do we teach calculus in high school rather than a different math course?","<secondary-education><calculus><curriculum>"
"Population of students taking freshman calculus","<calculus>"
"The role of visualization and intuition in graduate and postgraduate math and developing it","<graduate-education><intuition><visual-proof>"
"Should Euclid's algorithm be taught as rigid or flexible?","<undergraduate-education><secondary-education><number-theory>"
"Are precise drawings important in geometry?","<mathematical-pedagogy><secondary-education><geometry>"
"Should one justify formulae in middle school?","<mathematical-pedagogy><secondary-education><proofs>"
"References on British, German and French educational system","<undergraduate-education><reference-request><graduate-education><education-research><reference-books>"
"How to convince students of the integral identity $\int_0^af(x)dx=\int_0^af(a-x)dx$?","<mathematical-pedagogy><calculus><integration>"
"Moore method projective geometry","<geometry><lecture-notes><inquiry-based-learning>"
"The 'epsilon-delta' method for teaching limits","<calculus><infinitesimals>"
"Teaching geometric transformations through fractals?","<secondary-education><geometry><fractals>"
"How can a research mathematician transition into a mathematics education researcher?","<education-research>"
"""Opinionated"" textbooks","<textbooks>"
"Effects of early study of advanced books","<secondary-education><reference-request><self-learning><gifted-students><creativity>"
"Uninsulting way to say ""this will eventually be easy""","<proofs><language-use>"
"Are convergent and divergent sequences a prerequesite for calculus or are they a part of it?","<calculus><precalculus><sequences>"
"Gifs of finding the volume of 3d shapes?","<secondary-education><examples><geometry>"
"Has anyone written anything notable on the relation between mathematical progress and the simplification of proofs overtime?","<proofs><writing>"
"Books on meta-cognition that would be relevant for those involved in mathematics?","<mathematical-pedagogy><meta-cognition>"
"Is there any footage of Let's Make a Deal illustrating the Monty Hall problem?","<reference-request><probability>"
"Thought experiment: Utopian college-level math curriculum without external constraints","<reference-request><curriculum>"
"Permutations with identical objects","<secondary-education><algebra>"
"Interesting Math Posters","<student-motivation>"
"An alternative to ""two column"" geometry proofs","<secondary-education><geometry><proofs><terminology><usa>"
"Is there research on the efficacy of taking good notes in math class?","<mathematical-pedagogy>"
"Is there a pre-calculus introduction to the formal definition of a limit?","<calculus><precalculus><limits><absolute-value>"
"Finland's performance on international competitions","<mathematical-pedagogy><math-contests><finland>"
"Studies on more simple problems, or fewer difficult problems?","<calculus>"
"Easy examples of correspondence between global and local, as preparation for Gauss's theorem and Stokes's theorem","<examples><vector-calculus>"
"How should students say in words the notation for a limit?","<undergraduate-education><calculus><limits>"
"Why do you need to distinguish between apparently identical objects in probability?","<probability><teacher-development>"
"A PEMDAS issue request for explanation","<algebra><arithmetic-operations>"
"Retain problems and combat regression in learning","<mathematical-pedagogy><calculus><general-pedagogy><integration>"
"How to choose random student to answer questions?","<class-participation>"
"A different symbol for the indefinite integral/antiderivative?","<calculus><notation><integration><derivative>"
"How to show $3(\log_2 n)^5 < \sqrt{n}$","<secondary-education>"
"Becoming a better instructor: where to start?","<undergraduate-education><reference-request><teacher-development>"
"""A computer program IS a proof"": Introducing rigor via programming","<secondary-education><proofs><computer-science>"
"Most important nonstandard math courses","<undergraduate-education><curriculum>"
"What to do about a student's poor handwriting","<general-pedagogy><transferrable-skills>"
"Is there a conventional function notation that takes a polynomial and order and yields the coefficient corresponding to the order?","<notation><functions>"
"What are some places to publish pedagogical articles about teaching undergraduate mathematics?","<undergraduate-education><mathematical-pedagogy><publishing>"
"What is a logical way to introduce probability and statistics to students that don't know fractions or percentages yet?","<primary-education><statistics><probability>"
"Is derivation based Math a good way to teach my 5 years old daughter addition?","<axioms-foundations>"
"Does playing tournament chess result in high-level mathematical gains, and not merely a skill whose benefits can be gained through any other activity?","<education-research><transferrable-skills>"
"Handing out $2 calculators for tests?","<exams><testing><calculators>"
"How is teaching calculus in high school different from teaching calculus in college?","<undergraduate-education><calculus><secondary-education><usa>"
"A study comparing effects of calculator usage on later math skills?","<reference-request><technology-in-education><calculators>"
"Student Poisoned Experience with Math","<course-design><secondary-education><anxiety>"
"What Math(s) Ed literature is accessible to the working math(s) educator?","<education-research>"
"Is there any difference between teaching calculus for math and engineering students?","<mathematical-pedagogy><calculus>"
"Better use ""Integrate a function""/""Calculate the definite integral"" or use terms like ""primitive function"", ""antiderivative"", ""Aufleitung"" (German)?","<calculus><notation>"
"Good problems that uncover difficult points in a theory","<undergraduate-education><undergraduate-research><problem-design>"
"How formal should I be as a university teacher?","<mathematical-pedagogy>"
"How can I teach my students the difference between a sequence and a series?","<calculus><students-mistakes><series><sequences>"
"Whence the ""everything is linear"" phenomenon, and what can we do about it?","<mathematical-pedagogy><algebra><students-mistakes><education-research>"
"Is it a good idea to have one or two or three classes on basic logic before teaching $\varepsilon$-$\delta$ in Calculus?","<calculus><course-design><teaching><logic>"
"Memorizing Trig Identities","<trigonometry>"
"Examples showing necessity and advantage of emperical definition of probability","<secondary-education><probability>"
"Question about the process of creation of problems and exercises in Mathematics","<undergraduate-education><graduate-education><problem-design><problem-solving>"
"How can I explain ratio problems without talking about ratio?","<secondary-education><word-problems><proportional-reasoning>"
"Do ""gateway tests"" work?","<undergraduate-education>"
"Is there a simple real-world problem I can use to motivate a formula for $\displaystyle \sum_{i=1}^n i $?","<concept-motivation><examples>"
"Calculus 3 Teaching Demonstration for Community College Teaching Position","<mathematical-pedagogy>"
"Standardized Exam for Statistics?","<exams><statistics>"
"What is the mathematical value of children learning and being tested on Roman numerals?","<testing><test-design>"
"Is it better to study in groups or by yourself?","<self-learning>"
"Is 'estimating' still considered a valuable skill?","<secondary-education><algebra>"
"Is higher-math pedagogy responding properly to Wolfram Alpha's existence?","<mathematical-pedagogy>"
"How can I help a student who has a ""wrong"" kind of enthusiasm?","<undergraduate-education><secondary-education><calculus><student-motivation>"
"Ten options for multiple choices questions","<student-question>"
"What are some very concrete examples of statistical models to present to students?","<statistics>"
"Why's math more complicated to understand than philosophy?","<self-learning><philosophy-of-maths>"
"Experiences with Venn diagrams as didactic tool for factors, GCD, LCM?","<secondary-education>"
"How can I introduce a speech about the Fibonacci sequence creativiely?","<secondary-education><presentation><sequences>"
"How to explain NP-hardness and NP-completeness to students","<mathematical-pedagogy><technology-in-education><teaching><terminology><computer-science>"
"How students write their work, and learning outcomes","<students-mistakes><notation>"
"Textbooks explicitly showing the injections for the sum of sets","<reference-request><primary-education>"
"What to do if all students lack prerequisites?","<undergraduate-education><mathematical-pedagogy>"
"Recommend a vector calculus textbook/resource with an algebraic geometry flavor","<reference-request><textbooks><reference-books><vector-calculus>"
"Should Euler's method be taught in calculus 1 courses?","<calculus>"
"Source material to study number theory?","<self-learning><number-theory><resource-request>"
"Would this be a good way of teaching about symmetry?","<functions>"
"Teaching Mathematics to a Younger Sibling","<secondary-education><mathematical-pedagogy><textbooks><primary-education>"
"Examples of real-life vector fields for vector calculus","<calculus><vector-calculus><applied-mathematics><applications><physical-sciences>"
"Where can I find a good course on tensor calculus not focused on applications and physics?","<textbooks><self-learning><differential-geometry>"
"What should be the bare minimum wrong answer threshold when self studying a math text?","<self-learning>"
"What is the right notation to use in multivariable chain rules?","<notation><vector-calculus>"
"Choice of textbook for an undergraduate abstract algebra course","<undergraduate-education><reference-request><textbooks><abstract-algebra>"
"Questions relating to inclusion-exclusion principle","<self-learning>"
"Advice: How to cite literature for high-school students?","<secondary-education><general-pedagogy>"
"How to explain that winning the lottery is not a 50/50 distribution?","<probability>"
"Do you avoid examples or test questions that showcase an algorithmic plug'n'chug approach?","<mathematical-pedagogy><examples><exams>"
"DIY/Hack Instructional Implements","<secondary-education><technology-in-education>"
"A different version of central limit theorem?","<probability>"
"Should we teach abstract affine spaces?","<undergraduate-education><geometry>"
"Have there been longitudinal studies comparing outcomes of various teaching methods?","<reference-request>"
"Why don't we teach codomains of functions in high school?","<curriculum><functions>"
"Who is E. Kim Nebeuts?","<mathematical-pedagogy><history>"
"Math counterexamples site","<mathematical-pedagogy>"
"elementary level assessment tools","<assessment><testing>"
"Becoming independent of the calculator","<undergraduate-education><tutoring><calculators>"
"Looking for a tool to create a digital multiplication quiz","<primary-education><online-instruction><multiplication-table>"
"Constructing and sketching parabolas, conic sections and other curves","<calculus><algebra>"
"Are fractions hard because they are like algebra?","<algebra><fractions>"
"Exactly what do I want these Calculus I students to learn?","<calculus>"
"The word ""numeral"", is it being taught and does the word exist for it in your language?","<terminology><notation><language-use>"
"Can anyone recommend good software for verifying row reduction steps?","<linear-algebra>"
"Pedagogical considerations behind current order of presentation of trigonometry","<mathematical-pedagogy><textbooks><trigonometry>"
"Asking students to define ""unique""","<undergraduate-education><assessment>"
"Is ""The Petersen Graph"" by Holton and Sheehan a good text for graph-theory students? Any requisite knowledge for mastering the text?","<textbooks><prerequisites><graph-theory>"
"Would a 1990's educated person need additional content knowledge to tutor high school mathematics today?","<secondary-education><tutoring><history>"
"How to give my students a straightedge instead of a ruler","<geometry><constructions>"
"Are there any math journals or magazines with math problems for middle school or university?","<journals>"
"Questions about the calculus AP","<calculus><exams>"
"Applied ODEs for Numerical Methods","<undergraduate-education><examples><concept-motivation><differential-equations><engineering-mathematics>"
"High school maths textbook for talented students","<secondary-education><algebra><textbooks><geometry><reference-books>"
"Calculus book for basic calculus and repetition from videregående (Norwegian high school)","<undergraduate-education><textbooks>"
"Instilling a Growth Mindset in a Student Diagnosed With Dyscalculia","<dyscalculia>"
"How to improve mathematical skills(University level)?","<undergraduate-education><proofs><mathematical-analysis><undergraduate-research><problem-solving>"
"Are there any benefits to having an entire course's homework problems available from day one?","<undergraduate-education><course-design><homework><problem-design>"
"Use Mathematica to teach calculus","<calculus><course-design><technology-in-education><software>"
"How to design a compact course without loss of main benefits of a usual course?","<course-design><general-pedagogy>"
"is it possible to motivate square roots e.g. $\sqrt{2}$ in business math?","<secondary-education><concept-motivation><algebra>"
"How can a math teacher manage a class when unprepared?","<course-design><classroom-management><general-pedagogy><teacher-preparation>"
"How is education in mathematics relevant to law?","<student-motivation>"
"Convincing a student it's OK to move on to another problem","<tutoring>"
"Mathematical Knowledge for Teaching","<undergraduate-education><course-design><primary-education><graduate-education>"
"How to teach Proofs","<secondary-education><proofs>"
"The definition of natural log and e","<undergraduate-education><secondary-education><calculus><definitions>"
"What is a good ""simplification policy"" for a college course with no calculators?","<undergraduate-education><calculus>"
"Math Scholarships for the highly advanced","<gifted-students><student-question>"
"Do students confuse $\log_ab$ and $\log a^b$?","<secondary-education><students-mistakes><notation><logarithm>"
"Which math subjects should I know well to tutor competitive mathematics?","<secondary-education><math-contests>"
"Students strictly follow the steps and notations in sample problems without understanding them","<calculus><teaching>"
"Sliderule for teaching logarithms","<technology-in-education><logarithm>"
"The general and particular in the psychology of mathematics education","<reference-request><student-motivation><teacher-preparation><teacher-training><teacher-motivation>"
"How can we neatly explain chain rule of differentiation","<calculus>"
"Beyond Calculus, an Invitation to Dream Higher for High School","<secondary-education><curriculum>"
"Educational styles for writing proofs","<undergraduate-education><reference-request><proofs><logic>"
"Specific Intervention(s) for Middle School 'Place Value' confusion","<real-numbers><proportional-reasoning><place-value>"
"How can I motivate the formal definition of continuity?","<undergraduate-education><concept-motivation><mathematical-analysis><intuition><definitions>"
"Why is continuity defined as a local property?","<undergraduate-education><concept-motivation><mathematical-analysis><intuition><definitions>"
"Why is continuity only defined on its domain?","<undergraduate-education><concept-motivation><mathematical-analysis><intuition><definitions>"
"Developing mathematical stories","<mathematical-pedagogy>"
"Why would you teach Calculus before teaching Real Analysis?","<calculus><mathematical-analysis>"
"Hands-on demonstration ideas for multivariate calculus","<analytic-geometry><vector-calculus>"
"Seminal Professional Development writings","<teachers><teacher-training>"
"Notation Conflict between Teachers and Textbooks","<mathematical-pedagogy><notation><logic>"
"Advantages on repeating question in student's answer","<exams><homework><psychology>"
"Confirmation bias in math education","<secondary-education><primary-education><teachers>"
"Where can I inform me about experiences with exam tasks heading for deeper understanding?","<undergraduate-education><exams><examples><problem-design>"
"Philosophical Subjects in Logic Courses","<mathematical-pedagogy><class-participation><logic>"
"How to teach math to someone who is neither [really] willing nor able to understand it?","<mathematical-pedagogy>"
"How much detail should you show in algebra steps while teaching?","<calculations>"
"What to do if an exam takes longer than intended?","<undergraduate-education><exams><testing>"
"Is there any math text reader device to help children who cannot see?","<mathematical-pedagogy><technology-in-education><special-needs-education>"
"Teaching Infinitesmals and Non-Standard Analysis","<textbooks><curriculum><mathematical-analysis><infinitesimals>"
"Unusual applications of integration","<calculus><examples>"
"Can music improve math abilities?","<mathematical-pedagogy><psychology>"
"Real-World Applications of Logic","<undergraduate-education><examples><logic>"
"How are exercises in vector geometry created?","<exams><software>"
"Wording VS mathematical notations","<geometry><notation>"
"Advanced algebra circa 1969","<algebra>"
"Addressing fundamental math errors","<students-mistakes><teaching><struggling-students>"
"How to explain inverse modulo?","<secondary-education><self-learning><calculations>"
"What is the name of this discipline in mathematics education?","<algebra><functions><number-theory>"
"How to keep passion in students?","<tutoring>"
"A formula for the area of a rectangle","<geometry><visual-proof>"
"How to retain the key points of an exercise?","<undergraduate-education><student-motivation><problem-solving>"
"How to teach mass center for young people","<geometry>"
"Which calculus textbook is aligned the most with the CollegeBoard course description?","<calculus><textbooks>"
"What's the best way to explain multivariable limit problems to students who are not familiar with $\epsilon-\delta$ proofs?","<calculus><limits>"
"Constructive refutation of student misconception","<secondary-education><mathematical-pedagogy><proofs><students-mistakes><fractions>"
"Trig Tables and Right Triangles","<trigonometry>"
"What is the difference between ""numeracy"" and ""number sense""?","<education-research><terminology>"
"Difference between whole numbers and decimal numbers","<mathematical-pedagogy>"
"How can I deal with the time pressure of teaching a short course?","<mathematical-pedagogy><calculus><teaching><precalculus>"
"How can I help an eighth grader learn to write mathematically?","<secondary-education><algebra>"
"How is this problem categorised?","<secondary-education><problem-solving>"
"The Order in Pre-Calculus Textbooks","<textbooks><precalculus>"
"What is the term for the marks used to show congruence in geometric figures?","<geometry><terminology>"
"What number is the sum of two roots","<undergraduate-education><real-numbers>"
"Inspirational Mathematics Books for Teenager","<reference-books><applied-mathematics><mathematics-in-daily-life>"
"How to improve atmosphere in male-dominated courses","<graduate-education><classroom-interaction><gender>"
"Why don't textbooks foreground marginally generalized theorems?","<textbooks>"
"Calculus via a constructivist approach","<secondary-education>"
"Timing of when Cayley-Hamilton theorem is taught in Linear Algebra","<linear-algebra>"
"How should I solve this geometrical problem","<geometry>"
"Reference request: undergraduate combinatorial topology","<undergraduate-education><reference-books><topology>"
"How to introduce trigonometric ratios (HS) through a cognitive model?","<secondary-education><precalculus><trigonometry>"
"Ought color be used more in math?","<education-research>"
"Analogies or explanations for duality, at the college sophomore level","<linear-algebra><physical-sciences>"
"How to teach ordinary differential equations to good students?","<undergraduate-education><differential-equations>"
"How to resolve the new definition of subtraction and division seen in college algebra?","<undergraduate-education><algebra>"
"Intuition: 5 regular polyhedra, 6 regular 4-polytopes, and then 3 regular d-polytopes","<undergraduate-education><geometry><intuition>"
"Can or should students do research in standard major math courses","<undergraduate-education><undergraduate-research>"
"What tools are available for creating visual aids?","<course-design><examples><graphing>"
"How to explain multiplying and dividing by fractions with real-world examples","<intuition><fractions>"
"Can $y^{(n)}$ be used as a way of representing higher order derivatives?","<calculus><notation><derivative>"
"Middle / High School Math Teachers and LaTeX","<secondary-education><homework><presentation>"
"Can I succeed in university math, if I loathe physics?","<self-learning>"
"Ideas for high-school proof class?","<mathematical-pedagogy><proofs><teaching><struggling-students><summer>"
"What is the point of teaching variance?","<undergraduate-education><statistics>"
"Why teach absolute mean deviation?","<secondary-education><statistics>"
"What is a good hex board size for kids to learn on, playing short games?","<games>"
"Justifying the multi-variable chain rule to students","<undergraduate-education><calculus><concept-motivation><vector-calculus>"
"Adding irrelevant humorous questions to a quiz exam","<exams>"
"Setting up a new Ximera course with randomized values in problems","<course-design><technology-in-education><homework><software><problem-design>"
"Resources for Unit Conversions","<resource-request>"
"Resources for Unit Rates","<mathematical-pedagogy><primary-education><middle-school><resources>"
"How important is it to come up with or learn an elementary solution?","<undergraduate-education><secondary-education><proofs><problem-solving>"
"The dimension theorem and pedagogy","<undergraduate-education><linear-algebra>"
"How to summarize textbook material?","<discrete-math><student-question>"
"Do people usually teach solving a linear differential equation by inverse operators in an undergraduate course?","<undergraduate-education><differential-equations>"
"A wow video to teach Calculus","<online-instruction><online><videos>"
"Teaching calculus in AP without the limit definition","<calculus><teaching>"
"Is there online geometric construction software that models physical constructions?","<geometry><technology-in-education><constructions>"
"How strict are you with prerequisites?","<prerequisites>"
"Am I responsible to help a student who does not understand/know some prerequisites of a course?","<calculus><struggling-students>"
