title,tags
"Stone–Čech compactification and AC","<general-topology><axiom-of-choice><compactification>"
"Random walk over a cube:Probability of returning back","<probability><markov-chains>"
"Exist of function $f:\mathbb{R}\to \mathbb{R}$ so that $f_n(x)=f(x+\frac{1}{n})$ not converge.","<sequences-and-series><convergence-divergence>"
"Let $f$ be smooth, then the ""directional derivative"" $df_x$ is linear.","<calculus><real-analysis>"
"Show that $\lim_{x \rightarrow 1^{-}} (x^ {m+1} \frac {1}{1-x}) =\infty$ for $m \in \Bbb N, m>0$","<limits><functions>"
"Calculus 2 showing Improper Integral Converges","<calculus><integration><improper-integrals>"
"I need help with an integral that is too chaotic for my level of undestsanding","<calculus><integration><volume>"
"Using Fourier transform for an oscillator?","<fourier-transform>"
"Finding $n$ such that atleast one permutation of the digits $1,2,\ldots,n$ is divisible by $11$.","<permutations><divisibility>"
"find $A ^\perp$","<linear-algebra><inner-products><orthogonality>"
"What is proper notation for common (decimal) logarithm?","<notation><logarithms><convention>"
"Probability of choosing value of variable in equation - 4 tuple ($x_1 +x_2+x_3+x_4=10$)","<probability><combinatorics><discrete-mathematics>"
"Prove or disprove $\gcd(q,r) \mid b$ if $a = bq + r$","<elementary-number-theory><divisibility>"
"Help with Relation aRb if b =a^k","<discrete-mathematics><relations>"
"$ (1+\sin{x})^{\cos{x}} + (1+\cos{x})^{\sin{x}} > 3x $","<inequality>"
"How To Solve Base 15 Equations","<algebra-precalculus>"
"Area in the Hyperbolic Plane","<differential-geometry><riemannian-geometry>"
"$\sum_{k=0}^n\binom nk x^k=\sum_{k=0}^n\binom nk x^{n-k}.$","<binomial-coefficients>"
"Prob of sum of cards being multiple of die roll","<probability>"
"Constructing a homomorphism from $G$ to $S_t$ and finding it's order","<group-theory>"
"Find center of mass of triangle with varying density","<calculus><integration><multivariable-calculus><average>"
"What's wrong with this proof that commutativity is implied by the other field axioms?","<abstract-algebra><arithmetic><fake-proofs>"
"Transformation to elliptical coordinates","<calculus><multivariable-calculus><coordinate-systems>"
"Find maximum hyperplane separating two classes by optimizing the Langrangian function.","<optimization><lagrange-multiplier>"
"Calculating derivative by keeping all but one $x$ constant and adding the results together for different $x$","<calculus><derivatives>"
"Find the nullity of the transformation $T(f)=f-f'$ from $C^\infty$ to $C^\infty$","<linear-algebra>"
"If $s_1 +s_2 \gt 1$ and $(t_1,t_2)$ be a convex combination of this with $(0.5,0.5)$ then show that $t_1t_2 \gt 0.25$","<calculus><real-analysis><self-learning><convex-analysis>"
"Subtraction of two repeating decimals","<rational-numbers><decimal-expansion>"
"Thy conditional expectation hath forsaken me","<probability><probability-theory>"
"Prove that if $A$ has linearly dependents columns, then $A^tA$ is singular.","<linear-algebra><matrices>"
"$\int_{0}^{1}(f'(x))^2-(f'(x))^3f(x)\; dx \geq 0$?","<calculus><real-analysis>"
"Is this the middle fourth cantor set?","<real-analysis><elementary-set-theory><lebesgue-measure>"
"What else could we do, instead of solving the congruences?","<number-theory><elementary-number-theory><congruences><p-adic-number-theory>"
"Does this sequence contain all positive integers?","<sequences-and-series><number-theory><fibonacci-numbers>"
"Who is the last person?","<combinatorics><puzzle>"
"Closed form of $\sum_{n=1}^{\infty} \left(\frac{H_n}{n}\right)^4$","<calculus><real-analysis><sequences-and-series><harmonic-numbers>"
"How can I solve this PDE?","<partial-differential-equations><numerical-methods>"
"Does changing side order of quad change area?","<trigonometry><area><quadrilateral>"
"Why do we need zeroes when writing some of those kinds of numbers?","<education>"
"Tensor products isomorphic to hom-sets with a structure","<tensor-products><exceptional-isomorphisms>"
"Is it possible to write all of the functions in terms of polar form?","<calculus><coordinate-systems><polar-coordinates>"
"Proof the formula","<analysis>"
"Prove that $A$ is dense in $\bf R$","<real-analysis>"
"Calculation of polynomial in the finite field","<finite-groups><cryptography><coding-theory><information-theory>"
"Prove that, if $\{u,v,w\}$ is a basis for a vector space $V$, then so is $\{u+v, v+w, u+v+w\}$.","<linear-algebra><vector-spaces><proof-verification>"
"Find $C$ such that $x^2 - 47x - C = 0$ has integer roots, and further conditions","<quadratics><prime-factorization>"
"Calculus - $\sum_{k=1}^\infty (\frac{e}{\pi})^{k-1}$","<calculus><sequences-and-series>"
"When are the following inclusions $\subsetneq$","<elementary-set-theory><metric-spaces>"
"Prove that the limit of a series, containing 1/{powers-of-2}, is not rational","<real-analysis><power-series>"
"permutations of $\{1,2,\cdots , n \}$ with some restriction","<combinatorics>"
"Except First year Abstract Algebra and commutative Algebra, what else do i need to start read Algebraic Geometry text?","<algebraic-geometry><reference-request><soft-question><big-list><book-recommendation>"
"Is it true that $|x^a - y^a| \leq |(x-y)^a|$ on $[0,1]$, where $a\le 1$?","<real-analysis><inequality>"
"Getting the points at which the tangent plane is horizontal?","<multivariable-calculus>"
"Show that $\sqrt[3]{2} + \sqrt[3]{4}$ is irrational","<algebra-precalculus><radicals><rationality-testing>"
"Prove (by induction?): If $A \subset \mathbb{N}$, $4 \in A$ and $n+1 \in A$ whenever $n \in A$, then $\left\{n \mid n \geq 4 \right\} \subset A$.","<proof-verification><induction>"
"Questions about some special classes of polynomials","<number-theory><polynomials><fourier-analysis><roots>"
"how to find a function expression of a power series?","<sequences-and-series><power-series>"
"Function with finite domain can be linear?","<linear-algebra><functions>"
"Calculating double integral with incomplete gamma function (numerically)","<integration><numerical-methods><indefinite-integrals><gamma-function>"
"Finding the argument of a complex function","<complex-analysis><complex-numbers><triangles><laplace-transform><transfer-theory>"
"show that $X_n \overset{\mathrm{P}}{\to} X \iff d(X_n,X) \to 0 $","<probability-theory><convergence-divergence><metric-spaces>"
"Where does $\in$ come from and where is it defined?","<elementary-set-theory><notation><definition><math-history>"
"Compute the maximum likelihood estimator for $θ$.","<statistics>"
"Diameter of a graph such that given independent vertices u, v, d(u) + d(v) ≥ n.","<graph-theory><hamiltonian-path>"
"Maths notation for iteration steps","<algorithms><computational-mathematics>"
"Is there integer $x$ such that $79|7x^2+4x-23$","<elementary-number-theory><quadratic-residues><legendre-symbol>"
"What am I trying to calculate? Probability/Odds/Accuracy?","<statistics>"
"How are Trignometric Ratios related to a circle?","<geometry><trigonometry>"
"Polynomial reduction on algebraic curve","<polynomials><reference-request><euclidean-algorithm>"
"linearization of minimum function","<optimization><linear-programming><simplex><linearization>"
"Solving $z^2(1-|z^2|)=-20$","<complex-analysis>"
"Tangent space at a point and optimization under constraint with the sub-manifold $x^2+2y^2-z^2=1$","<real-analysis><general-topology><analysis><multivariable-calculus><manifolds>"
"Homomorphism of groups, subgroups","<abstract-algebra><group-theory><group-homomorphism>"
"Median of a fair $6$ sided die, rolling once","<probability>"
"Adjunction Signature: abuse of notation or actual functor?","<category-theory><notation><adjoint-functors>"
"Why can I write this function in terms of its previous values?","<proof-explanation><machine-learning>"
"Why is the conditional expectation of an $L^{p}$-function again in $L^{p}$?","<probability><probability-theory><measure-theory><lp-spaces><conditional-expectation>"
"Is the Inertia quotiented by the first group of ramification $I/G_1\simeq (\mathcal{O}_L/P)^*$?","<abstract-algebra><algebraic-number-theory><ramification>"
"What is the definition of a relation?","<discrete-mathematics><elementary-set-theory><definition><relations><equivalence-relations>"
"Proof to theory - Let x be subset of G. There is a group generated by x which is the intersection of all subgroups of G containing x.","<linear-algebra>"
"Riemann-integration problem","<proof-writing><riemann-integration>"
"why is the log/root of a negative number ""invalid"" when it is possible to compute it?","<abstract-algebra>"
"Existence of solution of some functional equation involving integral","<real-analysis><functional-analysis><operator-theory><functional-equations><adjoint-operators>"
"Explain to me the concept of global bounds in Jensen's Inequality","<functional-analysis><probability-theory><inequality>"
"Can we find angles of the new triangle?","<geometry><trigonometry><triangles>"
"linear algebra and linear functionals","<linear-algebra>"
"Difference between coordinate map and standard coordinates?","<differential-geometry><manifolds><smooth-manifolds><coordinate-systems>"
"Does pointwise convergence of estimator imply consistency","<probability><probability-theory><statistics><random-variables><estimation>"
"Finding the closed form of a generating function","<generating-functions>"
"Expected Value of an expression including error function","<real-analysis><integration><stochastic-processes><stochastic-calculus><expected-value>"
"Derivation of the Fokker-Planck equation","<functional-analysis><probability-theory><markov-process><stochastic-analysis><stochastic-differential-equations>"
"If $\cos^6 (x) + \sin^4 (x)=1$, find $x$ if $x\in [0, \dfrac {\pi}{2}]$","<trigonometry>"
"Show that the set is not countable","<combinatorics><discrete-mathematics><cardinals>"
"Why 1 is not a cluster point of $\frac1n$","<real-analysis>"
"Additive character sum over intersection of additive and multiplicative subgroups of finite fields","<finite-fields><analytic-number-theory><characters><exponential-sum>"
"Reaction diffusion equation solution","<partial-differential-equations><boundary-value-problem><heat-equation>"
"Lower bound on multiplicative norm of Banach algebra.","<real-analysis><abstract-algebra><functional-analysis><representation-theory><norm>"
"A binary irrational with bits defined by primes","<prime-numbers><irrational-numbers><transcendental-numbers>"
"Is there a proof that the sum of the trihedral angles of a tetrahedron is minimal when the latter is regular?","<trigonometry>"
"A question regarding independence modulo a prime ideal of a number ring","<commutative-algebra><algebraic-number-theory>"
"Is $x^TAy$ convex or concave, for $x,y$ not identically equivalent?","<multivariable-calculus><convex-analysis><linear-programming><quadratic-forms><matrix-calculus>"
"Suppose $p:E\to B$ is a covering map and $B$ is connected. Prove that if $p^{-1}(\{b\})$ has n points $p^{-1}(\{b\})$ has n points for every $b\in B$","<algebraic-topology><covering-spaces>"
"Frobenius Method for $x^4y''=y$","<ordinary-differential-equations>"
"Cohomology and normalization of a curve","<algebraic-geometry><algebraic-curves>"
"About a nonlinear problem using sufficient optimality Kuhn-Tucker theorem","<optimization><nonlinear-optimization>"
"Calculus: Maximum and Minimum Values","<calculus><derivatives>"
"Prove by induction that $21 | 4^{n+1} + 5^{2n-1}$","<discrete-mathematics><proof-writing>"
"Find an Orientation for a complete Bipartite graph $K_{r,s}$, where $r,s \geq 2$","<combinatorics><graph-theory><bipartite-graphs>"
"Let $f(x)=\frac{d^{100}}{dx^{100}}\frac{1}{100!}x^{100}(1-x)^{100}$ Show that $0<\int^{1}_{0}x^{100}f(x)dx<\left(\frac{1}{4}\right)^{100}$","<calculus>"
"Using L'Hopital to solve $\lim_{x\to +\infty}\frac{\frac{-1}{x^2}}{\sin^2\left(\frac{2}{x}\right)}$","<calculus><limits>"
"How many samples do we need to conclude that the mean of one random variable is greater","<probability><inequality><probability-distributions>"
"For a bounded sequence $a_n$, $\lim\limits_{k\to\infty}(a_1+...+a_{n_k})/n_k=a$ implies $\lim_{n\to\infty}(a_1+...+a_n)/n=a$.","<analysis>"
"Naive Euclidean algorithm - average complexity?","<computer-science><recursion>"
"cardinal of the union of an increasing sequence","<real-analysis><elementary-set-theory><cardinals>"
"Recursively defined sequence","<real-analysis>"
"Proving a complex equality.","<complex-analysis>"
"Why doesn't $\sqrt {x^3} = x \sqrt {x}$","<radicals>"
"Symmetry planes in spherical harmonic basis","<symmetry><orthogonal-polynomials><symmetric-polynomials><spherical-harmonics>"
"How long are $AO$ and $OC$?","<geometry>"
"Is this problem a geometric program?","<optimization>"
"Proving L'Hospital's Rule for $\lim_{x\rightarrow a^+}\frac{f'(x)}{g'(x)}=\infty$","<real-analysis><limits>"
"Connected sum of $n$ tori $\mathbb{T}$","<general-topology>"
"Is there a way to approximate a polynomial as another, binary-coefficient polynomial?","<polynomials><binary><approximation-theory>"
"Curvature of implicit curve","<calculus>"
"What is variance of $b$, the OLS estimator of $β$, when $u\sim N(A,σ²I)$?","<linear-algebra><matrices><economics>"
"Conjugation in the symmetric group","<group-theory><permutations><symmetric-groups><permutation-cycles>"
"normal distribution integrating over region.","<probability-distributions><normal-distribution>"
"Deriving Singular Value Decompositionusing diagonalizability","<linear-algebra><svd>"
"Is sequence $7a_{n+1} = a_n^2+3$ bounded, increasing? And find its limit as $n\to+\infty$","<sequences-and-series><convergence-divergence><induction>"
"Proof for Product of Congruences mod P","<modular-arithmetic><congruences><congruence-relations>"
"Is this number a Liouville number?","<pi><transcendental-numbers><transcendence-theory>"
"$\mathbb{Q}$: Unique operation s.t. $1\star q=q$ and right distributivity hold?","<arithmetic><rational-numbers>"
"Arithmetic-geometric Mean","<real-analysis>"
"Partition of $S = \{1,2,\dots, 3n\}$ in to three subsets $A, B, C$ such that $|A| = |B| = |C| = n$","<combinatorics><set-partition>"
"Geometry problem on circle","<geometry>"
"Is there an analogue/extension of Baker-Campbell-Hausdorff formula for the conjugate?","<lie-groups><lie-algebras>"
"Find the units and the zero divisors in $F_{3}[x]$ mod $m(x) = x^{2} + x$","<abstract-algebra><group-theory><polynomials><field-theory><roots>"
"For every non-zero integers $x,y,z$ at least one of the products $xy,xz,yz$ must be positive.","<elementary-number-theory><discrete-mathematics><inequality>"
"Riemann - Hurwitz Formula for topology.","<geometry><algebraic-topology><complex-geometry><riemann-surfaces>"
"Continuity question: Show that $f(x)=0, \forall x\in\mathbb{R}$.","<real-analysis><continuity><irrational-numbers><rational-numbers>"
"explicit formula for the series","<real-analysis>"
"The zero component of tensor products of graded mods","<reference-request><graded-modules>"
"Prove: $(a + b)^{n} \geq a^{n} + b^{n}$","<algebra-precalculus>"
"Mixing solutions of specified strength","<algebra-precalculus>"
"Counting subsets with r mod 5 elements","<combinatorics><binomial-coefficients>"
"How to solve a cyclic quintic in radicals?","<abstract-algebra><polynomials>"
"Not quite Fermat's Last Theorem","<number-theory><algebra-precalculus>"
"Relative sizes of sets of integers and rationals revisited - how do I make sense of this?","<elementary-set-theory>"
"Probability that the convex hull of random points contains sphere's center","<geometry><geometric-probability>"
"Why $PSL_3(\mathbb F_2)\cong PSL_2(\mathbb F_7)$?","<group-theory><simple-groups><exceptional-isomorphisms>"
"Computing stalks: do direct limits behave like limits?","<commutative-algebra><sheaf-theory>"
"Why should I care about fields of positive characteristic?","<abstract-algebra><field-theory>"
"Algebra of Random Variables?","<probability-theory><probability>"
"Which continuous functions are polynomials?","<algebraic-geometry><general-topology><differential-topology>"
"Number of finite simple groups of given order is at most $2$ - is a classification-free proof possible?","<group-theory><simple-groups>"
"Prove that this function is bounded","<real-analysis><functional-equations><asymptotics>"
"Solve an equation with linear and exponential functions, $x=10^{x/10}$","<algebra-precalculus><exponential-function>"
"Is there a direct proof of this lcm identity?","<number-theory><binomial-coefficients>"
"Interesting properties of ternary relations?","<logic><relations>"
"Intutive explanation of the PCP Theorem","<proof-theory>"
"Symmetric nash equilibrium","<game-theory><nash-equilibrium>"
"Constructing a counterexample in category theory","<category-theory><universal-algebra>"
"Time complexity to find the extremal value of a function","<computer-science><algorithms>"
"Recreating an Integer Sequence After Convolution","<number-theory><combinatorics>"
"Cardinality of all cardinalities","<set-theory><cardinals>"
"Parameters in the ZFC axioms","<set-theory><axioms>"
"What are the names for the various Sobolev spaces?","<functional-analysis><partial-differential-equations><soft-question><terminology><sobolev-spaces>"
"Laplace expansion of Pfaffian","<linear-algebra><reference-request><pfaffian>"
"Determine the following limits $\lim_{x \to 0}\left(\sin x + \frac{e^x-1}{x}\right)$ and $\lim_{x \to 0}\frac{e^x-1}{\sin x}$","<real-analysis><limits><exponential-function><limits-without-lhopital>"
"Is it true that $A\cap U \subset A$ is an open set in $A$?","<general-topology>"
"Does adding $\kappa$ Cohen reals preserve a Suslin tree?","<set-theory><forcing>"
"Is it true that $1_{B} \ast \frac{1}{|\det S|}(1_{B} \circ S) \leq 1_{2B}$?","<real-analysis><analysis>"
"Approximating $\sqrt{2}$ in rational numbers","<calculus><convergence-divergence><recurrence-relations><irrational-numbers><number-systems>"
"Prove convergence in $\mathbb{R}^3$ is convergence coordinate-wise.","<real-analysis><general-topology>"
"Using Symmetry for finding volume","<volume><multiple-integral>"
"Compute Derivative in Polar Coordinates","<calculus><polar-coordinates>"
"Any ressources of methodologies to study sequences such as $u_{n+1}=f(u_n)$ and $u_{n+1}=u_{n}^2+v_{n}^2$ with exercises?","<sequences-and-series><reference-request>"
"Is the ""$\mapsto$"" notation considered ""proper"" mathematics?","<notation>"
"((n-1)*(n+1))+1 = n^2 (perfect square when n = integer , but works for all numbers). Is there a proof for this?","<proof-verification>"
"Example of orthogonal dependent random variables","<probability><probability-distributions>"
"For a semi-simple ring $R$ and $R$-module $M$ show TFAE: M finitely generated, artinian and noetherian.","<abstract-algebra><ring-theory><modules>"
"winning the match (which is first to win n games), if i know the probability of them winning a game?","<probability>"
"Counting vectors of natual number with restrictions on coordinates","<combinatorics><vectors>"
"Zero divisors of a reduced Noetherian ring","<commutative-algebra><noetherian><cohen-macaulay>"
"Proving a function is well defined","<discrete-mathematics><modular-arithmetic>"
"Could $ \mathcal{R}$-unipotent semigroups be defined as the regular semigroups in which the idempotents form a right normal band?","<abstract-algebra><semigroups>"
"Complex Differentiation - why treat z as a single variable","<complex-analysis>"
"How can one get better at topology?","<general-topology><soft-question>"
"Combinatorics for a 3-d rotating automaton","<combinatorics><matrices><graph-theory><rotations><spherical-trigonometry>"
"Limits and Continuity - One sided limits question","<real-analysis><limits>"
"n >= (k-2)! implies k = O(log n / log log n)?","<logarithms><approximation><computational-complexity>"
"How to compute $\int\limits_{\mathbb{R}^3}\det D^2 u(\mathbf{r}) d\mathbf{r}$?","<calculus><integration><vector-analysis>"
"Reading a Proof About Showing A Set is Closed","<real-analysis><general-topology><proof-explanation>"
"Ordering of English phrases; Richard's paradox","<logic><soft-question><real-numbers><foundations><paradoxes>"
"Finding all Sylow 2-subgroups","<abstract-algebra><group-theory>"
"complex numbers - average of a function","<integration><trigonometry><complex-numbers><complex-integration><average>"
"Boundary value problem PDE","<partial-differential-equations><boundary-value-problem>"
"Proving that a function is multiplicative.","<elementary-number-theory><arithmetic-functions>"
"Are there any integer solutions for $a$, $b$, $c$, $d$ such that $ad^2+{b^2}c=0$","<elementary-number-theory><diophantine-equations>"
"Summation Series of Legendre Symbols","<number-theory><summation>"
"Integral of analytic function","<integration><complex-analysis><complex-numbers>"
"Is ""$\forall X\in\Gamma\forall Y\in \Sigma\exists x(x\in X\wedge x\in Y)$"" a well-formed second-order logic formula?","<first-order-logic><second-order-logic>"
"A question about integration explanation","<number-theory><analytic-number-theory><elliptic-curves>"
"Engel Expansion Algorithm question","<real-analysis><sequences-and-series><convergence-divergence><real-numbers>"
"Connected subsets of Moore plane","<general-topology><connectedness>"
"A weaker condition for $f_{xy} = f_{yx}$","<calculus><multivariable-calculus><derivatives><continuity><partial-derivative>"
"Why do we divide the cross product by sine when obtaining the points for the dual triangle on a sphere?","<geometry><cross-product><spherical-geometry>"
"Distribution of minimum of first passage time and first return time","<probability><random-walk>"
"When is this equality true?","<multivariable-calculus><vector-analysis>"
"Complex numbers algebra problem involving cyclic summation","<algebra-precalculus><complex-numbers><summation>"
"Solution to the equation $\Delta f=\nabla f\cdot \nabla g$, where $g$ is radial.","<partial-differential-equations><vector-fields><elliptic-equations>"
"Prove that $|x|<|y| \iff x^2<y^2$.","<real-analysis><proof-writing><solution-verification>"
"A domino is a $2$ by $1$ rectangle. For what integers $m$ and $n$ can we cover an $m$ by $n$ rectangle with non-overlapping dominoes?","<combinatorics><number-theory>"
"Proof that a spherical triangle is congruent with its dual","<geometry><triangles><spherical-geometry><congruences-geometry>"
"Limit of the sequence of $p$-norms","<sequences-and-series><functions><convergence-divergence><definite-integrals><monotone-functions>"
"System of 2 equations","<algebra-precalculus><systems-of-equations>"
"How to formulate an ODE for discrete iterative algorithm?","<ordinary-differential-equations><analysis><numerical-methods>"
"Show that $\sqrt{-n}$ and $\sqrt{-n} +1$ are not prime in $\mathbb{Z}[\sqrt{-n} ]$","<abstract-algebra><ring-theory><unique-factorization-domains>"
"Prove that for even $n$ and $x<-1$, $\sum_{k=0}^n\frac{x^k}{k!}>0$","<real-analysis><calculus><inequality>"
"Proving convergence of a two related sequences, specifically that one converges to a value half of the other","<real-analysis><sequences-and-series><limits>"
"If A is a square matrix, and A² = A, prove that the column space C(A) = { x ∊ Rⁿ | x = Ax }","<linear-algebra><matrices><proof-explanation><solution-verification>"
"Is it true that a number of the form $2p$, where $p$ is prime, cannot be written as $a^2-b^2$ for some $a,b\in\mathbb Z^+$?","<linear-algebra><elementary-number-theory><prime-numbers>"
"Mean Value Theorem for measurable functions","<calculus><integration><functional-analysis><measure-theory><measurable-functions>"
"Order of a linear multistep method","<numerical-methods>"
"A generator (or a cogenrerator) for the category of schemes","<algebraic-geometry><category-theory>"
"How to say $(a,b]$ and $[a,b)$ in English?","<terminology>"
"No. Of Laddoos in unit triangle","<geometry>"
"How to show that $\pi^*(g)=\chi(\det g)^{-1}$?","<group-theory><representation-theory><algebraic-groups>"
"Recursion Master Theorem","<recursion>"
"How to determine the probability of an event, given that three events do not occur simultaneously..","<probability>"
"Compute the conjunction probability of $contains$ operators in string","<probability><probability-theory><conditional-probability>"
"simpler way to calculate a determinant?","<linear-algebra><matrices><determinant>"
"Valuation of a rational function under pullback","<algebraic-geometry>"
"Sum involving the Digamma function.","<sequences-and-series><gamma-function>"
"Looking for articles on postcritically finite rational maps in Russian or French","<general-topology><reference-request><dynamical-systems><arithmetic-dynamics><mathematical-russian>"
"Minimum value of this expression","<multivariable-calculus><optimization>"
"About the quotient group of degree zero divisors on $C$ by the principal divisors on $C$","<group-theory><elliptic-curves>"
"Free abelian subgroup of index 2.","<group-theory><abelian-groups><free-groups>"
"Tichonoff theorem, closed subset of $\prod_{t \in T} X_t$","<general-topology><compactness>"
"How to show that two representations are equivalent?","<group-theory><representation-theory><algebraic-groups>"
"Proof for Gaussian integrals of form $\int_{-\infty}^{\infty} {\alpha\over\sqrt{\pi}} e^{-\alpha^2 x^2} f(x) dx$?","<statistics><integration><fourier-analysis>"
"A basic problem on topology","<real-analysis><general-topology><metric-spaces>"
"Ray class field - Ring class field","<algebraic-number-theory>"
"How find the value $\lim_{x\to 0}\dfrac{1}{x^2}\left(1-\cos{x}\cdot\sqrt{\cos{(2x)}}\cdots\sqrt[n]{\cos{(nx)}}\right)$","<calculus><limits>"
"How to show that the set of proper subspaces of a finite dimentinoal vector space $V$ is closed under unions of chains?","<linear-algebra>"
"Prove that some set is compact directly from definition","<real-analysis><metric-spaces>"
