title,tags
"Exclusion Inclusion Principle Induction Proof","<combinatorics><induction><inclusion-exclusion>"
"Geometric intuition for the tensor product of vector spaces","<linear-algebra><geometry><intuition><tensor-products><vector-bundles>"
"Simple equation.","<arithmetic>"
"Integration $\int\frac{dx}{x\ln(x)^3}$","<calculus><integration>"
"Teams in tournament problem","<combinatorics>"
"Weakest conditions on a function so that integral is bounded","<functional-analysis><lp-spaces>"
"Analytically solving simple quadratic problem in single variable with boundary constraints","<convex-analysis><convex-optimization>"
"Continuity of $f(z)=\overline{z}/z$","<complex-analysis>"
"Show that an isometric linear operator $T:H\to H$ satisfies $T^* T=I$, where $I$ is the identity operator on $H$.","<real-analysis><functional-analysis><operator-theory><hilbert-spaces>"
"Guessing strategy for a matching question","<probability>"
"Elementary proof of an inequality with $e^x$ when $|x|<1$.","<calculus><algebra-precalculus><convex-analysis>"
"Well-defined functions using mod $p$ equivalence classes","<functions><equivalence-relations>"
"Is the following limit correct? $[\lim_{n\to\infty}\binom{n}{50}(\frac2n)^{50}(1-\frac2n)^{n-50}]$","<limits><binomial-coefficients><poisson-distribution>"
"Multivariable integrating factor for a non-linear ODE","<ordinary-differential-equations>"
"Non-differentiable variational calculus (Dido's problem)","<calculus-of-variations><lagrange-multiplier><euler-lagrange-equation>"
"How to represent the solution of $z^{2}+2z+5=0$ in in Euler form?","<complex-numbers>"
"Can we express the following ordinary generating function?","<combinatorics><polynomials>"
"How to solve the functional equation $f(2x) = (e^x+1)f(x)$?","<calculus><functional-equations>"
"Is there free software that can be used to generate a chain rule tree graph?","<calculus><multivariable-calculus><math-software>"
"Removable singularities for Dirichlet problems of Laplace equaions?","<analysis><partial-differential-equations>"
"How does field influence the dimension of vector space?","<vector-spaces>"
"$S = \{(x,y,z) | x^5 + y^4 + z^5 + e^z = 3\}$, why can we write $S$ as a graph $z = f(x,y)$ near (1,1,0) for smooth $f(x,y)$??","<differential-geometry>"
"What is the definition of a cusp?","<derivatives><graphing-functions>"
"Show that if f'' is positive on an interval [a,b], then f' has at most one zero in [a,b]","<calculus>"
"Bases of complex vector spaces and the axiom of choice","<logic><vector-spaces><axiom-of-choice>"
"Is this method of finding range of x for which given series is convergent, wrong?","<sequences-and-series><power-series>"
"matrix convex optimization","<norm><convex-optimization><matrix-calculus><matrix-decomposition><semidefinite-programming>"
"Does all Eigenvectors of $A$ lie on the vector space of $Ax$?","<linear-algebra><vector-spaces><eigenvalues-eigenvectors>"
"Summing a series to $n^{2}$","<summation>"
"What is the relation between $a$ and $b$?","<elementary-number-theory>"
"Is there a continuous function f(x) that tends to zero for both positive and negative infinity and f(0) = c","<real-analysis><functions><graphing-functions>"
"Prove Fisher's Inequality for a non-trivial 2 - (v, 4, λ) design","<combinatorial-designs>"
"Fubini theorem to calculate iterated integral, counting and Lebesgue measure","<real-analysis><measure-theory><lebesgue-measure>"
"Cyclic $G/Z(G)$ implies that $G$ is abelian","<abstract-algebra><group-theory>"
"Second derivative test failed","<calculus><multivariable-calculus>"
"How to calculate the number of solutions for the vehicle routing problem (VRP)?","<combinatorics>"
"Rate of Convergence in CLT for IID random vectors with dependent entries","<probability-theory><probability-distributions>"
"On definition of alternating multilinear form","<differential-geometry>"
"Convert a tree to a forest where every component has an even number of vertices.","<graph-theory><trees>"
"Elliptic Curves","<elliptic-curves>"
"Lie algebras of vector fields over $\mathbb{R}$ and over $S^1$","<differential-topology><lie-algebras><vector-fields>"
"Expectation of a series of random variables with a random variable as upper limit","<probability><conditional-probability><expectation>"
"Convergence Rate of Sample Average Estimator","<probability><statistics><probability-theory><estimation-theory>"
"Let $K = \mathbb C(X)$, $\sigma: X \mapsto \xi X$ and $\tau: X \mapsto X^{-1}$. Find number of elements in $G$ generated by $\sigma$ and $\tau$.","<abstract-algebra>"
"If $a$ divides $b$, then $a$ divides $3b^3-b^2+5b$.","<elementary-number-theory>"
"Given $a, b, c>0$, prove $\frac{a^4}{a+b}+\frac{b^4}{b+c}+\frac{c^4}{c+a}\geq \frac{1}{2}(a^{2}c+b^{2}a+c^{2}b)$","<inequality><summation><a.m.-g.m.-inequality><sum-of-squares-method><tangent-line-method>"
"Does $\sum_{k=0}^{\infty}\frac{1}{(k+1)!}\left(\prod_{l=0}^{k}\left(1-ls\right)\right) x^{k+1}$ converge?","<sequences-and-series><power-series><divergent-series>"
"X and Y are independent Poisson random variables, each with rate lambda.","<random-variables><poisson-distribution>"
"How to find values from two equations with 3 variables?","<linear-algebra>"
"Using the tree method to write the sum formula of a recurrence relation","<recurrence-relations>"
"If $A$ is a real-valued matrix with $A^T A = AA^T$ then are the eigenvalues of $A$ necessarily real?","<linear-algebra><matrices><eigenvalues-eigenvectors>"
"Solving the integral without using Laplace","<definite-integrals>"
"Directional derivative, linear transformation, and chain rule?","<analysis><derivatives><probability-distributions><linear-transformations><chain-rule>"
"Recurrence relation solving","<combinatorics><analysis><recurrence-relations>"
"Index of two primitive roots modulo $m$","<number-theory><elementary-number-theory><integers><primitive-roots>"
"Mapping between doubly connected regions","<complex-analysis><conformal-geometry>"
"Prove that an invertible covariance matrix is positive definite","<linear-algebra><matrices><covariance><positive-definite>"
"If $f'(x)= \frac{f(x)}{x}-e^{\frac{f(x)}{x}}$, prove that $f(x)=-x\ln(\ln(x))$","<real-analysis><integration>"
"Can Three consecutive numbers can be pairwise prime considering middle element is even.","<prime-numbers>"
"Bounds for the box dimension of the Koch curve with different definitions","<real-analysis><geometry><solution-verification><fractals>"
"Compute the limit of $ \lim _{n \rightarrow \infty}\left(\frac{\sum_{k=1}^{n} \sin \left(\frac{\pi k}{n}\right)}{n}\right)$","<limits>"
"The Arroyo Game versus The Pasadena Game","<probability><statistics><expected-value><decision-theory><utility>"
"winding number under holomorphic map of an annulus","<complex-analysis><winding-number>"
"Chain rules and calculus","<calculus><chain-rule>"
"limit of $(1-k/n)^{k}$ where $k$ depends on $n$","<calculus><sequences-and-series><limits>"
"Double integral of absolute value of $\frac{\sin(x)}{x}$","<integration><multivariable-calculus><definite-integrals><improper-integrals><multiple-integral>"
"How many $7$ digit numbers in the form $a_7a_6...a_1$ such $\forall i \in (1,6)$ $a_{i+1}\geq a_i$","<combinatorics>"
"Proof of Fatou's Lemma.","<proof-writing><solution-verification>"
"If the equation $(x^2-4)^3(x^3+1)^n(x^2-5x+6)^m=0$ has 18 roots, find m+n.","<systems-of-equations><roots>"
"Selection Problem","<combinations>"
"Can we simplify the expression while finding domain?","<algebra-precalculus><functions>"
"Linear First-Order ODE - Why Must Integrating Factor Always be f(x)?","<ordinary-differential-equations>"
"The probability of taking one specific value is zero in normal distribution, but then the probability in a range of values is not zero?","<probability><normal-distribution>"
"What does the expression $ww^*$ for any vector $w$ mean?","<matrices>"
"Fibonacci nim winning strategies in different situations","<combinatorics><game-theory><combinatorial-game-theory>"
"How to find the minimal basis of an invariant ring?","<representation-theory><galois-theory><invariant-theory>"
"Finding a specific function based on given information","<real-analysis><calculus>"
"How can we prove this for n=5, 13 and any values?","<discrete-mathematics><proof-writing><problem-solving><word-problem>"
"Is there a nice analytic criterion when does three normals of three points on the same conic section meet at the same point?","<analytic-geometry><conic-sections>"
"$\frac{e^{-\lambda} \lambda^x}{x!}$ is Log-concave in $\lambda$?","<convex-analysis>"
"Show that this set is a linear subspace of $\mathbb{R}^{2}$ (or not)","<linear-algebra><abstract-algebra>"
"Proof involving the linear span of two subspaces","<linear-algebra><proof-writing>"
"Implication/function in set notation","<elementary-set-theory><logic>"
"Sufficient condition for absolute continuity","<real-analysis>"
"Finding the constant $a$ such that $af^n$ is a pdf given that $f$ is a normal pdf","<probability-distributions><normal-distribution>"
"Question from Stein's Fourier Analysis on sequence of integrable functions","<real-analysis><functional-analysis><convergence-divergence><fourier-analysis>"
"Angle between vectors given cross and dot product","<vectors><cross-product>"
"Ordinary Differential Equation (1°ord.), positive or negative constant when solving Cauchy problem?","<analysis><ordinary-differential-equations><indefinite-integrals><cauchy-problem>"
"Prove that the matrix $ \left[ \begin{array}{ c c } a & b \\ c & d \end{array} \right] $ is inherently stable if $a+d<0$ and $ad-bc>0$","<matrices>"
"Having trouble solving simple ode - need help.","<ordinary-differential-equations>"
"Is there a simpler way of finding the circumference of an ellipse?","<calculus><geometry><conic-sections>"
"Neusis construction of the 11-gon?","<proof-verification><galois-theory><geometric-construction>"
"Solving for x (multiple x's in the equation)","<exponentiation>"
"Is this a Powerset? What does is actually look like?","<elementary-set-theory><notation>"
"Why is absolute difference of max of functions less than max of absolute difference of functions","<inequality>"
"If $f$ is differentiable at $c$, then $F'$ is continuous at $c$ where $ F(x)=\int_a^x f(t)\ dt$?","<real-analysis>"
"Two simple questions about conditional probability","<probability>"
"Least square, Signifiance of plane we are projecting on","<linear-algebra><matrices><least-squares><projection-matrices>"
"Number of intersections of $n-2$ dimensional spheres inside $S^{n-1}$","<combinatorics><spheres>"
"Construct line segment with enpoints on given circles and equal to given line segment","<geometry><geometric-construction>"
"Majorizing Sharp Truncation of Integral by a Smooth Truncation","<real-analysis><fourier-analysis><harmonic-analysis>"
"How to set the limits for Jacobian Integration","<integration><polar-coordinates><jacobian>"
"Pullbacks classified by morphisms of fundamental groups?","<algebraic-topology><lie-groups>"
"Finding an Orthogonal Vector to v=4i—j+k","<vectors><orthogonality>"
"Calculating probability of Type II Error for a one-sample t test","<statistics><hypothesis-testing>"
"Solve PDE subject to a condition","<ordinary-differential-equations><partial-differential-equations><initial-value-problems>"
"Necessary and sufficient condition for a set in $\mathbb{R}$ to be C-embedded or $C^*$-embedded","<general-topology><alternative-proof>"
"Linearly independent vectors?","<linear-algebra>"
"Stating that either root is zero in solving a quadratic equation","<algebra-precalculus><polynomials><roots><quadratics>"
"What is the rigorous meaning of the integral $\int_\gamma dz$ with $\gamma \in H_1(\mathbb{C}/\Lambda, \mathbb{Z})$?","<differential-geometry><elliptic-curves>"
"Help with the convergence of this sequence","<sequences-and-series>"
"Proving set cardinality","<elementary-set-theory><cardinals>"
"Getting information from a differential equation","<ordinary-differential-equations>"
"Show that $[0,1]$ is a completion of $(0,1)\cap\mathbb Q$","<metric-spaces><complete-spaces>"
"is the product of a nonnegative monotone increasing and a nonnegative monotone decreasing sequence unimodal?","<sequences-and-series><monotone-functions>"
"What is the boxicity of $Z_n$ , the circuit of length n?","<graph-theory>"
"solving/approximating integral of lognormal cdf","<probability><statistics><definite-integrals><normal-distribution>"
"Equating sides and solving sides for Similar Triangles","<geometry>"
"Mondrian Art Problem Upper Bound for defect","<combinatorics><graph-theory><recreational-mathematics><packing-problem><oeis>"
"Fundamental theorem of Finitely generated abelian groups","<abstract-algebra><group-theory><finite-groups>"
"Center of mass of an $n$-hemisphere","<geometry><physics>"
"How do you define functions for non-mathematicians?","<algebra-precalculus><education><definition><functions>"
"A particular case of L'Hospital","<calculus><analysis>"
"Sets. Classes. ...?","<set-theory>"
"Diophantine equations whose coefficients are increasing sequences of integers","<number-theory><diophantine-equations>"
"How to determine if coin comes up heads more often than tails?","<probability>"
"(undergraduate) Algebraic Geometry Textbook Recommendations","<algebraic-geometry><reference-request><book-recommendation>"
"What is the probability that exactly $i$ heads will result from $n$ coin tosses?","<probability><statistics>"
"Dividing a disk into $7$ equal pieces with $3$ line segments","<euclidean-geometry>"
"If $\sum_{n=1}^{\infty} a_{n}^{3}$ converges does $\sum_{n=1}^{\infty} \frac{a_{n}}{n}$ converge?","<real-analysis>"
"What is a symmetric group?","<group-theory>"
"More convergent series","<sequences-and-series><analysis>"
"Undergraduate/High-School-Olympiad Level Introductory Number Theory Books For Self-Learning","<number-theory><reference-request><contest-math><book-recommendation>"
"A probability game","<probability>"
"Can this gravitational field differential equation be solved, or does it not show what I intended?","<physics><ordinary-differential-equations>"
"Cauchy condensation test - Exponential function explanation","<calculus><analysis><convergence-divergence>"
"Syntax for the convergence of random variables","<probability-theory><notation>"
"How to solve the equation $x^y=y^x=k$?","<calculus><real-analysis>"
"Is the function $(x, a) \mapsto (F(x,a), a)$ continuous whenever $F$ is?","<general-topology>"
"Fields that require both CS and pure math","<soft-question><big-list>"
"System of numbers $\{\pm i^2: i\in \mathbb{N}\}$ generates $\mathbb{N}$","<proof-verification><induction>"
"Dense subset of space of measures respecting a stronger norm","<real-analysis><functional-analysis><measure-theory><harmonic-analysis>"
"is my proof wrong?","<proof-verification>"
"Value of a power series","<analysis>"
"What does $S^1$ do in many branches of math?","<circles><big-list><group-isomorphism><spheres>"
"Compute $\int_0^2 x^3 d[x]$ using Riemann–Stieltjes","<real-analysis>"
"Combinatorics: inviting friends to dinner with and without restrictions","<combinatorics>"
"How to specify mathematical formula for ""falling"" in a center","<graphing-functions><polar-coordinates>"
"Solve the eigenvalue problem $y''=\lambda y$ numerically","<ordinary-differential-equations><numerical-methods><computational-mathematics>"
"The number of 3-colourings of rectangular grid","<combinatorics>"
"A question about local extreme value","<calculus>"
"What properties can be said for a subset of the reals which has a Lebesgue measure strictly greater than zero?","<lebesgue-measure>"
"Equality of conditional expectations of random variables","<probability-theory><measure-theory><conditional-expectation>"
"Let $\lim_{T \to \infty} \int_{0}^{T}e^{-t^2}dt=\sqrt{\pi}/2$, then $\lim_{T \to \infty} \int_{0}^{T}t^2e^{-t^2}dt$","<real-analysis><integration><improper-integrals>"
"A confusion about the uniqueness of the total derivative of a map $f: \mathbb{R}^p \to \mathbb{R}^q$","<real-analysis><functional-analysis><derivatives><partial-derivative>"
"Calculate the number of elements of order 2 and order 4 in each of $\mathbb{Z}_{16}, \mathbb{Z}_{8}\bigoplus\mathbb{Z}_{2}$ etc.","<abstract-algebra><group-theory><finite-groups><abelian-groups>"
"Chain complexes as functors and chain morphisms as natural transformations","<category-theory>"
"Prove it if it is true or give counterexample if it is false","<elementary-number-theory><congruences>"
"Distance between two vertices in graph theory","<graph-theory>"
"Prove if $b\neq x^2a$ then $\sqrt{b}\notin F(\sqrt{a})$","<abstract-algebra>"
"Isomorphic ultraproducts of models implies isomorphic models?","<model-theory>"
"Idempotent elements in $\mathbb{Z}_n$","<modular-arithmetic><integers><idempotents>"
"MVT - Showing $\sin x < x$ for all $x>0$","<calculus><inequality>"
"Proving a given inequality $\frac{2}{9}<x^4+y^4<8$","<algebra-precalculus><inequality><quadratics>"
"What is the derivative of the Jacobi_Amplitude_Function (u, m) where u and m are non-constant functions of the independent variable x?","<ordinary-differential-equations><derivatives>"
"Generating fuctions: $\sum_{k=0}^\infty \binom{2k}{k}\binom{n}{k}\left(-\frac{1}{4}\right)^k=2^{-2n}\binom{2n}{n}$","<combinatorics><generating-functions>"
"Show that $\arg\min\limits_{||s||\leq t}\langle p,s\rangle = -t\arg\max\limits_{||s||\leq 1}\langle p,s\rangle$","<real-analysis><complex-analysis><functional-analysis><optimization>"
"I am having difficulty with the algebra related to a coordinate geometry question.","<geometry><euclidean-geometry><analytic-geometry><geometric-transformation><homothety>"
"Is it true that the intersection of the closure of span is a subset of the closure of span of intersection","<linear-algebra><general-topology><functional-analysis><banach-spaces>"
"Let $P(x)\in \mathbb Z[x]$ be an irreducible polynomial. Prove or disprove that $P\circ P$ is irreducible over $\mathbb Z$","<functions><polynomials><irreducible-polynomials>"
"Joint Probability Density$ P(X>2Y)$","<statistics>"
"Random Jumps on board","<probability><random><random-walk>"
"h-vector of an unmixed ideal","<commutative-algebra><ideals><cohen-macaulay>"
"Two questions on Let $A ∈ R^{n×n}, B ∈ R^{n×m}, C ∈ R^{m×n}, and D ∈ R^{m×m}$. ...","<linear-algebra><matrices>"
"Propositional logic and tautologies","<logic><propositional-calculus>"
"Triangular inequality for expected value","<probability><expectation>"
"find the quotient space $\mathbb{M}(n;\mathbb{R})/\mathbb{T}(n;\mathbb{R})$, upto isomoprhism","<linear-algebra><abstract-algebra><matrices><proof-verification><quotient-spaces>"
"Let p be prime and Fpm denote the field with pm elements. Let k,n be in N.","<number-theory><elementary-number-theory><polynomials><finite-fields>"
"Probability Theory Question (Bayes Theorem)","<probability><statistics>"
"Finding $n$-dimensional vector direction","<geometry><vectors>"
"Why are SDP solvers inherently inaccurate?","<optimization><convex-optimization><numerical-optimization><semidefinite-programming><machine-precision>"
"Unable to understand motivation behind alternate definition of differentiability","<calculus>"
"Is it true that f(x) decreases faster than g(x).","<exponential-function>"
"Show $\sum_{k=1}^n\frac{\ln k}{k}-\frac{(\ln n)^2}{2}$ is convergent","<calculus><sequences-and-series><convergence-divergence>"
"Existence or regularization of the limit: $\lim_{\beta\to\infty} \frac{\beta^2}{\sin(\beta^2)}$","<calculus><limits><proof-verification><regularization>"
"On a notion of ""period"" of Dirichlet character, modulo $k$, restricted to integers co-prime to $k$","<number-theory><characters><arithmetic-functions>"
"A question from functions chapter","<real-analysis><functions>"
"homogeneous matrix properties","<matrices>"
"$f : X\to Y$ is continuous if and only if $f$ is continuous at $x$ for all $x\in X$","<general-topology><continuity>"
"Understanding this integral from a measure theory perspective.","<integration><measure-theory><lp-spaces>"
"If $N$ is a subcomodule of $M$, then the H-submodule generated by $N$ is a H-Hopf-module of $M$.","<abstract-algebra><hopf-algebras>"
"Mapping $w=\frac{z}{1+z}$","<complex-analysis><complex-numbers>"
"The difference between the premium paid and the expected claim","<probability><proof-verification>"
"Graph theory -decomposition into connected components","<graph-theory>"
"Generalised formula for fitting a cubic between two points with specified slopes at each point","<linear-algebra><polynomials><cubic-equations>"
"Convergence of $z^{1/n}$, where $z$ is a complex number","<complex-analysis>"
"Sum of traces over Weyl group","<linear-algebra><abstract-algebra><lie-groups><trace><root-systems>"
"Compute the angles between the elements of the standard basis with respect to this scalar product","<linear-algebra><vector-spaces><orthogonality><orthonormal>"
"Einstein-Cartan Theory vs Metric Affine Gravitation Theory","<general-relativity>"
"Quantified statement","<logic>"
"What is the probability that if a randomly chosen product is defective, then it came from machine X?","<probability>"
"Is every integer a mixed sum of three squares?","<number-theory><diophantine-equations>"
"A recursively defined sequence and a limit","<sequences-and-series><limits><recurrence-relations>"
"Absolute convergence implies convergence .","<sequences-and-series><convergence-divergence><absolute-convergence>"
"Show that the set of invertible $n\times n$ matrices with entries in $\mathbb{R}$ is not connected?","<general-topology><matrices><connectedness>"
"What is a Covering Space (intuitively) and is it related to the concept of open cover?","<general-topology><algebraic-topology>"
"$h$-principle for Legendrian immersions","<ordinary-differential-equations><differential-geometry><contact-topology><h-principle>"
"Signature of the inner product.","<linear-algebra><inner-products><multilinear-algebra><exterior-algebra>"
"How to show that the quadratic equation has solutions with real part negative?","<algebra-precalculus><polynomials>"
"Finding the units in $M_n(R)$","<abstract-algebra><matrices><ring-theory>"
"Show that if G(U, W) is a bipartite graph such that min u∈U degree(u) ≥ max w∈W degree(w), then G has a matching of size |U|.","<graph-theory><bipartite-graphs>"
"Does double negation distribute over disjunction intuitionistically?","<logic><propositional-calculus><natural-deduction><intuitionistic-logic>"
"Topology and Homeomorphisms","<general-topology>"
"A limit set defined in terms of the dyadic expansion","<probability-theory><measure-theory><lebesgue-measure>"
"Deriving Iteration Formula for $y''(x)=(3x^2+x^6)y(x)$","<ordinary-differential-equations>"
"If $\sigma(N) = aN + b$, where $\gcd(a, b) = 1$, does it follow that at least one of $N$'s factors is solitary?","<number-theory><elementary-number-theory><divisor-sum>"
"Automorphisms of the exceptional Jordan algebra preserve the determinant and trace.","<linear-algebra><abstract-algebra><determinant><trace><algebras>"
"Extend of cutoff function","<differential-geometry><riemannian-geometry><ricci-flow>"
"Holomorphic in a unit disk based on Identity Theorem","<complex-analysis>"
"finding limit to the following series with n addends: $\lim_{n\to \infty}\{\frac{1}{\sqrt{n+1}}+\frac{1}{\sqrt{n+2}}+\cdots+\frac{1}{\sqrt{n+n}}\}$","<sequences-and-series><limits><summation>"
"How to find a function from an array","<functions>"
"simple question about the degree of a divisor on riemann surface","<algebraic-geometry><riemann-surfaces>"
"Is $1010908899$ divisible by $7$ , $11$ and $13$?","<elementary-number-theory>"
"What is the probability of having a common element in two subsets?","<probability>"
"Unbounded function of bounded variation (in $\mathbb R^d$, $d>1$)","<real-analysis><bounded-variation>"
"Convergence of infinite series.","<convergence-divergence>"
"Is a set contained in its Cartesian product with itself?","<elementary-set-theory>"
"Solution of $y'' + 2y' + 2y = f(t)$ with $y(0) = 0$ and $y'(0) = 0$","<ordinary-differential-equations>"
"Is the category of all finite dimensional modules of $g$ equivalent to the category of all finite dimensional modules of $U_q(g)$?","<representation-theory><lie-algebras><quantum-groups>"
"On ideal quotient of intersection of fractional ideals","<ring-theory><commutative-algebra><modules><ideals><integral-domain>"
"Show that $\cos$ has at least one zeropoint","<real-analysis><trigonometry><proof-explanation>"
"Inequality relating the probabilities of a quantum state to the euclidean distance of states.","<linear-algebra><inequality><quantum-mechanics><quantum-computation>"
"(Soft question) Should you struggle with every question in the textbook or look at the solution manual for some?","<calculus><soft-question><self-learning><learning>"
"Continuity of the modified Dirichlet function","<real-analysis><continuity>"
"Find the following limit: $\lim\limits_{n \to \infty}(e-1)\sum_{k=1}^n \frac{1}{n+k(e-1)} $","<limits><summation>"
"Limiting Distribution on order statistics","<statistics><probability-limit-theorems><order-statistics><delta-method>"
"Coproduct of abelian categories","<category-theory><tensor-products><abelian-categories>"
"how to calculate the Casimir function of the Heisenberg Lie algebra?","<lie-algebras>"
"How to prove that a banded matrix is irreducible?","<linear-algebra><matrices>"
"How do I prove that two equations in Cartesian and Polar coordinates are equivalent?","<polar-coordinates>"
"point cloud in complex plane","<complex-numbers>"
"What's wrong with my simulation of the Central Limit Theorem?","<probability><central-limit-theorem>"
"How to prove binomial coefficient $ {2^n \choose k} $ is even number?","<combinatorics><binomial-coefficients>"
"How do we calculate the expected value of $X^{-1}$, where $X$ has geometric distribution?","<probability><proof-verification><probability-distributions><expected-value>"
