title,tags
"To what extent were the actors in Wedding Crashers improvising?","<wedding-crashers>"
"Evaluating characters by means of description","<analysis><star-wars>"
"Was the original ""Pink Panther"" movie intended to be a comedy?","<comedy><the-pink-panther>"
"What does the ending of The Tree of Life mean?","<plot-explanation><analysis><ending><the-tree-of-life>"
"Did the FBI know about the mole in the police department and did they interfere with the investigation?","<plot-explanation><the-departed>"
"Why the stoic acting style in 2001 Space Odyssey?","<analysis><stanley-kubrick><2001-a-space-odyssey>"
"Why was Prowse chosen to play Darth Vader?","<star-wars><casting>"
"Is there any definitive evidence that Teddy was or was not crazy?","<analysis><shutter-island>"
"How does the son (R.L.) die?","<plot-explanation><the-tree-of-life>"
"Why does the dinosaur let the wounded dinosaur live?","<plot-explanation><analysis><the-tree-of-life>"
"What was the alternative world in Sucker Punch?","<analysis><sucker-punch>"
"Did Existenz influence Inception?","<inception><existenz>"
"What weighs toward the decision to ignore the gravity change?","<effects><melancholia>"
"Are there any ""Hollywood-style"" movies made in Iran?","<iranian-cinema>"
"Why is the ending to the film adaptation of ""Hannibal"" completely different from the novel?","<ending><book-adaptation><hannibal>"
"Did Hayao Miyazaki make any movie without an environmental theme?","<hayao-miyazaki>"
"Did Kurosawa make so many Shakespeare-adaptations to avoid censorship?","<book-adaptation><akira-kurosawa>"
"Where did the speaking-disease come from?","<plot-explanation><pontypool>"
"Are there specific plot inconsistencies in The Matrix Trilogy?","<the-matrix><sequels><plot-explanation>"
"Why did Hel get cut from the American version of Metropolis?","<alternate-version><metropolis>"
"Why did they change the location of Akira in the remake?","<remake><akira>"
"What is the main theme of The Dark Knight?","<analysis><the-dark-knight>"
"Outcome of relationship at the end of 'Blue Valentine'","<plot-explanation><ending><blue-valentine>"
"What changes were made to the Star Wars Blu-ray and what effect did they have on the plot?","<star-wars><plot-explanation>"
"Captain Miller's thought process in Private Ryan ""School Teacher"" scene?","<plot-explanation><saving-private-ryan>"
"Is there any evidence of ""Big Twist"" movies having poor post-cinema sales?","<film-industry>"
"What has the greatest chance of being in Marcellus Wallace's briefcase?","<pulp-fiction>"
"Why don't Marty's parents ever mention how similar he looks to the Marty of 1955?","<analysis><back-to-the-future><time-travel>"
"Why is the bride's name beeped in Kill Bill Vol 1?","<analysis><quentin-tarantino><film-techniques><kill-bill>"
"Is Chandhramukhi / Manichitrathazhu / Bhool Bhulaiyaa a partial copy of Vertigo?","<reference><vertigo><manichitrathazhu><chandramukhi><bhool-bhulaiyaa>"
"How much of Melissa McCarthy's role in ""Bridesmaids"" was improvised?","<production><bridesmaids>"
"Have rights disputes kept Skeeter out of the Muppet movies, including ""The Muppets""?","<muppets>"
"What Muppets were not played by their original puppeteers?","<muppets>"
"What's the purpose of Aurra Sing appearing in Star Wars Episode One?","<character><star-wars><the-phantom-menace>"
"Why wasn't the poltergeist Peeves in the Harry Potter movies?","<character><harry-potter><book-adaptation>"
"Was the interview with the Norwegian prime minister real?","<trolljegeren>"
"What is a ""performance capture"" animation movie?","<film-techniques><animation><adventures-of-tintin>"
"Did the original Fantomas movies also include a lot of gadgets like the movies from the 60s?","<remake><fantomas>"
"Ending of Donnie Darko","<plot-explanation><ending><donnie-darko>"
"Why are there a lot of Hollywood-remakes of successful non-US-movies?","<remake><american-cinema>"
"What's the name of the sheep who's eating stuff backstage?","<muppets>"
"Movie about a toy factory and war toys?","<identify-this-movie>"
"Why does Harry only make use of time travel in The Prisoner of Azkaban?","<plot-explanation><harry-potter><time-travel><the-prisoner-of-azkaban>"
"Why isn't Bruce Willis's character in the Sixth Sense self-aware?","<plot-explanation><character><the-sixth-sense>"
"How do the differences between the replicants and Deckard evolve in Blade Runner?","<analysis><character><blade-runner>"
"What were the origins of Persephone in The Matrix: Reloaded?","<the-matrix><the-matrix-reloaded>"
"How credible is the ending of Collateral?","<plot-explanation><realism><collateral>"
"Which class is Mark sitting in when he falls asleep?","<the-social-network>"
"Why is James Bond less tech savvy in the Daniel Craig movies?","<james-bond>"
"Why did Ennio Morricone write the soundtrack of ""The Thing"" (1982) instead of John Carpenter?","<soundtrack><the-thing>"
"Why did Jodie Foster decide not to reprise the role of Clarice in Hannibal?","<hannibal><the-silence-of-the-lambs>"
"Which circles of Hell are shown in What Dreams May Come?","<analysis><what-dreams-may-come>"
"What is Harvey's purpose?","<analysis><harvey>"
"Is the opening break-up scene in The Social Network intended to be humorous?","<analysis><the-social-network>"
"What fills the void left by the lack of character development in Inception?","<analysis><inception>"
"Did Wolfe kill Triphammer?","<plot-explanation><powers>"
"Where and why is the Royal Coat of Arms in the title sequence of 30Rock","<title-sequence><30-rock>"
"Who is the narrator in the movie Book Thief?","<plot-explanation><the-book-thief>"
"Handcuffs found by Yuri","<plot-explanation><fortitude>"
"What gave Caincross away in the Imitation Game?","<plot-explanation><the-imitation-game>"
"X Files known by other name?","<the-x-files>"
"Did Mel Gibson give any of his profits back to charity?","<the-passion-of-the-christ><mel-gibson>"
"In Kingsman: The Secret Service, what do the wine choices imply?","<kingsman-the-secret-service>"
"Wouldn’t Underwood’s plan for Sharp in season 3 of House of Cards be obvious?","<plot-explanation><realism><house-of-cards>"
"How does Cole get from the First World War to 1996?","<plot-explanation><12-monkeys>"
"Why does Alfred suddenly start to encourage Bruce's darker side in episode S01E08?","<plot-explanation><character><gotham>"
"Why is Phantasm II available on Bluray while the other movies in this series are not?","<distribution>"
"What if the coordinates of NASA were not sent?","<plot-explanation><interstellar><time-travel>"
"Dragon Blade - true story?","<historical-accuracy><dragon-blade>"
"What does Carl mean when he says, ""that son of a gun""?","<dialogue><plot-explanation><hachi-a-dogs-tale>"
"What does you're on my hair signifies in Wedding Crashers?","<dialogue><wedding-crashers>"
"Are weapon manufacturers investing in product placement?","<product-placement>"
"Whose signature is shown in the Spectre teaser?","<james-bond><spectre>"
"How does Batman complete the Joker?","<plot-explanation><the-dark-knight>"
"Why is the ending of Big Hero 6 such as it is?","<ending><big-hero-6>"
"Why doesn't Walt tell Walt Jr the truth about Hank?","<breaking-bad>"
"What is the symbolism of the blue meth?","<analysis><breaking-bad>"
"Did Arnold smoke Cannabis at the end of Pumping Iron?","<pumping-iron>"
"Why did the white people on Candieland respect or even take commands from Stephen?","<plot-explanation><django-unchained>"
"Interstellar movie black hole concept?","<interstellar>"
"Is there any history between Irene Adler and Sherlock holmes in Sherlock Holmes (2009) movie","<sherlock-holmes-2009>"
"What did Jon Arryn mean?","<plot-explanation><dialogue><game-of-thrones>"
"How does the button mechanism work?","<plot-explanation><the-box>"
"Why did NASA not investigate Cooper's house?","<plot-explanation><interstellar>"
"The Bodyguard hotel kitchen scene","<plot-explanation><the-bodyguard>"
"Who did Rick Grimes shoot at the end of the Season 5 finale?","<the-walking-dead>"
"Is this a mistake in The Imitation Game?","<the-imitation-game>"
"What would happen if Cage tried to confront the first (or second) Alpha again?","<plot-explanation><edge-of-tomorrow>"
"Why does the doctor help Ray Breslin at last?","<plot-explanation><escape-plan>"
"What makes Hulk differentiate the enemy from the allies during the last fight in ""The Avengers""?","<plot-explanation><character><marvel-cinematic-universe><the-avengers>"
"Why did Cooper chase the drone across the field when food is so scarce?","<plot-explanation><interstellar>"
"How might a ""random"" event be effected in a movie?","<film-techniques>"
"Why was the actor who played Kreese in Community credited as 'Someone Else'?","<credits><community>"
"Why are some movie parts much louder than others?","<sound-effects>"
"Why did the Pollos Hermanos attacks not bring more suspicion?","<breaking-bad>"
"In the Sopranos, what is the meaning of Chris Moltisanti staring at an anonymous young family in the street?","<plot-explanation><the-sopranos>"
"Need help understanding ""Finding Forrester""","<plot-explanation><finding-forrester>"
"Why didn't Sherock let Watson in on his Empty Hearse plot?","<plot-explanation><sherlock>"
"Why the need for Sherlock's Empty Hearse plot?","<plot-explanation><sherlock>"
"What is the naming pattern in Better Call Saul?","<better-call-saul>"
"Why did those trucks/tractors act in a strange way?","<plot-explanation><interstellar>"
"Who are Reys parents?","<star-wars><the-force-awakens>"
"How involved are Edward Baines' parents?","<plot-explanation><the-cell>"
"Edward Baines in a coma, seals and sailing?","<plot-explanation><the-cell>"
"How many years away from Earth did Cooper experience in Interstellar?","<interstellar>"
"How did Frank figure out Jim was a spy?","<manhattan>"
"A civilian for two weeks?","<plot-explanation><the-cell>"
"Does the assignment in Saving Private Ryan come impossibly fast?","<saving-private-ryan>"
"Was the famous “Wilhelm Scream” used in “The Force Awakens?”","<star-wars><the-force-awakens><sound-effects>"
"Need name of a classic Sci Fi episode, involving a soldier frozen in time saving a woman?","<identify-this-tv-show><science-fiction>"
"What is the story behind the 'wall girl' in the movie ""Deep Dark""?","<plot-explanation><deep-dark>"
"How does Han communicate with Chewbacca?","<plot-explanation><star-wars>"
"Does Rey speak Shyriiwook?","<star-wars><the-force-awakens>"
"When do Arrow and Flash cross over?","<the-flash><continuity><arrow><arrowverse>"
"Why does Lorenzo de Medici never ask about his daughters?","<plot-explanation><character><da-vincis-demons>"
"In 'Sicario', what was the purpose of raiding the tunnel?","<plot-explanation><sicario>"
"How did they achieve the crack in the ice scene?","<effects><eternal-sunshine-of-spotless-mind>"
"Help me identify this movie man mutates into tree man","<identify-this-movie>"
"Why does master Qui-Gon think Anakin is the ""chosen one"" while others do not?","<star-wars><the-phantom-menace>"
"Age difference between Anakin Skywalker and Padmé in the Star Wars prequel trilogy","<plot-explanation><star-wars>"
"Why do Obi-Wan and Anakin not get burned during their battle on the lava?","<star-wars><revenge-of-the-sith>"
"Star Wars: Episode III - Revenge of the Sith vs. The Clone Wars","<star-wars><continuity><the-clone-wars><revenge-of-the-sith>"
"Why would Patrick Bateman share a phone number with Paul Allen and Timothy Bryce?","<american-psycho>"
"How far is Central City from Star/Starling City?","<the-flash><arrow><arrowverse>"
"What happened to Penny's pharmaceutical sales rep job?","<plot-explanation><character><the-big-bang-theory>"
"Why does ""Move on"" (2012) seem so disjointed?","<plot-explanation><move-on>"
"Where on the Enterprise-D is the ""Battle Bridge"" situated?","<plot-explanation><star-trek><star-trek-the-next-generation>"
"Petrol extinction in Futurama","<futurama>"
"Did Harrison Ford ever pay back Conan? Did he call the show “sh**”?","<censorship>"
"Why did Obi-Wan vanish after his fight with Vader?","<plot-explanation><star-wars><a-new-hope>"
"Have there been any movies about or with realistic ninjas?","<cinema-history><historical-accuracy>"
"Why did energy level drop after switching to global automatic control?","<plot-explanation><realism><chernobyl>"
"Is Marcus Tremaine based on Cinderella's father from any of the movies?","<character><once-upon-a-time><cinderella-2015><cinderella>"
"Is the film Yesterday (2019) a remake of Jean-Philippe (2006)?","<yesterday><jean-philippe>"
"How do Transformers die?","<plot-explanation><transformers><transformers-2007><revenge-of-the-fallen>"
"How are they captured?","<plot-explanation><glass>"
"Who was the youngest Executive Producer?","<film-industry><producer>"
"What does ""vrit' mean with reference to documentaries?","<film-industry><terminology>"
"Does animal tranquilizer really work as fast as we see on Dexter?","<realism><dexter>"
"Why is Havana covered in 5-digit numbers in Our Man in Havana?","<props><historical-accuracy><our-man-in-havana>"
"Why does Johnny say he’s responsible?","<plot-explanation><dirty-dancing>"
"Who is Abra's mother?","<east-of-eden>"
"Is Mayor in Cloudy with a Chance of Meatballs inspired by this character?","<reference><jaws><cloudy-with-a-chance-of-meatballs>"
"Has there ever been a drama film, with an unreliable death scene confession?","<film-techniques>"
"Would Buck Strickland's scheme work?","<realism><king-of-the-hill>"
"Why did Admiral Nimitz say they had 3 to1 carrier advantage?","<dialogue><realism><midway-1976>"
"How did the Covenant accidentally stumble over David's signal?","<plot-explanation><alien-covenant>"
"Is there a name for the trope when there is a moments dialogue when someone pauses just before they leave the room?","<dialogue><trope>"
"How does a new TV series ensures that its actors will be available for the future?","<production><casting><continuity>"
"Ring the bells. But how?","<game-of-thrones><realism>"
"What are Elsa's reasons for selecting the Holy Grail on behalf of Donovan?","<plot-explanation><indiana-jones><the-last-crusade>"
"What part of Buttercup's anatomy is Westley commenting on?","<the-princess-bride>"
"What happened to Steve's Shield in Iron Man 2?","<marvel-cinematic-universe><iron-man-2>"
"Where does Creed Bratton from The Office actually live?","<the-office>"
"What did Thanos mean when saying ""This day extracts a heavy toll""?","<marvel-cinematic-universe><dialogue><avengers-infinity-war>"
"What is the origin of Scooby-Doo's name?","<animation><scooby-doo>"
"What does Freysa mean by this?","<dialogue><blade-runner-2049>"
"What was Sakurai's motivation?","<plot-explanation><character><before-we-vanish>"
"How does HIV bestow 'double meaning' to Blood Diamond?","<blood-diamond>"
"How are intertitles (title cards) denoted in silent movie scripts?","<screenplay><silent-movie>"
"Who is Scoutmaster Kevin?","<character><reference><x-men-cinematic-universe><deadpool-2>"
"Why did the grandmother in Tumbbad need to be fed everyday?","<plot-explanation><tumbbad>"
"Why did the FBI arrest this character?","<plot-explanation><veep>"
"Did Daughter answer Mother's question correctly?","<plot-explanation><i-am-mother>"
"What is Mola Ram looking at in this shot?","<indiana-jones><the-temple-of-doom>"
"What is transpoil?","<plot-explanation><preacher>"
"How did Sapna become super rich, educated and well spoken in 2 years?","<plot-explanation><leila>"
"Why was Sapna still working for Shalini inspite of being a powerful guy's girlfriend/wife?","<plot-explanation><leila>"
"Is Johnny in Cobra Kai a sympathetic character?","<character><karate-kid><cobra-kai>"
"Why the order to protect Leonard?","<plot-explanation><the-umbrella-academy>"
"Where does Dark Phoenix's power come from in ""Apocalypse""?","<x-men-cinematic-universe><x-men-apocalypse><x-men-dark-phoenix>"
"Explantion for the ending of I am Mother","<plot-explanation><i-am-mother>"
"Do all of Quentin Tarantino's movies have a common underlying theme?","<analysis><quentin-tarantino>"
"What movie involves ripping a woman's face off?","<identify-this-movie><horror>"
"What was the first trailer to use ""in a world""?","<first-appearance><trailers>"
"What is the title of treasure hunting movie","<identify-this-movie>"
"Meaning of 55-JUMBO","<friends>"
"Hard to kill with an Arrow","<plot-explanation><the-huntsman-winters-war>"
"How was this scene shot without hurting Charlie Chaplin?","<film-techniques><stunts><city-lights>"
"What movie involves a boy feeding monsters underground?","<identify-this-movie><horror>"
"Cover Girl and a Hollywood-Bollywood Connection","<american-cinema><indian-cinema><musical><cover-girl>"
"What does ""Gollum"" mean?","<plot-explanation><character><the-lord-of-the-rings>"
"Is Red based on some real bird species?","<character><angry-birds>"
"What is Cameron meaning by saying ""I call 9 millimeter""?","<terminator-series><the-sarah-connor-chronicles>"
"Why did the old woman curse the servants of the French prince as well?","<plot-explanation><beauty-and-the-beast>"
"What creature is Vanessa Ives?","<character><penny-dreadful>"
"Why does ""Time"" speak with a German accent?","<character><analysis><through-the-looking-glass>"
"French film from 80-90s about military burning a town to cover up a poison spillage","<identify-this-movie>"
"Significance of Joker's weapon circle in Suicide Squad?","<analysis><dc-extended-universe><suicide-squad>"
"What was the reason for Magneto's decision at the end?","<plot-explanation><x-men-cinematic-universe><x-men-apocalypse>"
"Explanation of ""Lucumi""","<plot-explanation><character><narcos>"
"Male alien searching for a girlfriend on Earth","<identify-this-movie><comedy>"
"Why do the characters talk in old English?","<romeo-juliet-1996>"
"Explanation on the ending of ""(500) Days of Summer""","<plot-explanation><ending><500-days-of-summer>"
"How was Silver Surfer able to kill/banish Galactus in Fantastic Four 2?","<plot-explanation><fantastic-four-2>"
"What exactly was Harry's plan in the hotel with Helen?","<plot-explanation><true-lies>"
"Did Jeff Skiles really say that?","<character><realism><sully>"
"Why does Lance consider cell phones unsafe?","<plot-explanation><pulp-fiction>"
"Do we ever get to know Jake's (Elliot's boyfriend) ""wildest fantasy""?","<character><scrubs>"
"Movie about family moving into mysterious house and seeing mystical creatures","<identify-this-movie>"
"What happened to the rest of the world?","<plot-explanation><children-of-men>"
"What is the significance of the constant spitting of Josey Wales?","<plot-explanation><character><the-outlaw-josey-wales>"
"Why does Todd also get low marks in the history subject?","<plot-explanation><apt-pupil>"
"Do Roxie and her husband get back together in the end?","<plot-explanation><chicago>"
"Why Rick teleports to desert regions in the movie?","<plot-explanation><knight-of-cups>"
"Difference between Digital Rights and Satellite Rights?","<production>"
"What is Ainsley wearing on her foot?","<plot-explanation><character><xxx-return-of-xander-cage>"
"Why Knight of Cups poster look like that?","<analysis><posters><knight-of-cups>"
"Were the bullet holes already in the wall?","<pulp-fiction>"
"Have Patrick Jane and Kim Fischer slept together while on the island?","<the-mentalist>"
"Hindi movie where prisoner escapes by collecting matchsticks from prison guard","<identify-this-movie><indian-cinema>"
"""A galaxy far, far away..."" -- from where?","<plot-explanation><star-wars><realism>"
"What's wrong with this Supergirl elevator pitch?","<arrowverse><supergirl>"
"Why wasn't Anurag's name analogous to the respective ""Devdas"" character Chandramukhi?","<character><book-adaptation><dev-dd>"
"How do they shoot breaking things so close to the camera without damaging it?","<film-techniques><cinematography>"
"Why would Watney write his own name?","<plot-explanation><the-martian>"
"Was Tywin Lannister involved in the murder plot?","<plot-explanation><character><game-of-thrones>"
"Which is the oldest non-fantasy movie to design unique weapon for the character?","<first-appearance><props>"
"Why does Maleficent take care of Aurora?","<plot-explanation><maleficent>"
"Why do so many people remember Dolly from Moonraker having braces?","<james-bond><moonraker>"
"Was Nancy Pierpan a spy? (Page Eight)","<plot-explanation><character><page-eight>"
"Do cops in US always have to answer ""Yes"" when asked ""Are you a cop?""","<realism>"
"Why would the healthy Anne Welles need pills?","<plot-explanation><valley-of-the-dolls>"
"What is Grindhouse (2007) and how to watch it?","<death-proof><planet-terror><grindhouse>"
"Was Rorschach suicidal?","<character><watchmen>"
"What did Ben take a photo of?","<national-treasure-book-of-secrets>"
"Did Guardians of the Galaxy Vol 2 confirm that Marvel now has the rights to Fantastic Four?","<marvel-cinematic-universe><stan-lee><guardians-of-the-galaxy-2><fantastic-four>"
"The stuntman that died on the set of Resident Evil: The Final Chapter","<production><resident-evil><resident-evil-the-final-chapter>"
"Handwriting of Aaron and Abe","<plot-explanation><primer>"
"What was the first movie to have someone with a screen, guiding an agent on the field?","<first-appearance><cinema-history><trope>"
"What are 'F-rated' movies?","<content-rating>"
"How many times does Michael travel through time machine?","<plot-explanation><paycheck>"
"Filming Locations of The Space Between Us","<film-location><the-space-between-us>"
"What did Frank mean by ""For some it’s simply the size of the chair""?","<analysis><house-of-cards>"
"How did Dom arrange the meeting with Magdalene Shaw?","<plot-explanation><fast-and-furious-franchise><the-fate-of-the-furious>"
"Why does ""The Squid and the Whale"" poster have a sketchy background?","<posters><the-squid-and-the-whale>"
"Why is Grauman's Chinese Theater used for so many premieres?","<distribution><american-cinema>"
"How do they film an actor talking to themselves?","<film-techniques>"
"Movie featuring a scene where kids are boiled in a golden pot","<identify-this-movie>"
"Why didn't Hannah Baker ask for Tony's help?","<plot-explanation><13-reasons-why>"
"Why is Jenna left on the other side?","<plot-explanation><the-vampire-diaries>"
"Character (and related story) behind actress Peggy Connelly in Houseboat (1958)","<alternate-version><houseboat>"
"Why did the Sharpes choose this approach for Edith?","<plot-explanation><crimson-peak>"
"Why is Georgina cleaning in ""Get Out""?","<get-out>"
"Purpose of Carving Name?","<plot-explanation><the-shawshank-redemption>"
"How did Hannah and Tony meet in ""13 Reasons Why""?","<13-reasons-why>"
"Why didn't Judy bring up Nick's side business' health code violations when she realised he hustled her?","<character><zootopia>"
"Was the siege on for a whole day or over several days?","<plot-explanation><white-house-down>"
"Why were the Avengers fighting each other?","<plot-explanation><marvel-cinematic-universe><captain-america-civil-war>"
"Is it really possible to put a virus in a machine you don't know?","<plot-explanation><realism><independence-day>"
"Encrypted message in Simpsons Christmas episode 2013","<the-simpsons>"
"Why does the escaped prisoner not return with help?","<plot-explanation><saw>"
"How did they make Captain America so tiny and skinny in the first half?","<marvel-cinematic-universe><effects><captain-america-the-first-avenger>"
"Why was the piranhadon scene deleted from Peter Jackson’s King Kong?","<king-kong-2005>"
"Is a real shark used or is it just computerised?","<film-techniques><props><jaws>"
"Where were Saul & Mira at the end of Season 3?","<film-location><homeland>"
"Fat Cowboy, a Skinny Cowboy, and a Prostitute","<identify-this-movie><western>"
"Why does the ex-undercover cop in Homefront keep sensitive files about his identity unprotected at home?","<plot-explanation><homefront>"
"Why was Beau in the Murder House?","<plot-explanation><american-horror-story>"
"What is the original occurrence of this specific memory-loss / amnesia plot?","<first-appearance>"
"In the Dark Knight, what is the Chechen's fate?","<character><the-dark-knight>"
"Writer who writes a story realizes that it is being lived by some person","<identify-this-movie>"
"End of the world movie","<identify-this-movie>"
"Why name Bob after Robert Mapplethorpe in Bottle Rocket?","<character><bottle-rocket>"
"What song is being sung in the bar while George is praying?","<soundtrack><its-a-wonderful-life>"
"Steampunk movie about Demons","<identify-this-movie><anime>"
"Are talent doubles used for chopstick usage in American dramas?","<film-techniques>"
"Are IMDB ratings objectively credible?","<imdb>"
"Camera sway as cinematic technique?","<film-techniques><drama><cinematography>"
"Explanation of the ending of the episode ""Kafkaesque"" (S03E09)","<plot-explanation><breaking-bad><dialogue>"
"On the elements of a internationally successful comedy movie","<comedy><translation>"
"How did the Trinity Killer manage to leave no traces?","<dexter>"
"Plane crash survivors stuck on a creepy island","<identify-this-movie><identify-this-tv-show>"
"Were the sequels to Before Sunrise planned when its script was written?","<sequels><before-sunrise>"
"Does River Song's message on Planet One in ""The Pandorica Opens"" have any perceived meaning?","<plot-explanation><doctor-who>"
"Is the role of Colonel Race true to the novel?","<analysis><character><book-adaptation><death-on-the-nile>"
"Underground fist fighting, alienated brothers","<identify-this-movie><action>"
"What was the point of the interplay between Richard Riddick and Dahl in Riddick?","<analysis><riddick>"
"What is the difference between USD 38M and USD 120M CGI?","<production><effects><riddick><the-chronicles-of-riddick>"
"Unsane - father issues","<plot-explanation><film-techniques><unsane>"
