title,tags
"Why did Hawkeye become immune to mind control effects?","<plot-explanation><character><marvel-cinematic-universe><avengers-age-of-ultron>"
"In The Cabin in the Woods, what would happen in other parts of the world?","<plot-explanation><the-cabin-in-the-woods>"
"What happened to Daniel Jackson's allergies?","<stargate><stargate-sg1>"
"Voice synthesizer used for the Rabbot's voice on Aqua Teen Hunger Force","<character><sound-effects><aqua-teen-hunger-force>"
"Why was the Log Lady hostile towards Agent Cooper?","<twin-peaks>"
"Why don't the team ever bring back other species for study?","<stargate><stargate-sg1>"
"What are the differences between a DHD and Earth's dialing computer?","<stargate><stargate-sg1>"
"Which years are referred to as ""Generation 1"" in the original Transformers cartoon series?","<transformers><transformers-generation-1><transformers-generation-2>"
"Why does Monica's apartment look different in s01e10?","<friends>"
"Who was Brett in Pulp Fiction?","<plot-explanation><pulp-fiction>"
"What is the symbol on front of the Bus?","<marvel-cinematic-universe><agents-of-shield>"
"Was Cary Grant the first actor to say ""gay"" onscreen?","<first-appearance><bringing-up-baby>"
"Is the Marcus Aurelius quote in Black Sails a rewrite?","<dialogue><screenwriter><black-sails>"
"What is the longest, single take, tracking shot in cinema/TV?","<film-techniques><cinema-history>"
"Television crossover episodes between networks?","<character><spin-off><crossovers>"
"Have there been other cinematic crossovers like the Marvel Cinematic Universe?","<marvel-cinematic-universe><movie-franchise>"
"Who/What was Ra?","<stargate><stargate-1994>"
"How could the murder weapon in The Sign of Three possibly work?","<plot-explanation><sherlock>"
"In the pilot episode of Star Trek: Deep Space Nine, the ""timeless aliens"" were a paradox, right?","<plot-explanation><star-trek><star-trek-deep-space-nine>"
"Why are there so many different writers to TV series?","<production>"
"How precisely do we know the research topics of the scientists in TBBT?","<the-big-bang-theory>"
"How did Dick endanger Holly's children?","<die-hard><die-hard-2>"
"Serial Killer following basis for television shows","<the-following><the-mentalist><elementary>"
"What is the basis of the information in Dora Lange's diary?","<plot-explanation><true-detective>"
"Movie where little boy disappears from his room after thunder strikes the house","<identify-this-movie>"
"How come the ground under Aragorn's army did not collapse after the ring is destroyed?","<plot-explanation><the-lord-of-the-rings><the-return-of-the-king>"
"Why is Before Midnight considered an ""Adapted Screenplay?""","<academy-awards><screenplay><before-midnight>"
"Killing computers in movies","<film-techniques>"
"Has Daryl ever fired an arrow and not recovered it?","<the-walking-dead>"
"Why does Peter Bishop still exist?","<plot-explanation><fringe>"
"Inconsistency in medical clearance on Helix?","<plot-explanation><helix>"
"How did they get rid of the money in the bank?","<plot-explanation><now-you-see-me>"
"Why did James Moriarty decide to end it this way?","<plot-explanation><character><sherlock>"
"Why didn't the bomb detonate earlier?","<plot-explanation><robocop-2014>"
"What was the recent 3 week delay for?","<scheduling>"
"What are the points of overlap between True Detective and Twin Peaks?","<twin-peaks><true-detective>"
"Is there any relation between the head-butting in LotR and the Hobbit?","<the-lord-of-the-rings><the-hobbit>"
"Season 2: What is so important about the bridge?","<plot-explanation><house-of-cards>"
"What was the function of the Cop Uniforms?","<true-detective>"
"Why is Jackie against Claire's bill?","<plot-explanation><house-of-cards>"
"What was going on with Tom Hagen?","<the-godfather-2>"
"Why must the Avalon be perpetually in autopilot?","<plot-explanation><passengers>"
"Do Indian movies screened outside India, have intervals as well?","<indian-cinema>"
"Where does Sheldon hide the Golf Ball in TBBT S09E19?","<plot-explanation><the-big-bang-theory>"
"Why did the Predator not kill Arnold immediately as it killed everybody else?","<plot-explanation><predator>"
"Why is Superman still not aware of the Phantom Zone projector being stolen?","<plot-explanation><the-lego-batman-movie>"
"Why did this person implicate himself in House of Cards?","<plot-explanation><house-of-cards>"
"Where did the vial of ooze come from?","<tmnt-secret-of-the-ooze>"
"What was the argument between pirates and Yondu?","<plot-explanation><marvel-cinematic-universe><guardians-of-the-galaxy-2>"
"Where did the other Gladers get the spears from, to get out of the maze?","<plot-explanation><continuity><the-maze-runner>"
"Ian's breakthrough on the spacing of alien response","<plot-explanation><arrival>"
"Why this two movies appear in live action?","<plot-explanation><the-lego-batman-movie>"
"Can Darth Vader read minds like Kylo Ren?","<plot-explanation><character><star-wars>"
"Why did Sydney feel that he was entitled to $1,700 of Billy's money?","<plot-explanation><white-men-cant-jump>"
"Where is Will Turner's heart at the end?","<character><pirates-of-the-caribbean><dead-men-tell-no-tales>"
"Why was there a clip of silent movie at the start of John Wick Chapter 2?","<john-wick-chapter-2>"
"The Glaive from Krull","<plot-explanation><krull>"
"Why are rebel groups always situated in the Rocky Mountains?","<american-cinema>"
"Movie about a woman cutting the private part of a man who is a womanizer","<identify-this-movie>"
"How did the first T-1000 die?","<plot-explanation><terminator-series><terminator-genisys>"
"How was she able to crack the password of her professor's mail?","<plot-explanation><7-aum-arivu>"
"What have the harasser said to Rana","<dialogue><the-salesman>"
"Will movies look better on a professional monitor?","<display-technology>"
"Keeping two infinity stones close together","<plot-explanation><marvel-cinematic-universe>"
"Genius Season 1, a confusion in a quote","<dialogue><genius>"
"Was there any productional reason for the set change in The Fresh Prince?","<the-fresh-prince-of-bel-air><set-design>"
"Any significance for the number 2295 in the ""Chicago"" franchise?","<chicago-pd><chicago-med><chicago-fire>"
"What is a ""soap""?","<terminology><genre>"
"How do comedy and news shows get access to so many clips from other networks' shows?","<production>"
"Did people feel pain when they died in Infinity War?","<plot-explanation><marvel-cinematic-universe><avengers-infinity-war>"
"Is Calux still part of the game of Truth or Dare?","<plot-explanation><truth-or-dare>"
"Are foreign scenes meant to have no translation in Overlord?","<overlord>"
"Doctor who's Listen timeline vs Utopia","<doctor-who>"
"Why was Starlight vomiting?","<plot-explanation><the-boys>"
"Does Uncle Ben exist in the MCU?","<character><marvel-cinematic-universe><spider-man-homecoming><spider-man-far-from-home>"
"Is this bar slide trick shown on Cheers real or a visual effect?","<effects><cheers>"
"How did Aquaman get his tattoos?","<character><dc-extended-universe><aquaman>"
"How and from whom did Roger Corman acquire the rights for Soviet Films ""The Sky Beckons"" and others?","<american-cinema><russian-cinema>"
"How do reality and online TV shows prevent leaks regarding winner names?","<reality-tv>"
"Why do cars in movies set in earlier eras always look brand new?","<production><film-techniques><props><historical-accuracy>"
"Do the Chris Nolan Batman movies have a unique Gotham accent?","<dialogue><the-dark-knight-rises><the-dark-knight><batman-begins>"
"What did Julieta see at the end of ""The Son""?","<plot-explanation><the-son>"
"Why didn’t the Charles Manson character appear in Spahn Ranch?","<plot-explanation><character><analysis><once-upon-a-time-in-hollywood>"
"Have there ever been other TV shows or Films that told a similar story to the new 90210 show?","<terminology><90210>"
"Why did John Goodman say he was sandbagged by being cast as Fred Flintstone?","<casting><always>"
"Why did Amenadiel say these things about situation in Hell?","<plot-explanation><lucifer>"
"What is the relation of the butler to the protagonist?","<plot-explanation><character><estranged>"
"Why doesn't Benigno admit his crime to Marco?","<plot-explanation><talk-to-her>"
"Heaven Sent - Does the doctor die every day?","<doctor-who>"
"In-universe explanation of sex life, dating, reproduction of Smurfs","<the-smurfs>"
"Why did Dumbledore offer Licorice Snaps to Harry in GoF?","<plot-explanation><harry-potter><the-goblet-of-fire>"
"What was the purpose of the ""naughty"" words list?","<mindhunter-2017>"
"Why does public show no reaction to killings in John Wick 3?","<realism><john-wick-chapter-3-parabellum>"
"What Simulations were really Simulations?","<plot-explanation><enders-game>"
"Did Jesse have a different disorder than what he indicated?","<character><fast-and-furious-franchise><fast-and-furious-1>"
"In xXx, is Xander Cage's 10th vehicle a specific reference to another franchise?","<fast-and-furious-1><xxx>"
"Why didn’t Doctor Strange stay in the original winning timeline?","<plot-explanation><marvel-cinematic-universe><avengers-infinity-war><avengers-endgame>"
"How and why did Pam kiss fake-Jim in the Asian-Jim prank in The Office?","<the-office>"
"Why the color Red in Us, what is the significance?","<plot-explanation><us>"
"Is there any cameo from previous Step Up films in Step Up: High Water?","<cameo><step-up><step-up-high-water>"
"Why do soap operas have the soap opera effect?","<effects><cinematography>"
"Why did the crew members not feel anything during creating the paranormal documentary series?","<plot-explanation><american-horror-story>"
"Jokes about Monica's haircut","<plot-explanation><friends>"
"Longest Continuous Plotline Across a Series of Films","<continuity>"
"Have any participants ever apologized for their involvement in ""Mazes and Monsters""?","<reception><mazes-and-monsters>"
"How true-to-life is the language used by Issa and Molly?","<insecure>"
"Unknown animated movie with a powerful glove","<identify-this-movie><animation>"
"Is the catchphrase ""Hasta la vista, baby"" meant to be a nod to ""I'll be back""","<dialogue><terminator-series><terminator-2-judgment-day><the-terminator>"
"Where's Nadja from?","<character><the-hunt>"
"Who killed Fanny the dog and threw the stone?","<plot-explanation><the-hunt>"
"How come the present is not changed for the lab team?","<plot-explanation><time-travel><timeless>"
"How does Michael Myers always seem to know where Laurie/victims are?","<halloween>"
"How long has Sabrina lived with her Aunts?","<plot-explanation><sabrina-the-teenage-witch>"
"In Wristcutters: A Love Story who do the police work for?","<plot-explanation><wristcutters-a-love-story>"
"Why did they introduce girls in bikinis in court?","<plot-explanation><spring-breakers>"
"Why did Verbal get legal immunity?","<plot-explanation><the-usual-suspects>"
"How long is an epic?","<terminology><genre>"
"Why did the President still send the FBI after Benjamin Gates?","<plot-explanation><national-treasure-book-of-secrets>"
"Does the Iron Man movie ever establish a convincing motive for the main villain?","<character><marvel-cinematic-universe><iron-man>"
"What is the code in Envelope?","<plot-explanation><envelope>"
"How does killing Barron affect the timeline in Miss Peregrine's Home for Peculiar Children?","<time-travel><miss-peregrines-home-for-peculiar>"
"How did people learn in Defending Your Life?","<defending-your-life>"
"What was the point of obtaining GPS?","<plot-explanation><tmnt-out-of-the-shadows>"
"How was Sheldon able to play around with Rajesh and Howard","<plot-explanation><the-big-bang-theory>"
"Frank's Refusal Of Number One Observatory Circle","<character><analysis><house-of-cards>"
"Why didn't Air Force One defend itself when under attack by a missile?","<white-house-down>"
"How does Sherlock come to the conclusion Moriarty is dead?","<plot-explanation><sherlock>"
"In Ted 2, Ted is arguing with a male and female neighbour. What language is female neighbour speaking?","<ted-2>"
"Have they edited the turning water to wine scene in 'Now You See Me'?","<alternate-version><now-you-see-me>"
"About the role of Kate Macer in Sicario","<plot-explanation><sicario>"
"Reference to a Danish version of something on the TV series The Magicians","<plot-explanation><reference><the-magicians>"
"What is the actual relation between Miami Vice and the ""Smuggler's Blues""?","<soundtrack><miami-vice>"
"What boxing matches were the fights in Rocky based on?","<rocky><rocky-iii><rocky-iv><rocky-ii>"
"Why were the Doctor Who opening scenes and music changed between seasons and not between Doctors?","<production><soundtrack><effects><doctor-who>"
"Are the Clean Shaven Officer and the Old Man supposed to be the same person?","<character><the-x-files>"
"What does the prophecy exactly say in the Star Wars saga?","<star-wars>"
"Why didn't James Bond finish off Mr. Hinx after the crash?","<plot-explanation><james-bond><spectre>"
"Old Man's interaction with Mulder ""10 years ago""?","<the-x-files>"
"Why do some shows have an opening credits voice over that explains the premise of the show?","<credits><title-sequence>"
"Why do they refer to Palestine as a country?","<house-of-cards>"
"How did launched vehicles match speed of slingshot vehicle?","<plot-explanation><the-martian>"
"How many people were actually in the Beast's castle?","<beauty-and-the-beast>"
"In the film Donnie Brasco, why did the FBI tell the mafia that Donnie was an undercover agent?","<plot-explanation><donnie-brasco>"
"The others, who is dead or who is alive?","<the-others>"
"Is Gideon on The Flash and Gideon on Legends of Tomorrow same?","<character><the-flash><legends-of-tomorrow><arrowverse>"
"Can you tell me about the Saint George day in Time of the Gypsies?","<realism><historical-accuracy><time-of-the-gypsies>"
"In allegorical sense what does the mad dog represent in ""To Kill a Mockingbird""?","<character><analysis><to-kill-a-mockingbird>"
"Is the Babadook symbolic of the dead father?","<analysis><the-babadook>"
"Who burned down the horse stables?","<plot-explanation><the-sopranos>"
"Why are two such similar movies being made at the same time?","<production><book-adaptation><the-jungle-book-2016><mowgli-legend-of-the-jungle>"
"Does X-Files (2016) follow last season of X-Files (2002) story-wise?","<the-x-files>"
"Shooting of the gravity free scene in Inception","<film-techniques><inception>"
"What's that movie with a surreal golden tree appearing from time to time?","<identify-this-movie><drama>"
"Is there a good resource which analyzes many parody movies for ""what is being lampooned""?","<analysis><parody>"
"What is the purpose behind ""wax on, wax off"" in Karate Kid?","<martial-arts><karate-kid>"
"Dolores Umbridge: Misguided or Sinister?","<plot-explanation><character><harry-potter>"
"What are the specific parallels between Shakespeare's The Tempest and Forbidden Planet?","<book-adaptation><forbidden-planet>"
"Film where colour fades throughout to represent dying protagonist","<identify-this-movie><film-techniques>"
"Is Dogville inspired from Hitchcock's Rear Window?","<analysis><rear-window><dogville>"
"What does The Man from Another Place in Twin Peaks symbolize?","<plot-explanation><character><twin-peaks><david-lynch>"
"Western with extremely sweat-lathered horses","<identify-this-movie><western>"
"Did any of Alfred Hitchcock's American films receive poor reviews upon release?","<alfred-hitchcock>"
"Nineties sitcom about small software company","<comedy><sitcoms><identify-this-tv-show>"
"What does the Theodore doll say in Alvin and the Chipmunks?","<plot-explanation><alvin-and-the-chipmunks>"
"Why does Cobb use the spinning top?","<plot-explanation><inception>"
"What was the deal with the crazy Major at Fort Hays?","<plot-explanation><dances-with-wolves>"
"Why isn't Dr Bishop consulted about the disc in ""The Ghost Network""?","<plot-explanation><fringe>"
"What is the significance of a man sitting on the train engine in the last scene of ""Live and Let Die""?","<analysis><james-bond><live-and-let-die>"
"What is the cinematic origin (first use) of a ""Fortune teller will lose powers after intimacy"" trope?","<first-appearance>"
"First Hollywood (or at least made in USA) movie where Russian dialog was spoken by Russian speaking actor?","<first-appearance><casting><american-cinema>"
"Why are most sounds dubbed in afterwards for movies, instead of being recorded live?","<soundtrack>"
"Were any non-CGI movies shot in their entirety though a colored lens/filter?","<effects><cinematography>"
"What is the real reason for the Joker's scars?","<character><the-dark-knight>"
"Which film was the first to show us the face of God?","<first-appearance><analysis>"
"Who judged season one?","<jump-city-seattle>"
"South Park and references to Muhammad","<analysis><south-park>"
"Fellowship of the Ring continuity error?","<plot-explanation><the-lord-of-the-rings><the-fellowship-of-the-ring>"
"Language of the Moria password in The Fellowship of the Ring","<plot-explanation><the-lord-of-the-rings><the-fellowship-of-the-ring><dialogue>"
"What is the name of this Vietnam War-related movie?","<identify-this-movie>"
"What is the first instance of a disaster movie coming true?","<cinema-history>"
"What is the definitive ending to Kiss Me Deadly?","<kiss-me-deadly><alternate-version>"
"Why all the profanity in Deadwood?","<deadwood>"
"What happens with Chuck and Sarah?","<plot-explanation><ending><chuck>"
"Does George Lucas have a plan for how The Clone Wars series will continue into the movies?","<star-wars><the-clone-wars>"
"Explanation of scene in the Official Story (La historia oficial)","<plot-explanation><the-official-story>"
"What kind of tree is the giant tree in Downton Abbey?","<downton-abbey>"
"What is the title of this samurai movie?","<identify-this-movie>"
"Did Charlie Chaplin fund and produce The Great Dictator alone?","<analysis><production><charlie-chaplin><the-great-dictator>"
"Is this a real quote or is it written for the movie?","<dialogue><bharat-ane-nenu>"
"English translation of German conversation in Kelly’s Heroes","<dialogue><translation><kellys-heroes>"
"Why didn't the Wakandans destroy the alien ships?","<marvel-cinematic-universe><avengers-infinity-war>"
"Why was Charlie horrified when he looked inside the toilet?","<plot-explanation><daddy-day-care>"
"Where do empty 'natural' Sleeves come from?","<plot-explanation><analysis><altered-carbon>"
"How many years have passed between season 5 and 6 of The Americans","<the-americans>"
"Thanos is not the only one to wield 2 infinity stones","<marvel-cinematic-universe><avengers-infinity-war><the-avengers><avengers-age-of-ultron>"
"Why does Bruce Banner know so much about Thanos?","<plot-explanation><marvel-cinematic-universe><avengers-infinity-war>"
"How did Thanos know how to use this item?","<marvel-cinematic-universe><avengers-infinity-war><doctor-strange>"
"Understanding the abrupt beginning and the pre-plot of Infinity War","<plot-explanation><marvel-cinematic-universe><avengers-infinity-war>"
"Was Cobra Kai influenced by How I Met Your Mother?","<production><how-i-met-your-mother><karate-kid><cobra-kai>"
"Was Cartman's saving of Kyle in imaginationland and smug-alert selfish?","<character><south-park>"
"What is the relevance of this scene in the House intro?","<house><title-sequence>"
"Would Thanos be considered an anti-villain?","<character><marvel-cinematic-universe><avengers-infinity-war>"
"In ""Friends"", does any of the six wear the same clothes in different episodes?","<friends>"
"Spiral-projectors / holograms (?) - how do they work? (as seen in Gambinos SNL performance)","<effects><lighting><projection>"
"How did Thor get into Wakanda?","<plot-explanation><marvel-cinematic-universe><avengers-infinity-war>"
"Is it necessary to watch Black Panther before watching Avengers-Infinity War","<marvel-cinematic-universe><avengers-infinity-war><suggested-order><black-panther>"
"How did Banner know Dr.Strange?","<plot-explanation><analysis><marvel-cinematic-universe><avengers-infinity-war>"
"Was the Island in LOST In another dimension?","<plot-explanation><lost>"
"How did Beale know about the Saudi Arabian deal?","<plot-explanation><network>"
"Where do Wakandans get their (external) wealth from?","<plot-explanation><marvel-cinematic-universe><black-panther>"
"Were any Jedi actually successful at remaining completely emotionally unattached?","<star-wars>"
"Why aren't the actual people involved in incidents asked to do reenactments?","<character><casting>"
"Why does this character get affected in Infinity War?","<marvel-cinematic-universe><avengers-infinity-war>"
"In Ready Player One, what would happen if Artemis fell while jumping?","<ready-player-one>"
"Why didn't ""Dutch"" & his commandos bring any thermal imaging devices?","<plot-explanation><predator>"
"Controlling a host's behavior in Westworld?","<plot-explanation><westworld-tv>"
"What exactly happens in this scene with Gamora and Thanos?","<plot-explanation><marvel-cinematic-universe><avengers-infinity-war>"
"How does the series Lucifer end or how to find out?","<ending><lucifer>"
"How did the terrorists hide the nuclear weapons inside the figures?","<plot-explanation><true-lies>"
"Is Lucy's pose from anime?","<twin-peaks><anime>"
"Why don't the visitors get moved into the hotel and visitors center?","<plot-explanation><jurassic-world>"
"How Can Thanos believe his plan is sustainable?","<plot-explanation><marvel-cinematic-universe><avengers-infinity-war>"
"Why does Spike claim to have gotten his soul back by his own wish, when he didn't?","<buffy-the-vampire-slayer>"
"Why does Daredevil's cowl have eyeholes?","<marvel-cinematic-universe><costume><daredevil-tv>"
"Why does Reid scribble into his notebook `Extreme Aggressor`","<plot-explanation><criminal-minds>"
"Why is Pulp Fiction's opening scene different to the one near the end?","<dialogue><pulp-fiction>"
"In Disney's The Hunchback of Notre Dame: Is the gyspy woman really Quasimodo's mom?","<hunchback-of-notre-dame>"
"How do HYDRA get the Leviathan to Strucker's base?","<marvel-cinematic-universe><avengers-age-of-ultron>"
"How did Thor know the Power stone was in play?","<marvel-cinematic-universe><avengers-age-of-ultron><guardians-of-the-galaxy>"
"What did the Hulk see during his nightmare vision?","<marvel-cinematic-universe><avengers-age-of-ultron>"
"How would you describe the relation between Mathilda and Léon?","<character><leon-the-professional>"
"How does a movie director handle an inherently dangerous scene such as the following?","<film-techniques>"
"Would Dr Hannibal Lecter allow himself to be a consultant with Clarice if Miggs hadn't behaved improperly to her?","<analysis><character><the-silence-of-the-lambs>"
"Man admits guilt but recants it, leading to investigation and legal struggle","<identify-this-movie>"
"Why does Cooper send the NASA coordinates in Interstellar?","<plot-explanation><interstellar>"
"How does SGC know who is incoming before the stargate connects?","<stargate><stargate-sg1>"
"How did Klorel and Apophis escape their ships alive?","<plot-explanation><stargate><stargate-sg1>"
"What Bill Murray movie is on TV in ""Lost in Translation""?","<lost-in-translation>"
"What is the content of the one un-opened package in ""Castaway""?","<plot-explanation><cast-away>"
"Getting a movie's gross revenue trend","<box-office>"
"What's Saddam Hussein doing in the Dude's dream?","<the-big-lebowski>"
"Elderly man sending postcards to random addresses during wartime","<identify-this-movie><short-films>"
"In ""My Neighbor Totoro"", what is wrong with the mother (why is she in the hospital)?","<my-neighbor-totoro>"
"What is 'Forget it Tracy. It's Midtown' a reference to in 30 Rock","<plot-explanation><30-rock>"
"Did Diablo Cody intentionally have Juno use the mashed-up phrase, ""Thundercats are go!""?","<dialogue><juno>"
"Whose hands are in the box?","<plot-explanation><limitless>"
"Who leaked the news about the merger?","<plot-explanation><limitless>"
"Was any further information on Margaret's pregnancy ever given?","<the-west-wing>"
"Can a wooden log really harm a creature like the Predator?","<plot-explanation><predator>"
"The Imitation Game - 10 men checking one setting a minute","<the-imitation-game>"
"Is Chuck Shurley in Season 5 God?","<supernatural>"
"Stalker thriller movie from 80s","<identify-this-movie><thriller>"
"Why does Bateman's lawyer call him Davis?","<american-psycho>"
"What is Rotti Largo's terminal illness?","<repo-the-genetic-opera>"
"House of Cards - Camera Shots","<analysis><house-of-cards><cinematography>"
"About Zoe Barnes in the second season of House of Cards","<house-of-cards>"
"Did Frank Underwood mean for the bill to fail?","<plot-explanation><house-of-cards>"
"Boats in Philadelphia Story","<analysis><dialogue><the-philadelphia-story>"
"Why didn't the key word trigger the hypnosis on the first incident?","<plot-explanation><now-you-see-me>"
"Movie about a robbery by moving a building","<identify-this-movie>"
"What was the virtual reality research that was used to produce the movie A.I.?","<effects><ai-artificial-intelligence>"
"English translation of dialogues in The Godfather","<the-godfather><translation>"
"Post-apocalyptic movie, non-English, with a depressing ending","<identify-this-movie>"
"Train scene in the movie ""Shame""","<plot-explanation><analysis><shame>"
"Why didn't James Earl Jones get voice over credit for Star Wars?","<star-wars><credits>"
"What song is Castle humming at the end of S01E07?","<castle>"
"How does Sherlock deduce the relationship between Sergeant Donovan and Anderson?","<plot-explanation><sherlock>"
"Soundtrack idioms in movies","<soundtrack><film-location><sound-effects>"
"The three note danger idiom","<soundtrack><sound-effects><origin>"
"Why does Leslie Knope love Joe Biden?","<parks-and-recreation>"
