title,tags
"What is the maximal pot bet if one of the players has less chips than minimum raise","<pot-limit>"
"Have people been playing ""40% strategies"" in tournaments in the current century?","<texas-hold-em>"
"Is This a Bet or a Raise?","<poker-theory><cash-game><terminology>"
"Check Raise vs Donk Bet","<poker-theory>"
"Fictitious play for multiway hand in push or fold regime","<poker-theory><poker-tools>"
"Most important tells","<live>"
"Teaching source for putting players on hands?","<books><hand>"
"Why did I lose this hand?","<texas-hold-em><reading-hands><hand>"
"What I did was right?","<texas-hold-em><tournament><poker-theory><betting-position>"
"The more advice I read - the worse I play. What am I doing wrong?","<texas-hold-em><online>"
"Pocket Aces in 9-handed","<poker-theory><strategy><betting-position><pre-flop><no-limit>"
"AKo all in v 57o?","<nlhe><tournament><pre-flop><pot-odds>"
"Names of positions?","<poker-theory>"
"Can I move HUD info on PokerTracker?","<online><poker-tools><hud>"
"In live play, why do poker players wait their turn before looking at their cards?","<live><pre-flop>"
"Where to discuss poker hands (besides here)?","<hand-history>"
"What different types of poker game are there?","<poker-theory>"
"Stalling as a strategy in real life tournaments?","<live><strategy><poker-strategy>"
"What are the odds of being dealt exactly the same 2 hole cards in consecutive hands?","<texas-hold-em><online>"
"Possible cheating in Online Poker (by the dealer)","<online>"
"NL100: Can I Call This River Shove?","<nlhe><hand-history><nl100>"
"Formula for making a single pair on the flop","<probability>"
"What if a home game player is physically unable to deal? Skip or substitute?","<texas-hold-em><rules><dealing>"
"Finding leaks in your game","<statistics><poker-tools><hud><pokertracker><holdem-manager>"
"Does the ""top 5 cards"" rule apply to a flush?","<rules><reading-hands>"
"What you use to get your poker ""A"" when playing live?","<etiquette>"
"NL100: Deep Stack Shoves On River. Do You Call?","<nlhe><hand-history>"
"How can I use a player's decision to check blindly on the flop as a tell?","<texas-hold-em><betting-strategy><betting-position>"
"Simplest Way to Explain EV to Beginners","<poker-theory><ev><learning>"
"How to Decide Whether to Buy the Add On or Not in Rebuys","<nlhe><online><tournament><poker-theory>"
"How To Recognize Addiction To Gambling?","<psychology>"
"Why offer guaranteed prize pools?","<texas-hold-em><online><tournament><prize-pool>"
"How to deal with overcards in the flop","<texas-hold-em><tells><psychology>"
"Is there a site that compares ""effective"" rake?","<online><cash-game><rake>"
"Research on the effect of a screen name or avatar in online poker","<online><strategy><psychology>"
"What's the optimum time to enter a tournament with late registration?","<online><tournament><strategy>"
"Bet denied after having hit the table pre-river","<live><rules><pot-limit>"
"Does the buy-in for a tourney affect the taxes of your winning?","<tax><prize-pool>"
"Playing online poker with Italians (on PokerStars)?","<poker-tools>"
"What are the overall odds of winning a heads up, texas hold em hand?","<texas-hold-em><odds><heads-up><casino>"
"Rank of two-pair hands for low in razz or 7-stud hi-low","<rules><seven-card-stud>"
"How does the strategy for Omaha and Hold Em vary pre-flop?","<texas-hold-em><betting-strategy><strategy><poker-strategy>"
"How to calculate the odds of the same thing happening both times I have a specific hand?","<odds>"
"Texas Hold 'Em possibilities","<texas-hold-em><poker-theory>"
"What are best books, programes and sites to improve Texas Hold'em (Limit and No Limit) skills?","<texas-hold-em><learning>"
"What are best books for newbie, medium and advanced level players in order to learn no limit Texas Hold'em?","<books><learning>"
"What are recommended computer programs for learning No Limit Texas Hold'em?","<learning>"
"What are good web sites to learn No Limit Texas Hold'em?","<learning>"
"Real money poker on Android?","<poker-tools>"
"What data should you keep track of to improve your game?","<poker-theory><software><learning>"
"Which hand wins: 23 vs. 9J on a AAKKQ board?","<texas-hold-em><rules><hand>"
"Are non-standard verbal declarations such as ""same bet"" or ""I put you all-in"" binding?","<texas-hold-em><live><rules>"
"How this hand should have been played?","<odds>"
"What are the key lessons that Poker teaches that can be applied to successful speculation?","<learning><casino><soft-question>"
"Some Mathematical Poker Questions (Discrete Math)","<poker-theory><hand>"
"Holding pocket tens and flop in KQT suited in Texas Holdem 5 handed cash game","<texas-hold-em>"
"Do two A's beat a wheel straight?","<poker-strategy><reading-hands>"
"The need of calculating EV?","<cash-game><ev>"
"Texas hold'em: Why did I lose this hand?","<texas-hold-em><rules><reading-hands><wsop>"
"Chances of 5 way chop (flush board)","<statistics><probability>"
"Bank Roll Management @ Multiple Tables","<texas-hold-em><bankroll-management>"
"Bet sizes in Limit Texas Hold'em in cases of a players all-in","<texas-hold-em><all-in>"
"What Is The Rationale Behind A Check-Raise?","<texas-hold-em><online><betting-strategy><strategy>"
"What does the Dealer button have to do with the dealer?","<dealer><button>"
"Hold'em hand history with hero","<texas-hold-em><hand-history><statistics>"
"What, exactly, does it mean to play a hand?","<terminology><starting-hand>"
"What is a final table simulation?","<final-table>"
"Is ""open-face"" Chinese poker really about skill?","<open-face-chinese>"
"Final Table of Tournament - Hand History Example","<poker-theory><hand-history>"
"How to use (or not use) Chen formula valuation in different scenarios?","<poker-theory>"
"Total Money vs Money Invested In Current Game","<terminology><bankroll-management>"
"HU EV facing an open shove from sb with ~10bb","<ev><heads-up>"
"Do I have to show my hand in an ""All-In"" situation?","<texas-hold-em><all-in><hand><showdown>"
"Poker program that tells you the best-known multistrategy in limit hold'em","<texas-hold-em><software>"
"What is the best poker tracker/software?","<software><pokertracker><holdem-manager>"
"Are sidepots created at each turn, or at the end of the round?","<side-pots>"
"When is the true end of round (pre-flop, flop, turn, or river)?","<texas-hold-em><betting-position>"
"What happens (or is it possible) when there's sidepots that have no players competing for them?","<side-pots>"
"What is the min-raise and min-reraise in Holdem No Limit?","<texas-hold-em><no-limit><raise>"
"What is an open limp?","<texas-hold-em>"
"Hold'em Manager: Why resets HUD my stats on each table switch?","<holdem-manager>"
"Hand discussion: QJc vs A8o on A84 T K","<texas-hold-em><no-limit><hand-history>"
"When is Automatic Re-buy Triggered?","<online><rules>"
"How to identify low sets against top pair top kicker? (Online Poker)","<texas-hold-em><online><betting-strategy><no-limit><poker-strategy>"
"Hillbilly texan","<texas-hold-em>"
"tracking software for Omaha Hi/Low","<software><omaha-hi-lo><pokertracker>"
"What is a good (folding) poker table for home usage?","<equipment>"
"A2345 Straights permitted","<rules><wsop>"
"What app for tracking sessions on iPhone?","<online><pokertracker>"
"When do you need to think more than 1 decision ahead in limit hold'em?","<poker-theory><betting-strategy><odds><pot-odds>"
"Can you call when the pot odds don't favour you?","<poker-theory><odds><pot-odds>"
"Whose turn is it?","<terminology>"
"Simplified poker games","<poker-theory>"
"KK on small blind vs Calling Station","<nlhe><online><hand-history><cash-game>"
"Coin flips on cash game","<nlhe><online><cash-game><odds>"
"Question on Odds, Pot Odds and Expected Values","<odds><pot-odds>"
"Top-pair and top-kicker (or good kicker) question","<nlhe><cash-game>"
"Expanding my psychological game","<psychology>"
"Dealing with final table shovers","<final-table>"
"Storing Bankroll On Poker Site(s)","<bankroll-management>"
"Is my pair better than my opponent's pair?","<texas-hold-em>"
"Can the optimal strategy for low stakes holdem be considered simpler as a general rule?","<texas-hold-em><poker-theory><poker-strategy>"
"Question on Strategy Calculation (from Bill Chen's Book Math of Poker)","<poker-theory>"
"Is online poker still a profitable way to make money in 2014?","<online>"
"How long should I wait for a decent hand","<texas-hold-em><online><cash-game><poker-strategy>"
"Should I go see the flop more often if I'm chip leader","<texas-hold-em><poker-strategy>"
"How much must Hero bet for Villain to fold?","<texas-hold-em><nlhe><live><cash-game><nl200>"
"Do PokerStars take a cut when you cash out","<online>"
"Question about BB/100","<cash-game><software>"
"Can a chip leader be also short stacked? Is it still push or fold?","<strategy><short-stack>"
"How would the main and sidepot split in this situation?","<rules><side-pots>"
"Player with 3 cards in Texas Hold'em. Now what?","<texas-hold-em><nlhe><rules><dealing>"
"How good are the best poker bots?","<online>"
"When to call all-in in heads-up game?","<poker-theory><all-in>"
"When to bet/check with the pot very big?","<nlhe><betting-strategy><cash-game>"
"How to choose new dealer when some new players have joined and some previous players have left the table?","<dealer><button>"
"Is stats or technical knowledge of poker of any help","<statistics>"
"Going with maximum chips (max stack strategy)","<poker-strategy>"
"Hand-histories of successful players","<hand-history>"
"How is players raising each other indefinitely prevented?","<rules>"
"KQo on wet board","<texas-hold-em><cash-game>"
"Daily profit - how much do you consider enough [NLHE NL2]","<nlhe><online><cash-game>"
"Unexpected aggression and a premium hand","<texas-hold-em><no-limit>"
"Shuffle in middle of hand","<texas-hold-em>"
"is this an accurate pot odds calculation?","<pot-odds>"
"Showing hand before call","<rules>"
"TAG vs LAG stats in HU","<statistics><heads-up>"
"What is the value in using free poker sites to learn poker?","<learning><bankroll-management>"
"What time of day are poker players at their best/worst?","<online><psychology>"
"Phil Gordons Ace - x rule","<tournament><short-stack>"
"Odds of 2 pair running into trips on a paired board","<odds>"
"What's the chance of a better hand behind me?","<texas-hold-em><statistics><betting-position><starting-hand>"
"Calculating the Probability of Reaching a Certain Amount of BB vs Hero","<poker-theory><statistics><heads-up><poker-strategy>"
"Heads-up river, first to show mucks. Does second player have to show to win pot?","<texas-hold-em><rules><tournament>"
"$2/$5 Poker Hand: Nut Flush Draw, Big Pot","<cash-game><strategy>"
"Ratio vs Percentage in pots odds and hand odds","<pot-odds>"
"calling all-in before the flop","<pre-flop><all-in>"
"Flopping top set on an all club flop","<cash-game>"
"Texas Hold'Em Fullhouse Battle","<texas-hold-em><hand-history><reading-hands>"
"Hands selection in a 6 table","<starting-hand>"
"Have a question about texas holdm questions","<texas-hold-em><reading-hands>"
"What kind of plays could I make to convince my opponents that I have a polarised hand range?","<texas-hold-em><poker-theory><betting-strategy><poker-strategy><range>"
"what would be the minimum and maximum bets be in 7-card stud with a pot of $1000?","<betting-strategy><seven-card-stud>"
"various small questions","<texas-hold-em><live><learning>"
"In Hold'em games, how do the blinds move if the dealer is stationary (house)?","<texas-hold-em><no-limit><blinds><dealer>"
"mathematical profit","<nlhe><live><betting-strategy><learning><tells>"
"Can there be more betting after an all-in covering a min raise amount?","<rules>"
"Counting outs? Any websites provide this?","<nlhe><odds>"
"What are the odds of flopping a straight flush with 62s?","<odds><probability>"
"Should I have folded near the end of this tournament?","<nlhe><tournament><strategy>"
"Bully short stacks later on or try knock them out?","<sit-and-go>"
"Order for revealing hands with multiple side pots in play","<texas-hold-em><side-pots>"
"Term for when all players go all-in and show hands","<all-in><terminology>"
"What is the best TH Poker Strategy (Math Based)?","<texas-hold-em><poker-strategy>"
"Is there a situation where just calling is justified with AK on a QKA suited flop?","<texas-hold-em><betting-strategy>"
"Why some people all-in in the VERY first hand?","<betting-strategy><all-in>"
"Cashing out deposit on Pokerstars","<online><tournament>"
"What are the measures you should useto tell how well you're doing in a tournament?","<online><tournament>"
"Calculating equity of ranges","<range><equity>"
"How long does it usually take for an online tournament to start?","<texas-hold-em><online><tournament>"
"Probability of x pocket pairs at a table of n people (NLHE)?","<texas-hold-em><nlhe><statistics><pre-flop><probability>"
"Facing an all in","<rules><cash-game>"
"Pot odds for chasing a flush against unknown opponent","<poker-theory>"
"how does zynga poker works","<texas-hold-em>"
"How do you know that you ""got your money in good""?","<betting-strategy>"
"Four of a kind and Three of a kind at the same time. What are the odds?","<texas-hold-em><odds>"
"What is the minimum raise after an all-in?","<texas-hold-em><no-limit><all-in><sit-and-go><raise>"
"Table talk strategy","<live>"
"How do online poker sites make money?","<online>"
"How do you play at a table where everybody always goes all in?","<texas-hold-em>"
"In what situations will you lose the low-pot in Omaha Hi/Lo while holding Ace-Deuce?","<poker-theory><reading-hands><omaha-hi-lo><nuts>"
"Where do you get poker videos?","<wsop>"
"How to make the most of a very good hand when you've been playing conservatively?","<texas-hold-em><betting-strategy><no-limit>"
"Number of hands played by a November Nine?","<texas-hold-em><tournament><hand-history><wsop>"
"Is Harrington's zones strategy still valid at the end of a MTT tournament?","<tournament><strategy>"
"No-Limit Holdem Partial Raise Clarification","<texas-hold-em><rules><no-limit><raise>"
"Is it correct to go all-in when you have KK?","<texas-hold-em><online><cash-game><all-in><pocket-pair>"
"pineapple open face chinese shooting the moon","<open-face-chinese><pineapple><shoot-the-moon>"
"1/2 NL Decision","<live><no-limit><nl200>"
"Why in online games do cards belonging to players sat out remain live until a response to a bet or raise is required","<online><tournament>"
"Preflop game in 50/50 sit'n'go","<texas-hold-em><no-limit><pre-flop><sit-and-go>"
"Split staight between players","<texas-hold-em><reading-hands>"
"Talking during a hand","<rules><home-game><sit-and-go>"
"Are both a straight and a full-house possible on the same flop?","<probability>"
"Live NLHE Tournament Chip Denominations","<nlhe><tournament><live>"
"5card Jacks or better","<rules>"
"Is there a rule variation where only a single high card (not 2nd,3rd etc.) is used to resolve 2 flush hands?","<texas-hold-em><rules><reading-hands>"
"Studying poker math - is it worth it?","<poker-theory><tournament><learning><pot-odds>"
"Should this hold'em pot be split?","<texas-hold-em><rules><reading-hands>"
"bluffing when somebody is all-in","<tournament><betting-strategy><strategy>"
"Best strategy you know of for winning at texas hold'em","<texas-hold-em><poker-theory><betting-strategy><strategy><poker-strategy>"
"Do you have any ""in-hand"" thinking procedures?","<poker-theory>"
"How is the pot split in this texas holdem hand?","<texas-hold-em>"
"Why did I lose with a flush in Omaha?","<rules><omaha>"
"Calculating odds with 2 cards to come","<odds>"
"Multiple Chip Betting TDA rule 43","<nlhe><tournament><rules>"
"Run it more than once","<cash-game><all-in><etiquette>"
"What determines who finishes in a paid position after Hand-for-Hand play?","<tournament><bubble>"
"What is the nature of Omaha starting hands?","<poker-theory><omaha-hi-lo><omaha>"
"Miracle Full House Beats Me","<texas-hold-em>"
"Texas Holdem Scenario... Is this possible?","<nlhe>"
"What are the chances of losing with a King high Straight Flush?","<nlhe><probability>"
"Bigger than Big Blind","<tournament><rules>"
"How precise is math in the heat of battle?","<tournament><cash-game><statistics><gaming-theory>"
"How do I calculate the odds of making a four of a kind by the river given I have a pair?","<odds>"
"Is using American Sign Langauge against the English only rule?","<rules><asl>"
"Number of game tree nodes in HU","<betting-strategy><gaming-theory>"
"Is chopping the blinds accepted everywhere?","<rules><blinds>"
"Missing the flop with AK","<statistics><standard-deviation><sd>"
"Kill game, how does it change your starting hand value?","<poker-strategy><kill>"
"Are there any good strategies for dealing with relentless bettors?","<nlhe><betting-strategy><poker-strategy><table-image>"
"Can an Ace be low in a straight?","<texas-hold-em><reading-hands>"
"How to use poker odds calculators?","<texas-hold-em>"
"Bankroll Management on a Monthly Budget","<bankroll-management>"
"I lost and i dont get why, can any one help?","<texas-hold-em><rules><reading-hands>"
"Do you HAVE to show your cards in an all-in heads up situation?","<texas-hold-em><rules><heads-up>"
"Maximizing post oak bluff rate","<betting-strategy><cash-game><post-oak-bluff>"
"How Gus Hansen came up with 30%?","<betting-strategy><books>"
"Do odds depend the the number of hands folded preflop?","<texas-hold-em><odds>"
"To steal the pot, how much should I bet if first to act post-flop?","<betting-strategy><no-limit><sit-and-go>"
"Correct way to play Three of a Kind in the flop","<texas-hold-em>"
"What would happen in a professional tournament if a player was obviously taking performance enhancing drugs?","<poker-theory><etiquette>"
"Good holiday gifts for poker players?","<texas-hold-em>"
"Metrics on time to make decisions in live play?","<texas-hold-em><rules><etiquette>"
"MTT -- math point of view","<tournament>"
"What tie breakers exist?","<hand>"
"What do you study for poker? What do you focus on?","<poker-theory><poker-strategy>"
"Pineapple open face chinese Initial layout","<open-face-chinese>"
"Cost Effective Ideas for Promoting a Poker Wiki?","<texas-hold-em>"
"What is the maximum number of players in Texas Hold'em?","<texas-hold-em>"
"Do Odds Change if Count of Players at Table Change?","<odds>"
"What is the correct calculation to make various combinations of Hold'em hands?","<texas-hold-em><odds>"
"Must you show your cards if you are playing the board?","<texas-hold-em><rules>"
"Get all-in on a steal by a deep stack with avg hand","<texas-hold-em><tournament><no-limit>"
"Calculating Poker Outs","<texas-hold-em>"
"ZOOM FR NL2 - AA on wet board","<texas-hold-em><cash-game>"
"Should I have bet this river? - KK vs potential flush","<texas-hold-em><betting-strategy><no-limit>"
"Is Christmas a good day to play poker?","<casino>"
"What should a new player memorize?","<texas-hold-em><odds><learning>"
"What happens if the last two live players fold at the same time?","<texas-hold-em><rules><cash-game><no-limit>"
"Nut flush draw shove","<drawing>"
"Problem with a hand in Texas hold'em","<hand-history><no-limit><game-mechanics><hand-reading>"
"Pocket Tens vs Pocket Jacks","<texas-hold-em>"
"Who has advantage if one player is known to have an Ace?","<texas-hold-em><poker-theory>"
"Final table shuffle in MTT","<mtt>"
"Am I obligated to show my cards if I get called and we go to showdown?","<texas-hold-em><muck>"
"MTT - flush draw vs loose big'o'stack","<texas-hold-em><tournament><mtt><fold-equity>"
"Should I slow play a set?","<texas-hold-em><cash-game><nl200>"
"Best way to put your poker learning into a cohesive plan?","<texas-hold-em>"
"Poker Practice - Preflop All In","<online>"
"Tournaments: how to determine rankings if multiple players are knocked out in the same hand?","<rules><tournament>"
"How to size an opening raise in a NLHE tournament with antes?","<nlhe><tournament>"
"What are the advantages gained by those who cheat?","<online><poker-tools>"
"Evaluating tourneys on both rake and prize pool?","<tournament>"
"Odds of predicting the flop (twice!!)","<texas-hold-em>"
"Dealer cheating, why is rolling the deck bad practice?","<rules><dealing><cheating>"
"Preflop action when you hold good pocket pair or draw","<texas-hold-em><poker-theory><betting-strategy><poker-strategy><learning>"
"Probability of flopping straight flush","<texas-hold-em><probability>"
"Would someone adept at Online Poker be just as good at Casino Poker?","<online><strategy><casino><skill>"
"What exactly happens when chip denominations are pulled in a tournament?","<tournament>"
"If you could design your own poker tools what would they look like?","<texas-hold-em>"
"Can I create freemium chip-based poker software without licence?","<software>"
"Mucked hand. who wins?","<texas-hold-em>"
"Defending a made hand, is it good to make a high bet?","<texas-hold-em><poker-theory><betting-strategy><strategy><poker-strategy>"
"How to play two pairs when flop is connected?","<nlhe><online><cash-game><no-limit><all-in>"
"Differences between playing microstakes and higher stakes","<nlhe><cash-game>"
"Does the % of winning when someone goes all-in count cards in hands which have been folded?","<texas-hold-em>"
"Good Poker AUDIO Books","<texas-hold-em><books>"
"How to play the flop when two aces appear?","<texas-hold-em><nlhe><online>"
"What is the right way to list tourney structure for a level?","<texas-hold-em><tournament>"
"Help with a tournament hand - KK in SB","<texas-hold-em><tournament>"
"What is a ""dead raise""?","<tournament><raise>"
"Minimum raise after flop","<texas-hold-em>"
"Choice of hands, would you choose 8/9 or 7/J","<texas-hold-em><range><hand>"
"High Card only count","<texas-hold-em><poker-theory><probability>"
"If there are no random numbers","<hand-history><starting-hand><hand>"
"What are the rules for when you're dealt in to an online poker game","<texas-hold-em><online>"
"Are there any forms of poker where some of your personal cards are displayed from the start of the hand?","<texas-hold-em><omaha>"
"What does ""across"" mean in poker?","<terminology>"
"Probability of flopping the unbreakable nuts","<texas-hold-em><nuts>"
"Bad Experiences with Online Poker Sites","<online><poker-tools>"
"Joining and rejoining a texas holdem poker game that is already in progress","<texas-hold-em>"
"All-in, pre-flop with AK... twice. Was that a bad decision?","<cash-game><pre-flop><all-in>"
"Proper way to dispute a dealer's actions","<etiquette>"
"At least one ace","<texas-hold-em><poker-theory>"
"Poker Ready Reckoner","<texas-hold-em><poker-strategy><poker-tools>"
"Can I bet on who I think will win the hand at a casino?","<cash-game><etiquette><casino>"
"Going from two to three players and back again. Texas holdem ring game","<texas-hold-em><blinds><dealing>"
"How to play bottom pair in middle position?","<nlhe><online><cash-game><no-limit>"
"Is this a bug on PokerStars?","<texas-hold-em>"
"Does 'super stillness' emphasize strength or weakness?","<betting-position><tells>"
"Giving off subtle, fake tells to sharks. Possible strategy?","<tells><pocket-pair>"
"For online play what are the benefits of reloading your stack below a certain limit","<online><bankroll-management>"
"Cash outs, are they always in cash or are there other options?","<casino>"
"how to get nice reports easily from poker tracker 4?","<texas-hold-em><no-limit><pokertracker>"
"What kind of results are people getting with short stack strategies in no limit holdem?","<texas-hold-em><no-limit><short-stack>"
"Flopping a Set with pocket Sevens, was it played correctly?","<texas-hold-em><cash-game>"
"Split Pot question?","<texas-hold-em><reading-hands>"
"Missing the blinds in heads up play","<texas-hold-em><heads-up><blinds>"
"Question of declaration in Texas Hold em","<texas-hold-em><rules>"
"Late live MTT: critique the play","<all-in><mtt>"
"is this a misdeal?","<live>"
"What is the difference between limit and no limit starting hand rankings?","<no-limit><starting-hand>"
"Distinct head-to-head match ups in holdem","<texas-hold-em><odds><no-limit><starting-hand>"
"looking to see what card would have come","<texas-hold-em>"
"Hands when playing Omaha","<rules><reading-hands><omaha>"
"Equity calculation","<probability><equity>"
"What benefits would there be for a site to be rigged","<online><bankroll-management>"
"Why do some Texas Hold Em ring tables have an ante","<texas-hold-em><online><cash-game>"
"Are penny tables worth the trouble","<online><bankroll-management>"
"Probability Of Getting A Straight Flush Or Royal Flush When Holding QJs","<texas-hold-em><poker-theory><statistics><probability>"
"Re-raise multiple times with differing amounts?","<rules><raise>"
"Playing PL Omaha","<rules><rush-poker><omaha><reading-hands>"
"The loser has a 2 pair over a one pair","<rules><reading-hands>"
"Is playing safer poker, safer?","<texas-hold-em><strategy>"
"How to play when you hit a straight","<texas-hold-em><nlhe><online><cash-game><no-limit>"
"Showing your cards rules","<cash-game>"
"Why would a player ask how many chips another player has during a hand?","<poker-theory><betting-strategy><poker-strategy>"
"importance of psychological factors in poker?","<psychology>"
"Kicker cards - and splitting pots","<texas-hold-em><rules><reading-hands>"
"Is it possible to become a millionaire in $ with online poker?","<online>"
"Mucking a winning hand","<rules><muck>"
"Trips vs flush draw on the turn","<nlhe><cash-game><all-in>"
"Two Pair - what beats what","<texas-hold-em><rules><reading-hands>"
"Can I use the board's cards to have the best kicker?","<texas-hold-em><rules><reading-hands>"
"All in situation with side pot","<all-in><side-pots>"
"Set vs completed draw on the river - NL2","<texas-hold-em><nlhe><cash-game>"
"Two playes have same straight but one has two cards of it in hand","<rules><reading-hands>"
