title,tags
"Aces cracked promotion, good for the collective or good for the individual dilemma?","<betting-strategy>"
"What to do when I have a bad hand and everybody is checking?","<poker-strategy>"
"Flush draw against very aggressive player","<texas-hold-em><nlhe><cash-game><all-in><drawing>"
"Bluff psychology","<texas-hold-em><betting-strategy>"
"What's the minimum raise rules of NLHE","<nlhe><rules><raise>"
"Conversion of hand history from unsupported site","<hand-history><holdem-manager>"
"Should I have called an all-in with KK against a TAG?","<nlhe><cash-game><live><hand-history>"
"Is the play dead if the player throws his cards face up before calling?","<texas-hold-em><rules>"
"Should I call 3 bet when having two pair?","<nlhe><online><cash-game><no-limit>"
"Can I use HM Hud to show aggregate stats of players?","<holdem-manager>"
"Can I toggle on/off the HUD display?","<holdem-manager>"
"Calling out tells","<etiquette><tells>"
"current tournament position on pokerstars mobile","<tournament>"
"How can a poker player alter their strategy to exploit java.util.Random","<online>"
"Who won in this scenario? Both players have a pair","<texas-hold-em><rules><hand-reading>"
"Amount to cashout when building a bankroll","<texas-hold-em><cash-game><bankroll-management>"
"Texas Holdem questions","<no-limit><hand-reading>"
"Are there statistics that show the percentage of times you should fold at each stage of Texas Hold'em?","<strategy><statistics>"
"Can I raise the blinds without seeing my cards?","<texas-hold-em><blinds>"
"Play every hand or not","<tournament><soft-question>"
"Are online poker sites rigged?","<online><poker-theory><cheating>"
"Meaning of throwing or motioning with a card protector","<texas-hold-em><rules><tournament>"
"Advice for exploiting Sucker Reputation","<poker-strategy><psychology>"
"Raked Game Strategy","<casino><rake>"
"Can somebody tell me whom wins in this poker flush?","<texas-hold-em><hand-reading>"
"Revealing hand thinking bet was covered","<tournament>"
"Odds of three people at a 9 ring game having the same hole cards","<odds>"
"All in when you are chip leader","<all-in>"
"What actions can I take to safely convince others that I am a bad player?","<tells>"
"Specific Hand recommended action","<texas-hold-em><betting-strategy><betting-position><pocket-pair>"
"Push/Fold situation","<texas-hold-em><tournament><short-stack><final-table><fold-equity>"
"Stack sizes and perceived ranges","<range><short-stack>"
"How can I improve my MTT end game?","<tournament><live><no-limit><casino><mtt>"
"Out, how do you calculate them?","<poker-theory>"
"Chipping Up while playing Texas Hold Em","<texas-hold-em>"
"Odds Calculation Texas Hold'em","<texas-hold-em><odds>"
"Do all players have to show their hand if they check on the river?","<texas-hold-em><rules>"
"What are the odds of winning a tournament?","<tournament><odds>"
"Multiple Table Online Play","<online><tournament><poker-strategy><sit-and-go>"
"Should I go all-in with AAs in this situation?","<nlhe><cash-game><nl200>"
"What tendencies should I be looking out for and how can I use that information to my benefit?","<strategy>"
"How does a HUD work?","<software><hud>"
"How to deal with a table that always calls?","<texas-hold-em><betting-strategy><no-limit><home-game>"
"Betting strategy based on full information","<tournament><betting-strategy>"
"Is it good/practical to calculate EV, odds, etc. during games, or only when reviewing them afterwards?","<poker-theory><poker-strategy>"
"Can a decision be both + and - EV?","<strategy><statistics>"
"did we tie with a straight in texas hold'em? Or did I win?","<texas-hold-em><rules>"
"Who wins in this flush vs. flush hand?","<texas-hold-em>"
"How to Play Poker on many tables at the same time?","<texas-hold-em><poker-theory><poker-strategy><poker-tools>"
"How to decide winner between equal double pairs in Texas holdem?","<texas-hold-em><poker-theory>"
"Bar room free roll poker","<rules><live><etiquette><soft-question>"
"Tournament Strategy - When to flip?","<nlhe><tournament>"
"Odd for drawing an 8 in 5 card stud","<odds>"
"Can a player expose his cards to another player in a no limit texas holdem tournament?","<texas-hold-em>"
"What are the actual odds of being dealt pocket Aces?","<texas-hold-em><probability>"
"A Hand history: Navigating QQ","<nlhe><hand-history>"
"Hold'em hybrid dealing","<home-game>"
"How to play if you hit a straight on flop?","<nlhe><online><cash-game><pocket-pair>"
"What is an optimal ratio of buy-in stack amt. to blind amt. for a 2hr+ home game?","<rules><home-game>"
"Raising and multiple All-Ins","<rules><no-limit><all-in><raise>"
"How can I view the list of available games on Poker Stars?","<online>"
"How to calculate preflop equity in hand vs hand","<pre-flop><hand><equity>"
"Poker Tournament Application - Chip Logic","<poker-theory><poker-tools>"
"What is the best approach to playing against an aggressive player?","<poker-theory><poker-strategy>"
"Odds of consecutive hands being identical","<hand>"
"Checking from behind","<texas-hold-em>"
"Websites where you can input your hand histories for them to give you stats","<hand-history>"
"How do you deal with devastating bad beats?","<cash-game>"
"Should I ever reduce / cash out money from my stack when playing NL Holden cash games?","<bankroll-management>"
"Why this pot is split?","<texas-hold-em><online><rules><poker-theory>"
"How should I approach a zoom game where it feels like opponents always seem to flop better hands (big raises)","<strategy>"
"How to commit to think like a winner, instead of playing for maximizing emotional comforts?","<learning>"
"A pair versus ""suited"" overcards","<odds>"
"Formula not checking out under certain conditions","<odds><pot-odds><drawing>"
"Percentage chance of flopping straight or flush draw for suited connectors","<odds>"
"VPIP at Micro / Freeroll Stakes","<texas-hold-em><tournament><betting-strategy>"
"Should this holdem hand result in a split pot?","<texas-hold-em><poker-strategy><learning><hand><drawing>"
"What is the origin of the all-in bet?","<all-in><poker-history>"
"Bankroll strategy","<cash-game><bankroll-management>"
"Showing cards with one player all-in but other player active","<nlhe><rules><tournament><all-in>"
"C Net Adjusted, What does it mean? Should it be low or high?","<tournament><statistics><pokertracker><icm>"
"Card off the table by a player","<texas-hold-em>"
"What is theTop Five Cards rule and how does it apply to splitting pots?","<texas-hold-em>"
"All-in rules in extreme cases","<rules><all-in><raise>"
"What is the name of the Poker TV Show","<texas-hold-em>"
"What are practical differences between 8-max and 9-max tournaments?","<poker-theory>"
"What happens when you have the same pair and same kicker","<texas-hold-em>"
"Tallying monte carlo simulation and ties for Texas hold'em","<texas-hold-em><odds>"
"Is there statistically any combination worse than 2 7 offsuit for preflop Texas Hold'em?","<texas-hold-em><statistics><pre-flop>"
"Playings AA's deepstack vs drawing hands","<tournament>"
"Which pair wins?","<texas-hold-em>"
"Is it mandatory to show a hand at showdown to split a pot when playing the board?","<texas-hold-em><rules>"
"Straight draw in heads up?","<texas-hold-em><reading-hands><probability><heads-up>"
"Omaha: Interesting dealer mistake at showdown","<rules><cash-game><omaha>"
"Tournament play, what would you do?","<texas-hold-em><tournament>"
"No Limit Texas Holdem 6 max vs full ring (9 player) PF Range","<cash-game><pre-flop><range>"
"Did I play this AK hand well?","<texas-hold-em><online><cash-game>"
"Legality of Bovada and online poker moving forward in the U.S","<online>"
"Bayesian statistics","<texas-hold-em>"
"equity issue with equity calculator software","<nlhe><equity>"
"Pair of Jacks at the final table","<poker-strategy>"
"What is representative number of hands played?","<texas-hold-em><online>"
"Can I showdown early","<texas-hold-em><rules><fold-equity>"
"How to deal with the fast rate of play online","<online>"
"Avg equity on flop vs range","<software><equity>"
"exact same card back to back to back","<odds>"
"Best zoom poker bot strategy","<poker-strategy>"
"Ideal bet size based on EV","<poker-theory><ev>"
"How are cards dealt when you get Fantasy Land in OFC?","<dealing><open-face-chinese>"
"How many ways to shuffle a standard deck of 52 cards?","<poker-theory><odds>"
"Video poker RTP","<poker-theory>"
"If you put chips out but don't say anything while it's your turn, can you take them back, even if you didn't say anything?","<texas-hold-em>"
"Best 5 cards and the kicker","<texas-hold-em>"
"NL Hold Em coming into the blind","<poker-theory>"
"22-66 versus AK, AQ - how to avoid coinflips?","<poker-strategy>"
"What is more profitable in a long run: cash games or tournaments?","<tournament><cash-game>"
"""Waiting for a better spot"" in tournaments","<tournament><poker-theory>"
"What is the minimum amount which can be raised to after a bet and a raise in front?","<cash-game><raise><bet-sizing>"
"who wins if everyone has a pair","<rules>"
"Confusing hand in a Texas Hold em","<texas-hold-em><poker-history>"
"texas holdem split pot","<texas-hold-em><poker-history>"
"PFR (preflop raise) statistics calculation with raise + 4bet in one single hand","<statistics><pre-flop><raise><pokertracker><hud>"
"How do you trust on the online poker site when playing online?","<online>"
"Raising with two pair in 5 card draw?","<5-card-draw>"
"Text Based Poker Game","<poker-tools>"
"Eliminating two players from a four-hand hold'em play","<rules><blinds><button>"
"What are the odds of having 2 Quads in the same hand?","<texas-hold-em><tournament><probability>"
"Up & Down Straight Draw VS Flush Draw Comparison","<texas-hold-em><drawing>"
"Should I have gone all in on Flop with bottom pair and flush draw?","<texas-hold-em>"
"When do you feel its time to take your chips and go home?","<strategy>"
"AAA flop, KJ holding against very aggressive player","<texas-hold-em><hand-history><hand-reading>"
"How to fish with nuts?","<texas-hold-em><nuts>"
"Confusion on Poker Hand concerning high card","<texas-hold-em><poker-strategy>"
"What is the best way to play online tounaments?","<poker-strategy>"
"Do I have to show all players if I show to one?","<texas-hold-em>"
"Player allowed to play for main pot after folding during side pot action?","<texas-hold-em><rules><side-pots>"
"What is the probability of seeing a royal flush and a four of a kind in the same round with ten players?","<probability>"
"Looking for advanced poker tutorial strategies","<betting-strategy>"
"What's the penalty for coaching at the table?","<texas-hold-em>"
"Who wins if two players have a straight?","<rules>"
"Poker Main Pot is 100 and split in 3","<rules>"
"How much should you bet to bluff a huge nuts?","<texas-hold-em><betting-strategy>"
"What is Teddy KGB's tell?","<texas-hold-em><tells>"
"NL100: Top Pair weak kicker facing Turn barrel","<texas-hold-em><hand-history><nl100><rush-poker>"
"Is there a hand gesture for calling?","<etiquette>"
"What impression does a smile give?","<tells>"
"Tips for my first Live Tournament","<tournament>"
"Re-entry vs Re-buy in multi table tournaments","<poker-strategy>"
"TT close to bubble in SnG with a good stack","<tournament><sng>"
"What are the odds of making a royal flush after the flop in Texas Hold 'Em?","<texas-hold-em>"
"How to Prevent Blinding Out","<tournament>"
"How to improve my game","<texas-hold-em><cash-game>"
"Looking for a software is able to simulate each situation and verify the results of Texas Hold'em","<texas-hold-em><software>"
"Wrong decision?","<texas-hold-em>"
"How does All In work?","<all-in>"
"In Teaxs Hold'em 3 players in the hand","<rules>"
"Who is the winner","<rules>"
"5 cards draw odds","<odds><probability><5-card-draw>"
"Why did I lose this poker hand?","<texas-hold-em>"
"Bad move/bet or tilt situation?","<texas-hold-em><psychology>"
"Pokerstars confiscating my funds","<poker-tools>"
"1/3 NL Live Bad Beat Jackpot","<live><no-limit>"
"Where can I find poker hand histories?","<game-mechanics>"
"Chances of winning tournament vs Entries?","<tournament>"
"What's the Probability of hitting the board on the Turn or the River","<odds><statistics>"
"When should I move up from Freeroll MTT's?","<texas-hold-em><tournament><mtt>"
"Can anyone suggest a limit holdem training app for Android?","<texas-hold-em><odds><probability>"
"Full House vs. 2xThree of a Kind Texas Holdem","<texas-hold-em><rules><poker-theory><full-house><3-of-a-kind>"
"Dealer's Choice - What type of games should one choose?","<poker-strategy><home-game>"
"Flush in Texas holdem","<poker-theory>"
"Why no split-pot when the communal cards are strongest?","<texas-hold-em>"
"term for when players go all-in and show hands","<texas-hold-em>"
"Fundamental Theorem of Poker vs Morton's Theorem","<poker-theory><gaming-theory>"
"What are some good smartphone apps to help dealing with tilt?","<software><psychology>"
"Side pots without eligible winners","<rules><side-pots>"
"Playing PokerStars from US","<online><poker-stars><gaming-law>"
"Quantified-self devices to measure tilt","<poker-tools><psychology>"
"What is the correct ruling?","<fold-equity>"
"Probability of two players getting identical starting hands","<texas-hold-em><probability>"
"Looking for mathematical paradoxes in Poker","<poker-theory><poker-strategy><all-in><ev>"
"Cards Mucked Or Not?","<texas-hold-em>"
"SNG $0.25, Trip aces with weak kicker on River","<tournament><sng>"
"Are there names/terms of Hold'em above the level of hands?","<texas-hold-em>"
"Can I Bet and Call Blind","<texas-hold-em><rules><tournament><etiquette>"
"What are the percentage for running into AA if you have KK?","<online>"
"Bluffing on a two player table","<texas-hold-em><betting-strategy>"
"SNG $0.25 45-man, huge combo draw","<tournament><sng>"
"Most Profitable Online Stakes","<online>"
"Playing on a number of tables at one go","<online><poker-strategy>"
"Online Poker Results","<software>"
"books or articles on methodically analyzing hand history","<hand-history><books>"
"mental hand history?","<hand-history><psychology>"
"Probability of making two pairs (Hold'em)","<texas-hold-em><probability>"
"Big blind betting in tournaments","<texas-hold-em>"
"Question about this Hand","<rules>"
"Who wins the pot when","<texas-hold-em>"
"Rockets in the BB position, 6 handed, table folds","<texas-hold-em><betting-strategy><strategy>"
"PokerStars have banned the use of PokerTracker 4. Why?","<online><poker-tools>"
"Card flip on deal. Misdeal or next card?","<texas-hold-em><rules><dealing>"
"Does software exist that will analyze my previous hands and tell me what it thinks I did wrong?","<poker-tools>"
"How to play top pair with flush draw on the flop?","<nlhe><online><microstakes>"
"Can you play ""destructive""?","<poker-strategy>"
"How to play a pair against a maniac?","<nlhe><online><no-limit><microstakes>"
"using poker bots and top poker bots","<poker-strategy><poker-tools>"
"Kicker on high card","<texas-hold-em>"
"Can You Win a Long Tournament Without Major Suckouts","<texas-hold-em><tournament><probability>"
"Raise/ Re-raise in No Limit Hold Em?","<texas-hold-em><betting-strategy>"
"Mucking hand face up","<rules><reading-hands>"
"Who gets the side pot?","<texas-hold-em><nlhe><rules><side-pots>"
"how to play in a table which play so loose and mostly limp without any kind of standards?","<texas-hold-em>"
"Why decide whether or not to run it twice based on what the opponent has?","<all-in>"
"Beginner tips and tricks","<betting-strategy><poker-strategy><strategy>"
"How does number of player affect the probability of a hand winning a round?","<probability>"
"Can the same player check and after re-raise (do all-in) at river?","<rules>"
"Cash Game situation","<texas-hold-em><cash-game><hand-history>"
"What are the odds of facing AA or KK when holding AK? And odds of facing AK when holding AK","<texas-hold-em>"
"All-ins and folds: what happens to folded money?","<texas-hold-em><side-pots>"
"How to analyze why I am losing?","<hud><microstakes>"
"How to play AQ on flop against maniac?","<nlhe><online><cash-game><microstakes>"
"What's the optimum time to enter a tournament with late registration AND a later add-on?","<tournament><live><strategy>"
"Why Collin Moshman 3-bet that high?","<pre-flop><sit-and-go>"
"How do I keep note of poker hand so I can benefit of it at the same hand?","<online><hand-history><range>"
"Betting rounds in heads-up Texas holdem?","<betting-position>"
"Four to a flush with suited hand and two community cards, opponent raises, what to do?","<texas-hold-em><poker-strategy>"
"Avoid Costly Mistakes","<online>"
"How to mathematically calculate equity","<texas-hold-em><poker-theory><omaha>"
"What size bet to take away pot odds?","<pot-odds>"
"Poker winning hands","<texas-hold-em>"
"Does the order of posting the missed blinds in texas holdem matter?","<texas-hold-em><blinds>"
"Probability of forming a flush question (dependent vs independent event)","<texas-hold-em><probability>"
"150+15 live early with TP+FD","<texas-hold-em><tournament><hand-history><live><no-limit>"
"Reasoning behind assumptions in Independent Chip Model","<sit-and-go><icm>"
"Value of Speculative Hands","<implied-odds>"
"Should I have shoved all in on this flop?","<poker-theory><hand-history><odds>"
"Hold'em Manager for Mac alternative?","<poker-tools><holdem-manager>"
"Decision, is the hand dead","<rules><tournament>"
"Best mental state for playing","<psychology>"
"Why do people call/raise with poor hands on preflop?","<pre-flop>"
"Push or just call on the turn with trips against an over-pair and you know it?","<texas-hold-em><nlhe><tournament><no-limit>"
"What happens if there is royal flush on board","<texas-hold-em><rules>"
"Bet size according to the chances, is it a correct approach?","<betting-strategy>"
"Alternative to Dirty Dozen jackpot SNGs?","<online>"
"Holding a pair and two pair are on the board. Who wins?","<pocket-pair>"
"In Seven Card Stud, the dealer missed dealing the last cards and shuffles the deck","<rules><home-game><dealing><dealer><seven-card-stud>"
"Aggression vs cheap flop","<texas-hold-em><online>"
"Pot Odds Paradox in Short Stack","<texas-hold-em><betting-strategy><all-in><pot-odds>"
"Chance formula for Texas Hold'em","<texas-hold-em><poker-theory><poker-strategy>"
"Spin and Go Strategy","<online><short-stack>"
"Five cards rule and ""kicker"" in flush","<learning><hand>"
"Ask for the size of the pot","<rules>"
"What are the odds of a at least a certain amount of aces being dealt depending on the number of players?","<odds><probability>"
"Playing 99 in early position","<poker-strategy><betting-position><pocket-pair>"
"Building specific situational calcualtion of pot equity and chance of winning. Setting up the formula.","<texas-hold-em><poker-theory><poker-strategy><statistics>"
"Calculate full number of 7 card combinations beaten by my 7 card combo in texas poker","<texas-hold-em>"
"Anyone heard of this game?","<poker-history>"
"Who will win, 2 pairs on the table or one pair in hand and one pair on the table?","<rules><hand>"
"Squeeze Play - What and How","<betting-strategy><odds>"
"Full House..highest trip or card?","<nlhe><rules>"
"Dealing with the desire to play weak hands","<psychology>"
"How to determine the winning hands in poker?","<texas-hold-em><rules><reading-hands><omaha-hi-lo><omaha>"
"texas holdem question on split pot","<texas-hold-em>"
"Questionable Tournament Rule With Two Players Left","<texas-hold-em><rules><tournament>"
"Pocket Aces at a 8-10 Player Table","<poker-theory><odds>"
"Full House v. Quads","<poker-theory><odds><poker-strategy>"
"It was called ""Shimoka Man""","<rules>"
"could i have prevented losing to this set?","<texas-hold-em><nlhe><tournament>"
"Rules for mucking cards","<rules>"
"Poker side pots and dead money","<rules><all-in><side-pots>"
"Betting in all in situation","<all-in><raise>"
"side pot scenario","<texas-hold-em><rules><all-in><side-pots><drawing>"
"How to improve your heads up game","<poker-theory><poker-strategy><heads-up>"
"Holding suited connectors odd of flopping 2 pair or better","<probability><pre-flop>"
"Best statistical hand","<texas-hold-em>"
"Late Small Casino Tournament play","<nlhe><tournament>"
"How to play multi screen","<poker-strategy>"
"On the turn pot odds to call versus outs","<probability>"
"Short stack UTG action","<live><short-stack>"
"River vs cards in hand","<texas-hold-em><prize-pool>"
"Is there CAD table on pokerstars?","<online>"
"Probability in poker","<probability>"
"Question of the interpretations of Pot Odds and Pot Equity, MATH","<poker-theory><odds><pot-odds>"
"Chips running out playing tight","<poker-strategy><final-table>"
"Can an ace be used at the bottom of a hand besides 5,4,3,2,A?","<rules>"
"Betting strategy with a straight flush draw, ended up losing to a higher flush","<texas-hold-em><betting-strategy><hand-history><no-limit>"
"Strategy for Tournaments without Antes","<no-limit><mtt>"
"Rule for advancing the button when SB bust","<rules>"
"Moving up limits. a bankroll problem?","<bankroll-management>"
"Is this normal? Below EV","<ev>"
"All Players SItting Out","<dealer>"
"What's this difference in the pot?","<hand-history>"
"Texas hold em raising","<texas-hold-em>"
"How to plan IP when having two pair?","<nlhe><microstakes>"
"How to play against a fish when having straight","<nlhe><microstakes>"
"4 to one suit one a hold em board?","<texas-hold-em>"
"Set with a draws on the flop","<betting-strategy>"
"Do i split the pot?","<home-game>"
"Bet sizing to get all their chips","<betting-strategy>"
"Who wins at this hand below","<texas-hold-em>"
"Full House and 4 of a Kind in the Same Hand","<full-house>"
"Realistic Community Cards","<probability>"
"Mathematically speaking, is open-limping that bad?","<texas-hold-em><no-limit><gto>"
"When does a kicker count?","<texas-hold-em>"
"Who wins the pot or will it be a Split?","<rules>"
"Two straights and a pair who wins?","<texas-hold-em>"
"Detailed explanation of ICM?","<icm>"
"When taking pot odds into account after the flop, use chance of hitting with next two cards, or just the next card","<texas-hold-em><poker-theory><betting-strategy><odds><pot-odds>"
"Rules when dealer flips river early","<texas-hold-em><rules>"
"How to calculate SNG push/fold range using JAVA/C++?","<sng>"
"when there is two straits who win?","<rules>"
"Decrease in utility playing in same stakes (I stop caring about the amount of winning after some time)","<bankroll-management><psychology><microstakes>"
"Is playing online poker with multiple accounts an advantage?","<online>"
"7 card no peek rules","<rules><strategy>"
"How good is it to call when you have no money in the pot?","<betting-strategy><pot-limit>"
"Pot Odds/Equity, percentage and ratio method","<pot-odds>"
"Second J on turn lower the chance that","<poker-strategy>"
"Poker Calculator","<odds><strategy>"
"Feature In A Poker Game","<texas-hold-em><strategy>"
"Collusion in real life poker games","<cheating>"
"Why to post big blind in online poker?","<online><poker-strategy><poker-tools><blinds>"
"Can people remember the cards that are played?","<poker-strategy><casino>"
"Fold in preflop but could win with a flush. How to deal in this situation?","<texas-hold-em><poker-strategy>"
"Calling to lure players into the pot","<betting-strategy>"
"3 card texas-hold-em hand","<texas-hold-em><rules>"
"Side pot with fold","<side-pots>"
"Zoom NL5: checking second nut flush on turn?","<nlhe><betting-strategy><rush-poker>"
"Why is Royal Flush listed separately from Straight Flush?","<terminology><poker-history>"
"How to play a straight or flush when the board pairs","<betting-strategy><betting-position>"
"What is meant by ""protecting"" your hand and when do you want to try to do it?","<betting-strategy><terminology>"
"How do you express the statistics of turn/river possibilities to make a hand?","<statistics>"
"Should I call overbet shove with top pair","<hand-history>"
"Why are there two blinds in Texas Hold 'em instead of just one?","<texas-hold-em><blinds>"
"How did i lose here when we both had flush J High?","<nlhe>"
"Who had the best time cards?","<texas-hold-em>"
"Can a player raise in the following scenario?","<rules>"
"All in question","<texas-hold-em>"
"Always preflop all in with JJ+? cash game","<nlhe><cash-game><pre-flop>"
"How often should I be seeing four of a kind statistically?","<texas-hold-em><odds><hand>"
"Is there a list of sites that generate pure random hands?","<hand-history>"
"Adjusting bet size based on table position","<tournament>"
"Why did i win a portion of pot in this hand?","<texas-hold-em><rules><hand><side-pots>"
"Safe strategy? In a simplified model of poker","<poker-strategy><probability>"
"Poker Strategy for all ins","<probability>"
"What do these action abbreviations mean?","<terminology><pokertracker>"
"public domain poker images","<texas-hold-em>"
"Hold'em: Why does K7 beat A2 more frequently than K8 does?","<texas-hold-em><probability>"
"When should I limp pre-flop?","<betting-strategy><pre-flop>"
"I'm getting into sit and go tournament finals so much, but how can I come first more?","<poker-strategy>"
"Who wins the pot?","<texas-hold-em>"
"Can some tell me which hand(s) beats the dealers hand in this game of poker?","<rules><learning>"
"Do you have show your cards at end of Texas hold'em hand if asked by person who won?","<texas-hold-em>"
"Got beaten three times by the same 4 of a kind, then won with a straight flush. In the span of 141 hands. What are the odds?","<texas-hold-em><probability>"
"How to recognize a straight draw?","<texas-hold-em>"
"in this Flush vs flush who wins + pairs in the 2 hands?","<probability><pocket-pair>"
"How do the broadcasters know what the hole cards are in televised poker","<poker-tools><wsop>"
"4 of a kind on board ( texas holdem poker )","<texas-hold-em><rules>"
