title,tags
"Can a dealer help and tell players their outs","<rules><dealer>"
"Why 99-9 stronger than Q-QQ for Ivey vs Moneymaker?","<rules>"
"Who wins the straight or do they split the pot","<texas-hold-em>"
"Worst possible matchup for aces pre-flop in pot limit omaha","<odds><omaha><pot-limit>"
"Is there a benefit to pre-checking in online poker?","<online><betting-strategy><tells>"
"Who wins or is it a split pot","<texas-hold-em>"
"Ante and Blinds","<blinds>"
"Soft play in a cash game","<rules><cheating>"
"Calculating poker odds without knowing opponents cards","<odds>"
"Dealing with excessive clock calls?","<rules><nlhe><tournament>"
"It`s split pot if","<texas-hold-em><rules><poker-theory><odds>"
"Extra burn card, hand played. Pot collection started","<rules>"
"3 pairs v.s. 2 pairs?","<texas-hold-em>"
"What ruling should be made when a verbal declaration is not heard by the dealer?","<texas-hold-em><rules><cash-game><live><no-limit>"
"Who wins in this case? Or is it tied?","<texas-hold-em>"
"What constitutes a call?","<rules><etiquette>"
"calling an all-in bet following the flop","<rules>"
"What is overlay?","<online><tournament>"
"poker hand probability","<odds>"
"Tournament play Texas hold-em","<texas-hold-em><tournament>"
"Ace high flush being beaten by full house","<texas-hold-em>"
"Short deck probability","<probability>"
"2-7 hand ranking","<hand>"
"Is there a way to submit / view data into pro poker tools from a mobile device?","<poker-tools><equity>"
"Who wins this hand? with a flush in comunity cards","<flush>"
"Revealing part of your hand","<rules>"
"Combining poker hand probabilities (Texas Hold'em)","<texas-hold-em><probability>"
"How to Calculate the Possibility of a Straight","<texas-hold-em><odds>"
"If someone offers you a large casino chip at a discount should you take them up on the offer?","<bankroll-management><casino>"
"Take advantage of your equity vs. Force opponent to make a bad play","<texas-hold-em><betting-strategy>"
"Who wins if a player mis-identifies their hand?","<rules><etiquette>"
"How to play the hand","<betting-strategy><poker-strategy>"
"Why does Dealer call over floor if there is 3 of a kind on the flop in live poker?","<nlhe><live><dealer>"
"What is a progressive clock?","<tournament>"
"What happens when straight is on board","<rules>"
"Hand analysis - all in","<poker-strategy><reading-hands>"
"Does ""touching the muck"" mean anything in a casino?","<rules><casino>"
"What are the odds of the river containing a full house?","<probability>"
"Can I fold in response to a call?","<live><showdown>"
"Who has the winning hand?","<texas-hold-em>"
"Probabilities for each high card hands in draw poker","<probability>"
"Swings in online poker","<odds>"
"Flush lowest-ranking card","<flush>"
"Dead raise in tournament","<rules><all-in>"
"Erratum in ""The Mathematics of Poker""","<poker-theory><poker-strategy><books>"
"Texas Holdem Rules","<rules>"
"What are the rules of a misdeal in casinos?","<texas-hold-em><rules>"
"What happens if I get all 5 cards the same?","<rules><hand>"
"Not announcing raise on purpose","<texas-hold-em><betting-strategy><etiquette>"
"What is the formula in getting Outs?","<online><poker-strategy><game-mechanics>"
"Agree not to play for a side pot","<rules><tournament>"
"Micro/nano skin implants to signal hole cards at the WSOP?","<texas-hold-em><live><wsop><cheating>"
"Folding with 3 of a kind on the flop?","<poker-strategy>"
"Obliged to show cards after post-river out-of-turn reveal?","<texas-hold-em>"
"Good online poker app to play with friends?","<software>"
"Texas hold'em - Counting outs - Why not consider a possible pair?","<texas-hold-em>"
"Odds of runner runner","<odds>"
"Speculative hand with a lot of draws","<odds><poker-strategy>"
"Crazy Hand WSOP","<betting-strategy><poker-strategy>"
"A detailed definition of a Donk Bet","<texas-hold-em><betting-position>"
"How to deal with players always betting big post flop","<poker-strategy>"
"Flush confusion","<flush>"
"Probability of flush on board and no player has a flush card","<probability>"
"Does a player get dealt a card if they fold out of turn?","<rules><home-game><seven-card-stud>"
"What are the odds of drawing the idiot end of the straight flush on the flop","<odds><flush>"
"PLO against 3 opponents. Board is 434 rainbow. What is the probability of someone having a 4?","<omaha>"
"Folding hands in hold 'em poker","<texas-hold-em>"
"I'd like some help with Badugi absolute strength calculator","<untagged>"
"Ruling on a non-standard check","<texas-hold-em><rules>"
"Odds Of Someone Having A Flush","<odds><probability>"
"How much should I buy in for when playing live?","<nlhe><cash-game><live>"
"Over pair in position","<poker-strategy>"
"What are the 5 card hand probabilities","<probability>"
"Straight hand in poker","<poker-strategy><strategy>"
"How should I proceed (in non-home games / with strange(unkown) people / in my online server) if I have to suddenly close a tournament?","<tournament><online>"
"Pre shove range","<poker-strategy>"
"Moving to offline poker tournaments after playing exclusively online","<live>"
"Probability your opponent has a pocket pair when you are paired versus not","<probability>"
"Flush on the board","<rules><learning><flush>"
"Are late registration / late entry poker tournaments the norm?","<tournament><online>"
"How much should I be tipping when I cash a live tournament?","<tournament><etiquette><dealer>"
"Can I get probability of winning a HU SNG tournament out of ROI % against an opponent?","<probability><sng><roi>"
"Oregon (USA) Poker Gambling","<gaming-law>"
"Flush rule in Texas holden poker","<flush>"
"Best method to mark the numbers onto poker chips?","<home-game>"
"HU you know your opponent will bet pre with any two cards - what should your range be","<betting-strategy><poker-strategy>"
"Question for beginners in Omaha","<omaha>"
"What is the precise definition of ""showdown""?","<rules><showdown>"
"Why do so few players play razz?","<online><poker-theory>"
"Can ""run it twice"" be a +EV in a long run?","<all-in><ev>"
"Any program/game/bot to play with?","<online><software>"
"Odds of King flush losing to Ace flush","<flush>"
"Poker pre-flop probability trainer","<texas-hold-em><probability>"
"Help with a hand analysis from more experienced players?","<hand-history>"
"Software to create combinations","<statistics><software>"
"Is there a theory of how a novice can be a favorite against a world class player with a stack advantage?","<poker-theory><short-stack>"
"Heads up with chip advantage but you are the weaker player","<betting-strategy><poker-strategy>"
"Does tipping happen at the highest level?","<tournament>"
"Player has 3 cards in his hand, declares at the river","<rules>"
"Draw lowball call","<5-card-draw>"
"Draw poker should you keep AK","<probability><5-card-draw>"
"What are the rules for talking when you are not in the pot?","<rules>"
"Rules for Full house","<poker-theory><poker-strategy><poker-tools><full-house>"
"How many people need to call to make a bet on a flush draw worthwhile?","<texas-hold-em><odds><pot-odds><flush><implied-odds>"
"Finding out my range","<poker-tools>"
"What are the top money making starting hands?","<starting-hand>"
"Texas Hold'em blind raises","<texas-hold-em>"
"Hand analysis no limit","<poker-strategy>"
"What should hero do with JJ overpair on the Flop against an ultra aggressive (perhaps maniac)?","<nlhe>"
"Unusual Tournament spot","<texas-hold-em><tournament><live><all-in><hand>"
"Occurence of heads-up in full table poker","<cash-game><heads-up><casino>"
"How should I play against a limpers?","<poker-strategy><strategy>"
"Strategy vs Donkey Supreme?","<poker-strategy>"
"How to alter play so a tournement ends sooner?","<tournament>"
"Top 5 Cards Question (Straight)","<texas-hold-em>"
"Playing omaha showing players hands. Would it be usefull for training purposes?","<software><omaha><training>"
"Probability of tie","<texas-hold-em><poker-strategy>"
"""Streets"" in holdem","<texas-hold-em><omaha>"
"Is speech final in Poker?","<texas-hold-em><rules><all-in>"
"Calculating Nash Equilibrium for HU NLHE push fold game","<poker-theory><poker-strategy>"
"Profitable players crazy all ins","<texas-hold-em><all-in>"
"What is a double belly buster?","<texas-hold-em>"
"Complete all-in rules of fixed-limit hold-em","<texas-hold-em>"
"Rules following a raise, then a shove for slightly more?","<texas-hold-em><pre-flop>"
"Additional Odds for Flush Draw, by hitting two paris or three of a kind, as well - How to calculate Runner-Runner?","<odds><pot-odds><drawing>"
"Is my hand live","<rules>"
"Who win this hand and why? Thanks!","<texas-hold-em>"
"I was light on a hand, namely six dollars short.","<texas-hold-em>"
"PokerStars Android - Cards History","<hud><poker-stars>"
"Whats your move on this hand?(KK) High Level Table","<texas-hold-em><cash-game><hand-history><live>"
"Poker bankroll management in cash game","<poker-strategy>"
"Did I play QQ correctly in this situation?","<nlhe><cash-game>"
"Why is short-stacker pot committed in this instance?","<no-limit>"
"Do you guys believe online poker room is a scam?","<texas-hold-em>"
"Where is Jeff Changeley","<tournament><live><casino>"
"What is minimum raise when starting a new round of betting in NLHE?","<texas-hold-em><rules><no-limit><raise>"
"Is it proper to tip the folks who manage the table list?","<etiquette>"
"Texas Holdem Poker No Limit betting rules, How does Bet, Raise and by what value it is increased?","<texas-hold-em><bet-sizing>"
"Was this a good all-in with trip 8s on the turn?","<texas-hold-em><no-limit><nl100>"
"Hand analysis could you lay this down","<tournament><nlhe><poker-strategy>"
"Putting Crazy Players on a hand","<all-in><betting-position>"
"Tying in a win the button tournament","<rules><tournament>"
"Odds of getting aces in PLO?","<odds><pot-limit>"
"Side pot rules on not equal hands","<texas-hold-em><rules><side-pots>"
"Drawing Dead Preflop?","<probability><pre-flop>"
"Why isn't every value player rich?","<probability><strategy>"
"Jason Platten 1234","<hand-history>"
"1/3 NL: Was going all-in against villain with AK the best choice?","<nlhe><live><nl200>"
"Ace to Six relative value of straight ""AKQJT""","<hand>"
"All in or fold strategy","<live><all-in><casino>"
"How do I calculate ""I break even if Villain folds this percentage of shoving"", including Fold Equity, in heads up play?","<fold-equity>"
"Pocket Jacks with two higher cards on flop","<poker-strategy>"
"All in player exposes cards in multiway pot when action is not over","<texas-hold-em><rules><all-in>"
"Trip Aces vs Possible Flush","<all-in><learning><flush>"
"Ace value in a low straight","<texas-hold-em>"
"Probability for 75% to 25% in Omaha8?","<omaha-hi-lo>"
"C-Betting on Flops that Missed Both You and Your Opponents?","<no-limit>"
"Hold Em poker How minimum raise changes","<rules>"
"5 card flush on table","<flush>"
"Deriving Sklansky's Formula for the Optimal Calling Frequency","<no-limit>"
"How to deal with card dead in MTT?","<texas-hold-em><mtt>"
"Theory of Preflop Opening Ranges","<texas-hold-em><pre-flop>"
"All in betting when you are last in chips","<all-in>"
"Bounty Builder tournament","<texas-hold-em><tournament><online>"
"Poker hand analysis","<betting-strategy><poker-strategy>"
"How do straddle and antes effect the absolute stake?","<texas-hold-em><nlhe><poker-theory><cash-game>"
"Calling Pot Odds vs. Your Opponent's Bluffing Odds","<texas-hold-em><gto>"
"Best poker coaching program","<texas-hold-em>"
"Is there software that aids street by street range vs. range analysis of hand history?","<texas-hold-em><range>"
"Why can't one add the (outs/possible) fractions of hitting flush on turn or river for the overall chance given 4 suited on flop?","<texas-hold-em>"
"Reading a Western about stud poker and need some clarification -?","<seven-card-stud>"
"Why call with the top X% of your range when being laid X% pot odds (by an opponent playing GTO)?","<texas-hold-em>"
"Please advise if there was a better way to play pocket T","<texas-hold-em><strategy><heads-up>"
"Why shove the river when your range is more than 50% value heavy?","<texas-hold-em><poker-theory><betting-strategy><ev>"
"Confused about Omaha hand","<rules><hand><omaha>"
"Paradox after an evening of hold-em with 5 to 7 players","<texas-hold-em><cash-game><home-game>"
"I want to know who is in the wrong....?","<omaha>"
"Should fold AKo when 2 players already all-in?","<mtt>"
"Review of hand played with QQ","<texas-hold-em>"
"Texas holdem dealing question","<rules>"
"Does Heads Up Hold em GTO assume a linear relationship between utility and money?","<texas-hold-em><poker-theory><no-limit>"
"Probability of flopping two flushes","<statistics>"
"How to deal with players who aggressively pre-flop all-in in low stakes hold-em?","<texas-hold-em><online><all-in><pre-flop>"
"High low Omaha question","<omaha-hi-lo>"
"Tilting when chip is growing?","<texas-hold-em><bankroll-management>"
"Did I make a stupid mistake with JJ preflop?","<pre-flop><mtt>"
"3-bet on straight flush possible board","<nlhe><cash-game>"
"According to traditional poker rules (excluding Texas holdem), can the ace be used as the low card in a A2345 straight?","<rules>"
"Can the big blind be considered late position pre-flop?","<texas-hold-em><pre-flop><betting-position>"
"Can someone help me out with the table balancing done in MTT's?","<tournament><mtt><balancing>"
"How many side pots possible in case of n player table (assuming n to be any number)","<side-pots>"
"Run it twice side pot case","<rules>"
"Special entries like ""C>4"" or ""R<2"" in this chart","<texas-hold-em><strategy><pre-flop>"
"Declared hands - winner declared and then changed","<rules>"
"Did I play this hand correctly?","<texas-hold-em><hand-history>"
"Turn and river dealt twice, what is going on?","<omaha><dealing>"
"What do you think about this play?","<poker-strategy>"
"What do you think about this play1?","<poker-strategy>"
"Who's win in poker a's cards is 6&8 nd b's card is 10&8 nd fallen in cards 10,2,9,10,7 please give answer","<rules>"
"Number of combinations for 5 from 52 cards neglecting suit","<statistics>"
"Bet out of turn","<betting-position>"
"Mucking cards on an all-in hand","<all-in>"
"What is the Big Blind Ante?","<rules><blinds><wsop><antes>"
"What is the true rule in a situtation like that?","<all-in>"
"What is the Ace's namesake?","<learning>"
"ICM: Malmuth-Harville Formula by Bill Chen 2","<icm>"
"Poker aggression - Flop, Turn and River","<poker-theory><poker-strategy><poker-stars>"
"Why did Pokerstars' traffic crash so much in the last years?","<poker-history><poker-stars>"
"Is there a place for poker room account trading?","<poker-rooms>"
"Do top hands also have the top expected winnings?","<texas-hold-em>"
"Pokertracking software for 6+ holdem","<pokertracker>"
"Misdeal.....or not?","<texas-hold-em>"
"How does a bad beat jackpot work?","<rules><live>"
"Having a big debate need a third opinion helllp","<poker-history><soft-question>"
"Is this HUD stat profile a nit?","<texas-hold-em><poker-theory><pokertracker><hud>"
"Small Stakes NLH 1-2 $300 Cap - What did villain have?","<nlhe><live><reading-hands>"
"What is the official procedure for starting a hand in texas holdem heads up?","<texas-hold-em><dealing><dealer>"
"Fold AKo preflop?","<nlhe><live><pre-flop>"
"Playing the SB pre-flop in omaha cash games general strategy","<online><cash-game><pre-flop><omaha>"
"Is it legal to play online poker in New Jersey? If so, is it worth it?","<poker-history><poker-stars><gaming-law>"
"Playing low cards in position","<texas-hold-em>"
"behavior at the poker table after a big bet","<poker-strategy><tells>"
"mucked or not in texas hold em","<texas-hold-em>"
"How to manage money in the early stages of a poker journey","<bankroll-management>"
"What happens to the small blind ante?","<blinds><antes>"
"Preflop and Flop action with KK","<texas-hold-em><nlhe><poker-strategy>"
"A list of funny / non competetive Poker Variants","<home-game>"
"What are the best open source bots available for NLHE (2 player and multiplayer)","<texas-hold-em><nlhe><poker-tools><software><soft-question>"
"Do older players tend to never bluff?","<texas-hold-em><nlhe>"
"My opponent turned his cards over in error","<texas-hold-em><showdown><muck>"
"Pretty new to poker, wondering how this hand wins","<texas-hold-em><no-limit>"
"Who gets what and why does a player making three others fold get nothing","<texas-hold-em>"
"I am so confused with All-In of Limit Holdem","<texas-hold-em><all-in>"
"Need analysis of flop bluff shove","<nlhe><poker-theory><cash-game><all-in><heads-up>"
"What are good poker books from the last 4 years","<books>"
"Correct call from EV perspective? [PLO]","<pot-odds>"
"Straight vs Three of a kind in flop","<texas-hold-em>"
"Mucking cards in holdem","<texas-hold-em><muck>"
"Texas Holdem going all in with cards under your chips","<texas-hold-em><rules><all-in><muck>"
"In a poker game with a double-sized deck, does a ""Flush Pair"" have a special rank?","<poker-theory>"
"What happens to the chips in the middle if someone is disqualified?","<rules>"
"Showing your cards after your opponent has mucked his","<texas-hold-em><muck><showdown>"
"What are the betting rounds for badugi?","<rules><poker-stars>"
"Someone else took my cards from the muck","<texas-hold-em><muck><cheating>"
"How does one get comfortable with the honesty of online casinos?","<texas-hold-em><online><odds><casino><cheating>"
"Tie-related question","<rules>"
"Etiquette: Why is it rude to ask to see a mucked bluff?","<nlhe><etiquette>"
"What to consider in order to build a Pre-Flop range chart (Hold-em)?","<texas-hold-em><poker-theory>"
"Small stakes $1-$2 $200 Cap - What to do inside straight flush draw?","<nlhe><live><nl200>"
"Which player bets first, relative to the dealer chip, if there are only 3 players left? What about 2?","<rules><betting-position>"
"Hu Plo KQT2 on flop T84","<heads-up><omaha>"
"texas hold um no limit","<rules>"
"What are the odds of this?","<cash-game>"
"Poker game notation PGN as in chess","<poker-tools>"
"what are the odds of hitting a flush with 2 suited cards before the floop","<flush><drawing>"
"What to do if you are dealt AA at the begining of a tournament","<tournament><poker-strategy><probability><all-in>"
"Rules on players exposing card before all players bet","<rules><all-in>"
"ROI in multi-table tournamments","<online><mtt><roi>"
"Shortstack SB calling range against UTG","<nlhe><pre-flop><sng>"
"How is cash game winner reward calculated?","<cash-game>"
"Ace vs King and Queen (texas holdem)","<texas-hold-em>"
"Why not wait for the river","<rules>"
"When to fold second best flush on the River (got three bet shoved and lost to full house)","<poker-strategy>"
"Winning with pocket quads at omaha hi low","<omaha-hi-lo>"
"Call all in decision","<pre-flop>"
"All in for less than big blind, post flop","<rules>"
"Why is full house called full house?","<full-house>"
"Is NLHE ""solved""?","<texas-hold-em><software>"
"Should I shove or 4-bet with AA","<poker-strategy><betting-strategy><cash-game>"
"Pluribus games data","<hand-history>"
"Postflop guidelines","<heads-up>"
"Which probability to get any combination on flop with AA?","<texas-hold-em><poker-theory><probability>"
"How are all the raise options calculated in poker software","<texas-hold-em><rules>"
"Chance of winning heads-up by always shoving pre-flop","<texas-hold-em><poker-theory><probability><strategy>"
"Initial betting options on the preflop, and other streets on poker software","<rules><no-limit><raise>"
"Is a straight and a flush a straight flush?","<texas-hold-em><flush>"
"What would be the main difference to poker if the deck would be extended?","<poker-theory><gaming-theory>"
"Facing donk lead and call on flop ... what now?","<texas-hold-em><tournament><online><betting-strategy><hand-history>"
"Showing cards before showdown, all-in situation","<rules><all-in><showdown>"
"I started playing on a poker site in India. Is the following scenario possible :","<tournament><online>"
"Playing fast and slow ... with apologies to Kahneman","<texas-hold-em><tournament><online><spin-and-go><metagame>"
"How do you adjust your preflop range to opens?","<range>"
"Confusion about two pair rule in poker, can someone help me who will win","<poker-theory><pocket-pair>"
"Where can I play poker with a bot?","<texas-hold-em>"
"After a Misdeal","<rules>"
"Can I show a folded hand and win the pot?","<rules><muck>"
"Facing a shove on an ugly river","<texas-hold-em><poker-strategy><hand-history><heads-up><spin-and-go>"
"What hand is this?","<texas-hold-em><rules><dealing><dealer>"
"When to make -EV plays that put opponents in tough spots","<nlhe><tournament>"
"Player throws cards face up","<texas-hold-em><rules><muck>"
"On a round if everyone has called or folded, could the person after the last to call, raise and make everyone have to call again?","<texas-hold-em>"
"Are players allowed to show one card mid-game?","<rules><etiquette>"
"Player fold in split pot, is he part of main pot?","<texas-hold-em><all-in><fold-equity>"
"Should big denomination cihps be explicitly separated in a raise if they are in the same stack with smaller chips?","<texas-hold-em><raise>"
"Online poker OS restrictions","<online><software>"
"Playing monsters against nits","<nlhe><cash>"
"Best books for beginners Pot-Limit Omaha","<omaha><books>"
"if I have a pair of Aces in my hand and the other players has a pair of kings with the board, who wins?","<texas-hold-em>"
"How does the pot split in Texas Hold 'Em?","<texas-hold-em>"
"How to stay alert during long tournaments","<tournament><online>"
"Probability of two royal flushes' played in a row","<probability>"
"What are the Hero's outs?","<texas-hold-em>"
"What is the Villain's equity against Hero's cards in this hand?","<equity>"
"Poker Combinatorics: Compare pot odds with what?","<equity><ev>"
"Is there a software available that I can use to calculate outs?","<equity>"
"What constitutes a dead hand?","<betting-strategy>"
"How to avoid telegraphing the cards in your hand to your opponents?","<tells>"
"Odds for straight or flush on the flop","<odds><flush><straight>"
"Professional cash player's salaries","<cash>"
"Confusion regarding calculating odds in flops","<odds><fold-equity>"
"Playing with an infinite copies of a deck","<poker-theory><probability>"
"explaining the terms regarding Outs","<poker-theory>"
"How often does an overpair get out flopped by a set?","<texas-hold-em>"
"Calculating my bet size if I know my bluff % to make villain indifferent","<betting-strategy><odds><statistics>"
"Best five card hand","<poker-theory>"
"Calling down check-raise on semi-dry board","<nlhe><cash>"
"If two players both have pocket aces, who wins?","<starting-hand>"
"First round all-in","<nlhe><betting-strategy><all-in><no-limit><pre-flop>"
"I don't understand why I lost this hand in Texas Hold'em (help please)","<soft-question>"
"Poker tips backed by facts","<poker-strategy><odds><statistics>"
"Should dealer continue dealing after one of the players hits royal flush in heads-up showdown?","<texas-hold-em><dealing><dealer>"
"Bottom set on semi wet board with multi-way action","<nlhe><cash-game>"
"Tracking personal bad beats and suck outs","<texas-hold-em><online>"
"Can someone please explain to me this hand below:","<tournament>"
"What sites are most played?","<texas-hold-em><online>"
"How do international poker players take tournament prize money home?","<tournament>"
"Is gambling disease common among poker PROs who don't play other games?","<psychology>"
"Poker software terms","<software><terminology>"
"hand question review about this pot","<poker-theory>"
"How to raise and re-raise in post flop rounds?","<rules>"
"Full house vs Full house weak","<full-house>"
"Should I use Effective M on 9-Max Tournaments?","<texas-hold-em><tournament><poker-theory><blinds><sit-and-go>"
"Disclosure of info","<tournament>"
"How to keep tract of next to act if first to act player folds?","<texas-hold-em>"
"How does the middle pot's built between flop turn river","<texas-hold-em>"
"Is there a situation where a player has a right to act even though all the bets are equalized","<texas-hold-em>"
"Does this hand make sense?","<texas-hold-em><hand-history><hand><heads-up><hand-reading>"
"Which flush wins","<flush>"
"Odds for AAAKK Full House in Flop with 8 Players","<texas-hold-em><odds><full-house>"
"Folding to a check","<texas-hold-em>"
"Can I top off my stack and add more chips without telling the dealer?","<rules><live><etiquette><casino>"
"How to play when you block all your opponents' value range","<nlhe><cash-game><nuts>"
"How is percentages calculated for specific player?","<statistics>"
"What's the chance my opponent has a better flush?","<odds><range><flush>"
"Is there a formula to calculate starting hand ranking?","<texas-hold-em><poker-theory><starting-hand>"
"Can showing cards in a tournament constitute a call to an all-in?","<rules><tournament><all-in>"
"How can I calculate my total odds given different possible events?","<poker-theory><odds><poker-tools>"
"How Does EV Change As More Cards Come Up?","<texas-hold-em><probability>"
"Average graph of high-ranking players' chips vs. hands played in major tournaments","<tournament><poker-theory><statistics>"
"How much do poker rooms pay to use the Bravo waiting list / comp system?","<casino>"
"Cheating by 2 or more players playing ""best hand?""","<cheating>"
"Tournament: Should I call this Button-shove?","<texas-hold-em><tournament><icm>"
"How to play with pocket 10 in low stack situation?","<texas-hold-em><betting-strategy><cash-game>"
"Final table at tournament, two players avoiding eliminating each other -- what can the tournament director do?","<tournament><cheating>"
"What to do here?","<tournament>"
"What types of fees are allowed for home games?","<rake>"
