title,tags
"What are the odds I will hit my flush?","<texas-hold-em><odds>"
"How does a wild card (53rd) affect the odds of making the standard poker hands?","<statistics><wild-card>"
"How can I keep my skills sharp without online real-money poker?","<training>"
"What is the most common variant of poker?","<untagged>"
"How do you recognize when you are playing ""on tilt""?","<tells>"
"Texas Hold'em Rules","<texas-hold-em><rules>"
"How does Lo work in Omaha Hi-Lo","<rules><omaha-hi-lo>"
"How to detect tells online?","<tells><online>"
"How do you hide your tells?","<tells><live>"
"How wide should my 3-bet range pre-flop be in low-stakes NL live play?","<texas-hold-em><live><1-2nl><pre-flop><balancing>"
"How big an edge can you have on a tournament field ? ROI vs edge question","<tournament><equity><ev><roi>"
"What can I do  to calculate my odds in a hand?","<odds>"
"What are Pot Odds, and how do I determine them?","<odds>"
"Why is it easier to make a flush than a straight with four cards already matching?","<odds><poker-theory><drawing>"
"How do you bet pre-flop when there's no action, you're on the button, and you have pocket rockets?","<texas-hold-em><betting-strategy>"
"How do you determine a good online table to sit at?","<online>"
"Should I call this river overbet with an overpair?","<texas-hold-em><live><nlhe><hand-history><cash-game>"
"In Texas holdem, how should my betting change as my stack of chips changes?","<texas-hold-em><betting-strategy><betting-position>"
"Do I need to change my tactics playing pocket rockets (AA) to maximize their potential?","<betting-strategy>"
"Expected Value for SB und BB in NL HU (GTO)","<nlhe><poker-theory><ev><heads-up><gto>"
"How do I Calculate Expected Value of Shoving, including Fold Equity, in heads up play?","<betting-strategy><ev><heads-up>"
"Balanced Continuation Bet range","<texas-hold-em><nlhe><poker-theory><balancing><gto>"
"How to Calculate Hand Odds in Texas Hold'em","<texas-hold-em><odds><poker-theory><resources>"
"Tools for Managing Bankroll, Income and Losses","<bankroll><bankroll-management><poker-tools><session-accounting>"
"How can I gain an advantage in a weak no-limit Omaha Hi-Lo game?","<omaha-hi-lo><home-game>"
"Smallest Stack Size for playing 3bet/fold","<texas-hold-em><nlhe><pre-flop><short-stack>"
"How are casino poker dealers paid?","<dealing>"
"Do I call a turn all-in with KK with against a possible flush?","<texas-hold-em><live><1-2nl><nlhe><hand-history>"
"Is there a comprehensive source for poker terminology?","<terminology>"
"How do you determine which player needs to show their cards first?","<rules><dealing>"
"How do you sniff out a set NLHE?","<texas-hold-em><live><1-2nl>"
"Minimum re-raise in Hold em","<texas-hold-em><rules><nlhe>"
"Preflop range for representing the nuts on every board?","<texas-hold-em><poker-theory><range>"
"Over the long term, how often will AA lose a hand?","<texas-hold-em><statistics>"
"What is the usual ruling on an aggressor folding on the river?","<live><rules>"
"In a private live game, how do you deal with severe violations of table etiquette?","<live><rules><etiquette>"
"When should I use a polarized vs. a merged range?","<texas-hold-em><range>"
"In deep stacked NLHE cash games, in what way do the implied odds of my starting hands change vs shallow stacked games? And why?","<texas-hold-em><nlhe><cash-game><implied-odds>"
"Where can I find information on local legal poker tournaments","<live><tournament>"
"Revealing a Friend's Tells","<tells><etiquette>"
"How to deal with people who randomly go all-in?","<tournament><betting-strategy>"
"Area under graph in PPT simulations","<poker-theory><equity>"
"Looking for the BB/M math to build good NLHE Tourney Blind Structures","<texas-hold-em><tournament><nlhe>"
"Correct (preferred) blinding in NLTE tourneys when blinds or the button bust out","<texas-hold-em><tournament><betting-position><blinds>"
"NL400: Vs a TAG Regular. Interesting River Decision","<nlhe><hand-history><online><nl400>"
"Call river all-in after missing flush-draw but hitting AK?","<texas-hold-em><nlhe><live><1-2nl><hand-history>"
"NL200: Difficult River Situation; Whether To Bluff Or Not?","<nlhe><hand-history><online><nl200>"
"What are some examples of good, free poker tournament software?","<tournament><software>"
"Are There Good Points-Based Ways To Handicap Home Poker Tournaments?","<tournament><home-game><session-accounting>"
"NL200: Many possible lines to showdown in this 3-bet pot","<nlhe><hand-history><online><nl200>"
"At what point does poor etiquette turn into cheating?","<home-game><etiquette>"
"Who can play on www.pokerstars.it?","<online>"
"What is the purpose of a continuation bet, and when is it best applied in Hold'em?","<texas-hold-em><betting-strategy>"
"NL600: River Decision OOP vs Thinking Regular At Very Wet Board","<nlhe><online><hand-history><nl600>"
"What is a 'wet board'?","<terminology>"
"5/5 NLHE Flop decision against maniac and solid player","<nlhe><live><hand-history>"
"Is using a ""straddle"" a valid strategy or is it just for fun?","<texas-hold-em><cash-game>"
"What are the odds of getting the same four-of-a-kind twice in a row?","<texas-hold-em><odds>"
"What tournament size is best to play if completely new to on-line playing Texas hold-em?","<texas-hold-em><tournament><online>"
"What is a straddle bet?","<terminology><straddle>"
"What are the most important elements of poker to model in a Monte Carlo simulation?","<texas-hold-em><poker-theory>"
"Is it impolite to leave a cash game when I'm about to be the big blind?","<etiquette><betting-position><blinds>"
"PLO100 - Top Two Facing Turn Aggression on Wet Board","<online><hand-history>"
"Is Small Ball Poker In Cash Games A Good Strategy?","<texas-hold-em><nlhe><betting-strategy>"
"Burning cards in home games","<home-game>"
"Handling ""running it twice"" situations","<texas-hold-em><home-game>"
"What does ""run it twice"" mean?","<terminology>"
"Standing of all-in losers in a tournament","<tournament><rules>"
"What is the definition of a ""redraw""?","<texas-hold-em><terminology><drawing>"
"Does a bounty chop?","<tournament><home-game>"
"NL600: Should I Make This River Bluff vs Reg?","<nlhe><online><hand-history><nl600>"
"Optimal Win Rate Standard Deviation","<live><1-2nl><cash-game><statistics><bankroll-management>"
"Set Mining: betting pre flop with 22+","<texas-hold-em><betting-strategy><cash-game><1-2nl><implied-odds>"
"WSOP 2011: -1% badge - what it is for?","<tournament><wsop>"
"Ante + BB all-in, what can the BB win?","<poker-theory><rules><blinds><side-pots>"
"What online poker sites charge/rake the least?","<online><cash-game><rake>"
"Insurance in cash games. In which situations is it a good idea and for how much -EV?","<cash-game>"
"What is the""Top Five Cards"" rule and how does it apply to splitting pots?","<texas-hold-em><rules><reading-hands>"
"Are mucked and burnt cards significant in odds calculation?","<odds>"
"What to do if we suspect online poker server is cheating?","<online><cheating>"
"Texas Holdem poker software for LAN","<texas-hold-em><software>"
"What's considered an acceptable rake in tournaments?","<tournament><rake>"
"What's the order for showdown?","<live><rules>"
"Are WSOP hand logs available to the public?","<poker-theory><wsop>"
"99 short stacks reraised under the gun tournament","<nlhe><tournament><hand-history>"
"How to learn a new poker game?","<statistics><strategy>"
"Las Vegas: Best casino for 1-2 no limit?","<live><casino><skill>"
"NL200: Deep Stacked IP; 4Bet pot","<nlhe><online><hand-history><nl200>"
"Spread Limit vs Pot Limit","<texas-hold-em><betting-strategy>"
"Main differences between Limit and No Limit Hold'em","<texas-hold-em><betting-strategy>"
"Distribution of Badugi Hands","<poker-theory><odds>"
"Is online poker legal or not in the United States ?","<texas-hold-em><online>"
"How are side pots built?","<rules><side-pots>"
"What are the most important things to consider when choosing a poker coach?","<nlhe><online><training>"
"Classic Books for Texas Hold'Em","<texas-hold-em><books>"
"NL400: Live Hand vs Semi-Loose Passive Player At Dry Board. What Would You Do?","<nlhe><live><hand-history><nl400>"
"How often will pocket aces lose to 4 flush or set after the flop?","<nlhe>"
"What topical resources do you often use to learn more about poker?","<poker-theory><resources><poker-tools>"
"Giving a short stacked opponent a perfect all-in vs forcing them to over-commit","<tournament><poker-theory><odds><short-stack>"
"How should I play blind vs. blind late in tournaments against unknown players?","<nlhe><tournament><betting-strategy>"
"How does an opponent's all-in range change after showing an all-in bluff in an online heads-up tournament?","<online><tournament><betting-strategy><heads-up>"
"Is there any poker online software which run on Linux?","<online>"
"Online vs Live problem","<texas-hold-em><online><live><skill>"
"SNG or cash games, what is the best type of games for regular income","<cash-game><sit-and-go>"
"Is shoving all in with a weaker player the best strategy?","<online><tournament><betting-strategy>"
"Which requires more skill, cash game or tournament poker?","<nlhe><tournament><cash-game>"
"How many SnG tournaments do I need to play to be relatively sure I'm a profitable player?","<tournament><sit-and-go>"
"Online vs live tournament pace","<texas-hold-em><nlhe><tournament><live>"
"Basic Strategy for Pokerstars ZOOM?","<online><cash-game><rush-poker>"
"SB raise in preflop in no limit TH","<nlhe><betting-strategy><cash-game><pre-flop>"
"Dead Button in Rush Games","<texas-hold-em><betting-position><rush-poker>"
"pair of K, low kicker, out of position","<hand-history>"
"Can you win while ""short a card"" in poker?","<rules>"
"Complex split pot semantics for multiple All-In winners with differing amounts","<texas-hold-em><poker-theory><side-pots>"
"Redealing to the board in Pot Limit Omaha","<rules>"
"Inactive player problem: Where should the money be distributed in this situation?","<texas-hold-em><nlhe><rules>"
"Are there times when your bets are more important than your cards at poker?","<betting-strategy>"
"In Omaha, Is it allowed to only show two holecards at showdown when claiming the pot?","<online><live><rules>"
"Why is 7c2d a semi-bluff?","<nlhe>"
"Why does 555 beat QQQ in this Doyle vs Elezra hand?","<texas-hold-em>"
"NL600: River Decision IP vs TAG 3 Barrel","<nlhe><online><hand-history><nl600>"
"Is it against the rules to show a hole card during play?","<rules>"
"In heads-up Texas hold'em, what starting hands are ""above average"" pre-flop?","<heads-up>"
"Who wins this game of high low Hurricane with wilds?","<rules><wild-card>"
"Does Holdem Manager 2 have built in hand convertor?","<texas-hold-em><software>"
"Easy to memorize starting hand strategy","<texas-hold-em><learning><starting-hand><no-limit>"
"HUD states - current or database based","<software>"
"How do I structure the blind levels of a tournament to run for a certain length (on average)?","<tournament><blinds>"
"Most common freerolling situations in holdem?","<texas-hold-em>"
"What does 'freerolling' mean?","<terminology>"
"About Holdem Manager graphs","<texas-hold-em>"
"How often, and how much, should I bluff on the river when I miss my flush but a possible straight comes?","<texas-hold-em><nlhe><cash-game>"
"How to calculate expected value if I go All-in before flop with AK offsuit","<texas-hold-em><ev>"
"Minimum number of hands required to establish a conclusion about win-rate?","<texas-hold-em><nlhe><statistics>"
"is there an open source algorithm for a fixed limit holdem","<texas-hold-em><software>"
"What metrics do you use to evaluate your own live play performance?","<live>"
"Interesting Spot in Penny Poker: Overpair vs Nit on Wet Board","<nlhe><online><hand-history>"
"Is there an optimum formula for deciding chip denominations?","<home-game>"
"Maximizing profit post-bubble","<texas-hold-em><online><tournament><no-limit>"
"Heads up NLHE, is it harder to beat rake then full ring?","<cash-game><heads-up><rake>"
"Profitability of re-buys/add-ons when allowed","<nlhe><online><tournament>"
"Online play analysis software","<online><software><statistics>"
"Straight + Flush draw on flop, is all-in worth to play?","<texas-hold-em><nlhe><cash-game>"
"Micro Stakes, playing Big Aces pre-flop against multiple very loose opponents","<texas-hold-em><betting-strategy><cash-game><pre-flop><starting-hand>"
"Why is ""Let There Be Range"" so expensive ? Is it worth that money?","<nlhe><rules><books><let-there-be-range>"
"Interactive texas holdem learning","<texas-hold-em><learning>"
"NL400: Big Slick IP vs C-Bet In 3-Bet Pot","<nlhe><online><hand-history><nl400>"
"What mnemonic rules are helpful in poker calculations?","<odds><ev><roi>"
"What software to use when playing online?","<online><poker-tools><software>"
"Readless Preflop Strategy for Pokerstars HU Hyperturbo SNGs?","<nlhe><heads-up><pre-flop><range>"
"Are seat re-assignments random in multi-table tournaments?","<tournament><rules>"
"Should I call opponent's flop re-raise with trips?","<texas-hold-em><nlhe><live><hand-history>"
"Is just calling the big blind a poor strategy?","<texas-hold-em><betting-strategy><pre-flop>"
"Thoughts on Chen's formula","<betting-strategy><pre-flop><starting-hand>"
"Why do people make the following call, check, call round the table?","<texas-hold-em><betting-strategy><betting-position>"
"Best way to play poker online for playchips","<online>"
"How to maximize expectation with pocket aces and an Aces Cracked bonus running","<texas-hold-em><cash-game>"
"Can A Qualifying Low Hand Also Win The High Hand Pot?","<rules><omaha-hi-lo>"
"Is There Any Standard Rule of Buy-in Chips?","<rules><cash-game>"
"Is Manipulating Your Own Table Image Beneficial?","<table-image><psychology>"
"What is a proper starting bankroll?","<bankroll-management><bankroll>"
"Is it possible to play for real money online in the US?","<online><rules>"
"Poker Tools : Recording Hands / Outcomes","<texas-hold-em><betting-strategy><poker-tools>"
"Starting a Friendly Poker Ring","<texas-hold-em><tournament><cash-game>"
"Texas Hold'em and pocket ace","<texas-hold-em>"
"Should you make your choice of gaming location based on the promotions or the players?","<live><bankroll>"
"Dealing with Rookie / Novice Players","<nlhe><betting-strategy><live><skill><strategy>"
"Can a bettor concede his hand without showing it?","<poker-theory>"
"NL200 Zoom: Top 2-Pair Deepstacked @ Wet Board","<nlhe><hand-history><nl200><rush-poker>"
"Implied odds meaning and usage","<odds><implied-odds>"
"Tricky Tournament Bubble Situation","<texas-hold-em><tournament><drawing><bubble>"
"Poker Academy Pro or an alternative","<software>"
"Is a semi-unlimited stack a significant advantage?","<cash-game>"
"How to improve betting skills without losing too much money in the process","<betting-strategy>"
"Is there an app for managing invitations to a home poker game?","<home-game><software>"
"NL100: Overpair vs Loose Passive @ Wet Flop. Is The Prior Action Relevant?","<hand-history><nl100>"
"$1/$2 Live - Turned top two pair facing heat (line check)","<live><hand-history><nl200>"
"$1/$2 Live - Bottom set on flop and facing 3bet","<live><hand-history><nl200><casino>"
"How do you play AQ or AK (off or suited) on $1/$2 Live?","<nlhe><live><nl200>"
"(Simple?) 3-bet Scenario","<nlhe><hand-history>"
"How Can I Tell If My Opponent Is Aware Of My Image/Range?","<nlhe><table-image>"
"How to play QQ live tournament?","<nlhe><tournament><live>"
"Small Pairs on early and middle positions","<texas-hold-em><betting-strategy><cash-game>"
"Could I have won more money with top set on the flop?","<texas-hold-em><nlhe><live>"
"What's the best book to read to understand this site?","<betting-strategy><poker-theory><terminology>"
"Raising after an all in","<texas-hold-em>"
"How to count the power of cards in hand?","<odds><implied-odds>"
"NL100: 2-Pair In 4-Way Pot Facing OOP Lead @ Wet Flop","<nlhe><online><hand-history><nl100>"
"Pot odds with low chip stack","<odds>"
"Lose money when poker server goes down?","<online>"
"Ax2x, UTG, final tabler, 4 players. Go to war?","<nlhe><tournament>"
"Bet with Ax3x3x on river?","<betting-strategy><cash-game><nl200>"
"Texas Hold'em: Heads up pre-flop probabilities","<texas-hold-em><pre-flop><statistics>"
"What is the proper betting procedure with 7 players after the first three players go all in before preflop?","<nlhe>"
"How to play online horse tournament when you lack knowledge in one of the games?","<online><strategy>"
"NL100: Facing River Raise After Flopping Straight","<online><hand-history><nl100>"
"NL200: TPGK In Squeezed Pot OOP","<nlhe><online><hand-history><nl200>"
"Did I play this correctly? $1-2 NL Holdem","<nlhe><cash-game>"
"Are there well documented cases of winning tournament by someone who wasn't looking at his own cards?","<texas-hold-em>"
"Why is comparing hands based on how often they win a showdown or on their poker ""hand rank"" worse than worthless?","<nlhe><pre-flop>"
"200nl - Flop top two on wet board and get squeezed OOP deep","<online>"
"What's a good strategy for playing overpairs post flop?","<nlhe>"
"Should I have went all-in with KK on this flop?","<texas-hold-em><nlhe><live><hand-history>"
"Should I call all-in here with bottom set?","<texas-hold-em><nlhe><live><hand-history>"
"What % of tournament winners do it without going all in","<betting-strategy>"
"Publicly available poker stats","<texas-hold-em><statistics>"
"combinations from 2 hole card and 7 communal cards","<texas-hold-em><poker-theory>"
"Adjustments to the rake?","<online><range><rake>"
"Folding AA after the flop?","<nlhe><tournament><betting-strategy>"
"Why is Texas Hold'em Poker so popular in worldwide not just US?","<texas-hold-em>"
"Simple final table tournament play including push/fold","<texas-hold-em><live><tournament>"
"Are Poker books like ""Book on Tournament Texas Hold'em"" trust worthy?","<poker-theory><books>"
"Why can't folded hands compete for sidepots?","<texas-hold-em><side-pots>"
"Forums with lot of hand history analysis by other players","<resources>"
"NL100: Turn Two-Pair at Wet Board Facing Small Bets","<nlhe><online><hand-history><nl100>"
"How many chips do you have left?","<live><rules>"
"Online Poker League","<tournament>"
"Trying to express NL betting rules formally, did I miss anything?","<rules><no-limit>"
"What was the fifth card of the dead man's hand?","<poker-history><dead-mans-hand>"
"Do you have favourite hole cards - and do these change over time","<texas-hold-em><psychology>"
"Is trash talking legal in WSOP?","<rules><wsop><trash-talk>"
"Player very low on chips, can't pay Ante+BB. What happens?","<rules><no-limit>"
"What are some good movies about Poker?","<movie>"
"What is the meaning of ""D"" near with players name?","<wsop>"
"Doubt in expected value calculation of Bill Chen book","<poker-theory>"
"In Wsop, paying taxes depend on what?","<wsop><tax>"
"The state of the art of the pokerbots of poker academy","<poker-tools>"
"Position advantage on the table and odds","<poker-theory><betting-position>"
"What is top N% of hands in PokerStove?","<statistics><pokerstove>"
"The groups of Sklansky starting hands","<poker-theory><starting-hand>"
"Positions in Poker","<poker-theory>"
"What do you do when you get junk in draw poker?","<starting-hand><5-card-draw>"
"What is the purpose of blinds?","<blinds>"
"Name of five card Texas Hold'em game?","<texas-hold-em>"
"Why is this a poor play?","<texas-hold-em><strategy>"
"Heads-Up And The Logic Of The Blinds","<poker-theory>"
"When Is It A Good Tactic To Slowplay A Hand?","<betting-strategy>"
"Nash's ICM calculation","<poker-theory>"
"Potential all-in rules, does any game use this rule?","<rules><all-in>"
"Do previous bets count towards All-In raises?","<texas-hold-em><nlhe><rules><all-in>"
"Are there any good Poker hand history databases for free out there?","<texas-hold-em><hand-history>"
"Is it bad etiqutte for the whole table to agree to let someone blind out?","<texas-hold-em><nlhe><online><etiquette>"
"Whats this ""OFC"" game that I keep seeing poker players talking about?","<online><open-face-chinese>"
"The right bluff frequency","<poker-theory>"
"A TAG LAG paradox?","<poker-theory>"
"When should you defend your big blind in tournament play?","<nlhe><tournament><betting-strategy><betting-position><strategy>"
"Gap concept and pot odds","<poker-theory>"
"Poker Rooms Comparison","<online><poker-rooms>"
"The Importance of Mathematics in Poker","<soft-question>"
"How to use fpdb HUD in the game","<poker-tools><hud>"
"Position when joining a Texas Hold'em table","<texas-hold-em><blinds>"
"Why is it forbidden to check-raise in some Casino?","<betting-strategy><rules>"
"How to best teach poker to a novice in 1 month?","<nlhe><online><live><books>"
"Can someone offer a comparison (pros and cons) of the sites that one can play for real money on in the US?","<nlhe><online>"
"How to behave in crowded pots","<poker-theory><strategy>"
"Effect of number of players in the probability distribution of poker hands","<texas-hold-em>"
"NL100: River Shove with Ace-High?","<nlhe><hand-history><nl100>"
"Does This Qualify As A Split Pot?","<nlhe><rules><reading-hands>"
"NL200: Am I A Super-Nit For Considering Folding The Turn With TPGK?","<nlhe><hand-history><nl200>"
"Add-on value and ""bubble factor""","<poker-theory><bubble><icm>"
"Play in position against BB preflop raiser","<texas-hold-em>"
"Postflop play books references","<poker-theory><strategy>"
"What happens if the card wasn't burned?","<texas-hold-em><rules><dealing>"
"Outs counting correction","<poker-theory>"
"New school and old school","<soft-question>"
"How does one combat ""casual"" gameplay habits in ""professional"" games?","<betting-strategy><cash-game><strategy>"
"When to fold AA pre-flop?","<texas-hold-em><cash-game>"
"Mathematical Derivation of the Chen Formula","<starting-hand>"
"Why is the term ""action only"" called ""action only""?","<terminology>"
"Do two or more players colluding against honest players gain on average more money, or not?","<rules><odds><statistics><strategy>"
"Rivering a full house","<nl100>"
"Site with beatable PLO rake?","<rake>"
"Number positions in Poker table","<betting-position>"
"Converting Backdoor Draws Into Equity","<poker-theory>"
"How do you calculate side-pots when all-in on ante?","<tournament><all-in>"
"Is Colin Moshmans Book Still A Relevant Micro SNG Reference","<books><sit-and-go>"
"Position/order of dealing post pre-flop","<poker-theory><betting-position>"
"Straight w/ 4 board cards: Reacting to a Nit","<nlhe><hand-history><cash-game>"
"Starting hands probability","<texas-hold-em><probability>"
"Pocket pair starting hands vs. probability of opponent having a pocket pair","<probability>"
"Are there any 5-card-draw games with the joker online?","<wild-card><5-card-draw>"
"What do you do when you are running bad","<psychology>"
"Poker etymological dictionary","<poker-history>"
"Tough decision on the turn","<texas-hold-em><nlhe><tournament><hand-history><live>"
"How is Poker a game of skill?","<poker-theory>"
"What to do when a third suited card appears on the river","<texas-hold-em><cash-game><drawing>"
"Equity calculation at brick and mortar poker","<poker-theory><poker-tools><pokerstove>"
"What is the best strategy once you are chip leader in a tournament?","<texas-hold-em><nlhe><online><tournament><strategy>"
"Quantifying the amount of luck required to win a tournament","<tournament><statistics><skill>"
"Definition of ""lead""","<betting-position><terminology>"
"What if you get a straight flush on flop?","<texas-hold-em><strategy>"
"What is the D on table and the terms defining players?","<texas-hold-em><online>"
"Start playing NL Hold'em or Limit Hold'em?","<texas-hold-em><nlhe><online>"
"Strategy Against Aggressive, Maniacal Player","<poker-strategy>"
"Easy to remember push/fold/callpush table/formula","<texas-hold-em>"
"Joining an offline poker league - can being new be used to my advantage?","<tournament><live><table-image>"
"Difference in strategies with stakes?","<texas-hold-em><nlhe><tournament>"
"Considering Weighted Ranges","<range>"
"Heads Up NL Holdem: Best strategy against all in every hand","<texas-hold-em><tournament><no-limit>"
"Quantifying the amount of skill required to win a tournament","<tournament><statistics><skill>"
"Is it advantageous to buy into a NL cash game at the maximum amount?","<nlhe><cash-game><casino>"
"Short stack strategy","<texas-hold-em><nlhe><betting-strategy><short-stack>"
"Who has the higher hand: 44 vs. A2 on a JJKK2 board?","<texas-hold-em><hand>"
"Systematic all-in","<all-in><probability>"
"Is it possible to make profit from Online games? How?","<online>"
"Should you use average value or marginal value when deciding which hands to play?","<texas-hold-em><poker-theory>"
"Moving from online to live games","<online><live>"
"Adjusting strategy for MTT","<tournament>"
"Best playing style for MTT's","<tournament><strategy>"
"Is online poker safe?","<online>"
"Short stack play - best way to deal with it?","<texas-hold-em><nlhe><online><betting-strategy><strategy>"
"Name for limpers that call a pre-flop raise?","<terminology>"
"Why Prahlad Friedman's hand called dead againist Ted Bort on WSOP 2010?","<rules><wsop>"
"What happens when you break the ""No talk rule""?","<live><rules><wsop><casino>"
"What is the protocol for dealing the ""draws"" in ""draw poker""?","<5-card-draw>"
"1/2 NL: Call this villain's all-in with top pair, ace kicker?","<texas-hold-em><nlhe><live><cash-game><nl200>"
"Best Poker sites on net","<texas-hold-em><online>"
"Teach poker in a home game","<nlhe><live><rules><home-game><learning>"
"Does a poker party always end with one player winning all the chips?","<rules>"
"What is the odd of hitting flush when you have nothing","<odds><seven-card-stud>"
"Determining the proper play on the turn","<texas-hold-em><nlhe><tournament><live><hand-history>"
