title,tags
"How to override XPM Cancel Button?","<experience-manager><2013-sp1><gui-extensions>"
"How to access stub component in ECL StubComponentCreated method","<core-service><2013-sp1><ecl>"
"Odd WebDAV drive mapping on Windows 7","<2013><webdav>"
"How to grant undo-checkout / check-in to a user who isn't a system admin?","<2013><cme><permissions>"
"What improvements in transactional deployment were released in 2013","<2011><2013><content-delivery><2009>"
"XPM Ribbon toolbar getting disabled after finish editing","<experience-manager><dynamic-publishing>"
"Inline editing of override image through XPM","<2013><experience-manager>"
"Which page opens when click a component in Related Item on XPM?","<experience-manager><2013-sp1><workflow>"
"GetFromItem error for Multimedia type","<component>"
"Could not connect to ImportExport service on SDL Tridion Content Manager server <IP address>","<2013><content-manager><content-porter-2013>"
"Content Porter Tool SQL Server/Oracle Issues?","<2013><content-manager><content-porter-2013><oracle>"
"Active tracking TBB doesn't render tag","<profiling><tracking><personalization>"
"How to pass component field value to C# TBB using parameter schema","<2011>"
"Error importing a component which links to an ECL stub","<ecl><content-porter-2013>"
"Error on publishing promotion in SmartTarget 2014 SP1","<2013><smarttarget>"
"Loop thrugh StructureGroups with Razor MEdiator","<razormediator>"
"How to get the Session in a Razor template","<razormediator>"
"What's good way to add items to workflow on child publication?","<2013-sp1><workflow>"
"Is it possible to change the field character limit in Audience Manager?","<2013><cme><audience-manager>"
"retrieving component from subfolders excluding some subfolders","<2013><core-service>"
"How to show main Navigation name in different language","<dxa><dxa-java>"
"Binding to LDAP server failed. The supplied credential is invalid","<2013><cme><ldap>"
"Error setting up the SDL Web Discovery Service","<web8><discovery-service>"
"How to access custom meta of publication in JAVA?","<content-delivery><java><metadata><2013-sp1>"
"Failed upgrade from SDL Tridion 2011 to 2011 SP1","<2011><2011-sp1><upgrade>"
"odata service query Page Content","<odata><api>"
"Retrieve immediate folder name if particular component is present using core services","<2013><core-service>"
"Triggering of events on component publish","<2013-sp1><event-system>"
"Customize the Font Face, Font Color and Font size options for a RTF in CMS ribbon","<2013-sp1><rtf>"
"How should I choose my Content Manager environment ID?","<web8><topology-manager>"
"Core Service Login Issue (store procedure)","<2013><core-service><2013-sp1>"
"oData request with query paramater as URL","<odata>"
"How to get INDEXER_REPLICATION_PORT that the syncserver is currently listening to?","<smarttarget><fredhopper>"
"DXA Java sending 500 status code for file not found","<content-delivery><dxa><dxa-java><sdl-tridion>"
"How to deploy dxa-example-webapp on WebSphere ND 8.5.5?","<dxa><dxa-java>"
"Emergency Publish - to a different location","<deployer><deployer-extension>"
"DXA 1.2 - Http probe requests fails in absence of Accept or Content-Type parameter in header","<2013><dxa><dxa-java><dxa-1.2>"
"Web 8 Content Manager Explorer Interface Issues","<installation><web8>"
"Two Level Context Menu in Tridion Alchemy Plug-In","<2013-sp1><cme><a4t>"
"Error on optional field when using Core Service SynchronizeWithSchemaAndUpdate","<core-service><schema-synchronization>"
"About ADF solution for Update Preview issue in XPM","<2013-sp1><ambient-data-framework>"
"What is causing this LazyRepositoryLocation - Cannot find repository error?","<dxa><dxa-java><dxa-1.2>"
"Retrofitting DXA publications to an existing BluePrint","<2013><dxa><blueprint><dxa-1.2>"
"Fredhopper Indexer's qserver instance consuming too much CPU","<fredhopper><query>"
"GUI extension where to get Extensions.TridionDashboard.dl?","<2011><gui-extensions><2011-sp1>"
"Does Tridion Connector 1.3 for Media Manager work with a proxy server?","<2013><ecl><media-manager>"
"Upload Button in the Form in Tridion","<content-manager>"
"How does solve ADF solution for Update Preview issue in XPM","<ambient-data-framework><2013-sp1>"
"'<>' operator is not allowed for source level below 1.7","<dxa><dxa-java><dxa-1.2>"
"Not able to find DD4T 2.0 (.NET) API source code","<dd4t>"
"Getting Error {""error"":""invalid_grant""} to add the TtmCdEnvironment id in SDL Web8","<web8><topology-manager>"
"Best practice & Implications of folder structure for XPM","<experience-manager>"
"Removing old Publishing Target in Web 8.5","<web8.5>"
"CME error: Item of type 'CmEnvironmentData' with id 'Tridioncm_DEVSQLCMSDSQL2016CMSD' does not exist","<content-manager><web8.5><topology-manager><powershell><publication>"
"Coreservice Configuration for Max Instances | Throttling Configuration","<2013-sp1><core-service>"
"Topology manager not installed: Authorization denied","<web8.5><installation>"
"Rendering static images in DXA CSS","<dxa>"
"Using DXA Sources in an existing DXA WebApp","<dxa><dxa-net>"
"Broker: find a Page using a specific Component and Component Template","<2013-sp1><content-delivery><broker><query><brokerquery>"
"Not reflecting the field restriction while adding field constraints to a Schema","<web8><sdl-tridion><web8-cu1>"
"Is EventPhases.Initiated and EventPhases.TransactionCommitted in Event System always triggers from same Tridion server","<2013-sp1>"
"Coreservice Clients in Workflow External Activities","<2013-sp1><workflow>"
"High CPU utilization after upgrading to web 8.5","<web8.5><dd4t-2><microservices><cil>"
"Client.Create method returns tcm:0-0-0 for Component.Id","<2013-sp1><core-service>"
"Is it Possible to Configure Dedicated Publisher Box by Publication?","<web8><publishing><content-manager><publication>"
"Files are not deleted from incoming queue folder","<web8.5><deployer>"
"Passing values between Entity View and Page View","<dxa><dxa-java>"
"FSDeployerQueue failed to delete serialized command in scaled-out Deployer on SDL Web 8.5","<web8.5><deployer>"
"Items required to publish after upgrading to DD4T 2.2 and Web 8.5","<publishing><dd4t><web8.5><dd4t-2>"
"CD Micro Services Support on cloud platforms","<microservices><docker><service-fabric>"
"Set rights on parent Publication and permissions on Category and Keyword org item","<2013><authorization>"
"How can I get a Localization object to query a different Publication","<web8><dxa><c#><dxa-1.7>"
"Event System to disable transaction save","<2013-sp1><event-system>"
"Missing Business Process Types in Publication dropdown","<publishing><web8.5>"
"Usage of EHCache and Error while registering EHCache caused outage","<web8><dxa><dxa-1.7><spring>"
"Want to publish all content (Pages/DCPs) whichever are using specific Component in shortest possible time","<core-service><publishing>"
"Can Tridion 2013 update files without changing the filename?","<2013>"
"Structure Group prefixes in RTL languages","<web8><structuregroups><navigation>"
"Context microservice throwing error in DXA app","<dxa><web8.5><dxa-java><microservices><context-engine>"
"Resolver for Publications","<2013-sp1><resolver>"
"Publishing getting failed in Template rendering but able to preview the Page","<2013-sp1><templating><template-building-blocks>"
"How to get content of schema dependencies - XSD's like cm_xml_inst.xsd?","<core-service><cme><content-manager>"
"""New Page"" button disabled during SiteEdit/Experience Manager","<2011><experience-manager><siteedit>"
"Faceted search using Tridion Categories and Keywords","<2011><taxonomy>"
"Experience Manager - Create New page error","<experience-manager>"
"Equivalent of FieldTypeComponentLink in .NET?","<2009><event-system>"
"Content Porter Package Import Errors","<2011><content-porter-2013>"
"Distinguish exceptions thrown by the Tridion core service","<core-service>"
"DD4T resolvelink for a page not working","<dd4t><linking>"
"How can I redirect users from my old HTTP Tridion CME instance to my new HTTPS version of the CME?","<2011><cme><configuration>"
"Tridion 2011 SP1 Core Service Timeouts","<2011><core-service>"
"DD4T No PageFactory configured","<2013><dd4t>"
"Publish Tridion asset to Amazon S3 bucket","<2013>"
"Content Porter Import, Requires some manual configurations?","<2011><content-porter-2013>"
"Tridion 2009 CM and CD Database Segregation in Different Machines: Reasons","<content-delivery><2009><content-manager><database>"
"Process for content deletion?","<content-manager>"
"Moving components/folders from child publication to parent publication without breaking its dependencies","<2011><blueprint>"
"Publishing failure with DD4T and ECL Multimedia Links","<publishing><2013><dd4t><ecl>"
"Resolve component link in dynamic publishing","<2009><dynamic-linking>"
"Why I am getting Licenses error in SDL Tridion 2011?","<2011><content-porter-2009>"
"Directly selecting an item for promotion using SmartTarget","<smarttarget>"
"DD4T Xml Serialization Error","<2013><dd4t>"
"SystemWideListXml() not returning complete results","<core-service>"
"Component Opening issues","<2011><cme>"
"SI4T and category/keywords","<2011><si4t>"
"Tridion Search User Credentials","<2013><configuration><search>"
"DTAP Environment in SDL Tridion","<cme>"
"Publishing issue for a page data String index out of range: -7709","<publishing><deployer>"
"Does Tridion have an event which can be triggered when importing items via Content Porter","<2011><content-porter-2009><event-system>"
"Tiny URL and URL rewriting","<2013><content-delivery>"
"underscore is coming from broker for published image path","<broker><binary>"
"Device Simulators in XPM","<experience-manager>"
"How to check the component based on particular schema","<gui-extensions>"
"Get PageTemplateName at DWT","<2011><dwt>"
"Tridion:Publish same multimedia component in multiple structure groups","<2013>"
"TCM URI getting appended to image name while publishing in case of Dynamic Component Presentation","<2011><publishing><templating><multimedia>"
"Getting values for HTML meta tags","<2013><templating><dynamic-publishing>"
"What does ""No possibility to remove or change the metadataXml once it is added"" mean?","<tom.net>"
"Linked Component Title in CM DB","<2011>"
"Properties on Address Book in AM","<audience-manager>"
"The type or namespace name 'Component' could not be found (are you missing a using directive or an assembly reference?), yet references are added","<2013>"
"Invalid procedure call or argument: Content Porter","<2011><content-porter-2009><razormediator>"
"HTML Script Tag be shorten by Tridion","<2011><templating>"
"Intergrate Social Tools in CMS","<content-manager>"
"Core Service API : Does it contain Tridion Constants values","<core-service><api>"
"Getting error while setting up AudienceManager","<audience-manager>"
"Experience Manager and multi value (embedded) fields","<2011><experience-manager><dd4t><2011-sp1>"
"Could not initialize class com.tridion.linking.Linking","<linking>"
"Can we take backup of tridion user?","<content-manager><database>"
"Clear field value from Anguilla framework","<2011><gui-extensions>"
"Upgrade to Tridion 2013 SP1","<2013><upgrade><content-porter-2013>"
"The request failed with HTTP status 503: Service Unavailable - Translation Manager","<translation-manager><worldserver>"
"Error while exporting through Content Porter 2013 SP1 | Root element is missing","<2013><content-porter-2013><content-porter>"
"XPM: Moving component presentations in a page","<2013><experience-manager><componentpresentation>"
"2013 Licence Error - Can't create TDSXGit.Configuration","<2013><licensing>"
"Tridion 2013 sp1 upgrade - New user add not working","<2013><upgrade>"
"Level 30's Files Re-organization","<2011><cme>"
"What's the fastest way to get all Components content using Core Service?","<2011><core-service>"
"Tridion 2011 SP1 Recommended Oracle Patch Set Update","<2011><database><infrastructure>"
"How do I access a metadata field on my multimedia component from within my Dreamweaver template?","<dwt>"
"Unpublish PDFs from Tridion file system using Core Service","<core-service>"
"Insert youtube and vimeo video in the wysiwyg editor by replacing component link","<2011><publishing><templating>"
"Content Porter generating SQL connection error","<content-porter-2009>"
"Accessing configuration from events system when triggered via the core service","<core-service><configuration><event-system>"
"Why my web project with added x86_x64 Tridion's dlls does not work properly on my local 32bit machine?","<content-delivery><configuration><dd4t>"
"Error on page creation using Tridion UI","<2011><experience-manager>"
"500 error after enabling LDAP authentication on SDL Tridion 2011SP1","<security><ldap><2011>"
"Getting ""This key is already associated with an element of this collection"" while importing the pages using content porter 2009","<content-porter-2009>"
"tcdl is undeclared prefix issue while publishing DCP","<2011><content-delivery><publishing><templating>"
"Multiple Publications - One broker database","<content-delivery><broker><odata><architecture>"
"GUI extension to hide field in 2011 SP1","<gui-extensions>"
"How to override the publishpath of a structuregroup?","<publishing><binary>"
"In the Event System what is the easiest way log all items deleted when an Organizational Item is deleted?","<event-system><tom.net>"
"Tridion UI Update Preview Bad Request","<2011><content-delivery><configuration><experience-manager>"
"Dynamic Linking Across Multiple Web Publications","<content-delivery><dd4t><dynamic-linking>"
"Unable to search in Content Manager (503 Error)","<2011><content-manager>"
"Registering .dll to be callable via VBScript","<2011><upgrade><vbscript>"
"Dynamic Linking on classic ASP pages not working","<2011><content-delivery><upgrade>"
"What is the Razor Code for Experience Manager enabling a link in Tridion 2011?","<experience-manager><siteedit>"
"Transport failed: Could not transport tcm_0-64353-66560.Content.zip using HTTPS, cause: Not Found","<content-delivery><publishing>"
"Is it possible to make Tridion Template Logging use Enterprise Library version 5.0?","<2011><templating>"
"Tridion.ContentManager.CoreService.Client with .NET Core","<core-service>"
"Remove legacy templates from SDL 2011 SP1 before upgrade to sites 9","<2011-sp1>"
"Help need for tridion 2013 SP1 and SDLweb 8.1 Presentation on the same system ( OS :- windows server 2012 R2)","<2013><web8><content-delivery><topology-manager><dynamic-linking>"
"Context path not working with micro-services","<content-delivery><web8.5><sdl-tridion><microservices>"
"Tridion DXA page not loading (loads eventually but take whole lot of time)","<2013-sp1><dxa><sdl-tridion>"
"Tridion Broker Connection pool size","<content-delivery><web8.5><broker><api>"
"getting error in application ""Semantic schema not defined in Localization""","<dxa><web8.5><sdl-tridion><dxa-1.5>"
"How to traverse Tridion xml data using Tridion Object Model?","<tom.net>"
"Custom TCDL tag on page is not processed","<content-delivery><web8.5><tcdl>"
"Connect to ECL via .NET giving permission issue","<core-service><sdl-tridion><ecl><c#>"
"Amazon SQS as a JMS for caching invalidation","<web8.5><sdl-tridion><microservices>"
"Facing a warning in DD4T site with Tridion.ContentDelivery dll","<web8.5><dd4t><dd4t-2>"
"iframe schema require 2 byte space before </iframe>","<dxa><web8.5><sdl-tridion><dxa-1.5>"
"Troubles with Boolean values, of Trigger type (SmartTarget, Tridion 9)","<smarttarget><sites-9><experience-optimization>"
"SDL Tridion Sites Development Platform","<sdl-tridion>"
"Not Able to start Deployer Service and Discovery Service after Sdl Web 8.5 Install","<deployer><discovery>"
"How to read Plugin.Settings from outside of a Controller in Alchemy?","<a4t>"
"Amazon MQ to scale Deployer worker","<content-delivery><web8.5><microservices>"
"Error while uploading Template assembly with TcmUploadAssembly.exe using domain name to SDL 8.5","<web8.5><templating><content-manager>"
"CIS Performance log","<dxa><web8.5><model-service><cis>"
"Site 9 DXA Example site publishing issue","<dxa><topology-manager><sites-9><dxa-2.1>"
"DXA expansionDepth configuration","<dxa><web8.5><dxa-2.0><model-service>"
"AEM Asset Selector (6.5) and SDL Web 8.5 Integration","<web8.5><media-manager><adobe>"
"Tridion Web8.5 Token Service Not working","<web8.5><sdl-tridion><sites-9>"
"Adding users to Tridion when using SAML","<sites-9><user-management><sso>"
"DefaultMediaHelper.getScreenWidth() function is throwing error when useragent is null","<dxa><dxa-2.0>"
"SmartTarget Promotion Query Randomly Throws Exception","<smarttarget><java><experience-optimization><cil><query>"
"Event System add-on in Sites 9.1 'Pending Activation""","<event-system><sites-9.1>"
"DXA 2.1 .Net Error - Context Service","<dxa><sdl-tridion><sites-9>"
"Is DXA 1.8 compatible with Tridion 9.1?","<dxa><sdl-tridion><sites-9.1>"
"DXA 2.1 with Tridion 9","<dxa><sdl-tridion><dxa-2.0><microservices>"
"failed to load assembly microsoft.data.edm in web 8.5 tridion migration from 2013 sp1","<web8.5><discovery-service>"
"Get MIME Type of Multimedia Types based on file extension using TOM.NET (.NET Templating)","<web8.5><templating><tom.net><c#>"
"Creating a Dynamic Distribution List for +1 'starts with' filter-items","<outbound-email><audience-manager><2013-sp1-hr1>"
"How to create a simple API using dxa","<dxa><api>"
"Entity model json coming null","<dxa><api>"
"DXA 2.1 Map two publications to the same application","<dxa><sdl-tridion><dxa-2.0>"
"GraphQL componentPresentation null issue","<graphql>"
"Content microservice proxy error in a load-balanced environment","<content-delivery><web8.5><microservices>"
"Publications are not loading in WEB 8.1","<web8>"
"Audience Manager event system conflicting with DXA","<dxa><audience-manager>"
"Why do entities which have embedded objects need semantic markup?","<dxa><dxa-1.5>"
"How to get the Publish & Republish state explicitly of an item on PublishTransaction Event at Committed phase?","<event-system><2013-sp1-hr1><publishtransaction>"
"SI4T Error: Error creating bean with name 'JPASearchBinaryContentDAO'","<si4t>"
"Decimal numbers on UGC Ratings","<2013-sp1><ugc>"
"Using multiple custom meta data keyword Criteria in a single query as LIKE operators","<broker><metadata><query>"
"Installing SDL web 8 in a load balancing environment","<web8>"
"Changing MTSUser after installation in web8","<web8><content-manager>"
"DXA model mapping issue","<dxa><dxa-1.4>"
"Can assign a Workflow activity to multiple users from an Automatic Activity","<2013-sp1><workflow>"
"Problem using XPM to edit image","<experience-manager><dxa><dxa-java><dxa-1.5>"
"Workflow Designer | The Operation has Timed out","<workflow><2011-sp1><visio-designer>"
"Clean the ghost published records","<2011><database>"
"Is it mandatory to use the STUB schema, installed by DXA Media Manager Module?","<web8><dxa><ecl><dxa-1.5><media-manager>"
"Tridion Content Manager Search Host High CPU and Memory","<2013-sp1><search><solr>"
"Console Errors during XPM load","<2013-sp1><experience-manager>"
"DXA Java 1.5 on Web 8.1.1 | Localization not found error when browsing homepage","<web8><dxa><dxa-java><dxa-1.5>"
"How to route a request to a static html file in DXA Java 1.5","<web8><dxa><dxa-java><dxa-1.5>"
"How can we restrict users or group to manage user management without System Administrator Access","<2011><user-management>"
"Dynamic Component Presentation indexing using DXA Search module (SI4T)","<web8><dxa><si4t>"
"Cannot read PluginName of undefined","<web8><a4t>"
"Render Component Presentation cd_dynamic 7.1.0 error: cannot access Page","<java><content-delivery><dynamic>"
"DXA integration with Azure","<dxa><azure>"
"Using Machine Translation in WorldServer10.3.0","<worldserver>"
"TDSE: ORA-12504: TNS:listener was not given the SERVICE_NAME in CONNECT_DATA","<web8><oracle>"
"DXA 1.5 TBBs do not output Multimedia Component Field - External Url, recursively","<dxa><templating><multimedia><dxa-1.5>"
"DD4T.ContentModel.Component does NOT include URI","<2013-sp1><dd4t><componentpresentation><component>"
"SDL Web-8, Topology Installation","<topology-manager><discovery-service>"
"Connecting to Core Service via .NET in SDL Web 8","<core-service><web8>"
"Resolver affected by event system in Tridion 2013","<2013-sp1><event-system><custom-resolver>"
"What are the TBB changes required to enable GZip Compression in Tridion 2013 sp1?and also its Pros and Cons","<2013-sp1><dd4t-2><dd4t-java>"
"Updating the value of a keyword by Core Service in SDL Tridion 2013","<core-service><sdl-tridion>"
"What will the data type in Java be, when Schema fields type is Component Link in Tridion","<2013-sp1><dxa><dxa-java><dxa-1.2>"
"BinaryData Folder issue in DD4T","<dd4t><binary>"
"Arabic Content Not Retrieved from Broker correctly in Web 8","<web8><dxa><dxa-1.5>"
"Error regarding using core service in SDL Web 8","<core-service>"
"When is JuggerNET bridge initialized?","<content-delivery><java><iis-and-asp.net>"
"Get ComponentPresentations of an Array of ComponentURIs","<componentpresentation>"
"How to disable the high priority publish option in SDL Tridion","<2013><publishing><cme>"
"HTML Script Tag be converted by Tridion","<2013-sp1>"
"Experience Manager Best practice for Default SiteEdit tags","<experience-manager>"
"Experience Manager configuration issue. StorageTransactionId is getting appeneded to page url","<2013><experience-manager><dd4t>"
"How can we add custom extended field on top of the screen while new contact creation?","<outbound-email><audience-manager>"
"Email- Address field should display as mandatory while creating new contact form","<audience-manager>"
"Can we add a new custom field in contact creation form which comes as drop down","<audience-manager>"
"How can I get the contact from contact identification keys?","<audience-manager>"
"Content Porter Server Name Issue (Solved)","<content-porter-2013>"
"Tridion CM 2013 SP Install - Blank Page?","<2013><2013-sp1><installation>"
"SmartTarget Promotion issue","<2013><smarttarget><fredhopper>"
"Tridion GateWay timeout errors while previewing navigation file","<cme><2013-sp1>"
"TCM User Access. 401 Unauthorized: Access is denied due to invalid credentials","<cme><2013-sp1><content-manager><user-management>"
"Where is my CreateUnlisted button?","<2013><2013-sp1>"
"TRI - Error importing content - Value cannot be null. Parameter name: packageName","<2013-sp1><dxa>"
"Implementing Multiple deployers/Broker databases","<content-delivery>"
"Rich text field replaces HTML code reference with actual character in source tab in tridion component","<rtf>"
"Linking configuration","<2013><configuration><linking>"
"Not able to add CM in Content Porter","<content-porter-2013>"
"Structure groups hierarchy to be used for parent child relationship","<2013-sp1><dwt><c#>"
"What's the email address to get in touch with SDL for product pricing information","<2013>"
"Tridion Powertools 2013 sp1 installer throws Error 1001","<powertools>"
"Get publication ID of publication from where page is getting published","<event-system>"
"How does the CXC Language Cloud BeGlobal API Key work?","<translation-manager><language-cloud>"
"401-Unauthorized: Access is denied due to invalid credentials","<2013>"
"Automated CME functional validation after upgrade, hotfix or patch installation","<2013><upgrade><powershell>"
"Hows does SmartTarget sort results from multiple promotions?","<smarttarget>"
"Search components based on fields","<search>"
"Why would .getTitle() in Anguilla sometimes not return a title?","<cme>"
"2 of the 3 sites cache not resetting","<2013><cache-channel-service>"
"Failed initializing the External Content Library with id flickr","<2013><ecl>"
"Configuring publication target for SmartTarget 2014","<2013><smarttarget>"
"Components are not getting displayed while adding into CT presentation","<content-manager>"
"Will there be a Java Tridion Reference Implementation?","<dxa>"
"SmartTarget Navigation live attributes?","<smarttarget>"
"Possible threading problem in SI4T","<content-delivery><2013-sp1><si4t>"
"TRI - Adding new vocabularies","<2013-sp1><dxa>"
"Multiple embedded schema types in embedded schema field","<schema><embedded-items>"
"Shared Home Structure group has the wrong PublishPath which means items are deployed to the wrong place","<cme><2011-sp1>"
"Rendering Thread Count - Publishing","<2013><publishing><publishtransaction>"
"Issue in converting DWT page template to Razor Template page template","<2011><razormediator>"
"Exception while trying to render ""ComponentPresentationList"" pushed as a package variable ""MainSectionComponents""","<2011><razormediator>"
"RTF Editor - Edit Existing Tables?","<2013><2013-sp1><rtf>"
"TaxonomyService - Processing found keywords (0)","<2011-sp1><taxonomy>"
"Configuring the Web application for multilingual Web sites","<2013-sp1><java><dxa>"
"setting a value in the text field of a component in SDL Tridion","<2011-sp1><component>"
"Decimal code is changed to Sign symbol in RTF when switch between Design and Source tabs","<2013><rtf>"
"How can ADF capture the data from visitors session and store it into a Database","<ambient-data-framework>"
"Error adding TtmMapping","<publishing><web8><topology-manager>"
"HttpDeployer not publishing to Azure file storage","<2013-sp1><deployer>"
"Applying advanced styles to embedded RTF Images in DXA","<dxa><rtf><image>"
"DXA 1.2 Modules for Java?","<dxa><dxa-java><dxa-1.2><2013-sp1-hr1>"
"How to use Tracking Key in DD4T application","<dd4t><profiling><personalization><tracking>"
"Install DD4T templates for Tridion Web8","<dd4t><web8>"
"Not able to create a new site through wizard option available in Web 8 CME","<web8>"
"Publishing images to cookieless domain (adding cookieless domain in images' URL)","<publishing><multimedia><image>"
