title,tags
"How to get publish transaction ID in publishing event?","<2013><event-system>"
"Can you get all component presentations where CT has id 40 and Component contains keyword A and keyword B through Tridion OData service","<2013><odata>"
"What is the SDL Tridion Reference Implementation version number?","<dxa>"
"Is a GUI extension the proper way to capture information from our SSO system?","<cme><gui-extensions><sso>"
"Extending Linking for .NET","<dynamic-linking>"
"CPAssembler error: Web control file is not located inside your website error","<content-delivery><dynamic-linking>"
"Permission to delete locked pages, components etc?","<2013><2013-sp1>"
"What are the minimum files/config required by a Smart Target enabled deployer?","<smarttarget><deployer>"
"Getting Exception Invalid object name 'MULTIPLE_OPERATIONS' while running the tridion 2013 upgrade database script","<2013-sp1><upgrade><database><installation>"
"How can I enter right-to-left (RTL) content?","<2013><configuration><rtf>"
"What does ""pending"" mean in SmartTarget 2011 business manager when updating a promotion","<fredhopper>"
"Porting updated components and schemas, must I import twice?","<2011><content-porter-2009>"
"Unable to install TcmTemplateBuilder on my localmachine","<template-builder>"
"Issue with GetCompLink in the Tridion Reference Implementation","<dxa>"
"SDL Tridion and SDL Quatron - version compatibility","<2013><installation>"
"SDL Tridion and SDL SmartTarget DTAP recommendations","<2013><smarttarget>"
"Copying Tridion SmartTarget Promotions between environments","<smarttarget>"
"Is there a way to lock a page object to for a period of time?","<2013>"
"Getting ORA-01002 error when saving the page","<2011><2011-sp1>"
"LegacyVBscript: Page fields not accessible on Legacy VBscript dynamic Component Template during rendering","<publishing><2013-sp1><vbscript>"
"Attempted to read or write protected memory. This is often an indication that other memory is corrupt","<content-manager><2011-sp1>"
"Stored procedure failed: SP_PUBLICATIONS_FIND_CONFLICTS ORA-06550: line %s, column %s:","<2013-sp1><content-manager>"
"Migration from Tridion 2011 sp1 HR1 to Tridion 2013 SP1","<2013>"
"Application pool being stopped once browse the Tridion CMS site","<2013>"
"How do I update my Component (metadata) fields while copy/pasting a Component, using EventSystem?","<event-system><2011-sp1>"
"How do we can implement Custom controller for business logic and ViewModel seperation","<dd4t><componentpresentation>"
"CoreService: how to get a list of Protocol schema's","<2013><core-service>"
"Web8 Upgrade of CME Ribbon GUI Extension","<web8><upgrade>"
"Promotional content unable to get TCDL or tag/control mark up in ST 2014","<2013><smarttarget>"
"In Creating Content, how do I add a line in the text?","<content-manager>"
"Can Tridion's OData service be updated?","<2013><odata><componentpresentation><rest>"
"Steps for install DXA 1.4 .Net & Java","<dxa><web8><dxa-java><dxa-1.4><dxa-net>"
"DD4T 2 Java java.lang.ClassCastException","<dd4t><java><jsp>"
"Tridion Outbound emails - Mailing statistics - Can we hide some columns like failed/Delivered","<outbound-email>"
"Error while updating Discovery Service Registrations","<web8><topology-manager><discovery-service>"
"Could not autowire field in custom controller","<dxa><2013-sp1><dxa-java><dxa-1.4>"
"SDL web 8 | Multiple Publication same target Mapping","<publishing><web8><topology-manager>"
"Cannot add a new Topology Manager Mapping","<web8><topology-manager><discovery-service>"
"ImportExport API - Access is denied for the user NT AUTHORITY\NETWORK SERVICE","<a4t><importexportservice>"
"XPM unexpected behaviour when creating a page or updating preview","<experience-manager><dxa><web8><session-preview>"
"DD4T 2.0 using ViewModels and ModelControllerBase how to add Page Level XPM markup","<dd4t>"
"DD4T 2: binding viewModel with not using the rootElementName in .net","<dd4t><2013-sp1><mvc>"
"Translation Manager - Email Sending","<2013><translation-manager>"
"Disable XPM for smartphone/tablet","<2013><experience-manager><dd4t><2013-sp1>"
"Customize 500 Error Page in DXA 1.4 Java","<dxa><web8><dxa-java>"
"Content Delivery DCP DB Decoding Issue","<content-delivery><database><encoding>"
"Does DD4T version 1.31 support SDL Web 8?","<dd4t><web8>"
"Web8 | Translation Manager | Translating Job timeout","<translation-manager>"
"How to get the published date of page displayed on Page Template using VB Script Templating","<2011><vbscript>"
"Web8 | Error in Translation Manager | SDL Language cloud","<web8><translation-manager>"
"Load Data into Tridion 2011 from XML in Java","<2011><core-service>"
"How to delete contact extended detail field","<web8><configuration><audience-manager>"
"LdapAuthenticationHttpModule is throwing errors","<ldap><web8>"
"Add an image to the banner of a schema: Intranet Migrated Content?","<image>"
"Cache list size seems limited to 128 items","<2013-sp1><cache>"
"DXA Ehcache settings","<2013><dd4t><dxa><dxa-java><cache>"
"LRUPolicy is not loaded","<2013-sp1><cache>"
"Default location when browsing components","<schema><2013-sp1><component>"
"Running DXA under IIS Express","<dxa><dxa-net>"
"Tridion Delivery API/DD4T,How it connects internally to the Broker DB?","<content-delivery><dd4t>"
"Tridion not generating any logs on CD","<content-delivery><2013-sp1><logging>"
"DXA 1.4 How to use an empty region","<dxa><dxa-java><dxa-1.4>"
"Protected content strings in JSON producing DD4T TBB(s)","<dd4t><template-building-blocks>"
"How can I configure DXA to get Context claims from ADF?","<dxa>"
"How to set timeout value for Content service?","<web8><dxa><dxa-1.5><cil><content-delivery>"
"Alchemy | Extend the Publishing Dialog GUI to include some info to the publish instructions","<web8><gui-extensions><sdl-tridion><a4t>"
"What is the best approach for Mapping Broker and Web-Applications","<broker><deployer>"
"Can we use same OData Webservice instance to serve content from different Brokers","<broker><odata>"
"DXA 1.5 website is not able to load throwing context service error","<web8><dxa><dxa-1.5><context-engine>"
"Can Publish Transaction be updated via core service?","<2013-sp1><core-service><publishing><publishtransaction>"
"Where to get the Deployer Extension Jar files","<deployer-extension>"
"Overriding Publishing Queue","<2013><core-service><publishing><event-system><publishtransaction>"
"DD4T ComponentPresentationFactory - Caching issue","<dxa><dd4t><componentpresentation><dxa-1.2><caching>"
"Where is DXA ViewBag RegionName set?","<dxa>"
"query the Broker database on SDL Web 8.5","<content-delivery><broker><web8.5>"
"Are the properties in the DXA WebRequestContext documented?","<dxa>"
"Converting Spring DXA Webapp to Spring Boot APP","<dxa><dxa-java>"
"Using Html.DxaEntityMarkup() in View","<dxa>"
"Unable to authenticate against Core Service LDAP","<core-service><dxa><web8.5><ldap>"
"Implementing a custom storage type and having unpublish issue","<2013-sp1><storage-extensions>"
"LazyInitializationException in content service logs","<content-delivery><web8><sdl-tridion>"
"Issue with Rendering Component Presentations in TridionHelper.cs","<2013><2013-sp1><dd4t><dd4t-2>"
"DXA Framework issue (without the Core)","<dxa>"
"Web 8 New Topology Manager publishing to wrong Database","<web8><database><topology-manager>"
"keyword based Trigger type in DXA","<dxa><experience-optimization><taxonomy><dxa-1.7>"
"Fredhopper qservers high response time issue","<2013-sp1><smarttarget><fredhopper>"
"Does SDL Web support HTTP/2 (CM and CD)?","<web8.5>"
"Imported RAZOR TBB in Workflow does not render","<2013-sp1><workflow><razormediator>"
"""Content Delivery third-party JAR file reference"" of Tridion2013SP1","<2013-sp1><content-delivery>"
"Content Porting Localized & Renamed Structure Groups Fail","<content-porter-2013><structuregroups><localization>"
"DXA: Disable DD4T EHCache","<dxa><dxa-java><dd4t-2><dxa-1.6><dd4t-java>"
"Session service killed with DXA and XO","<dxa><web8.5><experience-optimization><dxa-1.7>"
"Linux and JBoss: Clustering software recomendation","<2013-sp1><java><linux>"
"Tridion Content Manager Batch Processor Service Error - Tridion 2013 SP1","<2013-sp1><cme>"
"Custom storage extension - obtain keyword children TCM ids","<2013-sp1><storage-extensions>"
"Not able to open a page template","<2013-sp1><templating>"
"Finding Mandatory fields","<core-service><schema>"
"DXA & DD4T: Activate json compression","<2013-sp1><dxa><dxa-java><dd4t-2><dd4t-java>"
"Custom controller SDL DXA (Bad Request) JAVA DXA 1.5 exception","<2013-sp1><dxa><dxa-java><dxa-1.5>"
"Page unpublished and deleted from CME, but page entry still exists in DB. How to clean the entry in DB?","<publishing><cme><broker>"
"Multiple template classes in assembly have the same TcmTemplateTitle attribute - TcmUploadAssembly.exe","<web8><templating><tom.net>"
"Event System Tridion 2013 SP1 - Cannot find connectionstring","<2013><event-system>"
"Schema mapping issue","<dxa>"
"SDLWeb8.5 : Preparing Deployment Failed due to Polling for notification for destination","<web8><web8.5>"
"Unable to save a multimedia component by core service","<web8><core-service>"
"Upgraded DD4T app to Web 8.5, multiple Caching Providers configured","<web8.5><dd4t-2><dd4t-java><cil>"
"Mixing Workflow with Experience Manager (Session Preview)","<2011><experience-manager><workflow>"
"Migrating Event System from 5.3 to 2011 SP1","<2011><publishing><event-system><upgrade><5.3>"
"What are the advantages and disadvantages of using a ""General Content"" Schema?","<schema><content-modeling>"
"Tridon UI 2012 Session Preview Web Service using incorrect encoding","<experience-manager><content-delivery><configuration>"
"What are the best practices to manage the sitemap for a Tridion website?","<publishing><templating><event-system>"
"How to Increase content Porter Importing File Size","<content-porter-2009>"
"SQLs directly to the Broker","<content-delivery><broker>"
"Tridion still uses c:\windows\temp folder at publish time","<publishing><configuration><content-delivery>"
"Modify the WYSIWYG editor","<2011>"
"External Content Libraries","<external-integrations><2013><ecl>"
"Unable to unpublish the content and remove a Publication Target in Tridon 2011?","<configuration>"
"Is there a tool to add multiple images to Tridion?","<2011><image>"
"Tridion 2013 vs 2011 SP1 architecture","<2013>"
"Move component to another folder","<2009>"
"Can't edit binary files in Experience Manager","<content-delivery><experience-manager><configuration>"
"Combined use of templating techniques within a single CM instance?","<content-delivery><templating><dd4t>"
"Why can't I see Tridion item XML in IE in version 2013?","<2013>"
"Publisher not picking up template changes","<2011><publishing><templating>"
"Get a list of all schemas for a publication, including inherited ones via core service","<schema><core-service>"
"Or Criteria taking forever to execute using tridion content delivery api","<content-delivery>"
"How to configure the Tridion Monitoring Service?","<content-delivery><configuration><monitoring>"
"How can I automatically generate an email when a specific content item publishes in Tridion 2009 SP1?","<publishing><2009>"
"Tridion Core Service endpoint","<2011><core-service>"
"ADF behaviour in Web 8+","<2013-sp1><web8><web8.5><ambient-data-framework>"
"Tridion 2013 SP1 Core service timeout with frequent requests","<2013-sp1><core-service>"
"Migrating SDL Tridion 2013 SP1 to another environment","<2013-sp1><content-porter-2013-sp1>"
"Tridion GUI Custom Extensions Upgrade to 8.5 - finding resources in new locations","<web8.5><gui-extensions><upgrade>"
"How to install the DXA 2.1 Model Service extension","<dxa><installation><model-service><dxa-2.1>"
"Web 8.5 Deployer State Store setup?","<web8.5><deployer>"
"Tridion GUI Custom Extensions Upgrade to 8.5 - replacing window.dialogArguments (unPublish)","<cme><web8.5><gui-extensions><upgrade>"
"JavaScript running before Tridion GUI Resources are loaded","<cme><web8.5><upgrade><javascript>"
"How to access published Excel, XML and Json file in dxa 2.0","<dxa><web8.5><dxa-2.0>"
"Unable to delete Publication - SDL Tridion 2013 SP1","<2013-sp1>"
"Rich Text Box: Option to select multiple styles from drop down","<cme><web8.5><gui-extensions>"
"DXA 1.8 ""BinaryData"" files is not creating under \dxaWeb\BinaryData\publication-id\system\config\ when I build dxaWeb app","<dxa><web8.5><dxa-java><java><dxa-1.8>"
"Publishing fails with SI4T and aws-cloud-search AmazonWebServiceClient.beforeMarshalling - NoSuchMethodError","<publishing><web8.5><si4t><publishingfailed>"
"Can't connect to external SQL Server DB","<web8.5><event-system><sql-server>"
"Unable to connect to custom controllers after enabling localization","<dxa><web8.5><dxa-2.0><topology-manager>"
"Efficient approach to get Component Presentation objects as array of JSON objects in Java (non-MVC)","<web8.5><componentpresentation><cil><cis><restfulapi>"
"Tridion upgrade + in progress Translation Jobs","<translation-manager><upgrade>"
"Error when using SDL Web 8.5 deployer and clustered Redis setup","<web8.5><deployer><redis>"
"DXA Model Service : Returns complete data","<dxa><dxa-2.0>"
"DXA 1.8 Java web app looking the VariantId='Y29uZmlnLWJvb3RzdHJhcA' but content service is returning only the VariantId='WyNkZWYjXQ=='","<dxa><content-delivery><web8.5><dxa-1.8><content-service>"
"Adding custom instructions","<web8.5><content-manager><external-integrations>"
"Publishing fails in Cloud Search with error Could not load SearchIndexer","<publishing><web8.5><si4t><publishingfailed>"
"Web service that queries Broker Database outside of SDL Web 8.5?","<content-delivery><web8.5><broker><odata><brokerquery>"
"How to publish a particular version of Page using Core Service","<core-service><web8.5><powershell>"
"Tridion ECL Implementation","<sdl-tridion><ecl>"
"Setting up Web 8.5 Experience Manager with legacy publishing","<publishing><experience-manager><web8.5><configuration>"
"Publishing fails in SI4T Solr Search with error multiple values encountered for non multiValued field skill","<web8.5><search><si4t><publishingfailed><solr>"
"DXA 2.1 Upgrade Content Import Fails Due to TemplatePurpose Property","<dxa><upgrade><sites-9><dxa-2.1>"
"How to query for multiple custom metas using Content Service microservice in Web 8.5?","<web8.5><content-service>"
"Sites 9 licensing model","<licensing><sites-9>"
"Enable remote JMX monitoring for DD4T webapp","<2013-sp1><dd4t><java><iis-and-asp.net>"
"DXA 2.0 API to Retrieve DCPs as Entity Models in a REST API","<dxa><web8.5><broker><dxa-2.0><componentpresentation>"
"DXA website header and footer do not work on DXA 2.1","<dxa><sites-9><dxa-2.1>"
"DXA 2.1 website returns 500 Internal Server Error after install","<dxa><sites-9><dxa-2.1>"
"Loading page components in parallel","<dxa><web8.5><component><dxa-1.8>"
"Where can I find JsonFeedView.jsp for DXA 2.0","<dxa><dxa-java><dxa-2.0><json>"
"Resolving tcdl tags for DCP and JSP Page - REL tags in combination with JSP tags are not working","<web8.5><deployer><tcdl><jsp>"
"ECL - GetTemplateFragment - Empty Attributes","<dxa><ecl><dxa-2.0>"
"Why is WebRequestContextImpl annotated as Primary, can it be removed in next release?","<dxa><dxa-java><dxa-2.0>"
"What is Virtual folder in SDL Tridion","<2011><2013>"
"Tridion Upgrade to 2011 has few Deprecated Classes","<2011>"
"Tridion User Last Login Info","<cme><2009>"
"How can I create a custom menu list of components in the SiteEdit Ribbon Toolbar in Tridion UI 2012?","<experience-manager><gui-extensions>"
"Tridion Upgrade 2009 to 2013","<2013><2009><upgrade>"
"SDL Content Porter SP2 unable to save Page Template","<cme><content-porter-2009>"
"Event System PublishEventArgs page subscribe is not being triggered","<publishing><event-system>"
"In Tridion UI-2012, the position of the selection area of CPs is not in the proper place","<experience-manager>"
"Experience Manager 2012 - Altering CSS/UI","<2011><experience-manager>"
"Purge Tool disabled due to access denied error","<2011><iis7><purgetool>"
"Client-side QA Testing Approaches?","<cme><content-manager>"
"Building Blocks Tree Nodes Sorting","<2011>"
"Template Builder fails with incorrect content type error after network changes","<2009>"
"Tridion.ContentManager.Data FileNotFoundException","<core-service><2013>"
"Content Porter 2.3 Tridion 5.3 import error","<content-porter-2009><5.3>"
"Why don't image Thumbnails update in Components after updating the Image's Multimedia Components?","<2011><cme>"
"What is the differences on the result of Tridion UI 2012 API methods ""getListComponentPresentations"" and ""getAllComponentPresentations""?","<experience-manager><gui-extensions>"
"UUID in Tridion same for every CMS?","<2011>"
"Phase: Deployment Processing Phase failed, Could not transform tcdl file","<2011>"
"How To Debug Tridion 2013 Workflow automatic activity","<2013><workflow><upgrade>"
"CCS and ports/firewall","<2011><configuration><content-manager><network>"
"Access TemplateRepeatIndex inside DWT Conditional","<2011><dwt>"
"Get Schema object from TCM URI","<2011><core-service>"
"How do I check if a Component is the parent or a copy of the parent using the Tridion JavaScript Framework (Anguilla).","<cme><gui-extensions>"
"After upgrade to 2011, Content Delivery server is throwing LogFactory errors","<2011>"
"DCPConfiguration.performReloadConfig: Component not found in tridion broker","<2011>"
"The appropriate update claim has not been set. UI update -2012","<2011><experience-manager>"
"Issue with SetVariable and GetVariable method calls from DWT","<2011><templating><dwt>"
"UI 2012 Entity Pages not writable. Error","<experience-manager>"
"Committing Deployment Failed","<publishing>"
"Author Access to Non-Visible ""Hidden"" Folders?","<2011><cme><2013><authorization>"
"Error while creating multimedia component using core service 2013","<2013><core-service>"
"Custom Core Service page working locally in Visual Studio but not when deployed in IIS on Tridion Server","<core-service><iis-and-asp.net>"
"What is the optimal way to configure IP addressing for the core Tridion 2013 SP1 infrastructure in EC2?","<2013-sp1><infrastructure>"
"Locked since date using core services","<2013>"
"Time zone issue with Tridion database","<2013><dd4t>"
"Integrate ambient data Framework with Java Application","<smarttarget><ambient-data-framework>"
"SI4T configuration: ""No Data Access Object Factory""","<2011><si4t>"
"Adding Video Component to RichTextBox in CME","<cme><rtf><multimedia>"
"Can you control proxy settings for the connection to the SmartTarget webservice?","<2013-sp1><smarttarget>"
"Fredhopper installation under Linux Server","<fredhopper><linux>"
"Code examples for SmartTarget in JSP?","<smarttarget><jsp>"
"How do I configure the XPM regions in the Tridion Reference Implementation?","<dxa>"
"SI4T: Commit failed after getSolrServer","<2011><si4t>"
"Resolve Engine.ResolveItem does not work in Unpublish tridion","<publishing><event-system><publishtransaction>"
"Get Shared Pages for Component using Core Service","<core-service>"
"Transaction aborted when saving Multimedia components-2011 SP1","<2011-sp1>"
"Are extension TBBs for the new XSLT Mediator managed in any way in Tridion?","<2013><xslt-mediator>"
"CoreService NetTcp Connection : The socket connection was aborted","<core-service><2011-sp1><wcf>"
"Is it possible to resize image when upload and copy it a certain directory?","<2011><image>"
"Unable publish page","<2013-sp1>"
"Unable to publish the page?","<2013>"
"Unable to Publish Page Or Unable to Retrieve Publish Transactions from Publishing Queue","<2013><content-manager>"
"How do you render a component presentation using XSLT page template in Tridion 2013 SP1","<2013-sp1><xslt>"
"Site Edit Enabled Content not editable in SDL Tridion 2013 website","<2013-sp1><siteedit>"
"DD4T - No proxy type error","<dd4t><2013-sp1>"
"Search not returning same results on both nodes","<2013-sp1><search><solr>"
"Where to add page meta entries","<dxa><java><dxa-java>"
"Coreservice : Upload Binary File (Couldn't upload the binary file Provided access token has expired)","<core-service><web8>"
"DXA 1.4 Managing page includes","<dxa><dxa-java><dxa-1.4>"
"Unable to update 2013 SP1 to Web 8 for CM","<web8>"
"DXA 1.4 Resolving entities tag for a include region","<dxa><dxa-java><dxa-1.4>"
"Unable to find uuid:xxxxx:Metadata using Java","<core-service><content-manager>"
"How to track the changes made on Page?","<2013-sp1><core-service><event-system><tom.net><publishtransaction>"
"Difference between renderthreadcount and deployerthreadcount","<publishing><2013-sp1-hr1>"
"Web 8 Update Preview error","<web8><experience-manager><session-preview>"
"CIL nuget package does not contain Sdl.AudienceManager.ContentDelivery.dll","<web8><audience-manager><installation>"
"The component is not editable in experience manager in sdl web 8","<experience-manager><web8><sdl-tridion>"
"ERROR : _all.json' not found for Localization | DXA 1.4 .NET web 8.1.1","<dxa><web8><dxa-1.4><dxa-net>"
"Unable to publish binaries to the file system in SDL Web 8.1","<deployer><web8>"
"Tokenservice Capability Not Found Error While registering discovery service","<web8><sdl-tridion><discovery-service>"
"Error Starting Standalone Cache Service","<web8><cache-channel-service>"
"How to update Audience Manager ADF claims","<web8><audience-manager>"
"Is there a way to update publication metadata dynamically while publishing page/component?","<publishing><dd4t><2013-sp1><binary><metadata>"
"DXA 1.4 JAVA Error serializing field XHTML type","<dxa><dxa-java><dxa-1.4>"
"DXA 1.4 Managing empty regions","<dxa><dxa-java><dxa-1.4>"
"Tridion Outbound email unsubscribe link (OutboundEmail_UnsubscribeURL) is always generating invalid url","<outbound-email>"
"SDL DXA Java 1.4 Resolving entityClass for multiple entities with same entityName","<dxa><dxa-java><dxa-1.4>"
"AccessToken - configure time?","<core-service><web8>"
"Dynamic image publishing fails for similar file names","<2013-sp1><templating><dynamic-publishing><publishingfailed>"
"Publishing failure - Unable to store item inside current transaction","<publishing><2013-sp1>"
"Error while accessing DXA 1.4 website","<dxa><web8><dxa-1.4>"
"SDL Web 8 and DXA 1.4 (Java version), Content service causes error","<content-delivery><dxa><web8>"
"Is publishing older components and pages mandatory after DD4T 2.0 Upgrade?","<dd4t><sdl-tridion>"
"dd4t-2-java Spring MVC web application ""ComponentPresentationController""","<dd4t>"
"Solr date format incorrect, sometimes","<2013><content-delivery><deployer><deployer-extension><solr>"
"Upgrade from SDL Triion 2011 SP1 to Web8","<2011><web8><upgrade>"
"Unable to delete item. The item is published","<templating><2013-sp1>"
"Required Database Permissions for Tridion 2013","<database><installation><permissions>"
"Multimedia links to pdfs in RTF are not working for some","<2013><2013-sp1><rtf><multimedia><binary>"
"Razor Mediator Template Timeout on Save","<razormediator>"
"Getting javascript Error in CodeMirror version 0.4","<2013><cme><gui-extensions>"
"PublicationMapping Error occurs on DXA 1.4 Java version, SDL Web 8","<dxa><web8>"
"How to get all Component Presentations with all Custom Meta in single ODATA query?","<java><2013-sp1><odata>"
"Localization [100 ('English')] does not contain includes for Page Type > '99999'?","<2013><2013-sp1><dxa>"
"Where are OData/ADF Access Tokens stored?","<content-delivery><configuration><odata><ambient-data-framework>"
"What might cause hibernate.service.UnknownServiceException","<content-delivery>"
"Personalization with Target Groups - Customer Characteristic","<2013><content-delivery><personalization>"
"How can we consume the Binary Content using Tridion CD OData web service?","<content-delivery><2013-sp1><odata>"
"Unable to update changes using OData services","<experience-manager><dxa>"
"Using keywords to filter items, but only if at least one keyword is present","<taxonomy>"
"Is it possible to run the Content Engine Device Database update process on a standalone server?","<context-engine>"
"External Content Library - Managing subfolders","<2013-sp1><ecl>"
"Issue with configuring logging on the Content Manager server","<logging><monitoring>"
"Experience manager - Update preview loop with ""Could not remove the storageTransactionId"" in logs","<experience-manager><2013-sp1><updatepreview>"
"Is Tridion.ContentManager.Monitoring.dll exist for SDL Tridion 2011","<logging><monitoring>"
"Catch the publication list 'Refresh' event | GUI Extension","<2013-sp1><gui-extensions>"
"Items failed in Preparing Transport/Transporting phase","<2013>"
"I am unable to add new template type.Error when adding new mediator","<templating>"
"Disabling Ambient framework and Content Preview gives error","<content-manager><ambient-data-framework>"
"How do I check the maxlength in a component template","<templating><2009>"
"How to show SVG in Xopus island?","<xslt>"
"Unable to retrieve item with id","<2013><publishing><content-manager><database>"
"Tridion Word Count and Reporting","<powertools>"
"Profiling and personalization Without DCP and tracking keys","<2013><profiling><personalization>"
"Dynamic Link Resolving issue in Tridion with multiple websites configured as Virtual directory in IIS","<2011><content-delivery><dynamic-linking>"
"DXA: AbstractController - Region not found on page: Social","<dxa>"
"Error after applying metadata (with category) on page","<2013-sp1><dxa><java>"
"Solr Search query for null/blank instances of a schema field?","<2013><solr>"
"How can I check if field is null or empty in DWT?","<templating><dwt>"
"Access denied Error on removing Tridion Ambient Framework","<2011><content-delivery><ambient-data-framework><iis7>"
"Anguilla XML / Json Libraries","<gui-extensions><xml>"
"User creation using core service on Tridion 2013","<2013><core-service><c#>"
