title,tags
"Is there any way to Customize the 'SiteEdit Enabled Sites ' list on CME","<2011><cme><gui-extensions>"
"Coding around OData query result size limits?","<2011><c#><odata>"
"SiteEdit not enabled when opening a popup window","<siteedit><siteedit-2009>"
"Component WebDAVUrl on Event System pre-Save not updated","<2011><event-system><webdav><metadata>"
"SetPublishedTo with CoreService","<core-service>"
"Tridion.Web.UI.Editors.SiteEdit.dll not found Issue while installing Tridion UI 2012","<2011><cme><experience-manager>"
"SDL Tridion Workflow Companion for IPad","<workflow>"
"Lifecycle of the Package","<publishing><templating><razormediator>"
"Blocked CSS files for Session Preview only in Internet Explorer","<experience-manager><2013><session-preview>"
"Add custom logic by Storage Extension without changing existing behavior","<content-delivery><2013><storage-extensions>"
"Removing the broker","<2013><broker><storage-extensions>"
"How to get all Components based on a Schema and from a particular Publication?","<2011><core-service>"
"Change password feature in Tridion","<2011><security><ldap>"
"Should RenderComponentField work on any Component in the Package?","<templating><2013><dwt>"
"Relevance in broker queries","<broker><search>"
"How to read Page Metadata multivalued text field as an arraylist and push it in to the package","<2011>"
"Access Categories and Keywords Hierarchy using OData","<2011><odata><taxonomy>"
"Changing Inline Editing Wrapping Tag per field?","<experience-manager><templating>"
"IE 10 loses focus after logging in","<cme><browser>"
"How to set ""hide organizational items if no access to content""?","<cme><authorization><mmc>"
"Can we attach a query string using the SDL Tridion Component link resolver?","<content-delivery><dynamic-linking><linking>"
"Tridion 2009 C# Powertool that uses the Tridion wysywig editor","<2009><tom.net><c#>"
"Image size validation (GUI extension)","<gui-extensions>"
"In a storage extension, is it possible to fetch the ID of the user who published the item?","<2011>"
"Core service Generic exception issue","<2011><core-service>"
"Use Font-Awesome with SDL Tridion","<2011><rtf>"
"How to select next workflow activity using Core Service?","<workflow>"
"How to use Tridion JavaScript Framework (Anguilla) to get the workflowInfo for a Component?","<cme><workflow>"
"Could not connect to net.tcp. Error code 10061","<core-service><experience-manager><2013>"
"Tridion uploading .net assembly error type mismatch","<2011><templating><c#>"
"DD4T-how to use ResolveRichText() extension method?","<2011><dd4t>"
"Storage Extension - Insert data to Tridion Broker DB and custom DB in same transaction","<content-delivery><2013><storage-extensions>"
"How do I disable the border and background color controls in Tridion 2011's rich text table options?","<2011>"
"Undo checkout and remove Publish Transaction rights to users","<cme><gui-extensions>"
"Editing Razor TBBs in Visual Studio","<2013><templating><razormediator>"
"Is it necessary to add an impersonation user record to TRUSTEES?","<2013><ldap>"
"Core Service save component opaque","<2011><core-service>"
"Problem saving new TBB - Exact fetch returns more than requested number of rows","<2011><database>"
"Oracle Content Delivery CreateTridionSYSUser.sql errors","<content-delivery><2013-sp1><database><oracle><oracle-12c>"
"How to use ComponentPresentationAssembler.GetContent overload adding variables?","<2011><content-delivery><dynamic-publishing>"
"how get the current page URL in Razor Template and TOM .Net?","<2013><tom.net><razormediator>"
"Include TCDL tag in component presentation for a component","<dynamic-linking><componentpresentation><tcdl><component>"
"Unable to Delete comment in the UGC (appropriate delete claim has not been set)","<dd4t><odata><ugc><webservice>"
"Tridion 2011 Slowness issue","<2011><cme>"
"View all values of localized Component field","<core-service><cme><gui-extensions><custom-page>"
"I would like to use SVG images on my website, but I get the error ""Parameter is not valid""","<2011><event-system><multimedia>"
"CPAssembler error: WAIPage object not initialized. Make sure to use the ComponentPresentationAssembler constructor that accepts a WAIPage","<2011><content-delivery><dynamic-publishing><iis-and-asp.net>"
"How to debug SDL tridion code?","<2013><tom.net><c#>"
"Multimedia Components are not updated when put into Workflow","<workflow><2011-sp1><multimedia>"
"Issue while retrieving component by Title through Core Service","<2013><core-service>"
"How to use the Core and HTML Design Configuration components in DXA?","<2013-sp1><templating><dxa>"
"Upgrade OutBound Email audience manager from Tridion 2009 sp1 to Tridion 2013 sp1","<2013><audience-manager><outbound-email><upgrade>"
"TCDL tags not appearing in Broker database","<broker><tcdl><component>"
"SmartTarget Experiment Percentages?","<smarttarget>"
"Components per SmartTarget Experiment Variant?","<smarttarget>"
"How to find pages using query criteria by last publish date?","<core-service><query>"
"Allignment of the content in TCM","<2011-sp1>"
"Get Published Content of Page in Tridion","<core-service><templating>"
"Schedule Publish Phases Separately Datepicker allows picking up previous date","<publishing><cme><publishtransaction>"
"Unable to process tcdl tags","<tcdl><component>"
"What are the items/itemsTotalCount in ResultSet object returned from SmartTarget API?","<smarttarget><fredhopper>"
"GUI Extension for Experience Manager - content drop handler","<experience-manager><gui-extensions><siteedit>"
"The remote server returned an error: (411) Length Required","<core-service><binary>"
"ST Region Icon and Targeted Regions in Experience Manager","<experience-manager><dd4t><smarttarget>"
"How to get CT's ID by name on DD4T Java version2","<dd4t>"
"Error(decomporess GZip,Base 64 decoding) when getting DCP on DD4T Java version2","<dd4t>"
"Error installing latest version of Alchemy4Tridion","<a4t>"
"To retrieve every iteration/version of component published","<core-service><2011-sp1>"
"Administrative Impersonation during Alchemy Installation","<a4t>"
"New Job using Tridion for an Arabic Market","<content-delivery><content-manager><language-cloud>"
"Using Razor Mediator for Outbound Email Templates","<2013-sp1><razormediator><outbound-email>"
"Can an optional embedded field be omitted, even when a mandatory dropdown field is included?","<cme><schema>"
"Search is not working in Tridion 2011","<2011><search>"
"Publishing updated component links in tridion workflow publishes pre-updated version","<workflow><2011-sp1><vbscript>"
"Dreamweaver rendering single component presentation","<2013><dwt><componentpresentation>"
"How to create a new Folder structure as same as Existing in Tridion using core service","<2011><core-service><2011-sp1>"
"What's causing 'Error 29001: Unable to authenticate user'?","<2013-sp1><upgrade><installation><hotfix-rollup>"
"Bounce Back not showing as Failed in Mailing Statistics","<2011><outbound-email><tracking>"
"Media Manager Captions and BluePrinting","<blueprint><media-manager>"
"How can I manage list-type Trigger/Filter values in SmartTarget","<smarttarget>"
"How to read Process Histories","<core-service>"
"JScriptEvaluator threw exception - Tridion 2009","<publishing><2009><xslt-mediator>"
"DD4T can't find pages on server but can local. (404)","<dd4t><2011-sp1>"
"Tridion Reference Implementation - Experience Manager button does not show","<experience-manager><dxa>"
"Publish binaries in a package - more info","<cme><razormediator>"
"Tridion CME search not reindexing correctly","<2011><content-manager><search>"
"Could not load file or assembly while publishing tridion Refrence implementation","<2013><publishing><dxa>"
"java.lang.ExceptionInInitializerError at content delivery while implementing Tridion reference implementation","<content-delivery><2013-sp1><dxa>"
"Limit component-links added to a component based upon custom rules?","<2013><cme><gui-extensions>"
"Tridion 2013 SP1 Search Access Denied","<cme><2013-sp1><search>"
"Tridion 2013 SP1 CMS UI feature regression","<2013><publishing><cme><2013-sp1>"
"Why Does Publishing Gets Stuck On ""Deploying"" When Legacy Pack Is Installed?","<publishing><2013-sp1><upgrade><legacy-pack>"
"Efficient way to get published pages in 2013 SP1","<2013-sp1><tom.net>"
"Is there any way to access outbound email items using core service","<audience-manager>"
"Has ""Republish Only"" Changed In Tridion 2013?","<publishing><2013-sp1>"
"Unable to save component when using this string: ""() {}""","<cme><2011-sp1><component>"
"PageContentAssembler.GetContent(resultUris[0]) Returns Empty string in Localhost only","<2013><dd4t>"
"Will an SDL Tridion license survive a backup/restore?","<licensing>"
"Tridion 2013 SP1 Cannot send inherited content to TMS using SDL Translation Manager 2013","<2013><blueprint><translation-manager>"
"Tridion GUI Extension enabled/disabled status","<2013><gui-extensions>"
"How do we add a second website publication to our Tridion environment?","<configuration><deployer>"
"Is it required to build Compound Templates with Tridion 2013 DLL while upgrade?","<2013-sp1><templating><2011-sp1><content-porter-2013><template-building-blocks>"
"Tridion 2013 SP1 Context Engine - Creating the device database - Timeout","<2013><content-delivery><ambient-data-framework><context-engine>"
"Content Manager Thumbnail Cache and Missing Component Template Icon","<experience-manager>"
"2011 - GUI Extension - how to remove extension button from Popups","<gui-extensions><2011-sp1>"
"How to implement surveys using SDL Tridion","<2013><publishing><external-integrations>"
"Getting a ConstraintViolationException when publishing to just one publication in Tridion 2011","<publishing>"
"Can't select layout in XPM","<experience-manager><2011-sp1>"
"Can't move multi-value (embedded) fields in Tridion GUI","<cme><2011-sp1><embedded-items>"
"Can we use Translation Manager when we have multiple languages in a single publication?","<blueprint><translation-manager>"
"Get page's Creator infirmation from Tridion CMS","<2011><core-service>"
"Storing images in broker DB","<2013><broker><binary>"
"Data Extender and Custom Listdefinitions: Disappearing data","<gui-extensions><2011-sp1>"
"Old workflow items set to ""Unapproved""","<workflow><2013-sp1><content-manager><upgrade>"
"Dynamic Component Presentation Returns Unicode Han Characters","<content-delivery>"
"How do I install SDL Mobile?","<2013><context-engine>"
"Retrieve category hierarchy on keyword save - event system","<event-system><2013-sp1><tom.net>"
"How to add an attibute to a element in design view?","<2011><schema><xml>"
"SI4T unpublish components error 'cannot parse' query","<si4t>"
"Do Tridion Keyword Keys Need to be Unique?","<cme>"
"Hybrid approach for CMS and CDS databases","<content-delivery><content-manager><broker><database>"
"Tridion related keyword ordering is not maintained correctly","<2013-sp1>"
"Can you determine a publications parent or child publications in the CD API?","<2013-sp1><api>"
"Get Publish Time per item with Event System","<publishing><event-system>"
"Have a new folder in an existing publication or create a new content publication for a new website?","<2011><blueprint>"
"How to update password in SDL Tridion if SQL Server password is updated","<cme><2013-sp1>"
"After server restore, Content Porter and Template Builder stop working","<2011><content-porter-2009><template-builder>"
"Available content services: none","<microservices>"
"Under what condition would Translation Manager unlocalize a translated component","<2013><translation-manager>"
"How to derive a Tridion Engine object?","<tom.net>"
"SDL Web 8 | Error while adding website using Add-TtmWebsite","<web8><topology-manager><sdl-tridion>"
"Has Templating Context Variable scope changed in Tridion 2013 SP1?","<templating><2013-sp1-hr1>"
"Can I publish an image from a page as well as dynamic component?","<2013-sp1><binary><dynamic-publishing>"
"Any updates or improvements with Solr search in SDL Web 8?","<web8><search>"
"Carriage Return / Linefeed Duplicate Item - Duplicate Component names under same folder","<core-service><cme><2013-sp1>"
"TCDL TagLib support in Web 8 for Component Links","<web8><dynamic-linking>"
"Why does my topology type not work from a different publication?","<topology-manager>"
"org.hibernate.exception.ConstraintViolationException: could not insert","<publishing><2011-sp1>"
"In the Core Service in Web 8, what is the batch_netTcp_201501 binding used for?","<core-service><web8>"
"Junk Characters displaying on webpage","<2013><content-delivery><dd4t><content-manager><iis-and-asp.net>"
"Dynamic Linking Config in Web 8","<web8><dynamic-linking>"
"Error while Installing DXA 1.4 on SDL Web 8.1.1","<dxa><web8><sdl-tridion>"
"SDL Fredhopper indexer and query published items sync issue","<smarttarget><fredhopper><2013-sp1>"
"Javascript Anguilla API : Is there any meaningful API documentation online? (not auto-docs)","<cme><gui-extensions><api><javascript>"
"Using Ajax to submit a form and returning a confirmation page","<dxa><web8><c#><iis-and-asp.net><mvc>"
"Indexing components in Fredhopper","<smarttarget><fredhopper>"
"_all.json not found","<dxa><web8>"
"Distribution List is empty even after adding the necessary details","<2013><outbound-email><audience-manager>"
"Disable XPM region and CP Tags for DXA","<experience-manager><dxa>"
"Web 8 Custom Deployer - cd_broker.jar not found in Rest Deployer files","<web8><storage-extensions>"
"GUI extension problem with IE11","<gui-extensions>"
"Cannot find class com.tridion.util.FileUtils in SDL Web 8","<content-delivery><web8><deployer-extension>"
"How to get component meta data fields and values using core service? Please provide examples","<core-service><2013-sp1><metadata><component>"
"Tridion Deployer Unable to store item in current transaction","<2013><content-delivery><deployer>"
"Facing issue while editing the workflow diagram?","<workflow><2013-sp1><visio-designer>"
"sdl web 8 'this implementation is not part of the windows platform FIPS validated cryptographic algorithms'","<2013-sp1><web8><upgrade><translation-manager><oracle>"
"Error while running .\ttm-prepare.ps1 script DXA 1.4 on SDL Web 8.1.1","<dxa><web8>"
"how to upgrade Content Deployer?","<web8><legacy-pack>"
"Issue Creating Translation Workflow in SDL Web","<workflow><web8><translation-manager>"
"Error on accessing website DXA 1.4","<dxa><sdl-tridion><dxa-1.4><web8>"
"Component Link and Image source are not generating correctly","<content-manager><upgrade><2013-sp1><linking>"
"SDL Web 8 CU1 Update | single machine i| microservice installation error","<microservices><web8>"
"DXA 1.4 Not possible to marshall single entity stream JSON","<content-delivery><web8><dxa><topology-manager><dxa-1.4>"
"Installing Experience Optimization on Fredhopper - indexer is not starting","<smarttarget><fredhopper><web8><experience-optimization>"
"Publishing only a Multimedia/binary Component and not the linked components","<custom-resolver>"
"DD4T data bind deserialization exception on Page metadata","<dd4t>"
"Topology Manager | Unable to Add Cd topology type","<topology-manager><web8>"
"Permissions/Rights needed to manage users","<2013><user-management>"
"Upgrading to SDL Web 8 and Publication URLs","<topology-manager>"
"How does template unpublish MMC?","<dd4t><templating><multimedia>"
"What is the rationale behind the microservice roles in SDL Web 8?","<topology-manager><microservices>"
"sometimes _client.IsExistingObject(id) returns exception rather than false","<core-service>"
"SDL Web 8 installation Files/Folders missing","<web8>"
"Schema won't content port - An unexpected version is found in the URI: tcm:x-x-8","<2013><schema><content-porter>"
"Permissions for adding items to workflow bundles","<workflow><permissions>"
"Is it possible for non-admins to see workflow tasks and comments after completion?","<workflow><permissions>"
"Topology Manager | How to create multiple Topology Environments","<topology-manager><web8>"
"Russia Characters randomly getting replaced as diamond with a question mark ��","<content-delivery><dd4t>"
"How to Get parent component from child embed component recursive Tridion 2011 TBB C#","<2011><component>"
"Granting Read access to Category for specific Groups using PowerShell Scripts","<2013-sp1><powershell><keyword>"
"Tridion 2013 sp1 , Not able to add/delete component links in XPM / Experience Manager View","<experience-manager><dwt><2013-sp1>"
"Binary updates - issue with configuration - DXA","<dd4t><dxa><2013-sp1><binary><dxa-1.2>"
"How to design a recursive menu schema?","<schema><cme>"
"How can we resync what the Tridion CM thinks are published to a specific publication target with what is actually published to that target?","<2011><publishing>"
"How can I remove minification from the 2011 CME when developing a GUI extension?","<2011><cme><gui-extensions><configuration>"
"How to enable logging on Business Connector","<2011>"
"Is it possible to maintain line feeds in User Generated Content (UGC) comments?","<content-delivery><ugc>"
"Developing Page/Component Template Designs through Visual Studio","<webdav><release-process>"
"How to add field constraints to a Schema","<schema><2011>"
"Creating a Multiple Operation Progress Bar","<2011><gui-extensions><wcf>"
"Use of Session in our WCF Service for the model makes the Communicator service hang","<2011><wcf><extension-model>"
"Getting additional keyword information from item Xml?","<tom.net><templating>"
"Workflow Process Histories","<2011><database><workflow>"
"How to handle Custom URLs on Tridion 2011 which are written in ASP on Tridion 2009?","<2011><2009><custom-url>"
"Referencing data stored in other systems from Tridion 2011?","<2011><external-integrations><core-service>"
"XPM Session Storage configuration for JNDI","<content-delivery><experience-manager>"
"Deployer extension / Navigation XML","<navigation><xml>"
"Do custom events fired on the Tridion UI also get triggered when we use Tridion Core Services?","<2011><event-system>"
"List of SDL Tridion References","<2011><2013><2009><5.3>"
"Extend Content Delivery Web Service (OData) - how far can it be taken?","<content-delivery><odata>"
"What is the best way to do logging from the Tridion Custom Events c# code?","<2011><event-system><logging>"
"Tridion Web UI shows error Not enough Storage to complete this action","<2011><content-delivery><publishing>"
"Using log4net for Tridion Custom Events only works for Publish or Save events, not both","<2011><event-system>"
"How to update a workflow definition with active process instances","<workflow>"
"Ordinal position of a Component Presentation in a DWT","<templating><2009><dwt><vbscript>"
"How to get the metadata of a page(minor version) in Tridion for Context Menu Item?","<2011><gui-extensions><workflow><event-system>"
"Accessing Embedded Schema fields via list of Component Links","<templating><razormediator>"
"How to select a check box by default for existing pages when modifying the metadata schema used by those page?","<2011><workflow><schema>"
"Can you change the default hyperlink 'Type' value","<2011>"
"How to insert characters between two anchor tags placed side by side in the Tridion editor?","<2011><cme>"
"Timeout in the TridionUploadAssembly","<database><configuration>"
"Tridion 2011 GUI Extensions: What is the proper usage of the pagetype element in the configuration?","<gui-extensions><configuration><extension-model>"
"Tridion Gui Extension Error Message: Unable to get unique id for element. What is the cause?","<2011><gui-extensions><configuration><extension-errors><javascript>"
"Is it possible/advisable to alter the UGC database to track who voted for a specific comment?","<2011><ugc>"
"Error for RenderedWith property while using GetPublishInfo for Component Template","<2011><templating>"
"TBB, Traverse components in package","<2011><template-builder>"
"How do you start a Workflow on a bundle in using the Event System?","<workflow><bundles>"
"Threads in Tridion Event System","<workflow><bundles>"
"How to get rid of garbage XML in an updated component?","<2011><xml>"
"Publishing Speed | QUEUE_CONSUMERS Table","<2013><publishing><2013-sp1>"
"Error while updating page metadata using core service","<2011><core-service>"
"How to run a Sdl Tridion develop WebSite on localhost","<publishing>"
"Event System - stopping an event avalanche","<2011><event-system>"
"Is there a way to access values from ExternalContentLibrary.xml","<ecl>"
"Tridion Odata not working with expand for metadata","<2011><odata>"
"Is SmartTarget 2011 SP3 compatible with Tridion 2013 SP1?","<smarttarget>"
"With UGC can users leave Comments on comments?","<2011><ugc>"
"Error while opening a Contact in CMS","<audience-manager>"
"How to template a Page Directive in Razor","<razormediator>"
"Mapping the URL of a page to a publication ID at request time","<content-delivery><2013>"
"Error when publishing page with file name ""aux""","<publishing>"
"Broker - Unable to cast object of type 'Java.Io.SerializableImpl' to type 'Java.Util.Date'","<2011><broker><cache-channel-service>"
"Can we integrate SDL Tridion with ATG?","<2011>"
"Checking if a keyword has classified items globally","<2011><event-system><tom.net>"
"How do we implement DAM in Tridion 2013SP1?","<2013><ecl>"
"How can we stop Unpublish in event system?","<event-system><publishing>"
"How to retrieve parent component object from a localized component using Tom.Net API?","<2013><tom.net>"
"Experience Manager and Keywords","<2013><experience-manager><taxonomy><2013-sp1>"
"Facing problem of XMLDOMDocument2 in Tridion 2011","<2011>"
"Get Component Render result inside the Post Publish Event","<2011><event-system>"
"How to try not to republish after clicking ""Finish Editing"" Button on experience manager","<2013><experience-manager><configuration>"
"How to fetch an Multi value Embedded Schema Image field using razor?","<razormediator>"
"Error while installing Tridion 2013 SP1 CDS: Unable to load DLL 'xmogrt'","<2013><content-delivery><configuration><2013-sp1>"
"Get list of target types to which a component is published","<2011><publishing><core-service>"
"What is the Content Delivery namespace for using ComponentFactory","<2011><content-delivery>"
"How i attach Navigation menu on each pages on Sdl Tridion and how i display pages on click of navigation menu tab?","<cme><linking><componentpresentation><navigation>"
"Tridion 2013 CME not loading properly after setting IIS authentication","<2013><cme>"
"Getting ""object doesn't support property or method 'show'"" when creating a new mulitmedia object in Tridion R5","<content-manager><5.3>"
"SiteEdit 2009 SP2 configuration: how to disable 'Add component' menu item","<configuration><siteedit-2009>"
"How to set Session Preview data for a Publication Target","<core-service><experience-manager><web8.5><sdl-tridion>"
"DXA Vocab value in Models","<dxa>"
"Translation Manager - sending job to TMS returns ""The client is inactive""","<content-manager><translation-manager>"
"How can I have two different PAGE_ID values for the same URL in LINK_INFO","<broker>"
"DXA 2.0 GetNavigationModel url Property for Keyword is null","<dxa><dxa-2.0><dxa-net><web8-cu1>"
"Event System in CME - Detect when a Component is linked to another","<cme><web8.5><event-system>"
"Opening create Translation Job window is very slow","<web8.5><translation-manager><performance>"
"SDL Web 8 (8.1) Installer not showing Outbound Emailing Services options","<web8><sdl-tridion><outbound-email><audience-manager>"
"New created component is greyed out","<web8><cme><sdl-cloud>"
"Java : Unable to use multiple discovery / content svcs when using content-client-api JAR","<content-delivery><web8.5><java><discovery-service><content-service>"
"What additional features are available in latest Solr (upgrade from Solr 3) when used in Tridion 8.5","<dxa><search><solr>"
"Issue with passed entityClass to SemanticMapper.createInstance() is null","<dxa><dxa-java><dxa-2.0>"
"DXA 2.0 JAVA microservice in Linux","<dxa><web8.5><dxa-java><microservices><linux>"
"Sync-TtmCdEnvironment / Enable-TtmCdEnvironment {""error"":""invalid_grant""} Error","<topology-manager><discovery-service><cis>"
"SDL Web 8.5 - How to get AccessTokenData of logged in user using Core Service","<core-service><web8.5><sdl-tridion>"
"Updating external metadata of an ECL item","<web8.5><ecl><sdl-tridion><external-integrations>"
"Unable to Install CME and TTM on port 80","<web8.5><topology-manager><powershell>"
"Prepopulate Page name with a default filename","<cme><web8.5>"
"SDL Web 8.5 Publishing Fails at Deploying stage","<web8><publishing>"
"Localization not found after changing Topology Configuration","<web8.5><topology-manager>"
"SVG with S3 AWS bucket","<2013>"
"DXA static content folder","<dxa><dxa-2.0>"
"Get content as JSON by sending Accept header","<dxa>"
"How to create custom popup in tridion?","<2013>"
"How Resolving and Rendering Works For DD4T based Applications","<publishing><dd4t>"
"Context Service giving Interim Errors","<web8><dxa-1.5>"
"Security exception when reading WebDavUrl","<web8.5><event-system>"
"Odata service querying results in special characters","<web8><odata>"
"Content Porter Icon disable in CME SDL Web 8","<web8><content-porter>"
"Is structure group order considered when resolving links with proximity?","<dynamic-linking>"
"No way to leverage Tridion proximity logic in link resolving with DXA 2.0?","<dxa><dxa-java><dxa-2.0><dynamic-linking>"
"Publication levels","<core-service><blueprint><publication>"
"Junk characters shown in Broker Database DCP publishing in SDL Web 8","<content-delivery><odata><dynamic-publishing>"
"Identifiableobject Xml Missing Node Info in Web 8.5 While It Exists in 2013 SP1","<2013-sp1><web8.5><tom.net><tbb>"
"Rename and reconfigure Content services in SDL Web 8","<web8><content-delivery><odata><microservices><content-service>"
