title,tags
"Why does Tridion think my Component both is and is not published?","<2011><core-service><publishing>"
"Managing claims and their scope in SDL Tridion's Ambient Data Framework 2013","<content-delivery><2013><ambient-data-framework>"
"Is it possible to use Environment/System Variables in Content Delivery config files?","<content-delivery><2013><configuration>"
"What are the best practices for Dynamic Link Resolving when using the Page-Free content approach for Tridion?","<dynamic-linking>"
"Deployment fails with SI4T and SDL Tridion 2013, nested exception is java.lang.NoClassDefFoundError: org/hibernate/util/DTDEntityResolver","<2013><si4t>"
"How to query for Components with Multi-value custom metas","<content-delivery>"
"Static Id's in Tridion?","<cme><content-manager>"
"Audience Manager Subscribe Form Exception","<audience-manager>"
"System.ServiceModel.FaultException: The item tcm: does not exist","<2011><core-service>"
"Experience Manager Finish Editing issue","<2011><experience-manager><multimedia>"
"Issue installing the Content Porter client","<2011><content-porter-2009>"
"Disable workflow using Core Service before editing the Component","<2011><core-service><workflow>"
"Tridion Broker Dynamic query (2009)","<2009><broker>"
"What is the difference between KeywordCriteria and TaxonomyKeywordNameCriteria?","<content-delivery>"
"What does a DD4T BluePrint look like?","<dd4t><blueprint>"
"How can we fix the UUID Mismatch issue, every time we content port certain Schemas from one env. to another?","<web8.5><content-porter-2013><schema-synchronization>"
"Get list of Publications based on Target Type in WEB 8.5 using 2016 Core Service","<2013-sp1><core-service><web8.5>"
"The stored procedure 'EDA_TRUSTEES_GETTRUSTEETOKEN_X' doesn't exist","<web8.5>"
"Updated Page content not showing","<2013><cme>"
"Cannot Close Window Popup Error During Save and Close","<web8.5><chrome>"
"The very first time Page loading takes too much time","<dxa><web8.5><dxa-java><dxa-1.8>"
"Can we customize Tridion Search?","<2013-sp1><search><search-engine>"
"Content Service breaks when content tagged with keyword is being requested via DXA Model Service DD4T","<dxa><web8.5><dd4t-2><model-service>"
"SDL Web Content Service not starting as a windows service","<content-delivery><web8.5><dxa-2.0><content-service><cis>"
"How to get multimedia component data in razor mediator?","<2013-sp1><razormediator>"
"Experience Manager automatic publishing failing in Web 8.5","<publishing><web8.5><experience-manager>"
"DXA 2.0 client-side cache using RedisCluster fails","<dxa><dxa-2.0><cache><cil><redis>"
"SDL Web 8.5 publishing of assets fail","<publishing><web8.5><publishingfailed>"
"Using PageContentFilter and BinaryContentFilter in 8.5","<2013-sp1><content-delivery><web8.5><experience-manager><java>"
"Razor template with tridion sites 9 without razor-mediator","<razormediator><sites-9><razor>"
"Does Alchemy4Tridion work with SDL Tridion Sites 9?","<a4t><sites-9>"
"How can I run a deployer module after the commit?","<web8.5><deployer><deployer-extension><sites-9><deployer-conf>"
"Handler for Component Save on Transaction Commited not working after upgrade","<2013-sp1><web8.5><event-system><upgrade>"
"How to override Publishing Path while publishing?","<2013-sp1><publishing><web8.5><legacy-pack>"
"How to maintain Publish Status of already published after DB refresh","<publishing><web8.5>"
"webp images are not getting published","<publishing><web8.5><dd4t-2><binary>"
"Facing Issue with DXA 2.1 with Sites 9","<dxa><sites-9><dxa-2.1>"
"How to get the component ID in a JSP using DXA 1.2?","<dxa><dxa-java><dxa-1.2>"
"Performing Transactions cleanup","<publishing><web8.5>"
"How to dynamically change the component in dxa while rendering the component presentations?","<dxa><dxa-java><sdl-tridion>"
"How to implement Redis cache with DXA 2.0 Java application","<dxa><web8.5><dxa-java><dxa-2.0><caching>"
"Tridion is throwing database error while loading","<sites-9>"
"Contact initialization taking long time in DXA 2.0 Java application","<dxa><web8.5><dxa-java><dxa-2.0><audience-manager>"
"How to debug DXA Model Service","<dxa><dxa-2.0><model-service>"
"Not able to paste multiple components","<component>"
"Blank space inserted at end of sentence","<cme>"
"Is DXA 2.0 compatible with the latest version of the .NET Framework?","<dxa><dxa-2.0>"
"How to remove a single associated Schema from Workflow?","<publishing><web8.5><workflow>"
"Unable to resolve links using DreamWeaver Templating","<templating><dwt>"
"InCriteria in tridion content delivery api","<content-delivery>"
"Deployer extension - documentation","<content-delivery><external-integrations><documentation><java>"
"DW Template for implementing multiple text field in component link field","<templating><dwt>"
"How to get the email address of the person submitted the comment","<2011><content-delivery><ugc>"
"Deployer extension - loading component presentation","<content-delivery><extension-model>"
"How to ""Finish Process"" programmatically (and rollback current item in workflow)?","<2011><workflow>"
"SDL Tridion 2011 SP1 HF1 - Add multimedia dialog crashing CMS","<cme>"
"addsorting not working with key_date_value in custommeta","<content-delivery>"
"Message ""The content of this page was successfully republished"" not always showing","<experience-manager>"
"Tridion 2013 Experience Manager fails to update the preview because of internal server error","<content-delivery><experience-manager>"
"Accessing page object in C# TBB used in the component template","<templating>"
"which browsers are in scope for Tridion 2011 and Tridion 2013?","<gui-extensions><browser>"
"Resolving type=""binary"" within RTF fields","<content-delivery>"
"Implementing Robots.txt","<2013>"
"""Unable to get template type with legacy id"" error","<2011><templating><2013><upgrade>"
"Log/Trace information in SDL Tridion","<2011>"
"404 not found when combining CWA 2011 + Experience Manager for Tridion 2011 SP1 HR1","<2011><content-delivery><experience-manager><cwa>"
"Deployer extension - deprecated methods","<content-delivery><external-integrations>"
"Experience Manager: Different publications for saving and localizing","<2011><experience-manager>"
"Diagram for Default Task Process Workflow?","<2013><workflow><bundles>"
"Legacy items and Content Porter 2013","<2013><content-porter-2013>"
"Retrieve local components using Core Service","<core-service>"
"What is the best way to create SEO friendly vanity urls in Tridion?","<content-delivery><cme>"
"Why do I get a ""the input data was invalid"" error when I click ""finish editing"" in Experience Manager?","<2011><experience-manager>"
"How to restrict html tags in RTF fields?","<2011><rtf><xslt>"
"Component Template - Parameter Schemas (2011 SP1 HR1)","<2011><templating>"
"Publishing page, missing images","<content-delivery><publishing><cme><image>"
"IFunctionSource functions for DWT in Razor?","<razormediator><dwt>"
"Can SDL Tridion API be integrated with J2EE and running on the Apple OS X/Lion?","<content-delivery><experience-manager><configuration>"
"Condition Sentence for Nested multiple Embeddable Link Field","<templating><dwt>"
"Is there API documentation available for DXA? Where can I find it?","<dxa>"
"Why Approval Status set in VISIO for Workflow is Overridden?","<2013-sp1><event-system><workflow><visio-designer>"
"Web 8 - Restoring DB from Prod to Dev and the Publish Status","<web8><topology-manager>"
"Tridion GUI strange behaviour on selecting items for Component link, it freezes","<2011>"
"DXA 1.5 - Category / Keyword Metadata approach","<dxa><keyword><metadata><dxa-1.5>"
"Having issues in updating the existing controls in SDL tridion","<sdl-tridion>"
"Error while publishing a component from Event System","<2013><event-system><tom.net>"
"Publisher Service Crashing While Publishing Component","<publishing><web8>"
"Timeout on Fasttrack publishing","<experience-manager>"
"World Server vs. Translations.com plugin - Pros/Cons?","<translation-manager><worldserver>"
"How to use Tridion 2011 SP1 Java program on SDL Web 8?","<web8><broker><upgrade>"
"Web 8 - Context Engine Catridge - Creating Device database Issue","<web8><context-engine>"
"ASPX pages in DXA","<dxa>"
"How to handle custom anchors in DWT?","<2011-sp1><dwt><linking>"
"Clarification on Web8 Installation steps regarding ""MTSUser""?","<web8><installation><sdl-tridion>"
"Unable to see resolved component link at CDA side | DXA | web8","<dxa><web8><link-resolver>"
"Razor Mediator Helper Functions TBB Not Working with Experience Manager Preivew","<experience-manager><templating><razormediator><template-building-blocks>"
"Custom module configs are not loading in DXA 1.4","<dxa><dxa-1.4><dxa-1.5>"
"Problems about migrating Java(Broker API) from Tridion 2011 SP1 to SDL Web 8","<web8><2011-sp1><broker><java>"
"Group Rights - Cache","<2013><web8><content-manager>"
"LastPublishedDate incorrect in DD4T.ContentModel.Page","<2013><dd4t><sdl-tridion>"
"Issue while reading the Metadata In DXA 1.5","<web8><dxa><dxa-1.5>"
"Trying to create multimedia schema with core service : nullreference error","<2013-sp1><core-service>"
"Unable to download process log file","<web8><importexportservice>"
"How to Set up LDAP integration for Content Manager?","<web8><installation><ldap>"
"Get Publications list which are (pages, content) enabled to be publishable","<xml>"
"I am unable to login to the SDL Web content manager?","<web8><installation>"
"Strange characters shown online for region specific languages post web 8 upgrade","<dxa><web8><encoding>"
"Why the Content Deployer is down after previously running correctly","<deployer>"
"Outbound Email Mailer Service throwing error ""Stored procedure failed: SP_MAILINGS_SAVE_LINKURLS""","<2013-sp1><outbound-email>"
"Contextual Image Delivery service throwing error","<web8><contextual-image-delivery>"
"Tridion publishing report query","<publishing><database>"
"Multivalue in DXA 1.5","<dxa><web8><dxa-1.5>"
"Web 8 Install Step Configuring the maximum size of all uploads to Content Manager","<web8><installation>"
"Embedded Razor Templates","<razormediator>"
"How to install the oData service in .NET?","<2011><odata>"
"Component XML duplicated","<2013-sp1><dxa>"
"Which edition of SQL Server should be suggested for SDL Tridion 2013 SP1","<content-delivery><content-manager><broker><database>"
"Sort by Title in Core Service for Categories","<2013><core-service>"
"Audience Manager: How to save Contacts in multiple address books?","<2013><audience-manager>"
"What are the user accounts for these extensions and modules?","<smarttarget><ecl><translation-manager>"
"Can I remove this promotion ""SmartTarget Meta Promotion (do not remove!)""?","<smarttarget>"
"How can i upload mm icon for existing Multimedia Type","<2013-sp1><content-manager><multimedia>"
"Is it possible to add thumbnails in CME in SDL Tridion?","<2011><cme><siteedit><image>"
"Catching Published or UnPublished in the SetPublishStateEventArgs","<event-system>"
"Replicating existing Tridion 2009 CMS on a different Machine with the same license","<2009><migration><licensing>"
"'Prepare the e-mails now, but send them later' in tridion send mailing gives local datetime but works according to the server datetime","<outbound-email>"
"How to export all email contacts which are failed to send from email statistics","<outbound-email>"
"Getting Error once create a multimedia component through Core Service using wshttp end point","<2011><core-service>"
"Browsers crashing after selecting the browse MM-Component popup","<cme><2011-sp1>"
"Value cannot be null. Parameter name: type in Tridion DD4T setup","<2013><dd4t>"
"Learn Tridion 2011 WorkFlow Basics","<workflow>"
"Is there a way to skip the selection of Publication target in Outbound Email?","<2013-sp1><outbound-email>"
"Tridion CME can not load GetListSmartTargetInstances on https","<2013-sp1><smarttarget>"
"Tridion 2011 SP1 WebDAV connecting to the wrong folder","<2011><2011-sp1><webdav>"
"What is the significance of selecting publication target when creating new mailing?","<outbound-email>"
"Event System with multiple DLLs","<event-system>"
"32bit and 64bit config settings mixed up","<configuration><2011-sp1>"
"How to obtain the root storage location for a publication in Tridion 2013?","<2013><content-delivery>"
"Marketo Forms / Tridion integration","<2013-sp1><external-integrations>"
"Content porting - waiting issue","<2013-sp1><content-porter-2013>"
"Can we edit existing hyperlinks (internal or external) in Experience Manager?","<2011><2013><experience-manager>"
"Is there any way to track links on web view of a newsletter email?","<outbound-email>"
"Custom Deployer for Binaries - Do not want binary stored on filesystem","<deployer><storage-extensions>"
"TemplateCompileException while working with array in razor","<templating><razormediator>"
"""Where used"" not returning all the ""using"" items","<2013><core-service><where-used>"
"Is there a way to unlocalize a Structure Group?","<2013-sp1><blueprint><structuregroups>"
"How can I pass the preview session token to a web service in Tridion 2011 SP1?","<experience-manager><2011-sp1><session-preview>"
"""The File Exist"" error while publishing","<publishing><dd4t><templating>"
"Is there a field change event I can subscribe to?","<event-system><web8.5><custom-url>"
"DXA 1.7 AM Module is Compatible with DXA 1.5?","<dxa><audience-manager><dxa-1.5>"
"package Push Item Method Encodes attribute values","<web8><templating><tbb>"
"Publishing does not update published state but items get published","<publishing><2013-sp1-hr1>"
"SDL Web 8.5 Support remember the last hyperlink location?","<gui-extensions><web8.5>"
"SDL Web 8.5 RTF generating <br> and <div> instead of <p> tags","<cme><gui-extensions><web8.5><rtf>"
"Custom Event Handler when Saving Component not Firing","<event-system><web8.5>"
"Add Component Presentation using Anguilla JavaScript","<2013-sp1><cme><gui-extensions>"
"Accessing a user's Claim Store from another application","<2013-sp1><smarttarget><ambient-data-framework>"
"Tridion Broker DB Taxonomy Java API query for multiple Criteria","<broker><taxonomy>"
"Preparing Deployment - failed","<publishing><deployer>"
"Creating ECL multimedia Components using Core Service Web 8","<web8><core-service><ecl><application-data>"
"Publishing stuck at waiting for deployment SDL Web 8.5","<web8.5><deployer><deployer-conf>"
"Get rendered HTML for different Page versions along with correct Component and Template version","<core-service><templating><component>"
"DXA 1.7: Custom Configuration / Resource Schema","<dxa><dxa-java><web8.5><dxa-1.7>"
"How to achieve - Release Management and Automated Deployment of cms items in Tridion 2013 SP1","<2013-sp1><content-manager>"
"Error during switch device - XPM","<web8><experience-manager><dd4t>"
"Referencing the SDL.Web.Tridion Assembly in DXA","<dxa>"
"Amazon S3 ECL Provider","<2013><web8><ecl><s3>"
"PublishTransaction save event not recording all publish states","<2013-sp1><event-system><tom.net><publishtransaction>"
"SDL Web 8.5 - Unable to search and list users from ""DOMAIN""","<web8.5><sdl-tridion>"
"Having an external application utilize Tridion TMS API?","<2013><web8><web8.5><sdl-tridion><translation-manager>"
"Is SDL Language Cloud included in SDL Web 8 or Web 8.5?","<web8><web8.5>"
"Publishing getting failed on Deploying state","<publishing><deployerservice>"
"SDL 8.5 Experience Optimisation - Deployer Committing Failure","<deployer><experience-optimization><web8.5>"
"unexpected WAI Presentation_id","<content-delivery><database>"
"SDL Web 8 free developer licenses","<web8>"
"Instructions not set for Binary while publishing Multimedia component linked to Content which is using CT set to be published as embedded","<2013-sp1><publishing><binary><embedded-items>"
"SDL Web 8 Pre-Requisite","<web8>"
"XPM Issue: JavaScript security errors when clicking Update Preview","<2013-sp1><experience-manager>"
"Chinese encoding issue in Broker","<content-delivery><2013-sp1><dd4t>"
"PublishState enum for Rendering Phase?","<core-service><publishing>"
"How do I access the HTTP request from a custom Ambient processor?","<2013-sp1><ambient-data-framework>"
"UI Beardcore is not working in https","<2013>"
"Not able to edit the component in Experience manager","<experience-manager><dd4t>"
"Tridion 2011 SP1 Solr Search - can the solr schema be extended?","<2011><cme><search><solr>"
"Get field value from multiple embedded component link from multiple embedded field","<templating>"
"Fredhopper Query Issue: The fredhopper query thread had an exception during execution","<dd4t><smarttarget><fredhopper>"
"Content Porter ""PRIMARY KEY constraint PK_FILE_EXTENSIONS"" error","<content-porter-2009>"
"Linking across 2 publications within Tridion","<2013-sp1><core-service><cme><event-system><configuration>"
"Search for TcmId without opening item directly","<2013-sp1><2011-sp1><search>"
"How to comprese the images from Generation Dynamic component TBB?","<publishing><dd4t>"
"Building DD4T 2.0 Templates project","<2013-sp1><dd4t><templating>"
"DXA Content Delivery database version","<dxa>"
"Tridion 2013 SP1: Error in CD Website","<content-delivery><2013-sp1><upgrade>"
"Best way to synchronize SmartTarget promotions across scaled Index Servers","<smarttarget><fredhopper>"
"Tridion SmartTarget : Error while publishing","<smarttarget><fredhopper>"
"How to debug with template builder","<2009>"
"Dynamic component template rendering dynamic component template seems to be caching component","<broker><dynamic-publishing>"
"Not able to find method to unpublish component with particular CT","<2013>"
"DD4T - Generate DD4T.Templates.merged.dll using ILMerge manually","<2013-sp1><dd4t><templating>"
"Fredhopper instances get killed","<smarttarget><fredhopper>"
"Tridion component linking in RTF field is not working properly","<2011-sp1><rtf>"
"Dencrypt sensitive strings","<2013><content-delivery><smarttarget>"
"Tridion 2013 SP1: Unable to publish page - nothing happens when clicking publish button","<2013-sp1><cme>"
"Alchemy Settings : Alchemy Not Defined","<gui-extensions><a4t>"
"No re-publishing of images","<publishing>"
"Preview of component failing with message 'Tridion.ContentManager.Templating.Expression.Evaluator.expressionContext2' not found","<cme><2013>"
"How many days old process history we can see in Tridion workflow management tab","<2013><workflow><processhistory>"
"Associating Parent Workflow to Structure Group","<workflow>"
"Can we change the user of Automatic activity in tridion workflow","<2013><workflow>"
"How to update Component Metadata Field using Core Service","<core-service>"
"What properties does my stream need to work in an ECL Provider?","<2013><ecl>"
"Upgrade from Tridion 2009 SP1 to 2013 SP1 - Is the Legacy Pack required?","<2013><upgrade><legacy-pack>"
"Upgrading to Tridion 2013 with active items in workflow","<2013><workflow>"
"How to make unpublish event fail in event system?","<2011><core-service><event-system><tom.net>"
"Invalid Page ID when pushing data to APP_DATA","<2013><cme><componentpresentation>"
"TridionSiteMapProvider with DD4T","<2011><dd4t>"
"Event System 2011 - Why does Tridion complain about a missing assembly when no references are added?","<2011><event-system>"
"Timed activities in SDL Tridion 2011 workflow?","<2011><workflow>"
"AppData Relationship to BluePrinting and Item History?","<2011><workflow>"
"GUI Extension, Publish from Publishing Queue in 2013 sp1","<cme><gui-extensions>"
"RelationShip of Components","<2011><event-system><tom.net>"
"How to retrieve the owning publication of a component via anguilla framework?","<2013><cme>"
"Page doesn't get published through bundle in workflow","<workflow><2013>"
"How to set the minimum approval status of a bundle and items in bundle in workflow","<workflow>"
"Error while uploading Template assembly with TcmUploadAssembly.exe to 2013 SP1","<templating>"
"Categories and Keywords in sdl tridion","<sdl-tridion><keyword>"
"Number of Fields in Schema","<schema>"
"Should MTSUser,administrator be LDAP or Windows?","<2013><ldap>"
"Error on creating list Field in Schema?","<2013><schema><keyword>"
"Unable to add the keywords on the component in the classify window?","<content-delivery><core-service><keyword>"
"How to configure search service on Server Clustering","<search><2013><clustering>"
"Last published date in Items table in Broker Database","<2013><broker>"
"How to create a List type field in schema using core service?","<core-service><schema><keyword>"
"Can I use special characters in the file name of a page?","<2011>"
"Conversion of Tridion CMS from MS SQL Server to Oracle","<database><migration><oracle>"
"Where is the ""translatable"" Schema field setting stored?","<2011><translation-manager>"
"Workflow approval","<workflow>"
"Paste option in XPM 2013","<experience-manager>"
"how to set the status of a component to unapproved in Tridion 2013","<2013><workflow>"
"core-service via PowerShell load of all users not returning all user data","<core-service><powershell>"
"Cannot get UIBeardcore GUI Extension to work on Tridion 2011SP1","<2011><gui-extensions>"
"How to attach publication into the existing publication target?","<publishing><core-service>"
"Permission issue for component template","<2011><permissions>"
"Extending RTF Editor","<experience-manager><gui-extensions><rtf>"
"User getting automatically logged in in SSO implemented CMS","<2011><2011-sp1><sso>"
"Publishing failed after upgrade to SDL Tridion 2013 SP1","<publishing><upgrade><2013>"
"Component Link is not working","<dynamic-linking>"
"Error importing using Content Porter 2009 SP1","<2011><content-porter-2009><schema><metadata>"
"Update content in a file being published using storage extension","<2011><storage-extensions>"
"2011/2013 usability","<2011><cme><2013>"
"Publisher service not finding Razor Helper methods","<2013><razormediator><publishing>"
"Change column widths in GUI","<2011><cme><gui-extensions>"
"How can I get the versionless TCM URI of a Component in SaveEventArgs?","<2011><event-system>"
"Upgrade to SDL Tridion 2013","<2011><2013><upgrade>"
"Tridion UI - ExperienceManager Startup","<2011><experience-manager>"
"Invoking a Publish mode render via the Core Service","<core-service><2013><preview>"
"Right place to add ""Staging preview"" to Workflow in Experience Manager?","<cme><experience-manager><workflow>"
"How can I find the installation details for an existing SDL Tridion installation?","<2011><content-delivery>"
"""Use this Page as a Page Type"" - How to give non-Admin users permission to set this property","<2011><experience-manager>"
"When adding a publication in the Blueprint - Why is a 'Root' Structure group needed?","<blueprint>"
"Publishing does not update the published state in ITEM_STATES nor PUBLISH_STATES","<2011><publishing>"
"What might be causing an 'Activity Instance Does not exist' exception in my workflow code?","<2011><workflow>"
"How to check a TCM URI is valid without raising an exception?","<2013><tom.net><api>"
"Permissions for ECL provider","<ecl><security>"
"How do I get my Storage Extension to call the 'update' method when republishing a Dynamic Component Presentation?","<content-delivery><2013><storage-extensions>"
"How to integrate my custom button into Experience Manager","<experience-manager><gui-extensions><siteedit>"
"Raising an error from a ECL provider","<ecl>"
"Sporadic issues with @RenderComponentField using Razor Mediator for Tridion 2013","<2013><templating><razormediator>"
"Broker Database failover using default JDBC","<2011><broker>"
"Order of execution for ADF cartridges","<content-delivery><2013><ambient-data-framework><context-engine>"
"SharePoint 2013 Support?","<external-integrations>"
"Multiple languages in a source Publication?","<cme><translation-manager>"
"Is there a detectable difference between a scheduled unpublish and unpublishing directly?","<2011><publishing><event-system>"
"DWT Condition with FieldPath","<templating><dwt>"
"Unable to start Tridion Content Management services","<publishing><infrastructure>"
"Find and Replace Links from the value of Rich text field","<2011><content-delivery>"
"Why is BinaryContent.GetByteArray() publishing corrupted data?","<2011><publishing><2011-sp1><binary>"
"Deployer extension | failed to lazily initialize a collection of role: com.tridion.storage.BinaryMeta.binaryVariants, no session or session was closed","<2013-sp1><deployer-extension>"
"Authorization failed while attempting to communicate with CD Discovery Service on Publish","<web8><publishing>"
"DxaNoOutputCache and NoCache not working for custom controllers","<dxa><dxa-2.0>"
"Issue with DXA app and Content Service -- strange SQL calls","<dxa><web8.5><dxa-1.8>"
"How do I query for Tridion Docs content with conditions?","<dxa><content-delivery><brokerquery><dxa-2.1><tridion-docs>"
"Error while Sdl web 8.5 Installation ""SDL Web Does not support this operating system""","<sdl-tridion><installation>"
"oAuth is disabled but DXA Webapp gives an error ""Client id is required""","<dxa><web8.5><dxa-java><dxa-2.0><cil>"
"Creating an Item with the Tridion Event System","<event-system><sites-9>"
"soap monitoring tridion microservices","<microservices>"
"SDL Tridion Sites 9 Discovery Service does not start","<discovery-service><sites-9>"
"Discovery Service Bad Digest","<discovery-service>"
"Unbalanced TCDL tags when using a tag renderer on broker query","<tcdl><tridion-docs>"
"Core Service error : The HTTP request is unauthorized with client authentication scheme 'Anonymous'","<core-service><web8.5>"
"Is it possible to use same indexer for Sites and DOCS search","<sites-9><tridion-docs><elasticsearch>"
"Embedded images in RTF field are not rendering correctly","<dxa><web8.5><dxa-java><dxa-1.8>"
"Navigation JSON coming from cache even after disabling service caching","<dxa><web8><dxa-1.5><dxa-net>"
