title,tags
"After changing lcd get parent directory of original file","<working-directory>"
"Adding conceal to already existing syntax highlighting?","<syntax-highlighting><conceal>"
"Execute curl command with variable interpolation","<vimrc><variables><environment-variables>"
"How to fold markdown using the built-in markdown mode?","<folding><filetype-markdown>"
"Vim to behave like nvi when opening line in empty buffer","<buffers><nvi>"
"Why does nmap work but nnoremap not work to set up vim-easy-align shortcut?","<key-bindings><plugin-easy-align>"
"Vim highlights long lines for all files","<vimrc><highlight>"
"Why vim can't find a word in a js buffer when autocompletting?","<autocompletion>"
"How do I turn off the ""feature"" where the pound sign ""#"" is forced to 0 position?","<bash>"
"How to remove unnecessary tags generated by neocomplete plugin of vim in my code snippet?","<vimrc><plugin-neocomplete>"
"Why won't vim-plug install my plugins? [typo]","<plugin-vim-plug>"
"How can I toggle between single and multi-line expressions of arrays?","<formatting><rearrangement>"
"Send all writable buffers to external command?","<external-command>"
"How to change buffer name for NeoVim Terminal special buffer","<neovim><terminal><terminal-buffer>"
"How do I ShaDon't?","<neovim>"
"How to format a mapping to an if statement?","<key-bindings><vimscript>"
"Unmap locally a mapping from .vimrc","<key-bindings><buffers>"
"What are the advantages of using colon for commands instead of semicolon?","<key-bindings><history-of>"
"inoremap <Up> <C-c>gka sometime does not work","<key-bindings>"
"Substitute words enclosed between comma or open-parenthesis and comma or closed parenthesis","<regular-expression><substitute><delimiter-matching>"
"How to select the tag to open when several tags have the same name?","<tags><ctags>"
"Map 'Jump to mark line' to 'Jump to mark position'","<vimrc><key-bindings>"
"How to set formatoption so that a blank line isn't needed between two paragraphs?","<formatting>"
"Make neovim background the same colour as the terminal background","<neovim><terminal><colorscheme><macos>"
"How to add a tags file with expand","<tags>"
"`s` doesn't trigger surrounding, but substitute (`cl`)","<vimrc><plugin-vim-surround>"
"Syntax highlighting for custom LaTeX commands","<syntax-highlighting><filetype-tex>"
"Use visual mode to convert text to unicode bold formats?","<visual-mode><formatting><unicode><font>"
"Vim compiled with python3 but has('python') returns 0","<installing><linux-ubuntu>"
"Why my dot key doesn't work properly in insert mode?","<vimrc><autocompletion><plugin-you-complete-me>"
"cannot source file when trying to make a vim pluggin with python3","<vimscript><plugin-system>"
"gvim window looks bad","<gvim><linux><font>"
"Is there a way to map PC ""Options"" key in vim?","<key-bindings>"
"How to redirect search results into a new file?","<regular-expression><search>"
"How can I determine if *any* window in the current tabpage is in diff-mode?","<vimscript><vim-windows><vimdiff>"
"Any way to prevent :Ag search from automatically opening the first returned result?","<search><the-silver-searcher><plugin-ag.vim>"
"Is it possible to not have the same buffer open in multiple windows?","<buffers><vim-windows>"
"How to stop vim from reformatting lines inside a codeblock in a markdown file?","<formatting><filetype-markdown>"
"Why are my bulleted lines automatically joining?","<formatting><options><filetype-markdown><join>"
"Registers ” vs @","<register>"
"Syntax highlight Markdown formulas using LaTeX highlighting","<syntax-highlighting><filetype-tex><filetype-markdown><filetype-mathjax>"
"Why does :bd # delete the current buffer when no alternate buffer exists?","<buffers><vim-windows>"
"Why does Git think Vi quit in error?","<git>"
"Call vimscript function on first keypress","<vimscript>"
"How do I open a tag with <C-]> but open it in an existing split?","<vim-windows>"
"How to use WSL's bash shell as default terminal of gvim/windows 10?","<gvim><terminal><microsoft-windows>"
"""-u {vimrc}"" not working as expected","<vimrc><command-line><options>"
"Difference between unmap and mapping to <Nop>","<key-bindings>"
"Cannot find color scheme error in Neovim","<neovim><microsoft-windows>"
"How to make YouCompleteMe work with cgo","<vimscript><plugin-you-complete-me>"
"Vim Error for Git Commit Message","<save>"
"map something to the action of the leader key?","<key-bindings><search><leader>"
"Is there a prepend insert mode?","<insert-mode><cursor>"
"Is loadview conflicted with readonly mode?","<vimrc><vimscript><linux>"
"IDE-alike Find Usages","<ctags><ide>"
"Quickfix navigation not working properly","<vimrc><quickfix><makeprg>"
"Why does ""E89: No write since last change"" error not occur when commands are joined with bar?","<buffers><error><hidden-buffers>"
"disable clipboard: how to set clipboard option to Black hole register?","<cut-copy-paste><register>"
"Duplicating a row and modifying the duplicate as a macro or regex","<regular-expression><macro>"
"How to open a split-diff for selected file out of the commit","<plugin-fugitive>"
"BufNewFile doesn't work from ftplugin","<vimrc><vimscript>"
"Tab multiple lines","<whitespace><tab-characters>"
"Convert a search and replace to a function","<vimscript><visual-mode><replace>"
"How to auto save on *.coffee files when lose focus (in insert mode) then also back to normal mode","<vimrc><gvim><vim-windows>"
"How to capture errors from make in terminal window","<terminal><quickfix><makeprg><terminal-buffer>"
"mapping to enclose symbol under cursor with an expression that contains the symbol (revisited)","<replace><macro>"
"Convert man page nroff overstrike text into highlight regions","<pager>"
"Debug ultisnip snippet","<normal-mode><plugin-ultisnips>"
"How to fake a script file name inside a monolithic vimrc?","<vimscript>"
"Good vimrc settings for commit messages?","<vimrc><margin>"
"When defining a command which uses an external tool (like :perldo), how do I cancel upon error?","<external-command>"
"Jump to next occurrence of the current character","<key-bindings><search><navigation>"
"inoremap <C-S> <esc>:w<CR> i","<vimrc>"
"How to prevent accidentally piping text to Vim?","<terminal><linux><bash>"
"How to pass argument to Neoformat for prettier-eslint-cli from a variable in vimrc","<vimrc><vimscript>"
"Replace brackets and the content within the brackets in a variable","<vimscript><substitute><replace>"
"Do not display letter when waiting for key sequence to complete","<key-bindings>"
"Pipe the content of the current buffer into an external command and then read the output into a new empty buffer?","<buffers><external-command><ex-mode>"
"backupskip with { curly braces","<vimrc><set>"
"Vim yank and paste via a shared file","<cut-copy-paste>"
"Is it possible to map <C-S-Space> in neovim?","<key-bindings><neovim>"
"shortcut of the current directory path when vsplit/split","<split><variables><path>"
"Close all windows except the current one and NERDTree","<vim-windows><plugin-nerdtree>"
"indentation different on different computers","<indentation><filetype-sh>"
"Extra indent in Vi/Vim Tcl code block indentation","<indentation>"
"Highlight column values when difference is greater than a specific value","<vimrc>"
"Open multiple files in tabs from Explore mode","<netrw><tabbed-user-interface><multiple-files>"
"Cannot setup tern_for_vim plugin","<linux-ubuntu><plugin-ternjs>"
"Alt-I doesn't work to inset \item in vim-latex","<vimrc><plugin-vim-latex>"
"Move to next keyword in vim?","<navigation>"
"How to execute a command on vim startup","<normal-mode><startup>"
"Vim custom key mapping not working in superuser mode","<key-bindings><unix>"
"How do I remove newlines inside arbitrary xml tags matching a pattern?","<regular-expression><multiple-lines><filetype-xml><join>"
"Which buffer quickfix file is opened in?","<buffers><quickfix>"
"Why don't I get syntax highlighting when I open a file in an autocmd?","<syntax-highlighting><vimscript><autocmd>"
"Following a tag in a VimScript","<vimscript><tags>"
"What is the easiest way to insert en dash in Vim?","<insert-mode><unicode><input-methods>"
"In Vimdiff, how do I switch the left and right panes?","<split><vimdiff>"
"What bad things can happen if I use :bwipeout?","<buffers>"
"Vim `cpp` Syntax highlighter prematurely ends macros mid-word","<syntax-highlighting><filetype-c++><filetype-c>"
"Search all versions of a file in the undo tree","<undo-redo>"
"Auto Highlighting identical lines text","<syntax-highlighting><highlight>"
"How to tell vim not to try to unzip a file","<filetype><binary-file><plugin-zip>"
"Quickest navigation within a buffer","<cursor-movement>"
"How can I use Vim as a hex editor?","<binary-file>"
"How do I move to the last character in a sentence?","<cursor-movement><cursor-motions>"
"How can I make Vim position the cursor at the start of a tab character instead of the end?","<cursor-movement><whitespace><tab-characters>"
"Strange behaviour of abbreviations triggered with shift+enter in gvim+vim-latex","<gvim><plugin-vim-latex><abbreviations>"
"How to create syntax folding for pascal","<syntax-highlighting><folding>"
"How do I make dictionary completion look in a different file if triggered after the @ sign?","<autocompletion><tags><word-processing>"
"What is the easiest way to insert Unicode characters into a document?","<insert-mode><unicode><input-methods>"
"How can I create a pseudo insert mode with a different keymap?","<key-bindings><insert-mode><keyboard-layout>"
"Can I get vim to fold comments when using foldmethod=indent","<indentation><folding>"
"Duplicating line content by substitution","<regular-expression><substitute>"
"How to make a newline without autoindent","<indentation>"
"unable to setup persistent undo history in Vim","<vimrc>"
"How to make comma and semi-colon direction-insensitive of the latest f,F,t,T command","<cursor-movement>"
"How to open same file in multiple window but with changes present only in one window?","<buffers><split>"
"How can I focus on one vimsplit fullscreen?","<neovim><split>"
"'filetype plugin indent on' breaks indention","<indentation><filetype-javascript>"
"How to paste several lines to a new buffer without extra empty line?","<cut-copy-paste>"
"tabstop doesnt work by default in python files","<vimrc><filetype-python><plugin-python-mode>"
"Problem with conditional mapping <expr>","<key-bindings><vimscript>"
"Can I script VIM to process a list of diffs?","<vimscript>"
"Where is the documentation for this ex command?","<cmdline>"
"How do I open a tag in an existing gvim instance?","<gvim><tags><clientserver>"
"Folding for git merge candidates is (at least to me) backwards","<git>"
"UltiSnips not working with VimWiki","<vimrc><plugin-ultisnips><plugin-vimwiki>"
"markdown html-element syntax highlighting fails when line has leading spaces","<syntax-highlighting><filetype-markdown>"
"How can I run a specific vimrc file after running the default one?","<vimrc>"
"Trigger autocommand on error?","<autocmd>"
"Write buffer to command and append stdout back to same buffer","<external-command><shell>"
"Does explicit setting of $MYVIMRC imply its execution as private vimrc?","<vimrc>"
"How to remap repeating commands i.e. <number><command>?","<key-bindings><normal-mode>"
"Enable line numbering for directories","<vimrc><autocmd><netrw><line-numbers>"
"Pattern not found: lastlevel = -1","<folding>"
"What's the difference between autocmd {cmd} and autocmd! {cmd}","<autocmd>"
"Using ! (filter command) just to see the terminal behind vim","<neovim><filter>"
"Replacement in visual mode","<visual-mode><replace>"
"Make <Esc> close completion menu and cancel selection, without side effects","<autocompletion>"
"search one word containing # with *","<search>"
"`vimdiff` nor `nvim -d` are working as an external diff tool for git","<command-line><vimdiff><git>"
"How to copy file and line info from vim to gdb?","<cut-copy-paste><terminal>"
"how could I use gvim through ssh two hops","<vimrc><gvim><ssh>"
"What's wrong with ""terminal cd ."" in vim 8.1?","<terminal><vim8>"
"How to access any given vim plugin documentation?","<plugin-system>"
"How to use vim as an error checker?","<syntax-highlighting><highlight>"
"Different versions of vimrc being read","<vimrc><microsoft-windows><filesystem>"
"word boundaries in abolish","<substitute><plugin-vim-abolish>"
"Vim shows error when running python3","<linux><vimscript-python><installing><linux-ubuntu>"
"Vi shortcut to execute line under cursor as a command","<vimrc><vimscript>"
"How would one change the spell-checking style while preserving highlight color?","<syntax-highlighting><spell-checking>"
"How could I explore the files when using netrw to edit remote files","<netrw>"
"Is there a way to split a word by characters?","<formatting>"
"What is necessary to properly indent shell scripts with gg=G?","<indentation>"
"Autocmd pattern to match empty file/no filename","<autocmd>"
"Error detected while processing grammarous.vim: E117: Unknown function","<vimscript><plugin-system><functions><error>"
"Saving setting to buffer","<gvim><buffers><default-settings>"
"How can I add a definition with several words to the spell checker?","<spell-checking>"
"A quick way to restore motion after changing iskeyword","<cursor-motions>"
"delete brackets and select region","<cursor-motions><normal-mode><plugin-vim-surround>"
"gw text wrapping for LaTeX","<filetype-tex><wrapping>"
"Usage of a autocmd to write into a buffer - E523: Not allowed here","<autocmd>"
"Remapping keys doesn't seem to work in the terminal-buffer","<vim-windows><terminal-buffer>"
"terminal api not working on gvim","<gvim><terminal><microsoft-windows><terminal-buffer>"
"gf with search pattern instead of line number","<find><file>"
"""Invalid expression"" setting 'foldtext', what is wrong?","<vimscript><folding><set>"
"Vulgarities in the vim Default Dictionary","<spell-checking>"
"search a pattern preceding cursor position, modify it and insert the modified string","<key-bindings><vimscript><regular-expression><search><functions>"
"What is the purpose of the short cursor in command mode?","<cursor><operator-pending-mode>"
"Vim-Matlab plugin","<neovim><matlab>"
"Mouse click on VIM tab to create new window","<vimrc>"
"Updating buffer content from another buffer","<buffers><functions>"
"Delete blank lines within range","<range><global-command>"
"Is it possible to use syn match dynamically","<syntax-highlighting><regular-expression><highlight><syntax>"
"select font for tab headers in gvim","<gvim><tabbed-user-interface><font>"
"How can I undo `zg`?","<spell-checking><undo-redo>"
"POSIX compliant vi implementations","<posix>"
"Rails Vim tab completition for model and controller works different than for views","<autocompletion><filetype-ruby>"
"FZF Immediately Gives me the Dreaded Bell When first Tyring to use it","<plugin-fzf><fzf>"
"How to iterate over pattern matches?","<vimscript>"
"How to delete entry from indented argument from list?","<indentation><normal-mode>"
"How to explicitly open the signature preview window when not completing?","<autocompletion><ctags><previewwindow>"
"syntax match: redundant end of line marker ""$""","<syntax-highlighting><regular-expression>"
"VimPlug, Vim won't load plugins: E117: Unknown function : plug#begin;","<vimrc><plugin-vim-plug><autoload>"
"why wont vi recognize html?","<syntax-highlighting><original-vi>"
"Smart jump to definition","<ctags><navigation>"
"Error E575 when starting VIM","<neovim><error>"
"How do I setup a command to use the ""in word"" as an argument","<register><fzf>"
"Most efficient way to insert numbered columns into formatted text using standard Vim commands?","<original-vim>"
"Can't exit buffer using leader mapping - 'cannot make changes'","<buffers><error><map-operator>"
"Auto-indent after carriage return after line containing open curly brace","<indentation>"
"How to go to a line based on number of words on a line?","<search>"
"Visually select a few lines given start and end positions in vimscript","<vimscript><visual-mode>"
"Why are my buffer numbers so high?","<buffers>"
"Show current file name and parent directory in tabline of vim-airline","<plugin-airline>"
"How to edit the next file when VI doesn't have buffer support?","<multiple-files>"
"How to ensure private secure editing in vim?","<vimrc><security>"
"Reducing multiple blank lines into single blank line. Exceptional case","<regular-expression><ex-mode><global-command>"
"IndentationLine Plugin doesn't get loaded without autocmd; appearance changes from default to desired when opening another window","<neovim>"
"easy-align spaces around delimiters","<alignment><plugin-easy-align>"
"What are the differences between :wq<cr> :x<cr> and ZZ when exiting vim?","<save><filesystem><quit><original-vi>"
"Searching for method definitions with cscope and ctags (or anything else)","<ctags><cscope>"
"How to find what is causing the command line height to be changed after opening / closing a tab?","<command-line><vim-windows>"
"How can I perform a search when vim displays content using ""more"" pager?","<search>"
"Tag navigation using CTRL+] does not work with Non English keyboard on Windows","<cursor-movement><microsoft-windows><tags><jumplist>"
"Why doesn't YouCompleteMe complete function paramters?","<vimrc><autocompletion><filetype-c++><plugin-you-complete-me>"
"Suppressing standard output during compilation in vim-latex","<plugin-vim-latex>"
"Trouble to call a bash command from vimrc with autocommands | ""Error: no previous command"" (neovim)","<autocmd><neovim><bash>"
"Adding ctags for a 3rd party library","<autocompletion><tags><ctags><plugin-you-complete-me>"
"What does the '+' symbol mean when opening a buffer?","<buffers><neovim>"
"How can I set tex filetypes to use plaintex solarized coloring","<terminal><filetype-tex>"
"Adding text to the left margin","<vimscript>"
"How to test filetype in an autocommand without using the FileType event?","<autocmd>"
"Is there a way to reselect the last visual shape, rather than the last actual selection, starting at the current cursor position?","<visual-mode>"
"How to pass control characters, e.g. <c-e> to a function in a mapping?","<vimscript><functions>"
"Indenting lines in each paragraph except the first one using global command","<regular-expression><global-command>"
"Why does the <count> escape sequence insert the current line number in my user command?","<vimscript><count><user-commands>"
"Delete multiple lines by address","<repeated-commands>"
"How to move the cursor to the correct indentation level without quiting insert mode?","<key-bindings><indentation><insert-mode>"
"How to selectively change a hightlighted string?","<search><replace>"
"How I apply a command to all lines?","<key-bindings><normal-mode>"
"Is there a way to reselect the last pasted text, rather than the last actual selection, starting at the current cursor position?","<cut-copy-paste><visual-mode>"
"Why after pressing $ in normal mode Vim goes to the last symbol in line, but in visual mode it goes on the /n newline symbol?","<cursor-movement>"
"Properly restore terminal title after suspending vim","<terminal><macos>"
"List known filetypes","<syntax-highlighting>"
"Can I edit visually selected text in a different buffer?","<visual-mode>"
"Make findfile() always return full path","<filesystem>"
"How to surround all headlines with empty new lines in a markdown file?","<vimscript><regular-expression><global-command>"
"Using cscope to search for patterns with spaces","<cscope>"
"Is there any vim plugin that implement hot exit feature from sublime text","<save>"
"Apply macro to every `n`-th line","<macro>"
"""shell returned 2"" when I try to indent","<indentation>"
"How to override the move left motion","<key-bindings><vimscript>"
"How can I make two substitution command in one line","<regular-expression><substitute>"
"How can I get vim to include suffixes in <cfile>?","<vimscript><filesystem>"
"Get column of last character in visual line - Vimscript","<vimscript><functions>"
"What is resetting my softtabstop?","<vimrc><plugin-system>"
"What is the best practice in vim8 for wrapping with indentation aka breakindent","<vimrc><indentation><wrapping>"
"batch create html colored versions of a list of files reflecting syntax highlighting","<vimscript><syntax-highlighting>"
"Why doesn't Vim regex allow more than 9 capture groups?","<regular-expression>"
"How to use a variable in the expression of a 'normal' command?","<vimscript><normal-mode>"
"How do I capitalize the first word after each period, question mark or exclamation point?","<substitute>"
"Vim Word count and insert into current text","<vimscript><counting>"
"Vim and gVim in Windows doesn't recognize Mongolian letters Өө and Үү","<gvim><microsoft-windows><font><encoding>"
"Swap two shortcuts","<key-bindings><navigation>"
"Cursor to last edit works, last position doesn't","<cursor-movement>"
"How does p command work in vim?","<normal-mode>"
"How to find out if the binding is used for a given mode?","<key-bindings>"
"Count only words for which Spell is enabled?","<syntax-highlighting><filetype-tex><spell-checking><counting>"
"How do I keep folds when formatting (reindenting) the whole file?","<key-bindings><vimscript><indentation><external-command><folding>"
"Editing text in a quotation mark","<normal-mode>"
"Print an error message without ""Error detected while processing function""","<functions><error><errorformat>"
"How to generate closing tags for HTML?","<vimscript><filetype-html><text-generation>"
"Mapping with the meta key","<key-bindings><vimrc>"
"Use variables in colorscheme","<colorscheme><variables>"
"Paste + Override Shortcut","<replace><key-bindings>"
"Deleting several words","<key-bindings>"
"SyntasticCheck C++ header","<plugin-syntastic>"
"Gvim: gx to {the same, a new, a vertical-split} window","<gvim><netrw>"
"How to forward multiple arguments from a command in a function?","<vimscript>"
"How to get varargs as a string?","<vimscript>"
"Globally replace a particular pattern with another string","<regular-expression><search><replace>"
"Add a ""Press any key to continue"" in VimL?","<vimscript>"
"Vim omnicomplete with Ruby 2.3.1","<autocompletion><filetype-ruby>"
"Defining my own key","<key-bindings><vimrc>"
"Search all mention of the current file's file name","<regular-expression>"
"Multiple choice substitute?","<substitute>"
"What is the difference between single and double quoted strings?","<vimscript><string-manipulation>"
"Which text object defines text enclosed in space?","<cursor-motions><visual-mode><normal-mode>"
"Turn Vim's multiple undo history into git commits?","<git><undo-redo>"
"Can't move `viminfo` file - &viminfo reverts upon loading vim","<vimrc><viminfo>"
"How to insert line in normal mode and stay at the same position","<key-bindings><vimrc>"
"Move the partly duplicated(repeated over lines in the middle part) lines to the end?","<regular-expression>"
"VimScript ""unknown function"" on a lot of functions","<vimscript><neovim>"
"Can I block vim from saving a file that isn't validated using an outside tool?","<vimscript>"
"Highlight `SquishedCommas`, except at end of line","<vimrc><syntax-highlighting>"
"Applying vimrc to vimtutor in Windows","<vimrc><key-bindings>"
"Is `width` a parameter of the Python object `vim.current.window`?","<vimrc><vimscript-python>"
"Search and Replace in each PATTERN with counter","<search>"
"jobsend sends no data even though return code is 1?","<vimscript><neovim><job-control>"
"Is there a way to disable the command line window?","<key-bindings><command-line-window>"
"Pasting emojis 🦄 in Vim or Neovim","<vimrc><neovim>"
"copy line XX and paste it below my cursor (avy / ace jump style)","<key-bindings><cut-copy-paste>"
"How to determine the bit-width of the Number type in Vimscript?","<vimscript>"
"applying a map only to normal buffers","<key-bindings>"
"How can I detect which command triggers a shortcut in a third-party package?","<key-bindings><plugin-ale>"
"Setting syntax in ftplugin","<syntax-highlighting><plugin-system><filetype>"
"Visual block mode and vim surround?","<plugin-vim-surround>"
"How can I align the comment at the end of sentences when the comment predictor is already shown?","<formatting><alignment>"
"Syntax - Match word based on a previous match","<syntax-highlighting><regular-expression><highlight>"
"Question about autocompletion in Vim editor and html document","<vimrc><autocompletion><filetype-html>"
"How to create an Edit-with-Vim context menu entry for Vim 8.1 on Windows 10","<microsoft-windows><installing>"
"Why does VIM not copy the entire text inside the backticks in `\\sfdas\lsdfjla\` if I use `yi``","<cut-copy-paste>"
"How to get all/global match results for a string?","<vimscript>"
"Dynamically toggle formatoptions based on input","<indentation><autocmd><formatting><comments>"
"Is visual model selection really faster than using mouse?","<cut-copy-paste>"
"I have a red line that splits my terminal window into tow parts when i open python files, why its there?","<neovim>"
"vim-easy-align: How to align multiple characters with single command?","<alignment><plugin-easy-align>"
"How do I pass a full filepath to a function in a Vim plug-in?","<vimscript><microsoft-windows><plugin-vim-plug>"
"How to recover from swap files correctly on Neovim?","<neovim><swap-file>"
"How do you make the command mode case insensitive?","<command-line><letter-case>"
"How to deal with accented latin characters on neovim","<neovim><terminal><unicode><font>"
"how to edit the command when copy into conque","<insert-mode><plugin-conque>"
"Overwrite buffer with system clipboard by ex command","<buffers><ex-mode><register><os-clipboard>"
"How can I pass extra flags to FZF/ripgrep commands with the leader key?","<normal-mode><filesystem><multiple-files><find><plugin-fzf>"
"Number of columns highlighted","<gvim>"
