title,tags
"How do I remove lines where its content already occured in the previous line?","<regular-expression><substitute><multiple-lines>"
"Wrapper script for vim --remote","<vimscript><linux>"
"Is it possible to use '/' search as an inclusive motion (similar to what 'f' is to 't')?","<cursor-motions>"
"What is a better way to use `windo` without changing of window?","<vimscript><vim-windows>"
"How to add a uid to html nodes?","<text-generation>"
"How can I detect whether an unlisted buffer contains a new file or an existing file?","<vimscript><buffers>"
"GNU global and vim","<tags><cscope>"
"How to match the first occurence of a repeating pattern on the same line?","<regular-expression><search><substitute>"
"How can I undo last command in command line?","<command-line><vim-windows><tabbed-user-interface><undo-redo>"
"Why is make running against a wrong file?","<vimrc><makeprg>"
"Turn off highlights when pattern is entered","<highlight>"
"vim-latex/latex-suite: command sequences not coloured","<colorscheme>"
"How to append some line at the end of the file only if it's not there yet?","<substitute><ex-command>"
"How to execute a mapping on <F7> key from a script?","<vimscript><key-bindings>"
"How to show all unsaved files opened in vim?","<save><linux><crash-recovery>"
"How to use vim editing abilities while asking question on MSE","<vimrc>"
"Dividing long paragraphs across pages","<wrapping>"
"How to enter tilde (~), back tick (`) and special chars with a non-US keyboard?","<key-bindings><vimrc><keyboard-layout>"
"Syntax concealends not applied","<vimrc><syntax-highlighting>"
"How to pass a parameter to JSHint with Syntastic","<syntax-highlighting><filetype-javascript><plugin-syntastic>"
"How to get uniform tabs/spaces in other programs (like Less)","<vim-windows>"
"Custom motion to change, delete or select matching pattern","<cursor-motions>"
"Error, polytonic Greek spell file","<spell-checking>"
"Adding leading and trailing space when entering insert mode","<key-bindings><vimrc>"
"Is there a difference between ""sudo apt-get vim"" and ""./configure --with-features=huge""?","<installing><linux-debian>"
"Supertab or Jedi for Python Autocompletion","<plugin-jedi-vim><plugin-supertab>"
"Globally replace text contained in curly braces","<command-line><delimiter-matching>"
"Avoid spaces getting converted to tabs automatically during shift(>>)","<tab-characters><whitespace>"
"How to treat underscores like space?","<cursor-motions>"
"Overwrite colorscheme syntax highlighting","<colorscheme><vimdiff>"
"How should the option 'switchbuf' work?","<vimrc><buffers><split>"
"What is the select mode and when is it relevant to use it?","<visual-mode><history-of>"
"How to make autocmd FileType work when a file has multiple / compound dot separated types?","<autocmd><filetype>"
"Is there a trick to set 'ignorecase' locally","<buffers><options>"
"Match a pattern within matching delimiters","<delimiter-matching>"
"modify conque to gate selected text","<vimscript><plugin-conque>"
"search for lines which contain a pattern but do not contain a second pattern","<search>"
"how to change visual selector color with xoria256 colorscheme","<syntax-highlighting><highlight>"
"Apply formating with a script, or have ftplugin format particular text based on syntax","<vimscript><filetype-tex><wrapping>"
"real time vim keylogger","<bash>"
"How do you open a file in vim from the terminal (osx)","<terminal>"
"Search for "" and replace with '","<regular-expression>"
"Math calculations in vim?","<normal-mode>"
"Feed keys visual mode and pressing enter?","<vimscript>"
"Automatically insert characters with Ultisnips upon exiting Insert mode","<plugin-ultisnips>"
"How to make vim automatically do a CTRL+D after jumping to a tag?","<cursor-movement><tags>"
"How can you turn off text highlighting (hlsearch) with custom text objects?","<visual-mode><cursor-motions><custom-text-object>"
"How to search in visual mapping?","<cursor-motions><visual-mode>"
"How can I show a preview of my LaTeX buffer without stealing focus from Vim?","<external-command><filetype-tex><macos>"
"Can't reassign local variable value from register?","<vimscript><register><variables>"
"Quit subsequent files opened with gvim *.c?","<gvim><quit>"
"find next comma, skipping anything in parens?","<regular-expression><search>"
"Regexp for beginning of word?","<regular-expression>"
"Why does :only care if ""Other window contains changes""?","<vim-windows>"
"How to feed visual selection into ex?","<buffers><ex-mode>"
"Vim with astyle remap =","<vimrc>"
"Save a macro just created in vimrc","<macro>"
"Error when trying to call pymode#rope#goto_definition() with vim's -c arg","<vimscript><gvim><vimscript-python>"
"How to change the cursor line higlighting only for one window (namely the quickfix one)?","<highlight><quickfix><cursorline>"
"Markdown in Neovim: which plugin sets conceallevel=2?","<neovim><filetype-markdown><conceal>"
"Finding Numbers in Brackets Followed by a Letter and Summing Them","<vimscript>"
"How to bring current line & cursor at 25% from top of screen?","<scrolling>"
"How can I run :! commands inline instead of in a new cmd.exe window?","<gvim><external-command><microsoft-windows>"
"Is it possible to make text blink inside vim?","<syntax-highlighting>"
"different colour schemas depends how file is opened","<neovim><colorscheme><filetype-c++>"
"Can vimwiki be made to treat list indentation the way vim-notes does?","<indentation><plugin-vimwiki>"
"Problems in installing vim-latex","<plugin-vim-latex>"
"How do I get vim to autocomplete correctly for :! on Windows?","<command-line><autocompletion><microsoft-windows>"
"Manual fold issue on both Mac & Ubuntu","<folding><macvim><linux-ubuntu>"
"vi editing of bash command line: Avoid execution upon exit?","<bash>"
"How to redirect a make program's stdout when using it in Vim?","<vimrc><makeprg>"
"How to allow count *before* my custom operator?","<vimscript><count><map-operator>"
"start vi automatically in hex mode","<startup><key-bindings><xxd>"
"Change the looks of the character limit ruler","<options>"
"custom syntax highlight doesn't match in parentheses","<syntax-highlighting><filetype-java>"
"How to format files on save using black with neovim and coc","<neovim><formatting><filetype-python><plugin-coc><debugging>"
"How do I get the Commands line in the absolute bottom of the screen","<neovim><plugin-airline><iterm2>"
"Change comment char based on filetype","<vimscript>"
"ALE fails to lint or autofix, (executable check - failure)","<plugin-ale>"
"How to get Vim to show git status in the statusline?","<statusline><git>"
"View pylint errors using coc and neovim","<neovim><filetype-python><plugin-coc><plugin-python-mode>"
"Dealing with fallback behavior when debugging custom errorformats","<quickfix><errorformat>"
"How to get emoji completion in markdown with `:<emoji>`, using neovim and coc","<neovim><font><plugin-coc>"
"Vim mapping to auto-indent when entering inside braces, brackets etc","<key-bindings><indent>"
"How can I get +ruby feature in Ubuntu 20.04 LTS?","<linux-ubuntu>"
"How do I backup/restore fzf.vim recentfile history?","<fzf>"
"Vim watch file for changes","<colorscheme>"
"Open or create a specific Vimwiki page from a command prompt","<bash><invocation><plugin-vimwiki>"
"Toggle between displaymath and inline math modes in LaTeX","<filetype-tex><plugin-vim-latex>"
"How do I display a Python docstring in Vim","<plugin-you-complete-me><python>"
"Use unicode string to replace cjk characters","<unicode>"
"Why \r means newline when replacing?","<substitute>"
"How to overwrite the conceal background color with line color?","<neovim><syntax-highlighting><conceal>"
"Color themes listed as available in Vim not changing upon :colo [themename] command","<vimrc><colorscheme><plugin-system><color>"
"Improve copy to clipboard using xclip","<vimscript><functions><environment-variables>"
"How to hide a buffer thru vimscript, with buffer number or buffer name","<vimscript><neovim><buffers><terminal-buffer>"
"Date change question: Find and replace with wildcards?","<search><cut-copy-paste><substitute><replace><date-and-time>"
"Vim undofile does not work when file is too long","<filesystem><undo-redo>"
"How to let Vim work with pyenv?","<vimscript-python><environment-variables><python>"
"Vim outputting weird characters and becoming unresponsive","<terminal>"
"Vim E370 error caused by attempting to load wrong version of Python","<plugin-ultisnips><error><python>"
"Moving up and down wrapped lines","<navigation>"
"How would I make this into a keybinding?","<vimrc><key-bindings><command-line>"
":tabonly does not close all unmodified tabs if there is a modified tab in the way","<command-line><tabbed-user-interface>"
"Vim: Append to each line in a ""[I"" query","<repeated-commands>"
"Can you read the value of `showcmd` in a vimscript function?","<vimscript>"
"<CR> in Insert mode while editing plain .R files produces a magrittr %>%","<nvim><plugin-nvim-r>"
"Can't type <>[]{}'""()` and backspace in vim after :set nopaste","<paste>"
"Syntax highlighting for objdump output","<syntax-highlighting>"
"mutually exclusive Autocommands for similar file extensions","<autocmd>"
"Deleting folds over a range","<folding><range>"
"How to convert register contents to something readable similar to :register command?","<vimscript><register>"
"How can I use different vim setting for different filename?","<original-vim>"
"How to quickly type a C expression where the assigned-to variable is repeated?","<vimrc>"
"Configuring Multiple Compiler Plugins in a Single Project","<neovim><makeprg><errorformat>"
"What is a pop_up windows?","<vim-windows><version>"
"Create a motion?","<key-bindings><cursor-motions>"
":o autocomplete","<autocompletion><normal-mode>"
"german umlaute mapping","<key-bindings><keyboard-layout>"
"Recognizing the right expression to complete in insert mode","<plugin-vimtex><ins-completion>"
"Vim auto save buffer on Tmux `select-pane`","<autocmd><tmux>"
"Why my vim doesn't support hex color code?","<syntax-highlighting>"
"How to configure support for cmd key in terminal (neovim)","<key-bindings><neovim><iterm2>"
"Can't use special characters in listchars even if setting scriptencoding to utf-8","<vimrc><syntax-highlighting><encoding><listchars>"
"Highlight syntax in start and end delimiters of region","<syntax-highlighting>"
"How do I change the return/enter key functionality without breaking enter to select?","<vimrc><key-bindings><neovim>"
"How to prevent stopping a macro on unsuccessful substitution?","<substitute><macro>"
"Does <c-h> represent a backspace when being mapped?","<vimrc><key-bindings>"
"Can't get textwidth for syntax highlighting working","<syntax-highlighting><filetype-fortran>"
"What is the green <92> that's in my file?","<grep><ascii><file>"
"Installing NeoBundle packages with Plug","<plugin-system><plugin-neobundle>"
"how do i open a new window with a new buffer, containing a variable?","<vimscript>"
"How can I fix my dependencies installing vim","<installing>"
"NeoVim - Go into insert mode when clicking in a terminal in a pane?","<neovim><insert-mode><terminal-buffer>"
"How could I customize preview window coloring with results from Ripgrep and fzf?","<vimrc><plugin-fzf>"
"Expanding region/selection for javascript","<filetype-javascript><selection>"
"Settings for the font in .vimrc are not working","<gvim><font>"
"Saving a scratch buffer","<vimrc><autocmd><scratch-buffer>"
"Autocmd treat user defined command differently?","<autocmd>"
"API, Modes, and their Short-Names","<neovim>"
"How do I configure the path to match Python's site-package location?","<path>"
"How to replace tabs with spaces?","<indentation><tab-characters>"
"More detailed comparison within a line","<vimdiff>"
"Navigating multiple files","<multiple-files><load>"
"Return to previous buffer without going through every jumplist entry","<buffers><jumplist>"
"How can I easily get the length of a piece of text?","<cursor-motions><visual-mode><counting>"
"Can I justify text in Vim?","<wrapping><word-processing><alignment>"
"Can I issue an interactive shell in Vim window?","<external-command><shell>"
"How do I change the current split's width and height?","<split>"
"Can I force parentheses matching to show up across multiple windows?","<split><delimiter-matching>"
"Can the command-line window be entered without interrupting macro recording?","<command-line><macro><command-line-window>"
"Move vertically to a specific character on a different line","<cursor-movement>"
"Is there any way to add to the help system without developing a plugin","<help-system>"
"Folding fails: vim can't find any fold","<ide><folding><filetype-php>"
"Creating & maintaining flowcharts in Vim","<alignment><ascii-art>"
"GitHub for .vimrc and plugins","<vimrc><plugin-system>"
"Run shell commands on current file based on file extension","<key-bindings><external-command><filetype>"
"Is it possible to easily work with .odt, .doc, .docx, .rtf, and other non-plain-text formats in Vim?","<autocmd><load><word-processing><file-formats>"
"See the Unicode code point of the current character","<statusline><unicode><encoding>"
"Raise window holding swap file","<swap-file><x11><linux>"
"Map a sequence of letters in insert mode","<key-bindings><insert-mode>"
"Prevent Vim from breaking up links mid-tag in markdown","<word-processing><wrapping><line-breaks><filetype-markdown><markup>"
"What is the correct capitalization of 'vim'?","<help-system><history-of>"
"How can I make the ""gn"" motion wrap to the beginning of the file?","<search>"
"Can I see the history of key presses in normal mode?","<command-history><normal-mode>"
"How much money has been raised for needy children in Uganda from Vim?","<history-of>"
"Can I use Vi or Vim with screen readers and/or Braille devices?","<options><input-devices>"
"Keeping lines to less than 80 characters","<line-breaks>"
"Sharing vimrc options in different computers","<vimrc>"
"equalprg to use for Python","<ide><indentation><whitespace><filetype-python>"
"Ctags function overload","<ctags>"
"Is there a conflict between `syntax enable` and custom keywords?","<syntax-highlighting><syntax><keyword>"
"Understanding how ""vi"" finds its global configuration file","<vimrc><linux-ubuntu>"
"initialization .vim directory base contents","<vimrc>"
"Mapping to insert comment at the end of a line","<vimscript><comments>"
"How to change color of the splits counter in a 'tabline'","<vimrc><colorscheme><tabbed-user-interface>"
"How does VIM sets the $VIM environment variable?","<environment-variables>"
"How to match autocmd pattern for unique file","<vimscript><autocmd><manpages>"
"Why does MacVim crash on Zoom","<macvim>"
"EurKEY input moves characters in INSERT mode","<keyboard-layout>"
"How to make vim text bold?","<vimrc><highlight>"
"How to make mapping for any mark","<key-bindings><mark>"
"Silence errors from colorscheme, silent! and try/catch not working","<vimrc><vimscript>"
"Importing project-specific rc files in Neovim","<vimrc><neovim>"
"Running previous run command that was run in normal mode using colon","<command-line><normal-mode><repeated-commands>"
"Valid usecases for `=` macro register","<macro><repeated-commands><expression-register>"
"gVim python continues to indent after function ends","<vimrc><gvim>"
"Is it possible to simultaneously edit one file in two views?","<buffers><split>"
"maparg returns empty string, but the mapping is effective","<key-bindings>"
"Invalid syntax for a bash file called catalog","<syntax-highlighting><bash>"
"Enable syntax highlight between custom tags","<syntax-highlighting>"
"Multiline errorformat","<filetype-tex><errorformat>"
"Neovim with split integrated terminal / REPL","<neovim><terminal>"
"Multi-line array variable in bash with filetype sh does not indent correctly","<indentation><filetype>"
"Last line on screen not showing state","<default-settings>"
"Can mapleader be Ctrl or Shift?","<leader>"
"Vim Syntax Highlighting for an Object's Method Call","<vimrc><vimscript>"
"Open new file while keeping the focus on the the current buffer","<buffers>"
"Syntax of keys on keyboard in documentation","<key-bindings><keyword>"
"Is there a Set datatype in VimScript?","<vimscript><dictionary><list>"
"Explain `infercase` option","<ins-completion>"
"How to execute selected lines in bash and print the output in the next line?","<vimrc><vimscript>"
"Why is `vim -E` always exiting with non-zero exit code when using here-doc?","<ex-mode><shell><posix>"
"If else statement vimrc for custom key mapping","<vimrc>"
"Search for line, move to end of search string, then search+replace","<regular-expression><search><replace>"
"How to get the current mode in vim?","<vimscript><statusline><variables>"
"Why is <C-S> not remappable?","<key-bindings>"
"How to execute commands in vim, piping the output back into the editor in real time?","<vimscript><external-command>"
"remap esc key introduced remove behave","<vimrc><key-bindings>"
"Could backtick-expansion be consistently used for autocompleting filenames within directory tree?","<key-bindings><shell>"
"How to replace a string only if the line starts with another string","<search><gvim><replace>"
"How to pass '\v\C[pattern]' into the built-in match() VimScript function","<vimscript><regular-expression>"
"Running find-and-replace in Visual Mode :'<,'>s/^/string/g inserts ""string"" at 0 position instead of ^ (first non-whitespace) position","<key-bindings><vimrc><search><visual-mode><string-manipulation>"
"In what order does Vim read ftplugin files, syntax files, and the .vimrc when the commands (e.g. set syntax=mysyntax, filetype plugin on) are called?","<vimrc><filetype><plugin-system>"
"How to disable auto-indent when pasting in BusyBox's Vi?","<indentation><busybox-vi>"
"How to load a single plugin when starting vim from the cmdline","<plugin-system>"
"How to output result of vim commands to shell","<bash>"
"How can I configure nvim to use a single escape to exit insert mode?","<neovim>"
"How I configure Vim for use with netrw?","<netrw><save>"
"Vim Text object and parentheses","<vimrc><object-motions>"
"I cannot append a matching pair to b:match_words","<vimscript><plugin-matchit>"
"Cut and copy : Blackhole and default register assignment","<key-bindings><cut-copy-paste><macvim><register>"
"Vimrun.exe keeps opening and closing when statusline is updated","<gvim><microsoft-windows><statusline><functions>"
"Loading ultisnips with NeoBundleLazy","<plugin-ultisnips>"
"Interrupting (blink-highlighting) function if mapping is invoked again","<vimscript><vimrc>"
"How to customize the entries in the completion menu?","<vimscript><vimrc><autocompletion><neovim>"
"wrap breaks when using delete or change word type commands","<cursor-motions><wrapping><line-breaks>"
"How can I change the default grep call (grepprg) to exclude directories?","<neovim><ex-command>"
"Mapping Ctrl with equal sign","<key-bindings><macvim>"
"Assign shortcut to a Split window resize Ctrl+w+|","<key-bindings><macvim><split>"
"How can I increase floating number with ctrl-a without deleting zeros?","<key-bindings><vimrc>"
"autocmd VimLeave event not firing","<autocmd>"
"No echo command?","<command-line><linux><linux-ubuntu><echo>"
"Echo message on startup without prompting","<vimrc><echo>"
"Using vim diff to compare the working directory to the HEAD in git?","<vimdiff><git>"
"Paste visual block selection on its own lines","<cut-copy-paste><visual-block>"
"What does Command+s do in MacVim?","<macvim><save>"
"Is there anything like matchaddpos() but stick the highlight with the character instead of grid?","<highlight>"
"with matchit installed %match parenthesis and brackets only once in Fortran files","<delimiter-matching><plugin-matchit><filetype-fortran>"
"Syntastic checking for embedded handlebars code?","<gvim><plugin-syntastic>"
"How to allow editing of a file from other sources while it's already open in vim?","<swap-file>"
"How to map a shortcut for saving the file","<key-bindings><save>"
"How to enter and display German Umlauts on a Windows 10 machine with Russian locale?","<microsoft-windows><unicode><keyboard-layout>"
"Autocomplete after serveral chars","<autocompletion>"
"Why can't UltiSnips use python while 'python' is enabled?","<plugin-ultisnips>"
"key mapping hints plugin","<key-bindings>"
"How to activate vim-snippets for UltiSnips and Pathogen?","<plugin-ultisnips>"
"How to show all unique types of a pattern?","<search>"
"Map movement keys to jump words like in non-modal editors","<key-bindings><cursor-movement>"
"Transforming a long table into multiple columns","<formatting><tab-characters>"
"Jump cursor vertically over code blocks. Keep horizontal position","<cursor-movement><cursor-motions>"
"How can I reload my .vimrc without appending anything to my current settings?","<vimrc><neovim>"
"Open file in a new instance of vim from nerdtree","<linux><plugin-nerdtree>"
"Is it possible to obtain the displayable area, width and height of current buffer in Vim?","<vimscript><buffers><split>"
"How to execute persistent command from vim to bash?","<external-command>"
"Vim syntax highlighting for custom C types","<syntax-highlighting><filetype-c>"
"How can I find the list of all of vim's default keybindings?","<key-bindings>"
"How can I define an operator that takes a register as an argument?","<key-bindings><vimscript><cut-copy-paste><replace><register>"
"How to install base16 for iTerm2?","<colorscheme><iterm2>"
"Run a function once on every paragraph","<vimscript><regular-expression><highlight><global-command>"
"Act on lines changed by previous command","<cursor-motions><range><object-motions>"
"EasyGrep plugin - is there a way to search only the current buffer","<plugin-easygrep>"
"How to export information from vim to bash","<external-command><bash>"
"Mapping ctags keys","<key-bindings><ctags>"
"Is there any documentation available on the internals of netrw?","<netrw><plugin-system>"
"Keep matchadd and matchaddpos up to date after file changes","<vimscript><highlight>"
"How can I use insert mode completion in a macro?","<autocompletion><macro>"
"vim diff isn't working while my shell is powershell","<vim-windows><vimdiff>"
"Is Vim's filename completion broken in Windows when using uppercase u umlaute (Ü)?","<microsoft-windows><unicode>"
"Can I specify the encoding of a sourced file?","<unicode>"
"Contextual key bindings when a specific context menu is open","<neovim><vim-windows><plugin-fzf>"
"How to disable the command key in Vim in Mac?","<key-bindings><macos>"
"How to open a file with variable in the path?","<variables>"
"How to map Alt-Enter","<key-bindings>"
"Show filename tail and parent directory in statusline","<statusline>"
"Delayed esc from insert mode caused by cursor-shape terminal sequence","<terminal><cursor>"
"How to add a new colorscheme syntax keyword","<syntax-highlighting><colorscheme>"
"Vim: Aligning insertion point with left side of column","<key-bindings><indentation>"
"How to not trigger InsertLeave inside an imap?","<key-bindings><autocmd><insert-mode>"
"<Esc> key mapping seems to be not working in my vim 8.0 on my Ubuntu 16.04","<vimrc><linux-ubuntu>"
"Discover which other user(s) are accessing a file","<save><swap-file>"
"Vim package development python support for 2, 3, or both?","<vimscript-python><plugin-development>"
"Is there something like '5s' for replacing words (instead of letters)?","<insert-mode>"
"Line number order is broken","<line-numbers><spacevim>"
"Why does ""e"" move you one character before the actual end of the word?","<cursor-movement><cursor-motions>"
"Indentation script does not work for all occurrence","<command-line><indentation>"
"Why -- ^X mode (^]^D^E^F^I^K^L^N^O^Ps^U^V^Y) Pattern not found?","<vimrc><autocompletion>"
"Is there any way to copy a entire function without indicating line number?","<cut-copy-paste>"
"How to comment a line in vim?","<comments>"
"e or tabe into path resulting from a ! command","<external-command><tabbed-user-interface>"
"How to call both javascript and php complete in editing html file with vim?","<autocompletion>"
"neovim doesn't change cursor in st terminal","<cursor><st>"
"Why is using arrow keys in normal mode considered bad practice?","<key-bindings><cursor-movement>"
"Is there a VIM plugin available to add JSONPath / jq / JMESPath path searching?","<filetype-json>"
"Vim not using variable value when changing a setting","<vimscript><neovim><variables><set>"
"How can I adjust ='s alignment of C-style comments?","<vimrc><indentation><alignment>"
"Add custom section to airline","<neovim><plugin-airline>"
"How do I wrap the location-list by default (without turning on wrap for files)?","<wrapping><plugin-syntastic><location-list>"
"Key repeat - removal of modifier","<gvim>"
"How to remove trailing white-spaces automatically while typing?","<whitespace>"
"Why all lines dispear after executing the lines on edited file?","<bash>"
"Save last action (.) in a macro","<macro><repeated-commands>"
"Why are two <cr> characters required when executing this highlighting toggle command?","<key-bindings><command-line><normal-mode><highlight>"
"How can I soft-wrap a word to a new line?","<wrapping><line-breaks><multiple-lines>"
"How to compile vim for user only and use git to track it?","<git><path><compile-vim>"
"How to NOT create a view and session file when viewing man pages","<vimscript><neovim><sessions><pager>"
"formatoptions for hybrid (short markup + long paragraphs) content","<autocmd><formatting><filetype><filetype-tex><wrapping>"
"Vim, tmux, and xterm-bracketed-paste","<cut-copy-paste><tmux>"
"Vim can't detect if a file is vim file type by commenting a file with vim:ft=vim","<filetype>"
"remove vim statusline for horizontal splits with laststatus already set to 0","<statusline>"
"How to create a key mapping to save file in any mode?","<key-bindings>"
"Auto activate autocompletion","<vimrc><autocompletion>"
