title,tags
"Discrete line numbers specified individually not as range","<vimscript><ex-mode><line-numbers>"
"How to view the command that was just un(re)done","<undo-redo><command-history>"
"How to configure autocompletion so that it replaces everything until non-word-char?","<autocompletion>"
"Set Indentation when Declaring Constructors for C++ Classes with Inheritance","<indentation>"
"Strange Highlighting during Git Commit","<syntax-highlighting><colorscheme>"
"How to force macro keep running even pattern is not found?","<macro>"
"How to echo a command but avoid the ""hit enter"" prompt","<echo>"
"Substring of filename in external command (bang)","<external-command>"
"Is it possible to color vim vertical indentation lines depending on the indentation level?","<indentation>"
"Move to the first/last non-whitespace character of the column (""vertical W/B/E"")","<cursor-movement><cursor-motions>"
"vim auto indent suddenly stopped working","<neovim><indentation>"
"What '\v' and '@<=' in '/\v(A)@<=b+\1' regex means?","<regular-expression>"
"How to map Ctrl-W <arrow> to Alt <arrow>","<vimrc>"
"How to delete swap files on neovim?","<neovim><swap-file>"
"What does vim's m command do?","<key-bindings>"
"What is the difference between normal mode and command mode in vim?","<normal-mode>"
":lvimgrep with one match per file","<vimgrep>"
"How to write a buffer which isn't the current to a temp file?","<buffers><save><terminal-buffer>"
"Make hardcopy without a header","<printing>"
"How does one automatically run a function when any error message appears?","<autocmd><external-command><error>"
"Competitive coding template in vim macro","<vimrc><vimscript><macro><filetype-c++>"
"Copying From Vim to Ubuntu Bash on Windows","<microsoft-windows><os-clipboard><linux-ubuntu>"
"Sorted TODO list with :sort n and letters","<sort>"
"Unknown symbols in vim near filename and filetype","<plugin-airline>"
"Make backup only once per session, when I close a file","<vimrc><backup>"
"<esc>k inserts `q`, r inserts two qs","<terminal>"
"How can I have more space between line number and code?","<line-numbers>"
"Cursorline/Columnline slowdown","<syntax-highlighting><scrolling><cursorline><redraw>"
"How to remove lines which have lower numbers than before, and keep only the sequential?","<vimscript><substitute><global-command><multiple-lines>"
"Make ctrl-j and ctrl-k work like they do in less?","<key-bindings><cursor-movement><scrolling>"
"What is the correct way to escape UNC paths?","<vimscript><external-command><microsoft-windows><filesystem>"
"How to use function returns?","<functions>"
"CursorHold event not working on nohlsearch","<search>"
"How to put space before and after operators for enhanced readability?","<regular-expression><search><replace>"
"Neovim Clipboard Selection","<neovim><os-clipboard>"
"Remapping Alt key in terminal: problem with macros","<key-bindings><terminal><macro>"
"What is the difference between set complete+=t and set complete+=k in vim?","<autocompletion>"
"How to go to end/get out of the parenthesis of a line in vim?","<cursor-movement>"
"Using a custom color scheme and setting it as default","<vimrc><colorscheme>"
"How to refer to ""~/vimfiles"" on Windows and ""~/.vim"" on Linux?","<vimrc><vimscript>"
"How to select/delete/yank the contents of only the current fold?","<cut-copy-paste><cursor-motions><folding><object-motions><custom-text-object>"
"How can I change Javascript syntax to higlight objects?","<syntax-highlighting><filetype-javascript>"
"Vim stops treating ""<Plug>"" as a keyword to call functions in insert mode","<vimrc><plugin-system><key-bindings><plugin-vim-latex>"
"How can I center align a word(s) in a table?","<alignment>"
"Using colon-commands inside ternary expression","<key-bindings><vimscript><command-line><undo-redo>"
"Is there a way to indent and outdent lines without moving the cursor?","<key-bindings><indentation>"
"How to know the shell started with :terminal?","<vimscript><terminal>"
"Why are [$p] characters appearing at the beginning of every file?","<echo>"
"How to affect the syntax highliting filetype from local vimrc?","<syntax-highlighting>"
"How can I remap Vim keys with numbers?","<key-bindings>"
"Save buffer before opening new file","<buffers><autocmd>"
"How to open internal MediaWiki links with their full URL from within Vim?","<external-command>"
"Syntax highlighting stopped working","<vimrc>"
"How to Insert a console.log for word under cursor in new line","<key-bindings>"
"vi/nvi (FreeBSD) How to make an abbreviation to a shell command?","<abbreviations><nvi>"
"How to set custom shortcut in vim?","<vimrc><indentation>"
"Enable cursor blink in all modes for terminal Vim","<vimrc><cursor>"
"Highlighting comments to EOL (terminal EOL, not buffer EOL)","<syntax-highlighting><terminal>"
"How to create command with -register and <reg>?","<vimscript>"
"Show terminal buffer in airline's tabline","<neovim><plugin-airline>"
"Map CTRL-& in vimrc","<vimrc><key-bindings>"
"How to truncate all lines at a certain length?","<global-command>"
"function variable scoping and arg types problems","<vimscript><functions><variables>"
"How can I hide and scroll popup window in coc.nvim in Vim?","<plugin-coc>"
"search highlighting only in the current buffer","<search><buffers><highlight>"
"Can the temp gzip decompression location for the integrated help documents be changed from /tmp?","<help-system>"
"Namespace color scheme","<colorscheme>"
"Make a buffer active by its number","<vimrc><vimscript><buffers><terminal><terminal-buffer>"
"Replay a vim macro until specified line number","<normal-mode><repeated-commands>"
"Running code in a different tmux pane","<tmux>"
"Move/copy range to start of current line","<cut-copy-paste><range>"
"How to comment List item?","<vimscript>"
"Ignore some files when using viminfo+=%","<buffers><startup><viminfo>"
"Appending file format while turning text into link (by pressing Enter) in Vimwiki","<plugin-vimwiki>"
"TeX file, search outside math","<filetype-tex><plugin-vimtex>"
"Two lines in command area how to make a single line","<vimrc>"
"Open netrw view of directory with Ctrl-P","<netrw><plugin-ctrlp>"
"Last char on the line is being ""left out"" in many situations","<cut-copy-paste><cursor-motions>"
"VIM How to enable .ts .tsx .js (for front-end) code highlight?","<vimrc><syntax-highlighting><plugin-system><filetype-javascript>"
"Why do the \| characters in an :execute ""normal ..."" mapping require extra escaping backslashes?","<key-bindings><regular-expression>"
"In GVim, preven ALE from changing syntax color, but still underlines errors","<syntax-highlighting><plugin-ale>"
"What's the difference between `/x` and `:/x`","<vimscript><search>"
"Vim command 0 goes to second column instead of first one","<vimrc><cursor-movement><normal-mode>"
"Can't set neovim colors to follow terminal colors in st terminal","<neovim><colorscheme><st>"
"How to copy text to X primary selection only when visual mode is started with the mouse?","<cut-copy-paste><visual-mode><os-clipboard>"
"How to show the name of a help buffer in the tabline of the airline?","<help-system><plugin-airline><hidden-buffers>"
"Tracking down odd behavior right after opening Vim and using fuzzy finder","<plugin-fzf>"
"tell vim to add default extention to word under my cursor before opening file","<vimscript><gvim>"
"Call a function after inserting a newline","<autocmd><insert-mode>"
"Write buffer list to file","<vimscript><buffers>"
"vim highlighting doesn't set the right type for a new filetype","<linux><syntax-highlighting>"
"Switch between splitted file with SPACE + NUMBER instead of CTRL-W (like in spacevim)","<split>"
"Moved from vim to neovim and now <BS> deletes 4 spaces at a time, instead of 1 as I'm used to. How to fix?","<neovim><whitespace><softtabstop>"
"How to conceal multiple characters without making text dance upon hovering?","<conceal>"
"vimdiff: disable option iwhiteeol in diffopt","<vimdiff>"
"How to append a random number between a range [1,10] at the end of each line in vim","<line-breaks><enumerate>"
"Using Vim to syntax check some text","<spell-checking><grammar-checking>"
"Search and replace in vimscript using a range?","<vimscript><range>"
"What is ""open mode"" and why is it in Vi but not in Vim?","<command-line><ex-mode><original-vi>"
"Use vi/vim from shell to filter / format text","<vimscript><command-line>"
"`normal` does not seem to allow automatic indentation","<vimscript><indentation><normal-mode>"
"Can I do array destructuring in VimL?","<vimscript><variables>"
"Finding out what number occurance of a matching pattern is under your cursor?","<regular-expression>"
"Spacing appears in Vim Airline on right side","<plugin-airline>"
"Execute normal command over range","<command-line><normal-mode><repeated-commands>"
"Remove left bar in vim","<vimrc>"
"async_job patch in Kaoryia's gVim (windows)","<gvim><microsoft-windows><async>"
"Filtering text out to new tab with custom command","<buffers><user-commands>"
"nnoremap is not working with `[v`]","<key-bindings>"
"how to replace all space with ""_"" for the first quoted string","<gvim>"
"One-handed Vim utilisation","<cursor-movement>"
"Reopen splits after closing them with <C-w>o","<vim-windows><split>"
"Sorting a list in the buffer?","<sort>"
"Linking the vsplit views of two different buffers?","<split>"
"Is it safe to do other stuff on a system while a macro runs?","<macro>"
"How to prevent vim from creating (and leaving) temporary files over webdav?","<swap-file>"
"How can I make Vim open help in a vertical split?","<vim-windows><help-system>"
"Using :TOhtml with solarized colorscheme","<colorscheme><plugin-solarized>"
"Creating C:\Users\MyUserNameHere\_vimrc on Windows seems to override some other vimrc file","<vimrc><microsoft-windows>"
"Using registers in different terminals","<register><window-management>"
"a problem with a mapping ( map enter and tab key)","<vimscript><vimrc>"
"How to open a file with all folds opened?","<folding>"
"Expand f and t motion to next lines","<cursor-motions>"
"How do I define an autocommand to work on all files excepted a certain filetype?","<autocmd><filetype>"
"How to add space on multiple lines when pressing spacebar (without extra configuration)?","<insert-mode><visual-mode><replace>"
"What is the order of WinEnter, BufEnter, BufRead, Syntax, FileType events?","<buffers><vim-windows><autocmd>"
"Encoding issue with filename in MacVim","<macvim><macos><encoding><xxd>"
"Constantly updated community best practice website?","<vimrc>"
"jinja2 indentation with gg=G","<indentation>"
"Determining makefile based on source file name","<makeprg>"
"Why does Vim highlight every dot in my code?","<vimrc><highlight>"
"Scrolling issues when the `wrap` option is set","<cursor-movement><terminal><normal-mode><scrolling>"
"Nicer way to not mach a pattern in autocmd","<vimscript><autocmd>"
"How to use arrow keys mappings in vim-submode plugin on linux terminal?","<key-bindings><terminal>"
"When exactly does <afile> differ from <amatch>?","<autocmd>"
"How to configure spell to ignore some environments in LaTeX","<spell-checking><plugin-vimtex>"
"Copy the values from a variable?","<variables>"
"Lag from filetype plugin indent on","<indentation><performance>"
"How to set up Crtl-v map that works in insert mode?","<key-bindings><cut-copy-paste>"
"Mappings with <alt> don't work within Terminator","<key-bindings><terminal>"
"Keeping context while scrolling","<scrolling>"
"Printing unicode chars?","<unicode><encoding><printing>"
"How to apply a setting in all open tabs and windows?","<vim-windows><options><set>"
"Emulate Emacs' ""auto-fill-mode""","<autocompletion>"
"syntax highlight function arguments","<syntax-highlighting>"
"How do I quote tabulated columns?","<visual-block><multiple-lines><plugin-vim-surround>"
"Consistent repeat search","<search>"
"Rather than tabnext and tabprevious can I get a list of tabs and select the one to switch to?","<tabbed-user-interface>"
"How do I highlight pc-lint comments in C/C++","<syntax-highlighting><comments><filetype-c>"
"neovim takes a long time to open files","<syntax-highlighting><performance><plugin-vim-polyglot>"
"Mappings defined in vimrc file only work sometimes?","<vimrc><key-bindings>"
"Prepare a range for an ex command without visual mode or line numbers","<cursor-motions><ex-mode>"
"How to sort lines by the right most characters?","<visual-mode><alignment><sort>"
"Netrw tree listing style opening files in other directories creates new empty files in current directory","<netrw>"
"Is it possible to clone a directory with netrw?","<netrw><filesystem>"
"Mapping Ctrl-Caret in insert mode?","<key-bindings><plugin-conque>"
"In vimrc, how can I chain multiple instructions in one Leader command","<vimrc>"
"Set folding method for c and cpp files, but not h and hpp","<folding><filetype>"
"What does :set background=dark do?","<colorscheme>"
"VIM regex - match all words equal to one under cursor, except one currently under the cursor","<regular-expression>"
"How can I find my true vimrc file?","<vimrc>"
"Inconsistency with the ""Discard All"" command","<gvim>"
"iskeyword for latex","<filetype-tex><variables>"
"Highlighting after a line limit","<folding><delimiter-matching>"
"How to get command line :g to output pattern search result including the first line?","<regular-expression>"
"What is the difference between :file and :saveas","<save><scratch-buffer>"
"Escaping and quickly pressing certain keys brings me back to insert mode","<key-bindings>"
"Handling Complex Arguments in a Vim Command","<vimscript><argument-list>"
"Replace surrounding quotes for < >","<replace><plugin-vim-surround>"
"How to disable moving the cursor with the mouse","<vim-windows><cursor><mouse>"
"gf: can I get next file that matches?","<filesystem>"
"Refer to text between arbitrary delimiting characters","<cut-copy-paste>"
"Running autocmd somehow turns to insert mode","<neovim><autocmd><terminal>"
"Can't make vim-plug work","<vimrc><plugin-vim-plug>"
"Improperly highlighted when used with cursorcolumn","<syntax-highlighting><cursorline>"
"How to ""find"" or ""till"" a bigram?","<cursor-movement><find>"
"Vim UltiSnips for python not working","<plugin-ultisnips>"
"map } but not after y","<key-bindings>"
"remap ':' to maintain last command, and erase all char if any key other than <CR> was pressed","<command-line><functions><repeated-commands>"
"How can I edit my Vim configuration whilst working in Vim?","<vimrc><set>"
"Unicode character does not show when entered using <C-q> with cp932","<gvim><microsoft-windows><unicode>"
"expandtab / noexpandtab toggles by itself in Neovim","<neovim><tab-characters>"
"Paragraph transfer from one file to another","<cut-copy-paste><gvim>"
"Jumping to one character past the search","<search><normal-mode>"
"Search for mismatched length alternative pattern?","<regular-expression><search>"
"Clear NeoVim Terminal window","<neovim>"
"Prevent the cursor from moving to the start of the yanked text?","<key-bindings><cursor-movement><cut-copy-paste><jumplist>"
"How to restore bash terminal title if using 'set title' in vim?","<vimrc><terminal>"
"Find first occurrence of string or return end of file","<search><matlab>"
"Preload a named register?","<vimrc>"
"mapping to quit using ""<Ctrl> + q"" not coming into effect","<key-bindings><quit>"
"How to move multiple IPs to different lines","<regular-expression><substitute>"
"vim delete parenthesis","<cut-copy-paste>"
"Expand visual selection to inner curly braces","<visual-mode>"
"Start and attach to neovim in same python file","<neovim><vimscript-python>"
"Remapping home row keys hjkl when using repmo plugin","<key-bindings>"
"How to use the argument of a vimscript function in an inner python function?","<vimscript><vimscript-python>"
"How do you indent > < without leaving visual mode and losing your current selection?","<indentation><visual-mode>"
"Your tips to learn regexp","<regular-expression>"
"auto insert text when creating a new file","<autocompletion><snippets>"
"Map a command that accepts an argument","<command-line><key-bindings>"
"How I force [count]<C-x> to leave leading zeros?","<visual-block><number-formatting>"
"Is it possible to have vim show the list of available marks when using marks?","<cursor-motions><mark><previewing>"
"Vimscript - Invalid argument in function declaration","<vimscript>"
"Split window & Fuzzy finder path with Nerdtree","<plugin-nerdtree><plugin-ctrlp>"
"Colon remap not working for registers(?)","<key-bindings><command-line><register>"
"How to make vim search every time I add a new character to the search?","<search>"
"MiniBufExpl: List buffers by window","<buffers><vim-windows>"
"Shift+F8 changes letter case for 2 letters; how to unmap this?","<key-bindings>"
"How can I easily list the content of the registers before pasting?","<cut-copy-paste><register>"
"Difference between full and short command","<command-line>"
"How to add space around a symbol using vim?","<whitespace><alignment>"
"What prevents the cursor from moving to the first column on some help files?","<cursor-movement><help-system>"
"Print neovim api-info using python 3","<neovim><neovim-python-client>"
"Vim doesn't refresh screen when going fullscreen","<terminal>"
"How to map keystrokes to a command?","<key-bindings><command-line>"
"Syntax highlighting not working vim-polyglot","<macvim>"
"Split a line by non-letter characters","<regular-expression><substitute>"
"edit file without swap file within a vim session","<swap-file>"
"How do I keep custom cursor reset function from interfering with vim-template?","<cursor-movement><autocmd>"
"New lines are not continuing block comments, only in php","<vimrc><syntax-highlighting>"
"system function output with Chinese chars","<functions><encoding>"
"How to delete searched line and next","<search><cut-copy-paste><global-command>"
"Creating a list of files contained in a buffer","<external-command><filesystem>"
"How to pass current file name with a different path to the command line","<filesystem><multiple-files>"
"How can I securely restrict vim access to a single file?","<autocmd><neovim><linux><filesystem><security>"
"Leader shortcuts ignored","<vimrc>"
"Use [d with ruby functions","<include>"
"Neovim Airline Powerline Fonts won't work","<plugin-airline><font>"
"Concatenating continuation lines","<replace>"
"How to apply certain vim config only to .py files","<vimscript>"
"How to define an operator which is updating while it is taking input?","<vimscript>"
"Perform previous substitution for different selection with single keystroke","<substitute><visual-mode><replace>"
"How can I add line numbers to Vim?","<line-numbers>"
"How can I show relative line numbers?","<line-numbers>"
"How can I change the default indentation based on filetype?","<indentation><filetype>"
"How can I use the undofile?","<persistent-state><undo-redo>"
"Can I script Vim using Python?","<vimscript-python>"
"How can I generate a list of sequential numbers, one per line?","<line-numbers><text-generation>"
"Does any solution exist to use vim from touch screen?","<input-devices>"
"Can I use some file-tree selector which exists on graphical IDEs?","<filesystem>"
"How can I search for a string between certain line numbers?","<line-numbers><search>"
"Why can ci"" be outside of quoted area and ci( only works inside parentheses?","<cursor-motions><cursor-movement>"
"How do I reload my vimrc without leaving Vim?","<vimrc>"
"How can I add syntax highlighting to vim as I can do in gedit?","<syntax-highlighting>"
"How do I visually select the block of text I just pasted in Vim?","<cut-copy-paste><visual-mode>"
"What is Neovim? How is it different from Vim? And why should I care?","<neovim>"
"Is there a way to display folded parts as a tree?","<folding>"
"Is it possible to have vim auto-complete function names, variables, etc. when using it to program?","<autocompletion><ide>"
"How do I center the current line in the screen?","<scrolling>"
"Treat string literals as a different language","<syntax-highlighting>"
"How do I make Vim adapt to the current indenting style of the file I'm editing?","<indentation>"
"How can I prevent Vim from leaving too many files (like swap, backup, undo)?","<crash-recovery>"
"Setting up ++ft according to the file extension","<filetype>"
"How can a complete beginner learn Vim using just Vim itself?","<help-system>"
"Is it possible to split Vim window to view multiple files at once?","<split>"
"Autocorrect spelling mistakes","<spell-checking>"
"Is it possible to make Vim auto-save files?","<save><crash-recovery>"
"Can I open a new vim split from an existing buffer?","<split><buffers>"
"Applying settings to a directory tree only","<vimrc><filesystem>"
"How can I move the cursor to the top or bottom of the screen?","<cursor-movement>"
"How to get intelligent C++ auto-completion","<ide><autocompletion><filetype-c++>"
"How can I copy text to the system clipboard from Vim?","<cut-copy-paste><os-clipboard>"
"What is an effective way to learn vimscript?","<vimscript>"
"How do I deal with very long lines in text (500+ characters)?","<cursor-movement><large-documents>"
"Is there a way to count the number of occurrences of a word in a file?","<search><counting>"
"Undo a single iab abbreviation expansion","<abbreviations>"
"Show partially hidden wrapped lines","<wrapping>"
"How can I see the full path of the current file?","<statusline>"
"How can I restore the cursor position when opening a file?","<cursor-movement><sessions>"
"Overwrite current line with register?","<cut-copy-paste><register>"
"Are there any precautionary measures I can take for a beginner?","<undo-redo>"
"After pressing qq, the status line says ""recording"". How do I get out of this mode?","<macro>"
"How can I use Vim's spellcheck with ‘smart quotes’","<spell-checking>"
"How can I run a function or macro across a folder of files?","<macro><multiple-files>"
"How do I move vertically until reaching a non-whitespace character?","<indentation><cursor-movement>"
"Performing certain operations without clearing register","<cut-copy-paste><register>"
"Is it possible to use vim's clientserver functionality to keep settings synchronized?","<vimrc><clientserver>"
"Using % in languages without curly braces","<cursor-movement>"
"How can I safely undo changes that I may or may not have made?","<undo-redo>"
"How to comment out a set of lines which are selected in visual mode?","<visual-mode><comments>"
"What can happen if I accidentally paste into command mode? What should I do if I do this?","<cut-copy-paste><undo-redo>"
"How do I edit crontab files with Vim (I get the error: 'temp file must be edited in place')","<save><unix>"
"Restricting operations to a section of code","<search><cursor-motions><ide><substitute>"
"How can I open very large files with good performance?","<large-documents>"
"How can I get correct autocompletion for ambiguous file extensions?","<ide><syntax-highlighting><filetype>"
"How do you save the file that you're working on as a new file?","<save>"
"How do you use changes tree in vim","<undo-redo>"
"How can text be moved from one register to an arbitrary number of registers?","<cut-copy-paste><register>"
"Is it possible to do a reverse vimdiff","<vimdiff>"
"Remapping the menu key in Neovim-Qt","<key-bindings><neovim><microsoft-windows><neovim-qt>"
"Is it possible to enter visual mode without changing the last visual selection?","<visual-mode><mark>"
"pluging value to override vimrc","<vimrc><ftplugin>"
"welcome message hidden by ""exe"" in timer function","<vimrc><colorscheme><startup>"
"Shortcut for spell checking","<key-bindings><spell-checking>"
"Unicode in vimrc no longer displaying correctly","<vimrc><unicode>"
"How to stop Vim from sourcing a file halfway through?","<vimrc><vimscript>"
"How can I fold some lines on opening a buffer?","<autocmd><visual-mode><functions><folding>"
"NeoVim Not Using My ~/.config/nvim/init.vim File","<neovim>"
"How can I add text to the end of words on each line?","<insert-mode><visual-block><multiple-lines>"
"Can I remove all maps containing key?","<key-bindings><autocmd><leader><plugin-c.vim>"
"Is it possible to view a history of commands (per mode) executed in Vim?","<visual-mode><normal-mode><ex-mode><nvim>"
"Slow write/save speed for files on network","<save><file>"
"Yank visual selection with modifications in a terminal-buffer","<cut-copy-paste><terminal-buffer>"
"How to change this particular ""deep blue"" color that displays?","<vimrc><colorscheme>"
"How to preserve options in Vim sessions?","<sessions>"
"Installing vim8.2 with python3.8 : Python.h not found","<vim8><python>"
"Is there a motion to select the comment block under the cursor?","<cursor-motions><object-motions>"
"anyone know how to improve how filepaths are handled in vimwiki?","<plugin-vimwiki>"
"How does ft-c-omni work and how can I make it faster?","<autocompletion><filetype-c><ins-completion>"
"gVim wont open skeleton code when creating new file","<vimrc><gvim>"
"Using 'd%' to delete a bracket pair and its contents is now broken","<plugin-matchit>"
"Is it possible to make a substitution command that preserves the case of the matched pattern?","<substitute>"
"How to create mappings with a function?","<vimrc><vimscript>"
"Autosave in vim causing side effects","<vimrc>"
"How to exit insert mode if pressing escape merely types ""^[""?","<neovim><cut-copy-paste><escape>"
"How can I make Neovim actually delete something instead of copy?","<key-bindings><cut-copy-paste>"
"Can't search for strings within hidden files with fzf's Rg command in vim","<search><bash><plugin-fzf>"
"Unable to reset settings after running command that triggers bash script","<autocmd>"
"Nvim black border issue","<neovim><colorscheme><nvim>"
"How to run a single Python unittest.TestCase test in VIM?","<python>"
"Make an expr mapping dependent on the number of lines selected","<key-bindings>"
