title,tags
"Control (or respond to) Input Method on Mac OS?","<macos><input-methods>"
"align/spread file content in vertically split windows","<scrolling><alignment>"
"Down and . X times?","<repeated-commands>"
"Stay at matching search result after escape","<search>"
"Get same indentation behavior as opening a new line on an empty line","<indentation>"
"CSV.vim how to change the column separator?","<plugin-system>"
"How to escape @ in search replacement","<search><replace><escape>"
"How to remove every second column in Vim?","<filetype>"
"Can't hide quickfix before executing makeprg","<autocmd><quickfix><makeprg>"
"Ruby indentation: align multiline method chains on the leading dot?","<indentation><filetype-ruby>"
"ale linter + eslint: Jump to next error","<key-bindings><plugin-ale>"
"How to correctly indent when beginning a new line below the cursor ('o')?","<indentation><filetype>"
"Use quickfix for completion","<autocompletion>"
"return to buffer after exiting terminal, neovim","<neovim><terminal>"
"replacing urls and escaped urls","<regular-expression><substitute>"
"ruby syntax highlighting lost on long files","<syntax-highlighting><filetype-ruby>"
"How to add accent to letters in normal mode?","<key-bindings><normal-mode><replace>"
":hi TabLine ctermfg=Whatever not working on Windows","<tabbed-user-interface>"
"Version conflict between vi and vim","<macvim><version>"
"set formatprg dynamically based on textwidth?","<formatting><options>"
"Custom mapping for ex command -> still show typing in ex console","<key-bindings><split>"
"How to make linebreak play along with conceal","<line-breaks><conceal><plugin-vimwiki>"
"What is the meaining of '#' symbol in function name?","<vimscript>"
"E129 when calling the function by call()","<vimscript>"
"Syntax region only if at top of file","<syntax-highlighting>"
"Duplicate single char with the shortest keys combinations","<cut-copy-paste>"
"Problem copying form vim to system clipboard","<vimrc><cut-copy-paste>"
"How can I decide whether a file can be opened in VIm or not?","<vimrc><vimscript><fzf>"
"Lose hlsearch when using with vim-fuzzysearch","<vimscript><highlight>"
"How do I prevent Vim from showing my terminal when executing an external command?","<terminal><external-command>"
"Switching arrow key mappings for wildmenu tab completion","<key-bindings><command-line><wildmenu>"
"How to visually scroll one line at the time with long lines?","<neovim>"
"How to delete a character that is present between two specific characters from every line in VIM?","<vimrc><original-vim>"
"Ins-completion C-X C-F and the path variable","<insert-mode><path><ins-completion>"
"ctermbg and ctermfg are backwards or incorrect for certain highlighting groups","<terminal><colorscheme><statusline><color>"
"FileType autocommand not working in Neovim","<neovim><autocmd><neovim-qt>"
"Can I make left Alt act the same as shift key using key map?","<vimrc><key-bindings><keyboard-layout>"
"How to override ftplugin set commands in Neovim","<vimrc><neovim><autocmd><neovim-qt>"
"Set CoC nodejs path dynamically","<vimscript><plugin-coc>"
"gvim: List all options for guifont as text?","<gvim><font>"
"Where does gvim find font options for its `guifont` pick list?","<gvim><font><cygwin><x11>"
"How to close all tabs with windows and terminals so I can quit","<tabbed-user-interface>"
"how to get dictionary and thesaurus completion","<autocompletion>"
"explicitly call netrw function in binding","<key-bindings><netrw>"
"Can the vim spell checker be used non-interactively?","<spell-checking>"
"Calling vimgrep from a comand","<vimgrep>"
"Case insensitive conservative substitution","<search><substitute>"
"How to match as many as possible in group?","<regular-expression>"
"Are there comments in command-line mode?","<command-line><comments>"
"Machine-specific gvim customization file tree with otherwise minimal customization?","<gvim>"
"Yank multiple lines and paste at end of lines","<cut-copy-paste>"
"nowait doesn't seem to work","<key-bindings>"
"How to chain shell command with vim Ex command?","<shell>"
"How to indent the cursor to the indentation of the above line in insert mode?","<insert-mode><normal-mode>"
"vim-airline tabs don't work. resetting airline theme when switching tabs","<vimrc><plugin-airline>"
"Creating and destroying temporary files by vim","<vimscript><filesystem>"
"How to set if else for vim's ""set background = "" for light and dark colorschemes?","<vimrc><colorscheme>"
"ctags works but not for tagbar","<ctags><plugin-tagbar>"
"Quickfix go to next error of specific type","<quickfix><plugin-vim-latex>"
"Why can't I use a literal Tab as the {commands} for :normal?","<vimscript><tab-characters>"
"Vim opens an empty buffer when I try to open an existing file","<vimrc>"
"How to source a part of a file","<vimscript><visual-mode><register>"
"Trigger doesn't expand my keywords","<plugin-ultisnips>"
"In Vim, how to enable Meta in all keybindings?","<vimrc><key-bindings><iterm2>"
"Pass character-wise visual selection to an external command","<visual-mode><external-command><register>"
"Distinguish between the column number of cursor after and before the first character in a line","<vimscript>"
"Is it good to use Auto-pairs plugin in Vim?","<plugin-auto-pairs>"
"don't use scrolloff=5 for mouse clicks","<vimrc><scrolling><mouse>"
"Integrating autocomplete and snippets","<vimrc><key-bindings><vimscript><autocompletion><plugin-ultisnips>"
"Setting a list of tag files","<vimrc><tags>"
"Command to list all customizable color highlights","<syntax-highlighting>"
"What's the difference between ""qp and <c-r><c-r>q when you store a macro?","<macro><register>"
"How to find all scripts which modified a certain vim setting?","<options><startup><debugging>"
"softtabstop not working","<softtabstop>"
"How to ensure files are copied to VIMRUNTIMEDIR when building Vim 8.1 from source and specifying a prefix?","<linux><installing><linux-ubuntu>"
"search replace for 1 line","<substitute>"
"Why :source! read linefeed as <c-j>?","<souce-command>"
"How can I get a reading time estimate?","<word-processing>"
"How not to use <Space> as a hit-enter key in command output pager","<key-bindings>"
"how to make buffer bar longer, show the names of more buffers","<buffers><plugin-powerline><plugin-airline>"
"How to highlight unused Python imports in VIM","<syntax-highlighting><filetype-python>"
"Ex command to put value of variable into terminal emulator?","<terminal><variables><terminal-buffer><input-methods>"
"Equivalent of emacs `winner-undo` and `winner-redo`","<vim-windows><split>"
"Color name or number not recognized: ctermbg","<colorscheme>"
"Are there any built-in functions to search sorted list?","<vimscript><search><performance><list>"
"Change the backspace behavior in neovim","<vimscript>"
"Can you match unicode blocks by name in vim?","<regular-expression><search><unicode><escape>"
"How to display all buffer names in tabline?","<buffers><statusline>"
"How to search in all registers","<register>"
"Delete whitespace before and after word","<whitespace><plugin-vim-surround>"
"Modify Quickfix to ignore paths outside project","<quickfix>"
"How does :g/^$/,/./-j (reduce multiple blank lines to a single blank) work in vim?","<line-breaks><substitute>"
"How to replace only within visual selection?","<substitute><visual-mode>"
"Can relative number be changed so that current line is 1?","<line-numbers>"
"How do I get gvim to start maximised in Windows?","<gvim><microsoft-windows><window-management>"
"How to execute shell commands silently?","<external-command>"
"Can I replace Vim's syntax highlighting with my own script?","<syntax-highlighting>"
"Is it possible to have the output of a :! command in a split rather than the whole window?","<external-command><split><vim-windows>"
"Close all split files, except the one currently focused?","<command-line><split><vim-windows>"
"Can I jump to a function declaration or definition in a multiple C++ source files project?","<ide><filetype-c++><ctags>"
"Most efficient way to replace the entire buffer?","<cut-copy-paste><buffers><replace>"
"How can I get vim to stop putting comments in front of new lines?","<formatting><comments>"
"How can I get vim to not auto-wrap pasted text?","<vimrc><cut-copy-paste>"
"Automatically add a closing "" or ' when inserting one, but only if the cursor isn't inside a string already","<key-bindings><vimscript><delimiter-matching>"
"Regex to search double quoted strings on multiple lines","<regular-expression>"
"How do I jump to the location of my last edit?","<cursor-movement><command-history>"
"How do I debug my vimrc file?","<vimrc>"
"Apply normal mode command to regex matches","<regular-expression><substitute>"
"Is there a way to alias `:w'` to `:w`, to avoid creating files named '?","<command-line><save><key-bindings>"
"How do I make vim look in a set of directories for a file, if it doesn't exist in the current directory?","<filesystem><load>"
"Colorscheme's background not correct in terminal","<vimrc><terminal><colorscheme><x11>"
"How can I automatically execute normal mode keystrokes with a terminal command when opening Vim?","<invocation>"
"How do I parse URL's from the text","<regular-expression>"
"How do I copy and paste between two vim instances - shared clipboard?","<cut-copy-paste><command-line>"
"How can I work around the inability to save macros in ViEmu?","<vimrc><macro>"
"remove automatic '<,'> when hitting colon in visual mode","<key-bindings><vimscript><visual-mode>"
"How to enable dictionary autocompletion without spell option set","<autocompletion><spell-checking><dictionary>"
"How to delete a file from within a vimscript?","<macos><vimrc>"
"Manipulate content of background (non-current) buffers from vimscript","<buffers>"
"What are/could be the potential advantages of learning VimL or vim scripting language?","<vimscript>"
"How can I import output from linux commands into vim for editing?","<external-command>"
"How to remove a line and paste it at the beginning of a range","<cut-copy-paste><cursor-movement>"
"How can I use a string variables for filepath in vimscript map command?","<vimscript><variables>"
"What does `-` mean in command `ls -la | vim -`?","<terminal>"
"Replace capitalized letters in matching lines","<replace><multiple-lines>"
"make :terminal use the current pane","<terminal-buffer>"
"How to quickly edit vim variable content?","<variables>"
"How to unindent code blocks?","<indentation>"
"Trouble using <cword> in mapping","<vimrc><key-bindings><vimscript>"
"Why is this map added using <Plug> not showing up?","<key-bindings><neovim><gvim>"
"Add a block of text to end of lines","<visual-block>"
"Wrapping lines in a paragraph with header and footer lines","<cut-copy-paste>"
"Vim on Debian, configuration issues","<vimrc><linux-debian><default-settings>"
"Vi and Vim default to split left and split above. What is the history and motivation behind this?","<split><history-of>"
"combining the gq command","<key-bindings>"
"Neovim Gray Background","<terminal><colorscheme><iterm2>"
"Interactively check given string highlight group","<syntax-highlighting>"
"How to prevent Vim to collapse a fold with foldmethod=indent on a text paste?","<indentation><folding>"
"Better way to copy paste previous word using vim's default keyboard sequences?","<cut-copy-paste>"
"Visual mode toggle block commenting with vimrc command","<vimscript><functions>"
"How to see if Vim has a file opened or not, or has a buffer open","<buffers>"
"How to apply patch to a buffer in place?","<vimdiff>"
"Switch to viewport by name?","<vimscript><buffers>"
"How to paste columns vertically to columns with unequal number of characters","<cut-copy-paste>"
"Vundle load plugins while still in .vimrc","<vimrc><plugin-vundle>"
"How do I restore visual mode selection highlighting?","<syntax-highlighting><visual-mode><colorscheme><highlight>"
"Includes in vimrc?","<vimscript><vimrc><include>"
"Unmap netrw-c in vinegar.vim","<key-bindings><netrw><plugin-unimpaired>"
"Fastest way to delete part of word from end of word?","<cursor-movement><cursor-motions>"
"Get a vimdiff view of changes made by a patch / diff file","<vimdiff>"
"Output Vim display to Text","<vimscript>"
"How to prevent indent, unindent (>>, <<) from re-aligning text?","<indentation><whitespace>"
"How can I create a mapping only in ""plain"" visual mode?","<key-bindings><visual-mode>"
"Create a new line with indentation matching the cursor position","<indentation>"
"Why does this auto command to disable hlsearch not work?","<gvim><autocmd><highlight>"
"How would I modify this function to restore from a specified register?","<vimscript><cut-copy-paste><visual-mode><register>"
"how to use Netrw Directory Listing in VIM split window without exiting it when a file has been read","<split><netrw>"
"set noautoread for one function","<vimscript><vimrc>"
"Substitution using groups from regex works only on one group out of three","<regular-expression><substitute>"
"Diff more than 4 buffers at the same time","<vimdiff>"
"Replace using info from the replaced string","<regular-expression><replace>"
"How do I prevent the delay when mapping jj to <ESC> in insert mode?","<insert-mode><normal-mode><escape>"
"Best Practices for working with an indent-sensitive language?","<indentation>"
"Why do I get the ""tag stack empty"" error when using :ptag and other commands?","<tags><ctags>"
"How to filter discontinuous line sets through an external program (Is it possible to combine :g global command with :range! external program filter)?","<command-line><external-command><range>"
"How to trace the origin of an autocomplete feature, in order to turn it off?","<autocompletion><macvim>"
"How to change the location of a new vertical split?","<split>"
"Key binding for enter key in insert mode","<key-bindings><indentation><formatting>"
"Why does vim use hjkl for cursor keys?","<cursor-motions><history-of><keyboard-layout>"
"How can I format objects wrapped inside curly braces?","<formatting>"
"Fix indentation after a multiline HTML tag","<indentation><filetype-html>"
"How to remap <Plug>vimtex#delim#close()<CR>?","<key-bindings><vimrc><plugin-vimtex>"
"How to append <cr> to a register from a yank?","<cut-copy-paste><register>"
"indent command does not indent matched lines","<indentation><global-command>"
"Why cannot I source vimrc for the current file being editing?","<vimrc><load>"
"Unexpected substitution behavior","<substitute><string-manipulation>"
"Autosave and Nerdtree conflicts","<neovim><autocmd><save>"
"How can I keep my cursor normal after exiting a terminal buffer?","<terminal><microsoft-windows><terminal-buffer><cursor>"
"Pipe :Ag output to a new buffer","<regular-expression><buffers>"
"Can I define window position/contents via command line arguments ? Maybe a sort of parameterised session file?","<vim-windows><argument-list>"
"Efficient way of cleaning up the buffer list","<buffers>"
"vim-fetch install","<plugin-system><plugin-vim-fetch>"
"Why are there no rightabove / leftbelow commands?","<split>"
"How do I turn off specific listchars in my current file?","<vimrc><gvim>"
"Is there going to be a VimConf this year?","<untagged>"
"Ctags doesn't find tag existing in tag file","<ctags>"
"Grep for a pattern using current visual selection on another file","<cut-copy-paste><visual-mode>"
"How to open folds in a pedit-preview popup window?","<vimscript><popup-menu><previewwindow>"
"Can I remap y key in vim-surround plugin?","<key-bindings><plugin-vim-surround>"
"In Vim how can I compile my .tex file automatically after pressing ':w'?","<plugin-vim-latex>"
"Is there some way to retrieve/redisplay :echon output?","<highlight><color><echo><debugging><highlighting>"
"How to open a command in a split window?","<split><grep>"
"Where is the help function defined or located?","<functions><help-system>"
"Yank visually selected text: Keep virtualedit & avoid left/right padding","<visual-block>"
"gvim on ubuntu breaks the console when calling system command in vimrc","<vimrc><console>"
"Open file, make changes, save it as a new one. In one step, using the Windows command prompt","<microsoft-windows><invocation>"
"How can I make a new line in my _vimrc after using the normal i command?","<vimrc><vimscript><gvim>"
"Why does a range search "":[range]/pattern/action"" not work the same way as "":[range]g/pattern/action""?","<search><range>"
"Yank multiple lines without using visual mode","<cut-copy-paste><multiple-lines>"
"Neovim automatically run command when opening a filetype from ftplugin file","<neovim><ftplugin>"
"automatic popup in vim with clang_complete plugin","<filetype-c++><filetype-c>"
"Installed Ale linter using Pathogen, but none of the commands are working","<plugin-ale><plugin-pathogen>"
"How to use read instead of execute in a function?","<vimscript><grep>"
"How to replace everything between PORT= and )","<replace><multiple-lines>"
"Check if a specific window is open","<vimscript><vim-windows>"
"How to list open buffers simplified","<buffers>"
"How to put Shift+v in a function?","<vimscript>"
"0-length file from new :term buffer: vim -c ""w! file""","<save>"
"Set line number on chunks of file","<vimscript><line-numbers>"
"Word completion ^P / ^N is very slow because of scanning a :term buffer","<terminal-buffer><ins-completion>"
"Does vim 8 have some screensaver-like mechanism","<vim8>"
"Delete all consecutive duplicates","<substitute><macro><global-command>"
"vim doesn't print the header in hardcopy","<printing>"
"Vim lost custom highlight settings after recovering from sessions","<vimrc><gvim><colorscheme><highlight><sessions>"
"How to save text after deleting lines to a new file in Vim?","<command-line>"
"Match ""n"" or more words","<vimscript><regular-expression>"
"Autocomplete popup menu with autoindent and hard wrap in insert mode","<autocompletion><indentation><wrapping><plugin-you-complete-me>"
"How to temporarily make gq consider hyphen (-) a normal word, to not indent the following lines in the same paragraph","<indentation><formatting>"
"Is it possible to add a file to the argument list with in netrw?","<netrw><argument-list>"
"Vim does not take umlauts as word characters","<unicode>"
"Preserve creation time stamp after modification","<buffers><save>"
"What's the correct way to install YouComplete using vim-plug in vim/nvim?","<plugin-you-complete-me><plugin-vim-plug>"
"Syntax highlight single - quote parameter","<syntax-highlighting>"
"vimscript conditional based on grep on current buffer","<vimscript>"
"Enabling or installing blowfish2 capabilities on VIM 7.4.52","<installing><security>"
"Copy and pasting blocks of text anywhere","<cut-copy-paste>"
"Why does Vim load unrelated ftplugins?","<filetype><plugin-system><filetype-html><filetype-markdown>"
"Modeline folding not working on help file","<folding><help-system><modeline>"
"How to use 'filetype indent on', without it indenting while entering text in insert mode","<vimrc><indentation>"
"Can't get Jedi's autocompletion on SuperTab","<autocompletion><plugin-jedi-vim><plugin-supertab>"
"Syntax file: keywords within context","<syntax-highlighting><folding>"
"Converting .spl spell files","<spell-checking>"
"External command on unsaved buffer","<external-command>"
"How can I add everything under .vim directory into github?","<git>"
"Code syntax checking using highlighting","<syntax-highlighting>"
"Yanking and pasting while incrementing","<cut-copy-paste>"
"Why does gx call curl when the cursor is on a URL with trailing slash?","<buffers><external-command><netrw>"
"Is it possible and useful to split vimrc?","<vimrc><filetype>"
"ubuntu & haskell : problem with haskell-vim-now","<linux>"
"How to disable default emmet or sparkup behaviour","<plugin-emmet-vim>"
"Vim to highlight only a submatch","<syntax-highlighting><regular-expression>"
"Why <C-W> does not enter operator pending mode?","<key-bindings><vim-windows>"
"How to use Lua in Vim?","<macvim><vimscript-lua>"
"How to remap ctrl-backspace in normal and insert modes?","<key-bindings>"
"How can I get my tabs to spread to the width of my window?","<tabbed-user-interface>"
"Alternatives to ctags: are rtags, uctags or other alternatives better?","<tags><ctags><filetype-c++>"
"How can I return the current filetype's comment character in vimscript?","<vimrc><vimscript><comments><plugin-tabular>"
"Triggering automatic replacements of certain strings","<vimrc><unicode>"
"how to write command to save selected text?","<visual-mode><visual-block>"
"Automatic whitespace in python","<indentation><filetype-python>"
"Highlighting specific words automatically with different background","<vimrc><highlight>"
"is search a true mode in vim?","<search>"
"Using range as argument returns a comparison","<vimscript><functions><range>"
"Inconsistent <cword>, <C-R><C-W>, and keyword behavior","<filetype-ruby><vi-words>"
"Get a NERDtree'ish list of commonly edited files","<vimrc><vimscript>"
"How can I shift only inner contents of HTML element?","<indentation><filetype-html><object-motions>"
"How can I right-align end-of-line comments with the Tabular plugin?","<vimrc><plugin-system><alignment><plugin-tabular>"
"Open One File-type per Tab","<filetype><tabbed-user-interface>"
"Replace two word sequence with second word","<search><regular-expression><replace>"
"How to repeat last mapping/action?","<repeated-commands>"
"Exclude start and end match from region","<syntax-highlighting>"
"How to decrease markdown header level in visual mode without a plugin?","<visual-mode><filetype-markdown>"
"Is there a help plugin which can behave like guake for vim?","<vimrc><help-system>"
"Why does my colorscheme not look like it should?","<colorscheme>"
"Setting TAB to 2 spaces","<whitespace><tab-characters>"
"Is there a direct way to select the buffer displayed in a non-active window?","<key-bindings><buffers><vim-windows>"
"Autocmd event for `autoread`?","<autocmd><autoload>"
"Understanding ""\_W*"" in vim regex","<regular-expression>"
"Not able to copy from terminal when using vim from homebrew on macOS","<os-clipboard><macos>"
"How to get a variable with the contents of a file on the filesystem?","<search><register>"
"how to use the number returned by arglistid()","<argument-list>"
"keymap for open .vimrc, edit, save and reload","<vimrc><key-bindings>"
"Match any number of digits NOT followed by","<search><regular-expression><substitute>"
"Vi/Vim 8 on debian stretch : filetype ""bindzone"" not loaded automatically","<syntax-highlighting><filetype>"
"Listchar for Preceding Indentation Space","<vimrc><whitespace><listchars>"
"Split window size change event","<vimscript><autocmd><split>"
"Select upto a given delimeter across multiple lines","<gvim><macvim>"
"How to replace all buffer content by some string?","<vimscript>"
"How can I ensure Vim doesn't quit entirely when the last window is closed, unless it's empty?","<buffers><quit>"
"Positioning the terminal emulator cursor in Neovim","<neovim><terminal-buffer><cursor>"
"What vim setting determines the amount of indentation change by pressing > or < (greater than or less than)?","<indentation>"
"Is there a way to yank directly to a vimscript variable?","<vimscript>"
"Syntax highlight rule for a block comment using indentation","<vimscript><syntax-highlighting>"
"How to have two different makefile mapped to two different keys?","<key-bindings><makeprg><compile-vim>"
"How can I use a range as input for an external command without deleting it?","<external-command><range>"
"Can I debug marks being deleted?","<neovim><neovim-qt>"
"keystroke to move to end of whitespace","<key-bindings>"
"Move lines with tildes to a certain section of a file","<filetype-markdown><plugin-vimwiki>"
"Pretty python comments","<comments><filetype-python><plugin-nerdcommenter>"
"How do I download Vim-Plug?","<plugin-system>"
"Why does a custom 'contained' highlight match interfere with the C syntax highlighting?","<vimscript><syntax-highlighting>"
"Is there a nice way to programmatically call the file auto-detection algorithm?","<vimscript><filetype>"
"Paste a block in ""replace"" mode","<cut-copy-paste><visual-block>"
"newline in macro recording","<macro>"
"Space Error when typing Korean","<multibyte>"
"get current vim mode inside vimscript code","<vimscript><linux>"
"Keeping indent (like breakindent) when using hard wrap with textwidth","<indentation><wrapping>"
"Treating lines wrapped with `linebreak` as separate lines","<wrapping><line-breaks>"
"Problem remapping key bindings in command line mode","<vimrc><key-bindings><command-line>"
"Select first char up to first non camelCase or non upper case char or up to first snake case _ in vim","<regular-expression>"
"Exit visual selection mode with different shortcut / hotkey","<key-bindings>"
"Difficulty with regular expressions","<command-line>"
"Is it possible to apply substitutions on parts of lines, instead of whole lines?","<substitute>"
"Folding in VimWiki like in org mode?","<folding><plugin-vimwiki>"
"customising Termdebug commands","<terminal><debugging>"
"Edit NERDTree text using normal mode vim keybindings","<key-bindings><normal-mode><plugin-nerdtree>"
"modelines not executed when opening new file in new tab","<encoding><modeline>"
"Preventing an autocmd from overriding last cmd - :<bang><bang> (:!!)","<autocmd><repeated-commands>"
"Preview previously yanked text before put","<cut-copy-paste><register>"
"Abbreviations for local filtype buffers only","<autocmd><abbreviations>"
"Are there any performance difference between :edit and :buffer on existing unchanged buffer?","<buffers><performance><command>"
"How do I change the "":"" symbol in the minibuffer?","<command-line>"
"Why does current/shell directory change depending whether drive-letter is used in filename?","<microsoft-windows><shell>"
"Mapping (omap) to erase inside any of (), {}, [], <> or their embeddings","<key-bindings>"
"Show absolute and relative line numbers (not hybrid)","<line-numbers>"
